{
    "id": "c7a4762b555baf4b",
    "company": "exp",
    "positionName": "Lab Technician",
    "jobType": [],
    "location": "Ottawa, ON",
    "salary": null,
    "postingDateParsed": "2023-10-01T20:08:22.370Z",
    "url": "https://www.indeed.ca/rc/clk?jk=c7a4762b555baf4b&from=jasx&tk=1haqc0qipjku7800&vjs=3",
    "externalApplyLink": "https://ca.indeed.com/rc/clk?jk=c7a4762b555baf4b&atk=&xpse=SoCD67I3IDjALsQcxR0LbzkdCdPP",
    "job_info_group": {
        "extracted_phone_numbers": [],
        "extracted_links": [
            "HTTP/HTTPS Links",
            "General Links",
            "WWW Links",
            "TLDs"
        ],
        "extracted_emails": [],
        "extracted_location_data": [
            "Ottawa"
        ],
        "extracted_dates": [
            "Today",
            "2023",
            "1906",
            "year",
            "the end of 2023"
        ],
        "extracted_languages": [
            "English"
        ],
        "extracted_laws": [],
        "extracted_norps": [],
        "extracted_orgs": [
            "our next Lab Technician",
            "LI-AH1",
            "a Lab Technician"
        ],
        "extracted_persons": [],
        "extracted_products": [
            "EXP EXP",
            "EXP"
        ],
        "extracted_money": [],
        "processed_text": "lab Technician Contract exp drive provide innovative solution world's build natural environment . team engineer architect designer scientist creator community professional bring diverse talented people solve world's complex challenge . join team leverage difference harness entrepreneurial spirit employee company diversity strength seek sustainable result share ambition client community serve . staying connect global network professional big . . ready design future environment currently search join Earth Environment group . contract position possibility extension . store successful spend material laboratory complete construction material test . lab base position \u2013 process concrete cylinder conduct aggregate soil testing Interact lab field staff engineer . Skills Knowledge seek strong people skill wide variety staff client communicate verbally writing field formal report ideally concrete soil asphalt testing advantageous strong general math skill Diploma accredit Civil Technology program equivalent asset valid canadian driver's license access vehicle asset lift minimum 25kg story mission understand innovate partner deliver provide engineering architecture design consulting service world's build natural environment . heritage early EXP's predecessor company start engineering infrastructure practice . creative professional deliver extraordinary . passion enthusiasm diversity industry lead capability employee . committed provide challenging environment cultivate career growth encourage creativity reward excellence . find life exp visit ."
    },
    "companyDescription": "",
    "description": "Lab Technician (Contract until 2023) \n Ottawa, ON \n \n At EXP, we\u2019re driven to provide innovative solutions for the world\u2019s built and natural environments. As a team of engineers, architects, designers, scientists, creators and a community of professionals, we bring diverse and talented people together to solve the world\u2019s most complex challenges. Here, you join a team that leverages differences, harnesses their entrepreneurial spirit in an employee-owned company, that believes diversity is what gives us strength, seeks sustainable results and shares ambitions for each other, our clients and the communities we are part of and serve. To be a part of EXP means to have your own experience, while staying connected to a global network of professionals, who believe we are a part of something bigger. Together, we are EXP. \n Are you ready to design your future? \n Be our next Lab Technician ! \n \n Your work environment at EXP \n EXP is currently searching for a Lab Technician to join our Earth and Environment group. This is a contract position until the end of 2023 with a possibility of extension. \n \n What a day at EXP has in store for you \n The successful candidate will spend their time in the material laboratory completing construction materials tests. \n \n  Lab based position \u2013 process concrete cylinders, conduct aggregate and soil testing Interact with other lab & field staff, engineers, etc. \n \n \n The Skills, Knowledge and Abilities We Seek \n \n  Must have strong people skills, and ability to work with wide variety of staff and clients \n  Must be able to communicate (verbally/writing) in English for field and formal reports \n  Ideally concrete/soils/asphalt testing experience would be advantageous \n  Strong general math skills \n  Diploma from an accredited Civil Technology program or equivalent would be an asset \n  Must have a valid Canadian driver\u2019s license (Having access to a vehicle is an asset) Able to lift a minimum of 25kg \n \n \n #LI-AH1\n \n\n\n Our story   With a mission to understand, innovate, partner and deliver, EXP provides engineering, architecture, design and consulting services to the world\u2019s built and natural environments. \n Our heritage dates back to 1906, when the earliest of EXP\u2019s predecessor companies started its engineering infrastructure practice. Today, thousands of creative professionals across EXP work together to deliver extraordinary experiences year after year. \n What makes us different \n The passion, enthusiasm, diversity and industry-leading capabilities of our employees make us who we are. We\u2019re committed to providing a challenging work environment that cultivates career growth, encourages creativity and rewards excellence. \n Find out more about life at EXP by visiting www.exp.com ."
}