{
    "id": "f54849fe83872965",
    "company": "Recognia Inc.",
    "positionName": "Accounting Administrator",
    "jobType": [],
    "location": "Recognia Inc. in Kanata, ON",
    "salary": null,
    "postingDateParsed": "2024-01-17T05:13:35.420Z",
    "url": "https://www.indeed.ca/rc/clk?jk=f54849fe83872965&from=jasx&tk=1hkikipjiii32800&bb=g3LG73kDIG2DKbipZ3VbGB-ka5Uf7wrx2WGKZCevUu-cDVK98WGXapv4b1Hthig9D18hIFh8pj8e23_lh9-gu5PTpnMlM-7d0FDShqrVe2mrCNDscKPTaQ%3D%3D&xkcb=SoDe67M3FShE7dQ2y50CbzkdCdPP&vjs=3",
    "externalApplyLink": null,
    "job_info_group": {
        "extracted_phone_numbers": [],
        "extracted_links": [
            "HTTP/HTTPS Links",
            "General Links",
            "WWW Links",
            "TLDs"
        ],
        "extracted_emails": [],
        "extracted_location_data": [
            "Kanata",
            "Ottawa"
        ],
        "extracted_dates": [
            "3 days per week",
            "3 years"
        ],
        "extracted_languages": [],
        "extracted_laws": [],
        "extracted_norps": [],
        "extracted_orgs": [
            "its parent company Component Communication Inc. Products",
            "CCI",
            "American Express bills Assist",
            "Communication Components Inc.",
            ", ON Responsibilities: Accounts Payable Account",
            "CCI Products"
        ],
        "extracted_persons": [
            "Adhoc"
        ],
        "extracted_products": [],
        "extracted_money": [
            {
                "amount": "23.00-$26.00",
                "noun_phrases": []
            }
        ],
        "processed_text": "position title Accounting Administrator \u2013 office . possibility depend load . location bank reconciliation reporting require reception duty filing data entry invoice receipt processing expense report execution ad hoc project relate process improvement support CCAI team Skills Education Requirements minimum \u2013 accounting environment QuickBooks desktop enterprise solution consider asset multi currency multi entity environment consider MS excel multitask maintain focus priority good organizational documentation skill independently initiative excellent communication skill CCI Antennas CCAI antenna design center . ccai design assemble test cellular base station antenna prototype laboratory . fast grow provider base station enhancement product . innovative product design allow service provider base station investment . capacity expansion coverage enhancement objective appropriate solution meet . field prove solution deployment PCS Cellular SMR environment bring expertise technology reliability . CCI's capacity expansion product allow basestation grow radio count add feeder antenna loss coverage . create turn key solution design assistance site commissioning . . applicant interest select interview contact . require accommodation stage recruitment process indicate application . type salary hour week schedule shift Commute require location person"
    },
    "companyDescription": "",
    "description": "Position Title:  Accounting Administrator\n3 days per week \u2013 In office. With the possibility of full-time depending on work load.\nLocation:\nOttawa, ON\nResponsibilities:\n\n Accounts Payable\n Account and bank reconciliations\n Adhoc reporting as required\n Reception duties\n Filing\n Data entry for invoices and receipts\n Processing expense reports and American Express bills\n Assist with execution of ad-hoc projects related to process improvements to support the CCAI team\n\nSkills, Experience and Education Requirements:\n\n Minimum 2 \u2013 3 years in accounting environment\n QuickBooks desktop enterprise solutions would be considered an asset\n Experience working in a multi-currency and multi-entity environment would be considered a plus\n Experience with MS excel\n Ability to multitask and maintain focus on priorities is a must\n Good organizational and documentation skills\n You are able to work independently and you know how to take initiative\n Excellent communication skills\n\nCCI Antennas (CCAI) is an antenna design center for its parent company Component Communication Inc. Products (CCI Products). CCAI designs, assembles and tests cellular base station antenna prototypes in its laboratory in Ottawa.\nCommunication Components Inc. is one of the fastest growing providers of base station enhancement products. Our innovative products are designed to allow service providers to get the most out of their base station investments. Whether capacity expansion or coverage enhancement is the objective, CCI has the appropriate solution to meet the need. With thousands of field-proven solutions in deployment, in PCS, Cellular and SMR environments, CCI brings expertise, technology, and reliability. CCI's capacity expansion products will allow a basestation to grow radio count without adding feeders and antennas, and with no loss of coverage. CCI creates turn-key solution from design assistance to site commissioning. www.cciproducts.com.\nWe thank all applicants for their interest however only those selected for an interview will be contacted. If you require accommodation during any stage of the recruitment process, please indicate this in your application.\nJob Type: Part-time\nSalary: $23.00-$26.00 per hour\nExpected hours: 22.5 per week\nSchedule:\n\n Day shift\n\nAbility to Commute:\n\n Kanata, ON K2K 2T8 (required)\n\nWork Location: In person"
}