{
    "id": "1abbd32f574f52be",
    "company": "Docebo",
    "positionName": "Technical Deployment Manager",
    "jobType": [],
    "location": "Ottawa, ON",
    "salary": null,
    "postingDateParsed": "2024-01-20T05:09:27.980Z",
    "url": "https://www.indeed.ca/rc/clk?jk=1abbd32f574f52be&from=jasx&tk=1hkikb4a7k5qp800&bb=lTPy9GC8AEMesPUlCsHFKts9Qucc2TZK4uNb54iUWZJ0rDb_z4Fj-87AWNzMZbTcrSbjoqBTMKsGhG1lhe0CK2UIBjIk4F-nnnzvGtY0i48EKCE4XC-vZQ%3D%3D&xkcb=SoDK67M3FSgjV4x1FB0KbzkdCdPP&vjs=3",
    "externalApplyLink": "https://jobs.lever.co/docebo/20a83de1-e22d-4828-8445-2bea1c201e01?lever-source=Indeed&lever-source=Indeed",
    "job_info_group": {
        "extracted_phone_numbers": [],
        "extracted_links": [
            "HTTP/HTTPS Links",
            "General Links",
            "WWW Links",
            "TLDs"
        ],
        "extracted_emails": [],
        "extracted_location_data": [
            "the Docebo Platform",
            "North America"
        ],
        "extracted_dates": [
            "today",
            "3 years"
        ],
        "extracted_languages": [],
        "extracted_laws": [],
        "extracted_norps": [
            "Docebians",
            "800+ global Docebians"
        ],
        "extracted_orgs": [
            "Docebo",
            "Togetherness",
            "Customer Success Teams",
            "Amazon Web Services",
            "TSX: DCBO & NASDAQ",
            "Curiosity",
            "Salesforce",
            "L'Oreal",
            "cloud-based Learning Management System",
            "an experienced Technical Deployment Manager",
            "APAC",
            "BA/BS",
            "EMEA",
            "the Customer Success, Sales Engineering",
            "Netflix",
            "Sales Engineering",
            "Success Criteria Develop",
            "Technical Trainer",
            "Professional Services",
            "our Professional Services Team",
            "the Docebo Heart"
        ],
        "extracted_persons": [
            "Opentable",
            "Docebo"
        ],
        "extracted_products": [],
        "extracted_money": [],
        "processed_text": "hey \\ud83d\\udc4b fast grow saas company \\uD83D\\uDCC8 build generation learn software company rely deliver training \\uD83D\\uDCBB learn learn . rely continuously innovate product process create exceptional employee customer partner . culture center . embody . trust teammate assume good hold space difference . \\uD83D\\uDC99 wait apply join change people learn . ready learn revolution \\uD83D\\uDE80 industry leader join grow organization . hybrid role provide technical expertise project manage directly manage small number customer onboarding service migration consult hour custom scope . role responsible provide technical consulting service Docebo client base include configuration troubleshooting Docebo add module Application Programming Interface usage workflow guidance technical assistance Single Sign application . Technical Deployment Manager customer understand customer prepare documentation provide guidance technical flow involve . individual role closely . responsibility scope Application Programming Interface define workflow utilize Docebofs api order enable Docebo customer scope initiate development effort document project activity ensure alignment continuity Professional Services department . lend assistance configuration troubleshooting Docebo integration product add ons include Single Sign web Conferencing tool . produce improve technical documentation ensure alignment personal Docebo client Prevent identify quantify communicate risk internally externally Partner customer country manage multiple project concurrently . customer identify document monitor implementation schedule include functional customization integration technical project meet client objective manage ongoing implementation project documentation ensure project team stay utilization budget target maintain exist creation good practice support documentation ensure successful onboarding customer Requirements minimum technical role Sales Engineer Implementation Support . large account enterprise space good understanding consulting process software implementation natural inclination resolve customer problem help highly successful extensive knowledge SAML Single Sign Protocols rest apis familiarity Hypertext Transfer Protocol client testing web service basic code language Fast learner excited learn technology ongoing basis write effective technical documentation English Fluency write speak strong desire Docebo product expert equivalent travel require nice Haves Learning Learning Management industry build Structured Query language query multilingual Hybrid Benefits Perks \\ud83d\\ude0d Generous Vacation Policy extra float holiday religious cultural event matter Employee Share Purchase Plan career progression internal mobility employee resource group involve Docebo Women's Alliance PRIDE BIDOC Green Ambassadors WeWork partnership program Hybrid Office Model \\uD83C\\uDFE2 people develop deep relationship accelerate innovation . Docebo employee worldwide hybrid . encourage person collaboration support employee dedicated focus allow good . team leader decide team office consider team employee's . Talent Acquisition team role apply hybrid detail interview . Docebo \\ud83d\\udc99 power learn customer easy Artificial Intelligence power Suite design close enterprise learn loop . achieve IPOs DCBO recognize saas learning solution grow exponentially process . global company office . people core simply define manifest Innovation simplicity Accountability Impact . sound join fast grow learn technology company market . apply Equal Employment employer . committed diversity inclusion workforce . qualified applicant employee receive consideration employment race color religion sex include pregnancy gender identity sexual orientation national origin citizenship status age genetic information category protect applicable law . individual require reasonable accommodation assist search application employment send mail recruiting_accommodation . mail include description requested accommodation position apply interested ."
    },
    "companyDescription": "",
    "description": "Hey you! \\uD83D\\uDC4B Want to work for one of the fastest growing SaaS companies in the world? \\uD83D\\uDCC8\n \n \n   We\u2019re building the next generation of learning software that companies like AWS, Netflix, Opentable and L\u2019Oreal rely on to deliver training \\uD83D\\uDCBB We believe learning is for everyone, and that we all have something we can learn from each other. We rely on one another to continuously innovate our products and processes to create an exceptional experience for our employees, customers and partners.\n \n \n \n   Still not sure? We are a culture where values are at the center of everything we do. We also embody what we call the \n  Docebo Heart. We trust our teammates, assume the best of one another, and also hold space for all the differences that make us better. \\uD83D\\uDC99\n \n \n \n   So what are you waiting for? Apply today! Join 800+ global Docebians and change the way people learn.\n \n \n \n   Are you ready to be a part of the learning revolution? \\uD83D\\uDE80\n \n \n \n   About This Opportunity:\n \n \n \n   Docebo, the industry leader in cloud-based LMS, is looking for an experienced Technical Deployment Manager to join our growing organization. This is a hybrid role within our Professional Services Team and will provide technical expertise across projects managed by other members of our Professional Services Team while also directly managing a small number of customer onboardings and other services such as migrations, consulting hours and custom scope. The role is responsible for providing technical consulting services to the Docebo client-base, including configuration and troubleshooting of Docebo add-on modules, API usage and workflow guidance, and technical assistance for Single Sign-on applications.\n \n \n \n   The Technical Deployment Manager will also work with customers to understand customer needs, and prepare documentation or provide guidance on technical work flows involving the Docebo Platform. An individual in this role will work closely with Sales Engineering, Professional Services, and Customer Success Teams.\n  \n Responsibilities:\n \n   Scope API needs and define workflows utilizing Docebo\u2019s APIs in order to enable Docebo customers to scope and initiate development effort\n   Document project activities to ensure alignment and continuity across the Customer\n   Success, Sales Engineering, and Professional Services departments.\n   Lend assistance in the configuration and troubleshooting of Docebo integrations and product Add-ons (including Salesforce, Single Sign-on, Web Conferencing tools, etc).\n   Produce or improve technical documentation to ensure alignment of Docebo personal and Docebo clients\n   Prevent, identify, quantify, and communicate risks internally and externally\n   Partner with customers from various countries, managing multiple projects concurrently.\n   Work with customers to identify and document Success Criteria\n   Develop/monitor overall implementation schedule (including all functional, customization and integration/technical projects) to meet client objectives\n   Manage ongoing implementation, project documentation, and ensure projects and teams stay within utilization and budget targets\n   Maintain existing and creation of new best practices and other supporting documentation ensuring successful onboarding of customers\n \n  Requirements:\n \n   Minimum of 3 years of experience in a technical role: Sales Engineer, Technical Trainer, Implementation, Support, etc.\n   Experience working with large accounts in the enterprise space\n   Good understanding of consulting processes and software implementation\n   A natural inclination to resolve customer problems and help them be highly successful\n   Extensive knowledge of SAML and other Single Sign on Protocols\n   Experience working with Rest APIs\n   Familiarity with HTTP clients such as Postman for testing web services\n   Basic coding ability in at least one language\n   Fast learner, excited and willing to learn new technology on an ongoing basis\n   Ability to write effective technical documentation\n   English Fluency (both written and spoken)\n   A strong desire to become a Docebo product expert\n   BA/BS or equivalent experience\n   Ability to travel as required (10% or less)\n \n  Nice to Haves: \n \n  Experience in E-Learning / Learning Management industry\n   Experience building SQL queries\n   Multilingual\n \n \n   #LI-Hybrid\n \n \n \n   Benefits & Perks \\uD83D\\uDE0D\n \n \n  Generous Vacation Policy, plus 2 extra floating holidays to use for religious or cultural events that matter to you\n  Employee Share Purchase Plan\n  Career progression/internal mobility opportunities\n  Four employee resource groups to get involved with (the Docebo Women's Alliance, PRIDE, BIDOC, and Green Ambassadors)\n  WeWork partnership and \u201cWork from Anywhere\u201d program\n \n \n \n   Hybrid Office Model \\uD83C\\uDFE2\n \n \n   We believe when people are together, they develop deeper relationships and accelerate innovation. Because of this, all Docebo employees worldwide are \u201chybrid.\u201d We encourage in-person collaboration while supporting work-from-home when employees need dedicated focus time, allowing Docebians to do their best every day. Each team leader is able to decide how often their teams come into the office, considering the needs of the team and the employee\u2019s needs. Our Talent Acquisition team will let you know about the role you are applying for and the hybrid details during the first interview.\n   \n \n \n  \n \n  About Docebo \\uD83D\\uDC99\n \n \n   Here at Docebo, we power learning experiences for over 3000 customers around the world with our easy-to-use, AI-powered Suite designed to close the enterprise learning loop. We have successfully achieved 2 IPOs (TSX: DCBO & NASDAQ: DCBO), been recognized as a Top SaaS e-learning Solution, and are growing exponentially in the process.\n \n \n   Docebo is a global company with offices in North America, EMEA, APAC and more. Our people believe in six core values, simply defined and manifested in everything we do - \n  Innovation, Simplicity, Accountability, Togetherness, Curiosity, and Impact. If this sounds like you, now is your time to join one of the fastest-growing learning technology companies on the market. Apply today!\n \n \n \n   Docebo is an Equal Employment Opportunity employer. We are committed to diversity and inclusion in our workforce. All qualified applicants and employees will receive consideration for employment regardless of their race, color, religion, sex (including pregnancy, gender identity, and sexual orientation), national origin, citizenship status, age, disability, genetic information, or any other category protected under applicable law.\n \n \n \n   Any individuals requiring a reasonable accommodation to assist with their job search or application for employment should send an e-mail to recruiting_accommodations (at) docebo.com. The e-mail should include a description of the requested accommodation and the position you\u2019re applying for or interested in."
}