{
    "id": "e771f046b2a9cb0d",
    "company": "L3Harris Technologies",
    "positionName": "Aircraft Maintenance Engineer (AME) - Mechanical (M2)",
    "jobType": null,
    "location": "Ottawa, ON",
    "salary": null,
    "postingDateParsed": "2024-01-05T03:13:14.821Z",
    "url": "https://www.indeed.ca/rc/clk?jk=e771f046b2a9cb0d&from=jasx&tk=1hjm3b4amipag801&vjs=3",
    "externalApplyLink": "https://ca.indeed.com/applystart?jk=e771f046b2a9cb0d&from=vj&pos=top&mvj=0&spon=0&sjdu=o7sfz71MPdMgyiV0LZq0d4DDplm6SwWjHcxyoDIphKnnRfYloqBSRF8jHYVxnKoC33N_wN23GpaSO0lj-AzAh1zMJm3oG813kzGSrf7f84GuA-tnUYwb7daZQ-2p1vvdDLW5pg5teFeWtrNtsE1j3QbzP1anskQTJF38EjDp81pKHmClsVR25rK01LTq7Z2Sw9_XINGINv7OnqX9-Wv1cg&vjfrom=serp&log=1&astse=5abaad23bc078630&assa=4446",
    "job_info_group": {
        "extracted_phone_numbers": [],
        "extracted_links": [
            "HTTP/HTTPS Links",
            "General Links",
            "WWW Links",
            "TLDs"
        ],
        "extracted_emails": [],
        "extracted_location_data": [],
        "extracted_dates": [
            "Familiarisation"
        ],
        "extracted_languages": [],
        "extracted_laws": [],
        "extracted_norps": [],
        "extracted_orgs": [
            "the Controlled Goods Program",
            "the MPM",
            "the Safety Management System Program Committee on Aircraft",
            "L3 MAS Policies and Processes",
            "L3Harris Technologies, Inc.",
            "the AMO",
            "the Aircraft Maintenance Engineer",
            "its Quality Program",
            "MAS",
            "a Aircraft Maintenance Engineer",
            "Environmental Control; Electrical System",
            "Service Difficulties"
        ],
        "extracted_persons": [],
        "extracted_products": [
            "Flight Control System"
        ],
        "extracted_money": [
            {
                "amount": "approximately $18 billion",
                "noun_phrases": []
            }
        ],
        "processed_text": "l3harris subsidiary agile innovative aerospace defense technology company . employee provide complete military commercial aviation modernization upgrade solution structural avionic upgrade aircraft component repair overhaul integrate logistic support stripping painting field service support technical publication range technical support service . specialized aviation facility include component repair overhaul machining aircraft hangar upgrade facility structural design analysis scale fatigue testing aircraft fatigue management engineering service mechanical engineering avionic electronic system engineering . customer perform world's challenging . trust prepared . combine speed innovation flawless execution ensure confidence security ahead . Challenge AME Mechanical M2 reporting Operations Supervisor AME M2 perform ready sign Maintenance Release . employee holder Transport AME license appropriately rate . AME demonstrate acceptable level knowledge issue ACA Authorization sign maintenance release respect perform aeronautical product . duty include limited performance include certification approve process . report airworthy condition discover include . utilize certify calibrate standard measuring test equipment . Familiarization . marshal fuel towing aircraft . maintain clean area assume responsibility indicate signature stamp perform duty repair modification maintenance aircraft approve maintenance procedure report airworthy condition discover process participate request . qualification hold AME license qualification heavy aircraft follow area Engine Airframe interface Hydraulic System Fuel System . Eligibility Criteria eligible registration eligible maintain government Reliability status Level secret security clearance . culture l3harris cultivate inclusive stimulate environment empower employee promote life balance . integrity respect excellence community dedication commitment excel foundation culture . Equal Employer committed treat employee applicant employment respect dignity maintain workplace free unlawful discrimination . applicant consider employment regard race color religion age national origin ancestry ethnicity gender include pregnancy childbirth breastfeeding relate medical condition gender identity gender expression sexual orientation marital status veteran status genetic information citizenship status characteristic membership group protect federal provincial local law . L3Harris maintain drug free workplace perform pre employment substance abuse testing background check permit law . l3harris technology agile global aerospace defense technology innovator deliver solution meet customer' mission critical . company provide advanced defense commercial technology air land sea space cyber domain . L3Harris annual revenue employee customer country . direct impact protection security human life . applicant interest select interview contact ."
    },
    "companyDescription": "",
    "description": "L3Harris MAS, a subsidiary of L3Harris Technologies, Inc., is an agile and innovative aerospace and defense technology company. Our 1000 employees provide complete military and commercial aviation modernization and upgrade solutions structural and avionics upgrades, aircraft component repair and overhaul, integrated logistics support, stripping and painting, field service support and technical publications, plus a full range of technical support services.\n \n  Our specialized aviation facilities include component repair, overhaul and machining, aircraft hangars and other upgrade facilities, structural design and analysis, full-scale fatigue testing and aircraft fatigue management, as well as other engineering services - from mechanical engineering and avionics to electronics and systems engineering.\n \n  Our customers perform on the world\u2019s most challenging front lines. They trust us to keep them prepared for what\u2019s next. We combine speed, innovation and flawless execution to ensure confidence and security in the world ahead.\n \n  About your next Challenge as a Aircraft Maintenance Engineer (AME) - Mechanical (M2):\n  Reporting to the Operations Supervisor the Aircraft Maintenance Engineer (AME M2) will perform work and be ready to sign a Maintenance Release for their work. The employee shall be the holder of a Transport Canada AME license, appropriately rated. The AME shall have demonstrated acceptable levels of knowledge of the AMO and its Quality Program and have been issued an ACA Authorization to sign a maintenance release in respect to work performed on aeronautical products. Their duties include but are not limited to:\n \n   Performance of work, up to and including certification with approved processes.\n   Reporting any un-airworthy conditions discovered (including Service Difficulties).\n   Utilizing certified/calibrated standard measuring and test equipment.\n   Familiarization with L3 MAS Policies and Processes.\n   Marshalling, fueling and towing of aircraft.\n   Maintaining a clean work area\n   Assuming responsibility for his work as indicated by his signature/stamp;\n   Performing duties such as repair, modification and maintenance of aircraft in accordance with approved maintenance procedures;\n   Reporting any un-airworthy conditions discovered;\n   Familiarisation of the MPM and related processes;\n   Participating in the Safety Management System Program Committee on Aircraft, if requested.\n \n \n  Qualifications:\n \n   You must hold an AME M license and have qualifications on heavy aircraft in the following areas:\n   \n     Engine/Airframe interface;\n     Environmental Control;\n     Electrical System;\n     Hydraulic System;\n     Fuel System;\n     Flight Control System.\n   \n \n \n  Eligibility Criteria:\n \n   Must be eligible for registration with the Controlled Goods Program;\n   Must be eligible to obtain and maintain a government of Canada \u201cReliability\u201d status and Level 2 (Secret) security clearance.\n \n \n  Our culture:\n  L3Harris MAS cultivates an inclusive and stimulating work environment that empowers employees and promotes work-life balance. Our values (integrity, respect, excellence), community dedication and commitment to excel in everything we do are the foundation of our culture.\n \n  We are proud to be an Equal Opportunity Employer and are committed to treating all employees and applicants for employment with respect and dignity and maintaining a workplace that is free from unlawful discrimination. All applicants will be considered for employment without regard to race, color, religion, age, national origin, ancestry, ethnicity, gender (including pregnancy, childbirth, breastfeeding or other related medical conditions), gender identity, gender expression, sexual orientation, marital status, veteran status, disability, genetic information, citizenship status, characteristic or membership in any other group protected by federal, provincial or local laws. L3Harris maintains a drug-free workplace and performs pre-employment substance abuse testing and background checks, where permitted by law.\n \n  About L3Harris:\n  L3Harris Technologies is an agile global aerospace and defense technology innovator, delivering end-to-end solutions that meet customers\u2019 mission-critical needs. The company provides advanced defense and commercial technologies across air, land, sea, space and cyber domains. L3Harris has approximately $18 billion in annual revenue, 48,000 employees and customers in more than 100 countries. L3Harris.com\n \n  Everything we do here has a direct impact on the protection and security of human lives.\n \n  We thank all applicants for their interest but only those selected for an interview will be contacted."
}