{
    "id": "c01fd5b4266bd4fc",
    "company": "Canadian Food Inspection Agency",
    "positionName": "Veterinary Anatomic Pathologist - AMENDMENT",
    "jobType": [],
    "location": "Ottawa, ON",
    "salary": null,
    "postingDateParsed": "2023-10-01T20:09:51.743Z",
    "url": "https://www.indeed.ca/rc/clk?jk=c01fd5b4266bd4fc&from=jasx&tk=1he3lmb38joqj800&vjs=3",
    "externalApplyLink": "https://ca.indeed.com/rc/clk?jk=c01fd5b4266bd4fc&atk=&xpse=SoDB67I3IDjVM8yRbJ0LbzkdCdPP",
    "job_info_group": {
        "extracted_phone_numbers": [
            "13056709913",
            "1340676915",
            "1305671848",
            "13056718483",
            "12998591428",
            "1299859095",
            "13037685444",
            "1303768471",
            "1305670991",
            "1340679107",
            "13037684711",
            "12998590950",
            "13406791071",
            "1303768544",
            "1299859142",
            "13406769153"
        ],
        "extracted_links": [
            "HTTP/HTTPS Links",
            "General Links",
            "WWW Links",
            "TLDs"
        ],
        "extracted_emails": [],
        "extracted_location_data": [
            "Ontario",
            "Canada"
        ],
        "extracted_dates": [
            "the past five",
            "a later date",
            "3 November 2023 - 23:59",
            "at least two years",
            "at least three years",
            "December 05, 2021 - 23:59",
            "six months",
            "the last five (5) years",
            "years"
        ],
        "extracted_languages": [],
        "extracted_laws": [
            "the CFIA Code of Conduct"
        ],
        "extracted_norps": [
            "the Canadians"
        ],
        "extracted_orgs": [
            "the National Examining Board (NEB",
            "Pacific Time Who",
            "the Canadian Veterinary Medical Association",
            "the European College of Veterinary",
            "The CFIA",
            "the National Examining Board",
            "Pacific Time",
            "the American College of Veterinary",
            "B & C",
            "CFIA",
            "CVMA",
            "the CVMA",
            "The Canadian Food Inspection Agency",
            "TSE",
            "AEd2 Diplomate",
            "the Public Service Employment Act",
            "the Values and Ethics Code for the Public Sector",
            "Canadian Food Inspection Agency - Science Branch Ottawa",
            "a Certificate of Qualification",
            "the Government of Canada",
            "the Ottawa Animal Health Laboratory",
            "Policy on COVID-19 Vaccination",
            "the CFIA",
            "COVID-19 VACCINATION",
            "Veterinary Medicine",
            "Post-Employment Policy",
            "OAHL"
        ],
        "extracted_persons": [],
        "extracted_products": [],
        "extracted_money": [
            {
                "amount": "VM-04 $113,150 to $",
                "noun_phrases": []
            },
            {
                "amount": "134,058",
                "noun_phrases": []
            }
        ],
        "processed_text": "incumbent laboratory . information organization visit Canadian Food Inspection Agency closing apply person reside canadian citizen reside abroad . apply online message committed provide inclusive barrier free environment start hiring process . accommodate phase evaluation process contact information request specialized accommodation . information receive relation accommodation confidential . assessment accommodation apply selection process apply specific inventory future vacancy . submit application inventory refer . currently staff . applicant interested apply consider round assessment . advise suspend . poster amend remove reference mandatory message Conditions employment . separate employer subject . consider application individual legal status preference canadian citizen . accept application receive GC Jobs website submit application click apply online advertisement . person unable apply online contact information prior closing request specialized accommodation . duty mandate offer diagnostic research service field veterinary transmissible spongiform encephalopathy bacterial disease chiefly regulate . list notifiable disease list notifiable disease report directly OAHL Director position responsible provide diagnostic pathology service disease high priority pathology support meat inspection forensic pathology service animal welfare . Bovine tuberculosis scrapie chronic waste disease main priority anatomic pathology . lead technical team incumbent ensure compliance ISO certification manage asset human financial resource . pathologist provide advice internal external cfia client contributor senior management . incumbent play role research project provide pathology service advice project lead collaborator . pathologist formulate recommendation client senior management international stakeholder animal disease prevention control laboratory diagnosis sample collection . incumbent laboratory . environment offer science base environment excellent benefit advancement emphasis learning development high level employee satisfaction . join workforce diverse people serve . find great reason join website reasons join eng intent process intent inventory draw vacancy current future . application accept ongoing basis long poster active . inventory staff position qualification language requirement condition employment tenure include term appointment indeterminate appointment appointment assignment . inventory staff position vm group level . position fill information provide resume . order consider application explain meet essential qualification meet essential qualification order appoint position . qualification decide factor choose person appoint . essential qualification assess application . responsibility provide appropriate example illustrate meet qualification . fail result application reject . ESSENTIAL education EEd1 Graduation recognize school define graduation veterinary school accredit approve graduation veterinary school hold Parts grant . eed2 Post graduate degree position relate field provide eligibility board certification Pathologists Pathologists . applicant submit education credential canadian institution responsible certification credential equivalent canadian education level require position . refer link information . degree equivalency ESSENTIAL OCCUPATIONAL CERTIFICATION Eligibility membership canadian veterinary association define current canadian veterinary association license recognize canadian veterinary association hold grant . ESSENTIAL EE1 deliver veterinary anatomic pathology diagnostic laboratory service . define extensive substantial associate performance duty period acquire relevant pathology training program . EE2 stakeholder e.g. client industry educational institution researcher project lead regulatory international body . EE3 assemble summarize analyze scientific information datum view provide advice recommendation science base decision . apply assess essential language requirement official language proficiency assess entry pool . enter pool assessment official language proficiency consider appointment . appointment assignment require meet language requirement position . information language requirement apply assess asset education aed1 post graduate degree study diagnostic anatomic pathology . Pathologists Pathologists . degree equivalency asset AEx1 deliver veterinary pathology diagnostic laboratory service . define acquire . aex2 provide veterinary pathology diagnostic service area meat hygiene . aex3 provide veterinary pathology expertise area animal welfare . condition employment Reliability Status security clearance applicant live depend security level require submit police certificate country live period documentation require security screening process . failure submit documentation request result elimination application follow condition employment require appointment adherence . adherence CFIA conflict Interest . compliance . legal status accept employment entire period employment . follow condition employment require appointment medical suitability pass pre placement Health Evaluation Periodic Health Evaluation . prescribed circumstance manner prescribe safety material equipment device clothing . prescribe provide respiratory equipment meet respiratory program requirement undergo fit testing e.g. clean shaven depend respirator design . willingness abide strict biosecurity protocol require shower abide restriction contact livestock workplace . environmentally challenging physically demanding condition pathogen high security laboratory biocontainment potential allergen . travel require . overtime require . information commit build skilled diverse workforce reflect serve . promote employment equity encourage indicate belong designate group apply . personal information purpose determine individual's competence suitability employment . staffing complaint question determination advise relevant personal information provide course staffing process disclose substantiate staffing decision . entitle participate staffing process official language choice . staffing process communicate email . provide valid email address receive communication regard staffing process . ensure check email account include spam promotion folder regularly deadline response . respond deadline risk remove staffing process . applicant screen staffing process send information email regard expect subsequent phase staffing process . application assessment process cheat plagiarism consider form misconduct permit . person find cheating include help cheat subject removal staffing process . current copy resume source confirm education describe screening question . review prospective hire manager appointment stage . information apply cfia staffing process visit provide proof education credential staffing process . assessment tool staffing process standardized test reference check write test interview . write verbal communication staffing process application close process evaluate . apply . select consideration contact ."
    },
    "companyDescription": "",
    "description": "Canadian Food Inspection Agency - Science Branch \n    Ottawa (Ontario) - The incumbent must be present in the laboratory. \n    VM-04 \n    $113,150 to $134,058 \n   For further information on the organization, please visit Canadian Food Inspection Agency \n   Closing date: 3 November 2023 - 23:59, Pacific Time \n   Who can apply: Persons residing in Canada and Canadian citizens residing abroad. \n   Apply online \n  \n \n Important messages \n We are committed to providing an inclusive and barrier-free work environment, starting with the hiring process. If you need to be accommodated during any phase of the evaluation process, please use the Contact information below to request specialized accommodation. All information received in relation to accommodation will be kept confidential.\n  Assessment accommodation \n When you apply to this selection process, you are not applying for a specific job, but to an inventory for future vacancies.   The sooner you submit your application into the inventory, the sooner you may be referred for opportunities.  There is currently an opportunity to staff in the Ottawa Animal Health Laboratory. We\u2019re asking applicants who are interested in this opportunity to apply by December 05, 2021 - 23:59, Pacific Time to be considered for the first round of assessment. \n \n  Please be advised that CFIA has suspended it\u2019s Policy on COVID-19 Vaccination. Accordingly, this poster has been amended to remove references to MANDATORY COVID-19 VACCINATION in the Important messages and Conditions of employment sections.\n \n  The Canadian Food Inspection Agency (CFIA) is a separate employer and is not subject to the Public Service Employment Act.\n  \n  The CFIA considers applications from individuals who have legal status to work in Canada and does not give preference to Canadian citizens.\n  \n  We will only accept applications received through the GC Jobs website, therefore you must submit your application by clicking on \u201cApply online\u201d in this advertisement. Persons who are unable to apply online must use the \u201cContact information\u201d below, prior to the closing date, to request specialized accommodation. \n Duties\n  The mandate of the Ottawa Animal Health Laboratory (OAHL) is primarily to offer diagnostic and research services in the field of veterinary transmissible spongiform encephalopathies (TSE) and bacterial diseases, chiefly for those regulated by the Government of Canada.   List of notifiable diseases in Canada: https://inspection.canada.ca/animal-health/terrestrial-animals/diseases/reportable/eng/1303768471142/1303768544412   List of immediately notifiable diseases in Canada: https://inspection.canada.ca/animal-health/terrestrial-animals/diseases/immediately-notifiable/eng/1305670991321/1305671848331   Reporting directly to the OAHL Director, the position is responsible for providing diagnostic pathology services for diseases of high priority to CFIA, pathology support for meat inspection and forensic pathology services for animal welfare. Bovine tuberculosis, scrapie and chronic wasting disease are the main priorities in anatomic pathology at OAHL.  Leading a technical team, the incumbent ensures compliance with ISO 17025 certification, manages assets and human and financial resources. The pathologist also provides advice to internal and external CFIA clients, contributors and senior management. The incumbent plays an important role in various research projects by providing pathology services and advice to project leads or collaborators. The pathologist will formulate recommendations to clients, senior management and international stakeholders on animal disease prevention, control, laboratory diagnosis and sample collection.  The incumbent must be present in the laboratory. \n Work environment\n  We offer a bilingual, science-based environment, with excellent benefits, flexible hours, opportunities for advancement, an emphasis on learning and development, and a high level of employee satisfaction. Join a workforce that\u2019s as diverse as the people it serves. You can find some more great reasons to join us on our website: http://www.inspection.gc.ca/about-the-cfia/cfia-jobs/top-10-reasons-to-join-us/eng/1299859095075/1299859142835 \n Intent of the process \n The intent is to have an inventory of candidates to draw from when vacancies arise for current and future needs of the CFIA. Applications will be accepted on an ongoing basis as long as the poster is active.  This inventory may be used to staff positions with similar qualifications, with various language requirements, various conditions of employment and/or various tenures including term appointments, indeterminate appointments, acting appointments and/or assignments. This inventory may also be used to staff positions at the VM-03 group and level. \n Positions to be filled: 1 \n Information you must provide \n Your r\u00e9sum\u00e9. \n In order to be considered, your application must clearly explain how you meet the following (essential qualifications)\n \n   You must meet all essential qualifications in order to be appointed to the position. Other qualifications may be a deciding factor in choosing the person to be appointed. Some essential and other qualifications will be assessed through your application. It is your responsibility to provide appropriate examples that illustrate how you meet each qualification. Failing to do so could result in your application being rejected.\n   \n   ESSENTIAL EDUCATION\n   \n   EEd1 Graduation from a recognized school of Veterinary Medicine, defined as:\n   \n  \n   graduation from a veterinary school accredited or approved by the Canadian Veterinary Medical Association (CVMA); or\n   graduation from another veterinary school and holding a Certificate of Qualification (Parts A, B & C) granted by the National Examining Board of the CVMA.\n  \n   EEd2 Post-graduate degree in a position-related field providing eligibility for board certification by the American College of Veterinary Pathologists or the European College of Veterinary Pathologists. \n   \n   Applicants submitting education credentials from a non-Canadian institution are responsible for obtaining certification that these credentials are the equivalent of the Canadian education level required for the position. \n   \n   Please refer to the link below for more information.\n \n  Degree equivalency\n \n   ESSENTIAL OCCUPATIONAL CERTIFICATION\n   \n   Eligibility for membership in a Canadian veterinary association, defined as:\n   \n  \n   current members of a Canadian veterinary association with a license recognized by the Canadian Veterinary Medical Association; and\n   non-members of Canadian veterinary associations holding a Certificate of Qualification granted by the National Examining Board (NEB) of the CVMA.\n  \n \n \n   ESSENTIAL EXPERIENCE\n   \n   EE1 Significant* experience in delivering veterinary anatomic pathology diagnostic laboratory services.\n   \n   \n  \n   Significant is defined as extensive and substantial experience normally associated with the performance of full-time duties over a period of at least two years, or acquired during a relevant pathology training program.\n  \n   EE2 Experience working with various stakeholders (e.g., clients, industry, educational institutions, researchers/project leads, regulatory/international bodies).\n   \n   EE3 Experience in assembling, summarizing and analyzing scientific information or data with a view to providing advice or recommendations or making science-based decisions.\n \n  The following will be applied / assessed at a later date (essential for the job)\n  Various language requirements Official languages proficiency will not be assessed for entry to the pool. Candidates entered in the pool will have an opportunity for assessment of their official languages proficiency if and when they are considered for an appointment.  For acting appointments and assignments, the candidate may not be required to meet the language requirements of the position.\n  Information on language requirements\n  The following may be applied / assessed at a later date (may be needed for the job)\n  ASSET EDUCATION  AEd1 Post-graduate degree (at least three years of studies) in diagnostic anatomic pathology.  AEd2 Diplomate of the American College of Veterinary Pathologists or of the European College of Veterinary Pathologists.\n  Degree equivalency\n \n   ASSET EXPERIENCE\n   \n   AEx1 Recent* experience in delivering veterinary pathology diagnostic laboratory services.\n   \n   \n  \n   Recent experience is defined as experience normally acquired within the last five (5) years.\n  \n   AEx2 Experience in providing veterinary pathology diagnostic services in the area of meat hygiene. \n   \n   AEx3 Experience in providing veterinary pathology expertise in the area of animal welfare.\n \n  Conditions of employment\n  Reliability Status security clearance - Applicants who have not lived in Canada for the past five (or ten, depending on security level) years may be required to submit a police certificate from each country in which they have lived for six months or more during this period, as well as other documentation required for the security screening process. Failure to submit this documentation if requested, will result in the elimination of your application\n \n   The following conditions of employment are required for an appointment:\n   \n  \n   Adherence to the CFIA Code of Conduct.\n   Adherence to the CFIA Conflict of Interest and Post-Employment Policy. \n   Compliance with the Values and Ethics Code for the Public Sector.\n   Legal status to accept employment for the entire period of employment.\n  \n   Any of the following conditions of employment may be required for an appointment:\n   \n  \n   Medical suitability: Pass a Pre-placement Health Evaluation and Periodic Health Evaluation.\n   To use in the prescribed circumstances and manner all prescribed safety materials, equipment, devices and clothing.\n   To use prescribed and provided respiratory equipment that meets the respiratory program requirements; to undergo fit testing (e.g. may need to be clean-shaven, depending on the respirator design).\n   Willingness to abide by strict biosecurity protocols which may require showering several times a day or abiding by certain restrictions on contact with livestock outside of the workplace.\n   Willing and able to work in environmentally challenging or physically demanding conditions and with pathogens in high security laboratory biocontainment or with potential allergens.\n   Willing and available to travel, as required.\n   Willing and available to work overtime, as required.\n  \n  \n Other information \n The Canadian Food Inspection Agency is committed to building a skilled and diverse workforce that reflects the Canadians we serve. We promote employment equity and encourage you to indicate if you belong to one of the designated groups when you apply. \n Personal information is obtained for the purpose of determining an individual\u2019s competence and suitability for employment. If a staffing complaint questions this determination, please be advised that relevant personal information you will provide in the course of this staffing process may be disclosed to substantiate the staffing decision.  You are entitled to participate in the staffing process in the official language of your choice.  For this staffing process, the CFIA will communicate with you by email. You must provide a valid email address to which you wish to receive communication regarding this staffing process. You must ensure that you check your email account including spam, promotion or other folders regularly as there may be a deadline for responses. If you respond past the deadline you risk being removed from the staffing process.  Applicants who are screened in to this staffing process will be sent further information by email regarding what to expect during subsequent phases of this staffing process.  During the application or assessment process both cheating and plagiarism are considered forms of misconduct and are not permitted. Any person found cheating, including those who help others to cheat, may be subject to removal from the staffing process.  A current copy of your resume may be used as another source to confirm the education and experience you will be asked to describe in the screening questions. It may also be reviewed by prospective hiring managers at the appointment stage.  For more information on how to apply to a CFIA staffing process, please visit: https://inspection.gc.ca/about-the-cfia/job-opportunities/how-to-apply/eng/1340676915348/1340679107182  You will be asked to provide proof of your education credentials later in the staffing process.  Various assessment tools may be used in this staffing process such as: standardized tests, reference checks, written tests, an interview, etc.  All written and verbal communication obtained throughout the staffing process, from the time of application to close of process, may be used to evaluate the candidate. \n We thank all those who apply. Only those selected for further consideration will be contacted."
}