{
    "id": "918fd4dfcf425fc9",
    "company": "Martello Technologies",
    "positionName": "Vice President, Research and Development",
    "jobType": [
        "Full-time"
    ],
    "location": "390 March Rd Suite 110, Kanata, ON",
    "salary": null,
    "postingDateParsed": "2024-01-26T12:13:41.663Z",
    "url": "https://www.indeed.ca/rc/clk?jk=918fd4dfcf425fc9&from=jasx&tk=1hl5dd1pui7nm800&bb=NiGljfghLwyJxtbyZy8vswW0La1Q_zOetf355TMDnYdjj1G7PlaJYWFBl-Pe80EgQ8A9z2hxNR2RYeMBUEruGIEZM30ObANyFdttKV0UQHALyrrt08ia-A%3D%3D&xkcb=SoCR67M3FlS757AVJj0PbzkdCdPP&vjs=3",
    "externalApplyLink": "https://martello.bamboohr.com/careers/166?source=indeed&src=indeed&postedDate=2024-01-25",
    "job_info_group": {
        "extracted_phone_numbers": [],
        "extracted_links": [
            "HTTP/HTTPS Links",
            "General Links",
            "WWW Links",
            "TLDs"
        ],
        "extracted_emails": [],
        "extracted_location_data": [
            "Kanata",
            "Canada",
            "Ottawa",
            "the United States",
            "Europe",
            "Ontario"
        ],
        "extracted_dates": [
            "At least 10 years",
            "five years",
            "5+ years"
        ],
        "extracted_languages": [],
        "extracted_laws": [],
        "extracted_norps": [],
        "extracted_orgs": [
            "Computer Science, Computer Engineering or Electrical Engineering",
            "Martello Technologies",
            "the Senior Leadership Team",
            "the Research and Development department",
            "Martello",
            "Research and Development",
            "Develop"
        ],
        "extracted_persons": [
            "Foster",
            "Lean Canvas"
        ],
        "extracted_products": [],
        "extracted_money": [],
        "processed_text": "headquarter employee . provide Microsoft digital monitoring DEM solution monitor performance cloud collaboration productivity tool enterprise insight user . product include unified communication UC performance analytic software Microsoft user monitor software analytic software . Vice President play pivotal leadership role drive innovation maintain competitiveness contribute long term success company . balance strategic thinking technical expertise effective leadership essential success role . VP senior leadership team lead global operation infrastructure customer care product delivery function company's cloud service identify requirement manage priority provide status manage budget ultimately ensure product service delivery budget maximum quality . responsibility include collaborate executive leadership ensure Research Development effort align company's vision mission . manage vision design development cloud infrastructure include compute storage network system cloud hosting . responsible 24x7x365 cloud infrastructure operation organization . manage Research Development budget ensure efficient resource . evaluate government funding program propose senior management program suited . contribute reporting management requirement government program . monitor progress milestone deliverable ensure alignment timeline objective . establish key Key Performance Indicators's Service Level Agreement's performance scorecard demonstrate department health . communicate operational review . measure track industry benchmark standard . evaluate potential technology adoption integration Martellofs product process . collaborate cross functional team include marketing sale product management bring product market . manage company's intellectual property portfolio include patent trademark trade secret . ensure Research Development activity comply legal regulatory requirement . cultivate relationship external partner research institution industry expert enhance collaboration access external expertise . implement measure ensure compliance relevant regulation standard . effectively communicate technical concept technical audience . implement oversee quality assurance process ensure reliability performance develop product . culture continuous improvement optimize process workflow . requirement undergraduate degree lead Research Development team include minimum senior management role . excellent write communication skill include architecture diagram datum flow system component diagram excellent presentation skill senior stakeholder executive board director . Agile Design thinking e.g. Lean User manage high volume mission critical saas application . 24x7x365 cloud saas operation Direct drive continuous improvement process operational efficiency . drive good practice cross functional team . excellent project management skill deadline manage multiple business drive initiative . market competitive analysis drive long term product strategy . ideal progressive leader effectively collaborate team focus approach mentor support develop research development team . hand lead example closely stakeholder external internal . appreciate head office ."
    },
    "companyDescription": null,
    "description": "Martello Technologies is headquartered in Ottawa, Canada with employees in Canada, Europe, and the United States. We provide Microsoft digital experience monitoring (DEM) solutions that monitor the performance of cloud collaboration and productivity tools to give enterprises insight into the user experience. Our products include unified communications (UC) performance analytics software, Microsoft 365 user experience monitoring software, and IT analytics software.\n  \n  \n  The Vice President of Research and Development plays a pivotal leadership role in driving innovation, maintaining competitiveness, and contributing to the long-term success of the company. The ability to balance strategic thinking, technical expertise, and effective leadership is essential for success in this role. The VP of R&D is a member of the senior leadership team and will lead the global operations, infrastructure, customer care, and product delivery functions for the company\u2019s cloud services and will identify requirements, manage priorities, provide status, manage budgets, and ultimately ensure that product and service delivery are on time, on budget and of maximum quality.\n  \n  \n  Your responsibilities will include: \n  \n  Collaborate with executive leadership to ensure R&D efforts align with the company\u2019s vision and mission. \n  Manage the vision, design, and development of cloud infrastructure, including compute, storage, and network systems for cloud hosting. \n  Responsible for running 24x7x365 cloud infrastructure and operations organization. \n  Develop and manage the R&D budget, ensuring efficient use of resources. \n  Evaluate government funding programs and propose to senior management the programs that are best suited for Martello. Contribute to the reporting and management requirements for these government programs. \n  Monitor progress, milestones, and deliverables to ensure alignment with timelines and objectives. \n  Establish key KPI\u2019s, SLA\u2019s, and performance scorecards demonstrating department health. Communicate through operational reviews. Measure and track against industry benchmarks and standards. \n  Evaluate the potential of new technologies for adoption or integration into Martello\u2019s products and processes. \n  Collaborate with cross-functional teams, including marketing, sales, and product management, to bring products to market successfully. \n  Manage the company\u2019s intellectual property portfolio, including patents, trademarks, and trade secrets. \n  Ensure that R&D activities comply with legal and regulatory requirements. \n  Cultivate relationships with external partners, research institutions, and industry experts to enhance collaboration and access external expertise. \n  Implement measures to ensure compliance with relevant regulations and standards. \n  Effectively communicate technical concepts to non-technical audiences. \n  Implement and oversee quality assurance processes to ensure the reliability and performance of developed products. \n  Foster a culture of continuous improvement within the R&D department, optimizing processes and workflows.\n \n  \n  \n  Requirements: \n  An undergraduate degree in Computer Science, Computer Engineering or Electrical Engineering \n  At least 10 years of experience in leading R&D teams, including a minimum of five years in a senior management role. \n  \n  Excellent written communication skills including architecture diagrams, data flows, and system component diagrams \n  Excellent presentation skills, in particular to senior stakeholders such as other executives or board of directors. \n  Experience with Agile, Design Thinking, and Lean Methodologies (e.g. Lean UX, Lean Canvas) \n  5+ years of experience managing high-volume mission-critical SaaS applications. \n  5+ years of experience in 24x7x365 cloud and SaaS operations \n  Direct experience driving continuous improvements in process and operational efficiencies. Drive best practices across cross functional teams. \n  Excellent project management skills and ability to work to deadlines managing multiple business-driven initiatives. \n  Experience with market and competitive analysis, and driving long-term product strategy.\n \n  \n  \n  The ideal candidate is a progressive leader who effectively collaborates with a team-focused approach and will mentor, support, and develop their research and development team members. You are hands-on, lead by example, and value the importance of working closely with stakeholders external and internal. As a member of the Senior Leadership Team, you appreciate the value and need to be \u201cpresent\u201d while working from our head office in Kanata, Ontario."
}