{
    "id": "4f64bf36316e2afe",
    "company": "Queensway Carleton Hospital",
    "positionName": "Director Quality, Patient Relations&Safety, IPAC - Full-Time",
    "jobType": [],
    "location": "3045 Baseline Road, Ottawa, ON",
    "salary": null,
    "postingDateParsed": "2023-10-08T02:02:31.395Z",
    "url": "https://www.indeed.ca/rc/clk?jk=4f64bf36316e2afe&from=jasx&tk=1hc6garcoih7o800&vjs=3",
    "externalApplyLink": "https://erecruiter.qch.on.ca/default.aspx?REQ_ID=12926",
    "job_info_group": {
        "extracted_phone_numbers": [],
        "extracted_links": [
            "HTTP/HTTPS Links",
            "General Links",
            "WWW Links",
            "TLDs"
        ],
        "extracted_emails": [],
        "extracted_location_data": [],
        "extracted_dates": [
            "5+ years"
        ],
        "extracted_languages": [],
        "extracted_laws": [
            "the Ontario Human Rights Code",
            "Ontario Human Rights Code"
        ],
        "extracted_norps": [
            "Inuit"
        ],
        "extracted_orgs": [
            "Human Resources Management Responsible",
            "Queensway Carleton Hospital",
            "e.g. Morbidity and Mortality Committee",
            "Senior Administration",
            "PIDAC",
            "Safe Medications Committee",
            "QIP",
            "the Quality Executive and Quality Council",
            "Health Care Quality and Risk Management",
            "Quality Improvement Plans",
            "Healthcare Insurance Reciprocal of Canada",
            "Safe Mobility Committee",
            "the Ontario Health",
            "the Provincial Infectious Diseases Advisory Committee",
            "Director Occupational Health and Safety",
            "Develop",
            "CHICA Ottawa Region",
            "Operations Management Responsible",
            "a healthcare setting Project Management Professional Designation",
            "First Nations",
            "infection control Special Projects and Initiatives Liaise",
            "the Hospital",
            "regional (Ottawa Infection Control Liaison Group"
        ],
        "extracted_persons": [],
        "extracted_products": [],
        "extracted_money": [
            {
                "amount": "90.93",
                "noun_phrases": []
            }
        ],
        "processed_text": "General Posting information position Director Quality Patient Relations Patient Safety Infection Prevention Control IPAC DEPARTMENT patient care condition shift shift subject change wage range Scale Minimum Maximum NONU hr hr summary reporting Vice President Patient Care Chief Nurse Executive Director Quality Patient Relations IPAC responsible strategically direct planning development implementation maintenance evaluation QCH quality improvement quality assurance risk management client clinical education infection prevention control IPAC program . responsibility addition duty assign consistent prescribe practice procedure policy department incumbent direction Vice President Patient Care Operations Leadership responsible anticipate scan environment emerge problem infectious organism communicable disease evaluate impact order recommend prevention control measure advise cost implication regard legislation . responsible propose program service change exist program ensure optimal performance compliance change guideline standard legislation . develop maintain robust set hospital wide policy procedure guideline ensure regulatory compliance good practice . champion culture patient safety risk reduction error prevention organization . Spearhead hospital's accreditation endeavor orchestrate cohesive effort encompass coordination consultation implementation review education . ensure organization meet exceed accreditation standard demonstrate commitment excellence . promote culture safety organization foster reporting adverse event implement initiative prevent error . direct clinical infection control program include identify monitor analyse trend advise ensure appropriate measure staff level prepare deliver statistical datum report infection control committee . ensure compliance IPAC guideline regulation lead audit coordinate staff training maintain high standard infection prevention organization . ensure going quality effectiveness regulatory compliance service policy process procedure . analyze clinical statistical financial operational datum assist going planning evaluation enhancement program budget . assist licensing accreditation survey preparation request . monitor execution preventive measure provide guidance staff ensure proper implementation good practice procedure maintain record document case infection disease monitoring investigation process improvement prevention purpose manage database surveillance datum ensure maintenance infection control standard practice current provincially federally legislate requirement mandate currently accept professional guideline recommendation Report designate communicable disease Public Health Quality Patient Safety Coordination Collaboration Drive initiative cultivate culture patient safety ensure quality care remain forefront operation . lead facilitate development implementation evaluation drive measurable enhancement patient care safety . develop comprehensive multi strategic plan advance patient safety quality objective consider industry trend good practice . ensure representation committee task group quality patient safety mandate carry objective Corporate Risk Patient Safety actively lead organization's accreditation effort include limit coordination consultation implementation review education . implement evaluate organizational patient safety plan . collaborate HIROC leverage risk management expertise foster proactive approach patient safety . provide leadership participate drive collective effort quality enhancement share good practice insight facilitate continuous learning . patient Management responsible oversee patient relation ensure satisfactory resolution patient family concern . support staff conflict management alternative dispute resolution skill enable level staff identify intervene mediate patient satisfaction service recovery timely fashion . report datum trend theme relate patient satisfaction Manage coordinate facilitate complex project enhance patient . educate staff level department infection prevention control measure ensure staff safety . liaise coordinate communicate internal external individual organization include VP Patient Care Organizational Effectiveness respect planning going operation . ensure application adherence legislative requirement collective agreement hospital policy . select coach retain transfer knowledge staff ensure quality care optimal individual team performance . develop educational material relevant easily understand clinical clinical staff . advise consult physician nurse contract personnel concern precaution protect patient staff transmission infection . serve knowledgeable resource infection control practice policy patient family staff . create support continuous learn culture promote participation seminar workshop conference ensure timely corporate communication issue pertain lead participate internal inter intra external committee task force network multidisciplinary project team . participate lead initiative common director i.e. cultural transition . participation provincial national CHICA infection prevention control relate group facilitate networking benchmarke sharing resource . stay update industry regulation guideline emerge trend ensure organization remain forefront good practice respective area . requirement Education Master's Degree health relate program study advanced knowledge microbiology epidemiology infection prevention control principle demonstrate oversight leadership progressive Quality Care initiative healthcare set + progressive healthcare healthcare management Qualifications Asset knowledge strategic planning datum analysis method risk management strategic analytical conceptual thinking continuous improvement skill provide expertise senior leader lead transformative change vision mission QCH write clear concise report briefing senior management include strategic advice recommendation key issue accreditation project leader medium sized Hospital Preferred Qualifications Post Graduate Degree certification prefer leader PMP Change Management PROSCI note accord Queensway Carleton Hospital Vaccination Policy applicant fully vaccinate provide proof valid medical contraindication exemption basis protect ground order consider staff volunteer . hiring applicant provide proof government issue documentation prove fully vaccinate support documentation valid medical contraindication exemption . continued interest . deeply celebrate principle equity diversity inclusion belong integral enrichment environment . foster inclusive diverse community achieve mission provide exceptional healthcare service individual compassion respect . encourage applicant background apply . contribute diversification organization include limit woman racial ethnic minority Metis people person Disabilities 2slgbtqi+ community . committed ensure accessibility accommodate entire selection process . dedicated recruitment team assist individual inquiry concern regard accessibility accommodation stage recruitment process . invite reach support . forward diverse talent team continue positive impact life patient community serve ."
    },
    "companyDescription": "",
    "description": "General Posting Information\n \n \n  \n    \n   \n   \n   \n   \n    \n     \n      \n       POSITION:\n       \n      \n       Director, Quality, Patient Relations, Patient Safety and Infection Prevention and Control (IPAC)\n       \n     \n      \n     \n     \n      \n       DEPARTMENT:\n       \n      \n       Patient Care\n       \n     \n      \n     \n     \n      \n       CONDITIONS:\n       \n      \n       Full-time\n       \n     \n      \n     \n     \n      \n       SHIFTS:\n       \n      \n       \n        Days\n        \n       \n        7.5 hours per shift (subject to change)\n        \n       \n     \n      \n     \n     \n      \n       WAGE RANGE:\n       \n      \n       \n        Scale Minimum Maximum\n        \n       \n        NONU $75.02/hr $90.93/hr\n       \n      \n       \n     \n      \n    \n   \n  \n  \n  \n   JOB SUMMARY \n    Reporting to the Vice President, Patient Care and Chief Nurse Executive, the Director for Quality, Patient Relations and IPAC is responsible for strategically directing the planning, development, implementation, maintenance, and evaluation of the QCH quality improvement, quality assurance, risk management, client experience, clinical education and infection prevention and control (IPAC) programs. \n   \n  \n   RESPONSIBILITIES:\n   \n   \n   \n    \n     In addition to such other duties as may from time to time be assigned, and consistent with the prescribed practices, procedures, and policies of the department and the Hospital, the incumbent shall under the direction of the Vice President, Patient Care: \n      Operations Leadership \n      \n      Responsible for anticipating and scanning the environment for emerging problem infectious organisms and communicable diseases, to evaluate the impact in order to recommend prevention/control measures and advise Senior Administration of cost implications regarding up and coming legislation. \n      Responsible for proposing new programs and services, or changes to existing programs, to ensure optimal performance and compliance with changing guidelines, standards, and legislation. \n      Develop and maintain a robust set of hospital-wide policies, procedures, and guidelines that ensure regulatory compliance and best practices. \n      Champion a culture of patient safety, risk reduction, and error prevention across the organization. \n      Spearhead the hospital's accreditation endeavors, orchestrating a cohesive effort that encompasses coordination, consultation, implementation, review, and education. Ensure the organization meets and exceeds accreditation standards, demonstrating a commitment to excellence. \n      Promoting a culture of safety throughout the organization by fostering reporting of near misses, adverse events, and implementing initiatives to prevent errors. \n      \n     Operations Management \n      \n      Responsible for directing the clinical infection control program, which includes identifying, monitoring and analysing trends, advising and ensuring appropriate measures are taken by staff at all levels, and preparing and delivering statistical data and reports to the infection control committee. \n      Ensure compliance with IPAC guidelines and regulations, leading audits, and coordinating staff training to maintain a high standard of infection prevention across the organization. \n      Ensure the on-going quality, effectiveness, and regulatory compliance of services, policies, processes, and procedures. \n      Analyze clinical, statistical, financial and operational data to assist in on-going planning, evaluation, and enhancement of programs and budgets. \n      Assists with licensing/accreditation survey preparation as requested. \n      Monitor the execution of preventive measures and provide guidance to staff to ensure proper implementation of best practices and procedures \n      Maintain records of documented cases of infection and disease for monitoring, investigation and process improvement/prevention purposes and manage the database of surveillance data \n      Ensure maintenance of infection control standards and practices in accordance with current provincially and/or federally legislated requirements, as mandated by the Provincial Infectious Diseases Advisory Committee (PIDAC) and/or currently accepted professional guidelines and recommendations \n      Report designated communicable diseases to Ottawa Public Health \n      \n     Quality and Patient Safety Coordination and Collaboration \n      \n      Drive initiatives to cultivate a culture of patient safety, ensuring that quality care remains at the forefront of all operations. \n      Lead and facilitate the development, implementation, and evaluation of Quality Improvement Plans (QIP), driving measurable enhancements in patient care, safety, and experience. \n      Develop comprehensive, multi-year strategic plans to advance patient safety and quality objectives, considering industry trends and best practices. \n      Ensure representation on committees and task groups with a quality or patient safety mandate in carrying out their objectives (e.g. Morbidity and Mortality Committee, Safe Mobility Committee, Safe Medications Committee, Corporate Risk and Patient Safety) \n      Actively lead the organization\u2019s accreditation efforts, including but not limited to coordination, consultation, implementation, review, and education. \n      Develop, implement, and evaluate the organizational patient safety plan. \n      Collaborate with HIROC (Healthcare Insurance Reciprocal of Canada) to leverage risk management expertise, fostering a proactive approach to patient safety. \n      Provide leadership and participate in the Quality Executive and Quality Council to drive collective efforts towards quality enhancement, sharing best practices, insights, and facilitating continuous learning. \n      \n     Patient Experience Management \n      \n      Responsible for overseeing patient relations, ensuring satisfactory resolution of patient/family concerns. \n      Support staff on the use of conflict management and alternative dispute resolution skills enabling all levels of staff to identify, intervene, and mediate patient satisfaction /service recovery in a timely fashion. \n      Report on data, trends and themes related to patient experience and satisfaction \n      Manage, coordinate, and facilitate complex projects to enhance the patient experience. \n      \n     Human Resources Management \n      \n      Responsible for educating staff at all levels and in all departments on infection prevention and control measures to ensure staff safety. \n      Liaise, coordinate, and communicate with internal and external individuals/organizations (including VP Patient Care/Organizational Effectiveness and Director Occupational Health and Safety) with respect to planning and on-going operations. \n      Ensure the application and adherence to legislative requirements, collective agreements, and hospital policies. \n      Select, coach, retain, and transfer knowledge to staff to ensure quality of care optimal in individual/team performance. \n      Develops educational materials that are relevant, useful and easily understood by both clinical and non-clinical staff members. \n      Advises and consults with physicians, nurses, and contracted personnel concerning precautions to be taken to protect patients, staff, and others from possible transmission of infection. \n      Serves as a knowledgeable and available resource on infection control practices and policies to patients, families, and staff. \n      Create and support a continuous learning culture \n      Promote participation in seminars, workshops and conferences \n      Ensure timely corporate communication of issues pertaining to infection control \n      \n     Special Projects and Initiatives \n      \n      Liaise with and lead/participate on internal (inter or intra) and external committees, task forces, networks and multidisciplinary project teams. \n      Participate and/or lead initiatives which are common to all Directors (i.e. cultural transition). \n      Participation in regional (Ottawa Infection Control Liaison Group and CHICA Ottawa Region) provincial and national (CHICA) infection prevention and control related groups to facilitate networking, benchmarking and sharing of resources. \n      Stay updated with industry regulations, guidelines, and emerging trends to ensure the organization remains at the forefront of best practices in the respective areas. \n      \n    \n   \n  \n  \n  \n   REQUIREMENTS:\n   \n   \n  \n   Education and Experience\n   \n  \n   \n    \n     \n      Master\u2019s Degree in a Health-related program of Study \n      Advanced knowledge of microbiology, epidemiology, infection prevention and control principles \n      Demonstrated oversight and leadership of progressive Quality Care initiatives in a healthcare setting \n      5+ years progressive experience in healthcare/healthcare management \n      \n     Other Qualifications (Asset) \n      \n      Knowledge and experience of strategic planning, data analysis methods and risk management \n      Strategic, analytical, conceptual thinking, and continuous improvement skills to provide expertise to senior leaders \n      Ability to lead transformative change in line with the vision, mission and values of QCH \n      Ability to write clear, concise reports and briefings for senior management that includes strategic advice and recommendations on key issues \n      Experience as an Accreditation project leader for a medium-sized (or above) Hospital \n     \n     Preferred Qualifications \n      \n      Post-Graduate Degree/certification in Health Care Quality and Risk Management (preferred) \n      5+ years of experience as a leader in a healthcare setting \n      Project Management Professional Designation (PMP) \n      Change Management (PROSCI or other) \n      \n    \n   \n  \n  \n  \n   \n    \n     \n      Please note that according to the Ontario Health and Queensway Carleton Hospital Vaccination Policy, all applicants must be fully vaccinated unless they can provide the proof of a valid medical contraindication or exemption on the basis of protected grounds under the Ontario Human Rights Code in order to be considered for any staff or volunteer opportunities. Upon hiring, applicants must provide the proof of either government issued documentation proving they have been fully vaccinated, or present supporting documentation of a valid medical contraindication or exemption under Ontario Human Rights Code.\n     \n     \n       \n       \n       \n       \n        Thank you for your continued interest in Queensway Carleton Hospital. We deeply value and celebrate the principles of equity, diversity, inclusion, and belonging, as they are integral to the enrichment of our work environment. We believe that by fostering an inclusive and diverse community, we can achieve our mission of providing exceptional healthcare services to all individuals with compassion and respect. We encourage applicants from all backgrounds to apply. We welcome those who would contribute to the further diversification of our organization including, but not limited to women, racial or ethnic minorities, First Nations, Inuit, and M\u00e9tis peoples, persons with Disabilities, and 2SLGBTQI+ communities. \n         At Queensway Carleton Hospital, we are committed to ensuring accessibility and accommodating the needs of all candidates throughout the entire selection process. Our dedicated recruitment team is readily available to assist individuals with any inquiries or concerns regarding accessibility and accommodations at any stage of our recruitment process. We invite you to reach out and let us know how we can best support you. We look forward to welcoming diverse talent into our team and continuing to make a positive impact in the lives of our patients and the communities we serve."
}