{
    "id": "6a9d3efd02a67d68",
    "company": "1595769 Ontario Ltd. O/A eDecree",
    "positionName": "English Transcriptionist",
    "jobType": [
        "Permanent",
        "Part-time",
        "Full-time"
    ],
    "location": "116 Albert St Ste 200, Ottawa, ON",
    "salary": null,
    "postingDateParsed": "2024-01-09T03:12:13.431Z",
    "url": "https://www.indeed.ca/rc/clk?jk=6a9d3efd02a67d68&from=jasx&tk=1hjm3501uhbi2800&vjs=3",
    "externalApplyLink": null,
    "job_info_group": {
        "extracted_phone_numbers": [],
        "extracted_links": [
            "HTTP/HTTPS Links",
            "General Links",
            "WWW Links",
            "TLDs"
        ],
        "extracted_emails": [],
        "extracted_location_data": [
            "Quebec",
            "Russia",
            "Uganda",
            "Ethiopia",
            "Indonesia",
            "Mali",
            "Japan",
            "Romania",
            "Canada",
            "Sudan",
            "Nigeria",
            "Kenya",
            "Eritrea",
            "Thailand",
            "Liberia",
            "South Sudan",
            "Korea",
            "China",
            "Djibouti",
            "Ghana",
            "France",
            "Congo",
            "Georgia",
            "Cameroon"
        ],
        "extracted_dates": [
            "Monday",
            "Three month",
            "Monday to Friday Open",
            "the last 5 years",
            "At least 18 years of age",
            "three months",
            "5 years"
        ],
        "extracted_languages": [
            "English"
        ],
        "extracted_laws": [],
        "extracted_norps": [
            "East African",
            "West African"
        ],
        "extracted_orgs": [
            "Ottawa ON",
            "Work Location & Hours Office"
        ],
        "extracted_persons": [],
        "extracted_products": [],
        "extracted_money": [
            {
                "amount": "up to $21",
                "noun_phrases": []
            },
            {
                "amount": "21",
                "noun_phrases": []
            },
            {
                "amount": "18.00-$21.00",
                "noun_phrases": []
            }
        ],
        "processed_text": "apply directly career currently hire long term legal transcription typist . position office . involve standard transcription perform quality assurance audio review complete transcript . employee role contractor . responsibility type verbatim transcript pre recorded audio video legal proceeding . learning follow client house rule i.e. client specific preference formatting spelling capitalization edit convention hold party client information strictest confidentiality review complete identify potential area improvement Requirements strong english grammar comprehension understand global accent minimum word minute type speed Computer literacy strong MS Word skill understand follow accent english language require include include Somalia south asian accent include India Pakistan Bangladesh Sri Lanka Afghanistan east asian accent include middle eastern accent include Iran Iraq Turkey Eastern Bloc european accent include latin american accent include Mexico Chile Brazil Venezuela french accent include strong command second language prefer previous transcription requirement train successful . violent graphic content . current Royal Canadian Mounted Police criminal background check Level hiring . eligible require live note content process graphic detail sexual physical violence . successful comfortable content . interview process screen handle content . locate Suite K1P Open p.m compensation start hour hour depend performance verifiable transcription base hourly rate hr probation vacation ESA standard pay pay cheque health benefit provide include pharma dental eye chiro physio . probation staff week . type permanent salary hour benefit casual dress dental care extended health care Vision care schedule hour shift shift evening shift Friday Morning shift weekend location person"
    },
    "companyDescription": "",
    "description": "Please apply directly through our careers page: \nhttps://www.edecree.com/careers-front-1\nWe are currently looking to hire several long term part-time and full-time legal transcription typists. This position is in office with both part-time and full-time opportunities. This job involves both standard transcription work as well as performing quality assurance audio reviews of completed transcripts. These are employee roles, not contractors.\nResponsibilities\n\n Typing verbatim transcripts of pre-recorded audio and video legal proceedings.\n Learning and following client house rules (i.e. client-specific preferences in formatting, spelling, capitalization, and editing conventions)\n Holding all third-party (client) information in the strictest confidentiality\n Reviewing completed work to identify potential areas of self-improvement\n\nRequirements\n\n Strong English grammar and comprehension\n Ability to understand global accents\n Minimum 80 Words per Minute typing speed\n Computer literacy with strong MS Word skills\n Ability to understand at least one or more of the following accents in the English language is required:\n West African (including Nigeria, Ghana, Liberia, Mali)\n East African (including Sudan, South Sudan, Kenya, Uganda, Ethiopia, Eritrea, Djibouti, Somalia)\n South Asian accents (including India, Pakistan, Bangladesh, Sri Lanka, Afghanistan)\n East Asian accents (including China, Korea, Japan, Thailand, Indonesia)\n Middle Eastern accents (including Iran, Iraq, Turkey)\n Eastern Bloc European accents (including Russia, Romania, Georgia)\n Latin American accents (including Mexico, Chile, Brazil, Venezuela)\n French accents (including Quebec, France, Congo, Cameroon)\n Strong command of a second language beyond English is preferred\n Previous transcription experience is not a requirement, we will train successful candidates.\n At least 18 years of age due to violent and graphic content.\n Current RCMP criminal background check Level 1 upon hiring.\n Eligible candidates are required to have lived in Canada for the last 5 years\n\nPlease Note: Content being processed contains graphic details of sexual and physical violence. Successful candidates need to be comfortable with this content. The interview process will screen for ability to handle such content.\nWork Location & Hours\n\n Office located at 116 Albert Street, Suite 200 & 300, Ottawa ON, K1P 5G3, Canada\n Open from Monday to Friday\n Open from 8:00 a.m. to 5:00 p.m\n\nCompensation\n\n Starts at $18/hour, and can go up to $21/hour depending on performance\n If you have 5 years or more of verifiable transcription experience, your base hourly rate will begin at $21/hr\n Three month probation\n Vacation as per ESA standards, and is paid out on each pay cheque\n Full health benefits are provided, including pharma, dental, eye, chiro, physio, etc., after three months of probation, for all staff working at least 32 hours per week.\n\nJob Types: Full-time, Part-time, Permanent\nSalary: $18.00-$21.00 per hour\nBenefits:\n\n Casual dress\n Dental care\n Extended health care\n Vision care\n\nSchedule:\n\n 8 hour shift\n Day shift\n Evening shift\n Monday to Friday\n Morning shift\n Weekends as needed\n\nWork Location: In person"
}