{
    "id": "721c33e4d7fca17e",
    "company": "Thermo Fisher Scientific",
    "positionName": "Chemical Account Manager (Analytical Reagents)(Upper East Coast)",
    "jobType": [
        "Full-time"
    ],
    "location": "Ottawa, ON",
    "salary": null,
    "postingDateParsed": "2024-01-26T12:14:21.770Z",
    "url": "https://www.indeed.ca/rc/clk?jk=721c33e4d7fca17e&from=jasx&tk=1hl5df1tjjgbv802&bb=Z1g7BKmuG1p3giV72g1dceo4A01IxxUJ7OAZ7kBhaa7jaXGEDjDuskGNUuj5VOWtAc0gSIO86r-kRLnxbDlQOa8i7e84G4_06PqPOPS7qHIHF51x9VrJEA%3D%3D&xkcb=SoBf67M3FlSzmxgNR70EbzkdCdPP&vjs=3",
    "externalApplyLink": "https://jobs.thermofisher.com/global/en/job/R-01222627/Chemical-Account-Manager-Analytical-Reagents-Upper-East-Coast?rx_a=0&rx_c=&rx_ch=jobp4p&rx_group=123525&rx_job=R-01222627_1001-1&rx_medium=cpc&rx_r=none&rx_source=indeed&rx_ts=20240127T120803Z&rx_vp=cpc&utm_medium=ppc&utm_source=recruitics_indeedorganic&codes=INDEED&rx_p=VVCOIR5X4X&rx_viewer=9e2d0924bd0d11eeb29f25dbcba6d142d23752f3333142cca12ab868844c5feb",
    "job_info_group": {
        "extracted_phone_numbers": [
            "855-471-2255",
            "1-855-471-2255"
        ],
        "extracted_links": [
            "HTTP/HTTPS Links",
            "General Links",
            "WWW Links",
            "TLDs"
        ],
        "extracted_emails": [],
        "extracted_location_data": [
            "Upstate New York",
            "Maine",
            "NY",
            "New York",
            "Watertown",
            "Eastern Canada",
            "Canada",
            "New Hampshire",
            "VT",
            "Ottawa",
            "Vermont",
            "Burlington",
            "Montreal"
        ],
        "extracted_dates": [
            "1-3 Years",
            "3 weeks",
            "today",
            "holidays annually",
            "2+ years",
            "8 weeks",
            "10"
        ],
        "extracted_languages": [],
        "extracted_laws": [],
        "extracted_norps": [],
        "extracted_orgs": [
            "our Analytical Reagents",
            "NYSE",
            "Thermo Scientific",
            "Fisher Scientific",
            "Invitrogen",
            "the Laboratory Chemicals Division",
            "BioReagents",
            "Thermo Fisher Scientific",
            "the Life Sciences",
            "Patheon",
            "Applied Biosystems",
            "Thermo Fisher Scientific Thermo Fisher Scientific Inc.",
            "Unity Lab Services"
        ],
        "extracted_persons": [],
        "extracted_products": [],
        "extracted_money": [
            {
                "amount": "approximately $40 billion",
                "noun_phrases": []
            },
            {
                "amount": "63,900.00\u2013$95,850.00",
                "noun_phrases": []
            }
        ],
        "processed_text": "description exist Chemical Account Manager LCD cover . lcd enable customer bring chemistry life scientific journey chemical life enrich result . purpose deliver chemical safely efficiently customer focus result . trusted partner chemical market serve Honor commitment consistently deliver result admired business safe exciting career destination outstanding talent . territory ideal live territory travel surround area . canadian resident french speaking . develop strategic tactical sale plan pursue ambitious incremental growth Discovery Chemicals business assign territory . schedule conduct formal sale activity include capability base presentation focus group technical seminar product launch drive sale . represent promote Laboratory chemical' proposition level account industry . provide market intelligence appropriate detail regard account sale position request . direct daily sale activity ensure customer focus timely customer response customer follow require . coordinate collaborate colleague develop appropriate alliance promote growth chemical business . coordinate engage level channel distribution sale teaminclude manager director local sale representative . implement joint distribution representative provide sale product training technical sale activity . required minimum education emphasis recommend . minimum sale sale Life sciences Healthcare field prefer require Business Hunter type sale background prefer speak french prefer Knowledge skill outstanding analytical capability problem solve skill . team environment influence achieve result . motivated bias action . excellent interpersonal persuasive communication . substantiated capability effectively negotiate close business . evidence professional presentation skill . outstanding follow organizational skill . willingness travel accomplish assign goal . demonstrate Thermo Fisher \u2013 Integrity Intensity Innovation involvement TMO leader serve science annual revenue . Mission enable customer healthy clean safe . customer accelerate life science research solve complex analytical challenge increase efficiency laboratory improve patient health diagnostic development manufacture life change therapy support . global team colleague deliver outstanding combination innovative technology purchase convenience pharmaceutical service industry lead brand include PPD . information visit . apply EEO Affirmative Action Employer discriminate basis race color religion sex sexual orientation gender identity national origin protect veteran status legally protect status . accessibility Access seeker offer accessibility service seeker require accommodation application process . example include individual require assistance hearing vision mobility cognitive impairment . seeker assist person require accessibility assistance accommodation apply submit request . include contact information specific detail require accommodation support application process . reserve solely seeker require accessibility assistance accommodation application process . message leave purpose career website follow application relate technical issue receive response . compensation Benefits salary range estimate position base . position eligible receive variable annual bonus base company team individual performance result company policy . offer comprehensive Total reward package U.S. colleague family count include choice national medical dental plan national vision plan include health incentive program employee assistance family support program include commuter benefit tuition reimbursement pay Paid pay pay parental leave bonding caregiver leave accident life insurance shortand long term company policy Retirement saving program competitive U.S. retirement saving plan employee' Stock Purchase Plan espp offer eligible colleague purchase company stock discount information benefit visit"
    },
    "companyDescription": "At Thermo Fisher Scientific, we work together to accelerate research, solve complex analytical challenges, improve patient diagnostics, drive laboratory productivity and produce life-saving treatments for patients. We know that our people are the source of our global success, and we embrace the unique qualities, differences and experiences of each of our colleagues. As the world leader in serving science, we provide our teams the autonomy and support they need to drive cutting-edge innovation and progressive thinking.\r\n\r\nIf you\u2019re looking for a career opportunity where you can build your future, you\u2019ll discover that, at Thermo Fisher Scientific, each one of our 100,000 extraordinary minds has a unique story to tell. And we all contribute to a singular Mission\u2014To enable our customers to make the world healthier, cleaner and safer.\r\n\r\nWhat story will you tell? Explore our opportunities at jobs.thermofisher.com and join our team. \r\n",
    "description": "Job Description\n \n  An opportunity exists for a Chemical Account Manager in the Laboratory Chemicals Division (LCD) of Thermo Fisher Scientific, covering Eastern Canada, Upstate New York, Vermont, New Hampshire and Maine.  LCD enables its customers by bringing chemistry to life! Scientific journeys begin with chemicals and end with life-enriching results. Our purpose is to deliver chemicals safely and efficiently, so that our customers can focus on results. Together, we will:\n \n   Become the trusted partner for chemicals in the markets we serve\n   Honor our commitments by consistently delivering results\n   Become an admired business to work for, and a safe and exciting career destination for outstanding talent.\n \n \n  Territory: Ideal candidate would live in territory (up to 50% travel) Watertown, NY, Burlington, VT, Canada (Montreal or Ottawa) and surrounding areas. Canadian residents must be bilingual (French speaking).\n \n  What will you do:\n \n   Develop strategic and tactical sales plans to pursue ambitious incremental growth of our Analytical Reagents, BioReagents and Discovery Chemicals businesses in the assigned territory.\n   Schedule and conduct formal sales activities, including capabilities-based presentations; focus groups; technical seminars; and new product launches to drive sales.\n   Represent and promote the Laboratory Chemicals\u2019 value proposition at all levels within your accounts, and in the industry.\n   Provide market intelligence and appropriate detail regarding account sales position as requested.\n   Direct daily sales activities to ensure customer focus, timely customer response, and customer follow-up where required.\n   Coordinate and collaborate with various colleagues of Thermo Fisher Scientific to develop appropriate alliances and to promote the growth of our overall Chemicals business.\n   Coordinate and engage with various levels of the channel & distribution sales team- including managers, directors and local sales representatives.\n \n \n   Implement joint calls with distribution representatives as needed to provide sales and product training, and further technical sales activities.\n \n \n  How will you get here:\n \n \n   A Bachelor\u2019s Degree is the required minimum education; an emphasis in the Life Sciences is recommended. \n \n \n Experience: \n \n \n  Minimum of 2+ years Sales Experience\n   1-3 Years Sales Experience in the Life sciences or Healthcare field preferred but not required\n   New Business/Hunter type sales background preferred\n   Ability to speak French preferred\n \n \n  Knowledge, Skills, Abilities: \n \n  Outstanding analytical capability and problem-solving skills.\n   Ability to work in a team environment and influence others to achieve results.\n   Self-motivated with bias for action.\n   Excellent interpersonal and persuasive communications abilities.\n   Substantiated capability to effectively negotiate and close business.\n   Evidence of professional presentation skills.\n   Outstanding follow up and organizational skills.\n   Willingness to travel to accomplish assigned goals.\n   Must show the ability to demonstrate the Thermo Fisher values (The Four I\u2019s) \u2013 Integrity, Intensity, Innovation, and Involvement\n \n \n  About Thermo Fisher Scientific \n Thermo Fisher Scientific Inc. (NYSE: TMO) is the world leader in serving science, with annual revenue of approximately $40 billion. Our Mission is to enable our customers to make the world healthier, cleaner and safer. Whether our customers are accelerating life sciences research, solving complex analytical challenges, increasing efficiency in their laboratories, improving patient health through diagnostics or the development and manufacture of life-changing therapies, we are here to support them. Our global team of more than 100,000 colleagues delivers an outstanding combination of innovative technologies, purchasing convenience and pharmaceutical services through our industry-leading brands, including Thermo Scientific, Applied Biosystems, Invitrogen, Fisher Scientific, Unity Lab Services, Patheon and PPD. For more information, please visit www.thermofisher.com.\n \n  Apply today! http://jobs.thermofisher.com\n \n  Thermo Fisher Scientific is an EEO/Affirmative Action Employer and does not discriminate on the basis of race, color, religion, sex, sexual orientation, gender identity, national origin, protected veteran status, disability or any other legally protected status.\n \n  Accessibility/Disability Access\n  Job Seekers with a Disability: Thermo Fisher Scientific offers accessibility service for job seekers requiring accommodations in the job application process. For example, this may include individuals requiring assistance because of hearing, vision, mobility, or cognitive impairments. If you are a job seeker with a disability, or assisting a person with a disability, and require accessibility assistance or an accommodation to apply for one of our jobs, please submit a request by telephone at 1-855-471-2255*. Please include your contact information and specific details about your required accommodation to support you during the job application process.\n \n  This telephone line is reserved solely for job seekers with disabilities requiring accessibility assistance or an accommodation in the job application process. Messages left for other purposes, such as not being able to get into the career website, following up on an application, or other non-disability related technical issues will not receive a response.\n \n \n  Compensation and Benefits The salary range estimated for this position based in New York is $63,900.00\u2013$95,850.00.\n \n  This position may also be eligible to receive a variable annual bonus based on company, team, and/or individual performance results in accordance with company policy. We offer a comprehensive Total Rewards package that our U.S. colleagues and their families can count on, which includes:\n \n   A choice of national medical and dental plans, and a national vision plan, including health incentive programs\n   Employee assistance and family support programs, including commuter benefits and tuition reimbursement\n   At least 120 hours paid time off (PTO), 10 paid holidays annually, paid parental leave (3 weeks for bonding and 8 weeks for caregiver leave), accident and life insurance, and short- and long-term disability in accordance with company policy\n   Retirement and savings programs, such as our competitive 401(k) U.S. retirement savings plan\n   Employees\u2019 Stock Purchase Plan (ESPP) offers eligible colleagues the opportunity to purchase company stock at a discount\n \n \n  For more information on our benefits, please visit: https://jobs.thermofisher.com/global/en/total-rewards"
}