{
    "id": "ed0a9db256048b35",
    "company": "Queensway Carleton Hospital",
    "positionName": "Director, Quality, Patient Relations & Safety, IPAC",
    "jobType": [],
    "location": "3045 Baseline Road, Ottawa, ON",
    "salary": null,
    "postingDateParsed": "2023-11-29T20:13:47.884Z",
    "url": "https://www.indeed.ca/rc/clk?jk=ed0a9db256048b35&from=jasx&tk=1hgol0erci16u800&vjs=3",
    "externalApplyLink": "https://erecruiter.qch.on.ca/default.aspx?REQ_ID=13162",
    "job_info_group": {
        "extracted_phone_numbers": [],
        "extracted_links": [
            "HTTP/HTTPS Links",
            "General Links",
            "WWW Links",
            "TLDs"
        ],
        "extracted_emails": [
            "opfeffer@boyden.com"
        ],
        "extracted_location_data": [
            "fast-growing west Ottawa",
            "Canada",
            "Ottawa",
            "the Ottawa Valley"
        ],
        "extracted_dates": [
            "2021"
        ],
        "extracted_languages": [],
        "extracted_laws": [],
        "extracted_norps": [],
        "extracted_orgs": [
            "Queensway Carleton Hospital",
            "Project Management Professional Designation",
            "Newsweek's World's Best Hospitals Survey",
            "progressive Quality Care Initiatives",
            "Mental Health",
            "Critical Care Services",
            "Change Management (PROSCI",
            "Patient Relations & Safety",
            "Rehabilitation, Medical and Surgical Services",
            "QCH"
        ],
        "extracted_persons": [
            "Olivia Pfeffer"
        ],
        "extracted_products": [],
        "extracted_money": [
            {
                "amount": "16",
                "noun_phrases": []
            }
        ],
        "processed_text": "General Posting Information Director Quality IPAC Queensway Carleton Hospital Location . locate QCH care . bed secondary referral centre offer diverse program service Emergency Childbirth Geriatrics . exemplary team + health care professional dedicate provide expert care patient family recognize hospital . seek Director Quality IPAC . report Vice President Patient Care Chief Nurse Executive Director strategically direct planning development implementation maintenance evaluation QCH quality improvement quality assurance risk management client clinical education infection prevention control IPAC program . Director key liaison relationship builder hospital lead participate internal external committee task force network multidisciplinary project team . ideal master prepared bring minimum year' healthcare leadership combine demonstrate oversight leadership . benefit deep knowledge strategic planning datum analysis method risk management knowledge demonstrate skill lead transformative change ensure QCH's commitment deliver exceptional quality patient safety deliver . outstanding communicator strategic analytical continuous improvement skill conceptual thinking technological orientation great convey expertise advice senior leader . proactive progressive courageous emotionally intelligent resilient term peer describe . bias action excel practical transparent evidence inform decision building lead high function team . PMP certification asset demonstrable knowledge microbiology epidemiology infection prevention control principle . play exciting leadership role drive initiative advance QCH's culture patient safety ensure quality care remain forefront operation . apply position visit . information contact state title position subject mail . applicant interest consideration role contact ."
    },
    "companyDescription": "",
    "description": "General Posting Information\n \n \n  \n    \n    \n   Director, Quality, Patient Relations \n   & Safety, IPAC \n    Queensway Carleton Hospital \n    Location: Ottawa, ON. \n    Located in fast-growing west Ottawa, Queensway Carleton Hospital (QCH) cares for more than 500,000 each year. With 264 beds, QCH is the secondary referral centre for the Ottawa Valley and offers diverse programs and services such as Emergency, Childbirth, Geriatrics, Mental Health, Rehabilitation, Medical and Surgical Services, and Critical Care Services. Its exemplary team of 2,500+ health care professionals have dedicated themselves to providing expert care that puts patients and families first and was recognized in Newsweek\u2019s World\u2019s Best Hospitals Survey in 2021 as the #1 hospital in Ottawa, #16 in Canada. \n    QCH is seeking its next Director, Quality, Patient Relations & Safety, IPAC. \n    Reporting to the Vice President, Patient Care and Chief Nurse Executive, the Director strategically directs the planning, development, implementation, maintenance, and evaluation of the QCH quality improvement, quality assurance, risk management, client experience, clinical education and infection prevention and control (IPAC) programs. To do so the Director acts a key liaison and relationship builder across the hospital, leading and participating on various internal and external committees, task forces, networks and multidisciplinary project teams. \n    As an ideal candidate, you are Masters prepared and bring a minimum of five years\u2019 healthcare leadership experience combined with demonstrated oversight and leadership of progressive Quality Care Initiatives. QCH will benefit from your deep knowledge and experience in strategic planning, data analysis methods and risk management knowledge and your demonstrated skill in leading transformative change that will ensure that QCH\u2019s commitment to deliver exceptional quality, patient safety and experience is delivered. You are an outstanding communicator whose strategic, analytical, continuous improvement skills, conceptual thinking and technological orientation have been of great value in conveying your expertise and advice to senior leaders. Proactive, progressive, courageous, emotionally intelligent, and resilient are all terms that peers would use to describe you. You have a bias to action and excel at making practical, transparent and evidence informed decisions and in building and leading high functioning teams. A Project Management Professional Designation (PMP) or Change Management (PROSCI or other) certification is an asset as is demonstrable knowledge of microbiology, epidemiology, infection prevention and control principles. \n    Play an exciting leadership role in driving initiatives to advance QCH\u2019s culture of patient safety, ensuring that quality care remains at the forefront of all operations. To apply for this position, please visit: boyden.thriveapp.ly/job/2262. For more information, please contact Olivia Pfeffer at opfeffer@boyden.com and state the title of the position in the subject line of your e-mail. \n    We thank all applicants for their interest, however only those under consideration for the role will be contacted."
}