{
    "id": "ee9f050e03d4aec1",
    "company": "Greenbelt Family Health Team",
    "positionName": "Primary Care Nurse Practitioner",
    "jobType": [
        "Permanent",
        "Part-time",
        "Full-time"
    ],
    "location": "3500 Fallowfield Road, Ottawa, ON",
    "salary": null,
    "postingDateParsed": "2024-01-06T03:12:26.868Z",
    "url": "https://www.indeed.ca/rc/clk?jk=ee9f050e03d4aec1&from=jasx&tk=1hjm39h30jroo800&vjs=3",
    "externalApplyLink": null,
    "job_info_group": {
        "extracted_phone_numbers": [],
        "extracted_links": [
            "HTTP/HTTPS Links",
            "General Links",
            "WWW Links",
            "TLDs"
        ],
        "extracted_emails": [],
        "extracted_location_data": [
            "Ontario",
            "Barrhaven"
        ],
        "extracted_dates": [
            "Monday to Friday",
            "1 year",
            "2024-02-05"
        ],
        "extracted_languages": [],
        "extracted_laws": [],
        "extracted_norps": [
            "French"
        ],
        "extracted_orgs": [
            "Social Worker",
            "Treatment, Management and Planning \u00b7 Provides",
            "Registered Nurses",
            "Nursing Primary Health Care Nurse Practitioners Program Baccualaureate of Science in Nursing Registration",
            "the RNAO",
            "Vision care Flexible Language Requirement",
            "Nurse Practitioners",
            "The Greenbelt Family Health Team",
            "the College of Nursess"
        ],
        "extracted_persons": [
            "the GFHT"
        ],
        "extracted_products": [],
        "extracted_money": [
            {
                "amount": "60.00-$66.00",
                "noun_phrases": []
            }
        ],
        "processed_text": "bring group physician allied health professional include Dietician Psychologists deliver high quality primary care resident surround community . duty include . assessment \u00b7 scope practice NP perform comprehensive health symptom direct assessment synthesize datum multiple source diagnosis health care team \u00b7 \u00b7 collaboratively consultation physician specialist define NP scope practice expectation consultation physician \u00b7 medical directive establish approve \u00b7 case management care path model chronic illness management continuum care \u00b7 determine order form approve list interpret result screening diagnostic laboratory imaging test scope practice \u00b7 complete accurate legible timely record patient's visit provide information assist practitioner continue patient's care \u00b7 sees patient clinic schedule urgent appointment . advanced nursing care treatment include pharmacological complementary therapy counseling intervention health problem . \u00b7 monitor ongoing therapy patient chronic stable illness provide effective pharmacological complementary counseling intervention \u00b7 prescribes drug include Schedules Regulations treat disease disorder NP scope practice \u00b7 collaborate physician health care provider develop discuss appropriate individualized care plan patient family caregiver base good practice \u00b7 document patient health record refer arrange follow \u00b7 implement strategy promote health prevent disease individual family \u00b7 target strategy foster independent healthy lifestyle chronically ill medical population \u00b7 ensure encounter form statistic record participate analysis . education \u00b7 help patient identify health resource \u00b7 involve patient decision health \u00b7 encourage patient action health \u00b7 initiate health education activity assist promote support patient strive achieve high level health qualification master degree recognize university program rn ec current membership evidence liability insurance demonstrate primary care set knowledge proficiency current evidence base method practice primary care delivery Superior organization mangement skill prior electronic medical record deomonstrate team type permanent salary hour benefit company pension Dental care insurance Extended health care Life insurance site parking Paid require Schedule nursing preferred location person expect start"
    },
    "companyDescription": "",
    "description": "About us\nThe Greenbelt Family Health Team brings a group of 16 physicians working together with allied health professionals including Registered Nurses, Nurse Practitioners, Social Worker, Dietician and Psychologists delivering high quality primary care to the residents of Barrhaven and surrounding communities.\nDuties Include: \n1. Assessment\n\u00b7 Working within the scope of practice of an NP s/he performs a comprehensive health or symptom directed assessment and synthesizes data from multiple sources to make a diagnosis, as part of the health care team\n\u00b7\u00b7 Works collaboratively and in consultation with the physicians and specialists as defined in the NP scope of practice \u201cExpectation for consultation with physicians\u201d\n\u00b7 Works within medical directives as established and approved by the GFHT\n\u00b7 Uses case management and a care path model for chronic illnesses management in the continuum of care\n\u00b7 Determines the need for and orders form an approved list and interprets the results of screening and diagnostic laboratory and imaging tests within the scope of practice\n\u00b7 Keeps complete, accurate, legible and timely records of patient\u2019s visits, which will provide information to assist other practitioners in continuing the patient\u2019s care\n\u00b7 Sees patients at the clinic with scheduled and urgent appointments,\n2. Treatment, Management and Planning\n\u00b7 Provides advanced nursing care and treatment (including pharmacological complementary therapies and/or counseling interventions for health problem.\n\u00b7 Monitors the ongoing therapy of patients with chronic stable illness by providing effective pharmacological, complementary, or counseling interventions\n\u00b7 Prescribes drugs included in the Schedules of the Regulations to treat diseases or disorders within the NP scope of practice\n\u00b7 Collaborates with physicians and other health care providers to develop and discuss appropriate individualized care plan with the patient/family caregiver based on best practices\n\u00b7 Documents using patient health records, refers to and arranges follow-up as necessary\n\u00b7 Implements strategies to promote health and prevent disease with individuals, families\n\u00b7 Targets strategies to foster independent and healthy lifestyles with the chronically ill medical population\n\u00b7 Ensures that encounter forms and other statistics have been recorded and participates in their analysis\n3. Education\n\u00b7 Help patients to identify and use health resources\n\u00b7 Involve patients in decisions about their own health\n\u00b7 Encourage patients to take action for their own health\n\u00b7 Initiate health education and other activities that assist, promote and support patients as they strive to achieve the highest level of health\nQualifications:\n\n Masters degree from a recognized university program in Nursing Primary Health Care Nurse Practitioners Program\n Baccualaureate of Science in Nursing\n Registration with the College of Nursess of Ontario as an RN(EC)\n Current membership with the RNAO and evidence of liability insurance\n Demonstrated experience in a primary care setting\n Knowledge and proficiency in current, evidence-based methods and practices of primary care delivery\n Superior organization and time mangement skills\n Prior experience with an electronic medical records\n Deomonstrated ability to work a part of a team\n\nJob Types: Full-time, Part-time, Permanent\nSalary: $60.00-$66.00 per hour\nBenefits:\n\n Company pension\n Dental care\n Disability insurance\n Extended health care\n Life insurance\n On-site parking\n Paid time off\n Vision care\n\nFlexible Language Requirement:\n\n French not required\n\nSchedule:\n\n Monday to Friday\n\nExperience:\n\n Nursing: 1 year (preferred)\n\nWork Location: In person\nExpected start date: 2024-02-05"
}