{
    "id": "aaf025f41f0379e0",
    "company": "ACT Learning Centre",
    "positionName": "Classroom Facilitator",
    "jobType": [
        "Full-time"
    ],
    "location": "2713 Lancaster Road, Ottawa, ON",
    "salary": null,
    "postingDateParsed": "2024-01-26T12:13:40.986Z",
    "url": "https://www.indeed.ca/rc/clk?jk=aaf025f41f0379e0&from=jasx&tk=1hl5dd1pui7nm800&bb=NiGljfghLwyJxtbyZy8vsyNV3Ej1Xh-QP1DPCqFVNRWh-fQkJMAK8OHLfClXfoewOQdk66KZrj0WLvpMR27B24io1QiFsyloJTucV2gaFiVukEantu1fPg%3D%3D&xkcb=SoAl67M3FlS757AVJj0ObzkdCdPP&vjs=3",
    "externalApplyLink": null,
    "job_info_group": {
        "extracted_phone_numbers": [],
        "extracted_links": [
            "HTTP/HTTPS Links",
            "General Links",
            "WWW Links",
            "TLDs"
        ],
        "extracted_emails": [],
        "extracted_location_data": [
            "2713 Lancaster Rd",
            "Ottawa"
        ],
        "extracted_dates": [
            "six months",
            "1 year",
            "Monday"
        ],
        "extracted_languages": [],
        "extracted_laws": [],
        "extracted_norps": [],
        "extracted_orgs": [
            "the cutting-edge, government-funded Entry to School Program",
            "ABA",
            "(e.g., DSW, CYW",
            "Communication",
            "the MCCSS-funded Entry to School Program",
            "Ontario's Human Rights Code",
            "The Entry to School Program",
            "Early Childhood Education",
            "the Accessibility of Ontarians with Disabilities Act",
            "CDA",
            "SSW",
            "ACT Learning Centre"
        ],
        "extracted_persons": [],
        "extracted_products": [],
        "extracted_money": [],
        "processed_text": "posting Classroom Facilitator MCCSS fund program entry School join Team Learning Centre leading edge dynamic multidisciplinary practice . multidisciplinary team speech language pathologist occupational therapist mental health consultant board certify behaviour analyst communicative disorder assistant occupational therapy assistant early childhood educator registered behaviour therapist provide exceptional service child youth autism developmental disorder delay family . local provider school readiness program child Autism Spectrum . focus help child develop school readiness skill key area . play social interaction functional routine behaviour management pre academic learning attention . program consist group base learning program completion group base program child proceed second program transition support enter school . program deliver multidisciplinary model service include classroom team early childhood educator communicative disorder assistant occupational therapy assistant behavioural therapist . classroom team classroom facilitator receive weekly consultation coaching supervisory team consist Occupational Therapist Speech Language Therapist Board certify Behavioural Analyst . excited expansion Entry School Program seek qualified classroom Classroom Facilitator follow location Key Responsibilities \u00b7 prepare classroom environment learner include environmental setup visual equipment toy material . \u00b7 implement modify curriculum appropriate learner direction supervisory team . \u00b7 engage interact learner developmental level . \u00b7 collaborate supervisory team share information learner' functional level area concern . \u00b7 support learner daily activity . i.e. care routine transition access learn . \u00b7 ensure safe learning environment learner \u2013 cleaning process place follow . \u00b7 manage challenge behaviour support supervisory team's recommendation . \u00b7 creatively problem solve classroom team support engagement regulation access classroom activity . \u00b7 actively participate activity hour program lead activity support learner . physical movement require . \u00b7 bring forward clinical question concern area training site manager supervisory team . \u00b7 participate professional development . \u00b7 month transition portion program classroom facilitator second private practice coverage ota SLPA . \u00b7 change nature requirement duty responsibility add delete . qualification Requirements Employment \u00b7 minimum autistic child youth . \u00b7 degree diploma Communication Disorders Assistant Occupational Therapy Disorders Assistant OTA autism behavioural science ABA therapist relate field University Degree child relate field study \u00b7 knowledge neurodiversity neuro affirm practice \u00b7 strong communication skill \u00b7 collaboratively multidisciplinary team . \u00b7 comfortable technology include video conferencing technology training provide \u00b7 lift sit floor extended period engage unusual physical movement kneeling crouch . \u00b7 actively participate program participant hour interval . \u00b7 satisfactory vulnerable sector check \u00b7 proof completion series covid vaccination Learning Centre \u00b7 school readiness program fund OAP \u00b7 paid continue education \u00b7 competitive salary benefit package \u00b7 Free Parking PPE provide covid protocol strictly adhere . proof vaccination covid variant condition hire . accommodation grant legitimate medical exemption exemption recognize . official documentation provide evidence vaccination status exemption . commit create diverse environment equal employer . qualified applicant receive consideration employment ethnicity race colour religion gender gender identity expression sexual orientation nation origin genetic age veteran status . comply AODA . accommodation request aspect selection process . type benefit dental care extended health care Vision care Schedule Friday autistic child youth require location person"
    },
    "companyDescription": "ACT is a an Ottawa autism therapy centre founded to provide evidence-based, innovative and leading-edge assessment and intervention for children, youth, and adults with autism spectrum disorder, developmental delays or developmental disabilities. Therapies are offered by ACT\u2019s highly trained staff both in our clinic or in your home.",
    "description": "Job Posting: Classroom Facilitator\nMCCSS funded program: Entry to School\nJoin Our Team!\nACT Learning Centre is a leading-edge, dynamic, multidisciplinary practice in Ottawa. We are a multidisciplinary team of speech-language pathologists, occupational therapists, mental health consultants, board-certified behaviour analysts, communicative disorders assistants, occupational therapy assistants, early childhood educators and registered behaviour therapists providing exceptional services to children and youth with autism, or other developmental disorders/delays and their families.\nACT is the local provider of the cutting-edge, government-funded Entry to School Program, a school readiness program for children on the Autism Spectrum. The Entry to School Program is focused on helping children develop school-readiness skills in six key areas. (Communication, play, social interaction, functional routines, behaviour self-management, pre-academic learning and attention). The program consists of two parts, a group-based learning program for six months and upon completion of the first group-based part of the program, the children will proceed to the second part of the program which is transition support as they enter school. The program is delivered through a multidisciplinary model of service which includes a classroom team of early childhood educators, communicative disorder assistants, occupational therapy assistants and behavioural therapists. The classroom team (classroom facilitators) receive weekly consultation and coaching from a supervisory team, which consists of an Occupational Therapist, a Speech and Language Therapist and a Board-Certified Behavioural Analyst.\nWe are excited to announce the expansion of our Entry to School Program and are seeking a qualified candidate to work in the classroom as a Classroom Facilitator at the following location:\n2713 Lancaster Rd, Ottawa, ON\nKey Responsibilities\n\u00b7 Prepare classroom environment for learners (includes environmental setup, use of visuals, equipment, toys, materials).\n\u00b7 Implement and modify curriculum, as appropriate, for learners under the direction of the supervisory team.\n\u00b7 Engage/interact with learners at their developmental level.\n\u00b7 Collaborate with the supervisory team to share information on learners\u2019 functional levels and areas of concern.\n\u00b7 Support learners in all daily activities as needed. (i.e., self-care routines, transitions, and accessing learning opportunities).\n\u00b7 Ensure a safe learning environment for learners \u2013 cleaning processes in place and followed.\n\u00b7 Manage challenging behaviour with the support of the supervisory team\u2019s recommendations.\n\u00b7 Creatively problem-solve with the classroom team to support engagement, regulation, and access to classroom activities.\n\u00b7 Actively participate in all activities throughout the 3-hour program, by leading activities and/or supporting the learners. Physical movement is required.\n\u00b7 Bring forward clinical questions, concerns and/or areas of need for training to the site manager and supervisory team.\n\u00b7 Participate in professional development opportunities.\n\u00b7 During the 6-month transition portion of the program, classroom facilitators may be seconded to private practice for coverage in ABA, OTA and SLPA.\n\u00b7 Because of the changing nature of the job and the job requirements, duties and responsibilities may be added or deleted from time to time.\nQualifications and Requirements of Employment\n\u00b7 Minimum 1 year experience working with autistic children or youth.\n\u00b7 A degree/diploma in Early Childhood Education, Communication Disorders Assistant (CDA), Occupational Therapy Disorders Assistant (OTA), Autism and behavioural science (ABA therapist) or related field (e.g., DSW, CYW, SSW) or a University Degree in child-related field of study\n\u00b7 Knowledge of neurodiversity and neuro-affirming practices\n\u00b7 Strong communication skills\n\u00b7 Ability to work collaboratively with multidisciplinary team members.\n\u00b7 Comfortable with technology, including video conferencing technology (training would be provided)\n\u00b7 Ability to lift at least 30lbs, sit on the floor for extended periods of time and engage in unusual physical movement such as kneeling and crouching.\n\u00b7 Ability to actively participate in programming with participants for up to three-hour intervals.\n\u00b7 Satisfactory Vulnerable Sector Check\n\u00b7 Proof of a completion of series of COVID-19 vaccinations\nWhy Work at ACT Learning Centre?\n\u00b7 Opportunity to work in the MCCSS-funded Entry to School Program, a school readiness program funded under the OAP\n\u00b7 Paid continuing education opportunities\n\u00b7 Competitive salary and benefits package\n\u00b7 Free Parking\nAll PPE is provided by ACT Learning Centre and COVID protocols are strictly adhered to. Proof of full vaccination for COVID-19 and its variants is a condition of hiring. Accommodation may be granted to those who have a legitimate medical exemption or other exemptions recognized under Ontario's Human Rights Code. Official documentation must be provided as evidence of vaccination status or exemption.\nACT Learning Centre is committed to creating a diverse environment and is proud to be an equal-opportunity employer. All qualified applicants will receive consideration for employment regardless of ethnicity, race, colour, religion, gender, gender identity or expression, sexual orientation, nation of origin, genetics, disability, age, or veteran status.\nACT Learning Centre complies with the Accessibility of Ontarians with Disabilities Act (AODA). Accommodations are available on request for candidates taking part in all aspects of the selection process.\nJob Type: Full-time\nBenefits:\n\n Dental care\n Extended health care\n Vision care\n\nSchedule:\n\n Monday to Friday\n\nExperience:\n\n working with autistic children and youth: 1 year (required)\n\nWork Location: In person"
}