{
    "id": "a67edb388602747f",
    "company": "Accreditation Canada",
    "positionName": "Operations Coordinator",
    "jobType": [],
    "location": "1150 Cyrville Road, Ottawa, ON",
    "salary": null,
    "postingDateParsed": "2024-01-20T05:08:41.860Z",
    "url": "https://www.indeed.ca/rc/clk?jk=a67edb388602747f&from=jasx&tk=1hkik8vp5k633800&bb=3fcFSWL0Q64YUe5hx9GNduHg1EhUQ-RcxbpD9r-ILoqbINvRP8Dq4eeLhfjhf__VkpEsc1nbmxSFgZBliGakQSf8G5S89KLKME3eSOJbuQagz1PgbkPmxw%3D%3D&xkcb=SoCs67M3FSgsJ0AB1z0IbzkdCdPP&vjs=3",
    "externalApplyLink": "https://can232.dayforcehcm.com/CandidatePortal/en-US/healthstandards/Posting/View/844",
    "job_info_group": {
        "extracted_phone_numbers": [],
        "extracted_links": [
            "HTTP/HTTPS Links",
            "General Links",
            "WWW Links",
            "TLDs"
        ],
        "extracted_emails": [
            "recruitment@healthstandards.org",
            "HumanResources@healthstandards.org"
        ],
        "extracted_location_data": [
            "recruitment@healthstandards.org"
        ],
        "extracted_dates": [
            "2022",
            "2023",
            "Your First 30-90 Days",
            "the year",
            "2-4 years",
            "last week of December",
            "65 years"
        ],
        "extracted_languages": [],
        "extracted_laws": [],
        "extracted_norps": [
            "Indigenous Peoples",
            "spoken French"
        ],
        "extracted_orgs": [
            "Human Resources",
            "Employment Equity",
            "HumanResources@healthstandards.org",
            "the Enterprise",
            "Indigenous Peoples",
            "HSO",
            "the Institute for Quality Management in Healthcare",
            "HSO's Global Programs Team",
            "UAT",
            "Accreditation Canada",
            "Develop"
        ],
        "extracted_persons": [],
        "extracted_products": [],
        "extracted_money": [],
        "processed_text": "term permanent salary commensurate location Hybrid Model role Operations Coordinator . Global Programs content development business unit create hso standard assessment program quality improvement solution . role Operations Coordinator team unique serve digital liaison closely HSO onboardqi team . onboardqi team responsible design develop deliver onboardqi HSofs digital platform support accreditation enterprise programming . role Operations Coordinator collaboratively team department produce quality material internal external stakeholder . role enjoy juggle multiple priority creatively solution problem close knit team . prioritize manage . Main responsibility support team's engagement internal external stakeholder session prepare briefing material meeting agenda meet follow meet action item . track stakeholder feedback organized structured documentation allow easy identification client improvement . support development training material product resource formatting quality assurance Quality Assurance . document update standard operating procedure Standard Operating Procedures . operational support internal external audience . Conduct User Acceptance Testing feature program release . qualification university degree college diploma . progressive administrative . communicate effectively verbally write demonstrate build positive relationship internal external stakeholder vendor client . desire qualification proficient strong oral communication . familiar health care environment understand people sector . expect complete orientation program hire learn trust inclusion collaboration innovation learning mission quality improvement healthcare social service . set performance learn objective collaboration people manager . meet regularly people manager discuss learning progression alignment accountability . assign initiative project role . offer hybrid model . competitive compensation benefit include define benefit pension plan . program include office shutdown . professional development support . culture measure psychological safety inclusion engagement . Health Standards Organization HSO affiliate AC IQMH global profit organization . develop standard deliver assessment program quality improvement solution adopt location continent . people center program service set bar quality health ecosystem . join future lead . follow mission empower enable people continuously improve quality care . hso commit foster culture inclusion diversity equity access employee feel respected equal achieve success . encourage application people diverse race ethnicity religion person people gender diverse community people intersectional identity . support recruiting process include provision accommodation request . National Capital Region's Employers . equal employer committed principle . encourage qualified application gender include visible minority person . applicant interest select interview contact . accommodation request aspect selection process . request accommodation email . query relate recruitment email ."
    },
    "companyDescription": "",
    "description": "Terms: Full-time permanent \n  \n  \n   Salary: Commensurate with experience\n   \n  \n    Location: Ottawa (Hybrid Work Model)\n  \n   \n   \n  \n    ABOUT THE ROLE:\n  \n   \n   \n  \n    The Operations Coordinator is a member of HSO\u2019s Global Programs Team. Global Programs, the content development business unit of the Enterprise, creates HSO standards, assessment programs and quality improvement solutions. The role of the Operations Coordinator along with their immediate team, is unique and serves as a digital liaison, working closely with the HSO OnboardQi team. The OnboardQi team is responsible for designing, developing, and delivering OnboardQi, HSO\u2019s new digital platform to support accreditation and other Enterprise programming.\n  \n   \n   \n  \n  \n   In this role, the Operations Coordinator will be working collaboratively with other team members and departments to produce quality materials for our internal and external stakeholders. The role is right for you if you enjoy juggling multiple priorities, creatively coming up with solutions to problems that arise and working within a close-knit team. You must be able to prioritize and manage your time well.\n  \n   \n   \n  \n  \n   Main Responsibilities:\n  \n   \n   \n   \n   Support the team\u2019s engagement with internal and external stakeholder sessions by preparing briefing materials, meeting agendas, meeting minutes and following up on meeting action items. \n   Track stakeholder feedback into organized, structured documentation to allow for easy identification of client value and improvements. \n   Support the development of training material and product resources through formatting, quality assurance (QA), etc. \n   Develop, document and update standard operating procedures (SOPs). \n   Act as back-up for operational support for internal and external audiences. \n   Conduct User Acceptance Testing (UAT) for new features and program releases.\n  \n   \n   \n  \n    Must Have Qualifications:\n  \n   \n   \n   \n   University degree or college diploma. \n   2-4 years of progressive administrative experience. \n   Ability to communicate effectively verbally and in writing Demonstrated experience in building positive relationships with internal and external stakeholders, vendors and clients.\n  \n   \n   \n  \n    Desired Qualifications:\n  \n   \n  \n    \n  \n  \n   Proficient in spoken French with strong oral communication abilities. \n   Are familiar with a health care environment and understand the needs of people working in this sector.\n  \n   \n   \n  \n    WHAT YOU CAN EXPECT:\n  \n   \n   \n  \n    In Your First 30-90 Days:\n  \n   \n   \n  \n  \n   Complete our orientation program with other new hires to learn about HSO, our values of trust, inclusion, collaboration, innovation and learning, and our mission of quality improvement in healthcare and social services. \n   Set your performance and learning objectives for the year in collaboration with your people manager. \n   Meet regularly with your people manager to discuss your learning progression and alignment for your accountabilities. \n   Take on assigned initiatives or projects for your role.\n  \n   \n   \n  \n    What We Can Offer \n   To You\n   :\n  \n   \n  \n    \n  \n  \n   Hybrid work model. \n   Competitive compensation and benefits, including a defined benefit pension plan. \n   Time off programs, including office shutdown during last week of December. \n   Professional development support. \n   A culture that measures and values psychological safety, inclusion and engagement.\n  \n   \n   \n  \n    WHO WE ARE AND WHAT WE DO:\n  \n   \n   \n   Health Standards Organization (HSO) and our affiliates Accreditation Canada (AC) and the Institute for Quality Management in Healthcare (IQMH) are global, not-for-profit organizations. Together, we develop standards and deliver assessment programs and quality improvement solutions that have been adopted in over 12,000 locations across five continents. Our people-centered programs and services have been setting the bar for quality across the health ecosystem for 65 years. \n  Join us toward a future that will lead to \u201cSafer Care and A Healthier World.\u201d Let\u2019s follow a mission together, where we \u201cempower and enable people around the world to continuously improve quality of care.\u201d \n   HSO is committed to fostering a culture of inclusion, diversity, equity and access, where all employees feel respected and valued and have an equal opportunity to achieve success. We encourage applications from Indigenous Peoples, people from diverse races, ethnicities and/or religions, persons with disabilities, people from gender diverse communities and/or people with intersectional identities. Please let us know how we can support you throughout the recruiting process, including through the provision of accommodations on request. \n   We are also proud to have been named as one of the Top 100 National Capital Region\u2019s Top Employers in 2022 and 2023. \n   \n \n \n  \n   \n    We are equal opportunity employer and are committed to the principles of Employment Equity. We encourage qualified applications from all genders, including visible minorities, Indigenous Peoples, and persons with disabilities. We thank all applicants for their interest; only those selected for an interview will be contacted. Accommodations are available on request for candidates taking part in all aspects of the selection process. To request accommodation, please email HR at HumanResources@healthstandards.org. For any queries related to recruitment please email at recruitment@healthstandards.org."
}