{
    "id": "d9677213f62a3ce5",
    "company": "Ciena",
    "positionName": "Senior Information Developer - Technical Writer",
    "jobType": [
        "Full-time"
    ],
    "location": "Ottawa, ON",
    "salary": null,
    "postingDateParsed": "2024-01-04T03:15:08.488Z",
    "url": "https://www.indeed.ca/rc/clk?jk=d9677213f62a3ce5&from=jasx&tk=1hjm3egi6irr6800&vjs=3",
    "externalApplyLink": "https://careers.ciena.com/us/en/job/CIENUSR024333ENUS/Senior-Information-Developer-Technical-Writer?utm_source=indeed&utm_medium=phenom-feeds",
    "job_info_group": {
        "extracted_phone_numbers": [],
        "extracted_links": [
            "HTTP/HTTPS Links",
            "General Links",
            "WWW Links",
            "TLDs"
        ],
        "extracted_emails": [],
        "extracted_location_data": [
            "nos \u00e9quipes des primes et des salaires comp\u00e9titifs",
            "Simplement"
        ],
        "extracted_dates": [],
        "extracted_languages": [],
        "extracted_laws": [],
        "extracted_norps": [],
        "extracted_orgs": [
            "d\u00e9veloppement de documentation",
            "Chez Ciena",
            "des guides d'utilisation",
            "senior Product Line Management",
            "et eXtensible Markup Language",
            "Product Verification, System Network Engineering",
            "destin\u00e9e aux clients dans",
            "Ciena",
            "nous sommes une",
            "Adobe FrameMaker",
            "des fiches techniques de produits, des cartes de registre",
            "the Ciena Technical Publications",
            "SW & HW Design",
            "y compris l'aide contextuelle sur le produit",
            "(SoC",
            "Microsoft Office",
            "n\u0153uds \u00e0 petit facteur de forme",
            "la conception logicielle et mat\u00e9rielle",
            "Recommander et mettre en \u0153uvre de nouvelles m\u00e9thodes et de nouveaux formats de documentation qui r\u00e9pondent aux exigences techniques",
            "sein d'une \u00e9quipe mondiale de gens innovateurs et de g\u00e9nies des affaires",
            "multim\u00e9dias et sur le Web",
            "la conception de circuits int\u00e9gr\u00e9s \u00e0 application sp\u00e9cifique",
            "an Equal Opportunity Employer",
            "Customer Support",
            "ASIC",
            "(EDK",
            "EDA"
        ],
        "extracted_persons": [
            "Exp\u00e9rience avec l'architecture darwinienne de typage",
            "des programmes de b\u00e9n\u00e9volat dans",
            "Exp\u00e9rience avec les syst\u00e8mes de gestion documentaire",
            "documentation sur les produits de Ciena",
            "\u00cates-vous la personne dynamique et polyvalente qui se joindra \u00e0 l'\u00e9quipe de conception de la",
            "Collaborer avec des \u00e9quipes interfonctionnelles telles que la",
            "Planifier",
            "DITA",
            "Responsabilit\u00e9s Vous devrez",
            "Rechercher",
            "Produire une documentation sur les produits et une aide en ligne claire",
            "Exp\u00e9rience de travail avec des \u00e9quipes multiculturelles et g\u00e9ographiquement dispers\u00e9es",
            "l'ing\u00e9nierie des r\u00e9seaux de syst\u00e8mes"
        ],
        "extracted_products": [
            "EDK",
            "d'Adobe FrameMaker",
            "Ciena"
        ],
        "extracted_money": [],
        "processed_text": "committed people philosophy . team enjoy culture focus prioritize personalized flexible environment empower individual's passion growth wellbeing belonging . technology company lead humanity \u2014 drive business priority alongside meaningful social community societal impact . achieve ideal career forefront innovation . life employee enjoy flexible pay freedom remotely . empower team competitive salary incentive community volunteer program professional development resource support mental physical health \u2014 diverse inclusive culture . simply technology company drive humanity . dynamic versatile Senior Information Developer join Ciena Product Documentation Development organization contribute evolution development maintenance key Ciena business earn respect brilliant colleague multiple zone global team innovator business genius responsibility apply judgment perform function plan build develop write edit update variety software hardware customer technical publication product datasheet register map user guide reference manual guide Application Programming Interface reference manual system chip SoC product offering . research translate technical information multimedia web base document include product context sensitive help technical technical user . recommend implement documentation method format serve satisfy technical customer requirement . produce product documentation online help clear concise compliant documentation quality assurance standard . collaborate cross functional team include ASIC design marketing personnel . send persuasive resume highlight SoC design documentation development small form factor nod semiconductor FPGA design . proficiency Microsoft Office suite DITA Content Management System CCMS document management system interworke eXtensible Markup Language software development environment agile development process include development customer documentation agile environment excellent communication interpersonal organizational skill . multicultural geographically disperse team . _ _ _ _ _ _ _ _ _ _ _ _ _ _ _ _ _ _ _ _ _ _ _ _ _ _ _ _ _ _ _ _ _ _ _ _ _ _ _ _ _ _ _ _ _ _ _ _ _ _ _ _ _ _ _ _ _ _ _ _ _ _ _ _ _ _ _ _ _ _ _ _ _ _ _ _ _ Developpeur d'information principal \u2013 Redacteur technique Developpeuse d'information principale \u2013 Redactrice technique realisez votre ideal carriere pointe l'innovation grace . vie dehors du travail est importante pour nous c'est pourquoi notre personnel beneficie conges payes flexible liberte travailler distance . nous offron communaute des ressources developpement professionnel soutien sante mentale physique tout dans cadre d'une culture diverse inclusive . . Pouvez vous contribuer l'evolution conception maintenance des publication technique Ciena sont essentielles ses activites Sauriez vous gagner respect collegues remarquable travaillant sur plusieurs fuseaux horaires au faire preuve d'experience discernement pour exercer les fonction du poste construire developper rediger editer mettre jour une variete publications technique logicielle materielle destinees aux client \u2013 par exemple des manuels reference des guide pour trousse developpement integree des manuel reference pour interface programmation d'application Application Programming Interface \u2013 pour l'offre produits systemes sur puce SoC Ciena . traduire des information technique dans des document pour des utilisateurs technique technique . celle des client . concise conforme aux normes documentation d'assurance qualite . direction des gammes produit ASIC verification des produit soutien clientele personnel du marketing . Envoyez nous Curriculum Vitae convaincant meet evidence les information suivantes conception systemes sur puce pour SFF . dans l'analyse exploratoire des donnees conception semi conducteur circuit integres application specifique ASIC reseaux portes programmable situ FPGA . Maitrise mode structure suite . d'information . Content Management System CCMS . . avec les processus developpement Agile compris l'elaboration documentation environnement Agile . Excellentes competence matiere communication relation interpersonnelle d'organisation . . LI WH1 LI Remote committed build foster environment employee feel respect hear . diversity workforce respect employee individual . tolerate form discrimination . include protect veteran status . contact relation advise accommodation measure require ."
    },
    "companyDescription": "",
    "description": "Ciena is committed to our people-first philosophy. Our teams enjoy a culture focused on prioritizing a personalized and flexible work environment that empowers an individual\u2019s passions, growth, wellbeing and belonging. We\u2019re a technology company that leads with our humanity\u2014driving our business priorities alongside meaningful social, community, and societal impact. \n \n Achieve your ideal career at the forefront of innovation with Ciena. We know the importance of life outside of work, which is why our employees enjoy flexible paid time off and the freedom of working remotely. Ciena empowers our teams with competitive salaries and incentives, community volunteer programs, professional development resources, and support for our mental and physical health\u2014all experienced within a diverse and inclusive culture. To put it simply, we\u2019re a technology company driven by our humanity.\n \n  Are you the dynamic and versatile Senior Information Developer who will join the Ciena Product Documentation Development organization?\n  Can you contribute to the evolution, development, and maintenance of the Ciena Technical Publications that are key to the Ciena business?\n  Can you earn the respect of brilliant colleagues, working across multiple time zones in a global team of innovators and business geniuses?\n  Responsibilities\n  You will need to apply experience and judgment to perform the functions of the job:\n \n   Plan, build, develop, write, edit, and update a variety of software and hardware customer technical publications (such as product datasheets, register maps, user guides, reference manuals, EDK guides, and API reference manuals) for Ciena's system-on-chip (SoC) product offering.\n   Research and translate technical information into multimedia and web-based documents (including on-product context-sensitive help) for non-technical and technical users.\n   Recommend and implement new documentation methods and formats that serve and satisfy technical and customer requirements.\n   Produce product documentation and online help that is clear, concise, and compliant to documentation and quality assurance standards.\n   Collaborate within cross-functional teams that include senior Product Line Management, SW & HW Design, ASIC design, Product Verification, System Network Engineering, Customer Support, and Marketing personnel.\n \n \n  Experience\n  Send us a persuasive resume that highlights:\n \n   Experience with SoC design and documentation development for small form factor nodes\n   Experience in semiconductor, EDA, ASIC, and/or FPGA design.\n   Proficiency with Adobe FrameMaker (Structured/XML) and Microsoft Office suite\n   Experience with DITA\n   Experience with CMS and CCMS document management systems\n   Experience interworking with XML software development environments\n   Experience with Agile development processes, including the development of customer documentation in an Agile environment\n   Excellent communication, interpersonal, and organizational skills.\n   Experience working with multicultural and geographically dispersed teams.\n \n  _____________________________________________________________________________\n \n  D\u00e9veloppeur d\u2019information principal \u2013 R\u00e9dacteur technique / D\u00e9veloppeuse d\u2019information principale \u2013 R\u00e9dactrice technique\n  R\u00e9alisez votre id\u00e9al de carri\u00e8re \u00e0 la pointe de l\u2019innovation gr\u00e2ce \u00e0 Ciena. La vie en dehors du travail est importante pour nous, c\u2019est pourquoi notre personnel b\u00e9n\u00e9ficie de cong\u00e9s pay\u00e9s flexibles et de la libert\u00e9 de travailler \u00e0 distance. Chez Ciena, nous offrons \u00e0 nos \u00e9quipes des primes et des salaires comp\u00e9titifs, des programmes de b\u00e9n\u00e9volat dans la communaut\u00e9, des ressources de d\u00e9veloppement professionnel et un soutien \u00e0 la sant\u00e9 mentale et physique, le tout dans le cadre d\u2019une culture diverse et inclusive. Simplement, nous sommes une entreprise de technologie anim\u00e9e par notre humanit\u00e9.\n  \u00cates-vous la personne dynamique et polyvalente qui se joindra \u00e0 l\u2019\u00e9quipe de conception de la documentation sur les produits de Ciena?\n  Pouvez-vous contribuer \u00e0 l\u2019\u00e9volution, \u00e0 la conception et \u00e0 la maintenance des publications techniques de Ciena qui sont essentielles \u00e0 ses activit\u00e9s?\n  Sauriez-vous gagner le respect de coll\u00e8gues remarquables, travaillant sur plusieurs fuseaux horaires au sein d\u2019une \u00e9quipe mondiale de gens innovateurs et de g\u00e9nies des affaires?\n  Responsabilit\u00e9s\n  Vous devrez faire preuve d\u2019exp\u00e9rience et de discernement pour exercer les fonctions du poste :\n \n   Planifier, construire, d\u00e9velopper, r\u00e9diger, \u00e9diter et mettre \u00e0 jour une vari\u00e9t\u00e9 de publications techniques logicielles et mat\u00e9rielles destin\u00e9es aux clients \u2013 par exemple, des fiches techniques de produits, des cartes de registre, des guides d\u2019utilisation, des manuels de r\u00e9f\u00e9rence, des guides pour trousse de d\u00e9veloppement int\u00e9gr\u00e9e (EDK) et des manuels de r\u00e9f\u00e9rence pour interface de programmation d\u2019application (API) \u2013 pour l\u2019offre de produits de syst\u00e8mes sur puce (SoC) de Ciena.\n   Rechercher et traduire des informations techniques dans des documents multim\u00e9dias et sur le Web, y compris l\u2019aide contextuelle sur le produit, pour des utilisateurs non techniques et techniques.\n   Recommander et mettre en \u0153uvre de nouvelles m\u00e9thodes et de nouveaux formats de documentation qui r\u00e9pondent aux exigences techniques et \u00e0 celles des clients.\n   Produire une documentation sur les produits et une aide en ligne claire, concise et conforme aux normes de documentation et d\u2019assurance qualit\u00e9.\n   Collaborer avec des \u00e9quipes interfonctionnelles telles que la direction des gammes de produits, la conception logicielle et mat\u00e9rielle, la conception de circuits int\u00e9gr\u00e9s \u00e0 application sp\u00e9cifique (ASIC), la v\u00e9rification des produits, l\u2019ing\u00e9nierie des r\u00e9seaux de syst\u00e8mes, le soutien \u00e0 la client\u00e8le et le personnel du marketing.\n \n \n  Exp\u00e9rience\n  Envoyez-nous un CV convaincant qui met en \u00e9vidence les informations suivantes :\n \n   Exp\u00e9rience en conception de syst\u00e8mes sur puce (SoC) et en d\u00e9veloppement de documentation pour n\u0153uds \u00e0 petit facteur de forme (SFF).\n   Exp\u00e9rience dans l\u2019analyse exploratoire des donn\u00e9es (EDA), la conception de semi-conducteurs, de circuits int\u00e9gr\u00e9s \u00e0 application sp\u00e9cifique (ASIC) ou de r\u00e9seaux de portes programmables in situ (FPGA).\n   Ma\u00eetrise d\u2019Adobe FrameMaker (mode structur\u00e9 et XML) et de la suite Microsoft Office.\n   Exp\u00e9rience avec l\u2019architecture darwinienne de typage d\u2019information (DITA).\n   Exp\u00e9rience avec les syst\u00e8mes de gestion documentaire CMS et CCMS.\n   Exp\u00e9rience en interfonctionnement des environnements de d\u00e9veloppement de logiciels XML.\n   Exp\u00e9rience avec les processus de d\u00e9veloppement Agile, y compris l\u2019\u00e9laboration de la documentation destin\u00e9e aux clients dans un environnement Agile.\n   Excellentes comp\u00e9tences en mati\u00e8re de communication, de relations interpersonnelles et d\u2019organisation.\n   Exp\u00e9rience de travail avec des \u00e9quipes multiculturelles et g\u00e9ographiquement dispers\u00e9es.\n \n \n  #LI-WH1\n  #LI-Remote\n \n  At Ciena, we are committed to building and fostering an environment in which our employees feel respected, valued, and heard. Ciena values the diversity of its workforce and respects its employees as individuals. We do not tolerate any form of discrimination.\n \n  Ciena is an Equal Opportunity Employer, including disability and protected veteran status.\n \n  If contacted in relation to a job opportunity, please advise Ciena of any accommodation measures you may require."
}