{
    "id": "a7bea43d2578eb16",
    "company": "Parliament of Canada, Senate",
    "positionName": "Analyst Programmer",
    "jobType": [],
    "location": "Ottawa, ON",
    "salary": null,
    "postingDateParsed": "2024-01-16T05:14:32.296Z",
    "url": "https://www.indeed.ca/rc/clk?jk=a7bea43d2578eb16&from=jasx&tk=1hkikkt0b2bf3001&bb=yhJIT6P4TthyluDALQ78dvNi8mMBUJEzI9opw5LB6yMcy8xrs7TJn8g3N7AbzfvvASVI6U6zqWw-KFNKKuTah_bu2nCG9p_xljGwcQY3Co223W14-UMeOQ%3D%3D&xkcb=SoCI67M3FShceOxytZ0AbzkdCdPP&vjs=3",
    "externalApplyLink": "https://jobs-emplois.sen.parl.gc.ca/cl4/xweb/xweb.asp?tbtoken=Z1tRQBxbDVAHE3R3NlQgY09LA2VbaVVacCNMWlAMD3lQXkRuW0JqBWB2cTUYGhdTSXBgF3U%3D&chk=ZVpaShM%3D&CLID=21004&page=jobdetails&JobID=J0124-0647&lang=1",
    "job_info_group": {
        "extracted_phone_numbers": [],
        "extracted_links": [
            "HTTP/HTTPS Links",
            "General Links",
            "WWW Links",
            "TLDs"
        ],
        "extracted_emails": [],
        "extracted_location_data": [
            "Umbraco",
            "Ottawa"
        ],
        "extracted_dates": [
            "five (5) years",
            "February 5, 2024 About"
        ],
        "extracted_languages": [],
        "extracted_laws": [],
        "extracted_norps": [],
        "extracted_orgs": [
            "Content Management System",
            "J0124-0647 Directorate: Information Services Classification",
            "Microsoft Structured Query Language Server",
            "the Information Services Directorate",
            "The Senate",
            "Basic Knowledge",
            "the following Technologies",
            "Razor/Blazor",
            "SharePoint",
            "B Competencies Integrity Respect Service Action Management Adaptability Communication Judgment Dependability Organizational Needs",
            "Linguistic Requirements English Reading Comprehension",
            "The Senate of Canada",
            "Information Technology",
            "Information Technology and/or Information Management",
            "Parliament",
            "the Senate",
            "the Senate of Canada"
        ],
        "extracted_persons": [],
        "extracted_products": [
            "Core"
        ],
        "extracted_money": [],
        "processed_text": "SEN Type Indeterminate permanent location minimum Salary maximum salary closing play unique role shape country's democracy . upper house senator examine legislation study public policy champion conduct interparliamentary diplomacy . workplace compose dynamic people represent nation's diverse talent background perspective . committed build maintain diverse inclusive workplace provide equal access employment development advancement . build advance career join team dedicated professional commit excellence support senator institution . contribute responsible development solution architecture align industry good practice participate activity relate planning design development stabilization quality assurance phase project participate committee external partner provide guidance expertise junior programmer programmer report progress project Technical Team Lead . open staff indeterminate position . selection process staff determinate indeterminate position level requirement . encourage individual underrepresented minority group apply . Prerequisites Graduation college diploma university degree provide programming analysis infrastructure expertise development integration maintenance business application lead small project team delivery business application provide technical advice recommendation implementation application component prepare detailed project plan mentor programmer ensure carry establish industry standard good practice minimum develop business application Microsoft .net minimum information technology field follow completion college diploma university degree information technology information management knowledge project management principle practice knowledge agile development principle practice cybersecurity development good practice knowledge emerge information technology current industry standard good practice . knowledge .NET Microsoft Microsoft Azure Devops asset Knowledge web accessibility WCAG Web Content Accessibility Guidelines asset web Content Management system Drupal Knowledge Windows Server IIS asset English Written Expression english oral proficiency french Reading comprehension french Written Expression french oral proficiency commit build maintain inclusive workplace employee provide equal access employment development advancement . condition Employment consent supply personal information security accreditation order eligible appointment ."
    },
    "companyDescription": "",
    "description": "Job ID: J0124-0647 \n    \n    \n     Directorate: Information Services \n    \n    \n     Classification: SEN-08 \n    \n    \n     Job Type: Indeterminate (Permanent) Full-Time \n    \n    \n     Location: Ottawa, Ontario \n    \n    \n     Minimum Salary: 80226/Year \n    \n    \n     Maximum Salary: 101507/Year \n    \n    \n     Closing Date: February 5, 2024\n      \n    \n   \n    \n    \n   \n   \n    \n     About the Senate \n     The Senate plays a unique role in shaping our country\u2019s democracy. As members of the upper house of Parliament, senators examine legislation, study public policy, champion causes and conduct interparliamentary diplomacy.  As a workplace, the Senate is composed of dynamic people representing our nation\u2019s diverse talents, backgrounds and perspectives. We are committed to building and maintaining a diverse and inclusive workplace where everyone is provided full and equal opportunity and access to employment, development and advancement. Build and advance your career by joining a team of dedicated professionals who are committed to excellence in support of senators and the institution. \n    \n    \n     How will you contribute? \n     You will be responsible for the development of solution architectures aligned with industry best practices; for participating in all activities relating to the planning, design, development, stabilization and quality assurance phases of the projects; for participating to various committees within the Senate of Canada and with its external partners; for providing guidance and expertise to junior programmers and programmers; and to report on the progress of projects with the Technical Team Lead. \n    \n    \n     Open to \n     To staff one (1) indeterminate position in the Information Services Directorate. This selection process may be used to staff determinate or indeterminate positions at the same level with similar requirements. We encourage individuals from underrepresented and minority groups to apply. \n    \n    \n     Prerequisites \n     \n      Graduation with a college diploma or university degree in Information Technology and/or Information Management;\n       \n      \n       Experience in providing programming, analysis and infrastructure expertise in the development, integration and maintenance of business applications;\n       Experience in leading small IT (Information Technology) project teams in the delivery of business applications;\n       Experience in providing technical advice and recommendations on the implementation of application components;\n       Experience in preparing detailed IT project plans;\n       Experience in mentoring programmers and ensuring that their work is carried out in accordance with established industry standards and best practices;\n       A minimum of three (3) years of experience developing business applications using the Microsoft .NET in C# and Microsoft SQL Server;\n       A minimum of five (5) years of work experience in the information technology field, following completion of a college diploma or university degree in information technology or information management;\n       Knowledge of project management principles and practices;\n       Knowledge of agile development principles and practices;\n       Basic Knowledge of cybersecurity development best practices;\n       Knowledge of emerging information technologies and current IT industry standards and best practices.\n       Knowledge of one or more of the following Technologies: .NET Core, Azure Devops, Razor/Blazor, C#, SharePoint would be an asset;\n       Knowledge of web accessibility (WCAG (Web Content Accessibility Guidelines) 2.0) would be an asset;\n       Experience with web Content Management systems (CMS) like Umbraco or Drupal or other\n       Knowledge of Windows Server and IIS would be an asset;\n      \n     \n      \n    \n    \n    \n      \n     \n      \n       Linguistic Requirements \n      \n     \n      \n     \n      \n       English Reading Comprehension: \n      \n      \n       B \n      \n     \n      \n     \n      \n       English Written Expression: \n      \n      \n       B \n      \n     \n      \n     \n      \n       English Oral Proficiency: \n      \n      \n       B \n      \n     \n      \n      \n     \n     \n      \n       French Reading Comprehension: \n      \n      \n       B \n      \n     \n      \n     \n      \n       French Written Expression: \n      \n      \n       B \n      \n     \n      \n     \n      \n       French Oral Proficiency: \n      \n      \n       B \n      \n     \n      \n    \n    \n     Competencies \n     Integrity Respect Service Action Management Adaptability Communication Judgment Dependability \n    \n    \n     Organizational Needs \n     The Senate of Canada is committed to building and maintaining an inclusive workplace where all employees are provided full and equal access to employment, development, and advancement opportunities. \n    \n    \n     Conditions of Employment \n     Candidates must consent to supply personal information and obtain a security accreditation in order to be eligible for appointment."
}