{
    "id": "245e270ca372c4b3",
    "company": "University of Ottawa",
    "positionName": "Replacement professor in Chemistry & Biomolecular Sciences",
    "jobType": [],
    "location": "40 Ruskin St, Ottawa, ON",
    "salary": null,
    "postingDateParsed": "2023-10-19T20:08:48.777Z",
    "url": "https://www.indeed.ca/rc/clk?jk=245e270ca372c4b3&from=jasx&tk=1hgol75cilemg800&vjs=3",
    "externalApplyLink": "https://ca.indeed.com/rc/clk?jk=245e270ca372c4b3&atk=&xpse=SoCx67I3IDjc-mAJqT0LbzkdCdPP",
    "job_info_group": {
        "extracted_phone_numbers": [],
        "extracted_links": [
            "HTTP/HTTPS Links",
            "General Links",
            "WWW Links",
            "TLDs"
        ],
        "extracted_emails": [
            "vra.affairesprofessorales@uottawa.ca"
        ],
        "extracted_location_data": [
            "Ottawa"
        ],
        "extracted_dates": [
            "May 2023",
            "the day prior",
            "May 1, 2022",
            "January 2024",
            "November 18"
        ],
        "extracted_languages": [],
        "extracted_laws": [],
        "extracted_norps": [
            "Canadians"
        ],
        "extracted_orgs": [
            "the University",
            "chemistry & biomolecular sciences",
            "the Office of the Vice-Provost",
            "Canada The University of Ottawa",
            "The University of Ottawa",
            "APUO Faculty/Department:",
            "its Official Languages and Bilingualism Institute",
            "University of Ottawa Pension Plan",
            "University of Ottawa",
            "10 Marie Curie Pvt",
            "the University of Ottawa Careers",
            "Department of Chemistry & Biomolecular Sciences",
            "Faculty Relations at vra.affairesprofessorales@uottawa.ca",
            ", Faculty Relations",
            "(e.g., Canadian Museum of Nature",
            "Indigenous Peoples in Canada",
            "the University of Ottawa",
            "Chemistry & Biomolecular Sciences",
            "Chemistry & Biomolecular Sciences The Department of Chemistry & Biomolecular Sciences"
        ],
        "extracted_persons": [
            "D'Iorio Hall",
            "https://hrdocrh.uottawa.ca/info/en-ca/apuo/leaves.html",
            "Dr. John Pezacki"
        ],
        "extracted_products": [],
        "extracted_money": [
            {
                "amount": "89,622",
                "noun_phrases": []
            }
        ],
        "processed_text": "Family Academic Leadership Faculty Union affiliation Department Chemistry Biomolecular Sciences_FT Campus stem post octobre closing note application accept Project Manager professor invite application fill replacement professor position . title position replacement professor duty function academic staff include vary proportion teaching activity course academic service activity . expect teach official language . term contract renewable . wage salary scale Assistant Professors start . benefit package provide complete compensation package include long term basic group life insurance supplementary health insurance optional life insurance pay leave include maternal parental . location K1N 6n5 . contact information Chair . Room K1N 6n5 . skill requirement education ph.d. Inorganic bioanalytical chemistry . additional background Chemistry Biomolecular science asset . seek prove track record teaching undergraduate level official language . research academia industry asset . supervise undergraduate student asset . teach graduate level asset . participate establish research group view asset . build inclusive course design learn asset . application deadline position fill . application procedure application submit portal . applicant provide curriculum vitae teach philosophy statement contact detail reference provide letter recommendation select . information tradition bilingualism . provide training staff spouse second official language . locate unceded ancestral territory Anishinabe Algonquin people heart Canada's capital unparalleled collaboration governmental agency funding sample GSC . Immigration requirement qualified person invite submit application priority canadian citizen permanent resident . commit ensure equity diversity inclusion scholarly leadership environment student staff faculty . encourage application visible minority racialize person person woman qualified skill knowledge productively engage equitable diverse inclusive community . consider designate group complete confidential Identification Questionnaire complete application . provide accommodation applicant recruitment process . invite proceed selection process notify accommodation require contact . information send handle respectfully complete confidence . commit ensure equity diversity inclusion scholarly leadership environment student staff faculty . encourage application visible minority racialize person person woman qualified skill knowledge productively engage equitable diverse inclusive community . consider designate group complete confidential Identification Questionnaire complete application . qualified invite apply preference permanent resident . submit application indicate legally entitle provide accommodation applicant recruitment process . invite proceed selection process notify accommodation require contact email . information send handle respectfully complete confidence . tradition bilingualism . provide training staff spouse second official language . prior require student faculty staff visitor include contractor fully vaccinate Covid define Policy \u2013 Covid Vaccination . policy suspend effective reinstate point future depend public health guideline recommendation expert ."
    },
    "companyDescription": "",
    "description": "Job Family:\n  Academic Leadership and Faculty\n \n   Union affiliation:\n \n  APUO\n \n \n   Faculty/Department:\n  Department of Chemistry and Biomolecular Sciences_FT\n \n \n   Campus:\n  STEM\n \n \n   Date Posted:\n  octobre 19, 2023\n \n \n   Closing Date:\n \n \n   Note: Applications will be accepted until 11:59 PM on the day prior to the Posting End Date above\n \n \n \n   Replacement professor in Chemistry & Biomolecular Sciences\n \n \n \n   The Department of Chemistry & Biomolecular Sciences of the University of Ottawa invites applications to fill one replacement professor position in Chemistry & Biomolecular Sciences, to begin January 2024.\n \n \n \n   Title of the position: Replacement professor\n \n \n \n   Duties: The functions of a member of the academic staff include, in varying proportions: teaching activities (six courses per year) and academic service activities. The candidate will be expected to teach in both official languages.\n \n \n \n   Terms: A two-year contract, renewable.\n \n \n \n   Wage: Salary scales for Assistant Professors start at $89,622 (as of May 2023).\n \n \n \n   Benefits package: The University of Ottawa provides a complete compensation package which includes long term disability, basic group life insurance, supplementary health insurance, University of Ottawa Pension Plan and optional life insurance, as well as paid leave (including maternal and parental: \n  \n   https://hrdocrh.uottawa.ca/info/en-ca/apuo/leaves.html\n  ).\n \n \n \n   Location of work: Department of Chemistry & Biomolecular Sciences, University of Ottawa, D\u2019Iorio Hall, 10 Marie Curie Pvt, Ottawa, ON K1N 6N5.\n \n \n \n   Contact information: Dr. John Pezacki, Chair, Department of Chemistry & Biomolecular Sciences, D\u2019Iorio Hall, 10 Marie Curie Pvt. Room 106, Ottawa, ON K1N 6N5.\n \n \n \n   Skills requirements:\n \n \n   Education: Ph.D. In Inorganic or Bioanalytical chemistry. Additional background in Chemistry and Biomolecular sciences is an asset.\n   Work experience:\n \n \n \n   We are seeking candidates with a proven track record in teaching at the undergraduate level (in chemistry & biomolecular sciences), in both official languages. Research experience in academia and/or industry will be an asset. Experience in supervising undergraduate students will be an asset.\n \n \n \n   The ability of the candidate to teach in chemistry & biomolecular sciences at the graduate level will be an asset. The ability of the candidate to participate in at least one of the established research groups will be viewed as an asset.\n \n \n \n   The ability of the candidate to build inclusive courses designed for learning will be an asset.\n \n \n \n   Application deadline: November 18 or until position is filled.\n \n \n \n   Application procedure: Applications should be submitted through the University of Ottawa Careers portal. Applicants should provide a curriculum vitae and a teaching philosophy statement, as well as the contact details of two references who would provide a letter of recommendation for the selected candidate.\n \n \n \n   Other information:\n \n \n   The University of Ottawa is proud of its more than 160-year tradition of bilingualism. Through its Official Languages and Bilingualism Institute, the University provides training to staff members and to their spouses in their second official language. Located on the unceded ancestral territory of the Anishinab\u00e9-Algonquin people, the University of Ottawa is at the heart of Canada\u2019s capital with unparalleled opportunity for collaborations with governmental agencies for funding and samples (e.g., Canadian Museum of Nature, GSC).\n \n \n \n   In accordance with Immigration Canada requirements, any qualified person is invited to submit their application; however, priority will be given to Canadian citizens and permanent residents. The University of Ottawa is committed to ensuring equity, diversity and inclusion in the scholarly and leadership environments of our students, staff, and faculty\n  . Accordingly, we strongly encourage applications from Indigenous Peoples in Canada, visible minorities members (racialized persons), persons with disabilities, women, as well as from all qualified candidates with the skills and knowledge to productively engage with equitable, diverse and inclusive communities. Candidates who wish to be considered as a member of one or more designated groups are asked to complete the confidential Self-Identification Questionnaire, to be completed at the time of application.\n \n \n \n   The University of Ottawa provides accommodations for applicants with disabilities throughout the recruitment process. If you are invited to proceed in the selection process, please notify us of any accommodations that you require by contacting the Office of the Vice-Provost, Faculty Relations at \n  \n   vra.affairesprofessorales@uottawa.ca\n  \n  . Any information you send us will be handled respectfully and in complete confidence.\n \n \n \n   The University of Ottawa is committed to ensuring equity, diversity, and inclusion in the scholarly and leadership environments of our students, staff, and faculty. Accordingly, we strongly encourage applications from Indigenous Peoples in Canada, visible minorities members (racialized persons), persons with disabilities, women, as well as from all qualified candidates with the skills and knowledge to productively engage with equitable, diverse, and inclusive communities. Candidates who wish to be considered as a member of one or more designated groups are asked to complete the confidential Self-Identification Questionnaire, to be completed at the time of application.\n \n \n \n   All qualified candidates are invited to apply; however, preference will be given to Canadians and permanent residents. When submitting your application, please indicate if you are legally entitled to work in Canada\n \n \n \n   The University of Ottawa provides accommodations for applicants with disabilities throughout the recruitment process. If you are invited to proceed in the selection process, please notify us of any accommodations that you require by contacting the Office of the Vice-Provost, Faculty Relations by email at \n  \n   vra.affairesprofessorales@uottawa.ca\n  . Any information you send us will be handled respectfully and in complete confidence.\n \n \n \n   The University of Ottawa is proud of its 160-year tradition of bilingualism. Through its Official Languages and Bilingualism Institute, the University provides training to staff members and to their spouses in their second official language.\n \n \n \n   Prior to May 1, 2022, the University required all students, faculty, staff, and visitors (including contractors) to be fully vaccinated against Covid-19 as defined in Policy 129 \u2013 Covid-19 Vaccination. This policy was suspended effective May 1, 2022 but may be reinstated at any point in the future depending on public health guidelines and the recommendations of experts."
}