{
    "id": "e67a244eea6465e0",
    "company": "NOKIA",
    "positionName": "NPI Lab Support Co-op/Intern",
    "jobType": [],
    "location": "Ottawa, ON",
    "salary": null,
    "postingDateParsed": "2023-08-31T06:51:09.197Z",
    "url": "https://www.indeed.ca/rc/clk?jk=e67a244eea6465e0&from=jasx&tk=1hb2v8b7g2ap3005&vjs=3",
    "externalApplyLink": "https://careers.nokia.com/jobs/npi-lab-support-co-op-intern-101720?src=JB-10760",
    "job_info_group": {
        "extracted_phone_numbers": [],
        "extracted_links": [
            "HTTP/HTTPS Links",
            "General Links",
            "WWW Links",
            "TLDs"
        ],
        "extracted_emails": [],
        "extracted_location_data": [
            "Canada",
            "Ottawa"
        ],
        "extracted_dates": [
            "4 Months Date",
            "January 8th to April 26th"
        ],
        "extracted_languages": [],
        "extracted_laws": [],
        "extracted_norps": [],
        "extracted_orgs": [
            "an equal opportunity employer Nokia",
            "Nokia",
            "Virtual Machines",
            "Your skills and experience Education Recommendations",
            "The IP Networks Business Division",
            "Computer Science, Computer Systems Engineering",
            "Bloomberg Workplace Pride Global Benchmark",
            "Technical Expertise Centre",
            "EXSi"
        ],
        "extracted_persons": [],
        "extracted_products": [
            "Windows"
        ],
        "extracted_money": [],
        "processed_text": "create technology help business business technology innovation leader pioneer future network meet cloud . positive impact people's life help build capability productive sustainable accessible . culture build inclusive open idea empower risk encourage fearless bring authentic . department pandemic highlight telecoms network society . Nokia's Network Infrastructure group heart revolution bring fast network capacity people worldwide ambition innovation technical expertise . team provide op student learn gain hand advanced technology build world's critical network . SR TEC team highly specialized group provide worldwide support customer internal Nokia team position NPI Lab Support op Intern duration location hybrid learn contribute team setup maintain network topology build server Linux KVM hypervisor maintain support Linux Operating system support lab network infrastructure currently Bachelor's degree diploma field accredit school . knowledge ip networking cable technique server setup nice familiarity Scripting automation offer offer flexible hybrid working scheme continuous learning program support mentally physically join support employee resource group mentor program highly diverse team inclusive culture people thrive empower . company Culture people great asset aim foster fun challenging positive inclusive environment . offer mentorship learning development global impact interaction flexible life balance . Meaningful op term op term test late technology innovative project leave global impact . skill learn classroom apply real situation gain professional hand . committed inclusion receive follow recognition commitment inclusion equality World's Ethical Companies Ethisphere Gender Equality Index inclusively respect uniqueness people . Nokia's employment decision race color national ethnic origin religion gender sexual orientation gender identity expression age marital status protect veteran status characteristic protect law . committed culture inclusion build core respect . join company feel include empower succeed ."
    },
    "companyDescription": "",
    "description": "Come create the technology that helps the world act together \n  \n \n We are a B2B technology innovation leader pioneering the future where networks meet cloud. \n  \n At Nokia you will have a positive impact on people\u2019s lives and help build the capabilities needed for a more productive, sustainable, and accessible world. \n  \n Be part of a culture built on an inclusive way of working where we are open to your ideas, you are empowered to take risks and are encouraged to be fearless in bringing your authentic self to work. \n  \n Department \n  The pandemic has highlighted how important telecoms networks are to society. Nokia\u2019s Network Infrastructure group is at the heart of a revolution to bring more and faster network capacity to people worldwide through our ambition, innovation, and technical expertise. \n  The team you will be a part of \n  \n \n The IP Networks Business Division provides a co-op student with the opportunity to learn and gain hands-on experience on the most advanced technologies that build the world's most critical networks. The SR TEC team (Technical Expertise Centre) is a highly specialized group providing worldwide support to customers and internal Nokia teams \n  \n Position: NPI Lab Support Co-op/Intern Duration: 4 Months Date: January 8th to April 26th, 2024 Location: Hybrid in Ottawa, Canada \n  \n What you will learn and contribute to \n  \n \n As part of the team, you will: \n  \n  Setup and maintain network topologies \n  Build new servers and Virtual Machines using EXSi and Linux KVM hypervisors \n  Maintain and support Windows and Linux Operating systems \n  Support the lab network infrastructure \n \n Your skills and experience \n  \n \n Education Recommendations: \n  \n Currently a candidate for a Bachelor\u2019s degree or diploma in Computer Science, Computer Systems Engineering, or a related field with an accredited school in Canada. \n  \n You have : \n  \n  Knowledge of IP networking \n  Experience with cabling techniques \n  Experience with server setup \n  \n \n It would be nice if you also had: \n  \n  Familiarity with Scripting/Automation \n \n What we offer \n  \n \n Nokia offers flexible and hybrid working schemes, continuous learning opportunities, well-being programs to support you mentally and physically, opportunities to join and get supported by employee resource groups, mentoring programs and highly diverse teams with an inclusive culture where people thrive and are empowered. \n  \n \n  Company Culture: We believe our people are our greatest asset, and we aim to foster a fun, challenging, positive, and inclusive work environment. We offer 1-on-1 mentorship, learning and development opportunities, global impact and interaction, and flexible work/life balance. \n  Meaningful Co-op Term: During your co-op term, you will have the opportunity to test the latest technologies and work on innovative projects that could leave a global impact. You get to use skills learned in the classroom and apply them to real-world situations while gaining professional hands-on experience. \n \n Nokia is committed to inclusion and is an equal opportunity employer \n  \n \n Nokia has received the following recognitions for its commitment to inclusion & equality: \n  \n  One of the World\u2019s Most Ethical Companies by Ethisphere \n  Gender-Equality Index by Bloomberg \n  Workplace Pride Global Benchmark \n  \n \n At Nokia, we act inclusively and respect the uniqueness of people. \n  \n Nokia\u2019s employment decisions are made regardless of race, color, national or ethnic origin, religion, gender, sexual orientation, gender identity or expression, age, marital status, disability, protected veteran status or other characteristics protected by law. \n  \n We are committed to a culture of inclusion built upon our core value of respect. \n  \n Join us and be part of a company where you will feel included and empowered to succeed."
}