{
    "id": "524131074fb969a3",
    "company": "Inter-Power Group",
    "positionName": "Technical Account Manager",
    "jobType": [
        "Permanent",
        "Full-time"
    ],
    "location": "Ottawa, ON",
    "salary": null,
    "postingDateParsed": "2024-01-26T12:13:20.547Z",
    "url": "https://www.indeed.ca/rc/clk?jk=524131074fb969a3&from=jasx&tk=1hl5dcuan2fci002&bb=meFSaZ2jpWfCb2DCBnnuQBC0JCJEj1GWBK8-9lxjEOzBgCrWsC4DitruJCHLSmDZL6GMnyP9eZlrYWAp025nVHDr28je4f1aeCabsikhZNPiVxSUl5EqEA%3D%3D&xkcb=SoBM67M3FlS8FtXIwZ0GbzkdCdPP&vjs=3",
    "externalApplyLink": null,
    "job_info_group": {
        "extracted_phone_numbers": [],
        "extracted_links": [
            "HTTP/HTTPS Links",
            "General Links",
            "WWW Links",
            "TLDs"
        ],
        "extracted_emails": [],
        "extracted_location_data": [
            "approximatively Kingston",
            "North America",
            "Ottawa"
        ],
        "extracted_dates": [
            "Friday",
            "90 years",
            "Monday"
        ],
        "extracted_languages": [],
        "extracted_laws": [],
        "extracted_norps": [
            "French"
        ],
        "extracted_orgs": [
            "FCG",
            "Dental care Disability insurance Extended health care Life insurance Vision care Flexible Language Requirement",
            "Success",
            "Entrepreneurship, Integrity, Respect, Partnership",
            "Engineering Technologist",
            "Critical Air",
            "Hot Water",
            "Steam, Hydronic Heating",
            "Preston Phipps Inc.",
            "Preston Phipps Divisions",
            "Flow Control Group"
        ],
        "extracted_persons": [
            "Preston Phipps"
        ],
        "extracted_products": [],
        "extracted_money": [],
        "processed_text": "talented entrepreneurial technical salesperson motivate help customer optimize performance system industry lead product service challenging position successful development manage territory growth potential great support team great team join Preston Phipps team . choose responsible build business assign territory . successful position build credibility establish trusting relationship develop intimate understanding user' system user' objective identify big . challenging competitive industry successful determined smart approach pick good pursue balance user contractor engineering consultant navigate internal resource maintain expert level knowledge extensive list technical product . challenge potential role hand hand . celebrate nationally establish specialty manufacture representative firm institutional commercial industrial sector . specialize market lead product service hvac product . build distribution evolve offer specialty design engineer product selection skid production turnkey installation . family company . position cover commercial institutional market region cover . responsibility ownership develop sale assign territory . maintain business plan develop territory inline company objective include annual sale forecast individual account goalsmaintaine account list term current volume potential growth development plan each. planned initiative objective . identify prospect networking industry event participation trade association trade technical seminar host product demonstration . expert Preston Phipps product application optimize customer system . guide educate user contractor engineering consultant select good equipment optimize user's system . deliver formal informal training product selection application system optimization . build relationship facilitate network user engineering consultant contractor . identify decision maker influence . build relationship Preston Phipps manufacturing partner deepen technical resource . leverage joint sale account . territory manager develop multi location account . strike optimal balance account ongoing project prospect manage sale funnel balance term medium term growth . prioritize person meeting account . lead bid spec project assign engineer . document project hand project delivery team . maintain Customer Relationship Management customer relationship management tool contact pipeline forecast . collect share information competition market industry trend leadership team . attend internal sale meeting prepare update quote order development territory . requirement Bachelor's degree mechanical engineering prefer . applicant equivalent industry technical sale encourage apply . year' position field prefer . HVAC hydronic industrial laboratory control favorable . excellent communication follow organizational project tracking skill . commitment drive sale active territory . discipline drive professional positive ethic . strong technical acumen problem solve capacity . driver's licence clean driving record . alignment Innovation . select contact . applicant interest type permanent benefit require Schedule supplemental pay type Commission pay location person"
    },
    "companyDescription": "Inter-Power Group est une entreprise de service \u0153uvrant dans le domaine des compresseurs \u00e0 air industriels. De par les banni\u00e8res Compresseurs Qu\u00e9bec au Qu\u00e9bec (Ville Saint-Laurent, St-Germain-de-Grantham, Sherbrooke et Boisbriand), et ReapAir Compressor services en Ontario (Toronto), l\u2019entreprise couvre un vaste territoire. En plus d\u2019\u00eatre le plus grand d\u00e9taillant Quincy en Am\u00e9rique du Nord, Inter-Power se d\u00e9marque \u00e9galement comme leader dans le domaine de l\u2019air comprim\u00e9. Or, la croissance d\u2019Inter-Power ne serait possible sans le dynamisme et l\u2019engagement de ses employ\u00e9s. \r\n\r\nL\u2019actif le plus important de la compagnie est son personnel. Il est donc essentiel de former une \u00e9quipe o\u00f9 l\u2019atmosph\u00e8re et le climat de travail font en sorte que chacun y obtienne une satisfaction d\u2019emploi tout en visant \u00e0 atteindre les objectifs et les buts de l\u2019entreprise. \r\n\r\n\r\nNos valeurs:\r\n\r\nv  Responsabilisation\r\n\r\nv Satisfaction client\u00e8le\r\n\r\nv  Rigueur, qualit\u00e9 et efficacit\u00e9\r\n\r\nv  Travail d'\u00e9quipe\r\n\r\nv  Respect\r\n\r\nv  Engagement\r\n\r\nv  Int\u00e9grit\u00e9\r\n\r\n\r\n\r\nUn peu plus sur l'entreprise...\r\n\r\nFond\u00e9e en 1985, Inter-Power est aujourd'hui chef de file pour tout ce qui traite d'air comprim\u00e9 et n'associe son nom qu'avec les marques de grande renomm\u00e9e, telles que Quincy, GlobalVac, Kobelco KNW Series et Great Lakes. Que ce soit pour la vente, le service ou l'installation, nous garantissons un service de qualit\u00e9 \u00e0 tous nos clients \u00e0 travers le Qu\u00e9bec, mais aussi en Ontario. La qualit\u00e9 et l'efficacit\u00e9 sont au c\u0153ur de nos aspirations. Nous offrons un service 24 heures \u00e0 nos clients, limitant ainsi les inqui\u00e9tudes et assurant le bon fonctionnement de leur entreprise en tout temps. Recherchant constamment l'atteinte de l'excellence doubl\u00e9e de la satisfaction de nos employ\u00e9s, nous innovons sans cesse dans le but de d\u00e9passer les attentes et mieux r\u00e9pondre aux besoins.",
    "description": "Are you a talented, entrepreneurial, and technical salesperson motivated to help customers optimize the performance of their systems with industry leading products and services? Are you looking for a challenging new position where you can be very successful, have development opportunities, manage a territory with growth potential and work with a great support team? If yes, you may be the next great team member to join the Preston Phipps team.\nThe chosen candidate will be responsible for building the business in the assigned territory. To be successful in this position, one needs to build credibility, establish trusting relationships, develop intimate understanding of end users\u2019 systems and the end users\u2019 objectives to identify opportunities, which can be very big. This is a challenging and competitive industry, and the successful candidate needs to be determined and smart about their approach, picking the best opportunities to pursue, balancing their time between end users, contractors, and engineering consultants while navigating internal resources and maintaining an expert level of knowledge on an extensive list of technical products. The challenge and the potential of this role go hand in hand.\nCelebrating 90 years, Preston Phipps Inc. is a nationally established specialty manufacturing representative firm working with the institutional, commercial, and industrial sectors. We specialize in market leading products and services in Steam, Hydronic Heating, Hot Water, HVAC, and Critical Air products. While built on distribution, Preston Phipps has evolved to offer specialty design, engineered product selection, skid production and even turnkey installations. Preston Phipps is part of FCG, Flow Control Group, a family of over 80 companies in North America.\nThis position will be covering the commercial and institutional markets in the Ottawa region (covering approximatively Kingston to Ottawa).\nResponsibilities:\n\n Take ownership of developing the sales of the assigned territory.\n Maintain a business plan for the developing the territory inline with company objectives, including:\n\n- Annual sales forecasts and individual account goals- Maintaining a top account list in terms of current volume, potential growth, and development plans for each.- Planned initiatives and call objectives.\n\n Identify new prospects through networking, industry event participation (trade associations, trade shows, and technical seminars), and even hosting product demonstrations.\n Be an expert on Preston Phipps products, their application and how they optimize customer systems.\n Guide and educate end users, contractors, and engineering consultants on selecting the best equipment to optimize the end user\u2019s system.\n Deliver formal and informal training on product selection, application, and system optimization.\n Build relationships and facilitate a network of end users, engineering consultants and contractors. The ability to identify the decision makers and the influences is important.\n Build relationships with Preston Phipps manufacturing partners and Preston Phipps Divisions to deepen your technical resources. When available, leverage them through joint sales calls with accounts.\n Work with other territory managers to develop multi location accounts.\n Strike an optimal balance between your top accounts, ongoing projects, and prospecting to manage your sales funnel balancing near term and medium-term growth opportunities.\n Prioritize in-person meetings with accounts.\n Lead take offs on bid and spec projects that your assigned engineers have specified.\n Document projects to hand off to the project delivery team.\n Maintain CRM (customer relationship management) tool with contacts, pipeline, opportunities, and forecasts.\n Collect and share information on competition, market, and industry trends with leadership team.\n Attend internal sales meetings prepared to give updates on quotes, orders, and development in territory.\n\nRequirements:\n\n Bachelor\u2019s degree in mechanical engineering is preferred.\n\n- Applicants with Engineering Technologist, equivalent industry experience, and technical sales experience are encouraged to apply.\n\n 3 to 5 years' experience in a similar position or field is preferred.\n Experience in HVAC, hydronics, industrial, laboratory or controls are favorable.\n Excellent communication, follow up, organizational and project tracking skills.\n Commitment to driving sales and being active in the territory.\n Disciplined, driven, professional and with a positive work ethic.\n Strong technical acumen and problem-solving capacity.\n Driver\u2019s licence and clean driving record.\n Alignment with our values of Entrepreneurship, Integrity, Respect, Partnership, Success, and Innovation.\n\nOnly selected candidates will be contacted. We would like to thank all applicants for your interest in Preston Phipps Inc.\nJob Types: Full-time, Permanent\nBenefits:\n\n Dental care\n Disability insurance\n Extended health care\n Life insurance\n Vision care\n\nFlexible Language Requirement:\n\n French not required\n\nSchedule:\n\n Monday to Friday\n\nSupplemental pay types:\n\n Commission pay\n\nWork Location: In person"
}