{
    "id": "d964cc5dc394773e",
    "company": "Canadian Institute for Health Information",
    "positionName": "Senior Analyst, Pharmaceuticals, Data Management",
    "jobType": [],
    "location": "495 Richmond Road, Ottawa, ON",
    "salary": null,
    "postingDateParsed": "2023-10-13T18:55:25.073Z",
    "url": "https://www.indeed.ca/rc/clk?jk=d964cc5dc394773e&from=jasx&tk=1hcvfr1frj4hv800&vjs=3",
    "externalApplyLink": "https://clients.njoyn.com/CL3/ex/JobBoards/JobBoards_jobdetails.asp?CLID=053103&BDID=1&JID=J0923-1463&BRID=243264&LGID=1&ForceSBDID=936",
    "job_info_group": {
        "extracted_phone_numbers": [],
        "extracted_links": [
            "HTTP/HTTPS Links",
            "General Links",
            "WWW Links",
            "TLDs"
        ],
        "extracted_emails": [],
        "extracted_location_data": [
            "et \u00e0 des projets sp\u00e9ciaux",
            "Toronto",
            "Pharmaceutique",
            "au besoin",
            "Ontario",
            "pr\u00e9sentations",
            "respecter les d\u00e9lais",
            "selon le contexte"
        ],
        "extracted_dates": [],
        "extracted_languages": [
            "English"
        ],
        "extracted_laws": [],
        "extracted_norps": [
            "healthier Canadians",
            "French",
            "au besoin"
        ],
        "extracted_orgs": [
            "d'opinion de l'industrie qui sont passionn\u00e9s par les donn\u00e9es et veulent",
            "\u00c9quit\u00e9 en emploi L'ICIS s'engage \u00e0 offrir un",
            "l'\u00e9volution du syst\u00e8me de sant\u00e9 canadien",
            "the National Prescription Drug Utilization Information System",
            "CIHI data",
            "our Equity, Diversity and Inclusion Strategy",
            "Analyste",
            "dans le domaine de la sant\u00e9",
            "Pourquoi ce r\u00f4le est-il",
            "connexe",
            "Pharmaceuticals",
            "www.cihi.ca",
            "vous jouerez un r\u00f4le d\u00e9terminant",
            "SNDAI",
            "appuyer la gestion des donn\u00e9es et la",
            "afin d'en",
            "comprendre la gestion des donn\u00e9es",
            "Dipl\u00f4me d'\u00e9tudes sup\u00e9rieures",
            "Data Management Who",
            "la r\u00e9solution de probl\u00e8mes",
            "Notre",
            "the National System for Incident Reporting",
            "fournir de l'information",
            "favorisant la prise de d\u00e9cisions \u00e9clair\u00e9es qui visent \u00e0 am\u00e9liorer la sant\u00e9 des Canadiens",
            "des intervenants afin d'appuyer les",
            "aux politiques et proc\u00e9dures de l'ICIS en mati\u00e8re de respect de la vie priv\u00e9e et de s\u00e9curit\u00e9.",
            "Il peut notamment s'agir de diriger l'\u00e9laboration et l'ex\u00e9cution des strat\u00e9gies",
            "et participe aux projets et initiatives de la Direction et de la Division",
            "mat\u00e9riel de formation et documents",
            "collaborons avec nos partenaires",
            "mati\u00e8re de recherche sur les services de sant\u00e9 et de politiques de sant\u00e9",
            "Par cons\u00e9quent",
            "Employment Equity",
            "SNIUMP",
            "the CIHI team",
            "notre gouvernance et nos pratiques",
            "ma\u00eetrise du fran\u00e7ais",
            "l'\u00e9volution des syst\u00e8mes de sant\u00e9 canadiens",
            "NPDUIS",
            "et des besoins",
            "concurrentielle un r\u00e9gime d'avantages sociaux",
            "de statistiques et d'indicateurs",
            "CIHI include HOOPP Pension Plan",
            "L'analyste principal joue \u00e9galement un r\u00f4le cl\u00e9 dans l'encadrement des membres de l'\u00e9quipe",
            "et accueillant en misant sur nos apprentissages",
            "et sp\u00e9ciaux",
            "le milieu de la sant\u00e9 ou dans le domaine de l'information sur la sant\u00e9.",
            "SAS"
        ],
        "extracted_persons": [
            "si vous avez des besoins sp\u00e9ciaux",
            "et le Syst\u00e8me national d'information sur l'utilisation des m\u00e9dicaments prescrits",
            "Exp\u00e9rience de travail dans",
            "production des principaux livrables",
            "multidisciplinaire avec un",
            "Aptitudes \u00e9prouv\u00e9es",
            "et collaborer avec d'autres \u00e9quipes de projet de l'ICIS",
            "Ces activit\u00e9s",
            "CIHI",
            "l'analyse ou la v\u00e9rification des principaux livrables",
            "l'\u00e9laboration de nouvelles offres analytiques",
            "Diriger ou appuyer la r\u00e9daction de documents",
            "Assurer et d\u00e9montrer la",
            "L'analyste principal",
            "Collaborer avec le chef de section",
            "Ex\u00e9cuter",
            "lucratif",
            "d'all\u00e9ger le texte",
            "\u00c0 titre d'organisme",
            "Entregent et capacit\u00e9 \u00e0 travailler au sein d'une \u00e9quipe",
            "cr\u00e9er un environnmenent",
            "\u00c0 titre d'employ\u00e9 de l'ICIS",
            "Exp\u00e9rience de travail avec les donn\u00e9es de l'ICIS ou avec des ensembles de donn\u00e9es connexes sur la sant\u00e9",
            "Que mettriez-vous"
        ],
        "extracted_products": [],
        "extracted_money": [],
        "processed_text": "Category Data Analysis City Description Senior Analyst Pharmaceuticals organization comprise industry thought leader passionate health datum difference health care field . independent profit organization partner provide essential information Canada's health system enable decision lead . pivotal role evolution Canada's health care system . recognize exceptional place embrace diversity respect integrity collaboration innovation . learn create inclusive welcoming organization focus learn govern practise . recognize matter employee . benefit Defined Benefits Pension Retirement Planning Program generous vacation permanent long term contract life balance Career Planning Program Learning Professional Development Program Flexible benefit program permanent long term contract role pivotal role evolution Canada's Health Care system . Senior Analyst play key role provide datum analytical support NSIR . involve data management system development maintenance activity assess datum quality client support stakeholder engagement fulfil custom datum request data analysis interpretation analytical product . senior analyst play key role mentor team . senior analyst participate department branch project initiative meeting special project require . . lead support datum management production key deliverable internal external dissemination include topical analytic report indicator datum table custom datum request relevant documentation . . conduct data management activity include write update statistical code require development computation analysis validation key deliverable . include lead development execution test strategy test case ensure adherence CIHI's corporate information quality framework . maintain detailed knowledge datum tool analytical technique produce standard ad hoc output . . conduct environmental scan literature review support development report statistic indicator . lead contribute development material e.g. analytical report methodology technical note presentation educational medium . dissemination finding knowledge translation review write product analytic accuracy quality . . provide professional timely client support respond internal external client query require . . ensure adherence demonstrate compliance CIHI's privacy security policy procedure . maintain current knowledge CIHI's datum holding trend health service research health policy stakeholder information support current contribute development analytic proposal . subject matter expert mentor team . . participate meeting corporate project team require . bring table Undergraduate degree field equivalent education . graduate degree asset . relate relational database large dataset include manipulate maintain prepare datum analysis report audience . proficiency datum manipulation statistical software Python statistical software . proficiency Microsoft Office application . excellent interpersonal skill multi disciplinary team minimal supervision . prove organizational management skill manage multiple project priority effectively meet deadline . strong attention detail advanced problem solve skill . strong write verbal communication skill demonstrate prepare interpret effectively key analytical finding audience asset . health care setting health information . knowledge pharmaceutical product radiation therapy asset . previous health datum set asset . fluency require bilingualism asset . close statement find role exciting visit website check 'career' . apply select interview contact . CIHI committed foster inclusive barrier free accessible environment . commitment include arrange accommodation ensure equitable participate recruitment selection process . require accommodation meet . principal organisation organisation regroupe des leaders faire bouger les chose . autonome sans nous pour essentielle sur les systemes sante au pay . dans . L'ICIS offron milieu travail exceptionnel favorise diversite respect l'integrite collaboration l'innovation . Renseignexz vous sur notre strategie sur l'equite diversite l'inclusion les effort nous deployon pour inclusif . L'ICIS sachant ce importe ses employes leur offre une gamme d'avantage les suivant une structure salariale flexible des premier jour travail l'adhesion au regime retraite HOOPP programme planification retraite equilibre travail vie personnelle programme planification carriere des programme d'apprentissage perfectionnement professionnel titre dthemploye l'ICIS dans . joue role dans les activites gestion d'analyse des donnees pour Systeme national declaration des accident incident . peuvent developpement maintenance des systemes l'evaluation qualite des donnees soutien clientele l'engagement des intervenants l'execution des demandes donnees personnalisees ainsi l'analyse des donnees l'interpretation des produits analytique . ainsi qu'a diverses reunion . Quelles seront vos responsabilites . pour rapport analytiques d'actualite indicateurs tableaux donnees demand donnees personnalisees documentation pertinente . aux fins diffusion interne externe . . des activites gestion des donnees comme redaction mise jour des code statistique requis pour preparation calcul . des scenario d'essai pour assurer conformite au cadre qualite l'information l'ICIS . . Maintenir des connaissances approfondies des donnees des outils des techniques analytique utilises dans production des rapport standard . . effectuer des analyses environnementale documentaires l'appui l'elaboration rapport . . p. . rapport analytique note methodologique technique destines aux medias aux fin diffusion des resultats transmission des connaissance examiner les document assurer l'exactitude analytique qualite . . Fournir soutien rapide professionnel aux clients internes externes repondant leurs question . . conformite . Tenir jour sa connaissance des banques donnees l'ICIS des tendance information travaux actuels participer . . Agir titre d'expert encadrer les membres l'equipe . . Participer d'autres reunion . profit Diplome premier cycle dans domaine combinaison equivalente formation d'experience . atout . ans d'experience travail avec des basis donnees relationnelle vastes fichiers donnees ce comprend manipulation preparation donnees meme presentation d'analyse rapport destines diver public . Maitrise manipulation donnees l'utilisation logiciels statistique tel Python . Maitrise des application Microsoft Office . minimum supervision . pour l'organisation gestion du temps capacite gerer multiple projet priorites simultanement facon . grand souci du detail excellente aptitude pour . Excellentes aptitude pour communication verbale ecrite capacite manifeste preparer interpreter presenter efficacement les principaux resultats analytique diver public atout . Connaissance des produits pharmaceutique radiotherapie atout . atout . Maitrise l'anglais essentielle atout . Declaration Pour savoir sur cette offre sur d'autres excellente possibilites visitez nous au parcourez notre Carrieres . nous remercion tous les participant mais nous ne communiquerons qu'avec les candidats retenu . l'utilisation dans document forme masculine feminine pour seul . milieu travail inclusif sans obstacle accessible . vue favoriser une participation equitable aux processus recrutement selection . nous nous efforceron d'y repondre . Skills Reference"
    },
    "companyDescription": "",
    "description": "Category\n    \n   \n    Data Analysis\n    \n  \n   \n  \n   \n    City\n    \n   \n    Ottawa, Toronto, Ontario, Canada\n   \n    \n  \n   \n   \n  \n  \n   \n    Job Description\n    \n   \n    Senior Analyst, Pharmaceuticals, Data Management \n     \n     Who we are\n     \n    We are an organization comprised of industry thought leaders who are passionate about health data and want to make a difference in the health care field. We are an independent, not-for-profit organization and together with our partners we provide essential information on Canada's health systems, enabling decisions that lead to healthier Canadians. As a valued member of the CIHI team, you and your work will have a pivotal role in the evolution of Canada's health care systems.\n     CIHI is recognized as an exceptional place to work that embraces diversity, respect, integrity, collaboration and innovation. Learn about our Equity, Diversity and Inclusion Strategy and the work being done to create a more inclusive and welcoming organization by focusing on how we learn, govern and practise.\n     At CIHI, we recognize what matters to our employees. Some of the benefits of working at CIHI include\n    \n      HOOPP Pension Plan (Defined Benefits Pension)\n      Retirement Planning Program\n      Generous vacation days for permanent and long-term contracts\n      Work-life balance\n      Career Planning Program\n      Learning and Professional Development Program\n      Flexible benefits program from your first day on the job for permanent and long-term contracts\n    \n     \n     \n     Why is this role important?\n     As a valued member of the CIHI team, your work will have a pivotal role in the evolution of Canada\u2019s Health Care system. The Senior Analyst, Pharmaceuticals, will play a key role in providing data and analytical support to the National System for Incident Reporting (NSIR) and the National Prescription Drug Utilization Information System (NPDUIS). This may involve data management and system development and maintenance activities, assessing data quality, client support and stakeholder engagement, fulfilling custom data requests, as well as data analysis and interpretation of analytical products. Senior Analysts also play a key role in mentoring team members. Senior Analysts will participate in department/branch projects and initiatives, as well as other meetings and special projects as required. \n     \n     What you'll do\n     1. Works with the Lead to support data management and the production of key deliverables for internal and external dissemination, including topical analytic reports, indicators, data tables, custom data requests, and relevant documentation.\n     \n     2. Conducts data management activities including writing and updating statistical code required for the development, computation, analysis, and/or validation of key deliverables. This may include leading the development and execution of test strategies / test cases to ensure adherence with CIHI\u2019s corporate information quality framework.\n     \n     3. Maintains detailed knowledge of data, tools, and analytical techniques used to produce standard and ad-hoc outputs.\n     \n     4. Conducts environmental scans and literature reviews to support the development of reports, statistics, and indicators.\n     \n     5. Leads and/or contributes to the development of materials (e.g., analytical reports, methodology or technical notes, presentations, educational, media, etc.) for dissemination of findings and knowledge translation, and reviews written products for analytic accuracy and quality. \n     \n     6. Provides professional and timely client support to respond to internal and external client queries as required.\n     \n     7. Ensures adherence to, and ability to demonstrate compliance with, CIHI\u2019s privacy and security policies and procedures.\n     \n     8. Maintains current knowledge of CIHI\u2019s data holdings, trends in health services research and health policy, and stakeholder information needs to support current work and contribute to the development of new analytic proposals.\n     \n     9. Acts as a subject matter expert and mentors team members.\n     \n     10. Participates in other meetings and corporate project teams as required. \n     \n     What you'll bring to the table\n     \n    Undergraduate degree in a related field, or equivalent education/experience. A graduate degree in is an asset.\n     \n    Three to five years related experience working with relational databases / large datasets, including manipulating, maintaining, and preparing data and presenting analyses and reports for different audiences.\n     \n    Proficiency with data manipulation and statistical software, such as SAS, R, Python or other statistical software.\n     \n    Proficiency in use of Microsoft Office applications.\n     \n    Excellent interpersonal skills and ability to work as part of a multi-disciplinary team with minimal supervision.\n     \n    Proven organizational and time management skills, with an ability to manage multiple projects and priorities effectively to meet deadlines.\n     \n    Strong attention to detail and advanced problem-solving skills.\n     \n    Strong written and verbal communication skills and demonstrated ability to prepare, interpret and effectively present key analytical findings for different audiences is an asset.\n     \n    Experience working in a health care setting and/or in health information. Knowledge of pharmaceutical products or radiation therapy is an asset.\n     \n    Previous experience working with CIHI data or related health data sets is an asset.\n     \n    Fluency in English is required, bilingualism (English and French) is an asset. \n     \n     Closing Statement\n     \n    To find out more about this role and other exciting opportunities visit our website at www.cihi.ca and check out our 'Careers' section.\n     We thank all those who apply, however, only candidates selected for an interview will be contacted.\n     \n     \n     Employment Equity\n     \n    At CIHI we are committed to fostering an inclusive, barrier-free and accessible environment. Part of this commitment includes arranging accommodations to ensure an equitable opportunity to participate in the recruitment and selection process. If you require an accommodation, we will work with you to meet your needs.\n     \n     \n     \n     \n     \n    Analyste principal \n     \n     Notre organisation\n     \n    Notre organisation regroupe des leaders d'opinion de l'industrie qui sont passionn\u00e9s par les donn\u00e9es et veulent faire bouger les choses dans le domaine de la sant\u00e9. \u00c0 titre d'organisme autonome et sans but lucratif, nous collaborons avec nos partenaires pour fournir de l'information essentielle sur les syst\u00e8mes de sant\u00e9 au pays, favorisant la prise de d\u00e9cisions \u00e9clair\u00e9es qui visent \u00e0 am\u00e9liorer la sant\u00e9 des Canadiens. \u00c0 titre d'employ\u00e9 de l'ICIS, vous jouerez un r\u00f4le d\u00e9terminant dans l'\u00e9volution du syst\u00e8me de sant\u00e9 canadien.\n     L'ICIS offrons un milieu de travail exceptionnel qui favorise la diversit\u00e9, le respect, l'int\u00e9grit\u00e9, la collaboration et l'innovation. Renseignexz-vous sur notre strategie sur l'\u00e9quit\u00e9, la diversit\u00e9 et l'inclusion et les efforts que nous d\u00e9ployons pour cr\u00e9er un environnmenent plus inclusif et accueillant en misant sur nos apprentissages, notre gouvernance et nos pratiques.\n     L'ICIS, sachant ce qui importe \u00e0 ses employ\u00e9s, leur offre une gamme d'avantages, dont les suivants : \n    \n     une structure salariale concurrentielle\n      un r\u00e9gime d'avantages sociaux flexible d\u00e8s le premier jour de travail\n      l'adh\u00e9sion au r\u00e9gime de retraite HOOPP\n      un programme de planification de la retraite\n      un \u00e9quilibre travail-vie personnelle\n      un programme de planification de carri\u00e8re\n      des programmes d'apprentissage et de perfectionnement professionnel\n    \n     \n     \n     Pourquoi ce r\u00f4le est-il important ?\n     \u00c0 titre d\u2019employ\u00e9 de l\u2019ICIS, vous jouerez un r\u00f4le d\u00e9terminant dans l\u2019\u00e9volution des syst\u00e8mes de sant\u00e9 canadiens. L\u2019analyste principal, Pharmaceutique, joue un r\u00f4le important dans les activit\u00e9s de gestion et d\u2019analyse des donn\u00e9es pour le Syst\u00e8me national de d\u00e9claration des accidents et incidents (SNDAI) et le Syst\u00e8me national d\u2019information sur l\u2019utilisation des m\u00e9dicaments prescrits (SNIUMP). Ces activit\u00e9s peuvent comprendre la gestion des donn\u00e9es, le d\u00e9veloppement et la maintenance des syst\u00e8mes, l\u2019\u00e9valuation de la qualit\u00e9 des donn\u00e9es, le soutien \u00e0 la client\u00e8le et l\u2019engagement des intervenants, l\u2019ex\u00e9cution des demandes de donn\u00e9es personnalis\u00e9es, ainsi que l\u2019analyse des donn\u00e9es et l\u2019interpr\u00e9tation des produits analytiques. L\u2019analyste principal joue \u00e9galement un r\u00f4le cl\u00e9 dans l\u2019encadrement des membres de l\u2019\u00e9quipe et participe aux projets et initiatives de la Direction et de la Division, ainsi qu\u2019\u00e0 diverses r\u00e9unions et \u00e0 des projets sp\u00e9ciaux, au besoin. \n     \n     Quelles seront vos responsabilit\u00e9s ?\n     1. Collaborer avec le chef de section pour appuyer la gestion des donn\u00e9es et la production des principaux livrables (rapports analytiques d\u2019actualit\u00e9, indicateurs, tableaux de donn\u00e9es, demandes de donn\u00e9es personnalis\u00e9es, documentation pertinente, etc.) aux fins de diffusion interne et externe.\n     \n     2. Ex\u00e9cuter des activit\u00e9s de gestion des donn\u00e9es, comme la r\u00e9daction et la mise \u00e0 jour des codes statistiques requis pour la pr\u00e9paration, le calcul, l\u2019analyse ou la v\u00e9rification des principaux livrables. Il peut notamment s\u2019agir de diriger l\u2019\u00e9laboration et l\u2019ex\u00e9cution des strat\u00e9gies et des sc\u00e9narios d\u2019essai pour assurer la conformit\u00e9 au cadre de la qualit\u00e9 de l\u2019information de l\u2019ICIS.\n     \n     3. Maintenir des connaissances approfondies des donn\u00e9es, des outils et des techniques analytiques utilis\u00e9s dans la production des rapports standards et sp\u00e9ciaux.\n     \n     4. Effectuer des analyses environnementales et documentaires \u00e0 l\u2019appui de l\u2019\u00e9laboration de rapports, de statistiques et d\u2019indicateurs.\n     \n     5. Diriger ou appuyer la r\u00e9daction de documents (p. ex. rapports analytiques, notes m\u00e9thodologiques ou techniques, pr\u00e9sentations, mat\u00e9riel de formation et documents destin\u00e9s aux m\u00e9dias) aux fins de diffusion des r\u00e9sultats et de transmission des connaissances, et examiner les documents afin d\u2019en assurer l\u2019exactitude analytique et la qualit\u00e9.\n     \n     6. Fournir un soutien rapide et professionnel aux clients internes et externes en r\u00e9pondant \u00e0 leurs questions, au besoin.\n     \n     7. Assurer et d\u00e9montrer la conformit\u00e9 aux politiques et proc\u00e9dures de l\u2019ICIS en mati\u00e8re de respect de la vie priv\u00e9e et de s\u00e9curit\u00e9.\n     \n     8. Tenir \u00e0 jour sa connaissance des banques de donn\u00e9es de l\u2019ICIS, des tendances en mati\u00e8re de recherche sur les services de sant\u00e9 et de politiques de sant\u00e9, et des besoins en information des intervenants afin d\u2019appuyer les travaux actuels et de participer \u00e0 l\u2019\u00e9laboration de nouvelles offres analytiques.\n     \n     9. Agir \u00e0 titre d\u2019expert et encadrer les membres de l\u2019\u00e9quipe.\n     \n     10. Participer \u00e0 d\u2019autres r\u00e9unions et collaborer avec d\u2019autres \u00e9quipes de projet de l\u2019ICIS, au besoin. \n     \n     Que mettriez-vous \u00e0 profit ? \n     \n    Dipl\u00f4me de premier cycle dans un domaine connexe ou combinaison \u00e9quivalente de formation et d\u2019exp\u00e9rience. Dipl\u00f4me d\u2019\u00e9tudes sup\u00e9rieures, un atout.\n     \n    De 3 \u00e0 5 ans d\u2019exp\u00e9rience de travail avec des bases de donn\u00e9es relationnelles ou de vastes fichiers de donn\u00e9es, ce qui comprend la manipulation, la tenue \u00e0 jour et la pr\u00e9paration de donn\u00e9es, de m\u00eame que la pr\u00e9sentation d\u2019analyses et de rapports destin\u00e9s \u00e0 divers publics.\n     \n    Ma\u00eetrise de la manipulation de donn\u00e9es et de l\u2019utilisation de logiciels statistiques tels que SAS, R ou Python.\n     \n    Ma\u00eetrise des applications de Microsoft Office.\n     \n    Entregent et capacit\u00e9 \u00e0 travailler au sein d\u2019une \u00e9quipe multidisciplinaire avec un minimum de supervision.\n     \n    Aptitudes \u00e9prouv\u00e9es pour l\u2019organisation et la gestion du temps, et capacit\u00e9 \u00e0 g\u00e9rer de multiples projets et priorit\u00e9s simultan\u00e9ment de fa\u00e7on \u00e0 respecter les d\u00e9lais.\n     \n    Grand souci du d\u00e9tail et excellentes aptitudes pour la r\u00e9solution de probl\u00e8mes.\n     \n    Excellentes aptitudes pour la communication verbale et \u00e9crite et capacit\u00e9 manifeste \u00e0 pr\u00e9parer, interpr\u00e9ter et pr\u00e9senter efficacement les principaux r\u00e9sultats analytiques \u00e0 divers publics, un atout.\n     \n    Exp\u00e9rience de travail dans le milieu de la sant\u00e9 ou dans le domaine de l\u2019information sur la sant\u00e9. Connaissance des produits pharmaceutiques ou de la radioth\u00e9rapie, un atout.\n     \n    Exp\u00e9rience de travail avec les donn\u00e9es de l\u2019ICIS ou avec des ensembles de donn\u00e9es connexes sur la sant\u00e9, un atout.\n     \n    Ma\u00eetrise de l\u2019anglais essentielle; ma\u00eetrise du fran\u00e7ais, un atout. \n     \n     Declaration\n     \n    Pour en savoir plus sur cette offre ou sur d'autres excellentes possibilit\u00e9s, visitez-nous au www.icis.ca et parcourez notre section Carri\u00e8res.\n     Nous remercions tous les participants, mais nous ne communiquerons qu'avec les candidats retenus.\n     L\u2019utilisation dans le pr\u00e9sent document de la forme masculine ou f\u00e9minine, selon le contexte, a pour seul but d\u2019all\u00e9ger le texte.\n     \n     \n     \u00c9quit\u00e9 en emploi\n     \n    L'ICIS s'engage \u00e0 offrir un milieu de travail inclusif, sans obstacle et accessible. Il s'engage entre autres \u00e0 prendre les mesures d'adaptation n\u00e9cessaires en vue de favoriser une participation \u00e9quitable aux processus de recrutement et de s\u00e9lection. Par cons\u00e9quent, si vous avez des besoins sp\u00e9ciaux, nous nous efforcerons d'y r\u00e9pondre.\n     \n     \n     \n   \n  \n   \n   \n  \n  \n   \n    Skills\n   \n    \n  \n   \n   \n  \n  \n   \n    Reference\n    \n   \n    243264"
}