{
    "id": "cf649783a8c0ed37",
    "company": "Magnet Forensics",
    "positionName": "Operations Analyst",
    "jobType": [],
    "location": "Ottawa, ON",
    "salary": null,
    "postingDateParsed": "2023-10-13T18:55:01.872Z",
    "url": "https://www.indeed.ca/rc/clk?jk=cf649783a8c0ed37&from=jasx&tk=1hcvfr63ggrgr800&vjs=3",
    "externalApplyLink": "https://jobs.lever.co/magnetforensics/839d7ec4-d59d-4677-8449-1b9fbde28c60",
    "job_info_group": {
        "extracted_phone_numbers": [],
        "extracted_links": [
            "HTTP/HTTPS Links",
            "General Links",
            "WWW Links",
            "TLDs"
        ],
        "extracted_emails": [
            "aoda@magnetforensics.com"
        ],
        "extracted_location_data": [],
        "extracted_dates": [
            "Earlier this year",
            "2+ years"
        ],
        "extracted_languages": [],
        "extracted_laws": [],
        "extracted_norps": [],
        "extracted_orgs": [
            "Create accurate Order Contracts Create Accounts within Invoicing Portals Create",
            "Work with Marketing",
            "Magnet",
            "Your Team The Magnet Forensics Order Operations",
            "Magnet Inte GRITy",
            "Salesforce.com Create",
            "our competitors Teamwork",
            "Going Magnet Forensics",
            "Salesforce",
            "Magnet Forensics"
        ],
        "extracted_persons": [],
        "extracted_products": [],
        "extracted_money": [],
        "processed_text": "global leader development digital investigative software acquire analyze share evidence computer smartphone tablet internet thing relate device . continually innovate customer deploy advanced effective tool protect company community country . share exciting news Grayshift organization accelerate innovation transform digital investigation customer . pleased share combine organization operate . combination mobile cloud computer forensic expertise Magnet Forensics underscore dedication provide comprehensive dfir solution . include commitment help access modern digital device lawfully renowned product suite . focus innovate DIFR community share mission continue priority . team play critical role ensure customer receive product timely accurate manner . team highly motivated detail orient group focus continual improvement game delight customer internal stakeholder . quote leader Operations Analyst responsible sale cycle organization . role maintain salesforce contract datum fulfil license invoice customer ship product external customer internal team meet Customer ensure contractual compliance . accomplish analyze fulfill customer order request SLAs provide timely excellent customer service software license system create maintain report maintain workflow process document video manage team's inventory requirement invoice client prepare report respond customer email regard license fulfillment inquire create order material perform clerical duty maintain financial filing record system assist sale team customer issue order sale requirement assist finance team require example prepare match credit memofs assist complete vendor form check box . find display indicator success skill develop find folk . development journey learn learn . couple list short order fulfillment process excellent attention detail strong organizational teamwork skill demonstrate solve problem order meet Key Performance Indicators's achieve result independent action minimal supervision maintain strong collaborative approach amazing team provide support occasionally require meet business thing provide example demonstrate previous Greater Good \u2013 interest strive improve community . demonstrate passion difference respect \u2013 hold accountable transparent sharing information faith other's innovation \u2013 lead industry excellence reliability user simple relevant . highlight afraid push boundary stay ahead \u2013 collaborate internally externally care employee listen customer committed continuous learning focus build diverse inclusive workforce . commitment reflect hiring process embed treat . interested role meet qualification list encourage apply . Equal Employer consider applicant employment regard race colour religion sex orientation national origin age genetic basis forbid federal provincial local law . committed provide inclusive accessible recruitment process environment . accommodation applicant request hiring process . require accommodation talent team email ."
    },
    "companyDescription": "",
    "description": "Who We Are; What We Do; Where we\u2019re Going\n     \n     \n     \n       Magnet Forensics is a global leader in the development of digital investigative software that acquires, analyzes, and shares evidence from computers, smartphones, tablets and other IoT related devices. We are continually innovating so that our customers can deploy advanced and effective tools to protect their companies, communities, and countries.\n     \n     \n     \n       Earlier this year, we shared the exciting news that Grayshift and Magnet Forensics have come together as one organization to accelerate innovation and transform digital investigations for our customers. We\u2019re pleased to share that the combined organization is operating as Magnet Forensics.\n     \n      \n     \n     \n       The combination of mobile, cloud and computer forensics expertise under the Magnet Forensics name underscores our dedication to providing comprehensive, end-to-end DFIR solutions. This includes our commitment to helping with access to modern digital devices lawfully with our renowned product suite. And, our focus on innovating for the DIFR community, along with our shared mission, continues to be the top priority.\n     \n     \n     \n       Your Team\n     \n     \n       The Magnet Forensics \n      Order Operations team plays a critical role at Magnet, ensuring our customers receive their products in a timely and accurate manner. This team is a highly motivated, detail oriented group who focus on continual improvement and upping their game to delight our customers and internal stakeholders.\n     \n     \n     \n       A quote from your leader:\n     \n     \n     \n       \u201cThe \n      Operations Analyst \n      is responsible for the end of sale cycle within the organization. In this role you will maintain salesforce contract data, fulfil licenses, invoice customers, ship products to external Customers and work with the internal teams to meet Customer needs and ensure contractual compliance.\u201d\n     \n     \n     \n       What You Will Accomplish\n     \n     \n       Analyze and fulfill customer orders and requests within SLAs and provide timely and excellent customer service\n       Create accurate Order Contracts\n       Create Accounts within Invoicing Portals\n       Create software licenses within various systems\n       Create and maintain reports through Salesforce.com\n       Create and maintain workflow process documents and videos\n       Manage the team\u2019s inventory requirements\n       Invoice clients and prepare reports as needed\n       Respond to customer emails regarding license and fulfillment inquires\n       Work with Marketing to create order materials\n       Perform clerical duties such as maintaining financial filing and record systems\n       Assisting the sales team with customer issues, orders, and sales requirements\n       Assist the finance team, as required, for example Prepare and match credit memo\u2019s\n       Assist with completing Vendor Forms\n     \n     \n     \n       What We Are Looking For\n     \n     \n       We\u2019re looking for someone who checks off most, but not all, of the boxes. It\u2019s more important to us to find a candidate who can display \n      indicators of success through skills they have developed and experience they have been a part of, than to find folks who have \u201cbeen there, done that\u201d. We want to be a part of your development journey, and we\u2019ll learn as much from you as you learn from us.\n     \n     \n     \n       There are a couple must haves, but we will keep that list short:\n     \n     \n       2+ years of experience successfully working within order fulfillment processing\n       Experience working with Salesforce\n       Excellent attention to detail, strong organizational and teamwork skills and a demonstrated ability to solve problems in order to meet KPI\u2019s\n       Ability to successfully achieve results through independent actions with minimal supervision, while also maintaining a strong collaborative approach with your amazing team!\n      Providing support outside normal hours of work may occasionally be required to meet the business needs\n     \n     \n     \n       The Most Important Thing\n     \n     \n       We\u2019re looking for candidates that can provide examples of how they have demonstrated Magnet Inte\n      GRITy throughout their previous experiences:\n     \n     \n       Greater Good \u2013 we think beyond our own interests and strive to improve the communities around the world. This demonstrates our passion for making a difference in the world\n     \n     \n       Respect \u2013 holding ourselves accountable through transparent sharing of information and having faith in each other\u2019s abilities\n     \n     \n       Innovation \u2013 leading the industry in excellence and reliability while keeping the user experience simple and relevant. It also highlights that we are not afraid to push the boundaries to stay ahead of our competitors\n     \n     \n       Teamwork \u2013 collaborating internally and externally while caring about employees and listening to our customers\n     \n    \n    \n     \n       We\u2019re committed to continuous learning and are focused on building a diverse and inclusive workforce. This commitment will be reflected in our hiring processes and embedded in our values and how we treat one another. If you\u2019re interested in this role, but do not meet all of the qualifications listed above, we encourage you to apply anyways. \n     \n     \n       \n     \n     \n      Magnet Forensics is an Equal Opportunity Employer and considers applicants for employment without regard to race, colour, religion, sex, orientation, national origin, age, disability, genetics or any other basis forbidden under federal, provincial, or local law.\n     \n     \n       \n     \n     \n       We are committed to providing an inclusive, accessible recruitment process and work environment. Accommodation is available to all applicants upon request throughout the hiring process. If you require accommodation, please let our talent team know, or you can email \n      aoda@magnetforensics.com\n      ."
}