{
    "id": "717a21abbeba554f",
    "company": "BTY Consultancy Group Inc.",
    "positionName": "Proposals Coordinator",
    "jobType": [],
    "location": "Ottawa, ON",
    "salary": null,
    "postingDateParsed": "2023-10-14T18:54:22.871Z",
    "url": "https://www.indeed.ca/rc/clk?jk=717a21abbeba554f&from=jasx&tk=1hcvfpdfukoko804&vjs=3",
    "externalApplyLink": "https://ca.indeed.com/rc/clk?jk=717a21abbeba554f&atk=&xpse=SoBZ67I3JfXmbVyDz50LbzkdCdPP",
    "job_info_group": {
        "extracted_phone_numbers": [],
        "extracted_links": [
            "HTTP/HTTPS Links",
            "General Links",
            "WWW Links",
            "TLDs"
        ],
        "extracted_emails": [],
        "extracted_location_data": [
            "the United States",
            "Canada",
            "Ottawa"
        ],
        "extracted_dates": [
            "3 to 5 years",
            "4 years in a row"
        ],
        "extracted_languages": [
            "Spanish"
        ],
        "extracted_laws": [],
        "extracted_norps": [
            "French"
        ],
        "extracted_orgs": [
            "Sharepoint",
            "Great Place to",
            "Power Point",
            "Bilingual and Multilingual Capabilities",
            "Adobe Creative Apps",
            "LinkedIn",
            "Senior Management",
            "the Global Pursuits Team",
            "BTY's Global Pursuits Team",
            "Employee Assistance Program Get",
            "Instagram & Twitter"
        ],
        "extracted_persons": [],
        "extracted_products": [
            "Comfort",
            "Word, Excel"
        ],
        "extracted_money": [],
        "processed_text": "enthusiastic Pursuits Coordinator ambition creativity join . role base flexible office remote environment . key team responsible liaise team research prospective project support lead proposal preparation closely wide pursuit marketing group . ownership proposal process search bid development strategy submission . central point contact facilitate input business unit include internal Subject Matter expert external creative support team external consultant . research write compelling differentiated qualification content comply bid requirement showcase BTY's relevant capability . understand complex technical concept integrate easy understand narrative technical reader . develop visually engage content bid presentation marketing collateral . consistently lead detailed content bid review close process emphasis edit impact compliance thorough proofing completion check quality assurance . champion consistent deadline focused delivery high quality provide reliable regular update search content development proposal submission result update share lesson debrief internally bring prove Proposal Development College diploma university degree relevant discipline proven construction industry require solid understanding procurement portal search matching profile setup knowledge procurement portal consider key asset strong management skill coordinate multiple deliverable confidence managing process multiple simultaneous bid essential high proficiency Office include team outlook proficiency consider asset consider asset include impeccable communication listen interpersonal skill determine ethic deliver high quality demonstrate attention detail edit proofing deliverable confident engaging style drive buy deliver result build relationship excellent interview writing editing skill strategic thinking entrepreneurial drive test learn improve comfortable pressure tight deadline personnel locate zone legally eligible . detailed description request . consider team meaningful project impact community globally enjoy workplace flexibility freedom hybrid program receive competitive compensation package health dental benefit average vacation RRSP matching bonus sick advance career continuous learning professional development receive health support involve team building community support activity team certify employee \u00ae BTY commit diversity equity inclusion current team . visit website learn service market people success . follow stay connect . occasion request solicitation recruitment agency ."
    },
    "companyDescription": "",
    "description": "We are looking for an enthusiastic Pursuits Coordinator with the ambition and creativity to join BTY's Global Pursuits Team. This is a full-time role based in Ottawa within a flexible office/remote/work-from-home environment.\n  \n  \n  What You Get To Do \n  As a key member of our team, you will be responsible for liaising with all team members, researching prospective projects, supporting and leading proposal preparation, while working closely with the wider pursuits and marketing group.\n  \n  \n  \n  End to end ownership of proposal process from opportunities search, to bid development, strategy and submission. \n  Act as the central point of contact for and facilitate inputs from various business units, including Senior Management, the Global Pursuits Team, internal Subject Matter Experts, external creative support team, external sub-consultants, etc. \n  Research and write compelling and differentiated qualification content which complies with bid requirements and showcases BTY\u2019s relevant capabilities. \n  Understand complex technical concepts and integrate into easy-to-understand narratives for non-technical readers. \n  Develop visually engaging content for bids, presentations, and marketing collateral. \n  Consistently lead detailed content and bid review, and close-out process with emphasis on editing for impact and compliance, thorough proofing, completion check and quality assurance. \n  Champion consistent and deadline focused delivery of high-quality work, providing reliable and regular updates on opportunity search, content development, proposal submissions, results update and sharing lessons from debriefs internally\n \n  \n  \n  What You'll Bring \n  \n  3 to 5 years of proven Proposal Development experience; \n  College diploma or university degree in a relevant discipline; \n  Proven experience in the construction industry is required; \n  Solid understanding of procurement portals for opportunity search and matching profile setup; \n  Knowledge of top procurement portals in Canada and the United States will be considered a key asset; \n  Strong time management skills when coordinating multiple deliverables \n  Comfort and confidence in managing processes for multiple and simultaneous bids is essential; \n  High proficiency in Office 365, including Word, Excel, Power Point, Sharepoint, Teams, and Outlook; \n  Proficiency in Adobe Creative Apps considered an asset; \n  Bilingual and Multilingual Capabilities considered an asset, including French or Spanish; \n  Impeccable communication, listening and interpersonal skills; \n  Determined work ethic to deliver high quality work quickly; \n  Demonstrated attention to detail in editing and proofing of deliverables \n  Confident and engaging style that drives buy-in, delivers results and builds relationships; \n  Excellent interviewing, writing and editing skills; \n  Strategic thinking and entrepreneurial drive to test, learn and improve; \n  Comfortable working under pressure, within tight deadlines and with personnel located in different time zones; and \n  Must be legally eligible to work in Canada.\n \n  \n  \n \n  Detailed job description available upon request.\n  \n  Why Consider our Team? \n  \n  Work on meaningful projects that impact communities globally \n  Enjoy workplace flexibility with the freedom from a hybrid program \n  Receive a competitive compensation package with health and dental benefits, above-average vacation, RRSP matching, bonuses, sick days and more \n  Advance your career with continuous learning and professional development opportunities \n  Receive health and well-being support through our Employee Assistance Program \n  Get involved in team building and community support activities with a team who have been certified Best Place to Work for 4 years in a row by our employees and Great Place to Work\u00ae\n \n  \n  \n  BTY is committed to, and values, diversity, equity and inclusion of new and current team members.\n  \n  \n  Visit our website to learn more about our services, markets, and the people behind our success. Follow us on LinkedIn, Instagram & Twitter to stay connected. \n  On this occasion, we request no outside solicitation from recruitment agencies."
}