{
    "id": "89c1c67f81c3cd48",
    "company": "Merrick & Company",
    "positionName": "Mechanical Engineer",
    "jobType": [
        "Full-time"
    ],
    "location": "580 Terry Fox Drive, Kanata, ON",
    "salary": null,
    "postingDateParsed": "2024-01-04T03:14:59.109Z",
    "url": "https://www.indeed.ca/rc/clk?jk=89c1c67f81c3cd48&from=jasx&tk=1hjm3egi6irr6800&vjs=3",
    "externalApplyLink": "https://ca.indeed.com/applystart?jk=89c1c67f81c3cd48&from=vj&pos=top&mvj=0&spon=0&sjdu=o7sfz71MPdMgyiV0LZq0d4DDplm6SwWjHcxyoDIphKnivWw47HIlu-R5u-_wC3P9v1rT14rVxHVIagB_M7Vp7mF6lLE3_meA85QS86RiHN8gdLomPTxjVPn6bDPmqlwSHNUSHsbaAqdAepA_-DqTWIvZD7202fDErcUgSDWNl8Ev1WSmRE8OB-ilpZHo_CDaw9_XINGINv7OnqX9-Wv1cg&vjfrom=serp&log=1&astse=d84b9b63142ba90c&assa=8714",
    "job_info_group": {
        "extracted_phone_numbers": [],
        "extracted_links": [
            "HTTP/HTTPS Links",
            "General Links",
            "WWW Links",
            "TLDs"
        ],
        "extracted_emails": [],
        "extracted_location_data": [
            "Ontario",
            "continental USA",
            "our Kanata",
            "Canada"
        ],
        "extracted_dates": [
            "its 60+ years",
            "two years"
        ],
        "extracted_languages": [],
        "extracted_laws": [],
        "extracted_norps": [],
        "extracted_orgs": [
            "Engineering News Record",
            "Government of Canada Reliability Level",
            "CEAB",
            "Merrick & Company",
            "Canadian Citizenship Candidate",
            "Canadian Citizenship",
            "Physical Requirements",
            "Merrick and Company",
            "the Canadian Engineering Accreditation Board",
            "Mechanical Engineer / Designer",
            "Life Sciences, Nuclear",
            "RRSP",
            "a Professional Engineer",
            "REVIT",
            "Develop",
            "internationally as required Develop"
        ],
        "extracted_persons": [
            "Merrick"
        ],
        "extracted_products": [
            "AutoCAD"
        ],
        "extracted_money": [],
        "processed_text": "overview seek support mechanical design project multi disciplinary team . person locate office . client project position require . internationally multi office multi discipline firm consist diverse dedicated talented staff achieve design excellence existence . office worldwide rank design firm . provide personalized service client . desire personal professional growth define understanding design construction document process adaptability short term long term project environment require blend creativity high technical skill . successful start motivated innovative articulate discipline confident demanding exciting fast pace environment . position require competent mechanical engineer designer mechanical design team responsible phase mechanical design production variety National Security project range program construction administration . exist participation facility commissioning project . description participate mechanical design team multi disciplinary project team execute detailed mechanical plumbing process control design complex mechanical facility include life science nuclear facility inclusive detailed engineering calculation production detailed 3d model construction drawing specification Reports require perform site inspection testing commissioning equipment facility require include travel abroad utilize excellent verbal write communication skill interact effectively client employee maintain expert level knowledge applicable code standard design construction nuclear biocontainment facility maintain expert level skill require software package include execute project specific Quality Assurance procedure exercise excellent independent judgement initiative complete design task independently team environment base Merrick's hybrid arrangement comprise office remote onsite . specific requirement mechanical engineer designer mechanical building design government academic private client . demonstrate follow area asset hvac plumbing process fire protection control design minimum . licensure canadian jurisdiction prefer . currently license demonstrate plan include hold Mechanical engineering degree university accredit licensure join . aspect mechanical building design include planning calculation equipment selection schematic design production construction document drawing specification construction administration strong asset Laboratory design construction knowledge advantage . energy modeling life cycle cost analysis sustainability design asset proficient . proficient report writing include basis design report specification field report . good verbal writing skill interact effectively client employee strong oral presentation skill . demonstrate effective problem solve skill apply mechanical design principal travel possess current passport . anticipate include international travel . local prefer Client project position require possess security clearance . Level II Secret Clearance prefer . require sit extended period computer workstation . jobsite require inclusive active construction commissioning effort . require access elevated area functional operational equipment don appropriate PPE Air travel business trip require overseas . physical demand describe representative meet employee perform essential function . reasonable accommodation enable individual perform essential function . additional information apply online . mail hard copy party resume accept . offer competitive compensation benefit package include unique life benefit . recognize develop talent employee access wide range internal external training coaching program reward achievement excellent benefit competitive salary . Equal Employer include vet ."
    },
    "companyDescription": "",
    "description": "Overview: \n  Merrick and Company is seeking Mechanical Engineer / Designer to support the mechanical design of projects as part of a multi disciplinary team. This person will be located in our Kanata, ON office. Client projects for this position require Canadian Citizenship.\n  Merrick is an internationally known multi-office and multi-discipline firm consisting of a diverse, dedicated, and talented staff which has achieved design excellence throughout its 60+ years of existence. With offices worldwide, Merrick and Company has been ranked as one of the top 100 design firms by Engineering News Record. Merrick provides personalized services to various clients throughout the world.\n  Candidates that have a desire for personal and professional growth, a well-defined understanding of design and construction document processes, and adaptability for short term and long-term projects in an environment that requires a blend of creativity and high technical skills. Successful candidates must be self-starting, motivated, innovative, articulate, self-disciplined, and confident in a demanding, exciting, and fast-paced environment. This position requires a competent mechanical engineer / designer who as a member of the mechanical design team will be responsible for all phases of mechanical design production for a variety of Life Sciences, Nuclear, and National Security projects ranging from programming through construction administration. Opportunities also exist for the participation in facility commissioning projects.\n  Job Description \n \n  Participating as part of the mechanical design team and the multi-disciplinary project team, execute the detailed mechanical, plumbing/process and controls design of complex mechanical facilities including life science and nuclear facilities, inclusive of:\n  \n    Detailed engineering calculations\n    Production of detailed 3D models and construction drawings\n    Specifications\n    Reports as required\n  \n   Perform site inspection, testing, and commissioning of equipment and facilities as required, which may include travel within Canada and abroad\n   Utilize excellent verbal and written communication skills to interact effectively with clients and other employees\n   Develop and maintain expert level knowledge of applicable codes and standards for the design and construction of nuclear and biocontainment facilities in Canada and internationally as required\n   Develop and maintain expert level skills in required software packages including REVIT\n   Execute all work in accordance with Merrick and project specific Quality Assurance procedures\n   Exercise excellent independent judgement and initiative to complete design tasks\n   Work independently and in a team environment based upon Merrick\u2019s hybrid arrangement comprised of office, remote, and onsite work.\n \n  Specific experience requirements: \n \n  We are looking for a mechanical engineer / designer with experience in mechanical building design for government, academic, and private clients. Demonstrated experience in as many of the following areas as possible is an asset: HVAC, plumbing/process, fire protection and controls design\n   A minimum of eight (8) years related experience.\n   Licensure as a Professional Engineer in Ontario or another Canadian jurisdiction is preferred. If the candidate is not currently licensed, they must demonstrate a plan and ability, including holding a Mechanical engineering degree from a university accredited by the Canadian Engineering Accreditation Board (CEAB), to obtain licensure within two years of joining Merrick.\n   Experience in aspects of mechanical building design including planning, calculations, equipment selection, schematic design, production of construction documents (drawings and specifications), and construction administration is a strong asset\n   Laboratory design and construction knowledge is an advantage.\n   Experience in energy modeling and life cycle cost analysis for sustainability design is an asset\n   Candidate shall be proficient in the use of REVIT and AutoCAD.\n   Candidate shall be proficient in report writing including basis of design reports, specifications, field reports, etc.\n   Candidate shall have good verbal and writing skills and be able to interact effectively with clients and other employees and must have strong oral presentation skills.\n   Candidate must be able to demonstrate effective problem solving skills applying mechanical design principals\n   Candidate must be able to travel and must possess a current passport. It is anticipated that this may include some international travel.\n   Local candidates preferred\n   Client projects for this position require Canadian Citizenship\n   Candidate must possess or be able to obtain Government of Canada Reliability Level security clearance. Level II Secret Clearance is preferred. \n \n Physical Requirements\n \n   The job requires the ability to sit for extended periods at a computer workstation.\n   Work at jobsites will be required inclusive of active construction and or commissioning efforts. Will require access to/from elevated areas, functional and operational equipment and donning of appropriate PPE\n   Air travel and business trips will be required within Canada, continental USA and possible overseas work as well.\n   The physical demands described here are representative of those that must be met by an employee to successfully perform the essential functions of this job.\n   Reasonable accommodations may be made to enable individuals with disabilities to perform the essential functions.\n \n  Additional information:\n \n   Apply online only. No e-mail, hard copy or third-party resumes accepted.\n   Merrick & Company offers a competitive compensation and benefits package which includes; RRSP, and unique work-life benefits.\n   We recognize the importance of developing top talent from within, our employees have access to a wide range of internal and external training and coaching programs and are rewarded for their achievements through excellent benefits and competitive salaries.\n   An Equal Opportunity Employer, including disability/vets."
}