{
    "id": "dc521d5b76d59328",
    "company": "The Ottawa Hospital",
    "positionName": "Registered Nurse, Cardiac Catheterization Lab",
    "jobType": [],
    "location": "501 Smyth Rd, Ottawa, ON",
    "salary": null,
    "postingDateParsed": "2023-09-22T06:49:04.526Z",
    "url": "https://www.indeed.ca/rc/clk?jk=dc521d5b76d59328&from=jasx&tk=1hb2v4hd2is3q800&vjs=3",
    "externalApplyLink": "https://ca.indeed.com/rc/clk?jk=dc521d5b76d59328&atk=&xpse=SoDM67I3Ki2YUTwXxp0LbzkdCdPP",
    "job_info_group": {
        "extracted_phone_numbers": [],
        "extracted_links": [
            "HTTP/HTTPS Links",
            "General Links",
            "WWW Links",
            "TLDs"
        ],
        "extracted_emails": [],
        "extracted_location_data": [
            "Canada",
            "B.C.L.S.",
            "the Province of Ontario"
        ],
        "extracted_dates": [
            "today",
            "approximately March 30, 2024"
        ],
        "extracted_languages": [
            "English"
        ],
        "extracted_laws": [],
        "extracted_norps": [
            "French"
        ],
        "extracted_orgs": [
            "Rotation/Shifts Days",
            "Position Information Electrophysiology Lab/Cardiac Catheterization Lab Temporary",
            "DBP",
            "Learning and Leadership Development",
            "the University of Ottawa",
            "The Ottawa Hospital",
            "The Ottawa Hospital Inspired",
            "Cardiac"
        ],
        "extracted_persons": [],
        "extracted_products": [],
        "extracted_money": [],
        "processed_text": "research drive compassion TOH Canada's large learning research multi campus hospital . bed staff deliver specialized care Eastern region . compassion people relentless pursuit discovery seek solution complex health care challenge continually engage community support vision patient care . research institute partner hospital continually gain national international recognition high quality patient care teaching research strive meet culturally diverse community serve . . evening night include weekend hour shift . standby night return . information purpose Hospital reserve change . Basic Requirements Current Certificate Competence current catheterization laboratory Critical care completion Critical Care course e.c.g. interpretation current certification eligible proficiency \u2013 oral expression advanced level comprehension advanced level . language proficiency requirement base nature position level interaction Frenchand English speak client . Preferred Qualifications O.R. certification current O.R. C.O.R. . expect commit provide healthy safe inclusive environment . drive purpose provide patient class care exceptional service compassion love . offer attractive equitable compensation package include comprehensive benefit package Defined Benefit Pension plan insurance protection . offer discount choice provider variety product service . provide Health Wellness resource personal professional development house team help align goal career objective . interested apply passionate motivate improve health community excite lead edge medical technology commit excellence quality patient safety hear . submit application position interested . apply select consideration contact . equal employer . request accommodation recruitment process ."
    },
    "companyDescription": "",
    "description": "About The Ottawa Hospital \n    \n    \n    \n     \n      Inspired by research and driven by compassion!\n     \n      \n     \n     \n       The Ottawa Hospital (TOH) is one of Canada\u2019s largest learning and research multi-campus hospitals. With more than 1,100 beds and approximately 12,000 staff members, we deliver specialized care to the Eastern Ontario region. \n     \n      \n     \n     \n      From the compassion of our people to the relentless pursuit of new discoveries, The Ottawa Hospital never stops seeking solutions to the most complex health-care challenges while continually engaging with the community to support our vision for better patient care.\n     \n      \n     \n     \n       Working together with its research institute, the University of Ottawa, and other partners, the hospital is continually gaining national and international recognition for high-quality patient care, teaching and research, while striving to meet the needs of the culturally diverse community we serve.\n      \n    \n   \n  \n \n \n  \n   Position Information \n    \n    \n    \n     \n      Electrophysiology Lab/Cardiac Catheterization Lab\n     \n     \n       \n       Temporary until approximately March 30, 2024.\n      \n    \n   \n  \n \n \n  \n   Rotation/Shifts \n    \n    \n    \n     \n      Days, evenings and night, including weekends, 8 hour shifts. Must be available for standby and call back (nights) - 30 minutes return time to work.\n     \n     \n      For information purposes only - The Hospital reserves the right to change.\n      \n    \n   \n  \n \n \n  \n   Basic Requirements \n    \n    \n    \n     \n      \n       \n        Current Certificate of Competence in the Province of Ontario;\n        \n      \n       \n        Current Cardiac catheterization laboratory experience;\n        \n      \n       \n        Two (2) years Critical Care experience;\n        \n      \n       \n        Completion of Critical Care course;\n        \n      \n       \n        E.C.G. interpretation;\n        \n      \n       \n        Current certification for B.C.L.S.;\n        \n      \n       \n        Must be eligible to work in Canada;\n        \n      \n       \n        Proficiency in English and French \u2013 oral expression (advanced level) and comprehension (advanced level).\n        \n     \n     \n     \n      Language proficiency requirements are based on the nature of the position and the level of interaction with French- and English-speaking clients.\n      \n    \n   \n  \n \n \n  \n   Preferred Qualifications \n    \n    \n    \n     \n      \n       \n        O.R. certification;\n        \n      \n       \n        Current O.R. and C.O.R. experience.\n        \n     \n    \n   \n  \n \n \n  \n   What you can expect from us \n    \n    \n    \n     \n      The Ottawa Hospital is committed to providing a healthy, safe, and inclusive work environment for everyone. We are driven by our purpose to provide each patient with the world-class care, exceptional service and compassion we would want for our loved ones.\n     \n      \n     \n     \n       We offer an attractive and equitable compensation package including a comprehensive benefits package, a Defined Benefit Pension (DBP) plan, and insurance protection. We also offer discounts from choice providers on a variety of products and services. \n     \n      \n     \n     \n      The Ottawa Hospital provides various Health and Wellness resources as well as opportunities for personal and professional development opportunities from our in-house Learning and Leadership Development team to help align your goals with your career objectives.\n      \n    \n   \n  \n \n \n  \n   Interested? Apply today! \n    \n    \n    \n     \n      If you are passionate about what you do, motivated by improving the health of the community, excited by leading-edge medical technology, and as committed to excellence, quality and patient safety as we are, we would like to hear from you. Please submit an on-line application for the position you are interested in. We thank all those who apply but only those selected for further consideration will be contacted.\n     \n     \n       The Ottawa Hospital is an equal opportunity employer. Upon request, accommodations due to a disability are available throughout the recruitment process."
}