{
    "id": "b77ed175ba4c2587",
    "company": "ADP",
    "positionName": "Sp\u00e9cialiste du traitement de la paie bilingue",
    "jobType": [],
    "location": "Ottawa, ON",
    "salary": null,
    "postingDateParsed": "2023-10-16T18:52:48.166Z",
    "url": "https://www.indeed.ca/rc/clk?jk=b77ed175ba4c2587&from=jasx&tk=1hcvfn7eljiim800&vjs=3",
    "externalApplyLink": "https://click.appcast.io/track/hqymhps-org?cs=5c&jg=5jky&bid=lUf2CslKyPxm6i440ZgUYA==&ittk=QMKFBG7RB7",
    "job_info_group": {
        "extracted_phone_numbers": [],
        "extracted_links": [
            "HTTP/HTTPS Links",
            "General Links",
            "WWW Links",
            "TLDs"
        ],
        "extracted_emails": [],
        "extracted_location_data": [
            "Fournir aux",
            "l'\u00e9crit",
            "au besoin"
        ],
        "extracted_dates": [],
        "extracted_languages": [],
        "extracted_laws": [],
        "extracted_norps": [
            "les plus productifs"
        ],
        "extracted_orgs": [
            "associ\u00e9es",
            "y compris la v\u00e9rification du casier judiciaire",
            "aux probl\u00e8mes",
            "ADP collabore avec plus de 740 000",
            "DiversityInc\u00ae",
            "trimestrielles et de fin d'exercice",
            "ADP est \u00e0 la recherche d'un sp\u00e9cialiste du traitement de la paie",
            "Voil\u00e0 l'unique objectif d'ADP",
            "propos de la paie",
            "FORTUNE\u00ae",
            "les ressources documentaires",
            "l'une des \"",
            "afin de trouver une",
            "ses apprentissages dans le cadre de ses fonctions",
            "C'est chez",
            "d'impartition des processus d'affaires",
            "\u00e0 la client\u00e8le",
            "au Canada une entreprise",
            "recommander les meilleures pratiques aux clients",
            "en mati\u00e8re de diversit\u00e9",
            "un",
            "sein d'\u00e9quipes",
            "Cette entreprise tire avantage du mod\u00e8le commercial d'ADP Comprehensive Services",
            "Bonne ma\u00eetrise de MS Office",
            "ADP",
            "suivant le processus en",
            "client\u00e8le/RH Connaissance des produits d'ADP",
            "ADP Canada",
            "admir\u00e9es \" par le magazine",
            "heureux au",
            "selon la r\u00e9glementation",
            "\u00e0 la",
            "Effectuer promptement la",
            "qu\u00eate d'une",
            "sur ce qui compte le"
        ],
        "extracted_persons": [
            "Si vous d\u00e9sirez contribuer",
            "qui lui attribu\u00e9s en",
            "un atout, ou l'\u00e9quivalent",
            "avec l'\u00e9quipe de soutien",
            "Tenir \u00e0 jour des notes compl\u00e8tes",
            "attribu\u00e9s ou autres",
            "Veuillez prendre",
            "Responsabilit\u00e9s",
            "synergie avec leurs besoins",
            "Capacit\u00e9 \u00e0 collaborer et \u00e0",
            "des ant\u00e9c\u00e9dents",
            "Sommaire du poste",
            "Des personnes qui aspirent \u00e0 un",
            "Fr\u00e9quemment d\u00e9sign\u00e9e"
        ],
        "extracted_products": [],
        "extracted_money": [],
        "processed_text": "nous les professionnel sont les travail . . Parce tout ce nous faison tourne autour des gen . commencant par les notre . Nous sommes ouverts aux nouvelles idees . Celles personnes voient grand exigent davantage leur carriere . travail epanouissant une vie famille . Les services complet d'adp ADP Comprehensive Services aux Etats Unis se sont pour lancer au cours l'exercice . l'organisation connait croissance rapide matiere comptes principaux . progression d'un nouveau modele d'affaires participer aux processus developpement etes excellente occasion croissance cette offre dthemploi pourrait vous interesser . . titulaire ce poste aidera les client tirer profit des solution exceptionnelle d'adp matiere paie sorte qu'ils puissent se concentrer pour eux croissance leur entreprise . Assumer responsabilite l'imputabilite relativement fonction traitement verification paie ce pour plusieurs client . Prioriser traiter paie des clients place . mise jour complete precise des dossiers des client leurs employes temps reel . precises relative aux profils des client leurs instruction pour traitement leur paie . Auditer paie des clients selon calendrier fin d'annee effectuer tout les remises aux tier avant les d'echeance etablie transmettre les donnees electroniquement generer les releves pour ces client . Utiliser tous les outil processus internes afin d'optimiser productivite assurer l'excellence du service . Recevoir des appels client client . Effectuer les verifications notamment conciliation fin d'annee les ajustements distribution des feuillets T4 R1 . client les renseignement essentiels exacts vigueur notamment declaration revenus . Utiliser les diverses basis donnees meme les site Web appropries pour trouver les reponse solution appropriees aux problemes des client . travailler collaboration technique interne les centre d'ADP solution . Travailler l'amelioration continue relativement aux produit aux processus aux procedures communiquant ses observation suggestion ainsi accroitre l'efficacite . Maintenir son titre aupres l'ACP Association canadienne paie participer toute les formation exigees par service mettre application . qualification requise Minimum deux annees d'experience traitement paie Deux annees d'experience administrative service atout Word Excel Internet requise Competences superieures service clientele l'oral bonnes competences ecoute active . Excellentes competence communication travailler efficacement au interfonctionnelles Excellentes competence gestion du temps aptitude respecter les echeance Tres bonne maitrise du francais l'anglais Scolarite Baccalaureat certificat matiere d'experience administrative service RH . Certification l'acp Association Canadienne Paie atout NOTE l'intention DES CANDIDATS note toute offre dthemploi est conditionnelle une verification . nous creon une facon travailler efficace afin vous puissiez atteindre vos objectifs . comme societes les reconnue par comme l'une des meilleure entreprise entreprise l'echelle mondiale afin d'aider leurs employes travailler intelligemment relever nouveaux defis deployer leur talent . Axer developpement sur les personnes signifie nous creon des plateformes transformeront monde du travail nous permettant ensemble decouvrir d'infinies possibilites . diversity fuel innovation . committed equal employment race color genetic information creed religion sex sexual orientation gender identity lawful alien status national origin age marital status protect veteran status . support inclusive workplace associate excel base personal merit qualification performance ."
    },
    "companyDescription": "",
    "description": "C'est chez nous que les professionnels sont les plus productifs et les plus heureux au travail. Voil\u00e0 l'unique objectif d'ADP. Parce que tout ce que nous faisons tourne autour des gens. En commen\u00e7ant par les n\u00f4tres. Nous sommes ouverts aux nouvelles id\u00e9es. Celles de personnes qui voient grand et qui exigent davantage de leur carri\u00e8re. Des personnes qui aspirent \u00e0 un travail \u00e9panouissant et \u00e0 une vie de famille en synergie avec leurs besoins\n  . \n  \n  \n Les services complets d'ADP:\n  \n  ADP Canada et ADP Comprehensive Services aux \u00c9tats-Unis se sont associ\u00e9es pour lancer au Canada une entreprise d'impartition des processus d'affaires au cours de l'exercice 2015. Cette entreprise tire avantage du mod\u00e8le commercial d'ADP Comprehensive Services, l'organisation qui conna\u00eet la croissance la plus rapide en mati\u00e8re de comptes principaux. Si vous d\u00e9sirez contribuer \u00e0 la progression d'un nouveau mod\u00e8le d'affaires et participer aux processus de d\u00e9veloppement, et \u00eates en qu\u00eate d'une excellente occasion de croissance, cette offre d'emploi pourrait vous int\u00e9resser.\n  \n  \n Sommaire du poste:\n  \n  ADP est \u00e0 la recherche d'un \n sp\u00e9cialiste du traitement de la paie. Le titulaire de ce poste aidera les clients \u00e0 tirer profit des solutions exceptionnelles d'ADP en mati\u00e8re de paie, de sorte qu'ils puissent se concentrer sur ce qui compte le plus pour eux : la croissance de leur entreprise.\n  \n  \n Responsabilit\u00e9s:\n  \n \n  Assumer la responsabilit\u00e9 et l'imputabilit\u00e9 relativement \u00e0 la fonction de traitement et de v\u00e9rification de la paie, et ce, pour plusieurs clients. \n  Prioriser et traiter la paie des clients qui lui attribu\u00e9s en suivant le processus en place. \n  Effectuer promptement la mise \u00e0 jour compl\u00e8te et pr\u00e9cise des dossiers des clients et de leurs employ\u00e9s en temps r\u00e9el. \n  Tenir \u00e0 jour des notes compl\u00e8tes et pr\u00e9cises relatives aux profils des clients et leurs instructions pour le traitement de leur paie. \n  Auditer la paie des clients selon le calendrier de fin d'ann\u00e9e et effectuer toutes les remises aux tiers avant les dates d'\u00e9ch\u00e9ance \u00e9tablies, transmettre les donn\u00e9es \u00e9lectroniquement et g\u00e9n\u00e9rer les relev\u00e9s pour ces clients. \n  Utiliser tous les outils et processus internes afin d'optimiser la productivit\u00e9 et assurer l'excellence du service; recommander les meilleures pratiques aux clients. \n  Recevoir des appels de clients (clients attribu\u00e9s ou autres). \n  Effectuer les v\u00e9rifications trimestrielles et de fin d'exercice, notamment la conciliation de fin d'ann\u00e9e, les ajustements et la distribution des feuillets T4/R1. \n  Fournir aux clients les renseignements essentiels et exacts selon la r\u00e9glementation en vigueur \u00e0 propos de la paie, notamment la d\u00e9claration de revenus. Utiliser les diverses bases de donn\u00e9es, les ressources documentaires, de m\u00eame que les sites Web appropri\u00e9s pour trouver les r\u00e9ponses et solutions appropri\u00e9es aux probl\u00e8mes des clients. \n  Travailler en collaboration avec l'\u00e9quipe de soutien technique interne et les diff\u00e9rents centres de d'ADP, au besoin, afin de trouver une solution. \n \n \n  Travailler \u00e0 l'am\u00e9lioration continue relativement aux produits, aux probl\u00e8mes, aux processus et aux proc\u00e9dures en communiquant ses observations et suggestions et ainsi, accro\u00eetre l'efficacit\u00e9. \n  Maintenir son titre aupr\u00e8s de l'ACP (Association canadienne de la paie) et participer \u00e0 toutes les formations exig\u00e9es par le service et mettre en application ses apprentissages dans le cadre de ses fonctions. \n \n  \n Qualifications requises:\n  \n \n  Minimum deux ann\u00e9es d'exp\u00e9rience en traitement de la paie \n  Deux ann\u00e9es d'exp\u00e9rience administrative en service \u00e0 la client\u00e8le/RH \n  Connaissance des produits d'ADP, un atout \n  Bonne ma\u00eetrise de MS Office (Word/Excel) et Internet requise \n  Comp\u00e9tences sup\u00e9rieures en service \u00e0 la client\u00e8le, \u00e0 l'\u00e9crit et \u00e0 l'oral, et bonnes comp\u00e9tences en \u00e9coute active. \n  Excellentes comp\u00e9tences en communication \n  Capacit\u00e9 \u00e0 collaborer et \u00e0 travailler efficacement au sein d'\u00e9quipes interfonctionnelles \n  Excellentes comp\u00e9tences en gestion du temps et aptitude \u00e0 respecter les \u00e9ch\u00e9ances \n  Tr\u00e8s bonne maitrise du fran\u00e7ais et de l'anglais \n \n  \n Scolarit\u00e9:\n  \n \n  Baccalaur\u00e9at/certificat, un atout, ou l'\u00e9quivalent en mati\u00e8re d'exp\u00e9rience administrative en service \u00e0 la client\u00e8le/RH. \n  Certification de l'ACP (Association Canadienne de la Paie) : un atout \n \n  \n  NOTE \u00c0 L'INTENTION DES CANDIDATS:\n  \n  Veuillez prendre note que toute offre d'emploi est conditionnelle \u00e0 une v\u00e9rification des ant\u00e9c\u00e9dents, y compris la v\u00e9rification du casier judiciaire.\n  \n  Nous cr\u00e9ons une fa\u00e7on de travailler plus efficace, afin que vous puissiez atteindre vos objectifs. Fr\u00e9quemment d\u00e9sign\u00e9e comme l'une des \" soci\u00e9t\u00e9s les plus admir\u00e9es \" par le magazine FORTUNE\u00ae, et reconnue par DiversityInc\u00ae comme l'une des 50 meilleures entreprises en mati\u00e8re de diversit\u00e9, ADP collabore avec plus de 740 000 entreprises \u00e0 l'\u00e9chelle mondiale afin d'aider leurs employ\u00e9s \u00e0 travailler plus intelligemment, \u00e0 relever de nouveaux d\u00e9fis et \u00e0 d\u00e9ployer leur talent. \" Axer le d\u00e9veloppement sur les personnes \" signifie que nous cr\u00e9ons des plateformes qui transformeront le monde du travail, nous permettant ensemble de d\u00e9couvrir d'infinies possibilit\u00e9s.\n  \n  At ADP, we believe that diversity fuels innovation. ADP is committed to equal employment opportunities regardless of race, color, genetic information, creed, religion, sex, sexual orientation, gender identity, lawful alien status, national origin, age, marital status, or protected veteran status. We support an inclusive workplace where associates excel based on personal merit, qualifications, experience, ability, and job performance."
}