{
    "id": "41a192dec48837e5",
    "company": "Canadian Centre on Substance Abuse",
    "positionName": "Director, Health Promotion and Prevention Directeur Promotion de la sante et prevention",
    "jobType": [],
    "location": "Ottawa, ON",
    "salary": null,
    "postingDateParsed": "2023-10-14T18:54:08.286Z",
    "url": "https://www.indeed.ca/rc/clk?jk=41a192dec48837e5&from=jasx&tk=1hcvfpdfukoko804&vjs=3",
    "externalApplyLink": "https://www.careerbeacon.com/en/job-12/401585/canadian-centre-on-substance-abuse/director-health-promotion-and-prevention-directeur-promotion-de-la-sante-et-prevention/ottawa-on",
    "job_info_group": {
        "extracted_phone_numbers": [],
        "extracted_links": [
            "HTTP/HTTPS Links",
            "General Links",
            "WWW Links",
            "TLDs"
        ],
        "extracted_emails": [],
        "extracted_location_data": [
            "Canada",
            "avec l'encadrement",
            "Ottawa",
            "il travaille \u00e0 am\u00e9liorer la sant\u00e9 et la s\u00e9curit\u00e9 des personnes vivant au Canada",
            "laquelle les donn\u00e9es probantes transforment les"
        ],
        "extracted_dates": [
            "September 2023",
            "2005",
            "Septembre 2023",
            "10 years",
            "eight years"
        ],
        "extracted_languages": [
            "English",
            "French"
        ],
        "extracted_laws": [],
        "extracted_norps": [
            "M\u00e9tis",
            "Inuit"
        ],
        "extracted_orgs": [
            "sant\u00e9 dans",
            "Establishes",
            "les Premi\u00e8res Nations",
            "The Director of Health Promotion and Prevention",
            "Health Promotion and Prevention Reports",
            "its related Integrated Accessibility Standards Regulation",
            "vision et le mandat du CCDUS",
            "Undertakes",
            "Responsibilities Develops",
            "Le directeur",
            "the Accessibility for Ontarians with Disabilities Act",
            "DHPP",
            "An Non-Governmental Organizations",
            "Qualifications Master's",
            "Parliament",
            "Promotion de la sant\u00e9 et pr\u00e9vention",
            "The Canadian Centre on Substance Use and Addiction",
            "Traditional Indigenous Knowledge",
            "CCSA Carries",
            "sur la soci\u00e9t\u00e9",
            "the Government of Canada",
            "the Ontario Human Rights Code",
            "les approches de mobilisation des connaissances",
            "avec des partenaires internes",
            "CCSA",
            "ONG",
            "cerner les besoins et lacunes dans la recherche",
            "The DHPP",
            "Encadrer les chercheurs et courtiers du savoir",
            "avec des organismes",
            "de financement en recherche \u00e0 l'\u00e9chelle nationale et provinciale afin de r\u00e9aliser la",
            "First Nations",
            "Health Canada"
        ],
        "extracted_persons": [
            "Il ou elle fait partie de la haute direction du CCDUS",
            "Responsabilit\u00e9s D\u00e9finir et concr\u00e9tiser",
            "Piloter les activit\u00e9s multidimensionnelles de mobilisation des connaissances et de recherche du CCDUS en mati\u00e8re de promotion de la sant\u00e9 et de pr\u00e9vention Collaborer avec des partenaires externes",
            "CCDUS",
            "d'encadrer et de diriger une \u00e9quipe de chercheurs",
            "Le CCDUS reconna\u00eet que"
        ],
        "extracted_products": [
            "Il respecte le pouvoir des modes de connaissance autochtones et du savoir traditionnel autochtone et s'engage \u00e0 apprendre de ce savoir"
        ],
        "extracted_money": [],
        "processed_text": "position Director stream accountability Table profile ccsa change live bring people knowledge reduce harm drug society . partner public private governmental organization ngo improve health safety people live . General Term national focus envision healthy canadian society evidence transform approach substance . acknowledge Metis Inuit people holder . respect power indigenous traditional Indigenous Knowledge commit learn incorporate knowledge proper guidance . responsible lead CCSA's multifaceted health promotion portfolio special focus cannabis gambling . bring national leadership knowledge field substance addiction provide guidance leadership team researcher knowledge broker . collaboration division ccsa external partner Director lead CCSA's research activity knowledge mobilization health promotion prevention . CCSA's leadership team . implement strategic direction associated budget ccsa priority health promotion prevention lead CCSA's multifaceted health promotion prevention research knowledge mobilization activity collaborate external partner community affect identify gap exist research stay abreast development field addiction substance strong working relationship actively collaborate key internal external partner e.g. indigenous people people lived living substance addiction guide researcher knowledge broker set standard research knowledge mobilization approach research grant nationally provincially achieve vision mandate divisional responsibility ccsa policy practice include manage health promotion prevention budget lead performance coach staff manage human resource seek strategic create innovation initiative position lead health promotion field nationally internationally include pursuit research partnership external funding create high perform team key conference respond medium request relate trend multifaceted health promotion field contribute strategic business planning activity leadership team provide strategic advice identify gap partnership sustain francophone partnership corporate level responsibility assign doctoral degree relevant discipline e.g. science art humanity health administration public policy minimum field research knowledge mobilization minimum leadership management role proven engage diverse audience build effective partnership collaboration organization represent diverse view discipline sector demonstrate mentoring coaching professional development staff colleague partner subject matter expertise substance addiction field proven system thinker develop understanding system issue complex theory partner engagement addiction field exceptional skill partner engagement change management include skill negotiation consensus building conflict resolution develop research knowledge mobilization partnership collaboration prove gain credibility organization key partner public speaker excellent interpersonal verbal write communication skill superior writing skill develop review write report fluent bilingualism oral write Assets nonprofit environment . commit equity diversity inclusion aspect . organization committed ensure people equity deserve group fully represent include woman people colour people people . dedicate learn support people lived living substance health . encourage people lived living substance apply join CCSA team . promote people outline . appropriate accommodation request . inform advance request accommodation recruitment process email . interested position submit cover letter resume . CCSA office . qualified region encourage apply . successful onsite attend meeting attend partner meeting require . successful travel require . applicant . select interview contact . agency . create provide national leadership address substance . trusted counsel provide national guidance decision maker harness power research curate knowledge bring diverse perspective . ccsa activity product financial contribution . view represent view . poste Directeur Promotion sante prevention Releve table responsabilisation des volet d'activites Centre canadien sur les dependance l'usage substance transforme des vies mobilisant les gen les connaissance afin reduire les mefaits l'alcool d'autres substance . partenariat publics prives des organisation gouvernementales . ONG d'envergure nationale vision parle d'une societe canadienne approche concernant consommation substance . les Metis les Inuits sont les detenteurs du savoir traditionnel autochtone . l'integrer dans son travail adequat . gere les activites multidimensionnelles promotion sante du CCDUS particulierement celle concernent l'alcool cannabis les jeux hasard d'argent . Il elle apporte leadership national au domaine des dependances l'usage substance courtiers du savoir . collaboration avec d'autres division du CCDUS des partenaires externes titulaire pilote les activites recherche mobilisation des connaissances du CCDUS matiere promotion sante prevention . . des orientation strategique etablir les budget correspondant pour faire avancer les priorites du CCDUS matiere promotion sante prevention des communautes concernees pour se tenir au courant des dernieres avancees dans domaine des dependances l'usage substance Etablir solide relation travail collaborer activement externes p. . peuples autochtone personnes vivent ont vecu dependance l'usage substance etablir des normes pour recherche Chercher des occasions . click apply detail"
    },
    "companyDescription": "",
    "description": "Position: \n   Director, Health Promotion and Prevention \n   Reports to: \n   Stream Accountability Table \n   Profile Date: \n   September 2023 \n   The Canadian Centre on Substance Use and Addiction (CCSA) changes lives by bringing people and knowledge together to reduce the harms of alcohol and other drugs on society. We partner with public, private and non-governmental organizations (NGOs) to improve the health and safety of people living in Canada. An NGO with a national focus, CCSA envisions a healthier Canadian society where evidence transforms approaches to substance use. \n   CCSA acknowledges that First Nations, M\u00e9tis and Inuit people are the holders of Traditional Indigenous Knowledge. We respect the power of the Indigenous ways of knowing and of Traditional Indigenous Knowledge and commit to learning about and incorporating this knowledge into our work with proper guidance. \n  The Director of Health Promotion and Prevention (DHPP) is responsible for leading CCSA's multifaceted health promotion portfolio with special focus on alcohol, cannabis and gambling. The DHPP brings national leadership knowledge in the field of substance use and addiction and provides guidance and leadership to a team of researchers and knowledge brokers. In collaboration with other divisions within CCSA and external partners, the Director leads CCSA's research activities and knowledge mobilization in health promotion and prevention. The DHPP is a member of CCSA's leadership team. \n  Responsibilities \n   \n   Develops and implements strategic directions and associated budgets for CCSA priorities under health promotion and prevention \n   Leads CCSA's multifaceted health promotion and prevention research and knowledge mobilization activities \n   Collaborates with external partners and communities most affected to identify needs and gaps in existing research and stay abreast of new developments in the field of addiction and substance use \n   Establishes strong working relationships and actively collaborates with key internal and external partners (e.g., Indigenous people, people with lived or living experience with substance use and addiction) \n   Guides researchers and knowledge brokers and sets standards in research and knowledge mobilization approaches \n   Looks for opportunities to obtain research grants nationally and provincially to achieve the vision and mandate of CCSA \n   Carries out divisional responsibilities in accordance with CCSA policies and practices, including managing the health promotion and prevention budget, leading performance, coaching staff and managing human resources \n   Seeks strategic opportunities and creates innovation initiatives that position CCSA to lead the health promotion field nationally and internationally, including the pursuit of research partnerships and external funding \n   Creates a high-performing team \n   Presents at key conferences and responds to media requests related to trends in the multifaceted health promotion field \n   Contributes to overall strategic and business planning and the activities of CCSA as part of the leadership team \n   Provides strategic advice in identifying gaps in partnerships and sustaining new francophone partnerships at a corporate level \n   Undertakes other responsibilities as assigned \n   \n  Qualifications \n   \n   Master's or doctoral degree in a relevant discipline (e.g., science, arts and humanities, health administration, public policy) \n   Minimum of 10 years working in the field of research or knowledge mobilization and minimum of eight years in a leadership or management role \n   Proven ability to engage diverse audiences and build effective partnerships and collaborations with organizations that represent diverse views, disciplines and sectors \n   Demonstrated experience in mentoring, coaching or professional development of staff, colleagues and partners \n   Subject matter expertise in the substance use and addiction field \n   Proven abilities as a systems thinker: ability to develop an understanding of systems issues, complex theory and partner engagement in addiction and other related fields \n   Exceptional skills in partner engagement and change management, including skills in negotiation, consensus building and conflict resolution \n   Experienced in developing research or knowledge mobilization partnerships and collaborations and a proven ability to gain credibility across the organization and with key partners \n   Experienced public speaker \n   Excellent interpersonal, verbal and written communication skills; in particular, superior writing skills to develop, review and write reports \n   Fluent bilingualism in English and French, oral and written \n   \n  Assets \n   \n   Experience working in a nonprofit environment. \n   \n  CCSA is committed to equity, diversity and inclusion in all aspects of our work. As an organization, we are committed to ensuring that First Nations, M\u00e9tis and Inuit people and all equity-deserving groups are fully represented, including women, people of colour, people with disabilities, and people who are 2SLGBTQ+. \n   CCSA is dedicated to learning from and supporting people with lived or living experience of substance use and health. We encourage people with lived or living experience of substance use to apply to join the CCSA team. \n   CCSA promotes the rights of all people with disabilities as outlined in the Ontario Human Rights Code and the Accessibility for Ontarians with Disabilities Act, 2005, and its related Integrated Accessibility Standards Regulation. CCSA will make appropriate accommodations on request. Please inform CCSA in advance of a request for accommodation during the recruitment process by email. \n   If you are interested in this position, please submit a cover letter and resum\u00e9. The CCSA office is in Ottawa. Qualified candidates outside of the Ottawa region are encouraged to apply. The successful candidate must be willing to be onsite to attend meetings or attend other partner meetings as required. The successful candidate must be willing to travel as required. We thank all applicants. Only candidates selected for an interview will be contacted. \n  No agencies please. \n   CCSA was created by Parliament to provide national leadership to address substance use in Canada. A trusted counsel, we provide national guidance to decision makers by harnessing the power of research, curating knowledge and bringing together diverse perspectives. \n   CCSA activities and products are made possible through a financial contribution from Health Canada. The views of CCSA do not necessarily represent the views of the Government of Canada. \n   Poste : \n   Directeur, Promotion de la sant\u00e9 et pr\u00e9vention \n   Rel\u00e8ve de : \n   Table de responsabilisation des volets d'activit\u00e9s \n   Date : \n   Septembre 2023 \n   Le Centre canadien sur les d\u00e9pendances et l'usage de substances (CCDUS) transforme des vies en mobilisant les gens et les connaissances afin de r\u00e9duire les m\u00e9faits de l'alcool et d'autres substances sur la soci\u00e9t\u00e9. En partenariat avec des organismes publics et priv\u00e9s et des organisations non gouvernementales (ONG), il travaille \u00e0 am\u00e9liorer la sant\u00e9 et la s\u00e9curit\u00e9 des personnes vivant au Canada. Le CCDUS est une ONG d'envergure nationale dont la vision parle d'une soci\u00e9t\u00e9 canadienne en sant\u00e9 dans laquelle les donn\u00e9es probantes transforment les approches concernant la consommation de substances. \n   Le CCDUS reconna\u00eet que les Premi\u00e8res Nations, les M\u00e9tis et les Inuits sont les d\u00e9tenteurs du savoir traditionnel autochtone. Il respecte le pouvoir des modes de connaissance autochtones et du savoir traditionnel autochtone et s'engage \u00e0 apprendre de ce savoir et \u00e0 l'int\u00e9grer dans son travail, avec l'encadrement ad\u00e9quat. \n  Le directeur, Promotion de la sant\u00e9 et pr\u00e9vention, g\u00e8re les activit\u00e9s multidimensionnelles de promotion de la sant\u00e9 du CCDUS, plus particuli\u00e8rement celles qui concernent l'alcool, le cannabis et les jeux de hasard et d'argent. Il ou elle apporte un leadership national au domaine des d\u00e9pendances et de l'usage de substances, en plus d'encadrer et de diriger une \u00e9quipe de chercheurs et de courtiers du savoir. En collaboration avec d'autres divisions du CCDUS et des partenaires externes, le ou la titulaire pilote les activit\u00e9s de recherche et de mobilisation des connaissances du CCDUS en mati\u00e8re de promotion de la sant\u00e9 et de pr\u00e9vention. Il ou elle fait partie de la haute direction du CCDUS. \n  Responsabilit\u00e9s \n   \n   D\u00e9finir et concr\u00e9tiser des orientations strat\u00e9giques et \u00e9tablir les budgets correspondants pour faire avancer les priorit\u00e9s du CCDUS en mati\u00e8re de promotion de la sant\u00e9 et de pr\u00e9vention \n   Piloter les activit\u00e9s multidimensionnelles de mobilisation des connaissances et de recherche du CCDUS en mati\u00e8re de promotion de la sant\u00e9 et de pr\u00e9vention \n   Collaborer avec des partenaires externes et des communaut\u00e9s concern\u00e9es pour cerner les besoins et lacunes dans la recherche, et se tenir au courant des derni\u00e8res avanc\u00e9es dans le domaine des d\u00e9pendances et de l'usage de substances \n   \u00c9tablir de solides relations de travail et collaborer activement avec des partenaires internes et externes (p. ex. peuples autochtones, personnes qui vivent ou ont v\u00e9cu la d\u00e9pendance et l'usage de substances) \n   Encadrer les chercheurs et courtiers du savoir, et \u00e9tablir des normes pour les approches de mobilisation des connaissances et de recherche \n   Chercher des occasions de financement en recherche \u00e0 l'\u00e9chelle nationale et provinciale afin de r\u00e9aliser la vision et le mandat du CCDUS \n    . click apply for full job details"
}