{
    "id": "f29542e223c2a6d7",
    "company": "NOKIA",
    "positionName": "Engineering Lab Support Co-op/Intern",
    "jobType": [],
    "location": "Ottawa, ON",
    "salary": null,
    "postingDateParsed": "2023-08-25T22:44:08.424Z",
    "url": "https://www.indeed.ca/rc/clk?jk=f29542e223c2a6d7&from=jasx&tk=1hb2v8b7g2ap3005&vjs=3",
    "externalApplyLink": "https://careers.nokia.com/jobs/engineering-lab-support-co-op-intern-101634?src=JB-10760",
    "job_info_group": {
        "extracted_phone_numbers": [],
        "extracted_links": [
            "HTTP/HTTPS Links",
            "General Links",
            "WWW Links",
            "TLDs"
        ],
        "extracted_emails": [],
        "extracted_location_data": [
            "Canada"
        ],
        "extracted_dates": [
            "8 - April 26",
            "Winter 2024",
            "3 + months Date"
        ],
        "extracted_languages": [],
        "extracted_laws": [],
        "extracted_norps": [],
        "extracted_orgs": [
            "awesome Nokia",
            "Computer Science, Computer Engineering",
            "a highly motivated Engineering Lab Software Developer",
            "Kanata Candidates",
            "Nokia",
            "Education Recommendations",
            "an equal opportunity employer Nokia",
            "The Network Automation Product Group",
            "Bloomberg Workplace Pride Global Benchmark",
            "the Research and Development and Customer Support Teams",
            "Network Infrastructure"
        ],
        "extracted_persons": [],
        "extracted_products": [],
        "extracted_money": [],
        "processed_text": "position Engineering Lab Support op Intern duration Jan location Onsite create technology help business business technology innovation leader pioneer future network meet cloud . positive impact people's life help build capability productive sustainable accessible . culture build inclusive open idea empower risk encourage fearless bring authentic . team pandemic highlight telecoms network society . Nokia's Network Infrastructure group heart revolution bring fast network capacity people worldwide ambition innovation technical expertise . currently bachelor's degree diploma relate field accredit school . team seek join lab team . team responsible support Research Development lab expect hand programming design role focus provide lab support . learn contribute team product technology . software install system configuration restore database . program PHP Hypertext Markup Language Cascading Style sheet MYSQL database . update create feature web lab tool . enrol Post secondary Computer Networking strong interpersonal communication write verbal skill require . team orient environment . demonstrate learn fast pace innovative environment . nice knowledge ip networking familiar networking concept . familiar proficient LINUX operating system i.e Centos scripting language \u2013 bash php css familiar debug program eclipse offer flexible hybrid working scheme continuous learning program support mentally physically join support employee resource group mentor program highly diverse team inclusive culture people thrive empower . company Culture people great asset aim foster fun challenging positive inclusive environment . offer mentorship learning development global impact interaction flexible life balance . Meaningful op term op term test late technology innovative project leave global impact . skill learn classroom apply real situation gain professional hand . committed inclusion receive follow recognition commitment inclusion equality World's Ethical Companies Ethisphere Gender Equality Index inclusively respect uniqueness people . Nokia's employment decision race color national ethnic origin religion gender sexual orientation gender identity expression age marital status protect veteran status characteristic protect law . committed culture inclusion build core respect . join company feel include empower succeed . winter"
    },
    "companyDescription": "",
    "description": "Position: Engineering Lab Support Co-op/Intern Duration: 3 + months Date: Winter 2024 (Jan 8 - April 26) Location: Onsite\n \n \n   \n   \n  Come create the technology that helps the world act together\n   We are a B2B technology innovation leader pioneering the future where networks meet cloud. At Nokia, you will have a positive impact on people\u2019s lives and help build the capabilities needed for a more productive, sustainable, and accessible world.  Be part of a culture built on an inclusive way of working where we are open to your ideas, you are empowered to take risks, and are encouraged to be fearless in bringing your authentic self to work. \n  The team you'll be part of  Network Infrastructure \n   The pandemic has highlighted how important telecoms networks are to society. Nokia\u2019s Network Infrastructure group is at the heart of a revolution to bring more and faster network capacity to people worldwide through our ambition, innovation, and technical expertise.\n   \n   \n   Education Recommendations\n   Currently a candidate for a bachelor\u2019s degree or diploma in Computer Science, Computer Engineering, or related field with an accredited school in Canada.\n    The team you will be a part of\n   The Network Automation Product Group at Nokia is seeking a highly motivated Engineering Lab Software Developer to join its lab team. This team is responsible for supporting all the NA R&D labs in Kanata  Candidates can expect a hands-on programming design role with a focus on providing lab support to the R&D and Customer Support Teams.\n    What you will learn and contribute to\n   As part of the team, you will: \n   \n   Work with new products and technologies. \n   Software installs, system configurations restoring and backing up databases. \n   Programming in PHP, HTML and CSS using a MYSQL database. \n   Update and create new features in Web Lab tools.\n  \n   \n   What is Nokia looking for from me  You have: \n   \n   Enrolled in Post-Secondary for Computer Networking \n   Strong interpersonal and communication (both written and verbal) skills are required. \n   The candidate must be able to successfully work in a team-oriented environment. \n   Demonstrated ability to learn quickly and to work in a fast paced, innovative environment.\n  \n   \n   \n   It would be nice if you also had: \n  \n   Knowledge in IP networking, familiar with networking concepts. \n   Familiar or proficient with different LINUX operating systems (i.e Centos) \n   Scripting languages \u2013 bash, php and css Familiar with debugging programs such as eclipse  \n  \n  Why we're awesome\n   Nokia offers flexible and hybrid working schemes, continuous learning opportunities, well-being programs to support you mentally and physically, opportunities to join and get supported by employee resource groups, mentoring programs and highly diverse teams with an inclusive culture where people thrive and are empowered.\n   \n   Company Culture: We believe our people are our greatest asset and we aim to foster a fun, challenging, positive, and inclusive work environment. We offer 1-on-1 mentorship, learning and development opportunities, global impact and interaction, and flexible work/life balance. \n   Meaningful Co-op Term: During your co-op term, you will have the opportunity to test out the latest technologies and work on innovative projects that could leave a global impact. You get to use skills learned in the classroom and apply it to real work situations while gaining professional hands-on experience.\n    Nokia is committed to inclusion and is an equal opportunity employer\n   Nokia has received the following recognitions for its commitment to inclusion & equality: \n  \n   One of the World\u2019s Most Ethical Companies by Ethisphere \n   Gender-Equality Index by Bloomberg \n   Workplace Pride Global Benchmark\n  \n   \n   \n   At Nokia, we act inclusively and respect the uniqueness of people.\n   \n   Nokia\u2019s employment decisions are made regardless of race, color, national or ethnic origin, religion, gender, sexual orientation, gender identity or expression, age, marital status, disability, protected veteran status or other characteristics protected by law.\n   \n   We are committed to a culture of inclusion built upon our core value of respect.\n   \n   Join us and be part of a company where you will feel included and empowered to succeed. \n   \n  \n   See you this Winter 2024!"
}