{
    "id": "5e4d25c75382b91b",
    "company": "Extendicare",
    "positionName": "Medex PSW PART TIME",
    "jobType": [
        "Part-time"
    ],
    "location": "Ottawa, ON",
    "salary": null,
    "postingDateParsed": "2024-01-23T12:19:07.363Z",
    "url": "https://www.indeed.ca/rc/clk?jk=5e4d25c75382b91b&from=jasx&tk=1hl5dnps928uu000&bb=UGkEiCo3Z_GruqQb2rXDBPfnUGnODW8MrkarwQ0PHR-pAD9RnHNE3wo5dHlBYA-uNXwo_EnVSpZ0Pukdq4HhDGt6RsDBDFowNfvLSsXluOwxYlH67-MIAg%3D%3D&xkcb=SoCY67M3FlTQ5AwTEJ0GbzkdCdPP&vjs=3",
    "externalApplyLink": "https://extendicare.wd10.myworkdayjobs.com/en-US/Extendicare2023/job/Ottawa-Ontario/Medex-PSW-PART-TIME_R9202",
    "job_info_group": {
        "extracted_phone_numbers": [],
        "extracted_links": [
            "HTTP/HTTPS Links",
            "General Links",
            "WWW Links",
            "TLDs"
        ],
        "extracted_emails": [],
        "extracted_location_data": [
            "Ontario",
            "Ottawa",
            "Extendicare"
        ],
        "extracted_dates": [
            "every day"
        ],
        "extracted_languages": [
            "English"
        ],
        "extracted_laws": [],
        "extracted_norps": [],
        "extracted_orgs": [
            "the PSW",
            "the Accessibility for Ontarians with Disabilities Act",
            "Extendicare",
            "the Ontario Human Rights Code",
            "ParaMed Home Health Care",
            "the Ministry of Training, Colleges and Universities",
            "Extendicare Assist",
            "the Ontario Community Support Association",
            "the National Association of Career Colleges"
        ],
        "extracted_persons": [
            "Extendicare"
        ],
        "extracted_products": [],
        "extracted_money": [],
        "processed_text": "description personal support worker \u2013 Positions Extendicare Medex Personal Support Workers PSW invite apply position bed long term care locate . direction Registered Staff provide direct personal nursing care resident fulfil physical intellectual emotional social spiritual resident police procedure routine . responsibility assist provide direct care resident assist ambulation feeding bathing grooming . encourage participation activity program assist resident activity . assist meal service nourishment delivery resident provide feeding assistance require . provide emotional social support resident family include palliative care . adhere establish departmental police procedure regard documentation quality assurance fire safety environment infection control . consult inform supervisor unit activity matter relate resident care . participate care conference documentation relate resident care plan . qualification complete PSW Program meet appropriate standard establish minimum duration include class practical nursing long term care require Knowledge care planning system documentation require mentally physically perform duty assign communicate positively staff resident family demonstrate empathy concern interest provide quality care service resident demonstrate organizational skill complete assignment timely fashion independently team provide resident care application legislation routine nursing care plan read write understand verbal write instruction . affiliated organization include partner accommodate applicant recruitment selection process . accommodation provide advance . discuss contact individual note posting . ExtendicareOttawaPSW Type choose build career join team dedicate difference . focus energy enrich life resident transform quality life quality . passion care turn rewarding career affiliated organization include partner accommodate applicant recruitment selection process request ."
    },
    "companyDescription": "Extendicare is a leading provider of care and services for seniors across Canada. We are committed to delivering quality care throughout the health continuum to meet the needs of a growing seniors population. We operate a network of 120 senior care and retirement living centres and home health care services under the Extendicare, Esprit Lifestyle and ParaMed brands. Our qualified and highly trained workforce of approximately 23,000 individuals is passionate about providing high quality services to help people live better.",
    "description": "Job Description\n  \n \n \n \n   PERSONAL SUPPORT WORKERS \u2013 Part Time Positions - Extendicare Medex\n \n \n \n   Personal Support Workers (PSW) are invited to apply for full time and part time positions to work at our 193 bed long-term care home located in Ottawa, Ontario.\n \n \n \n   Under the direction of the Registered Staff, the PSW provides direct personal and nursing care to residents so as to fulfil the physical, intellectual, emotional, social and spiritual needs of residents in accordance to home polices, procedure and work routines.\n \n \n \n   RESPONSIBILITIES\n \n \n   Assists in providing direct care for residents; assists with ambulation, feeding, bathing and grooming.\n   Encourages participation in activity programs by assisting residents to and from activities.\n   Assists with meal service and nourishment delivery to residents and provides feeding assistance as required.\n   Provides emotional and social support to residents/families including palliative care.\n   Adheres to established departmental polices and procedures regarding documentation, quality assurance, fire, safety, environment and infection control.\n   Consults with and informs supervisor of unit activities, needs and matters related to resident care.\n   Participates in care conferences and documentation related to resident care plans.\n \n \n \n   QUALIFICATIONS:\n \n \n   Completed a PSW Program that meets the appropriate standards established by the Ministry of Training, Colleges and Universities, the National Association of Career Colleges, or the Ontario Community Support Association and must be a minimum of 600 hours in duration (including class time and practical experience time)\n   Nursing Experience in long-term care required\n   Knowledge and experience in care planning systems and documentation required\n   Mentally and physically able to perform duties as assigned\n   Ability to communicate positively with other staff, residents and families\n   Demonstrates empathy, concern and interest in providing quality care and service to residents\n   Demonstrates organizational skills and ability to complete assignments in a timely fashion\n   Ability to work independently and as part of a team\n   Ability to provide resident care in accordance with application legislation, job routines, nursing care plans, ability to read and write English and understand verbal and written instructions in English.\n \n \n \n   In Ontario, Extendicare, ParaMed Home Health Care and affiliated organizations including our partner homes in Extendicare Assist, accommodate the needs of job applicants throughout its recruitment and selection processes in accordance with the Ontario Human Rights Code and the Accessibility for Ontarians with Disabilities Act. Accommodation needs must be provided in advance. To discuss your needs, please contact the individual noted in the posting.\n \n \n \n   #ExtendicareOttawaPSW\n \n \n \n   Time Type:\n \n  Part time\n \n \n  \n    When you choose to build your career with Extendicare, you\u2019re joining a team dedicated to making a difference. By focusing our energy on enriching the lives of our residents every day, we transform both the quality of their lives and the quality of our own work experiences.\n  \n \n \n \n  \n    If you have a passion for caring, turn it into a rewarding career with Extendicare!\n  \n \n \n \n   Extendicare and affiliated organizations including our partner homes in Extendicare Assist, accommodate the needs of job applicants throughout its recruitment and selection processes upon request."
}