{
    "id": "c332fef64567eced",
    "company": "Accreditation Canada",
    "positionName": "Client Engagement Lead, Health Systems, Accreditation Canada",
    "jobType": [],
    "location": "1150 Cyrville Rd, Ottawa, ON",
    "salary": null,
    "postingDateParsed": "2023-10-06T02:05:01.482Z",
    "url": "https://www.indeed.ca/rc/clk?jk=c332fef64567eced&from=jasx&tk=1hc6geptqk7pr800&vjs=3",
    "externalApplyLink": "https://can232.dayforcehcm.com/CandidatePortal/en-US/healthstandards/Posting/View/688",
    "job_info_group": {
        "extracted_phone_numbers": [],
        "extracted_links": [
            "HTTP/HTTPS Links",
            "General Links",
            "WWW Links",
            "TLDs"
        ],
        "extracted_emails": [
            "recruitment@healthstandards.org",
            "HumanResources@healthstandards.org"
        ],
        "extracted_location_data": [
            "the British Columbia",
            "Ottawa",
            "Manitoba",
            "British Columbia",
            "recruitment@healthstandards.org"
        ],
        "extracted_dates": [
            "2022",
            "2023",
            "Your First 30-90 Days",
            "the year",
            "last week of December",
            "65 years",
            "Three to five years"
        ],
        "extracted_languages": [],
        "extracted_laws": [],
        "extracted_norps": [
            "Indigenous Peoples"
        ],
        "extracted_orgs": [
            "Human Resources",
            "the Accreditation Program",
            "Manitoba Health Systems",
            "Employment Equity",
            "Health Standards Organization",
            "the Accreditation Canada Accreditation Program",
            "HumanResources@healthstandards.org",
            "People Powered Health\u2122",
            "Indigenous Peoples",
            "HSO",
            "Canadian Health Systems",
            "the Institute for Quality Management in Healthcare",
            "project management qualification(s",
            "Accreditation Canada"
        ],
        "extracted_persons": [],
        "extracted_products": [],
        "extracted_money": [],
        "processed_text": "term permanent salary commensurate location Hybrid Model | Montreal Hybrid Model | Toronto Hybrid Model | Remote Models occasional travel role Client Engagement Lead team . seek dynamic leader knowledge . client lead accountable lead health system accreditation activity responsible lead include update assessment program digital platform standard embed philosophy continuous quality improvement . Client Engagement Lead manage provide support client organization consult advise improve quality care . person role joy alongside dedicated compassionate Client Engagement lead accreditation team support . person role require evening weekend manage accreditation survey activity . occur capacity compensate flex . employee balance life . Main responsibility building relationship client organization support accreditation cycle interest increase capacity continuous quality improvement . support lead accreditation team proficient planning implementation survey process focus quality efficiently meet target . plan organize implement evaluate represent program internally external partner funder . effectively partner stakeholder diverse background create era quality improvement patient safety initiative . hold people accountable result control provide guidance conflict resolution proactive approach identify success team . qualification university degree master's level prefer . equivalent combination education consider . progressive lead team health care quality improvement . demonstrate problem solve skill identify root develop effective solution . strong verbal write communication skill . knowledge quality improvement principle . desire Qualifications Attributes knowledge hso standard Accreditation process proficiency comprehensive range Microsoft application include Teams Word Excel leadership style orientation empathetic team orient relationship change management system transformation . . quality assurance improvement qualification . client service . stand Accreditation surveyor process . completely Canada's official language . expect complete orientation program employee learn trust inclusion collaboration innovation learning mission quality improvement healthcare social service . enroll Accreditation surveyor training module orientation familiarize HSO standard . review learn departmental policy procedure platform workflow . set performance learn objective collaboration people manager . meet regularly people manager discuss learning progression alignment accountability . assign initiative project role . offer collaborate awesome team impact system level client . hybrid model Montreal Toronto area remote model Montreal Toronto area . competitive compensation benefit include define benefit pension plan . program include office shutdown . professional development support . culture measure psychological safety inclusion engagement . Health Standards Organization HSO affiliate AC IQMH global profit organization . develop standard deliver assessment program quality improvement solution adopt location continent . people center program service set bar quality health ecosystem . join future lead . follow mission empower enable people continuously improve quality care . hso commit foster culture inclusion diversity equity access employee feel respected equal achieve success . encourage application people diverse race ethnicity religion person people gender diverse community people intersectional identity . support recruiting process include provision accommodation request . National Capital Region's Employers . equal employer committed principle . encourage qualified application gender include visible minority person . applicant interest select interview contact . accommodation request aspect selection process . request accommodation email . query relate recruitment email ."
    },
    "companyDescription": "",
    "description": "Terms: Full-time permanent \n  \n  \n   Salary: Commensurate with experience\n   \n  \n    Location: Ottawa (Hybrid Work Model) | Montreal (Hybrid Work Model) | Toronto (Hybrid Work Model) | Remote Work Models, will have occasional travel to Ottawa\n  \n   \n   \n  \n    ABOUT THE ROLE:\n  \n   \n   \n  \n    The Client Engagement Lead is a member of team at Accreditation Canada. We are seeking a dynamic leader that has experience in Canadian Health Systems and particularly knowledge of the British Columbia and Manitoba Health Systems. The client lead will primarily be accountable to lead all health systems accreditation activities for Manitoba and British Columbia, more specifically being responsible for leading the Accreditation Canada Accreditation Program, including the updated assessment programs, digital platforms, and standards, which further embed our philosophy of People Powered Health\u2122 and continuous quality improvement. The Client Engagement Lead will manage and provide support to client organizations while consulting and advising for improving the quality of care for all. The person in this role can take joy in working alongside other dedicated and compassionate Client Engagement Leads, the full accreditation team and many other supports across Accreditation Canada and Health Standards Organization.\n  \n   \n   \n  \n    The person in this role may be required at times to work evenings and weekends when managing accreditation survey activities. When this occurs, you will have the capacity to compensate these extra hours as flex time and take them off later. We value employee balance work/life.\n  \n   \n  \n    \n  \n  \n   Main Responsibilities:\n  \n   \n   \n   \n   Building relationships with client organizations and supporting them where they are at in their accreditation cycles in the interest of increasing their capacity for continuous quality improvement. \n   Support and lead the Accreditation team to become proficient in the planning and implementation of the survey process that is focused on quality while working efficiently to meet targets. \n   Plan, organize, implement, and evaluate the Accreditation Program and represent the program both internally and with external partners and funders. \n   Work effectively with partners and stakeholders of diverse backgrounds to co-create the next era of quality improvement and patient safety initiatives. \n   Holds people accountable for results they can control while providing guidance, conflict resolution and a proactive approach in identifying success for the team. \n   \n  \n  \n   Must Have Qualifications:\n  \n   \n   \n   \n   University degree at a master\u2019s level is preferred. An equivalent combination of work experience and education will be considered. \n   Three to five years of progressive experience leading teams with health care and quality improvement experience. Demonstrated problem-solving skills to identify root causes and develop effective solutions. \n   Strong verbal and written communication skills. \n   Knowledge of quality improvement principles.\n  \n   \n   \n  \n    Desired Qualifications and Attributes:\n  \n   \n   \n   Knowledge of HSO standards \n   Experience in Accreditation Canada process \n   Proficiency in a comprehensive range of Microsoft applications including Teams, Word, and Excel \n   A leadership style orientation to empathetic, team oriented working relationships \n   Experience in change management and systems transformation. \n   Have project management qualification(s) and/or experience. \n   Have quality assurance and improvement qualification(s). \n   Have experience in client services.\n  \n   \n   You will stand out if: \n   \n   You are an Accreditation Canada surveyor or are in the process of becoming one. \n   Completely bilingual in Canada\u2019s official languages. \n   \n  \n   WHAT YOU CAN EXPECT:\n  \n   \n   \n  \n    In Your First 30-90 Days: \n  \n  \n   Complete our orientation program with other new employees to learn about HSO, our values of trust, inclusion, collaboration, innovation and learning, and our mission of quality improvement in healthcare and social services. \n   Enroll in the Accreditation Canada surveyor training modules as part of the orientation and familiarize yourself with the HSO standards. \n   Review and learn departmental policies, procedures, IT platforms and workflows. \n   Set your performance and learning objectives for the year in collaboration with your people manager. \n   Meet regularly with your people manager to discuss your learning progression and alignment for your accountabilities. \n   Take on assigned initiatives or projects for your role. \n   \n  \n  \n   What We Can Offer to You\n   :\n  \n   \n   \n   Collaborating with an awesome team! \n   Opportunity to make an impact at a system level with our clients. \n   Hybrid work model for candidates in Ottawa/Montreal/Toronto area \n   A remote model for candidates outside Ottawa/Montreal/Toronto area. \n  \n  \n   Competitive compensation and benefits, including a defined benefit pension plan. \n   Time-off programs, including office shutdown during last week of December. \n   Professional development support. \n   A culture that measures and values psychological safety, inclusion, and engagement.\n  \n   \n   \n  \n    WHO WE ARE AND WHAT WE DO:\n   \n   Health Standards Organization (HSO) and our affiliates Accreditation Canada (AC) and the Institute for Quality Management in Healthcare (IQMH) are global, not-for-profit organizations. Together, we develop standards and deliver assessment programs and quality improvement solutions that have been adopted in over 12,000 locations across five continents. Our people-centered programs and services have been setting the bar for quality across the health ecosystem for 65 years. \n  Join us toward a future that will lead to \u201cSafer Care and A Healthier World.\u201d Let\u2019s follow a mission together, where we \u201cempower and enable people around the world to continuously improve quality of care.\u201d \n   HSO is committed to fostering a culture of inclusion, diversity, equity, and access, where all employees feel respected and valued and have an equal opportunity to achieve success. We encourage applications from Indigenous Peoples, people from diverse races, ethnicities and/or religions, persons with disabilities, people from gender diverse communities and/or people with intersectional identities. Please let us know how we can support you throughout the recruiting process, including through the provision of accommodations on request. \n   We are also proud to have been named as one of the Top 100 National Capital Region\u2019s Top Employers in 2022 and 2023. \n \n \n  \n   \n    We are equal opportunity employer and are committed to the principles of Employment Equity. We encourage qualified applications from all genders, including visible minorities, Indigenous Peoples, and persons with disabilities. We thank all applicants for their interest; only those selected for an interview will be contacted. Accommodations are available on request for candidates taking part in all aspects of the selection process. To request accommodation, please email HR at HumanResources@healthstandards.org. For any queries related to recruitment please email at recruitment@healthstandards.org."
}