{
    "id": "54b7abe9ddf4da18",
    "company": "CHEO",
    "positionName": "Director, Precision Health and Regional Genetics Program",
    "jobType": [],
    "location": "Ottawa, ON",
    "salary": null,
    "postingDateParsed": "2023-10-30T20:06:25.254Z",
    "url": "https://www.indeed.ca/rc/clk?jk=54b7abe9ddf4da18&from=jasx&tk=1he3lftbdk7tt800&vjs=3",
    "externalApplyLink": "https://ca.indeed.com/rc/clk?jk=54b7abe9ddf4da18&atk=&xpse=SoCl67I3IDjObPTU4p0LbzkdCdPP",
    "job_info_group": {
        "extracted_phone_numbers": [
            " 613-604-5310",
            "613-604-5310"
        ],
        "extracted_links": [
            "HTTP/HTTPS Links",
            "General Links",
            "WWW Links",
            "TLDs"
        ],
        "extracted_emails": [
            "opfeffer@boyden.com",
            "jobs@cheo.on.ca"
        ],
        "extracted_location_data": [],
        "extracted_dates": [
            "2023",
            "2021",
            "the 10th consecutive year in a row",
            "November 7,"
        ],
        "extracted_languages": [],
        "extracted_laws": [],
        "extracted_norps": [],
        "extracted_orgs": [
            "Canada's Best Employers",
            "the Genetics Diagnostic Laboratory",
            "Forbes Magazine",
            "the Centre for Genomic Innovation",
            "the Accessibility for Ontarians with Disabilities Act",
            "Precision Diagnostics",
            "Child Development & Community Services",
            "Clinical Genetics Services",
            "Human Resources at jobs@cheo.on.ca",
            "Canada's Top 100 Employers",
            "Boyden",
            "Regional Genetics Program",
            "the Program",
            "the National Capital Region"
        ],
        "extracted_persons": [
            "Olivia Pfeffer",
            "John Caminiti"
        ],
        "extracted_products": [
            "CHEO"
        ],
        "extracted_money": [
            {
                "amount": "$57.26-$69.58 Job Description",
                "noun_phrases": [
                    "$57.26-$69.58 Job Description"
                ]
            }
        ],
        "processed_text": "compensation pay Range location CHEO stand global leader pediatric health staff physician dedicate help child youth live good life . wall partnership community provider transform 20th Century acute care hospital 21st Century integrate child youth health system . rank canadian hospital digitization clinical infrastructure CHEO combine excellence clinical care research education advance seamless care provide . CHEO good place canadian healthcare rank canadian hospital list . editor recognize employer . report Vice President Director Precision Health develop implement multi precision health strategy position leader provincially nationally internationally . provide leadership CGI lead expansion accelerate clinical adoption advance genomic help establish robust lifecycle strategy . Director oversee operational financial programmatic people activity portfolio include . alongside team tandem key internal external stakeholder maintain high quality patient care ensure continuous business growth . ideal Master's prepare leader minimum ' leadership implement organization wide initiative ideally complex health relate translational research environment include precision health . highly autonomous motivated starter organizational analytical problem solving decision skill effectively balance collaborate variety team . exceptional interpersonal skill allow cogently communicate motivate staff department level foster inclusive environment achieve result support rewarding collaboration . fluency official language highly desirable asset . interested impactful leadership Canada's respected paediatric healthcare organization contact . apply position submit application material state title position subject mail simply submit material directly apply button . applicant interest consideration role contact diversity equal employer . committed provide inclusive barrier free environment start hiring process interest qualified applicant . require accommodation phase recruitment process contact . information receive relation accommodation confidential handle compliance . apply interview contact . posting applicable"
    },
    "companyDescription": "",
    "description": "Compensation Pay Range:\n  $57.26-$69.58\n \n \n   Job Description:\n \n \n   Location: Ottawa\n   \n   CHEO is one of the few stand-alone, global leaders in pediatric health and is home to nearly 4,500 staff and physicians dedicated to helping children and youth live their best lives. Within its own walls and through partnerships with community providers, CHEO has transformed from a 20th Century acute care hospital into a 21st Century integrated child and youth health system. Ranked in the top 1% of Canadian hospitals for the digitization of its clinical infrastructure, CHEO combines excellence in clinical care, research, and education to advance seamless care that\u2019s provided where, when, and how it is needed.\n   \n   CHEO has twice been named as the best place to work in Canadian healthcare by Forbes Magazine and is ranked second among Canadian hospitals on its list of Canada\u2019s Best Employers for 2021. For the 10th consecutive year in a row, the editors of Canada's Top 100 Employers has recognized CHEO as a top employer in the National Capital Region.\n   \n   Reporting to the Vice President of Child Development & Community Services, the Director, Precision Health and Regional Genetics Program,will develop and implement a multi-year precision health strategy that positions CHEO as a leader provincially, nationally, and internationally.You will provide leadership to the Centre for Genomic Innovation (CGI) and lead the expansion of Precision Diagnostics, accelerating the clinical adoption of advances in genomics and helping to establish a robust lifecycle strategy. As Director, you will oversee all operational, financial, programmatic and people activities across the portfolio, which includes Clinical Genetics Services and the Genetics Diagnostic Laboratory. Working alongside your team, and in tandem with key internal and external stakeholders, you will maintain high-quality patient care, ensuring continuous business growth of the Program.\n   \n   As the ideal candidate, you are a Master\u2019s-prepared leader with a minimum of five (5) years\u2019 of leadership experience implementing organization-wide initiatives, ideally within a complex health-related or translational research environment, including precision health. Highly autonomous and a motivated self-starter, your organizational, analytical, problem solving, and decision-making skills are effectively balanced by your ability to successfully collaborate within a variety of teams. You are known for your exceptional interpersonal skills that allow you to cogently communicate, motivate, and present to staff across departments and at all levels, fostering an inclusive environment that achieves results by valuing, supporting, and rewarding collaboration. Fluency in both official languages is a highly desirable asset.\n   \n   If you are interested in this impactful leadership opportunity with one of Canada\u2019s most respected paediatric healthcare organizations, please contact John Caminiti and Olivia Pfeffer of Boyden at 613-604-5310. To apply for this position, please submit your application and related materials to \n  \n   opfeffer@boyden.com\n   and \n  state the title of the position in the subject line of your e-mail, or simply submit your materials directly using the \"Apply\" button.\n   \n   \n  We thank all applicants for their interest, however only those under consideration for the role will be contacted\n \n \n \n   CHEO values diversity and is an equal opportunity employer. We are committed to providing an inclusive and barrier-free work environment, starting with the hiring process and welcome interest from all qualified applicants.\n \n \n \n   Should you require accommodation during any phase in the recruitment process, please contact Human Resources at jobs@cheo.on.ca. All information received in relation to accommodation will be kept confidential and will be handled in compliance with the Accessibility for Ontarians with Disabilities Act.\n \n \n \n   We thank all those who apply, however, only those to be interviewed will be contacted.\n \n \n \n   Job Posting End Date (if applicable):\n  November 7, 2023"
}