{
    "id": "72497fca82b317e7",
    "company": "The Ottawa Hospital",
    "positionName": "Registered Nurse, ICU Coronary Care (Medicine)",
    "jobType": [],
    "location": "501 Smyth Rd, Ottawa, ON",
    "salary": null,
    "postingDateParsed": "2023-10-17T18:50:55.850Z",
    "url": "https://www.indeed.ca/rc/clk?jk=72497fca82b317e7&from=jasx&tk=1hcvfjcolkedt800&vjs=3",
    "externalApplyLink": "https://ohhcmdmzweb01.ottawahospital.on.ca/psc/HRPRD/?cmd=login&errorPg=ckreq&languageCd=ENG",
    "job_info_group": {
        "extracted_phone_numbers": [],
        "extracted_links": [
            "HTTP/HTTPS Links",
            "General Links",
            "WWW Links",
            "TLDs"
        ],
        "extracted_emails": [],
        "extracted_location_data": [],
        "extracted_dates": [
            "up to 12 weeks",
            "today"
        ],
        "extracted_languages": [
            "English"
        ],
        "extracted_laws": [
            "Basic Requirements Certificate"
        ],
        "extracted_norps": [
            "French"
        ],
        "extracted_orgs": [
            "Rotation/Shifts Days",
            "Nursing",
            "DBP",
            "Learning and Leadership Development",
            "the University of Ottawa",
            "The Ottawa Hospital",
            "The Ottawa Hospital Inspired",
            "ECG",
            "Position Information Where",
            "the Quality Assurance Program",
            "the College of Nurses of Ontario"
        ],
        "extracted_persons": [
            "Member CCCN",
            "Member RNAO"
        ],
        "extracted_products": [],
        "extracted_money": [],
        "processed_text": "research drive compassion TOH Canada's large learning research multi campus hospital . bed staff deliver specialized care Eastern region . compassion people relentless pursuit discovery seek solution complex health care challenge continually engage community support vision patient care . research institute partner hospital continually gain national international recognition high quality patient care teaching research strive meet culturally diverse community serve . successful applicant nurse meet requirement apply eligible coronary critical care training program . night include weekend hour shift . information purpose Hospital reserve change . registration Completion Coronary Care Courses minimum medical surgical nursing Minimum cardiology nursing demonstrate theoretical knowledge nursing process relate general medicine surgery patient apply knowledge clinical setting demonstrate theoretical knowledge care cardiac patient apply knowledge clinical setting demonstrate assess patient's learning plan appropriate teaching demonstrate participate active health care team demonstrate communicate effectively oral write format patient public colleague health discipline identify commitment personal continue education activity demonstrate understanding willingness participate evaluation demonstrate understanding application relevance participate unit activity demonstrate theoretical knowledge Nursing Utilization Collection system willingness participate ongoing basis . Preferred Qualifications degree successful completion critical care program consolidation critical care course coronary care critical care read interpret lead proficiency \u2013 oral expression advanced level comprehension advanced level . expect commit provide healthy safe inclusive environment . drive purpose provide patient class care exceptional service compassion love . offer attractive equitable compensation package include comprehensive benefit package Defined Benefit Pension plan insurance protection . offer discount choice provider variety product service . provide Health Wellness resource personal professional development house team help align goal career objective . note applicant meet note requirement eligible apply position consider applicant meet requirement . applicant select interview notify interview result . interested apply passionate motivate improve health community excite lead edge medical technology commit excellence quality patient safety hear . submit application position interested . apply select consideration contact . equal employer . request accommodation recruitment process ."
    },
    "companyDescription": "",
    "description": "About The Ottawa Hospital\n   \n     \n    \n      \n     \n     \n      Inspired by research and driven by compassion!\n     \n     \n     \n       The Ottawa Hospital (TOH) is one of Canada\u2019s largest learning and research multi-campus hospitals. With more than 1,100 beds and approximately 12,000 staff members, we deliver specialized care to the Eastern Ontario region.\n     \n     \n       \n     \n     \n      From the compassion of our people to the relentless pursuit of new discoveries, The Ottawa Hospital never stops seeking solutions to the most complex health-care challenges while continually engaging with the community to support our vision for better patient care.\n     \n     \n      Working together with its research institute, the University of Ottawa, and other partners, the hospital is continually gaining national and international recognition for high-quality patient care, teaching and research, while striving to meet the needs of the culturally diverse community we serve. \n    \n   \n  \n \n \n  \n    Position Information\n   \n     \n    \n      \n     \n     Where there are no successful applicants, nurses that meet the experience requirement may apply and be eligible for a coronary critical care training program lasting up to 12 weeks. \n    \n   \n  \n \n \n  \n    Rotation/Shifts\n   \n     \n    \n      \n     \n     Days and nights, including weekends, 12 hour shifts. \n     \n      For information purposes only - The Hospital reserves the right to change.\n      \n    \n   \n  \n \n \n  \n    Basic Requirements \n    \n    \n    \n     \n      Certificate of registration from the College of Nurses of Ontario; \n      Completion of Coronary Care Courses; \n      Minimum of one (1) year medical surgical nursing experience; and \n      Minimum of one (1) year cardiology nursing experience; \n      Demonstrates theoretical knowledge of the nursing process as it relates to the general medicine/surgery patient and the ability to apply this knowledge in a clinical setting; \n      Demonstrates theoretical knowledge of the care of the cardiac patient,and ability to apply this knowledge in a clinical setting; \n      Demonstrates the ability to assess the patient's learning needs and ability to plan appropriate teaching; \n      Demonstrates the ability to participate as an active member of the health care team; \n      Demonstrates the ability to communicate effectively in an oral and written format with patients, public, colleagues and other health discipline; \n      Identifies a commitment to personal continuing education activities; \n      Demonstrates an understanding and a willingness to participate in self-evaluation; \n      Demonstrates an understanding of the application and relevance of the Quality Assurance Program and participates in unit activities; \n      Demonstrates theoretical knowledge of the Nursing Utilization Collection system and willingness to participate on an ongoing basis.\n      \n    \n   \n  \n \n \n  \n   Preferred Qualifications \n    \n    \n    \n     \n      A degree in Nursing; \n      Successful completion of a critical care program or consolidation in critical care; \n      Recent courses in coronary care, critical care; UoHI Cardiac Nursing Series; \n      Experience reading and interpreting 12 lead ECG's; \n      Member RNAO; \n      Member CCCN; \n      Proficiency in English and French \u2013 oral expression (advanced level) and comprehension (advanced level).\n      \n    \n   \n  \n \n \n  \n   What you can expect from us\n   \n     \n    \n      \n     \n     \n      The Ottawa Hospital is committed to providing a healthy, safe, and inclusive work environment for everyone. We are driven by our purpose to provide each patient with the world-class care, exceptional service and compassion we would want for our loved ones.\n     \n     \n     \n       We offer an attractive and equitable compensation package including a comprehensive benefits package, a Defined Benefit Pension (DBP) plan, and insurance protection. We also offer discounts from choice providers on a variety of products and services.\n     \n     \n       \n     \n     The Ottawa Hospital provides various Health and Wellness resources as well as opportunities for personal and professional development opportunities from our in-house Learning and Leadership Development team to help align your goals with your career objectives. \n    \n   \n  \n \n \n  \n    Please Note\n   \n     \n    \n      \n     \n     Applicants who do not meet the above-noted requirements are eligible to apply for this position and may be considered if there are no other applicants who meet all of the requirements.\n     \n      Applicants selected for an interview will be notified of interview results. \n    \n   \n  \n \n \n  \n    Interested? Apply today!\n   \n     \n    \n      \n     \n     If you are passionate about what you do, motivated by improving the health of the community, excited by leading-edge medical technology, and as committed to excellence, quality and patient safety as we are, we would like to hear from you. Please submit an on-line application for the position you are interested in. We thank all those who apply but only those selected for further consideration will be contacted.\n      The Ottawa Hospital is an equal opportunity employer. Upon request, accommodations due to a disability are available throughout the recruitment process."
}