{
    "id": "c2aa2bfa190672b4",
    "company": "Canadian Blood Services",
    "positionName": "Stem Cells Clerk",
    "jobType": [
        "Full-time"
    ],
    "location": "Ottawa, ON",
    "salary": null,
    "postingDateParsed": "2024-01-04T03:14:30.920Z",
    "url": "https://www.indeed.ca/rc/clk?jk=c2aa2bfa190672b4&from=jasx&tk=1hjm3csar2cja000&vjs=3",
    "externalApplyLink": "https://ca.indeed.com/applystart?jk=c2aa2bfa190672b4&from=vj&pos=top&mvj=0&spon=0&sjdu=o7sfz71MPdMgyiV0LZq0d4DDplm6SwWjHcxyoDIphKmibrN-3N7qDNm5lEU3lrksC6Rou-UBLFIJ_DEaNtX66dsfxaqi-yhjZg0H0zWVVeQDmwQjI6jeodGudyuBRNIDHocChxkPIqSfVeM2LKOT0WHz3mVUU5vusnDYZHaC9KdZCOpYfNA_wLIrCuS-rBQ0w9_XINGINv7OnqX9-Wv1cg&vjfrom=serp&log=1&astse=9febd00a9f6fe28d&assa=9983",
    "job_info_group": {
        "extracted_phone_numbers": [],
        "extracted_links": [
            "HTTP/HTTPS Links",
            "General Links",
            "WWW Links",
            "TLDs"
        ],
        "extracted_emails": [],
        "extracted_location_data": [
            "Canada"
        ],
        "extracted_dates": [],
        "extracted_languages": [],
        "extracted_laws": [],
        "extracted_norps": [],
        "extracted_orgs": [
            "Position",
            "the Stem Cells Program",
            "their local Public Health Unit",
            "MS Teams",
            "the Cord Blood Bank",
            "the Stem Cell Program",
            "Canadian Blood Services",
            "the Traditional Knowledge Keepers and Elders",
            "Health Canada"
        ],
        "extracted_persons": [],
        "extracted_products": [
            "Word, Outlook"
        ],
        "extracted_money": [],
        "processed_text": "category Administrative post employment status regular anticipated start classification BT opseu salary rate pay application deadline application requirement resume . recommend save copy post reference recruitment process . currently employee apply internal career . difference life . dynamic collaborative caring organization commit save improve life . patient depend reliable access safe blood plasma stem cell organ tissue . rewarding mission drive team join Canada's Lifeline meaningful difference . acknowledge span Territories Treaty area country grateful guide . recognize land water inspire offer gratitude indigenous people territory live play . role regular Stem Cells Clerk join dynamic Medical Laboratory Stem Cell Services team . role responsible support coordination administrative function include Stem Cells Manufacturing Stem Cells Registry . Clerk responsible provide administrative project operational support staff . Formula success utilize superb organization skill maintain update datum spreadsheet share drive draw administrative skill support recruitment material ordering processing inventory management critical thinker expert management prioritization task assessment excellent interpersonal skill maintain support internal external customer training draw detail execute document control activity desire education skill Grade year' relate equivalent combination education training Intermediate Excel skill knowledge Sharepoint communicate effectively verbally write deal other's effectively organize operate equipment offer week' vacation Comprehensive group health dental vision benefit family premium pay accord collective agreement define benefit pension plan . employee discount wellness program professional resource . expect shift hour Monday Friday physical requirement lift weight lb . diversity inclusion play vital role ensure health equity patient . committed reflect Canada's population organization foster environment employee authentic equal succeed contribute . require employee fully vaccinate covid vaccine dose approve subject medical human consideration . person vaccinate contact order vaccine equivalency certificate . role resonate encourage apply provide resume . step meaningful inspiring career . save life . applicant interest . consider interview invite participate assessment contact . applicant require accommodation discuss ."
    },
    "companyDescription": "",
    "description": "Job category: Administrative Job posting ID: 5413\n \n  Employment status: Regular full-time Position's anticipated start date: 2024-02-05\n \n  Classification: BT OPSEU 477 Salary/Rate of pay: $21.95\n \n  Application deadline: 2024-01-11 Application requirements:\n \n   Your up-to-date resume.\n   We recommend you save a copy of the job posting for reference throughout the recruitment process.\n \n \n  Do you currently work for Canadian Blood Services? All employees must apply via the internal career page.\n \n  Together, we can make all the difference in the lives of others.\n \n  Be part of a dynamic, collaborative and caring organization committed to saving and improving lives. Thousands of patients depend on us every day for reliable access to safe blood, plasma, stem cells and organs and tissues.\n \n  If you are looking for a rewarding experience with a values and mission-driven team, join Canada\u2019s Lifeline and make a meaningful difference.\n \n  We acknowledge that the work of Canadian Blood Services spans many Territories and Treaty areas across the country, and we are grateful for the Traditional Knowledge Keepers and Elders who have guided us in this important work. We recognize the land and waters that have inspired our work and offer gratitude to those Indigenous peoples on whose territory we work, live and play.\n \n \n  \n   \n     About the role\n   \n   \n     Canadian Blood Services is looking for a Regular full-time Stem Cells Clerk to join our dynamic Medical Laboratory & Stem Cell Services team.\n    \n     In this role, you will be responsible for supporting Canadian Blood Services through the coordination of the administrative function for the Stem Cell Program including the Cord Blood Bank, Stem Cells Manufacturing and Stem Cells Registry. The Clerk is also responsible for providing administrative, project and operational support to the Stem Cells Program and its staff.\n   \n  \n  \n   \n     Formula for success\n   \n   \n    \n      Utilizing your superb organization skills, you will be maintaining and updating data into various spreadsheets and shared drives\n      Drawing on your experience and administrative skills, you will be supporting recruitment materials ordering, processing and inventory management\n      Being a critical thinker, you are an expert at time management and prioritization of tasks and assessments\n      With your excellent interpersonal skills, you will maintain and support internal and external customer training\n      Drawing on your ability to be detailed, you will execute document control activities within\n    \n   \n  \n  \n   \n     Desired education and skills\n   \n   \n    \n      Grade 12, two years\u2019 recent related experience or an equivalent combination of education, training, and experience\n      Intermediate Excel skills with knowledge of Word, Outlook, MS Teams and Sharepoint\n      Ability to communicate effectively both verbally and in writing\n      Ability to deal with other\u2019s effectively\n      Ability to organize work\n      Ability to operate related equipment\n    \n   \n  \n  \n   \n     What we offer you\n   \n   \n   \n     \n    \n      3 weeks' vacation\n      Comprehensive group health, dental and vision benefits for you and your family\n      Premiums paid according to the collective agreement\n      Defined benefit pension plan.\n      Employee discounts, wellness program, professional resources.\n    \n   \n  \n  \n   \n     What you can expect\n   \n   \n   \n     \n    \n      Shift/hours - Monday to Friday - 7am to 3pm\n      Physical requirements - ability to lift weight up to 10 kg (22 lbs.)\n    \n   \n  \n \n  Diversity and inclusion play a vital role in ensuring health equity for patients across Canada. We are committed to reflecting Canada\u2019s population in our organization and fostering an environment where all employees can be their authentic selves, with equal opportunities to succeed and contribute.\n \n  Canadian Blood Services requires that all employees be fully vaccinated (COVID 19 vaccine doses as approved by Health Canada), subject to any medical or other human rights considerations. Persons who have been vaccinated outside of Canada must contact their local Public Health Unit in order to obtain a vaccine equivalency certificate.\n \n  If this role resonates with you, we encourage you to apply by providing your up-to-date resume. This could be your first step towards a meaningful and inspiring career. Come to work each day knowing that you save lives.\n \n  We thank all applicants for their interest. However, only those considered for an interview or those invited to participate in an assessment will be contacted. Applicants who require accommodation should discuss their needs with us."
}