{
    "id": "05ca0e6ee31a8643",
    "company": "Bousada",
    "positionName": "Charg\u00e9 de projets",
    "jobType": [],
    "location": "24 Bentley Avenue, Nepean, ON",
    "salary": null,
    "postingDateParsed": "2024-01-16T05:15:16.224Z",
    "url": "https://www.indeed.ca/rc/clk?jk=05ca0e6ee31a8643&from=jasx&tk=1hkikmj2lk7d1800&bb=vKjm19btPWjOJZeGLPTxvzRL5Z2YBAm4y1pkpbiPM8jVQlDMfoqsyrWKTKvhGhjDPBvCASJYmkMytUkq6U8sHRyH7Ty-SmZ8ZlKln3ytMeLOoBYDhI4XVg%3D%3D&xkcb=SoBE67M3FShVvVxytZ0FbzkdCdPP&vjs=3",
    "externalApplyLink": null,
    "job_info_group": {
        "extracted_phone_numbers": [],
        "extracted_links": [
            "HTTP/HTTPS Links",
            "General Links",
            "WWW Links",
            "TLDs"
        ],
        "extracted_emails": [],
        "extracted_location_data": [
            "li\u00e9es",
            "Bousada",
            "eastern Canada",
            "Project manager Ottawa"
        ],
        "extracted_dates": [
            "6 months - Opportunity",
            "2024-01-16"
        ],
        "extracted_languages": [],
        "extracted_laws": [],
        "extracted_norps": [],
        "extracted_orgs": [
            "- Group assurance & group",
            "institutionnels et r\u00e9sidentiels",
            "avec votre exp\u00e9rience",
            "POSTE",
            "la supervision et l'orientation du",
            "DEC",
            "6 mois - Possibilit\u00e9 d'avancement de carri\u00e8re - Environnement de travail enrichissant POSTE",
            "Maitre de l'anglais et du fran\u00e7ais - Permis",
            "les secteurs commerciaux",
            "vos responsabilit\u00e9s sont les suivantes",
            "& REER",
            "Charg\u00e9 de Projet Ottawa Chef de fil dans le domaine du couvre plancher dans",
            "l'Est du Canada",
            "Du Lundi au Vendredi Formation",
            "les autres employ\u00e9s"
        ],
        "extracted_persons": [
            "respecter les d\u00e9lais - Remplis tous les documents",
            "qu'il n'y",
            "Sous la supervision du directeur des charg\u00e9s de projet",
            "les superviseurs",
            "sp\u00e9cialise"
        ],
        "extracted_products": [],
        "extracted_money": [],
        "processed_text": "se dans vente l'installation couvre plancher autres surface dans . Superviser les installateur Superviser qualite l'execution des travaux Promouvoir milieu travail securitaire etre responsable securite des equipe Assumer responsabilite capacite l'equipe atteindre les objectifs production identifier les besoin matiere materiel d'outils les communiquer au responsable Informer directeur tout conflit d'horaire aider resoudre Organiser les horaires travail pour requis les feuilles temps tous les document construction connexe Passer revue tout les tache assignees pour s'assurer pas probleme planifier correctement l'utilisation efficace tous les materiaux Profil recherche du charge projet capacite resoudre des problemes orienter les travailleur Capacite montrer l'exemple les tache physique capacite lire interpreter diver dessin document lies construction Bien communiquer avec les collegues les groupes clients grand public tout assurant leadership travail l'ensemble l'equipe Preparer tenir des reunions hebdomadaires Excellentes competence communication tant l'oral qu'a l'ecrit conduire valide dossier conduite sans tache Bonne comprehension des question sante securite au travail l'environnement Nous offron Salaire competitif lien Regime d'assurance collective collectif apres true leader field flooring sell install flooring surface commercial institutional residential sector . project manager team leader's supervision responsibility duty supervise installer require oversee quality workmanship promote safe environment responsible safety crew accountable team's meet production goal identify requirement material tool communicate manager inform manager scheduling conflict assist resolve prioritize schedule meet deadline complete require paperwork tool box talk sheet construction document Review assign ensure issue properly plan material effectively Qualifications Skills problem solve skill direction worker physically demonstrate lead example capable read interpret construction relate drawing document communicate worker supervisor employee client group general public provide leadership supervision direction entire crew prepare conduct weekly safety toolbox meeting strong communication skill write verbally strong command English Language Valid driver's license clean drive record good understanding Occupation Health Safety environmental issue offer competitive salary relate RRSP plan career advancement reward environnement type dthemploi Temps plein Permanent avantage Assurance Dentaire Assurance Maladie Complementaire REER Collectif Tenue Decontractee Horaires travail Souhaite Gestion projet Souhaite Lieu du poste"
    },
    "companyDescription": "",
    "description": "POSTE : Charg\u00e9 de Projet Ottawa\nChef de fil dans le domaine du couvre plancher dans l\u2019Est du Canada, Bousada se sp\u00e9cialise dans la vente et l\u2019installation de couvre-plancher et autres surfaces dans les secteurs commerciaux, institutionnels et r\u00e9sidentiels.\nSous la supervision du directeur des charg\u00e9s de projet, vos responsabilit\u00e9s sont les suivantes :\n- Superviser les installateurs\n- Superviser la qualit\u00e9 de l\u2019ex\u00e9cution des travaux\n- Promouvoir un milieu de travail s\u00e9curitaire et \u00eatre responsable de la s\u00e9curit\u00e9 des \u00e9quipes\n- Assumer la responsabilit\u00e9 de la capacit\u00e9 de l\u2019\u00e9quipe \u00e0 atteindre les objectifs de production\n- Identifier les besoins en mati\u00e8re de mat\u00e9riel et d\u2019outils et les communiquer au responsable\n- Informer le directeur de tout conflit d\u2019horaire et aider \u00e0 le r\u00e9soudre\n- Organiser les horaires de travail pour respecter les d\u00e9lais\n- Remplis tous les documents requis, les feuilles de temps et tous les documents de construction connexes\n- Passer en revue toutes les t\u00e2ches assign\u00e9es pour s\u2019assurer qu\u2019il n\u2019y a pas de probl\u00e8me et planifier correctement l\u2019utilisation efficace de tous les mat\u00e9riaux\nProfil recherch\u00e9 du charg\u00e9 de projet :\n- Capacit\u00e9 \u00e0 r\u00e9soudre des probl\u00e8mes et \u00e0 orienter les travailleurs\n- Capacit\u00e9 \u00e0 montrer l\u2019exemple et les t\u00e2ches physique\n- Capacit\u00e9 \u00e0 lire et interpr\u00e9ter divers dessins et documents li\u00e9s \u00e0 la construction\n- Bien communiquer avec les coll\u00e8gues, les superviseurs, les autres employ\u00e9s, les groupes de clients et le grand public tout en assurant le leadership, la supervision et l\u2019orientation du travail \u00e0 l\u2019ensemble de l\u2019\u00e9quipe\n- Pr\u00e9parer et tenir des r\u00e9unions hebdomadaires\n- Excellentes comp\u00e9tences de communication tant \u00e0 l\u2019oral qu\u2019\u00e0 l\u2019\u00e9crit\n- Maitre de l\u2019anglais et du fran\u00e7ais\n- Permis de conduire valide, dossier de conduite sans tache\n- Bonne compr\u00e9hension des questions li\u00e9es \u00e0 la sant\u00e9 et \u00e0 la s\u00e9curit\u00e9 au travail et \u00e0 l\u2019environnement\nNous offrons:\n- Salaire comp\u00e9titif en lien avec votre exp\u00e9rience;\n- R\u00e9gime d\u2019assurances collectives & REER collectif apr\u00e8s 6 mois\n- Possibilit\u00e9 d\u2019avancement de carri\u00e8re\n- Environnement de travail enrichissant\nPOSTE : Project manager Ottawa\nBeing a true leader in the field of flooring in eastern Canada, Bousada sells and installs flooring and other surfaces within the commercial, institutional and residential sectors.\nUnder the project manager team leader\u2019s supervision, your responsibilities and duties are:\n- Supervise installers as required\n- Oversee quality of Workmanship\n- Promote a safe work environment and be responsible for the safety of the crews\n- Be accountable for team's ability to meet production goals\n- Identify requirements for materials, tools and communicate these to the manager\n- Inform the manager of any scheduling conflicts and assist in resolving them\n- Prioritize work schedules to meet deadlines\n- Complete all required paperwork such as tool box talks, time sheets, all related construction documents\n- Review all jobs assigned to ensure no issues and properly plan to use all materials effectively\nQualifications and Skills:\n- Problem solving skill and ability to give direction to workers\n- Ability to physically demonstrate & lead by example\n- Capable of reading and interpreting various construction related drawings and documents\n- Communicate well with co-workers, supervisors, other employees, client groups and the general public while providing leadership/supervision and work direction to the entire crew\n- Prepares and conducts weekly safety toolbox meetings\n- Strong communication skills both written and verbally\n- Strong command of English Language\n- Valid Ontario driver's license, clean driving record\n- Good understanding of Occupation Health and Safety and environmental issues\nWe offer:\n- Competitive salary related to your experience;\n- Group assurance & group RRSP plan after 6 months\n- Opportunity of career advancement\n- Rewarding work environnement\nType d'emploi : Temps plein, Permanent\nAvantages\u00a0:\n\n Assurance Dentaire\n Assurance Maladie Compl\u00e9mentaire\n REER Collectif\n Tenue D\u00e9contract\u00e9e\n\nHoraires de travail\u00a0:\n\n Du Lundi au Vendredi\n\nFormation:\n\n DEC (Souhait\u00e9)\n\nExp\u00e9rience:\n\n Gestion de projet: 1\u00a0an (Souhait\u00e9)\n\nLieu du poste : En pr\u00e9sentiel\nDate de d\u00e9but pr\u00e9vue\u00a0: 2024-01-16"
}