{
    "id": "133853395d6b6535",
    "company": "Schindler",
    "positionName": "Field Supervisor - New Installations & Modernizations",
    "jobType": [],
    "location": "110 Cobourg St, Ottawa, ON",
    "salary": null,
    "postingDateParsed": "2024-01-17T05:12:27.228Z",
    "url": "https://www.indeed.ca/rc/clk?jk=133853395d6b6535&from=jasx&tk=1hkikh137kp3h801&bb=MbdkWoTc0uPjBzci8Lm-JZ9AUwTEBbfU019JFLwHgy428LvMBu8k09oQ19nwMkio94_owSaE_3Yk3Zn_FIdg2GUVNkJ-N4TKnVpqHshVPWw6Pi7dpU1uDQ%3D%3D&xkcb=SoD367M3FShL_WzU3h0FbzkdCdPP&vjs=3",
    "externalApplyLink": "https://job.schindler.com/Schindler/job/Ottawa%2C-ON-Field-Supervisor-New-Installations-&-Modernizations-Onta/1025518701/",
    "job_info_group": {
        "extracted_phone_numbers": [],
        "extracted_links": [
            "HTTP/HTTPS Links",
            "General Links",
            "WWW Links",
            "TLDs"
        ],
        "extracted_emails": [],
        "extracted_location_data": [
            "Toronto",
            "Canada",
            "North America",
            "ON, Ontario",
            "Ottawa",
            "Morristown",
            "Ontario",
            "Switzerland",
            "New Jersey"
        ],
        "extracted_dates": [
            "1874",
            "3-5 years"
        ],
        "extracted_languages": [],
        "extracted_laws": [],
        "extracted_norps": [],
        "extracted_orgs": [
            "the Schindler Group",
            "Schindler Elevator Corporation",
            "Engineering or Project Management",
            "Communicate",
            "Canadian Headquarters",
            "safety & technical",
            "MS Word",
            "Schindler",
            "PPE",
            "ON.",
            "73013 Schindler",
            "New Installations (NI",
            "Schindler Group",
            "the Switzerland-based Schindler Group",
            "Bay & Adelaide",
            "U.S. Headquarters",
            "Company Match Ongoing Learning & Career Development"
        ],
        "extracted_persons": [
            "Schindler"
        ],
        "extracted_products": [
            "Excel"
        ],
        "extracted_money": [],
        "processed_text": "location Requisition stand mobility . mobility expert . join team lead global provider elevator escalator service . schindler mobility solution billion people . company's success employee country . north american operating entity . lead global manufacturer elevator escalator walk . employ people location . company specialize late technology engineering mechanical micro technology product design rigorously test comfort efficiency reliability . schindler product find building include . Field Supervisor Installations Modernizations Mobility goal Field Supervisor \u2013 Modernization MOD responsible installation construction modernization project conform customer company requirement relate quality improvement safety cost improvement customer satisfaction support Branch objective . responsibility managing coaching training field employee health safety requirement . Safety Supervision Lead field employee provide mentorship guidance constructive feedback promote employee development Coach persuade field employee Schindler's method safety quality productivity identify training deliver training field employee monitor field employee quantitative qualitative point view include approval ticket maintenance vacation schedule Investigate employee incident support early safe return initiative . conduct regular safety observation ensure correct usage . Financial Management Manage installation modernization area responsibility framework financial budget Manage field technician manpower maximize business result Process Quality Management Monitor completion check point implement require corrective action order drive installation modernization performance BDP model meet ISO standard ensure installation modernization project meet Schindler employee passenger safety quality standard contract requirement define customer ensure compliance requirement issue local government authority manage ongoing program project field audit assurance conformance performance standard quality completeness safety . evaluate initiate request tooling tooling support productivity improvement Customer Service External Relations Interpret customer concern mobilize internal resource customer satisfaction assure cost minimize ensure customer enquire meet prompt professional manner provide clear communication . demonstrate customer receive fair expenditure influence business agent inspector . resolve dispute maintain manage pro active relationship Union business agent Mobility post secondary degree \u2013 preferably elevator industry industry include supervision capital equipment installation excellent leadership skill demonstrate solve problem coach mentor guide team strong communication skill organization skill supervision motivated team player record achieve result flexible hour business demand Computer literacy \u2013 Power Point Project Commitment competitive salary commensurate Competitive Bonus Incentive Program Company Vehicle Program Fuel Card Competitive Extended Health Dental Vision Plans generous Paid Plans Tuition Reimbursement Program Competitive Group RRSP Supportive Environment submit application consent allow share application detail include personal information party recruitment partner affiliate company . future send complete application . inclusion diversity practice equity create equal . endeavor qualified applicant receive consideration employment regard age race ethnic background color religious affiliation union affiliation gender gender identity sexual orientation marital status national origin nationality genetic health protect veteran status ."
    },
    "companyDescription": "",
    "description": "Location: Ottawa, ON, Ontario, Canada Requisition ID: 73013 \n  Schindler stands for mobility. Mobility needs experts. Join our team in Ottawa, ON. \n  Founded in Switzerland in 1874, the Schindler Group is a leading global provider of elevators, escalators, and related services. Schindler mobility solutions move one billion people every day all over the world. Behind the company's success are over 60,000 employees in more than 100 countries. \n  With U.S. Headquarters in Morristown, New Jersey, and Canadian Headquarters in Toronto, Ontario, Schindler Elevator Corporation is the North American operating entity of the Switzerland-based Schindler Group. Schindler is one of the leading global manufacturers of elevators, escalators and moving walks. Schindler employs over 5,000 people in more than 230 locations in North America. The company specializes in latest-technology engineering as well as mechanical and micro-technology products designed and rigorously tested for comfort, efficiency and reliability. Schindler products can be found in many well-known buildings throughout Canada, including Scotia Plaza, Bay & Adelaide, Edmonton Arena, Calgary Airport, and Vancouver Canada Line. \n  Field Supervisor - New Installations & Modernizations \n  \n   \n    Mobility is the goal \n    \n     The Field Supervisor \u2013 New Installations (NI) and Modernization (MOD) is responsible for the installation of new construction and modernization projects through conforming to customer and company requirements as related to quality improvements, safety, cost improvement and customer satisfaction in support of Branch objectives. He/She has responsibility for managing, coaching and training field employees as well as health and safety requirements.\n      \n      \n     Safety and Supervision \n     \n      Lead field employees through providing mentorship, guidance and constructive feedback to promote employee development \n      Coach and persuade field employees on Schindler\u2019s methods of safety, quality and productivity \n      Identify training needs and deliver training (safety & technical) to field employees \n      Monitor work of field employees from both a quantitative and qualitative point of view, including approval of time tickets and maintenance of vacation schedules \n      Investigate employee incidents and near misses, and support early and safe return to work initiatives. Conduct regular safety observations and ensure correct usage of PPE.\n     \n      \n      \n     Financial Management \n     \n      Manage new installation and modernization work in area of responsibility within framework of financial budget \n      Manage field technician manpower to maximize business results\n     \n      \n      \n     Process and Quality Management \n     \n      Monitor job completion check points and implement required corrective action in order to drive installation and modernization performance to BDP model and meet ISO standards \n      Ensure each installation and modernization project meets Schindler employee and passenger safety and quality standards and all contract requirements as defined by customer \n      Ensure compliance with requirements issued by local and government authorities \n      Manage ongoing program of project field audit to assurance conformance of performance standards of quality, completeness and safety. \n      Evaluate and initiate requests for tooling where such tooling would support productivity improvement\n     \n      \n      \n     Customer Service and External Relations \n     \n      Interpret customer concerns and mobilize the necessary internal resources in such a way that customer satisfaction is assured while costs are minimized \n      Ensure customer needs or enquires are met in a prompt, professional manner by providing clear communications. \n      Demonstrate to customers that they are receiving fair value for their expenditures \n      Communicate with and influence business agents, inspectors, etc., in resolving disputes \n      Maintain and manage pro-active relationships with Union business agent \n     \n     \n   \n   \n    Mobility needs you \n    \n     \n      Post Secondary degree \u2013 preferably in Engineering or Project Management \n      3-5 years in elevator industry or related experience, or a similar industry which includes the supervision of capital equipment installation \n      Excellent leadership skills and demonstrated ability to solve problems \n      Ability to coach, mentor and guide team members \n      Strong communication skills, organization skills and ability to work without supervision \n      Self motivated team player with record of achieving results \n      Work flexible hours as business demands \n      Computer literacy \u2013 MS Word, Power Point, Excel, Project\n     \n      \n      \n     \n     Our Commitment \n     \n      Competitive Salary (commensurate with experience) \n      Competitive Bonus Incentive Program \n      Company Vehicle Program & Fuel Card \n      Competitive Extended Health, Dental & Vision Plans \n      Generous Paid Time Off Plans \n      Tuition Reimbursement Program \n      Competitive Group RRSP with Company Match \n      Ongoing Learning & Career Development in a Supportive Work Environment \n      By submitting this application, you consent to allow Schindler Elevator Corporation to share your application details (including your personal information) with our third party recruitment partners and affiliate companies. \n      \n    \n   \n   \n    \n     \n      Do you want to move the future with us? \n     \n     \n      Send us your complete application.\n       www.schindler.com\n     \n      \n      \n     \n   \n  \n \n \n At Schindler Group we value inclusion and diversity, and practice equity to create equal opportunities for all. We endeavor that all qualified applicants will receive consideration for employment without regard to age, race, ethnic background, color, religious affiliation, union affiliation, gender, gender identity, sexual orientation, marital status, national origin, nationality, genetics and health, disability or protected veteran status."
}