{
    "id": "c8334c7cac050eb5",
    "company": "Roberts/Smart Centre",
    "positionName": "Director of Programs and Quality/Directeur des programmes et de la qualit\u00e9",
    "jobType": [],
    "location": "Ottawa, ON",
    "salary": null,
    "postingDateParsed": "2024-01-17T05:12:54.384Z",
    "url": "https://www.indeed.ca/rc/clk?jk=c8334c7cac050eb5&from=jasx&tk=1hkikituvitnn800&bb=wVO1fWneEL8E3fFenywj_l5bVDFuxbzVEX5xRs3Zp_jHz8kkRQcye6iHMmgrhs9GzzuxZr5bwQF-vt0O1CKPRAkqxYNE3KrivdLcWwiDDXgyeI1Cs4GDxw%3D%3D&xkcb=SoAQ67M3FShEGrw23Z0LbzkdCdPP&vjs=3",
    "externalApplyLink": null,
    "job_info_group": {
        "extracted_phone_numbers": [],
        "extracted_links": [
            "HTTP/HTTPS Links",
            "General Links",
            "WWW Links",
            "TLDs"
        ],
        "extracted_emails": [],
        "extracted_location_data": [
            "dans ce poste"
        ],
        "extracted_dates": [
            "Monday to Friday",
            "Several years",
            "5 years"
        ],
        "extracted_languages": [],
        "extracted_laws": [],
        "extracted_norps": [
            "au besoin"
        ],
        "extracted_orgs": [
            "- Diriger le d\u00e9veloppement et l'\u00e9valuation des programmes du Centre Roberts/Smart",
            "the RSC Board of Directors Quality Committee",
            "la vie des jeunes les plus vuln\u00e9rables de la province",
            "sant\u00e9 mentale de qualit\u00e9 exceptionnelle dans",
            "Care Mental Health",
            "Ce membre cl\u00e9 de l'\u00e9quipe de direction jouera \u00e9galement un r\u00f4le dans la planification et l'orientation g\u00e9n\u00e9rale du Centre",
            "RSC",
            "Pourquoi seriez-vous un atout pour l'\u00e9quipe du Centre Roberts/Smart",
            "avec les principales",
            "et un syst\u00e8me de soutien",
            "en sant\u00e9 publique",
            "Central Reservation System",
            "the Director of Programs and Quality",
            "Nous les aidons en leur fournissant des services",
            "C'est",
            "qui promeuvent l'orientation ax\u00e9e sur le client",
            "travail social ou dans un domaine d'\u00e9tude",
            "Social Work",
            "directrice des programmes et de la qualit\u00e9",
            "the Position Working",
            "occuper ce poste La meilleure personne pour ce poste sera un joueur d'\u00e9quipe attentionn\u00e9",
            "\u00e0 la recherche d'un",
            "Le directeur ou la directrice des programmes et de la",
            "Ce poste Sous la direction de la directrice g\u00e9n\u00e9rale, le directeur ou la",
            "Comment postuler Vous souhaitez vous joindre \u00e0 notre \u00e9quipe en tant que nouveau directeur ou nouvelle directrice des programmes et de la",
            "un \u00e9tablissement de soins tertiaires en sant\u00e9 mentale",
            "en sciences de la sant\u00e9",
            "directrice des programmes et de la qualit\u00e9 est",
            "the Centre",
            "Health Sciences",
            "(sans droit de vote",
            "et d\u00e9velopper les services du Central Reservation System",
            "envoyez-nous votre Curriculum Vitae",
            "de croissance organisationnelle et de renforcement des capacit\u00e9s"
        ],
        "extracted_persons": [
            "Nous faisons \u00e9galement tout ce qui est en notre pouvoir pour leur donner les outils",
            "vivre heureux",
            "de se",
            "et r\u00e9pondez aux",
            "id\u00e9al",
            "d\u00e9marquer",
            "fond\u00e9es sur des donn\u00e9es probantes",
            "Diriger et superviser les gestionnaires des programmes.",
            "administration de la sant\u00e9",
            "fond\u00e9es sur des donn\u00e9es probantes et les pratiques",
            "D'autres crit\u00e8res peuvent permettre \u00e0",
            "Des connaissances approfondies du secteur de la sant\u00e9 mentale des jeunes",
            "La personne id\u00e9ale"
        ],
        "extracted_products": [],
        "extracted_money": [
            {
                "amount": "$91,152.95-$98,591.03",
                "noun_phrases": [
                    "$91,152.95-$98,591.03"
                ]
            }
        ],
        "processed_text": "difference life vulnerable youth province . youth family privilege serve deal severe mental health behavioural challenge . help provide exceptional mental health service welcoming supportive inclusive culturally safe environment . tool confidence support system lead happy productive fulfil life . expand program team grow Roberts Smart Centre currently Director Programs Quality . direction Chief Executive Officer responsible program quality assurance program risk management community collaboration effort behalf . key senior management team play planning direction . Director Programs Quality lead development evaluation Roberts Smart Centre program . lead supervise Program Managers . Oversee key performance indicator quality improvement initiative relate program serve ad hoc voting . lead grow current evidence base leading practice RSC program expand RSC service . collaboratively key stakeholder include Ministry representative local provincial community partner youth family . represent organization community function require develop maintain community relationship partnership promote client centre direction . Ideal person compassionate team player passion youth mental health demonstrate proven program development management change management organizational growth capacity building . senior management level tertiary care mental health setting . advanced knowledge youth mental health sector include organization community context clinical environment evidence inform approach . demonstrate build strong relationship key stakeholder include Ministry representative local provincial community partner youth family senior leader multiple organization virtually person . strong communication verbal write official language administrative organizational skill . criterion set apart include master's degree health administration Public Health relevant field study . develop broad network community mental health addiction health community service provider . apply interested join team Director Programs Quality terrific apply send resume attach answer question . excite position ideal . valuable addition Roberts Smart Centre team forward hear . _ _ _ _ _ _ _ _ _ _ _ _ _ _ _ _ _ _ _ _ _ _ _ _ _ _ _ _ _ _ _ _ _ _ _ _ _ _ _ _ _ _ _ _ _ _ _ _ _ _ _ _ _ _ _ _ _ _ _ _ _ _ _ _ _ _ _ _ _ _ _ _ _ _ _ _ _ _ _ _ _ _ _ _ _ _ _ _ Au Centre Roberts Smart nous nous efforcon declencher changement positif dans . Les jeunes les familles nous avons privilege servir sont confronte graves problemes sante mentale comportement . environnement accueillant solidaire inclusif bilingue culturellement sain . confiance il auront besoin pour facon productive epanouie . Nous sommes pleine expansion programme notre equipe est croissance . Centre Roberts Smart est presentement directeur d'une . responsable tous programme l'assurance qualite gestion du risque des programme des nombreux efforts collaboration avec communaute au nom du Central Reservation System . . qualite . Superviser les indicateurs cles performance d'amelioration qualite ce concerne les programme agir tant membre ad hoc du comite qualite du conseil d'administration du Central Reservation System . Diriger renforcer les pratiques courantes exemplaires dans les programme du Central Reservation System . travailler collaboration avec les principaux party prenantes compris les representants du ministere les partenaires communautaires locaux provinciaux les jeunes les familles . Representer l'organisation lors d'activites communautaires etablissant maintenant des relations des partenariats communautaire du . pour passionne par sante mentale des jeunes demontrera qu'il Des competence averees matiere d'elaboration programme gestion gestion du changement . Plusieurs annees d'experience poste direction dans . notamment du contexte organisationnel communautaire l'environnement clinique des approches . Une capacite averee etablir des relation solide party prenante compris les representants du ministere les partenaires communautaires locaux provinciaux les jeunes les familles les haut responsable plusieurs organisation fois virtuellement personne . solide competence communication orale ecrite dans les deux langues officielles des competences organisationnelles matiere d'administration . candidat une Une maitrise pertinent . Disposer d'un vaste reseau bien developpe au sein communaute des prestataires services sante mentale toxicomanie sante services communautaire . qualite formidable pour postuler questions suivantes . Qu'est ce vous interesse . Qu'est ce fait vous une ideale candidat . type permanent salary benefit casual dress company pension Dental care insurance Extended health care Life insurance site parking Paid Vision care Wellness program Schedule senior level Tertiary preferred location person"
    },
    "companyDescription": "",
    "description": "At the Roberts/Smart Centre, we are all about making a difference in the lives of the most vulnerable youth in the province.\nThe youth and families we have the privilege of serving deal with severe mental health and behavioural challenges. We help them by providing exceptional mental health services in a welcoming, supportive, inclusive, bilingual, and culturally safe environment. We also do everything to give them the tools, confidence, and support system they need to lead happy, productive, and fulfilling lives.\nWe are expanding programs and our team is growing! The Roberts/Smart Centre is currently looking for a Director of Programs and Quality.\nAbout the Position\nWorking under the direction of the Chief Executive Officer, the Director of Programs and Quality is responsible for all our programs, quality assurance, program risk management, and many community collaboration efforts on behalf of RSC. This key member of the senior management team will also play a part in the planning and overall direction of the Centre.\nThe Director of Programs and Quality will:\n- Lead the development and evaluation of the Roberts/Smart Centre programs.\n- Lead and supervise Program Managers.\n- Oversee key performance indicators and quality improvement initiatives as they relate to programs and serve as an ad hoc (non-voting) member of the RSC Board of Directors Quality Committee.\n- Lead and grow current evidence-based and leading practices within RSC programs and expand RSC services.\n- Work collaboratively with key stakeholders, including Ministry representatives, local and provincial community partners, youth, and families.\n- Represent the organization at community functions as required, developing and maintaining community relationships and partnerships that promote the client-centred direction of RSC.\nOur Ideal Candidate\nThe right person for this job will be a compassionate team player with a passion for youth mental health who can demonstrate that they have:\n- Proven abilities in program development, management, change management and organizational growth and capacity building.\n- Several years of experience at a senior management level in a tertiary care mental health setting.\n- Advanced working knowledge of the youth mental health sector, including organization and community context, clinical environment, and evidence informed approaches.\n- A demonstrated ability to build strong relationships with key stakeholders, including Ministry representatives, local and provincial community partners, youth and families, and senior leaders across multiple organizations, both virtually and in-person.\n- Strong communication (verbal and written) in both official languages and administrative organizational skills.\nOther criteria that could set a candidate apart include:\n- A master\u2019s degree in health administration, Health Sciences, Public Health, Social Work or relevant field of study.\n- A well-developed and broad network within the community of mental health/addictions, health, and community service providers.\nHow to Apply\nAre you interested in joining our team as our new Director of Programs and Quality? That\u2019s terrific!\nTo apply, send us your resume attached, and answer the following questions:\n1. What excites you most about this position?\n2. What makes you an ideal candidate?\n3. Why would you be a valuable addition to the Roberts/Smart Centre team?\nWe look forward to hearing from you.\n________________________________________________________________________________________\nAu Centre Roberts/Smart, nous nous effor\u00e7ons de d\u00e9clencher un changement positif dans la vie des jeunes les plus vuln\u00e9rables de la province.\nLes jeunes et les familles que nous avons le privil\u00e8ge de servir sont confront\u00e9s \u00e0 de graves probl\u00e8mes de sant\u00e9 mentale et de comportement. Nous les aidons en leur fournissant des services en sant\u00e9 mentale de qualit\u00e9 exceptionnelle dans un environnement accueillant, solidaire, inclusif, bilingue et culturellement sain. Nous faisons \u00e9galement tout ce qui est en notre pouvoir pour leur donner les outils, la confiance et un syst\u00e8me de soutien dont ils auront besoin pour vivre heureux, de fa\u00e7on productive et \u00e9panouie.\nNous sommes en pleine expansion de nos programmes et notre \u00e9quipe est en croissance. Le Centre Roberts/Smart est pr\u00e9sentement \u00e0 la recherche d\u2019un directeur ou d\u2019une directrice des programmes et de la qualit\u00e9.\nCe poste\nSous la direction de la directrice g\u00e9n\u00e9rale, le directeur ou la directrice des programmes et de la qualit\u00e9 est responsable de tous nos programmes, de l\u2019assurance de la qualit\u00e9, de la gestion du risque des programmes et des nombreux efforts de collaboration avec la communaut\u00e9 au nom du CRS. Ce membre cl\u00e9 de l\u2019\u00e9quipe de direction jouera \u00e9galement un r\u00f4le dans la planification et l\u2019orientation g\u00e9n\u00e9rale du Centre.\nLe directeur ou la directrice des programmes et de la qualit\u00e9 :\n- Diriger le d\u00e9veloppement et l\u2019\u00e9valuation des programmes du Centre Roberts/Smart.\n- Diriger et superviser les gestionnaires des programmes.\n- Superviser les indicateurs cl\u00e9s de performance et d\u2019am\u00e9lioration de la qualit\u00e9 en ce qui concerne les programmes et agir en tant que membre ad hoc (sans droit de vote) du comit\u00e9 de la qualit\u00e9 du conseil d\u2019administration du CRS.\n- Diriger et renforcer les pratiques courantes fond\u00e9es sur des donn\u00e9es probantes et les pratiques exemplaires dans les programmes du CRS et d\u00e9velopper les services du CRS.\n- Travailler en collaboration avec les principaux parties prenantes, y compris les repr\u00e9sentants du minist\u00e8re, les partenaires communautaires locaux et provinciaux, les jeunes et les familles.\n- Repr\u00e9senter l\u2019organisation lors d\u2019activit\u00e9s communautaires, au besoin, en \u00e9tablissant et en maintenant des relations et des partenariats communautaires qui promeuvent l\u2019orientation ax\u00e9e sur le client du CRS.\nLa personne id\u00e9ale pour occuper ce poste\nLa meilleure personne pour ce poste sera un joueur d\u2019\u00e9quipe attentionn\u00e9, passionn\u00e9 par la sant\u00e9 mentale des jeunes et qui d\u00e9montrera qu\u2019il a :\n- Des comp\u00e9tences av\u00e9r\u00e9es en mati\u00e8re d\u2019\u00e9laboration de programmes, de gestion, de gestion du changement, de croissance organisationnelle et de renforcement des capacit\u00e9s.\n- Plusieurs ann\u00e9es d\u2019exp\u00e9rience \u00e0 un poste de direction dans un \u00e9tablissement de soins tertiaires en sant\u00e9 mentale.\n- Des connaissances approfondies du secteur de la sant\u00e9 mentale des jeunes, notamment du contexte organisationnel et communautaire, de l\u2019environnement clinique et des approches fond\u00e9es sur des donn\u00e9es probantes.\n- Une capacit\u00e9 av\u00e9r\u00e9e \u00e0 \u00e9tablir des relations solides avec les principales parties prenantes, y compris les repr\u00e9sentants du minist\u00e8re, les partenaires communautaires locaux et provinciaux, les jeunes et les familles, et les hauts responsables de plusieurs organisations, \u00e0 la fois virtuellement et en personne.\n- De solides comp\u00e9tences en communication (orale et \u00e9crite) dans les deux langues officielles et des comp\u00e9tences organisationnelles en mati\u00e8re d\u2019administration.\nD\u2019autres crit\u00e8res peuvent permettre \u00e0 un candidat ou une candidate de se d\u00e9marquer:\n- Une maitrise en administration de la sant\u00e9, en sciences de la sant\u00e9, en sant\u00e9 publique, en travail social ou dans un domaine d\u2019\u00e9tude pertinent.\n- Disposer d\u2019un vaste r\u00e9seau bien d\u00e9velopp\u00e9 au sein de la communaut\u00e9 des prestataires de services de sant\u00e9 mentale et de toxicomanie, de sant\u00e9 et de services communautaires.\nComment postuler\nVous souhaitez vous joindre \u00e0 notre \u00e9quipe en tant que nouveau directeur ou nouvelle directrice des programmes et de la qualit\u00e9 ? C\u2019est formidable !\nPour postuler, envoyez-nous votre CV, et r\u00e9pondez aux questions suivantes :\n1. Qu\u2019est-ce qui vous int\u00e9resse le plus dans ce poste ?\n2. Qu\u2019est-ce qui fait de vous une candidate id\u00e9ale ou un candidat id\u00e9al ?\n3. Pourquoi seriez-vous un atout pour l\u2019\u00e9quipe du Centre Roberts/Smart ?\nJob Types: Full-time, Permanent\nSalary: $91,152.95-$98,591.03 per year\nBenefits:\n\n Casual dress\n Company pension\n Dental care\n Disability insurance\n Extended health care\n Life insurance\n On-site parking\n Paid time off\n Vision care\n Wellness program\n\nSchedule:\n\n Monday to Friday\n On call\n\nExperience:\n\n Senior level /Tertiary Care Mental Health: 5 years (preferred)\n\nWork Location: In person"
}