{
    "id": "2de9902ad8534520",
    "company": "University of Ottawa",
    "positionName": "Poste en mati\u00e8re \u00e9cologie \u00e9volutive - BIO",
    "jobType": [],
    "location": "30 Marie-Curie Private, Ottawa, ON",
    "salary": null,
    "postingDateParsed": "2023-11-10T20:16:30.959Z",
    "url": "https://www.indeed.ca/rc/clk?jk=2de9902ad8534520&from=jasx&tk=1hgol57rgk5r3800&vjs=3",
    "externalApplyLink": "https://uottawa.wd3.myworkdayjobs.com/fr-CA/uOttawa_External_Career_Site/job/Ottawa-ON/Tenure-track-positions-in-evolutionary-ecology---BIO_JR7952",
    "job_info_group": {
        "extracted_phone_numbers": [
            "613-562-5729",
            " 613-562-5486",
            "613-562-5486",
            " 613-562-5729"
        ],
        "extracted_links": [
            "HTTP/HTTPS Links",
            "General Links",
            "WWW Links",
            "TLDs"
        ],
        "extracted_emails": [
            "biochair.assistant@uottawa.ca",
            "vra.affairesprofessorales@uOttawa.ca",
            "vra.affairesprofessorales@uottawa.ca"
        ],
        "extracted_location_data": [
            "au Canada",
            "Ottawa",
            "les membres de la population \u00e9tudiante",
            "le portail des carri\u00e8res de l'Universit\u00e9",
            "niveaux"
        ],
        "extracted_dates": [
            "Avant le 1er mai 2022",
            "1er juillet 2024",
            "novembre 17",
            "1er mai 2022"
        ],
        "extracted_languages": [],
        "extracted_laws": [],
        "extracted_norps": [
            "\u00e9volutive",
            "candidatures des Peuples"
        ],
        "extracted_orgs": [
            "La Facult\u00e9 des sciences offre \u00e0 tous ses membres l'acc\u00e8s \u00e0 des installations de base",
            "avec des chercheuses et des chercheurs de l'Institut de recherche de l'H\u00f4pital d'Ottawa",
            "par des pairs Formulaire",
            "coll\u00e9gial et \u00e0 forte intensit\u00e9 de recherche",
            "contribuant aux activit\u00e9s administratives",
            "Le d\u00e9partement collabore \u00e9troitement",
            "l'\u00e9cologie mol\u00e9culaire et la g\u00e9n\u00e9tique \u00e9cologique",
            "un r\u00f4le actif au sein du d\u00e9partement",
            "T\u00e9l\u00e9phone",
            "APUO Facult\u00e9 ou d\u00e9partement",
            "Autochtones du Canada",
            "\u00e9tablissant des collaborations au sein et au-del\u00e0 de notre d\u00e9partement",
            "assurer l'\u00e9quit\u00e9, la diversit\u00e9 et l'inclusion dans les milieux de recherche et de leadership de ses",
            "courriel au vra.affairesprofessorales@uottawa.ca",
            "L'Universit\u00e9 d'Ottawa est engag\u00e9e \u00e0 assurer l'\u00e9quit\u00e9, la diversit\u00e9 et l'inclusion dans les environnements de recherche et de leadership de nos",
            "les deux langues officielles de l'Universit\u00e9",
            "la formation des membres du groupe de recherche",
            "\u00e0 poursuivre les \u00e9tapes",
            "notamment la",
            "l'\u00e9cotoxicologie",
            "de deuxi\u00e8me cycle du d\u00e9partement",
            "discipline connexe",
            "formation dans leur deuxi\u00e8me langue officielle",
            "au moment de l'embauche",
            "du corps professoral et du",
            "un entretien seront contact\u00e9s",
            "l'\u00e9quit\u00e9, la diversit\u00e9 et l'inclusion",
            "de l'Institut de cardiologie d'Ottawa",
            "de l'Universit\u00e9 Carleton",
            "avec des communaut\u00e9s",
            "sont invit\u00e9es \u00e0 postuler",
            "mais pourrait \u00eatre remis",
            "doit \u00eatre d\u00e9pos\u00e9 le 10 janvier 2024",
            "biologie ou en sciences",
            "la Facult\u00e9 des sciences",
            "vigueur \u00e0 compter de mai 2023",
            "par des pairs",
            "Le D\u00e9partement de biologie de l'Universit\u00e9",
            "Famille d'emplois : Cadres universitaires et corps professoral Affiliation",
            "l'excellence de la recherche doit \u00eatre clairement pr\u00e9sent\u00e9e",
            "dont vous avez besoin en \u00e9crivant au Cabinet de la vice-provost aux affaires professorales \u00e0 vra.affairesprofessorales@uOttawa.ca",
            "au moins un de ces groupes sont invit\u00e9es \u00e0 remplir le",
            "Dans certains cas",
            "sur votre dossier de recherche",
            "et acad\u00e9miques du d\u00e9partement et de la Facult\u00e9 des sciences",
            "d'enseigner en fran\u00e7ais et en anglais au moment de l'embauche",
            "les moyens de devenir bilingue",
            "avec un salaire selon l'\u00e9chelle salariale",
            "biologie du d\u00e9veloppement",
            "enseigner en fran\u00e7ais et en anglais",
            "Les personnes qui souhaitent \u00eatre consid\u00e9r\u00e9es comme membres d'un ou de plusieurs groupes d\u00e9sign\u00e9s sont pri\u00e9es de remplir le questionnaire",
            "de soutien et",
            "des femmes",
            "par voie \u00e9lectronique",
            "L'Universit\u00e9 d'Ottawa s'est engag\u00e9e \u00e0 offrir \u00e0 sa communaut\u00e9 un milieu de leadership et de savoir qui pr\u00f4ne l'\u00e9quit\u00e9, la diversit\u00e9 et l'inclusion",
            "La personne candidate doit \u00eatre en mesure d'enseigner en fran\u00e7ais et en anglais",
            "d\u00e9velopper les forces du d\u00e9partement en mati\u00e8re",
            "un d\u00e9partement",
            "d'\u00e9quit\u00e9, de diversit\u00e9 et d'inclusion seront int\u00e9gr\u00e9s dans",
            "la recherche th\u00e9orique et/ou empirique \u00e0 l'interface",
            "fonction des directives de la sant\u00e9 publique et des recommandations des sp\u00e9cialistes"
        ],
        "extracted_persons": [
            "engagement et des strat\u00e9gies en mati\u00e8re d'enseignement et de formation des dipl\u00f4m\u00e9s",
            "La personne candidate retenue devra d\u00e9montrer son potentiel",
            "retenues pour ce",
            "30 Marie Curie Private",
            "Les personnes qui appartiennent \u00e0",
            "veuillez nous aviser de tout besoin n\u00e9cessitant",
            "juste titre",
            "Les personnes",
            "Les",
            "et \u00e0 leurs conjoints",
            "les professeures et professeurs doivent \u00eatre",
            "niveau de professeure associ\u00e9e ou de professeur associ\u00e9 peuvent \u00e9galement \u00eatre pris",
            "Nous encourageons donc vivement",
            "elles ou ils doivent avoir la capacit\u00e9 d'enseigner dans les deux",
            "veuillez pr\u00e9ciser si vous avez l'autorisation de travailler au Canada",
            "la chimie",
            "Rang et salaire",
            "des projets de th\u00e8se des \u00e9tudiants",
            "L'Universit\u00e9 d'Ottawa est fi\u00e8re de sa tradition de bilinguisme",
            "l'Universit\u00e9 (y compris les entrepreneurs) \u00e9taient tenus d'\u00eatre vaccin\u00e9s",
            "Les responsabilit\u00e9s",
            "retenue",
            "Exigences pr\u00e9alables",
            "innovant et collaboratif de 40",
            "veuillez indiquer",
            "des mol\u00e9cules",
            "un entretien seront contact\u00e9es",
            "qualifi\u00e9es poss\u00e9dant les comp\u00e9tences",
            "veuillez nous aviser de toute mesure d'adaptation",
            "Si vous \u00eates",
            "de son personnel et de son corps professoral",
            "Au moment de soumettre votre candidature",
            "Si nous vous",
            "de m\u00eame qu'un",
            "Professeure adjointe",
            "agr\u00e9g\u00e9 T\u00e2ches",
            "citoyennet\u00e9 canadienne ou",
            "au m\u00eame titre que",
            "diversifi\u00e9es et inclusives",
            "doit inclure",
            "parentaux ou les cong\u00e9s de maladie qui ont pu avoir un",
            "Le dossier de"
        ],
        "extracted_products": [],
        "extracted_money": [],
        "processed_text": "syndicale Departement biologie_TC Campus STEM d'affichage cloture note Les candidature seront acceptees jusqu'a jour avant fin publication cet affichage dthemploi DOCUMENT REVISE Poste matiere d'ecologie evolutive d'Ottawa sollicite des candidatures pour poste menant permanence . construire programme recherche reconnu internationalement finance l'externe engage pleinement les stagiaires tous les . candidates doivent etre capables au niveau du premier du deuxieme cycle . Les personnes exceptionnelles au consideration . d'entree fonction prevues ne precederont pas . nous cherchon d'ecologie evolutive . Les personnes poste seront actifs dans large l'ecologie l'evolution travaillant tout niveau d'organisation biologique aux communautes biologique aux etendues biogeographique compris mais sans s'y limiter des specialisations telles l'ecologie comportementale . personne rejoindra chercheur chercheuses travaillant dans large eventail domaines biologie cellulaire moleculaire physiologie les neuroscience l'ecologie conservation biologie bio informatique . l'Institut du cerveau l'esprit l'Universite d'Ottawa des ministeres agences scientifique federaux du Musee canadien nature . pour biologie moleculaire genomique microscopie les soin aux animaux aquatique . Titre du poste agregee professeur adjoint comprennent maintien d'un solide programme recherche finance par des sources externe supervision premier l'enseignement cours premier deuxieme cycle contribuent au programme d'etudes bilingue anglais francais biomedicale . Poste universitaire regulier menant permanence \u2013 salaire base des professeurs adjoint des professeures adjointes est . Personne ressource Directeur Departement biologie K1N 6n5 . fax Lieu travail Departement biologie Universite d'Ottawa K1N 6n5 . doctorat biologie dans une . Une postdoctorale est attendue . Une feuille route demontrant . . Dossier candidature ample information sur les carrieres universitaire sont disponible ligne . Les candidatures doivent etre soumises d'Ottawa . candidature les element suivant Une lettre motivation d'une exprimant formellement l'interet pour poste comprenant une declaration concernant leur capacite . curriculum vitae complet les interruptions carriere telles les conges impact . ces element seront pris compte dans processus selection plan recherche detaille maximum Une declaration sur les interets l'enseignement maniere les principes . Les coordonnees trois personnes reference Trois publication evaluees Formulaire d'auto identification L'Universite d'Ottawa s'engage etudiante etudiants . limite depot des candidatures dossier candidature complet . l'examan des candidatures se poursuivra jusqu'a ce poste soit pourvu . Seules les personnes selectionnees pour . Autres information etudiante etudiant notre personnel notre corps professoral . consequence nous encourageon fortement les autochtone des membres des minorites visible personnes racisees des personnes situation handicap ainsi toutes les personnes qualifiees possedant les competence les connaissance requise pour dialoguer maniere productive equitable . confidentiel d'auto identification remplir au moment demande . toute les personnes qualifiees sont invitees poser leur candidature priorite sera toutefois accordee celle ayant residence permanente . Lors soumission votre candidature veuillez indiquer votre statut actuel . L'Universite d'Ottawa offre des accommodements aux aux candidats situation handicap tout au long du processus recrutement . invite du processus selection des mesures d'adaptations particulieres communiquant avec Cabinet du vice provost aux affaire professorale par . Les renseignements communiques seront traites avec respect confidentialite . L'Universite d'Ottawa est fiere ses ans tradition bilinguisme . Par l'entremise son Institut des langues officielles du bilinguisme l'Universite offre aux membres du personnel une . Au moment l'obtention permanence mesure fonctionner dans milieu bilingue . langues officielles pour obtenir leur permanence . poste matiere ecologie evolutive Departement biologie l'Universite d'Ottawa sollicite des candidatures pour poste menant permanence . construire programme recherche reconnu internationalement finance l'externe engage pleinement les stagiaires tous les . candidates doivent etre capables au niveau du premier du deuxieme cycle . Les personnes exceptionnelles au consideration . d'entree fonction prevues ne precederont pas . nous cherchon d'ecologie evolutive . Les personnes poste seront actifs dans large l'ecologie l'evolution travaillant tout niveau d'organisation biologique aux communautes biologique aux etendues biogeographique compris mais sans s'y limiter des specialisations telles l'ecologie comportementale . personne rejoindra chercheur chercheuses travaillant dans large eventail domaines biologie cellulaire moleculaire physiologie les neuroscience l'ecologie conservation biologie bio informatique . l'Institut du cerveau l'esprit l'Universite d'Ottawa des ministeres agences scientifique federaux du Musee canadien nature . pour biologie moleculaire genomique microscopie les soin aux animaux aquatique . Titre du poste agregee professeur adjoint comprennent maintien d'un solide programme recherche finance par des sources externe supervision premier l'enseignement cours premier deuxieme cycle contribuent au programme d'etudes bilingue anglais francais biomedicale . Poste universitaire regulier menant permanence \u2013 salaire base des professeurs adjoint des professeures adjointes est . Personne ressource Directeur Departement biologie K1N 6n5 . fax Lieu travail Departement biologie Universite d'Ottawa K1N 6n5 . doctorat biologie dans une . Une postdoctorale est attendue . Une feuille route demontrant . . Dossier candidature ample information sur les carrieres universitaire sont disponible ligne . Les candidatures doivent etre soumises d'Ottawa . candidature les element suivant Une lettre motivation d'une exprimant formellement l'interet pour poste comprenant une declaration concernant leur capacite . curriculum vitae complet les interruptions carriere telles les conges impact . ces element seront pris compte dans processus selection plan recherche detaille maximum Une declaration sur les interets l'enseignement maniere les principes . Les coordonnees trois personnes reference Trois publication evaluees L'Universite d'Ottawa s'engage etudiante etudiants . limite depot des candidatures dossier candidature complet doit etre depose 1er decembre . l'examan des candidatures se poursuivra jusqu'a ce poste soit pourvu . Seules les personnes selectionnees pour . Autres information etudiante etudiant notre personnel notre corps professoral . consequence nous encourageon fortement les autochtone des membres des minorites visible personnes racisees des personnes situation handicap ainsi toutes les personnes qualifiees possedant les competence les connaissance requise pour dialoguer maniere productive equitable . confidentiel d'auto identification remplir au moment demande . toute les personnes qualifiees sont invitees poser leur candidature priorite sera toutefois accordee celle ayant residence permanente . Lors soumission votre candidature veuillez indiquer votre statut actuel . L'Universite d'Ottawa offre des accommodements aux aux candidats situation handicap tout au long du processus recrutement . invite du processus selection des mesures d'adaptations particulieres communiquant avec Cabinet du vice provost aux affaire professorale par . Les renseignements communiques seront traites avec respect confidentialite . L'Universite d'Ottawa est fiere ses ans tradition bilinguisme . Par l'entremise son Institut des langues officielles du bilinguisme l'Universite offre aux membres du personnel une . Au moment l'obtention permanence mesure fonctionner dans milieu bilingue . langues officielles pour obtenir leur permanence . . les les membres minorites visible personnes racialisees les personnes situation handicap les femme toutes les personnes les connaissances necessaires pour travailler maniere constructive avec des communautes regnent poser leur candidature . questionnaire d'auto identification confidentiel lorsqu'elles soumettent leur candidature . toute les personnes qualifiees priorite sera toutefois accordee celle ont citoyennete canadienne residence permanente . . Tout au long du processus recrutement l'Universite d'Ottawa offrira des mesures d'adaptation aux personnes ayant handicap . inviton poursuivre les etapes du processus selection . toute les information recue seront traitees maniere confidentielle . vieille . Par l'entremise son Institut des langues officielles du bilinguisme l'Universite offre aux membres son personnel ainsi qu'a leur conjointe conjoint . vertu du Reglement \u2013 Vaccination contre COVID personnel les personnes visite . Ce reglement ete suspendu vigueur tout moment ."
    },
    "companyDescription": "",
    "description": "Famille d\u2019emplois :\n  Cadres universitaires et corps professoral\n \n   Affiliation syndicale:\n  APUO\n \n \n   Facult\u00e9 ou d\u00e9partement :\n  D\u00e9partement de biologie_TC\n \n \n   Campus :\n  STEM\n \n \n   Date d\u2019affichage :\n  novembre 17, 2023\n \n \n   Date de cl\u00f4ture :\n \n \n   Note: Les candidatures seront accept\u00e9es jusqu'\u00e0 23h59 le jour avant la date de fin de publication de cet affichage d'emploi\n \n \n \n   DOCUMENT R\u00c9VIS\u00c9\n \n \n \n   Poste en mati\u00e8re d'\u00e9cologie \u00e9volutive\n \n \n \n   Le D\u00e9partement de biologie de l'Universit\u00e9 d'Ottawa sollicite des candidatures pour un poste menant \u00e0 la permanence. La personne candidate retenue devra d\u00e9montrer son potentiel \u00e0 construire un programme de recherche reconnu internationalement et financ\u00e9 \u00e0 l'externe qui engage pleinement les stagiaires \u00e0 tous les niveaux, en \u00e9tablissant des collaborations au sein et au-del\u00e0 de notre d\u00e9partement coll\u00e9gial et \u00e0 forte intensit\u00e9 de recherche. Les personnes candidates doivent \u00eatre capables d'enseigner en fran\u00e7ais et en anglais au moment de l'embauche, au niveau du premier et du deuxi\u00e8me cycle. Les personnes candidates exceptionnelles au niveau de professeure associ\u00e9e ou de professeur associ\u00e9 peuvent \u00e9galement \u00eatre pris en consid\u00e9ration. Les dates d'entr\u00e9e en fonction pr\u00e9vues ne pr\u00e9c\u00e9deront pas le 1er juillet 2024.\n \n \n \n   Nous cherchons \u00e0 d\u00e9velopper les forces du d\u00e9partement en mati\u00e8re d'\u00e9cologie \u00e9volutive. Les personnes candidates retenues pour ce poste seront actifs dans la recherche th\u00e9orique et/ou empirique \u00e0 l'interface large de l'\u00e9cologie et de l'\u00e9volution, travaillant \u00e0 tout niveau d'organisation biologique, des mol\u00e9cules aux communaut\u00e9s biologiques ou aux \u00e9tendues biog\u00e9ographiques, y compris (mais sans s'y limiter) des sp\u00e9cialisations telles que l'\u00e9cologie comportementale, l'\u00e9cologie mol\u00e9culaire et la g\u00e9n\u00e9tique \u00e9cologique.\n \n \n \n   La personne candidate retenue rejoindra un d\u00e9partement innovant et collaboratif de 40 chercheurs et chercheuses travaillant dans un large \u00e9ventail de domaines, notamment la biologie cellulaire et mol\u00e9culaire, la physiologie, l'\u00e9cotoxicologie, les neurosciences, la biologie du d\u00e9veloppement, l'\u00e9cologie et la conservation, la biologie \u00e9volutive et la bio-informatique. Le d\u00e9partement collabore \u00e9troitement avec des chercheuses et des chercheurs de l'Institut de recherche de l'H\u00f4pital d'Ottawa, de l'Institut du cerveau et de l'esprit de l'Universit\u00e9 d'Ottawa, de l'Institut de cardiologie d'Ottawa, de l'Universit\u00e9 Carleton, des minist\u00e8res et agences scientifiques f\u00e9d\u00e9raux et du Mus\u00e9e canadien de la nature. La Facult\u00e9 des sciences offre \u00e0 tous ses membres l'acc\u00e8s \u00e0 des installations de base pour la biologie mol\u00e9culaire, la g\u00e9nomique, la chimie, la microscopie et les soins aux animaux aquatiques.\n \n \n \n   Titre du poste : Professeure adjointe, agr\u00e9g\u00e9e ou professeur adjoint, agr\u00e9g\u00e9\n \n \n \n   T\u00e2ches : Les responsabilit\u00e9s comprennent : 1) le maintien d'un solide programme de recherche financ\u00e9 par des sources externes ; 2) la supervision des projets de th\u00e8se des \u00e9tudiants de premier et de deuxi\u00e8me cycle du d\u00e9partement ; 3) l'enseignement de cours de premier et de deuxi\u00e8me cycle qui contribuent au programme d'\u00e9tudes bilingue (anglais-fran\u00e7ais) en biologie ou en sciences biom\u00e9dicales ; et 4) un r\u00f4le actif au sein du d\u00e9partement en contribuant aux activit\u00e9s administratives et acad\u00e9miques du d\u00e9partement et de la Facult\u00e9 des sciences.\n \n \n \n   Rang et salaire : Poste universitaire r\u00e9gulier menant \u00e0 la permanence \u00e0 la Facult\u00e9 des sciences, avec un salaire selon l\u2019\u00e9chelle salariale en vigueur \u00e0 compter de mai 2023 \u2013 le salaire de base des professeurs adjoints et des professeures adjointes est de 89 622$.\n \n \n \n   Personne ressource : Directeur, D\u00e9partement de biologie, 30 Marie Curie Private, Ottawa, ON K1N 6N5, \n  \n   biochair.assistant@uottawa.ca\n  . T\u00e9l\u00e9phone : 613-562-5729 613-562-5729, fax : 613-562-5486\n \n \n \n   Lieu de travail : D\u00e9partement de biologie, Universit\u00e9 d\u2019Ottawa, 30 Marie Curie Private, Ottawa, ON K1N 6N5.\n \n \n \n   Exigences pr\u00e9alables : Doctorat en biologie ou dans une discipline connexe. Une exp\u00e9rience postdoctorale est attendue. Une feuille de route d\u00e9montrant l\u2019excellence de la recherche doit \u00eatre clairement pr\u00e9sent\u00e9e, de m\u00eame qu\u2019un engagement et des strat\u00e9gies en mati\u00e8re d\u2019enseignement et de formation des dipl\u00f4m\u00e9s. La personne candidate doit \u00eatre en mesure d'enseigner en fran\u00e7ais et en anglais, les deux langues officielles de l'Universit\u00e9, au moment de l'embauche.\n \n \n \n   Dossier de candidature : De plus amples informations sur les \n  \n   carri\u00e8res universitaires sont disponibles en ligne\n  . Les candidatures doivent \u00eatre soumises par voie \u00e9lectronique via le portail \n  \n   des carri\u00e8res de l'Universit\u00e9 d'Ottawa\n  . Le dossier de candidature doit inclure les \u00e9l\u00e9ments suivants :\n \n \n \n   Une lettre de motivation d'une page exprimant formellement l'int\u00e9r\u00eat pour le poste et comprenant une d\u00e9claration concernant leur capacit\u00e9 \u00e0 enseigner en fran\u00e7ais et en anglais.\n   Un curriculum vitae complet (veuillez indiquer les interruptions de carri\u00e8re telles que les cong\u00e9s parentaux ou les cong\u00e9s de maladie qui ont pu avoir un impact sur votre dossier de recherche. Ces \u00e9l\u00e9ments seront pris en compte dans le processus de s\u00e9lection)\n   Un plan de recherche d\u00e9taill\u00e9 (3 pages maximum)\n   Une d\u00e9claration sur les int\u00e9r\u00eats de l'enseignement et la mani\u00e8re dont les principes d'\u00e9quit\u00e9, de diversit\u00e9 et d'inclusion seront int\u00e9gr\u00e9s dans la formation des membres du groupe de recherche (1 page).\n   Les coordonn\u00e9es de trois personnes de r\u00e9f\u00e9rence\n   Trois publications \u00e9valu\u00e9es par des pairs\n   Formulaire d'auto-identification : L'Universit\u00e9 d'Ottawa s'engage \u00e0 assurer l'\u00e9quit\u00e9, la diversit\u00e9 et l'inclusion dans les milieux de recherche et de leadership de ses \u00e9tudiantes et \u00e9tudiants, de son personnel et de son corps professoral.\n \n \n \n   Date limite de d\u00e9p\u00f4t des candidatures : Le dossier de candidature complet doit \u00eatre d\u00e9pos\u00e9 le 10 janvier 2024. L'examen des candidatures se poursuivra jusqu'\u00e0 ce que le poste soit pourvu. Seules les personnes s\u00e9lectionn\u00e9es pour un entretien seront contact\u00e9es.\n \n \n \n   Autres informations : \n  L'Universit\u00e9 d'Ottawa est engag\u00e9e \u00e0 assurer l'\u00e9quit\u00e9, la diversit\u00e9 et l'inclusion dans les environnements de recherche et de leadership de nos \u00e9tudiantes et nos \u00e9tudiants, de notre personnel et de notre corps professoral. En cons\u00e9quence, nous encourageons fortement les candidatures des Peuples autochtones au Canada, des membres des minorit\u00e9s visibles (personnes racis\u00e9es), des personnes en situation de handicap, des femmes, ainsi que de toutes les personnes qualifi\u00e9es poss\u00e9dant les comp\u00e9tences et les connaissances requises pour dialoguer de mani\u00e8re productive avec des communaut\u00e9s \u00e9quitables, diversifi\u00e9es et inclusives. Les personnes qui souhaitent \u00eatre consid\u00e9r\u00e9es comme membres d'un ou de plusieurs groupes d\u00e9sign\u00e9s sont pri\u00e9es de remplir le questionnaire confidentiel \n  d\u2019auto-identification,\n   \u00e0 remplir au moment de la demande.\n \n \n   Toutes les personnes qualifi\u00e9es sont invit\u00e9es \u00e0 poser leur candidature; la priorit\u00e9 sera toutefois accord\u00e9e \u00e0 celles ayant la citoyennet\u00e9 canadienne ou r\u00e9sidence permanente. Lors de la soumission de votre candidature, veuillez indiquer votre statut actuel.\n \n \n \n   L\u2019Universit\u00e9 d\u2019Ottawa offre des accommodements aux candidates et aux candidats en situation de handicap tout au long du processus de recrutement. Si vous \u00eates invit\u00e9 \u00e0 poursuivre les \u00e9tapes du processus de s\u00e9lection, veuillez nous aviser de tout besoin n\u00e9cessitant des mesures d\u2019adaptations particuli\u00e8res en communiquant avec le Cabinet du vice-provost aux affaires professorales par courriel au \n  \n   vra.affairesprofessorales@uottawa.ca\n  \n  . Les renseignements communiqu\u00e9s seront trait\u00e9s avec respect et confidentialit\u00e9.\n \n \n \n   L'Universit\u00e9 d'Ottawa est fi\u00e8re, \u00e0 juste titre, de ses 160 ans de tradition de bilinguisme. Par l'entremise de son Institut des langues officielles et du bilinguisme, l'Universit\u00e9 offre aux membres du personnel et \u00e0 leurs conjoints une formation dans leur deuxi\u00e8me langue officielle. Au moment de l\u2019obtention de la permanence, les professeures et professeurs doivent \u00eatre en mesure de fonctionner dans un milieu bilingue. Dans certains cas, elles ou ils doivent avoir la capacit\u00e9 d'enseigner dans les deux langues officielles pour obtenir leur permanence.\n \n \n \n   Poste en mati\u00e8re \u00e9cologie \u00e9volutive\n \n \n \n   Le D\u00e9partement de biologie de l'Universit\u00e9 d'Ottawa sollicite des candidatures pour un poste menant \u00e0 la permanence. La personne candidate retenue devra d\u00e9montrer son potentiel \u00e0 construire un programme de recherche reconnu internationalement et financ\u00e9 \u00e0 l'externe qui engage pleinement les stagiaires \u00e0 tous les niveaux, en \u00e9tablissant des collaborations au sein et au-del\u00e0 de notre d\u00e9partement coll\u00e9gial et \u00e0 forte intensit\u00e9 de recherche. Les personnes candidates doivent \u00eatre capables d'enseigner en fran\u00e7ais et en anglais au moment de l'embauche, au niveau du premier et du deuxi\u00e8me cycle. Les personnes candidates exceptionnelles au niveau de professeure associ\u00e9e ou de professeur associ\u00e9 peuvent \u00e9galement \u00eatre pris en consid\u00e9ration. Les dates d'entr\u00e9e en fonction pr\u00e9vues ne pr\u00e9c\u00e9deront pas le 1er juillet 2024.\n \n \n \n   Nous cherchons \u00e0 d\u00e9velopper les forces du d\u00e9partement en mati\u00e8re d'\u00e9cologie \u00e9volutive. Les personnes candidates retenues pour ce poste seront actifs dans la recherche th\u00e9orique et/ou empirique \u00e0 l'interface large de l'\u00e9cologie et de l'\u00e9volution, travaillant \u00e0 tout niveau d'organisation biologique, des mol\u00e9cules aux communaut\u00e9s biologiques ou aux \u00e9tendues biog\u00e9ographiques, y compris (mais sans s'y limiter) des sp\u00e9cialisations telles que l'\u00e9cologie comportementale, l'\u00e9cologie mol\u00e9culaire et la g\u00e9n\u00e9tique \u00e9cologique.\n \n \n \n   La personne candidate retenue rejoindra un d\u00e9partement innovant et collaboratif de 40 chercheurs et chercheuses travaillant dans un large \u00e9ventail de domaines, notamment la biologie cellulaire et mol\u00e9culaire, la physiologie, l'\u00e9cotoxicologie, les neurosciences, la biologie du d\u00e9veloppement, l'\u00e9cologie et la conservation, la biologie \u00e9volutive et la bio-informatique. Le d\u00e9partement collabore \u00e9troitement avec des chercheuses et des chercheurs de l'Institut de recherche de l'H\u00f4pital d'Ottawa, de l'Institut du cerveau et de l'esprit de l'Universit\u00e9 d'Ottawa, de l'Institut de cardiologie d'Ottawa, de l'Universit\u00e9 Carleton, des minist\u00e8res et agences scientifiques f\u00e9d\u00e9raux et du Mus\u00e9e canadien de la nature. La Facult\u00e9 des sciences offre \u00e0 tous ses membres l'acc\u00e8s \u00e0 des installations de base pour la biologie mol\u00e9culaire, la g\u00e9nomique, la chimie, la microscopie et les soins aux animaux aquatiques.\n \n \n \n   Titre du poste : Professeure adjointe, agr\u00e9g\u00e9e ou professeur adjoint, agr\u00e9g\u00e9\n \n \n \n   T\u00e2ches : Les responsabilit\u00e9s comprennent : 1) le maintien d'un solide programme de recherche financ\u00e9 par des sources externes ; 2) la supervision des projets de th\u00e8se des \u00e9tudiants de premier et de deuxi\u00e8me cycle du d\u00e9partement ; 3) l'enseignement de cours de premier et de deuxi\u00e8me cycle qui contribuent au programme d'\u00e9tudes bilingue (anglais-fran\u00e7ais) en biologie ou en sciences biom\u00e9dicales ; et 4) un r\u00f4le actif au sein du d\u00e9partement en contribuant aux activit\u00e9s administratives et acad\u00e9miques du d\u00e9partement et de la Facult\u00e9 des sciences.\n \n \n \n   Rang et salaire : Poste universitaire r\u00e9gulier menant \u00e0 la permanence \u00e0 la Facult\u00e9 des sciences, avec un salaire selon l\u2019\u00e9chelle salariale en vigueur \u00e0 compter de mai 2023 \u2013 le salaire de base des professeurs adjoints et des professeures adjointes est de 89 622$.\n \n \n \n   Personne ressource : Directeur, D\u00e9partement de biologie, 30 Marie Curie Private, Ottawa, ON K1N 6N5, \n  \n   biochair.assistant@uottawa.ca\n  . T\u00e9l\u00e9phone : 613-562-5729 613-562-5729, fax : 613-562-5486\n \n \n \n   Lieu de travail : D\u00e9partement de biologie, Universit\u00e9 d\u2019Ottawa, 30 Marie Curie Private, Ottawa, ON K1N 6N5.\n \n \n \n   Exigences pr\u00e9alables : Doctorat en biologie ou dans une discipline connexe. Une exp\u00e9rience postdoctorale est attendue. Une feuille de route d\u00e9montrant l\u2019excellence de la recherche doit \u00eatre clairement pr\u00e9sent\u00e9e, de m\u00eame qu\u2019un engagement et des strat\u00e9gies en mati\u00e8re d\u2019enseignement et de formation des dipl\u00f4m\u00e9s. La personne candidate doit \u00eatre en mesure d'enseigner en fran\u00e7ais et en anglais, les deux langues officielles de l'Universit\u00e9, au moment de l'embauche.\n \n \n \n   Dossier de candidature : De plus amples informations sur les \n  \n   carri\u00e8res universitaires sont disponibles en ligne\n  . Les candidatures doivent \u00eatre soumises par voie \u00e9lectronique via le portail des carri\u00e8res de l'Universit\u00e9 d'Ottawa. Le dossier de candidature doit inclure les \u00e9l\u00e9ments suivants :\n \n \n \n   Une lettre de motivation d'une page exprimant formellement l'int\u00e9r\u00eat pour le poste et comprenant une d\u00e9claration concernant leur capacit\u00e9 \u00e0 enseigner en fran\u00e7ais et en anglais.\n   Un curriculum vitae complet (veuillez indiquer les interruptions de carri\u00e8re telles que les cong\u00e9s parentaux ou les cong\u00e9s de maladie qui ont pu avoir un impact sur votre dossier de recherche. Ces \u00e9l\u00e9ments seront pris en compte dans le processus de s\u00e9lection)\n   Un plan de recherche d\u00e9taill\u00e9 (3 pages maximum)\n   Une d\u00e9claration sur les int\u00e9r\u00eats de l'enseignement et la mani\u00e8re dont les principes d'\u00e9quit\u00e9, de diversit\u00e9 et d'inclusion seront int\u00e9gr\u00e9s dans la formation des membres du groupe de recherche (1 page).\n   Les coordonn\u00e9es de trois personnes de r\u00e9f\u00e9rence\n   Trois publications \u00e9valu\u00e9es par des pairs\n   Formulaire : L'Universit\u00e9 d'Ottawa s'engage \u00e0 assurer l'\u00e9quit\u00e9, la diversit\u00e9 et l'inclusion dans les milieux de recherche et de leadership de ses \u00e9tudiantes et \u00e9tudiants, de son personnel et de son corps professoral.\n \n \n \n   Date limite de d\u00e9p\u00f4t des candidatures : Le dossier de candidature complet doit \u00eatre d\u00e9pos\u00e9 le 1er d\u00e9cembre 2023. L'examen des candidatures se poursuivra jusqu'\u00e0 ce que le poste soit pourvu. Seules les personnes s\u00e9lectionn\u00e9es pour un entretien seront contact\u00e9s.\n \n \n \n   Autres informations : \n  L'Universit\u00e9 d'Ottawa est engag\u00e9e \u00e0 assurer l'\u00e9quit\u00e9, la diversit\u00e9 et l'inclusion dans les environnements de recherche et de leadership de nos \u00e9tudiantes et nos \u00e9tudiants, de notre personnel et de notre corps professoral. En cons\u00e9quence, nous encourageons fortement les candidatures des Peuples autochtones au Canada, des membres des minorit\u00e9s visibles (personnes racis\u00e9es), des personnes en situation de handicap, des femmes, ainsi que de toutes les personnes qualifi\u00e9es poss\u00e9dant les comp\u00e9tences et les connaissances requises pour dialoguer de mani\u00e8re productive avec des communaut\u00e9s \u00e9quitables, diversifi\u00e9es et inclusives. Les personnes qui souhaitent \u00eatre consid\u00e9r\u00e9es comme membres d'un ou de plusieurs groupes d\u00e9sign\u00e9s sont pri\u00e9es de remplir le questionnaire confidentiel \n  d\u2019auto-identification,\n   \u00e0 remplir au moment de la demande.\n \n \n   Toutes les personnes qualifi\u00e9es sont invit\u00e9es \u00e0 poser leur candidature; la priorit\u00e9 sera toutefois accord\u00e9e \u00e0 celles ayant la citoyennet\u00e9 canadienne ou r\u00e9sidence permanente. Lors de la soumission de votre candidature, veuillez indiquer votre statut actuel.\n \n \n \n   L\u2019Universit\u00e9 d\u2019Ottawa offre des accommodements aux candidates et aux candidats en situation de handicap tout au long du processus de recrutement. Si vous \u00eates invit\u00e9 \u00e0 poursuivre les \u00e9tapes du processus de s\u00e9lection, veuillez nous aviser de tout besoin n\u00e9cessitant des mesures d\u2019adaptations particuli\u00e8res en communiquant avec le Cabinet du vice-provost aux affaires professorales par courriel au \n  \n   vra.affairesprofessorales@uottawa.ca\n  \n  . Les renseignements communiqu\u00e9s seront trait\u00e9s avec respect et confidentialit\u00e9.\n \n \n \n   L'Universit\u00e9 d'Ottawa est fi\u00e8re, \u00e0 juste titre, de ses 160 ans de tradition de bilinguisme. Par l'entremise de son Institut des langues officielles et du bilinguisme, l'Universit\u00e9 offre aux membres du personnel et \u00e0 leurs conjoints une formation dans leur deuxi\u00e8me langue officielle. Au moment de l\u2019obtention de la permanence, les professeures et professeurs doivent \u00eatre en mesure de fonctionner dans un milieu bilingue. Dans certains cas, elles ou ils doivent avoir la capacit\u00e9 d'enseigner dans les deux langues officielles pour obtenir leur permanence.\n \n \n \n   L\u2019Universit\u00e9 d\u2019Ottawa s\u2019est engag\u00e9e \u00e0 offrir \u00e0 sa communaut\u00e9 un milieu de leadership et de savoir qui pr\u00f4ne l\u2019\u00e9quit\u00e9, la diversit\u00e9 et l\u2019inclusion. Nous encourageons donc vivement les Autochtones du Canada, les membres de minorit\u00e9s visibles (personnes racialis\u00e9es), les personnes en situation de handicap et les femmes, au m\u00eame titre que toutes les personnes qualifi\u00e9es poss\u00e9dant les comp\u00e9tences et les connaissances n\u00e9cessaires pour travailler de mani\u00e8re constructive avec des communaut\u00e9s o\u00f9 r\u00e8gnent l\u2019\u00e9quit\u00e9, la diversit\u00e9 et l\u2019inclusion, \u00e0 poser leur candidature. Les personnes qui appartiennent \u00e0 au moins un de ces groupes sont invit\u00e9es \u00e0 remplir le questionnaire d\u2019auto-identification confidentiel lorsqu\u2019elles soumettent leur candidature.\n \n \n \n   Toutes les personnes qualifi\u00e9es sont invit\u00e9es \u00e0 postuler; la priorit\u00e9 sera toutefois accord\u00e9e \u00e0 celles qui ont la citoyennet\u00e9 canadienne ou la r\u00e9sidence permanente. Au moment de soumettre votre candidature, veuillez pr\u00e9ciser si vous avez l\u2019autorisation de travailler au Canada.\n \n \n \n   Tout au long du processus de recrutement, l\u2019Universit\u00e9 d\u2019Ottawa offrira des mesures d\u2019adaptation aux personnes candidates ayant un handicap. Si nous vous invitons \u00e0 poursuivre les \u00e9tapes du processus de s\u00e9lection, veuillez nous aviser de toute mesure d\u2019adaptation dont vous avez besoin en \u00e9crivant au Cabinet de la vice-provost aux affaires professorales \u00e0 \n  \n   vra.affairesprofessorales@uOttawa.ca\n  . Toutes les informations re\u00e7ues seront trait\u00e9es de mani\u00e8re confidentielle.\n \n \n \n   L\u2019Universit\u00e9 d\u2019Ottawa est fi\u00e8re de sa tradition de bilinguisme, vieille de plus de 160 ans. Par l\u2019entremise de son Institut des langues officielles et du bilinguisme, l\u2019Universit\u00e9 offre aux membres de son personnel, ainsi qu\u2019\u00e0 leur conjointe ou conjoint, les moyens de devenir bilingue.\n \n \n \n   Avant le 1er mai 2022, en vertu du R\u00e8glement 129 \u2013 Vaccination contre la COVID-19, les membres de la population \u00e9tudiante, du corps professoral et du personnel de soutien et les personnes en visite \u00e0 l\u2019Universit\u00e9 (y compris les entrepreneurs) \u00e9taient tenus d\u2019\u00eatre vaccin\u00e9s. Ce r\u00e8glement a \u00e9t\u00e9 suspendu le 1er mai 2022, mais pourrait \u00eatre remis en vigueur \u00e0 tout moment en fonction des directives de la sant\u00e9 publique et des recommandations des sp\u00e9cialistes."
}