{
    "id": "6c4a1e093c9a9877",
    "company": "Western Qu\u00e9bec School Board",
    "positionName": "Conseill\u00e8re ou Conseiller p\u00e9dagogique- Remplacement \u00e0 temps plein | Education Consultant- Replacement Full Time",
    "jobType": [],
    "location": "Gatineau, QC",
    "salary": null,
    "postingDateParsed": "2024-01-19T05:10:23.134Z",
    "url": "https://www.indeed.ca/rc/clk?jk=6c4a1e093c9a9877&from=jasx&tk=1hkikdadhih1j800&bb=EhOb8wC-jg2wt5IuI5mDXc-mjubvF3eOGM7jE-SOd4wwmqCsGcYTgMPHUhsdKdLKKYCw06th0k_hzHTUvryOAzPGPg1jlu0rGTBt94ZDf7in0poVHPYsSw%3D%3D&xkcb=SoAM67M3FSg6inQ9SB0FbzkdCdPP&vjs=3",
    "externalApplyLink": "https://westernquebec.simplication.com/Applicant/jobposting/jobdetails.aspx?JOB_POSTING_ID=ab69bea8-88f1-4b16-999b-e1a8f210f43c&PAGE=1&locale=en&maf=0",
    "job_info_group": {
        "extracted_phone_numbers": [],
        "extracted_links": [
            "HTTP/HTTPS Links",
            "General Links",
            "WWW Links",
            "TLDs"
        ],
        "extracted_emails": [],
        "extracted_location_data": [
            "elle ou il conseille sur l'am\u00e9nagement des locaux",
            "\u00e0 l'emploi",
            "elle ou il"
        ],
        "extracted_dates": [
            "l'\u00e9laboration",
            "five years",
            "Special leave days",
            "January 25, 2024",
            "35 days"
        ],
        "extracted_languages": [
            "English"
        ],
        "extracted_laws": [],
        "extracted_norps": [
            "French",
            "apprenons et travaillons sont le territoire traditionnel non c\u00e9d\u00e9 des peuples algonquins Anishinaabe"
        ],
        "extracted_orgs": [
            "Elle ou il analyse et conseille sur la s\u00e9lection de mat\u00e9riel didactique",
            "d'innovation et de d\u00e9veloppement p\u00e9dagogique",
            "avec les enseignantes",
            "CPNCA",
            "Federation of Educational Professionals of Qu\u00e9bec",
            "au d\u00e9veloppement et \u00e0 l'\u00e9valuation des programmes d'\u00e9tudes",
            "the Outaouais",
            "Les parents et les communaut\u00e9s sont consid\u00e9r\u00e9s comme des partenaires qui collaborent \u00e0 l'enrichissement de nos programmes",
            "elle ou il \u00e9labore et anime des ateliers de formation et d'information sur les \u00e9l\u00e9ments du programme d'int\u00e9gration des technologies",
            "afin de d\u00e9velopper conjointement des programmes de formation",
            "(F\u00e9d\u00e9ration des professionnels de l'\u00e9ducation du Qu\u00e9bec",
            "con\u00e7oit et anime des ateliers et des sessions de formation sur les \u00e9l\u00e9ments du programme",
            "WQSB Special Education Policy",
            "d'embaucher des personnes qui refl\u00e8tent les communaut\u00e9s que",
            "Conseill\u00e8re ou Conseiller p\u00e9dagogique Remplacement",
            "Un",
            "2025 Complementary Services Department",
            "the Minist\u00e8re de l'\u00c9ducation et de l'Enseignement sup\u00e9rieur",
            "Exp\u00e9rience dans le domaine de l'\u00e9ducation sp\u00e9cialis\u00e9e et/ou des ressources au",
            "the Western Quebec School Board",
            "au choix des objectifs",
            "La Commission scolaire Western Qu\u00e9bec s'engage \u00e0",
            "de la scolarit\u00e9 et de l'exp\u00e9rience",
            "the Qu\u00e9bec Education Programme",
            "de Pontiac et de l'Abitibi-T\u00e9miscamingue",
            "sur un territoire immense et diversifi\u00e9 qui couvre les r\u00e9gions de l'Outaouais",
            "tout le territoire de la CSWQ.",
            "un entretien seront contact\u00e9s",
            "fonction des qualifications",
            "visibilit\u00e9 de la commission scolaire aupr\u00e8s des partenaires socio-\u00e9conomiques et \u00e9tablit un plan de promotion",
            "Premi\u00e8res Nations",
            "Nous, la commission scolaire de Western Quebec",
            "communaut\u00e9 \u00e9ducative ayant",
            "\u00c0",
            "Western Qu\u00e9bec Western Qu\u00e9bec est une",
            "enseignantes",
            "elle ou il les accompagne",
            "les enseignantes",
            "Connaissance des diagnostics courants",
            "un v\u00e9hicule",
            "2025 D\u00e9partement des services",
            "Working Conditions",
            "connaissance de la politique de la CSWQ en mati\u00e8re d'\u00e9ducation sp\u00e9cialis\u00e9e",
            "appuyer l'action quotidienne",
            "sur une base individuelle et collective pour",
            "The Western Quebec School Board",
            "cultivant un solide corps de soutien et l'excellence professionnelle",
            "sur les moyens d'int\u00e9gration des technologies \u00e0 l'enseignement",
            "besoins de l'entreprise et de",
            "tant qu'organisation",
            "the Western Qu\u00e9bec School Board Western Qu\u00e9bec",
            "Western Qu\u00e9bec",
            "et la culture du peuple Anishinaabe",
            "Connaissance du Programme de formation de l'\u00e9cole qu\u00e9b\u00e9coise",
            "caract\u00e9ristiques La conseill\u00e8re ou le conseiller p\u00e9dagogique collabore \u00e0 la r\u00e9alisation du projet",
            "En outre",
            "R\u00e9gime de retraite",
            "de la Commission"
        ],
        "extracted_persons": [
            "elle ou il collabore \u00e0 la r\u00e9alisation de projets qui vont dans",
            "Familiarit\u00e9 avec les technologies d'assistance ; Excellente compr\u00e9hension des pratiques d'int\u00e9gration et des cadres/approches qui soutiennent succ\u00e8s",
            "elle ou il pr\u00e9pare des protocoles d'entente et des offres de services",
            "Elle ou il conseille et soutient les",
            "les \u00e9l\u00e8ves ayant des besoins",
            "tant au niveau des \u00e9tablissements que de la commission scolaire",
            "elle ou il",
            "tant qu'\u00e9ducateurs",
            "Elle ou il conseille le personnel d'encadrement",
            "Bilinguisme fonctionnel",
            "\u00e9ducatifs",
            "des personnes vivant avec un",
            "objectif commun de r\u00e9aliser le potentiel de tous nos \u00e9l\u00e8ves",
            "\u00e0 entretenir une",
            "Elle ou il conseille les intervenantes et intervenants scolaires",
            "d'emploi proactives afin d'aborder les barri\u00e8res",
            "oeuvre et l'\u00e9valuation de leur plan de r\u00e9ussite tout en respectant les encadrements \u00e9ducatifs et administratifs",
            "Volont\u00e9 et capacit\u00e9",
            "Nous encourageons donc les candidatures des Autochtones",
            "culturellement s\u00fbr comprennent la",
            "Salaire annuel de",
            "Elle ou il instrumente les enseignantes",
            "avec l'\u00e9quipe multidisciplinaire",
            "Seuls les candidats",
            "Les enseignantes",
            "un champ de sp\u00e9cialisation appropri\u00e9",
            "doivent \u00eatre",
            "les \u00e9l\u00e8ves qui pr\u00e9sentent ou qui sont",
            "Elle ou il",
            "l'excellence acad\u00e9mique",
            "Education https://westernquebec.ca/resources/careers/ Deadline"
        ],
        "extracted_products": [],
        "extracted_money": [
            {
                "amount": "456 $ \u00e0",
                "noun_phrases": []
            },
            {
                "amount": "87 626 $",
                "noun_phrases": [
                    "87 626 $"
                ]
            },
            {
                "amount": "49,456",
                "noun_phrases": []
            },
            {
                "amount": "87,626",
                "noun_phrases": []
            }
        ],
        "processed_text": "temps plein heure par semaine Jusqu'au janvier complementaire propos scolaire commission scolaire anglophone devouee au developpement personnel preparation professionnelle ses eleves . enseignants personnel se vouent tous enseignement qualite encourage developpement social emotionnel moral . Western respecte promeut les droits les responsabilites chaque individu tout privilegiant apprentissage axe sur l'eleve dans environnement securitaire sain . l'atteinte d'objectifs . Les ecole centres d'enseignement aux adultes Western offrent l'enseignement langue anglaise aux eleves admissible . Les difference culturelle sont mise valeur celebrees dans notre population etudiante par des programme d'immersion francaise des evenement pour par les par d'autres activites initiatives etudiante . nature du travail Lthemploi conseillere conseiller pedagogique comporte specifiquement des fonction conseil soutien aupres des intervenantes intervenants des etablissements scolaire des services educatifs relativement mise oeuvre gestion classe didactique . Quelques attribution educatif des projet particulier des etablissement elle il participe mise . Elle il collabore l'implantation des programme d'etudes formation conseille les enseignantes enseignants direction relativement l'interpretation ces programme elle il collabore l'elaboration situation d'apprentissage soutient l'experimentation classe . enseignants elle il concoit selectionne anime les activites formation d'instrumentation pour des besoins d'adaptation . enseignants sur l'evaluation des apprentissages dans conception l'elaboration l'adaptation d'outils d'evaluation . Elle il peut etre appele participer l'elaboration revision du plan d'intervention l'eleve handicape presente des difficultes d'adaptation d'apprentissage participe des moyens d'intervention . participe enseignants l'elaboration mise oeuvre strategies projets visant aider susceptible presenter des difficultes d'adaptation d'apprentissage . enseignant professionnel sur des question relative aux programmes perfectionnement du personnel planifie ces programme evalue les resultat . materiel complementaire d'equipement logiciels progiciels pertinent . ce sens . Elle il collabore avec les autres intervenantes intervenants du milieu scolaire les organismes partenaires ministere l'Education l'Enseignement superieur . conseillere conseiller pedagogique formation generale des adultes formation professionnelle contribue consequence . Elle il rencontre les representante representants diverses entreprise repondant aux son personnel . Elle il participe l'organisation des programmes d'alternance travail etude des stage entreprise des visites industrie soutient enseignants concernes elle il informe conseille les employeur . qualification requise Diplome universitaire terminal premier cycle dans notamment education . autre exigence sein l'enseignement primaire secondaire francais anglais minimum cinq ans d'experience enseignement des parcours des programme correspondant documentation du MEQ concernant speciaux handicaps des handicaps des trouble d'apprentissage sociaux emotionnels comportementaux . Excellentes competence orales ecrite presentation Volonte travailler avec des service agence externes pour favoriser reussite des etudiant personnel est essentiel voyager dans condition travail poste est regi par convention collective entre CPNCA FPPE . . vacance annuelle jour . Jours conges sociaux . . assurance collective . programme d'aide aux employes . Equilibre entre vie professionnelle vie privee horaires flexibles . comment postuler Les candidatures soumises par l'intermediaire Apply Education limite pour postuler janvier . retenus pour . reconnaissons les terres sur lesquelles nous vivon . nous les remercion partager ces terre nous nous engageon tant qu'individus relation continue reconnait respecte les terre les tradition . batir une pour pedagogique administrative . ainsi celles des autres groupes racialises handicap des personnes confession religieuse des minorites genre . tant qu'organisation nous nous efforcons nous servon pratiquent l'amour l'apprentissage tout au long vie travail d'equipe l'ethique professionnelle elevee . effort pour obtenir une main d'\u0153uvre diversifiee contribue environnement travail mise place pratiques systemiques d'eliminer les obstacle lthembauche retention personnes qualifiees . Education consultant replacement hour week english school board dedicate develop lifelong learner contribute society prepared future . teacher staff commit academic excellence provision quality education encourage social emotional moral development . respect promote responsibility individual maintain student centre safe healthy learning environment . parent community collaborative partner enrich program achieve goal . Western Quebec's school centre provide english language education eligible student immense diverse territory cover Pontiac Abitibi Temiscamingue region . cultural difference celebrate student population French immersion program Nations event student initiative activity . nature position education consultant encompass responsibility provide advice support staff educational institution service implementation development evaluation program study class management instructional material . characteristic duty education consultant participate carry educational project special project educational institution participate development implementation evaluation success plan comply academic administrative requirement educational institution school board . contribute implementation program study training provide advice teacher administration concern interpretation program design lead training workshop session program component collaborate develop learning situation support experimentation class . provide advice support teacher individually group format matter pertain daily teaching activity develop select deliver training instrumentation activity design respond pedagogical adaptation innovation development . provide teacher learn evaluation tool guide design preparation adaptation evaluation tool . multidisciplinary team draw review individualized education plan handicapped student student social maladjustment learn difficulty participate define intervention objective . teacher prepare implement strategy project aim help student social maladjustment learn difficulty . advise management teaching professional staff matter pertain professional development program plan program evaluate result . analyze recommend purchase learn material supplementary material equipment software program package provide advice room layout . advise school staff integrate technology teaching participate carry relate project prepare deliver training information workshop component program integrate technology . collaborate school resource partner organization . addition education consultant general adult education vocational training sector promote school board social economic partner draw appropriate promotional plan . meet representative business develop training program meet staff draw memorandum agreement service offer . participate organize study program training period industrial visit provide support teacher concern information advice employer . qualification require bachelor's degree appropriate specialty notably education Requirements special education resource elementary secondary education Functional Bilingualism minimum teaching Knowledge educational pathway corresponding program knowledge Familiarity common diagnosis MEQ documentation regard EHDAA student student special 'handicaps ' learning social emotional behavioural disorder excellent oral write presentation skill Familiarity assistive technology excellent understanding inclusive practice framework approach support inclusion Willingness service agency support student success willingness personal vehicle essential travel wqsb territory . position govern collective agreement FPPE . annual salary base qualification schooling . vacation . . pension plan . group insurance program . employee assistance program . life balance . apply Applications submit apply apply choose interview contact . acknowledge land live learn traditional unceded territory Algonquin Anishinaabe people . share land commit organization educator individual ongoing relationship recognize respect land tradition culture Anishinaabe people . commit build educational community common purpose realize potential student cultivate strong corp support professional teaching administrative excellence . encourage application indigenous people racialize people group person live people religious faith gender minority . organization strive hire individual reflect community serve embody practice love life long learning teamwork high professional ethic . effort achieve diverse workforce contribute culturally safe environment include establish proactive employment practice address systemic barrier remove obstacle hire retain qualified people ."
    },
    "companyDescription": "",
    "description": "Conseill\u00e8re ou Conseiller p\u00e9dagogique \n\n Remplacement \u00e0 temps plein - 35 heures par semaine \n\n Jusqu\u2019au 31 janvier 2025 \n\n D\u00e9partement des services compl\u00e9mentaires \n\n \u00c0 propos de la Commission scolaire Western Qu\u00e9bec \n\n Western Qu\u00e9bec est une commission scolaire anglophone d\u00e9vou\u00e9e au d\u00e9veloppement personnel et \u00e0 la pr\u00e9paration professionnelle de ses \u00e9l\u00e8ves. Les enseignantes, enseignants et le personnel se vouent tous \u00e0 l'excellence acad\u00e9mique, et \u00e0 un enseignement de qualit\u00e9 qui encourage le d\u00e9veloppement social, \u00e9motionnel et moral. Western Qu\u00e9bec respecte et promeut les droits et les responsabilit\u00e9s de chaque individu tout en privil\u00e9giant un apprentissage ax\u00e9 sur l'\u00e9l\u00e8ve dans un environnement s\u00e9curitaire et sain. Les parents et les communaut\u00e9s sont consid\u00e9r\u00e9s comme des partenaires qui collaborent \u00e0 l\u2019enrichissement de nos programmes et l\u2019atteinte d\u2019objectifs. \n\n Les 31 \u00e9coles et centres d\u2019enseignement aux adultes de Western Qu\u00e9bec offrent l\u2019enseignement de langue anglaise aux \u00e9l\u00e8ves admissibles sur un territoire immense et diversifi\u00e9 qui couvre les r\u00e9gions de l\u2019Outaouais, de Pontiac et de l\u2019Abitibi-T\u00e9miscamingue. Les diff\u00e9rences culturelles sont mises en valeur et c\u00e9l\u00e9br\u00e9es dans notre population \u00e9tudiante par des programmes d\u2019immersion fran\u00e7aise, des \u00e9v\u00e9nements pour et par les Premi\u00e8res Nations, et par d\u2019autres activit\u00e9s et initiatives \u00e9tudiantes. \n\n Nature du travail \n\n L\u2019emploi de conseill\u00e8re ou conseiller p\u00e9dagogique comporte plus sp\u00e9cifiquement des fonctions de conseil et soutien aupr\u00e8s des intervenantes et intervenants des \u00e9tablissements scolaires et des services \u00e9ducatifs relativement \u00e0 la mise en oeuvre, au d\u00e9veloppement et \u00e0 l\u2019\u00e9valuation des programmes d\u2019\u00e9tudes, \u00e0 la gestion de classe et \u00e0 la didactique. \n\n Quelques attributions caract\u00e9ristiques \n\n La conseill\u00e8re ou le conseiller p\u00e9dagogique collabore \u00e0 la r\u00e9alisation du projet \u00e9ducatif et des projets particuliers des \u00e9tablissements; elle ou il participe \u00e0 l\u2019\u00e9laboration, la mise en oeuvre et l\u2019\u00e9valuation de leur plan de r\u00e9ussite tout en respectant les encadrements \u00e9ducatifs et administratifs, tant au niveau des \u00e9tablissements que de la commission scolaire. \n\n Elle ou il collabore \u00e0 l\u2019implantation des programmes d\u2019\u00e9tudes et de formation, conseille les enseignantes et enseignants et la direction relativement \u00e0 l\u2019interpr\u00e9tation de ces programmes, con\u00e7oit et anime des ateliers et des sessions de formation sur les \u00e9l\u00e9ments du programme; elle ou il collabore \u00e0 l\u2019\u00e9laboration de situations d\u2019apprentissage et soutient l\u2019exp\u00e9rimentation en classe. \n\n Elle ou il conseille et soutient les enseignantes et enseignants sur une base individuelle et collective pour appuyer l\u2019action quotidienne; elle ou il con\u00e7oit ou s\u00e9lectionne et anime les activit\u00e9s de formation et d\u2019instrumentation pour des besoins d\u2019adaptation, d\u2019innovation et de d\u00e9veloppement p\u00e9dagogique. \n\n Elle ou il instrumente les enseignantes et enseignants sur l\u2019\u00e9valuation des apprentissages; elle ou il les accompagne dans la conception, l\u2019\u00e9laboration ou l\u2019adaptation d\u2019outils d\u2019\u00e9valuation. \n\n Elle ou il peut \u00eatre appel\u00e9 \u00e0 participer avec l\u2019\u00e9quipe multidisciplinaire \u00e0 l\u2019\u00e9laboration et la r\u00e9vision du plan d\u2019intervention de l\u2019\u00e9l\u00e8ve handicap\u00e9 ou qui pr\u00e9sente des difficult\u00e9s d\u2019adaptation ou d\u2019apprentissage; elle ou il participe au choix des objectifs et des moyens d\u2019intervention. \n\n Elle ou il participe avec les enseignantes et enseignants \u00e0 l\u2019\u00e9laboration et \u00e0 la mise en oeuvre de strat\u00e9gies et projets visant \u00e0 aider les \u00e9l\u00e8ves qui pr\u00e9sentent ou qui sont susceptibles de pr\u00e9senter des difficult\u00e9s d\u2019adaptation ou d\u2019apprentissage. \n\n Elle ou il conseille le personnel d\u2019encadrement, enseignant et professionnel sur des questions relatives aux programmes de perfectionnement du personnel, planifie ces programmes et en \u00e9value les r\u00e9sultats. \n\n Elle ou il analyse et conseille sur la s\u00e9lection de mat\u00e9riel didactique, mat\u00e9riel compl\u00e9mentaire, d\u2019\u00e9quipement, logiciels et progiciels pertinents; elle ou il conseille sur l\u2019am\u00e9nagement des locaux. \n\n Elle ou il conseille les intervenantes et intervenants scolaires sur les moyens d\u2019int\u00e9gration des technologies \u00e0 l\u2019enseignement; elle ou il collabore \u00e0 la r\u00e9alisation de projets qui vont dans ce sens; elle ou il \u00e9labore et anime des ateliers de formation et d\u2019information sur les \u00e9l\u00e9ments du programme d\u2019int\u00e9gration des technologies. \n\n Elle ou il collabore avec les autres intervenantes et intervenants du milieu scolaire, les organismes partenaires et le minist\u00e8re de l\u2019\u00c9ducation et de l'Enseignement sup\u00e9rieur. \n\n En outre, la conseill\u00e8re ou le conseiller p\u00e9dagogique en formation g\u00e9n\u00e9rale des adultes et en formation professionnelle contribue \u00e0 la visibilit\u00e9 de la commission scolaire aupr\u00e8s des partenaires socio-\u00e9conomiques et \u00e9tablit un plan de promotion en cons\u00e9quence. \n\n Elle ou il rencontre les repr\u00e9sentantes et repr\u00e9sentants de diverses entreprises afin de d\u00e9velopper conjointement des programmes de formation r\u00e9pondant aux besoins de l\u2019entreprise et de son personnel; elle ou il pr\u00e9pare des protocoles d\u2019entente et des offres de services. \n\n Elle ou il participe \u00e0 l\u2019organisation des programmes d\u2019alternance travail-\u00e9tudes, des stages en entreprise et des visites en industrie; elle ou il soutient les enseignantes et enseignants concern\u00e9s; elle ou il informe et conseille les employeurs. \n\n Qualifications requises \n\n Dipl\u00f4me universitaire terminal de premier cycle dans un champ de sp\u00e9cialisation appropri\u00e9, \u00e0 l\u2019emploi, notamment en \u00e9ducation. \n\n Autres exigences \n\n Exp\u00e9rience dans le domaine de l'\u00e9ducation sp\u00e9cialis\u00e9e et/ou des ressources au sein de l'enseignement primaire et/ou secondaire ; \n\n Bilinguisme fonctionnel (fran\u00e7ais et anglais) ; \n\n Un minimum de cinq ans d'exp\u00e9rience en enseignement ; \n\n Connaissance du Programme de formation de l'\u00e9cole qu\u00e9b\u00e9coise, des parcours \u00e9ducatifs et des programmes correspondants ; connaissance de la politique de la CSWQ en mati\u00e8re d'\u00e9ducation sp\u00e9cialis\u00e9e ; \n\n Connaissance des diagnostics courants et de la documentation du MEQ concernant les \u00e9l\u00e8ves ayant des besoins sp\u00e9ciaux/\"handicaps\", des handicaps et des troubles d'apprentissage/sociaux/\u00e9motionnels/comportementaux). \n\n Excellentes comp\u00e9tences orales, \u00e9crites et de pr\u00e9sentation ; \n\n Familiarit\u00e9 avec les technologies d'assistance ; \n\n Excellente compr\u00e9hension des pratiques d'int\u00e9gration et des cadres/approches qui soutiennent succ\u00e8s; \n\n Volont\u00e9 de travailler avec des services/agences externes pour favoriser la r\u00e9ussite des \u00e9tudiants ; \n\n Volont\u00e9 et capacit\u00e9 (un v\u00e9hicule personnel est essentiel) de voyager dans tout le territoire de la CSWQ. \n\n Conditions de travail \n\n Le poste est r\u00e9gi par la convention collective entre le CPNCA et la FPPE (F\u00e9d\u00e9ration des professionnels de l'\u00e9ducation du Qu\u00e9bec). \n\n Salaire annuel de 49 456 $ \u00e0 87 626 $, en fonction des qualifications, de la scolarit\u00e9 et de l'exp\u00e9rience. \n\n \nVacances annuelles : 35 jours. \n\n Jours de cong\u00e9s sociaux. \n\n R\u00e9gime de retraite. \n\n Assurances collectives. \n\n Programme d'aide aux employ\u00e9s. \n\n \u00c9quilibre entre vie professionnelle et vie priv\u00e9e (horaires flexibles). \n\n Comment postuler \n\n Les candidatures doivent \u00eatre soumises par l'interm\u00e9diaire de Apply To Education https://westernquebec.ca/resources/careers/ \n\n Date limite pour postuler \n\n Le 25 janvier 2024, \u00e0 16h. \n\n Seuls les candidats retenus pour un entretien seront contact\u00e9s. \n\n Nous, la commission scolaire de Western Quebec, reconnaissons que les terres sur lesquelles nous vivons, apprenons et travaillons sont le territoire traditionnel non c\u00e9d\u00e9 des peuples algonquins Anishinaabe. Nous les remercions de partager ces terres et nous nous engageons, en tant qu'organisation, en tant qu'\u00e9ducateurs et en tant qu'individus, \u00e0 entretenir une relation continue qui reconna\u00eet et respecte les terres, les traditions et la culture du peuple Anishinaabe. \n\n La Commission scolaire Western Qu\u00e9bec s'engage \u00e0 b\u00e2tir une communaut\u00e9 \u00e9ducative ayant pour objectif commun de r\u00e9aliser le potentiel de tous nos \u00e9l\u00e8ves en cultivant un solide corps de soutien et l'excellence professionnelle, p\u00e9dagogique et administrative. Nous encourageons donc les candidatures des Autochtones, ainsi que celles des autres groupes racialis\u00e9s, des personnes vivant avec un handicap, des personnes de confession religieuse et des minorit\u00e9s de genre. En tant qu'organisation, nous nous effor\u00e7ons d'embaucher des personnes qui refl\u00e8tent les communaut\u00e9s que nous servons, et qui pratiquent l'amour de l'apprentissage tout au long de la vie, le travail d'\u00e9quipe et l'\u00e9thique professionnelle la plus \u00e9lev\u00e9e. Nos efforts pour obtenir une main-d'\u0153uvre diversifi\u00e9e qui contribue \u00e0 un environnement de travail culturellement s\u00fbr comprennent la mise en place de pratiques d'emploi proactives afin d'aborder les barri\u00e8res syst\u00e9miques et d'\u00e9liminer les obstacles \u00e0 l'embauche et \u00e0 la r\u00e9tention de personnes qualifi\u00e9es. \n\n Education Consultant \n\n Replacement - Full Time - 35 hours per week \n\n To January 31, 2025 \n\n Complementary Services Department \n\n About the Western Qu\u00e9bec School Board \n\n Western Qu\u00e9bec is an English school board dedicated to developing lifelong learners who contribute to society and are prepared for their future. All teachers and staff are committed to academic excellence and the provision of quality education which encourages social, emotional and moral development. Western Qu\u00e9bec respects and promotes the rights and responsibilities of every individual while maintaining a student-centred, safe and healthy learning environment. Parents and communities are valued as collaborative partners in enriching programs and achieving goals. \n\n Western Qu\u00e9bec\u2019s 31 schools and centres provide English-language education to eligible students over an immense and diverse territory which covers the Outaouais, Pontiac and Abitibi-T\u00e9miscamingue regions. Cultural differences are valued and celebrated within our student population through French-Immersion programs, First Nations events and student initiatives and activities. \n\n Nature of the Work \n\n The position of education consultant encompasses, in particular, responsibility for providing advice and support to staff of educational institutions and services in the implementation, development and evaluation of programs of study, class management and instructional materials. \n\n \nSome characteristic duties:\n The education consultant participates in carrying out the educational project and the special projects of educational institutions; he or she participates in the development, implementation and evaluation of their success plan, while complying with the academic and administrative requirements of both the educational institutions and the school board. \n\n He or she contributes to the implementation of programs of study and training, provides advice to the teachers and administration concerning the interpretation of those programs, designs and leads training workshops and sessions on program components; he or she collaborates in developing learning situations and supports experimentation in class. \n\n He or she provides advice and support to teachers either individually or in a group format in matters pertaining to their daily teaching activities; he or she develops or selects and delivers training and instrumentation activities designed to respond to needs in pedagogical adaptation, innovation and development. \n\n He or she provides teachers with learning evaluation tools and guides them in the design, preparation or adaptation of evaluation tools. \n\n He or she may be called upon to work with a multidisciplinary team to draw up and review the individualized education plan of a handicapped student or a student with social maladjustments or learning difficulties; he or she participates in defining intervention objectives and means. \n\n He or she works with teachers to prepare and implement strategies and projects aimed at helping students who are experiencing or who are likely to experience social maladjustments or learning difficulties. \n\n He or she advises management, teaching or professional staff on matters pertaining to professional development programs, plans the programs and evaluates the results. \n\n He or she analyzes and recommends the purchase of learning materials, supplementary materials, equipment, software and program packages, and provides advice on room layouts. \n\n He or she advises school staff on the means for integrating technology into teaching; he or she participates in carrying out related projects; he or she prepares and delivers training and information workshops on components of the program for integrating technology. \n\n He or she collaborates with other school resources, partner organizations and the Minist\u00e8re de l\u2019\u00c9ducation et de l'Enseignement sup\u00e9rieur. \n\n In addition, the education consultant in the general adult education and vocational training sectors promotes the school board to social and economic partners and draws up an appropriate promotional plan. \n\n He or she meets with representatives of various businesses so as to develop with them training programs that meet their needs and those of their staff; he or she draws up memorandums of agreement and service offers. \n\n He or she participates in organizing work-study programs, training periods and industrial visits; provides support to the teachers concerned and information and advice to employers. \n\n Qualifications Required \n\n A bachelor's degree in an appropriate specialty, notably education \n\n Other Requirements \n\n Special education and/or resource experience within elementary and/or secondary education; \n\n Functional Bilingualism (French and English); \n\n A minimum of five years of teaching experience; \n\n Knowledge of the Qu\u00e9bec Education Programme, educational pathways and corresponding programs; knowledge of WQSB Special Education Policy; \n\n Familiarity with common diagnoses and MEQ documentation regarding EHDAA students (students with special needs/\u2018handicaps\u2019, learning/social/emotional/behavioural disabilities and disorders) \n\n Excellent oral, written and presentation skills; \n\n Familiarity with assistive technology; \n\n Excellent understanding of inclusive practices and of frameworks/approaches that support inclusion; \n\n Willingness to work with outside services/agencies in support of student success; \n\n Willingness and ability (personal vehicle is essential) to travel throughout the WQSB territory. \n\n Working Conditions \n\n The position is governed by the collective agreement between CPNCA and FPPE (Federation of Educational Professionals of Qu\u00e9bec). \n\n Annual salary from $ 49,456, to $ 87,626, based on qualifications; schooling; experience. \n\n \nVacation: 35 days. \n\n Special leave days. \n\n Pension plan. \n\n Group insurance program. \n\n Employee assistance program. \n\n Work-life balance (flexible hours). \n\n How to Apply \n\n Applications must be submitted through Apply To Education https://westernquebec.ca/resources/careers/ \n\n Deadline to Apply \n\n January 25, 2024, 4:00 p.m. \n\n Only those candidates chosen for interviews will be contacted. \n\n We, the Western Quebec School Board, acknowledge that the lands upon which we live, learn, and work are the traditional unceded territory of the Algonquin Anishinaabe peoples. We thank them for sharing these lands and commit, as an organization, as educators and as individuals, to an ongoing relationship that recognizes and respects the lands, traditions, and culture of the Anishinaabe people. \n\n The Western Quebec School Board is committed to building an educational community with the common purpose to realize the potential of all our students by cultivating a strong corps of support, professional, teaching, and administrative excellence. We, therefore, encourage applications from Indigenous people, as well as from other racialized people groups, persons living with a disability, people of religious faith, and gender minorities. As an organization, we strive to hire individuals who reflect the communities we serve, and who embody and practice a love of life-long learning, teamwork, and the highest professional ethics. Our efforts to achieve a diverse workforce that contributes to a culturally safe working environment include establishing proactive employment practices to address systemic barriers and removing obstacles to hiring and retaining qualified people."
}