{
    "id": "b1b7ad56c5d90c63",
    "company": "Business Sherpa Group",
    "positionName": "Software Architect",
    "jobType": [
        "Full-time"
    ],
    "location": "Ottawa, ON",
    "salary": null,
    "postingDateParsed": "2024-01-26T12:13:40.668Z",
    "url": "https://www.indeed.ca/rc/clk?jk=b1b7ad56c5d90c63&from=jasx&tk=1hl5dd1pui7nm800&bb=NiGljfghLwyJxtbyZy8vs-Jk0qJZKd91pGFYGAENkLcorZtxwvRmT-c4S8w05zqyrSHX24iopoPO5LwS0F0OKJxOtDE4LBVjCBDTa7qcRyqsE2kXYt9KDw%3D%3D&xkcb=SoC467M3FlS757AVJj0NbzkdCdPP&vjs=3",
    "externalApplyLink": "https://www.businesssherpagroup.com/job/software-architect-searidge-technologies/",
    "job_info_group": {
        "extracted_phone_numbers": [],
        "extracted_links": [
            "HTTP/HTTPS Links",
            "General Links",
            "WWW Links",
            "TLDs"
        ],
        "extracted_emails": [],
        "extracted_location_data": [
            "Ontario",
            "Location Ottawa",
            "Ottawa"
        ],
        "extracted_dates": [
            "January 8"
        ],
        "extracted_languages": [
            "English",
            "C++"
        ],
        "extracted_laws": [],
        "extracted_norps": [],
        "extracted_orgs": [
            "Review",
            "About the Job Searidge Technologies",
            "LinkedIn",
            "EKS",
            "React Hands",
            "high-level system design documentation Qualifications Computer Science Bachelor Degree",
            "Ontario Industry: Technology/Aviation Job Type",
            "Fargate",
            "Actively",
            "Searidge Technologies"
        ],
        "extracted_persons": [
            "Searidge"
        ],
        "extracted_products": [
            "Collaborate",
            "JavaScript"
        ],
        "extracted_money": [],
        "processed_text": "Published Hybrid Category Software Development type Mid senior Level Description Headquarters global leader preferred partner Remote Tower Digital Airport solution currently recruit Software Architect excellent understanding software development software system architecture design software development life cycle . successful responsible architecture design Searidge's software component integrated software subsystem Searidge's digital data platform underpin software component product . software architect role essential Searidge's model system development process interface project delivery software development team . software architect analyze system level requirement derive software level requirement design software architecture ensure architectural principle follow platform product . permanent position report Head Platform Products . responsibility collaborate Searidge project software team create functional functional software level requirement software tester ensure software level requirement adequately verify validate tool software development methodology create highand low level software component integrated software system architecture design documentation document record software design selection specification seek improve architectural design Searidge product platform aim improve safety efficiency customer satisfaction . provide technical guidance mentor software developer software tester project delivery team ensure software system design follow consistent design pattern specification . communicate concept guideline software developer project delivery team documentation presentation approve architecture relate information software low level design equivalent + design implement software application solid understanding development tooling development platform excellent knowledge software application design architecture demonstrate knowledge real application web application api cybersecurity Helm Docker kubernete Message queue Structured Query Language structured Query Language database extensive Message Queues Representational State transfer api Application Programming Interface architecture excellent communication interpersonal skill general understanding software quality assurance principle strong analytical critical thinking skill big picture understanding Linux system team player learn Desired Qualifications code language Amazon Web Services technology EC2 S3 Lambda develop frontend backend application understanding cybersecurity threat solution good practice Familiarity language addition innovative technology company mission critical aviation . pioneer global leader Digital Tower Advanced Airport solution team forefront technology driving change aircraft vehicle vicinity airport traditionally manage . Searidge team exciting industry encounter challenging problem expose variety internal function encourage learn grow expand professionally personally . equal employer offer competitive compensation respectful positive environment creative solution empowerment collaboration achieve share goal corporate dna . apply sound good fit follow link apply ."
    },
    "companyDescription": "Business Sherpa Group provides its clients with an experienced, corporate class Human Resources team. With a focus on small or start up businesses, Business Sherpa is able to assist by providing its clients with HR business partners embedded, either physically or virtually, within each firm.  As well, organizations can count on the support of the entire Group, where a full spectrum of Human Resources functionality can be scaled exactly to client needs. ",
    "description": "Searidge Technologies \n     \n      searidgetech.com \n     \n    \n   \n  \n  \n   \n    \n     Published \n    \n    \n     January 8, 2024 \n    \n   \n   \n    \n     Location \n    \n    \n     Ottawa (Hybrid), Ontario, Canada \n    \n   \n   \n    \n     Category \n    \n    \n     Software Development \n    \n   \n   \n    \n     Job Type \n    \n    \n     Full-time \n    \n   \n   \n    \n     Experience\n     \n    \n     Mid-Senior Level \n    \n   \n  \n  \n   Description \n   \n    Headquarters: Ottawa, Ontario \n     Industry: Technology/Aviation \n     Job Type: Full-time \n     About the Job \n     Searidge Technologies, a global leader and preferred partner for Remote Tower and Digital Airport solutions is currently recruiting for a Software Architect with an excellent understanding of software development, software system architecture design and the software development life cycle. The successful candidate will be responsible for the architecture design of Searidge\u2019s software components and integrated software subsystems as well as the Searidge\u2019s digital data platform that underpins all software components and products. The software architect role is an essential part of Searidge\u2019s V-Model system development process, interfacing with both project delivery and software development teams. The software architect will analyze system-level requirements, derive software-level requirements, and design the software architecture, while ensuring the overall architectural principles are followed for the platform and all products. \n     This will be a permanent, full-time position, reporting to the Head of Platform and Products. \n     Responsibilities \n    \n     Collaborate with Searidge project and software teams to create functional and non-functional software-level requirements \n     Collaborate with software testers to ensure the software-level requirements are adequately verified and validated \n     Use tools and software development methodologies to create high- and low-level software component and integrated software sub-system architecture design documentation \n     Documenting and recording software design selections and specifications \n     Actively seek ways to improve the architectural design of all Searidge products and the platform, with an aim to improve safety, efficiency, and customer satisfaction. \n     Provide technical guidance and mentoring to software developers, software testers, and project delivery teams \n     Ensure that software and sub-system designs follow a consistent design pattern and specification. \n     Communicate new concepts and guidelines to software developers and project delivery teams through documentation and presentations \n     Review and approve architecture-related information in software low-level design and high-level system design documentation \n    \n    Qualifications \n    \n     Computer Science Bachelor Degree or equivalent \n     5+ years experience in designing and implementing software applications \n     Solid understanding of development tooling and development platform \n     Excellent knowledge of software and application design and architecture \n     Demonstrated knowledge of real time applications, web applications, APIs, and cybersecurity \n     Experience with Helm, Docker, Kubernetes, Message Queues, SQL and No-SQL databases \n     Extensive experience with Message Queues, REST APIs and API architecture \n     Excellent communication and interpersonal skills \n     General understanding of software quality assurance principles \n     Strong analytical and critical thinking skills with the ability to see the big picture \n     Understanding of Linux systems \n     Must be a team player and willing to learn \n    \n    Desired Qualifications \n    \n     Experience in coding languages such as C++, JavaScript, and React \n     Hands-on experience with AWS technologies such as EC2, EKS, S3, Fargate and Lambda \n     Experience developing frontend and backend applications \n     Understanding of cybersecurity threats, solutions, and best practices \n     Familiarity with one or more languages in addition to English \n    \n    Why Searidge? \n     Searidge Technologies is an innovative technology company working in the mission critical world of aviation. As a pioneer and global leader in Digital Tower and Advanced Airport solutions, our team is on the forefront of technology and driving change in how aircraft and vehicles in the vicinity of an airport have been traditionally managed. \n     As a member of the Searidge team, you will be part of exciting industry firsts, encounter challenging problems, be exposed to a variety of internal functions, and encouraged to learn, grow and expand both professionally and personally. \n     We are an equal opportunity employer offering competitive compensation, a respectful and positive work environment where creative solutions, empowerment, and collaboration to achieve our shared goals are part of our corporate DNA. \n     To Apply \n     Sounds like a good fit? If so, follow this link to apply via LinkedIn."
}