{
    "id": "8d686ae4cb46bbfe",
    "company": "University of Ottawa",
    "positionName": "Assistant Professor in Solid Earth Materials",
    "jobType": [],
    "location": "40 Ruskin St, Ottawa, ON",
    "salary": null,
    "postingDateParsed": "2023-10-13T18:55:06.439Z",
    "url": "https://www.indeed.ca/rc/clk?jk=8d686ae4cb46bbfe&from=jasx&tk=1hcvfr1frj4hv800&vjs=3",
    "externalApplyLink": "https://uottawa.wd3.myworkdayjobs.com/en-US/uOttawa_External_Career_Site/job/Ottawa-ON/Assistant-Professor-in-Solid-Earth-Materials_JR6659",
    "job_info_group": {
        "extracted_phone_numbers": [
            "613-562-5773",
            " 613-562-5773"
        ],
        "extracted_links": [
            "HTTP/HTTPS Links",
            "General Links",
            "WWW Links",
            "TLDs"
        ],
        "extracted_emails": [
            "EESpost@uottawa.ca",
            "vra.affairesprofessorales@uottawa.ca"
        ],
        "extracted_location_data": [
            "Canada",
            "North America",
            "Ottawa",
            "downtown Ottawa",
            "the Arctic"
        ],
        "extracted_dates": [
            "November 29, 2023",
            "the day prior",
            "May 1, 2022",
            "July 1, 2024"
        ],
        "extracted_languages": [
            "French"
        ],
        "extracted_laws": [],
        "extracted_norps": [
            "Canadians",
            "PXRD"
        ],
        "extracted_orgs": [
            "the University",
            "the Office of the Vice-Provost",
            "Canada The University of Ottawa",
            "The University",
            "The University of Ottawa",
            "APUO Faculty/Department:",
            "the Association of Professors",
            "its Official Languages and Bilingualism Institute",
            "Environmental Sciences Postdoctoral",
            "ICP-ES",
            "Department of Earth & Environmental Sciences",
            "Academic Careers",
            "Solid Earth Materials The Department of Earth and Environmental Sciences",
            "University of Ottawa",
            "XRF",
            "Canada's National AE Lalonde Accelerating Mass Spectrometer Laboratory",
            "Department of Earth and Environmental Sciences_FT Campus",
            "Micro-CT",
            "the University of Ottawa Careers",
            "(SCXRD",
            "TEM",
            ", Faculty Relations",
            "Earth Sciences, Geology",
            "the Faculty of Science",
            "Indigenous Peoples in Canada",
            "the University of Ottawa",
            "Earth Sciences",
            "150 Louis Pasteur Pvt.",
            "Preference",
            "EMPA"
        ],
        "extracted_persons": [
            "Dr. David Schneider"
        ],
        "extracted_products": [],
        "extracted_money": [
            {
                "amount": "89,622",
                "noun_phrases": []
            }
        ],
        "processed_text": "Family Academic Leadership Faculty Union affiliation stem post octobre closing note application accept Project Manager tenure track position invite application tenure track position rank Assistant Professor field broadly relate solid Earth petrologic process . scientist outstanding track record innovative research experimental theoretical field base investigation structure process rock understand dynamic geological system . interested research interest igneous metamorphic mineral microstructure ore geology . research focus solid foundation field geology encouraged apply . starting . title position Assistant Professor duty responsibility include teach broad spectrum mineralogy petrology orient course supervision BSc MSc student develop externally fund research program establish connection industry government agency active engagement department faculty contribute administrative academic activity . rank salary regular tenure track academic appointment salary consistent collective agreement . base salary assistant professor . contact information K1N skill requirement excellent didactic skill asset bilingualism large English French university consider bilingualism define feature institution . expect function teach official language tenure . delighted offer free training achieve aim . teach hiring . application procedure information regard find online . application submit electronically portal . include application cover letter curriculum vitae statement summarize propose research program strategy candidate's pedagogical approach teach statement address potential contribution diversity research teaching service contact detail professional reference Application deadline review application . application receive receive consideration . select interview contact . location K1N information analytical laboratory campus include microbeam SEM ray geochemical ICP MS ICP OES facility noble gas stable isotope instrumentation . recognize nationally internationally good university country large university . locate unceded territory Anishinabe Algonquin people heart contribute economy culture quality life Canada's Capital . commit ensure equity diversity inclusion scholarly leadership environment student staff faculty . encourage application visible minority racialize person person woman qualified skill knowledge productively engage equitable diverse inclusive community . consider designate group complete confidential Identification Questionnaire complete application . accord government policy qualified invite apply preference permanent resident . submit application indicate legally entitle . provide accommodation applicant recruitment process . invite proceed selection process notify accommodation require contact email . information send handle respectfully complete confidence . justly tradition bilingualism . provide training staff spouse second official language . tenure professor expect function setting . case professor teach official language grant tenure . commit ensure equity diversity inclusion scholarly leadership environment student staff faculty . encourage application visible minority racialize person person woman qualified skill knowledge productively engage equitable diverse inclusive community . consider designate group complete confidential Identification Questionnaire complete application . qualified invite apply preference permanent resident . submit application indicate legally entitle provide accommodation applicant recruitment process . invite proceed selection process notify accommodation require contact email . information send handle respectfully complete confidence . tradition bilingualism . provide training staff spouse second official language . prior require student faculty staff visitor include contractor fully vaccinate Covid define Policy \u2013 Covid Vaccination . policy suspend effective reinstate point future depend public health guideline recommendation expert ."
    },
    "companyDescription": "",
    "description": "Job Family:\n  Academic Leadership and Faculty\n \n   Union affiliation:\n \n  APUO\n \n \n   Faculty/Department:\n  Department of Earth and Environmental Sciences_FT\n \n \n   Campus:\n  STEM\n \n \n   Date Posted:\n  octobre 13, 2023\n \n \n   Closing Date:\n \n \n   Note: Applications will be accepted until 11:59 PM on the day prior to the Posting End Date above\n \n \n \n   Tenure-track position in Solid Earth Materials\n \n \n \n   The Department of Earth and Environmental Sciences at the University of Ottawa invites applications for a tenure-track position at the rank of Assistant Professor in a field broadly related to solid Earth petrologic processes. We are looking for a scientist with an outstanding track record for innovative research using experimental, theoretical and field-based investigations of structures and processes in rocks to understand the dynamics of geological systems. We are especially interested in candidates with research interests in igneous and metamorphic minerals and microstructures, or ore geology. Candidates with a research focus in the Arctic and that have a solid foundation in field geology are strongly encouraged to apply. The starting date is July 1, 2024.\n \n \n \n   Title of the position: Assistant Professor\n \n \n \n   Duties: The responsibilities include: 1) teach across a broad spectrum of mineralogy or petrology oriented courses; 2) supervision of BSc, MSc and PhD students; 3) develop an externally-funded research program; 4) establish connections with industry and government agencies; and 5) active engagement with the department and faculty by contributing to administrative and academic activities.\n \n \n \n   Rank and salary: Regular tenure-track academic appointment in the Faculty of Science, with a salary consistent with the collective agreement of the Association of Professors of the University of Ottawa. The base salary for assistant professors is $89,622.\n \n \n \n   Contact information: Dr. David Schneider, Department of Earth & Environmental Sciences, University of Ottawa, 150 Louis Pasteur Pvt., Ottawa, Ontario K1N 6N5 Canada, 613-562-5773, \n  \n   EESpost@uottawa.ca\n  \n \n \n \n   Skill requirements:\n \n \n   PhD in Earth Sciences, Geology, or Environmental Sciences\n   Postdoctoral experience and excellent didactic skills are an asset\n   Bilingualism: The University of Ottawa is proud to be the largest bilingual (English-French) university in North America and considers bilingualism to be a defining feature of the institution. It is expected that the candidate will be able to function and teach in both official languages by the time of tenure. The University is delighted to offer free training to achieve this aim. Preference may be given to candidates who are able to teach in French at the time of hiring.\n \n \n \n   Application procedure: More information regarding \n  \n   Academic Careers can be found online\n  . Applications must be submitted electronically through the University of Ottawa Careers portal. Candidates should include the following in their application:\n \n \n   a cover letter and curriculum vitae\n   a statement summarizing the proposed research program (2-3 pages)\n   strategies of the candidate's pedagogical approach to teaching Earth Sciences (2 pages)\n   a statement addressing past and/or potential contributions to diversity through research, teaching, and/or service (1 page)\n   names and contact details of three professional references\n \n \n \n   Application deadline: Review of applications will begin November 29, 2023. Applications received before this date will receive full consideration. Only candidates selected for an interview will be contacted.\n \n \n \n   Location of work: Department of Earth & Environmental Sciences, University of Ottawa, 150 Louis Pasteur Pvt., Ottawa, Ontario K1N 6N5 Canada\n \n \n \n   Other information:\n \n \n   Analytical laboratories on campus include microbeam (SEM, TEM, EMPA), X-ray (SCXRD, PXRD, XRF, Micro-CT), and geochemical (LA-ICP-MS, ICP-ES, ICP-OES) facilities, Canada\u2019s National AE Lalonde Accelerating Mass Spectrometer Laboratory, and noble gas and stable isotope instrumentation. The University of Ottawa is recognized nationally and internationally as one of the best universities in the country and the largest bilingual university in the world. Located on the unceded territory of Anishinab\u00e9-Algonquin people, in the heart of downtown Ottawa, it contributes significantly to the economy, culture and quality of life of Canada's Capital.\n \n \n \n   The University of Ottawa is committed to ensuring equity, diversity and inclusion in the scholarly and leadership environments of our students, staff, and faculty. Accordingly, we strongly encourage applications from Indigenous Peoples in Canada, visible minorities members (racialized persons), persons with disabilities, women, as well as from all qualified candidates with the skills and knowledge to productively engage with equitable, diverse and inclusive communities. Candidates who wish to be considered as a member of one or more designated groups are asked to complete the confidential Self-Identi\ufb01cation Questionnaire, to be completed at the time of application.\n \n \n \n   According to government policy, all qualified candidates are invited to apply; however, preference will be given to Canadians and permanent residents. When submitting your application, please indicate if you are legally entitled to work in Canada.\n \n \n \n   The University of Ottawa provides accommodations for applicants with disabilities throughout the recruitment process. If you are invited to proceed in the selection process, please notify us of any accommodations that you require by contacting the Office of the Vice-Provost, Faculty Relations by email at \n  \n   vra.affairesprofessorales@uottawa.ca\n  \n  . Any information you send us will be handled respectfully and in complete confidence.\n \n \n   The University of Ottawa is justly proud of its more than 160-year tradition of bilingualism. Through its Official Languages and Bilingualism Institute, the University provides training to staff members and their spouses in their second official language. At the time of tenure, professors are expected to be able to function in a bilingual setting. In certain cases, professors must have the ability to teach in both official languages to be granted tenure.\n \n \n \n   The University of Ottawa is committed to ensuring equity, diversity, and inclusion in the scholarly and leadership environments of our students, staff, and faculty. Accordingly, we strongly encourage applications from Indigenous Peoples in Canada, visible minorities members (racialized persons), persons with disabilities, women, as well as from all qualified candidates with the skills and knowledge to productively engage with equitable, diverse, and inclusive communities. Candidates who wish to be considered as a member of one or more designated groups are asked to complete the confidential Self-Identification Questionnaire, to be completed at the time of application.\n \n \n \n   All qualified candidates are invited to apply; however, preference will be given to Canadians and permanent residents. When submitting your application, please indicate if you are legally entitled to work in Canada\n \n \n \n   The University of Ottawa provides accommodations for applicants with disabilities throughout the recruitment process. If you are invited to proceed in the selection process, please notify us of any accommodations that you require by contacting the Office of the Vice-Provost, Faculty Relations by email at \n  \n   vra.affairesprofessorales@uottawa.ca\n  . Any information you send us will be handled respectfully and in complete confidence.\n \n \n \n   The University of Ottawa is proud of its 160-year tradition of bilingualism. Through its Official Languages and Bilingualism Institute, the University provides training to staff members and to their spouses in their second official language.\n \n \n \n   Prior to May 1, 2022, the University required all students, faculty, staff, and visitors (including contractors) to be fully vaccinated against Covid-19 as defined in Policy 129 \u2013 Covid-19 Vaccination. This policy was suspended effective May 1, 2022 but may be reinstated at any point in the future depending on public health guidelines and the recommendations of experts."
}