{
    "id": "2099b0e3c45ffc66",
    "company": "University of Ottawa",
    "positionName": "Laboratory Coordinator",
    "jobType": [],
    "location": "40 Ruskin St, Ottawa, ON",
    "salary": null,
    "postingDateParsed": "2023-10-30T20:06:59.193Z",
    "url": "https://www.indeed.ca/rc/clk?jk=2099b0e3c45ffc66&from=jasx&tk=1he3lftbdk7tt800&vjs=3",
    "externalApplyLink": "https://ca.indeed.com/rc/clk?jk=2099b0e3c45ffc66&atk=&xpse=SoCD67I3IDjKFrQ9d50LbzkdCdPP",
    "job_info_group": {
        "extracted_phone_numbers": [],
        "extracted_links": [
            "HTTP/HTTPS Links",
            "General Links",
            "WWW Links",
            "TLDs"
        ],
        "extracted_emails": [
            "hrtalentmanagement@uottawa.ca"
        ],
        "extracted_location_data": [
            "Canada"
        ],
        "extracted_dates": [
            "October 30,",
            "Months",
            "the day prior",
            "May 1, 2022",
            "November 10",
            "three to five years"
        ],
        "extracted_languages": [
            "English",
            "French"
        ],
        "extracted_laws": [],
        "extracted_norps": [
            "Canadians"
        ],
        "extracted_orgs": [
            "Financial Operations Tracks",
            "the Faculty of Medicine Welcome",
            "the University",
            "the University of Ottawa Faculty of Medicine",
            "Key Competencies",
            "Laboratory and Operations Management Manages",
            "The University",
            "1 Faculty/Service - Department",
            "the Official Languages and Bilingualism Institute",
            "The University of Ottawa",
            "uOttawa"
        ],
        "extracted_persons": [
            "Marc-Andr\u00e9 Langlois Lab Campus"
        ],
        "extracted_products": [],
        "extracted_money": [
            {
                "amount": "61,802.00 - $",
                "noun_phrases": []
            }
        ],
        "processed_text": "type employee duration term Family research Open position Roger Guindon Hall Union Affiliation post closing note application accept Project Manager week Salary grade Union Grade NR5 hrs Salary range large medical faculty . learner access state art facility specialized institution learn alongside class physician scientist . consistently rank medical school faculty faculty medicine research impact biomedical health science . position Purpose Oversees technical administrative operation laboratory include conduct scientific activity experimentation laboratory ensure safe proper care calibration maintenance laboratory's equipment scientific resource database animal colony sample collection . administer laboratory operation include inventory maintenance ordering supply track expenditure project budget assist administration laboratory personnel . role responsibility include oversee daily operation finance laboratory technical operation department include responsibility budget purchasing inventory maintenance financial report administration staff . ensures safe proper laboratory's equipment ensure appropriate maintenance calibration laboratory equipment . expenditure project budget . Advises Principal Investigator budget deviation Attributes research grant contract account appropriate documentation justification require . Personnel supervision supervise operational activity staff student laboratory . provide guidance expert advice staff student technical issue safety procedure regulatory compliance matter laboratory . monitor operation ensure compliance . instruct demonstrate analysis technique procedure laboratory staff student . ensure student employee familiar laboratory operational requirement . Scientific Operations perform background research literature search evaluate result formulate recommendation . research determine applicability technology system relate . develop modify exist specialized technique test procedure standard general direction senior professional staff . monitor safety provide guidance safe equipment . research design analyze result novel experiment . select appropriate procedure equipment standard produce require datum assist analysis interpretation . set test calibrate testing equipment . assists professional staff diagnose system equipment material failure . identifies solution problem . ensure datum analytical result maintain satisfactory manner . internal external partner ensure effective implementation joint experimental program support collaborative research project . bring M.Sc . relevant discipline relevant equivalent combination educational qualification . research laboratory operation . safely reagent hazardous biohazardous material . excellent technical skill analytical judgment strong operational focus demonstrate organizational prioritization skill excellent communication skill excellent interpersonal technical scientific communication skill write oral . advance write verbal skill . Bilingualism speak write prefer . require competency employee planning organize series action event order realize objective project . plan organize priority regular daily activity . initiative demonstrate creativity initiative improvement encourage positive result . proactive starting . availability willingness . Client Service Orientation help serve meet . imply anticipate identify internal external client find solution meet . teamwork Cooperation cooperate team reach common goal . accept constructive feedback . adjust behaviour reach goal team . embrace diversity inclusion workplace . passionate people commit employment equity . foster culture respect teamwork inclusion collaboration innovation creativity fuel quest research teaching excellence . qualified person invite apply application qualified indigenous person racialize person person woman lgbtqia2s+ person . commit create maintain accessible barrier free environment . committed applicant request accommodation recruitment assessment selection process . applicant contact communicate accommodation . qualified encourage apply permanent resident priority . note union position hiring process govern current collective agreement relate union affiliation note click find . position responsibility interact student select rate low advanced proficiency level high oral comprehension reading comprehension second official language . rating determine proficiency test design . prior require student faculty staff visitor include contractor fully vaccinate Covid define Policy \u2013 Covid Vaccination . policy suspend effective reinstate point future depend public health guideline recommendation expert ."
    },
    "companyDescription": "",
    "description": "Job Type:\n  Employee\n \n \n   Duration in Months (for fixed-term jobs):\n  12\n \n \n   Job Family:\n  Research\n \n \n   # of Open Positions:\n  1\n \n \n   Faculty/Service - Department:\n  Marc-Andr\u00e9 Langlois Lab\n \n \n   Campus:\n  Roger Guindon Hall\n \n \n   Union Affiliation:\n  N/A\n \n \n   Date Posted:\n  October 30, 2023\n \n \n   Closing Date:\n  November 10, 2023\n \n   Note: Applications will be accepted until 11:59 PM on the day prior to the Posting End Date above\n \n \n \n   Hours per week:\n  35\n \n \n   Salary Grade:\n  Non-Union Grade NR5 - 35 hrs\n \n \n   Salary Range:\n  $61,802.00 - $75,234.00\n  About the Faculty of Medicine\n  Welcome to the University of Ottawa Faculty of Medicine, the first and largest bilingual medical faculty in Canada. Our learners have access to state-of-the art facilities and specialized institutions as they learn alongside world-class physicians and scientists. Consistently ranked among the top 10 medical schools in Canada, our faculty is among the top faculties of medicine in the world for research impact in biomedical and health sciences.\n \n \n   Position Purpose:\n \n \n   Oversees the day-to-day technical and administrative operations of a laboratory, including conducting some of the scientific activities and experimentation of the laboratory, ensuring the safe and proper use, care, calibration and maintenance of the laboratory\u2019s equipment and other scientific resources such as databases, animal colonies, sample collection, etc,). Administers the laboratory\u2019s day-to-day operations including inventory maintenance, ordering of supplies, tracking expenditures against project budgets, and assisting with administration of laboratory personnel.\n \n \n \n   In this role, your responsibilities will include:\n \n \n \n  \n    Laboratory and Operations Management\n  \n  \n    Manages and oversees the daily operations and finances of a laboratory or technical operation for a department, including responsibility for budget, purchasing, inventory, maintenance of financial reports, and administration of staff.\n    Ensures the safe and proper use of laboratory\u2019s equipment\n    Ensures appropriate maintenance and calibration of laboratory equipment.\n  \n  \n  \n    Financial Operations\n  \n  \n    Tracks expenditures against project budgets. -Advises Principal Investigator of significant budget deviations\n    Attributes to research grant and contract accounts, with appropriate documentation and justification as may be required.\n  \n  \n  \n    Personnel supervision\n  \n  \n    Supervises operational activities of staff and students working in the laboratory.\n    Provides guidance and expert advice to staff and students on technical issues, safety procedures and regulatory compliance matters within the laboratory. Monitors operations to ensure compliance.\n    Instructs and demonstrates analysis techniques and procedures to laboratory staff and students.\n    Ensures that new students or employees are familiar with laboratory operational requirements.\n  \n  \n  \n   \n     Scientific Operations\n   \n   \n     Performs background research and literature searches as needed, evaluates results and formulates recommendations as needed. Researches and determines the applicability of new technology and systems related to work.\n     Develops new, or modifies existing specialized techniques, test procedures and standards under general direction from senior professional staff. Monitors safety and provides guidance on safe use of equipment.\n     Researches, designs and analyzes the results of novel experiments. Selects and uses appropriate procedures, equipment and standards to produce required data; assists in analysis and interpretation.\n     Sets up, tests, and calibrates testing equipment.\n     Assists professional staff in diagnosing causes of system, equipment or material failures. Identifies possible solutions to problems.\n     Ensures that all data and analytical results are maintained in a satisfactory manner.\n     Works with internal and external partners to ensure effective implementation of joint experimental programs in support of collaborative research projects.\n   \n  \n \n \n \n   What you will bring:\n \n \n  \n    M.Sc. in a relevant discipline and three to five years of relevant experience, or an equivalent combination of experience and educational qualifications.\n    Experience in research and /or laboratory operations.\n  \n  \n    Ability to work safely with reagents, hazardous and biohazardous materials.\n    Excellent technical skills, analytical ability, judgment with a strong operational focus\n    Demonstrated organizational and prioritization skills\n    Excellent communications skills\n  \n  \n    Excellent interpersonal, technical, scientific and communications skills (written/oral).\n    Advanced written and verbal skills in English or French. Bilingualism, spoken and written, is preferred.\n  \n \n \n \n   Key Competencies at uOttawa:\n   Here are the required competencies for all or our employees at uOttawa:\n   \n   Planning: Organize in time a series of actions or events in order to realize an objective or a project. Plan and organize own work and priorities in regular daily activities.\n   Initiative: Demonstrate creativity and initiative to suggest improvements and encourage positive results. Is proactive and self-starting. Show availability and willingness to go above and beyond whenever it is possible.\n   Client Service Orientation: Help or serve others to meet their needs. This implies anticipating and identifying the needs of internal and external clients and finding solutions on how to meet them.\n   Teamwork and Cooperation: Cooperate and work well with other members of the team to reach common goal(s). Accept and give constructive feedback. Able to adjust own behaviour to reach the goals of the team.\n   \n   The University of Ottawa embraces diversity and inclusion in the workplace. We are passionate about our people and committed to employment equity. We foster a culture of respect, teamwork and inclusion, where collaboration, innovation, and creativity fuel our quest for research and teaching excellence. While all qualified persons are invited to apply, we welcome applications from qualified Indigenous persons, racialized persons, persons with disabilities, women and LGBTQIA2S+ persons. The University is committed to creating and maintaining an accessible, barrier-free work environment. The University is also committed to working with applicants with disabilities requesting accommodation during the recruitment, assessment and selection processes. Applicants with disabilities may contact hrtalentmanagement@uottawa.ca to communicate the accommodation need. All qualified candidates are encouraged to apply; however, Canadians and permanent residents will be given priority.\n   \n   Note: if this is a union position: The hiring process will be governed by the current collective agreement related to the union affiliation noted above; you can click \n  \n   here\n   to find out more.\n   \n   \n  If this is a front-line position with responsibilities to interact with students, selected candidates must be rated at the Low Advanced proficiency level or higher for both oral comprehension and reading comprehension in their second official language. The rating is determined by a proficiency test designed by the Official Languages and Bilingualism Institute.\n \n \n \n   Prior to May 1, 2022, the University required all students, faculty, staff, and visitors (including contractors) to be fully vaccinated against Covid-19 as defined in Policy 129 \u2013 Covid-19 Vaccination. This policy was suspended effective May 1, 2022 but may be reinstated at any point in the future depending on public health guidelines and the recommendations of experts."
}