{
    "id": "0f45a27170fa6bf1",
    "company": "Chartered Professional Accountants of Canada",
    "positionName": "Principal, Sustainability",
    "jobType": [
        "Full-time"
    ],
    "location": "Ottawa, ON",
    "salary": "$115,000\u2013$130,000 a year",
    "postingDateParsed": "2024-01-24T12:18:30.062Z",
    "url": "https://www.indeed.ca/rc/clk?jk=0f45a27170fa6bf1&from=jasx&tk=1hl5dm5j5kc37800&bb=oevkGIDXh7gG1VwZljrf74wpGp--zOfABFenpUfZcyIRzk-3N3QMU3BbySfA2w94fsQ7-R_CAs-P0d_cPeBFzFZ4MLA17mx4ZHqj2yXEHdO7kTbfawUXIA%3D%3D&xkcb=SoDd67M3FlTXbXRRp50CbzkdCdPP&vjs=3",
    "externalApplyLink": "https://workforcenow.adp.com/mascsr/default/mdf/recruitment/recruitment.html?cid=15dadf4b-f9d2-4ab9-8274-debc4bfdaa88&ccId=19000101_000001&jobId=518618&source=IN&lang=en_CA&ittk=EGIEAZW7QK",
    "job_info_group": {
        "extracted_phone_numbers": [],
        "extracted_links": [
            "HTTP/HTTPS Links",
            "General Links",
            "WWW Links",
            "TLDs"
        ],
        "extracted_emails": [
            "careers@cpacanada.ca"
        ],
        "extracted_location_data": [
            "CPA Canada",
            "Toronto",
            "Canada",
            "Ottawa",
            "Burnaby",
            "Montreal"
        ],
        "extracted_dates": [
            "2023",
            "8 to 10 years"
        ],
        "extracted_languages": [
            "English",
            "French"
        ],
        "extracted_laws": [],
        "extracted_norps": [],
        "extracted_orgs": [
            "CPA Canada's Standards Group",
            "International Public Sector Accounting Standards Board",
            "EFRAG",
            "Sustainability Standards",
            "the CSSB Participate",
            "e.g. ISSB",
            "financial, social and environmental considerations Commitment",
            "the International Sustainability Standards Board (ISSB",
            "The CSSB",
            "Serve",
            "the Canadian Sustainability Standards Board",
            "CSSB Prepare",
            "(CSSB",
            "GRI"
        ],
        "extracted_persons": [],
        "extracted_products": [
            "clear, concise and effective communication Pride",
            "Superior"
        ],
        "extracted_money": [
            {
                "amount": "$115k to $130k",
                "noun_phrases": []
            }
        ],
        "processed_text": "Chartered Professional Accountants Chartered Professional Accountants collaboratively provincial territorial bermudian cpa body represent canadian accounting profession nationally internationally . collaboration allow canadian profession champion good practice benefit business society prepare evolve operating environment feature unprecedented change . represent large national accounting body worldwide . form . alongside Canada's exist accounting assurance board liaise IPSASB . context seek Principal Sustainability . role report directly Vice President offer unique ground break shape future international sustainability standard . position offer flexibility remote traditional option base CPA Canada's office . periodic travel require . targeted base salary range position commensurate . role globally respect process root consultation consensus building public interest advance sustainability standard support quality accuracy resultant disclosure conduct market research inform proposal datum drive decision CSSB Establish position concept terminology affect scope application international domestic sustainability disclosure standard prepare draft response public consultation global standard setter behalf education outreach activity support capacity building sustainability disclosure identify cultivate strategic relationship key market participant contribute internal process improvement support smooth functioning report presentation material internal external ensure complex topic communicate plain language represent organization conference roundtable committee external forum support training development staff grow team seek preferred hold undergraduate graduate degree general business sustainability environmental study finance accounting relevant education credential . background supplement professional follow skill attribute apply passion advance societal environmental imperative standard setting Understanding global sustainability reporting initiative link core tenet standard development include consultation transparency accountability Client service mindset strong listening skill respect divergent view prove assess resolve issue creatively comfortable idea facilitate plan build consensus Solutions orient approach drive research analysis critical reasoning verbal write skill emphasis workmanship manage accountable complex project unwavere attention integrity deadline quality autonomously collaboratively departmental function understanding indigenous interest worldview live background indigenous study genuine willingness learn Chartered Professional Accountant cpa designation bilingualism consider strong asset . CPA inclusive place diverse workforce commitment health wellness employee . require accommodation recruitment process contact . organization offer flexible balanced environment allow individual maximize professional personal development . employ people headquarters regional office . technology enable culture design attract qualified people enable good . employee perk include competitive salary pension comprehensive benefit package professional development program flexible working hour regular social event successful employee volunteer program . CPA dedicate continual improvement build high perform innovative organization create stakeholder . organization create collaborative constructive culture \u2022 integrity \u2022 Fostering excellence \u2022 respect \u2022 working collaboratively \u2022 accountable cpa commit cultivate inclusive accessible environment employee feel respect support . qualified individual apply online . require relate accommodation participate recruitment process note application . happy meet ."
    },
    "companyDescription": "Chartered Professional Accountants of Canada (CPA Canada) is one of the largest national accounting organizations in the world and is a respected voice in the business, government, education and non-profit sectors. CPA Canada is a progressive and forward-thinking organization whose members bring a convergence of shared values, diverse business skills and exceptional talents to the accounting field. Domestically, CPA Canada works cooperatively with the provincial and territorial CPA bodies who are charged with regulating the profession. Globally, it works together with the International Federation of Accountants and the Global Accounting Alliance to build a stronger accounting profession worldwide. As one of the world\u2019s largest national accounting bodies, CPA Canada carries a strong influential voice and acts in the public interest.",
    "description": "About Chartered Professional Accountants of Canada\n            Chartered Professional Accountants of Canada (CPA Canada) works collaboratively with the provincial, territorial and Bermudian CPA bodies, as it represents the Canadian accounting profession, both nationally and internationally. This collaboration allows the Canadian profession to champion best practices that benefit business and society, as well as prepare its members for an ever-evolving operating environment featuring unprecedented change. Representing more than 220,000 members, CPA Canada is one of the largest national accounting bodies worldwide.\n           \n            About the opportunity\n            In 2023, the Canadian Sustainability Standards Board (CSSB) was formed. The CSSB works alongside Canada\u2019s existing accounting and assurance boards and liaises with the International Sustainability Standards Board (ISSB) and International Public Sector Accounting Standards Board (IPSASB). Within this context, CPA Canada\u2019s Standards Group seeks a Principal, Sustainability. This role, which reports directly to the Vice President, Sustainability Standards, offers a unique and ground-breaking opportunity to shape future international sustainability standards.\n            The position offers the flexibility of remote work or a more traditional work option based out of any of CPA Canada's offices in Montreal, Ottawa, Toronto or Burnaby. Periodic travel is required. The targeted base salary range for this position is $115k to $130k and is commensurate with experience.\n           \n            What you'll do\n            In this role, you will:\n           \n             Work within a globally-respected due process rooted in consultation and consensus-building\n             Serve the public interest by advancing sustainability standards and supporting the quality and accuracy of their resultant disclosures\n             Conduct market research to inform proposals and data-driven decisions of the CSSB\n             Establish positions on concepts and terminology affecting the scope and application of international and domestic sustainability disclosure standards\n             Prepare draft responses to public consultations of global standard setters on behalf of the CSSB\n             Participate in education/outreach activities to support capacity building in sustainability disclosure\n             Identify and cultivate strategic relationships with key market participants\n             Contribute to internal process improvement to support the smooth functioning of the CSSB\n             Prepare reports, presentations and other material for internal and external use, ensuring new or complex topics are communicated in plain language\n             Represent the organization at conferences, roundtables, committees and other external forums\n             Support the training and development of new staff members within a growing team\n           \n           \n            What we seek\n            The preferred candidate will hold an undergraduate or graduate degree in general business, sustainability, environmental studies, finance, accounting or other relevant education and credentials. This background will be supplemented by 8 to 10 years of professional experience in which the following skills and attributes have been applied:\n           \n             Passion for advancing societal and environmental imperatives through standard setting\n             Understanding of global sustainability reporting initiatives (e.g. ISSB, GRI, EFRAG) and an ability to link financial, social and environmental considerations\n             Commitment to the core tenets of standards development, including consultation, transparency and accountability\n             Client service mindset with strong listening skills, respect for divergent views and a proven ability to assess and resolve issues creatively; comfortable presenting ideas, facilitating plans and building consensus\n             Solutions-oriented approach driven by research, analysis and critical reasoning\n             Superior verbal and written skills with an emphasis on clear, concise and effective communication\n             Pride in workmanship; ability to manage and be accountable for complex projects with unwavering attention to integrity, deadlines and quality\n             Ability to work autonomously or collaboratively across departmental functions as needed\n             Understanding of Indigenous rights, interests and worldviews through lived experience or a background in Indigenous studies, or a genuine willingness to learn\n             A Chartered Professional Accountant (CPA) designation and bilingualism in French and English would be considered strong assets.\n           \n           \n            What it's like to work here\n            CPA Canada is an inclusive place to work with a diverse workforce and a commitment to health and wellness for its employees. Should you require accommodation during the recruitment process, please contact careers@cpacanada.ca. The organization offers a flexible and balanced environment that allows individuals to maximize professional and personal development. CPA Canada employs over 400 people, with its headquarters in Toronto and regional offices in Burnaby, Ottawa and Montreal. Our technology-enabled culture is designed to attract qualified people and enable them to do their best work. Employee perks include competitive salaries and pension, a comprehensive benefits package, professional development programs, flexible working hours and opportunities to work from home, regular social events and a successful employee volunteer program. CPA Canada is dedicated to continual improvement and building a high-performing, innovative organization that creates value for members and other stakeholders.\n           \n            Organization values  We create a collaborative and constructive culture by:  \u2022 Acting with Integrity \u2022 Fostering Excellence \u2022 Respecting Others \u2022 Working Collaboratively \u2022 Being Accountable\n            CPA Canada is committed to cultivating an inclusive, accessible environment, where each employee feels respected, valued and supported. All qualified individuals may apply online. If you require a disability-related accommodation to participate in our recruitment process, please note this in your application. We'll be happy to work with you to meet your needs."
}