{
    "id": "f384525c3f763df5",
    "company": "National Capital Commission",
    "positionName": "INTERMEDIATE PROGRAMMER / ANALYST",
    "jobType": [],
    "location": "40 Elgin St Suite 202, Ottawa, ON",
    "salary": null,
    "postingDateParsed": "2024-01-16T05:14:23.936Z",
    "url": "https://www.indeed.ca/rc/clk?jk=f384525c3f763df5&from=jasx&tk=1hkikl12lhalc800&bb=Rsh5TE0HTVZ9QJn0sYd8Qne6epIbefztxGJTI9OCIlUT_E9mqteNyvF8lYdQmmQ2_GUbHFr1rwjwXP8TNsYgV0Y7MmSg1bBu4YC3p1WoM1IItGhaJxrJ1g%3D%3D&xkcb=SoAp67M3FShb_tAdOz0HbzkdCdPP&vjs=3",
    "externalApplyLink": "https://tre.tbe.taleo.net/tre01/ats/careers/v2/viewRequisition?org=DNQV4N&cws=37&rid=575",
    "job_info_group": {
        "extracted_phone_numbers": [
            "(613) 239-5090",
            " (613) 239-5090",
            "1-866-661-3530",
            "866-661-3530"
        ],
        "extracted_links": [
            "HTTP/HTTPS Links",
            "General Links",
            "WWW Links",
            "TLDs"
        ],
        "extracted_emails": [
            "hr.recruitment@ncc-ccn.ca"
        ],
        "extracted_location_data": [
            "Ontario",
            "US",
            "Ottawa",
            "the Capital Region"
        ],
        "extracted_dates": [
            "Year after year",
            "2012",
            "more than a century",
            "2) days per week"
        ],
        "extracted_languages": [],
        "extracted_laws": [],
        "extracted_norps": [
            "all Canadians"
        ],
        "extracted_orgs": [
            "COMPETENCIES Demonstrating Integrity and Respect Civility",
            "Data Management",
            "(OLTP",
            "Structured Query Language Server Reporting Services",
            "Microsoft Customer Relationship Management",
            "the Public Service Employment Act",
            "PeopleSoft",
            "the NCC",
            "MS Windows",
            "Power Business Intelligence",
            "Information Technology",
            "Microsoft Dynamics AX (Enterprise Resource Planning",
            "TTY",
            "The National Capital Commission",
            "The NCC",
            "NCC",
            "the National Capital Region"
        ],
        "extracted_persons": [
            "Tableau"
        ],
        "extracted_products": [
            "a R\u00c9-05"
        ],
        "extracted_money": [
            {
                "amount": "$68,641 to $91,072",
                "noun_phrases": []
            },
            {
                "amount": "68,641",
                "noun_phrases": []
            },
            {
                "amount": "91,072",
                "noun_phrases": []
            }
        ],
        "processed_text": "Level salary review closing intermediate programmer analyst Corporate Services Branch Intermediate Programmer Analyst indeterminate position . position classify annum . salary review . federal Crown corporation dedicate ensure Canada's capital dynamic inspiring source pride legacy generation . build provide unique fulfil specific role long term planner federal land principal steward nationally public place creative partner commit excellence development conservation . recognize National Capital Region's employer . NCC employee deploy department separate agency . list qualified people compile additional temporary indeterminate position . overview report Team Leader responsible analysis design development quality assurance implementation support service reporting Business Intelligence Business Intelligence solution include manage datum warehouse application software . require blend business analysis business process knowledge combine strong structured query language structure Query Language scripting troubleshooting programming technical analytical skill . provide technical advice application assistance deliver training session technical colleague user solution . ESSENTIAL qualification education degree recognize post secondary institution field discipline position . follow area structured Query Language Server Structured Query Language Server Integration Services write complex structured Query Language Sharp script designing develop datum analytic report tool Structured Query Language Server Analysis Services . KNOWLEDGE Online Transaction Processing relational database Online Analytical Processing OLAP Enterprise Data Warehouse design development administration database security concept web desktop development concept programming language business analysis process . analyze troubleshoot resolve complex programming technical issue client define document user requirement follow appropriate structured programming methodology deliver solution write maintain technical documentation architecture design report specification system configuration user guide . thing innovate analysis idea . effectively \u2013 Relationships Trust Building . Initiative action orient \u2013 thing . ASSETS Knowledge DAX Data Analysis Expressions library function Knowledge Power Query language knowledge corporate application Knowledge Visio tool Entity Relationship Diagram design system architecture design application design case scenario documentation knowledge development web service Representational State Transfer api knowledge field financial operation asset management general business administration . condition EMPLOYMENT Possess eligible secret security clearance . linguistic profile BBB Position . person select position reside commutable distance workplace offer hybrid flexible environment employee currently site . committed establish maintain representative workforce . qualified applicant declare visible minority group indigenous people person woman select appointment fulfill organizational . committed develop inclusive barrier free selection process environment . contact regard competition advise Human Resources representative accommodation measure enable assess fair equitable manner . require additional information position technical difficulty contact . hear impaired speech impaired person contact Teletype Device toll free . note select contact ."
    },
    "companyDescription": "",
    "description": "Job Level: RE-05 $68,641 to $91,072 (salary under review) \n      Closing Date: 04/02/24\n      \n      \n      INTERMEDIATE PROGRAMMER / ANALYST \n      The Corporate Services Branch is looking for an Intermediate Programmer / Analyst for an indeterminate position. The position is classified as a R\u00c9-05 ($68,641 to $91,072 per annum). Salary under review.\n      \n      \n      ABOUT US \n      The National Capital Commission (NCC) is the federal Crown corporation dedicated to ensuring that Canada\u2019s Capital is a dynamic and inspiring source of pride for all Canadians and a legacy for generations to come. Building on more than a century of experience, the NCC provides unique value in the Capital Region by fulfilling three specific roles: long-term planner of federal lands, principal steward of nationally significant public places, and creative partner committed to excellence in development and conservation. \n      Year after year, the NCC has been recognized as one of National Capital Region\u2019s top employers. NCC employees can deploy to departments and separate agencies in accordance with the Public Service Employment Act.\n      \n      \n     \n      A list of qualified people will be compiled and may be used for additional temporary or indeterminate positions.\n       JOB OVERVIEW Reporting to the Team Leader, Data Management, you will be responsible for the analysis, design, development, quality assurance, implementation, and support services for reporting/ Business Intelligence (BI) solutions, including managing the data warehouse and application software. This job requires a blend of business analysis and business processes knowledge, combined with strong structured query language (SQL) scripting, troubleshooting, programming, technical and analytical skills. You will provide technical advice, application assistance and deliver training sessions to technical colleagues as well as the users of new IT solutions.\n       ESSENTIAL QUALIFICATIONS: EDUCATION A degree from a recognized post-secondary institution in the field of Information Technology or in a related discipline to the position. \n     \n       EXPERIENCE\n       Three (3) to five (5) years of experience in each of the following areas:\n       \n      \n       Working with SQL Server 2012 (or newer), SQL Server Reporting Services and SQL Server Integration Services;\n       Writing complex SQL and C# (C Sharp) scripts;\n       Designing and developing data analytics reports using tools such as Power BI, Tableau or SQL Server Analysis Services.\n      \n      \n     \n       KNOWLEDGE\n       \n      \n       Of Online Transaction Processing (OLTP) Relational Databases and Online Analytical Processing (OLAP) Enterprise Data Warehouse design, development and administration;\n       Of database security concepts;\n       Of web and desktop (MS Windows) development concepts and programming languages;\n       Of business analysis and processes.\n      \n      \n     \n       ABILITIES\n       \n      \n       To analyze, troubleshoot and resolve complex programming and technical issues;\n       To work with clients to define and document user requirements;\n       To follow appropriate and structured programming methodology for delivering solutions;\n       To write, maintain and present technical documentation such as architecture designs, reports, specifications, system configurations and user guides\n      \n      \n     \n       COMPETENCIES\n       \n      \n       Demonstrating Integrity and Respect Civility and Well-Being.\n       Thinking things through - Innovating through analysis and ideas.\n       Working Effectively with Others \u2013 Relationships and Trust Building.\n       Showing Initiative and Being Action-Oriented \u2013 Getting Things Done.\n      \n      \n     \n       ASSETS\n       \n      \n       Knowledge of the DAX (Data Analysis Expressions) library of functions;\n       Knowledge of Power Query / M language;\n       Knowledge of corporate applications such as Microsoft Dynamics AX (ERP), Microsoft CRM and PeopleSoft;\n       Knowledge of Visio or other tools for Entity Relationship Diagram design, system architecture design, application design and use case scenarios documentation;\n       Knowledge in the use and development of Web services, REST APIs;\n       Knowledge and experience in the field of financial operations, asset management and general business administration.\n      \n      \n     \n       CONDITIONS OF EMPLOYMENT\n       \n      \n       Possess or eligible to obtain Secret security clearance.\n       Linguistic profile: Bilingual BBB;\n       Position is in the National Capital Region. The person selected for this position must reside within a commutable distance from the workplace at 40 Elgin Street, Ottawa, Ontario;\n       The National Capital Commission offers a hybrid and flexible work environment, all employees are currently asked to work on-site at least two (2) days per week.\n      \n     \n    \n   \n    \n    \n   \n \n \n \n  \n   \n    \n     The NCC is committed to establishing and maintaining a representative workforce. Qualified applicants who self-declare as members of a visible minority group, Indigenous peoples, persons with disabilities and/or women may be selected for appointment to fulfill organizational needs. \n      The NCC is also committed to developing inclusive, barrier-free selection processes and work environments. If contacted regarding this competition, please advise the Human Resources representative of the accommodation measures which must be taken to enable you to be assessed in a fair and equitable manner. If you require additional information on the position or if you are experiencing technical difficulties, please contact us at hr.recruitment@ncc-ccn.ca. \n      Hearing impaired and speech impaired persons can contact us through a Teletype Device (TTY) at (613) 239-5090 or 1-866-661-3530 (toll free). \n      Please take note that only selected candidates will be contacted."
}