{
    "id": "6e817a87bb9c1e05",
    "company": "The Anglican Diocese of Ottawa",
    "positionName": "Parish Administrator",
    "jobType": [
        "Part-time"
    ],
    "location": "125 Mackay St, Ottawa, ON",
    "salary": null,
    "postingDateParsed": "2024-01-09T03:10:22.681Z",
    "url": "https://www.indeed.ca/rc/clk?jk=6e817a87bb9c1e05&from=jasx&tk=1hjm3501uhbi2800&vjs=3",
    "externalApplyLink": null,
    "job_info_group": {
        "extracted_phone_numbers": [],
        "extracted_links": [
            "HTTP/HTTPS Links",
            "General Links",
            "WWW Links",
            "TLDs"
        ],
        "extracted_emails": [
            "hr@ottawa.anglican.ca"
        ],
        "extracted_location_data": [
            "Ontario",
            "Canada",
            "Ottawa"
        ],
        "extracted_dates": [
            "Monday",
            "1866",
            "January 26, 2024",
            "Monday to Friday",
            "1868",
            "January 2024",
            "daily"
        ],
        "extracted_languages": [],
        "extracted_laws": [],
        "extracted_norps": [
            "French"
        ],
        "extracted_orgs": [
            "St. Bartholomew's Anglican Church",
            "the Accessibility for Ontarians with Disabilities Act",
            "a faith-based working environment Perks & Benefits",
            "the Ontario Human Rights Code",
            "the Anglican Diocese of Ottawa",
            "Our Historic Church",
            "Taxable Receipts",
            "The Anglican Diocese of Ottawa"
        ],
        "extracted_persons": [
            "Parish Priest"
        ],
        "extracted_products": [
            "Excel"
        ],
        "extracted_money": [
            {
                "amount": "$24 - $27",
                "noun_phrases": []
            },
            {
                "amount": "24.00-$27.00",
                "noun_phrases": []
            }
        ],
        "processed_text": "join Key Operational Community Engagement role landmark history architecture invite central figure parish operation community engagement . building complete church stand Edinburgh neighbourhood opposite . hold special place guard' Chapel regimental chapel Governor General's Foot Guards . history closely interweave story mark significance nation's heritage . role Parish Administrator key daily church operation face . role pivotal manage administrative task oversee maintenance historic space include venue sharing strategy . activity associate position achieve manner consistent mission ministry . position report Incumbent Churchwardens . key responsibility primary contact parish manage communication channel warm welcoming demeanour . ensure efficient operation church office include supply procurement equipment management file management worship material preparation . coordinate building maintenance church rectory manage church calendar schedule activity smooth functioning . handle office concern professionally record register . manage parish website rental agreement booking billing . oversee space usage church maintain high standard engage potential client . collaborate warden clergy rental policy include rate setting operation requirement . record donation church eligible issue receipt . handle invoice prepare requisition prepare cheque transfer signature . profile proficient MS Word publisher website content management skill space booking management software . strong administration organization communication keen attention detail . background facility property management relevant education . capable multitaske dynamic environment independently team . email marketing customer service client relation beneficial . commit confidentiality adhere parish policy . comfortable competitive hourly rate . define benefit pension plan generous employer contribution . extended Health Dental benefit collaborative diverse innovative environment . schedule position person week Project Manager . apply apply click apply position submit application . employment commence depend availability . review application delay application gratefully receive individual select consideration contact . reserve contact individual arrange interview . organization commit create diverse environment equal employer . qualified applicant receive consideration employment regard race colour religion gender gender identity expression sexual orientation national origin genetic age veteran status . accommodate applicant AODA . advise search process require accommodation contact type salary hour week benefit company pension Dental care insurance extended health care Paid require Schedule Friday Location person"
    },
    "companyDescription": "",
    "description": "Join Our Historic Church in a Key Operational and Community Engagement Role\nAbout Us: St. Bartholomew's Anglican Church, a landmark of history and architecture in Ottawa, Ontario, Canada, invites you to become a central figure in our parish operations and community engagement. Founded in 1866 with a building completed in 1868, our church stands at 125 MacKay Street in the New Edinburgh neighbourhood, opposite Rideau Hall. We hold a special place as the \u201cGuards\u2019 Chapel,\u201d being the regimental chapel of the Governor General's Foot Guards. Our history is closely interwoven with the story of Canada, marking our significance in the nation\u2019s heritage.\nYour Role: As the Parish Administrator, you are a key part of our daily church operations and the face of St. Bartholomew's. This role is pivotal not only in managing the day-to-day administrative tasks but also in overseeing the use and maintenance of our historic space, which includes our venue sharing strategy. All activities associated with this position must be achieved in a manner consistent with the mission and ministry of the Anglican Diocese of Ottawa. The position reports to the Incumbent (Parish Priest) and Churchwardens.\nKey Responsibilities:\n\n Be the primary contact for the parish, managing communication through various channels with a warm and welcoming demeanour.\n Ensure efficient operations of the church office, including supply procurement, equipment management, file management, and worship material preparation. Coordinate building maintenance for both church and rectory, manage the church calendar, and schedule activities for smooth functioning.\n Handle office concerns professionally, keeping records and registers up to date.\n Manage the parish website, rental agreements, bookings, and billing.\n Oversee space usage within the church, maintaining high standards and engaging with potential clients.\n Collaborate with wardens and clergy on rental policies, including rate setting and daily operations, along with other requirements.\n Record all donations to the church which are eligible for Taxable Receipts and issue receipts. Handle invoices, prepare requisitions and prepare cheques or e-transfers for signature.\n\nYour Profile:\n\n Proficient in MS Word, Excel, Publisher and website content management, with skills in space booking and management software.\n Strong in administration, organization, and communication, with keen attention to detail.\n Background in facility or property management, or relevant experience and education.\n Capable of multitasking in a dynamic environment, both independently and in a team.\n Experience with email marketing, customer service, or client relations is beneficial.\n Committed to confidentiality and adhering to parish policies.\n Comfortable in a faith-based working environment\n\nPerks & Benefits:\n\n Competitive hourly rate of $24 - $27.\n Defined benefit pension plan with generous employer contribution.\n Extended Health and Dental benefits\n Part of a collaborative, diverse, and innovative work environment.\n\nWork Schedule:\n\n This position is an in-person part-time, 25 hours per week, Monday to Friday from 8:30 AM to 2:00 PM.\n\nDon't just apply for a job, apply for a cause! Click on \"Apply for This Position\" on or before January 26, 2024 and submit your application.\nEmployment can commence January 2024 depending on availability. We'll be reviewing applications as they come in, so don't delay!\nWhile all applications will be gratefully received, only individuals selected for further consideration will be contacted. The Anglican Diocese of Ottawa reserves the right to contact individuals and to arrange for interviews at any time.\nOur organization is committed to creating a diverse environment and is proud to be an equal-opportunity employer. All qualified applicants will receive consideration for employment without regard to race, colour, religion, gender, gender identity or expression, sexual orientation, national origin, genetics, age, veteran status, or disability. We will accommodate the needs of applicants under the Ontario Human Rights Code and the Accessibility for Ontarians with Disabilities Act (AODA). Please advise during the search process if you require accommodation by contacting us at hr@ottawa.anglican.ca\nJob Type: Part-time\nSalary: $24.00-$27.00 per hour\nExpected hours: 25 per week\nBenefits:\n\n Company pension\n Dental care\n Disability insurance\n Extended health care\n Paid time off\n\nFlexible Language Requirement:\n\n French not required\n\nSchedule:\n\n Monday to Friday\n\nWork Location: In person"
}