{
    "id": "59d9eb1b9eb1326d",
    "company": "CHEO RESEARCH INSTITUTE",
    "positionName": "RI-23-048 Research Assistant",
    "jobType": [],
    "location": "401 Smyth Road, Ottawa, ON",
    "salary": null,
    "postingDateParsed": "2023-09-13T22:42:26.013Z",
    "url": "https://www.indeed.ca/rc/clk?jk=59d9eb1b9eb1326d&from=jasx&tk=1hb2v5rcfk7vv800&vjs=3",
    "externalApplyLink": null,
    "job_info_group": {
        "extracted_phone_numbers": [],
        "extracted_links": [
            "HTTP/HTTPS Links",
            "General Links",
            "WWW Links",
            "TLDs"
        ],
        "extracted_emails": [
            "sbigford@cheo.on.ca",
            "researchhr@cheo.on.ca"
        ],
        "extracted_location_data": [
            "l'exp\u00e9rience",
            "au Canada",
            "Canada",
            "dans d'autres",
            "Ottawa"
        ],
        "extracted_dates": [
            "septembre 2023",
            "September 13, 2023 to September 27",
            "1 year",
            "jusqu'au 30 septembre 2024",
            "September 30, 2024"
        ],
        "extracted_languages": [],
        "extracted_laws": [],
        "extracted_norps": [
            "English/French"
        ],
        "extracted_orgs": [
            "Development and Rehabilitation",
            "notation et codage des donn\u00e9es de recherche Participation \u00e0 la conception de bases de donn\u00e9es et tenue des bases de donn\u00e9es et du dictionnaire de donn\u00e9es Saisie",
            "le processus d'embauche",
            "Police Record Check",
            "source de soutien dans notre collectivit\u00e9",
            "l'\u00e9quipe de recherche dans les activit\u00e9s quotidiennes li\u00e9es au d\u00e9roulement de la recherche",
            "un domaine li\u00e9 \u00e0 la sant\u00e9",
            "CHEORI",
            "possibilit\u00e9 de prolongement SALAIRE",
            "la cr\u00e9ation et le",
            "d'une assistante de recherche.",
            "de la recherche",
            "D\u00e9veloppement et r\u00e9adaptation",
            "ON K1H 8L1",
            "Human Resources",
            "recherche clinique (Pr\u00e9f\u00e9rable)",
            "Effectuer le travail conform\u00e9ment aux dispositions de la Loi sur la sant\u00e9 et la s\u00e9curit\u00e9 au travail et de son r\u00e8glement d'application",
            "CHEO RI's Universal COVID-19 Vaccination Policy",
            "accro\u00eetre l'\u00e9quit\u00e9, la diversit\u00e9 et l'inclusion dans",
            "a complete Curriculum Vitae",
            "la recherche",
            "li\u00e9es \u00e0 la recherche",
            "et de nouvelles preuves pour soutenir CHEO dans sa",
            "L'Institut de recherche du Centre",
            "an asset (Preferred) WORKING CONDITIONS Clinic",
            "handicap\u00e9es de l'Ontario \u00e0 l'adresse",
            "Development and Rehabilitation Children's Hospital of",
            "r\u00e9gissant la recherche clinique",
            "Eastern Ontario Research Institute",
            "Microsoft Office",
            "cr\u00e9er de nouvelles connaissances",
            "L'Institut de recherche de CHEO cherche \u00e0",
            "POSTE",
            "proc\u00e9dures de l'entreprise et des services de CHEO",
            "\u00e0 la Loi sur l'accessibilit\u00e9 pour les",
            "du Centre",
            "de recherche Programme de la douleur chronique, D\u00e9veloppement et r\u00e9adaptation",
            "l'Institut de recherche de CHEO",
            "un",
            "The CHEO Research Institute",
            "EPTC-2",
            "Comit\u00e9 d'\u00e9thique de la recherche (",
            "ETP",
            "CHEO RI",
            "un mod\u00e8le de",
            "Ottawa Children's Treatment Centre",
            "Personal Health Information Protection Act",
            "Aider dans le cas des",
            "the University of Ottawa",
            "les pr\u00e9sentations Recrutement des patients",
            "the Occupational Health and Safety Act and Regulations",
            "the Children's Hospital of Eastern Ontario",
            "\u00eatre une",
            "la poursuite de recherches qui ont une",
            "Bachelor of Science or Social Science Degree",
            "milieu clinique \u00e0 l'h\u00f4pital",
            "notation et codage des donn\u00e9es de recherche Aider, le cas \u00e9ch\u00e9ant"
        ],
        "extracted_persons": [
            "L'IR de CHEO",
            "Tenue d'un inventaire des mesures de recherche et de la transmission de l'information au pr\u00e9parateur de commandes Collecte",
            "Loi sur la",
            "AUTRES EXIGENCES \u00catre autoris\u00e9 \u00e0 travailler au Canada",
            "connexe",
            "avec les enfants",
            "courriel un Curriculum Vitae",
            "DUR\u00c9E",
            "sommes heureux de recevoir des demandes",
            "les personnes handicap\u00e9es",
            "orientation sexuelle ou une",
            "les personnes ayant une",
            "; V\u00e9rification du casier judiciaire",
            "jeune et famille de notre collectivit\u00e9 et ailleurs",
            "enfants de l'est de l'Ontario",
            "Mener des entrevues de base",
            "No d'affichage RI-23-048 P\u00e9riode d'affichage",
            "de pr\u00e9f\u00e9rence",
            "Sarah Bigford",
            ", y compris la v\u00e9rification et l'obtention de consentements \u00e9clair\u00e9s ainsi que le traitement des \u00e9chantillons de laboratoire PRINCIPALES RESPONSABILIT\u00c9S Sous la supervision g\u00e9n\u00e9rale du gestionnaire",
            "L'Institut de recherche du CHEO valorise la diversit\u00e9 et est un employeur qui souscrit au principe d'\u00e9galit\u00e9 d'acc\u00e8s",
            "lettre d'accompagnement \u00e0",
            "L'IR de CHEO travaille pour"
        ],
        "extracted_products": [],
        "extracted_money": [
            {
                "amount": "17.50",
                "noun_phrases": []
            }
        ],
        "processed_text": "description post ri Posting Period \u2013 position Research Assistant Chronic Pain Program Development Rehabilitation TERM Contract FTE possibility extension salary commensurate skill report Manager CHEO RI research arm \u2013 CHEO affiliated institute . CHEO beloved institution workplace recognize anchor community . create knowledge evidence support CHEO provision class care child . mission connect exceptional talent technology pursuit life change research child youth family community . requirement Research Assistant . Clinical Research Assistant assist research team activity involve conduct research include limit creation maintenance research file accord study guideline collection scoring coding research information patient recruitment include screen informed consent processing lab sample . MAIN responsibility general supervision Manager Research Assistant assist REB grant submission update submission assist creation modification slide presentation responsible patient recruitment include screen informed consent responsible creation maintenance research file accord study guideline Good Clinical Practice Guidelines responsible inventory research measure relay information order agent responsible collection scoring coding research information . assist database design responsible maintenance database datum dictionary responsible data entry datum integrity identify child family eligible recruit study Conduct baseline interview Collect follow datum create maintain research project file responsible collection scoring coding research information Assist administrative duty relate ongoing research perform provision cheo corporate departmental policy procedure relate OccupationalHealth Safety perform relate duty assign supervisor qualification SKILL ABILITIES University undergraduate degree health relate field preferably psychology neuroscience field Essential minimum clinical research preferred understanding research design procedure guideline standard govern clinical research include Essential Data management preferred proficiency computer skill essential excellent communication verbal write interpersonal organizational skill essential demonstrate collegiality professionalism team skill Essential demonstrate initiative flexibility independently essential Good Clinical Practice TPCS certification preferred Bilingualism set hospital exposure child parent caregiver . flexibility remotely hybrid model include remote site . requirement eligible compliance . apply send cover letter email . diversity equal employer . committed provide inclusive barrier free environment start hiring process interest qualified applicant . applicant require accommodation application process Accessibility Ontarians Disabilities notify . seek increase equity diversity inclusion activity include research education career development patient family donor partnership . diverse traditional career path perspective skill resilience collaboration relationship building . application racialized minority indigenous people person person minority sexual orientation gender identity skill knowledge productively engage diverse community . application consider eligible . applicant interest invite interview contact . description POSTE \u2013 du au Assistant assistante Contrat temps partiel avec salaire sera proportionnel aux competences RELEVE Gestionnaire hospitalier pour \u00ab IR CHEO \u00bb est l'organisme recherche du Centre traitement pour enfant hospitalier pour enfant l'est l'Ontario situe \u00ab CHEO \u00bb institut affilie l'Universite d'Ottawa . CHEO est une institution milieu travail nous cherisson est largement reconnu pour . prestation soins classe mondiale enfant . Notre mission est reunir des technology des talent exceptionnel dans incidence sur vie chaque enfant . immediatement besoin d'un assistant L'assistant l'assistante recherche clinique aidera compris sans s'y limiter maintien des dossiers recherche conformement aux directive l'etude collecte notation codage des donnees recherche recrutement des patient titulaire sera responsable des activites suivantes presentations au CER des presentations vue l'obtention subvention ainsi des mise jour ces presentations cas echeant Aider creation modification des diapositives pour compris verification l'obtention des consentements eclaires Creation tenue jour des dossiers recherche conformement aux lignes directrices l'etude lignes directrice des bonnes pratiques cliniques integrite des donnees Identification des enfant leurs familles sont admissible au recrutement pour l'etude taches administratives cour ainsi toute les politiques relative sante securite au travail . Effectuer d'autres tache connexe attribuees par superviseur . qualification COMPETENCES CAPACITES Diplome universitaire premier cycle dans tel qu'un baccalaureat sciences science sociale psychologie neuroscience dans domaine Essentiel Minimum d'experience Comprehension conception des procedure des lignes directrice des normes compris protection des renseignement personnel sur sante Essentiel gestion donnees Preferable Maitrise des competences informatique Essentiel Excellentes aptitude communication verbale ecrite aux relation interpersonnelle l'organisation Essentiel Collegialite professionnalisme esprit d'equipe averes Essentiel Esprit d'initiative flexibilite capacite travailler maniere independante Essentiel Certifications BPC bilinguisme anglais francais est atout condition travail travail contact leurs parent avec les aidant . flexibilite pour travailler distance dans travail hybride inclut fois travail distance travail sur place . Respect politique vaccination universelle contre COVID l'IR CHEO . POUR POSTULER Veuillez envoyer par complet une l'adresse suivante . . Nous sommes resolus fournir environnement travail inclusif sans obstacle commencant par nous provenant tous les candidats competent . Les candidats les auront besoin mesures d'adaptation durant processus demande dthemploi sont pries d'envoyer courriel aux Ressources humaines conformement personnes suivante . toutes ses activites compris l'education l'avancement professionnel les partenariat avec les patient les familles les donateur . nous valorison les parcour les perspectives carriere diversifies traditionnel ainsi les competences telles resilience collaboration l'etablissement relation . nous inviton les membres minorites racisees peuple autochtone identite genre minoritaire toute autre personne ayant les competences connaissances necessaires presenter leur demande afin s'engager maniere productive aupres diverses communautes . Seules les candidature des personnes autorisees travailler seront prise consideration . nous remercion tous les candidats leur interet cependant nous ne communiquerons qu'avec ceux seront convoques une entrevue . type salary hour education Bachelor's Degree require location hybrid remote"
    },
    "companyDescription": "",
    "description": "JOB DESCRIPTION Posting # RI-23-048\nPosting Period \u2013 September 13, 2023 to September 27, 2023\nPOSITION: Research Assistant\nChronic Pain Program, Development and Rehabilitation\nTERM: Part-time Contract (0.4 FTE); until September 30, 2024 with possibility of extension\nSALARY: Will be commensurate with skills and experience\nREPORTS TO: Manager, Development and Rehabilitation\nChildren\u2019s Hospital of Eastern Ontario Research Institute (\u201cCHEO RI\u201d) is the research arm of the Children\u2019s Hospital of Eastern Ontario \u2013 Ottawa Children\u2019s Treatment Centre (\u201cCHEO\u201d) and an affiliated institute of the University of Ottawa. CHEO is a beloved institution and workplace that is widely recognized for being an anchor in our community. CHEO RI works to create new knowledge and evidence to support CHEO in its provision of world-class care to our children. Our mission at CHEORI is to connect exceptional talent and technology in pursuit of life-changing research for every child, youth and family in our community and beyond.\nCHEO RI has an immediate requirement for a Research Assistant.\nThe Clinical Research Assistant will assist the research team in the day-to-day activities involved in the conduct of research including, but not limited to, the creation and maintenance of research files according to study guidelines, the collection, scoring and coding of research information, patient recruitment including screening and obtaining informed consents, processing of lab samples.\nMAIN RESPONSIBILITIES\nUnder the general supervision of the Manager, Development and Rehabilitation, the Research Assistant will:\n\n Assist with REB and/or grant submissions and updates to those submissions as needed\n Assist with creation and/or modification of slides for presentations\n Be responsible for patient recruitment including screening and obtaining informed consents\n Be responsible for the creation and maintenance of research files according to study guidelines (Good Clinical Practice Guidelines)\n Be responsible for keeping an inventory of research measures and relaying information to the ordering agent\n Be responsible for the collection, scoring, and coding of research information.\n Will assist in the database design and be responsible for the maintenance of the databases and the data dictionary\n Be responsible for data entry and data integrity\n Identifying children and their families eligible to be recruited to the study\n Conduct baseline interviews\n Collect follow up data\n Create and maintain research and project files\n Be responsible for the collection, scoring, and coding of research information\n Assist as needed with other administrative duties related to ongoing research\n Perform work in accordance with the provisions of the Occupational Health and Safety Act and Regulations and all CHEO corporate/departmental policies and procedures related to OccupationalHealth and Safety\n Perform other related duties as assigned by supervisor\n\nQUALIFICATIONS, SKILL AND ABILITIES\n\n University undergraduate degree in a health-related field such as Bachelor of Science or Social Science Degree, preferably in psychology, neuroscience , or related field (Essential)\n Minimum 1 year of clinical research experience (Preferred)\n Understanding of research design, procedures, guidelines and standards governing clinical research including Personal Health Information Protection Act (Essential)\n Data management experience (REDCap) (Preferred)\n Proficiency in computer skills (Microsoft Office) (Essential)\n Excellent communication (verbal and written), interpersonal and organizational skills (Essential)\n Demonstrated collegiality, professionalism and team skills (Essential)\n Demonstrated initiative, flexibility, and ability to work independently (Essential)\n GCP, TPCS-2, certifications (Preferred)\n Bilingualism (English/French) is an asset (Preferred)\n\nWORKING CONDITIONS\n\n Clinic setting work within hospital; exposure to children and parents and/or caregivers.\n Flexibility to work remotely in a hybrid work model that would include both remote work and on-site work.\n\nOTHER REQUIREMENTS\n\n Eligible to work in Canada;\n Compliance with CHEO RI\u2019s Universal COVID-19 Vaccination Policy; and\n Police Record Check.\n\nTO APPLY\nPlease send a complete CV and cover letter to Sarah Bigford, by email to: sbigford@cheo.on.ca.\nThe CHEO Research Institute values diversity and is an equal opportunity employer. We are committed to providing an inclusive and barrier-free work environment, starting with the hiring process and welcome interest from all qualified applicants. Should an applicant require any accommodations during the application process, as per the Accessibility for Ontarians with Disabilities Act, please notify Human Resources at researchhr@cheo.on.ca.\nThe CHEO Research Institute seeks to increase equity, diversity and inclusion in all of its activities, including research, education and career development, patient, family and donor partnerships. We value diverse and non-traditional career paths and perspectives, and value skills such as resilience, collaboration, and relationship-building. We welcome applications from members of racialized minorities, Indigenous peoples, persons with disabilities, persons of minority sexual orientations and gender identities, and others with the skills and knowledge to productively engage with diverse communities.\nApplications will only be considered from those that are eligible to work in Canada. We thank all applicants for their interest, however, only those invited for an interview will be contacted.\nDESCRIPTION DE POSTE No d\u2019affichage RI-23-048\nP\u00e9riode d\u2019affichage \u2013 du 13 au 27 septembre 2023\nPOSTE : Assistant ou assistante de recherche\nProgramme de la douleur chronique, D\u00e9veloppement et r\u00e9adaptation\nDUR\u00c9E : Contrat \u00e0 temps partiel (0,4 ETP); jusqu\u2019au 30 septembre 2024 avec possibilit\u00e9 de prolongement\nSALAIRE : Le salaire sera proportionnel aux comp\u00e9tences et \u00e0 l\u2019exp\u00e9rience\nREL\u00c8VE DE : Gestionnaire, D\u00e9veloppement et r\u00e9adaptation\nL\u2019Institut de recherche du Centre hospitalier pour enfants de l\u2019est de l\u2019Ontario (\u00ab\u2009IR de CHEO\u2009\u00bb) est l\u2019organisme de recherche du Centre de traitement pour enfants du Centre hospitalier pour enfants de l\u2019est de l\u2019Ontario situ\u00e9 \u00e0 Ottawa (\u00ab\u2009CHEO\u2009\u00bb) et un institut affili\u00e9 de l\u2019Universit\u00e9 d\u2019Ottawa. CHEO est une institution et un milieu de travail que nous ch\u00e9rissons et qui est largement reconnu pour \u00eatre une source de soutien dans notre collectivit\u00e9. L\u2019IR de CHEO travaille pour cr\u00e9er de nouvelles connaissances et de nouvelles preuves pour soutenir CHEO dans sa prestation de soins de classe mondiale \u00e0 nos enfants. Notre mission, \u00e0 l\u2019Institut de recherche de CHEO, est de r\u00e9unir des technologies et des talents exceptionnels dans la poursuite de recherches qui ont une incidence sur la vie de chaque enfant, jeune et famille de notre collectivit\u00e9 et ailleurs.\nL\u2019IR de CHEO a imm\u00e9diatement besoin d\u2019un assistant ou d\u2019une assistante de recherche.\nL\u2019assistant ou l\u2019assistante de recherche clinique aidera l\u2019\u00e9quipe de recherche dans les activit\u00e9s quotidiennes li\u00e9es au d\u00e9roulement de la recherche, y compris sans s\u2019y limiter, la cr\u00e9ation et le maintien des dossiers de recherche conform\u00e9ment aux directives de l\u2019\u00e9tude, la collecte, la notation et le codage des donn\u00e9es de recherche et le recrutement des patients, y compris la v\u00e9rification et l\u2019obtention de consentements \u00e9clair\u00e9s ainsi que le traitement des \u00e9chantillons de laboratoire\nPRINCIPALES RESPONSABILIT\u00c9S\nSous la supervision g\u00e9n\u00e9rale du gestionnaire, D\u00e9veloppement et r\u00e9adaptation, le ou la titulaire sera responsable des activit\u00e9s suivantes :\n\n Aider dans le cas des pr\u00e9sentations au Comit\u00e9 d\u2019\u00e9thique de la recherche (CER) ou des pr\u00e9sentations en vue de l\u2019obtention de subventions ainsi que des mises \u00e0 jour de ces pr\u00e9sentations, le cas \u00e9ch\u00e9ant\n Aider \u00e0 la cr\u00e9ation ou \u00e0 la modification des diapositives pour les pr\u00e9sentations\n Recrutement des patients, y compris de la v\u00e9rification et de l\u2019obtention des consentements \u00e9clair\u00e9s\n Cr\u00e9ation et tenue \u00e0 jour des dossiers de recherche conform\u00e9ment aux lignes directrices de l\u2019\u00e9tude (lignes directrices des bonnes pratiques cliniques)\n Tenue d\u2019un inventaire des mesures de recherche et de la transmission de l\u2019information au pr\u00e9parateur de commandes\n Collecte, notation et codage des donn\u00e9es de recherche\n Participation \u00e0 la conception de bases de donn\u00e9es et tenue des bases de donn\u00e9es et du dictionnaire de donn\u00e9es\n Saisie et int\u00e9grit\u00e9 des donn\u00e9es\n Identification des enfants et de leurs familles qui sont admissibles au recrutement pour l\u2019\u00e9tude\n Mener des entrevues de base\n Recueillir les donn\u00e9es de suivi\n Cr\u00e9er et tenir \u00e0 jour les dossiers de recherche et de projet\n Collecte, notation et codage des donn\u00e9es de recherche\n Aider, le cas \u00e9ch\u00e9ant, dans d\u2019autres t\u00e2ches administratives li\u00e9es \u00e0 la recherche en cours\n Effectuer le travail conform\u00e9ment aux dispositions de la Loi sur la sant\u00e9 et la s\u00e9curit\u00e9 au travail et de son r\u00e8glement d\u2019application, ainsi qu\u2019\u00e0 toutes les politiques et proc\u00e9dures de l\u2019entreprise et des services de CHEO relatives \u00e0 la sant\u00e9 et \u00e0 la s\u00e9curit\u00e9 au travail.\n Effectuer d\u2019autres t\u00e2ches connexes attribu\u00e9es par le superviseur.\n\nQUALIFICATIONS, COMP\u00c9TENCES ET CAPACIT\u00c9S\n\n Dipl\u00f4me universitaire de premier cycle dans un domaine li\u00e9 \u00e0 la sant\u00e9, tel qu\u2019un baccalaur\u00e9at en sciences ou en sciences sociales, de pr\u00e9f\u00e9rence en psychologie, en neurosciences ou dans un domaine connexe (Essentiel)\n Minimum de 1 an d\u2019exp\u00e9rience en recherche clinique (Pr\u00e9f\u00e9rable)\n Compr\u00e9hension de la conception de la recherche, des proc\u00e9dures, des lignes directrices et des normes r\u00e9gissant la recherche clinique, y compris la Loi sur la protection des renseignements personnels sur la sant\u00e9 (Essentiel)\n Exp\u00e9rience en gestion de donn\u00e9es (REDCap) (Pr\u00e9f\u00e9rable)\n Ma\u00eetrise des comp\u00e9tences informatiques (Microsoft Office) (Essentiel)\n Excellentes aptitudes \u00e0 la communication (verbale et \u00e9crite), aux relations interpersonnelles et \u00e0 l\u2019organisation (Essentiel)\n Coll\u00e9gialit\u00e9, professionnalisme et esprit d\u2019\u00e9quipe av\u00e9r\u00e9s (Essentiel)\n Esprit d\u2019initiative, flexibilit\u00e9 et capacit\u00e9 \u00e0 travailler de mani\u00e8re ind\u00e9pendante (Essentiel)\n Certifications BPC, EPTC-2 (Pr\u00e9f\u00e9rable)\n Le bilinguisme (anglais et fran\u00e7ais) est un atout (Pr\u00e9f\u00e9rable)\n\nCONDITIONS DE TRAVAIL\n\n Travail en milieu clinique \u00e0 l\u2019h\u00f4pital; en contact avec les enfants et leurs parents et/ou avec les aidants.\n Flexibilit\u00e9 pour travailler \u00e0 distance dans un mod\u00e8le de travail hybride qui inclut \u00e0 la fois le travail \u00e0 distance et le travail sur place.\n\nAUTRES EXIGENCES\n\n \u00catre autoris\u00e9 \u00e0 travailler au Canada;\n Respect de la politique de vaccination universelle contre la COVID-19 de l\u2019IR de CHEO;\n V\u00e9rification du casier judiciaire.\n\nPOUR POSTULER\nVeuillez envoyer par courriel un CV complet et une lettre d\u2019accompagnement \u00e0 Sarah Bigford \u00e0 l\u2019adresse suivante : sbigford@cheo.on.ca.\nL\u2019Institut de recherche du CHEO valorise la diversit\u00e9 et est un employeur qui souscrit au principe d\u2019\u00e9galit\u00e9 d\u2019acc\u00e8s. Nous sommes r\u00e9solus \u00e0 fournir un environnement de travail inclusif et sans obstacle, en commen\u00e7ant par le processus d\u2019embauche et nous sommes heureux de recevoir des demandes provenant de tous les candidats comp\u00e9tents. Les candidats ou les candidates qui auront besoin de mesures d\u2019adaptation durant le processus de demande d\u2019emploi sont pri\u00e9s d\u2019envoyer un courriel aux Ressources humaines, conform\u00e9ment \u00e0 la Loi sur l\u2019accessibilit\u00e9 pour les personnes handicap\u00e9es de l\u2019Ontario \u00e0 l\u2019adresse suivante : researchhr@cheo.on.ca.\nL\u2019Institut de recherche de CHEO cherche \u00e0 accro\u00eetre l\u2019\u00e9quit\u00e9, la diversit\u00e9 et l\u2019inclusion dans toutes ses activit\u00e9s, y compris la recherche, l\u2019\u00e9ducation et l\u2019avancement professionnel, les partenariats avec les patients, les familles et les donateurs. Nous valorisons les parcours et les perspectives de carri\u00e8re diversifi\u00e9s et non traditionnels, ainsi que les comp\u00e9tences telles que la r\u00e9silience, la collaboration et l\u2019\u00e9tablissement de relations.Nous invitons les membres de minorit\u00e9s racis\u00e9es ou de peuples autochtones, les personnes handicap\u00e9es, les personnes ayant une orientation sexuelle ou une identit\u00e9 de genre minoritaire, et toute autre personne ayant les comp\u00e9tences et connaissances n\u00e9cessaires \u00e0 pr\u00e9senter leur demande, afin de s\u2019engager de mani\u00e8re productive aupr\u00e8s de diverses communaut\u00e9s.\nSeules les candidatures des personnes autoris\u00e9es \u00e0 travailler au Canada seront prises en consid\u00e9ration. Nous remercions tous les candidats de leur int\u00e9r\u00eat, cependant, nous ne communiquerons qu\u2019avec ceux qui seront convoqu\u00e9s \u00e0 une entrevue.\nJob Type: Part-time\nSalary: From $17.50 per hour\nEducation:\n\n Bachelor's Degree (required)\n\nWork Location: Hybrid remote in Ottawa, ON K1H 8L1"
}