{
    "id": "43afb68db10ab985",
    "company": "NOKIA",
    "positionName": "IP R&D Lab Technologist Co-op/Intern",
    "jobType": [],
    "location": "Ottawa, ON",
    "salary": null,
    "postingDateParsed": "2023-09-15T06:49:46.571Z",
    "url": "https://www.indeed.ca/rc/clk?jk=43afb68db10ab985&from=jasx&tk=1hb2v5rcfk7vv800&vjs=3",
    "externalApplyLink": "https://careers.nokia.com/jobs/ip-r-d-lab-technologist-co-op-intern-102008?src=JB-10760",
    "job_info_group": {
        "extracted_phone_numbers": [],
        "extracted_links": [
            "HTTP/HTTPS Links",
            "General Links",
            "WWW Links",
            "TLDs"
        ],
        "extracted_emails": [],
        "extracted_location_data": [
            "Canada"
        ],
        "extracted_dates": [
            "3 months+ Date",
            "January 8th to April 26th"
        ],
        "extracted_languages": [],
        "extracted_laws": [
            "File Transfer Protocol"
        ],
        "extracted_norps": [
            "APCs"
        ],
        "extracted_orgs": [
            "awesome Nokia",
            "Group Policies Familiar",
            "an equal opportunity employer Nokia",
            "Nokia",
            "Education Recommendations",
            "Computer Networking",
            "Bloomberg Workplace Pride Global Benchmark",
            "inventory tracking OTS",
            "Network Infrastructure"
        ],
        "extracted_persons": [
            "TFTP"
        ],
        "extracted_products": [
            "Windows Servers"
        ],
        "extracted_money": [],
        "processed_text": "position IP Research Development Lab Technologist op Intern duration location Onsite create technology help business business technology innovation leader pioneer future network meet cloud . positive impact people's life help build capability productive sustainable accessible . culture build inclusive open idea empower risk encourage fearless bring authentic . team pandemic highlight telecoms network society . Nokia's Network Infrastructure group heart revolution bring fast network capacity people worldwide ambition innovation technical expertise . currently 2nd bachelor's degree diploma field accredit school . learn contribute team central tool serial number loan equipment repair . manage upgrade repair simple repair track repair proper storage ESD Deal equipment build custom pc install CentOS create Linux server cable build basic topology troubleshoot issue network equipment configuring terminal server cabling topology testbed infrastructure Sniff network . find inefficiency problem . bench cabling . neat clean . maintain web troubleshoot procedure find implement improve lab monitor performance node long duration test report anomaly supervise engineer . strong interpersonal communication write verbal skill require demonstrated learn fast pace innovative environment strong troubleshooting skill strong sense ownership accountability Linux Unix operating system instal server create user group permission instal Domain System Active Directory create networking tool . Wireshark Basic training cable architecture repair team orient environment offer flexible hybrid working scheme continuous learning program support mentally physically join support employee resource group mentor program highly diverse team inclusive culture people thrive empower . company Culture people great asset aim foster fun challenging positive inclusive environment . offer mentorship learning development global impact interaction flexible life balance . Meaningful op term op term test late technology innovative project leave global impact . skill learn classroom apply real situation gain professional hand . committed inclusion receive follow recognition commitment inclusion equality World's Ethical Companies Ethisphere Gender Equality Index inclusively respect uniqueness people . Nokia's employment decision race color national ethnic origin religion gender sexual orientation gender identity expression age marital status protect veteran status characteristic protect law . committed culture inclusion build core respect . join company feel include empower succeed . winter"
    },
    "companyDescription": "",
    "description": "Position: IP R&D Lab Technologist Co-op/Intern\n    Duration: 3 months+\n    Date: January 8th to April 26th, 2024\n    Location: Onsite\n  \n \n \n   \n   \n  \n \n \n  \n   Come create the technology that helps the world act together\n  \n   \n  \n \n  We are a B2B technology innovation leader pioneering the future where networks meet cloud. At Nokia, you will have a positive impact on people\u2019s lives and help build the capabilities needed for a more productive, sustainable, and accessible world. \n   Be part of a culture built on an inclusive way of working where we are open to your ideas, you are empowered to take risks, and are encouraged to be fearless in bringing your authentic self to work.\n \n \n   \n  \n    \n    \n   The team you'll be part of\n   \n  \n \n  \n   Network Infrastructure\n   \n  \n \n  \n   The pandemic has highlighted how important telecoms networks are to society. Nokia\u2019s Network Infrastructure group is at the heart of a revolution to bring more and faster network capacity to people worldwide through our ambition, innovation, and technical expertise.\n  \n \n \n   \n   \n  \n \n \n  \n   Education Recommendations\n  \n \n  \n  \n  \n    Currently a 2nd-year candidate for a bachelor\u2019s degree or diploma in Computer Networking or a related field with an accredited school in Canada.\n  \n \n \n   \n   \n  \n \n \n  \n   What you will learn and contribute to\n   \n  \n \n  \n   As part of our team, you will:\n   \n   \n   A central tool for inventory tracking OTS (serial numbers, loaned equipment, repairs, etc.) \n   Manage upgrades, and repairs (do some simple repairs; tracking what's out for repairs) \n   Proper storage and ESD \n   Deal with new equipment \n   Build custom PCs, install CentOS, and create Linux servers \n   Cabling and building basic topologies \n   Troubleshoot various issues with network and equipment \n   Configuring terminal servers, APCs, and cabling topologies for testbeds/infrastructure \n   Sniff the network to keep it running well. Find inefficiencies/problems and fix them. \n   Keep benches, cabling, etc. neat and clean. \n   Maintain a web page with troubleshooting tips, procedures \n   Find/implement ways to improve the lab \n   Monitor the performance of these nodes during long-duration tests, and report anomalies to the supervising engineers.\n  \n \n  \n  \n \n \n \n  \n   What is Nokia looking for from me\n    \n    You have:\n   \n  \n \n  \n   Strong interpersonal and communication (both written and verbal) skills are required \n   Demonstrated ability to learn quickly and to work in a fast-paced, innovative environment \n   Strong troubleshooting skills \n   Strong sense of ownership and accountability \n   Linux/Unix operating systems, installing servers, creating users, groups, and permissions \n   Windows Servers, installing DNS and Active Directory, and creating Group Policies \n   Familiar with networking tools, ie. TFTP, FTP, and Wireshark \n   Basic training in cable architecture and repair \n   The candidate must be able to successfully work in a team-oriented environment\n  \n \n  \n  \n \n \n \n  \n   Why we're awesome\n   \n  \n \n  \n   Nokia offers flexible and hybrid working schemes, continuous learning opportunities, well-being programs to support you mentally and physically, opportunities to join and get supported by employee resource groups, mentoring programs and highly diverse teams with an inclusive culture where people thrive and are empowered.\n    \n    Company Culture: We believe our people are our greatest asset and we aim to foster a fun, challenging, positive, and inclusive work environment. We offer 1-on-1 mentorship, learning and development opportunities, global impact and interaction, and flexible work/life balance.\n    \n    Meaningful Co-op Term: During your co-op term, you will have the opportunity to test out the latest technologies and work on innovative projects that could leave a global impact. You get to use skills learned in the classroom and apply it to real work situations while gaining professional hands-on experience.\n  \n \n \n   \n   \n  \n \n \n  \n   Nokia is committed to inclusion and is an equal opportunity employer\n   \n  \n \n  \n   Nokia has received the following recognitions for its commitment to inclusion & equality:\n   \n  \n \n  One of the World\u2019s Most Ethical Companies by Ethisphere \n  Gender-Equality Index by Bloomberg \n  Workplace Pride Global Benchmark \n  \n \n  \n   At Nokia, we act inclusively and respect the uniqueness of people.\n  \n \n  \n  \n  \n    Nokia\u2019s employment decisions are made regardless of race, color, national or ethnic origin, religion, gender, sexual orientation, gender identity or expression, age, marital status, disability, protected veteran status or other characteristics protected by law.\n    We are committed to a culture of inclusion built upon our core value of respect.\n   \n  \n \n  \n   Join us and be part of a company where you will feel included and empowered to succeed.\n  \n \n \n   \n   \n  \n \n \n  \n   See you this Winter 2024!!!"
}