{
    "id": "45b3ef61a96dffcd",
    "company": "Baird & Associates",
    "positionName": "CAD Drafting Technician",
    "jobType": [
        "Permanent"
    ],
    "location": "Ottawa, ON",
    "salary": null,
    "postingDateParsed": "2024-01-26T12:13:59.278Z",
    "url": "https://www.indeed.ca/rc/clk?jk=45b3ef61a96dffcd&from=jasx&tk=1hl5dcuan2fci002&bb=meFSaZ2jpWfCb2DCBnnuQMDs2jPqJ13xmdFYlAiLpKI6p-1Xc_t5l-U2k_I9_FfSl0_xe89JNJKMTGeSzwSpyP5ANyWqVV6m6UIvPAhQl6_er2_ZYHgKsw%3D%3D&xkcb=SoCf67M3FlS8FtXIwZ0PbzkdCdPP&vjs=3",
    "externalApplyLink": "https://jobs.smartrecruiters.com/BairdAssociates/743999962905772-cad-drafting-technician",
    "job_info_group": {
        "extracted_phone_numbers": [],
        "extracted_links": [
            "HTTP/HTTPS Links",
            "General Links",
            "WWW Links",
            "TLDs"
        ],
        "extracted_emails": [],
        "extracted_location_data": [
            "Chile",
            "North and South America",
            "Southeast Asia",
            "the U.S.",
            "Canada",
            "Middle East",
            "Africa",
            "the Caribbean",
            "Australia",
            "Barbados"
        ],
        "extracted_dates": [
            "Qualifications 5-10 years"
        ],
        "extracted_languages": [
            "English"
        ],
        "extracted_laws": [],
        "extracted_norps": [],
        "extracted_orgs": [
            "Company Description W.F. Baird & Associates Coastal Engineers Ltd.",
            "a dedicated, creative, and approachable Computer-Aided Design Drafting Technician",
            "PowerPoint",
            "Geographic Information System",
            "Adobe Illustrator",
            "MicroStation",
            "Job Description W.F. Baird & Associates"
        ],
        "extracted_persons": [
            "Baird"
        ],
        "extracted_products": [
            "AutoCAD",
            "Photoshop"
        ],
        "extracted_money": [],
        "processed_text": "provide professional engineering technical service relate design coastal structure facility interact world's ocean lake river . recognize successful completion innovative practical project . provide stimulate environment domestic international travel professional development ownership potential company . person engineering firm specialize coastal marine riverine engineering office . firm dedicate exclusively marine coastal project encourage visit website gain additional insight company capability . seek civil structural engineering . engineer project manager technical staff . involve preparation civil engineering drawing gather datum information graphical form . role require produce quality meet budget schedule multiple concurrent project . responsibility lay drawing sheet drawing set . prepare design construction drawing base map figure rendering graphic project commercial software internal protocol client standard . perform task digitizing copying scanning drawing print map . assist diverse team international engineer scientist phase project perform duty assign . include reinforce concrete structural steel detail development horizontal vertical alignment grading profile quantity surface knowledge Computer aid Design standard . strong communication skill require . Associate's degree Civil Engineering Technology equivalent . nice qualification draft pier wharf ferry terminal retain flood wall steel floodgate structure e.g. steel barge moveable steel bridge civil 3d software travel require undertake duty describe . travel plan basis flexible meeting project deadline . Additional Information Baird equal employer . qualified applicant receive consideration employment regard race colour religion sex include pregnancy sexual orientation gender identity expression national origin protect veteran status genetic citizenship status legally authorize discriminate base characteristic status protect law regulation location operate . interest . diverse inclusive workplace background walk life . encourage apply match requirement disclaimer information description design indicate general nature level perform employee classification . design interpret comprehensive inventory duty responsibility qualification require employee assign position . equal employer . qualified applicant receive consideration employment regard race colour religion sex include pregnancy sexual orientation gender identity expression national origin protect veteran status genetic citizenship status legally authorize discriminate base characteristic status protect law regulation location operate . interest . diverse inclusive workplace background walk life . encourage apply match requirement disclaimer information description design indicate general nature level perform employee classification . design interpret comprehensive inventory duty responsibility qualification require employee assign position ."
    },
    "companyDescription": null,
    "description": "Company Description\n  W.F. Baird & Associates Coastal Engineers Ltd. (Baird) provides professional engineering and technical services related to the design of coastal structures and facilities that interact with the world\u2019s oceans, lakes, and rivers. Baird is recognized for the successful completion of innovative and practical projects throughout North and South America, the Caribbean, Middle East, Africa, and Southeast Asia.\n  We provide a stimulating work environment, with opportunities for domestic and international travel, professional development, and ownership potential within the company. Baird is a 100-person engineering firm specializing in coastal, marine, and riverine engineering with offices in the U.S., Canada, Barbados, Chile, and Australia. We are one of the only firms in the world dedicated exclusively to marine and coastal projects, and we encourage you to visit our website (www.baird.com) to gain additional insight into our company, capabilities, and experience.\n  Job Description\n  W.F. Baird & Associates is seeking a dedicated, creative, and approachable CAD Drafting Technician for civil and structural engineering. The candidate will work with engineers, project managers, and other technical staff. Work will involve preparation of civil engineering drawings, gathering data, and presenting information in graphical form. This role will require the candidate to produce quality work, while meeting the budget and schedules of multiple concurrent projects.\n  Job Responsibilities\n \n   Lay out drawings sheets and drawing sets.\n   Prepare design and construction drawings, base maps, figures, renderings and other graphics for projects using commercial software and internal protocols and client standards.\n   Perform tasks such as digitizing, copying and scanning of drawings, prints and maps.\n   Assist a diverse team of international engineers and scientist with all phases of projects\n   Perform other duties as assigned.\n \n  \n  Qualifications\n  \n \n   5-10 years of experience using AutoCAD, including reinforced concrete and structural steel details, the development of horizontal and vertical alignments, grading, profiles, sections, quantities, surfaces, and knowledge of CAD standards.\n   Strong communication skills in English is required\n   Experience in MicroStation.\n   Associate\u2019s Degree in Civil Engineering Technology or equivalent.\n \n  Nice to Have Qualifications:\n \n   Experience drafting piers, wharfs, ferry terminals, retaining or flood walls, and steel floodgates or similar structures (e.g. steel barges or moveable steel bridges)\n   Experience in Civil 3D software, GIS, Adobe Illustrator, Photoshop, PowerPoint\n \n  Some travel will be required to undertake the job duties described above. Travel may be planned or on an immediate basis and the candidate will need to be flexible in meeting project deadlines.\n  Additional Information\n \n  Baird is an equal-opportunity employer. All qualified applicants will receive consideration for employment without regard to race, colour, religion, sex (including pregnancy), sexual orientation, gender identity and/or expression, national origin, protected veteran status, disability, genetics, or citizenship status (when otherwise legally authorized to work) and will not be discriminated against based on such characteristics or any other status protected by the laws or regulations in the locations where Baird operates.\n  We thank all candidates for their interest. Baird is a diverse and inclusive workplace that is welcoming to all backgrounds and walks of life. We encourage you to apply even if you don't match all of our job requirements!\n  Disclaimer: The above information in this description has been designed to indicate the general nature and level of work performed by employees with this classification. It is not designed to contain or be interpreted as a comprehensive inventory of all duties, responsibilities, and qualifications required of employees assigned to this position. \n  Baird is an equal-opportunity employer. All qualified applicants will receive consideration for employment without regard to race, colour, religion, sex (including pregnancy), sexual orientation, gender identity and/or expression, national origin, protected veteran status, disability, genetics, or citizenship status (when otherwise legally authorized to work) and will not be discriminated against based on such characteristics or any other status protected by the laws or regulations in the locations where Baird operates.\n  We thank all candidates for their interest. Baird is a diverse and inclusive workplace that is welcoming to all backgrounds and walks of life. We encourage you to apply even if you don't match all of our job requirements!\n  Disclaimer: The above information in this description has been designed to indicate the general nature and level of work performed by employees with this classification. It is not designed to contain or be interpreted as a comprehensive inventory of all duties, responsibilities, and qualifications required of employees assigned to this position."
}