{
    "id": "1fb220e4ee41bc49",
    "company": "CBI Sant\u00e9",
    "positionName": "Physioth\u00e9rapeute / Physiotherapist",
    "jobType": [],
    "location": "Gatineau, QC",
    "salary": null,
    "postingDateParsed": "2024-01-20T05:08:47.875Z",
    "url": "https://www.indeed.ca/rc/clk?jk=1fb220e4ee41bc49&from=jasx&tk=1hkik8vp5k633800&bb=3fcFSWL0Q64YUe5hx9GNdsaFycxcpHiI48VOgNfMAiHLjhtIv1zkGzE3eHZuwxeR_Rl1GDpcwh7En_YXgFIqNBMFFcgq6xBdTvxGPTBBw8K1n6jJ5mHdBQ%3D%3D&xkcb=SoAx67M3FSgsJ0AB1z0LbzkdCdPP&vjs=3",
    "externalApplyLink": "https://recruiting.ultipro.ca/CBI5000CBHIG/JobBoard/5ed9b0b5-33c5-df47-591e-ac6551779695/OpportunityDetail?opportunityId=9405c396-5639-495c-8281-59e845bbf9f5&postingId=cf7fd675-0042-45e9-9072-2d2c7f00d05b",
    "job_info_group": {
        "extracted_phone_numbers": [],
        "extracted_links": [
            "HTTP/HTTPS Links",
            "General Links",
            "WWW Links",
            "TLDs"
        ],
        "extracted_emails": [],
        "extracted_location_data": [
            "Offrir",
            "Entretenir des partenariats privil\u00e9gi\u00e9s",
            "Gatineau",
            "la fin pointe des donn\u00e9es probantes",
            "Special Olympics Canada"
        ],
        "extracted_dates": [
            "each day"
        ],
        "extracted_languages": [
            "English"
        ],
        "extracted_laws": [],
        "extracted_norps": [
            "sans",
            "J8"
        ],
        "extracted_orgs": [
            "de cette",
            "soigneurs des Canadiens de Montr\u00e9al",
            "l'\u00e9quipe de CBI Sant\u00e9 et d\u00e9couvrez comment nous sommes ici",
            "85 Chemin de la Savane",
            "Quality Control",
            "o\u00f9 tout le monde se",
            "avoir du succ\u00e8s dans",
            "l'\u00e2ge, le handicap ou",
            "Le remboursement de la cotisation annuelle \u00e0 l'ordre",
            "\u00e0 la recherche de",
            "un r\u00e9seau national d'experts",
            "soutenir le d\u00e9veloppement de votre plein potentiel",
            "CBI Health",
            "avec les ressources pour",
            "la communaut\u00e9 au Canada avec",
            "CBI",
            "le d\u00e9veloppement des comp\u00e9tences",
            "un atout \u00c0",
            "Ce que vous offre",
            "\u00eatre mieux",
            "ax\u00e9 sur les meilleures pratiques",
            "tout en faisant partie d'une grande famille au quotidien",
            "About Us CBI Health",
            "the new CBI Health"
        ],
        "extracted_persons": [
            "Collaborer avec d'autres professionnels",
            "au sein d'une \u00e9quipe interdisciplinaire Ce",
            "permanent Excellence Physio et Readaptation - Gatineau",
            "Visitez",
            "besoin",
            "autre caract\u00e9ristique qui",
            "renomm\u00e9s Servir une",
            "\u00e0 innover et \u00e0",
            "l'\u00e9quit\u00e9 et l'inclusion et contribuent \u00e0 la diversification",
            "Bonus de signature de 10 000$ Chez CBI Sant\u00e9",
            "y compris l'assurance collective couvrant les soins m\u00e9dicaux",
            "dentaires et de la vision",
            "Sant\u00e9",
            "the OPPQ",
            "et l'opportunit\u00e9 de si\u00e9ger sur un comit\u00e9 d\u00e9di\u00e9 Un excellent soutien administratif",
            "Joignez-vous",
            "Full-time or part-time, permanent Excellence Physio et Readaptation - Gatineau",
            "interdisciplinaire",
            "ressembleront vos journ\u00e9es chez CBI Sant\u00e9"
        ],
        "extracted_products": [],
        "extracted_money": [
            {
                "amount": "202",
                "noun_phrases": []
            }
        ],
        "processed_text": "follow . salaire competitif une gamme complete d'avantage sociaux . professionnel budget formation continue Une prime signature Une reelle trajectoire carriere axee sur accompagnement illimite formation continue les opportunites gestion Du mentorat par physiotherapeute FCAMPT professeur d'universite accompagnement clinique tout au long votre carriere possibilite travailler concert avec des organismes externe comme les Olympiques speciaux du environnement clinique pour pouvoir vous consacrer vos patient Des horaires flexible permettent conciliation travail famille mettent l'accent sur qualite vie propos opportunite Temps plein temps partiel local 8l5 quoi des soins qualite milieux aigus complex avec des tier payeur clientele diversifiee blessure sportive accidentes route du travail post chirurgie . vous avez pour ce role Etre membre regle l'OPPQ voie d'obtention d'equivalence votre diplome maitrise readaptation propos nous CBI Sante est principal fournisseur soins sante emplacement . nous desservon communautes . Notre equipe passionnee est au c\u0153ur ce nous accomplisson . Tous les jour les membres notre personnel font une reelle difference dans vie client . nous incarnon des valeurs nous definissent passion respect fiabilite travail d'equipe l'innovation . pour . pour savoir . CBI Sante s'engage offrir milieu travail diversifie equitable inclusif send securite accepte dans son unicite . Nous sommes activement candidats qualifies partagent notre engagement envers des idees des perspectives nous aident fournir les meilleurs soin notre clientele . nous accueillon tout les candidature egard l'origine ethnique religion genre l'identite l'expression genre l'orientation sexuelle toute nous rend tout tous unique . _ _ _ _ _ _ _ _ _ _ _ _ _ _ _ _ _ _ _ _ _ _ _ _ _ _ _ _ _ _ _ _ _ _ _ _ _ _ _ _ _ _ _ _ _ _ _ _ _ _ _ _ _ _ _ _ _ _ _ _ _ _ _ _ _ _ _ _ _ _ _ _ _ _ _ _ _ _ _ _ _ _ _ _ _ _ _ _ _ _ _ _ _ _ _ _ _ _ _ _ _ _ _ _ _ _ _ _ _ _ _ _ _ _ _ _ _ _ _ _ _ _ _ _ _ _ benefit large company resource support development potential large family daily basis . offer competitive salary range benefit include group health dental vision benefit pay employer reimbursement annual membership fee professional order continue education budget signing bonus discuss real career path base unlimited support continue education skill development management mentorship national network expert FCAMPT physiotherapist university professor Montreal Canadiens' trainer clinical coaching career external organization clinical environment base good practice sit dedicated committee excellent administrative support focus patient flexible hour allow life balance focus quality life Suite J8T 8l5 inside provide quality care cut edge evidence base knowledge acute complex environment maintain privileged partnership reputable party payer serve diverse clientele include sport injury road workplace accident post operation . collaborate professional interdisciplinary team successful good standing process equivalence master's degree interdisciplinary rehabilitation asset Canada's lead community healthcare provider + location . support community . passionate team heart . staff meaningful difference client' life live core define heart respect reliability teamwork innovation . join find . learn . commit provide diverse equitable inclusive workplace feel safe accept authentic . actively seek qualified share commitment equity inclusion contribute diversification idea perspective help innovate provide good care client . application individual race colour religion gender gender identity expression sexual orientation national origin genetic age veteran status characteristic ."
    },
    "companyDescription": "",
    "description": "(English following) \n  Bonus de signature de 10 000$ \n  Chez CBI Sant\u00e9, vous b\u00e9n\u00e9ficierez de tous les avantages d\u2019une grande entreprise avec les ressources pour soutenir le d\u00e9veloppement de votre plein potentiel, tout en faisant partie d\u2019une grande famille au quotidien. \n  Ce que vous offre CBI Sant\u00e9 : \n \n  Un salaire comp\u00e9titif et une gamme compl\u00e8te d\u2019avantages sociaux, y compris l\u2019assurance collective couvrant les soins m\u00e9dicaux, dentaires et de la vision. \n  Le remboursement de la cotisation annuelle \u00e0 l\u2019ordre professionnel \n  Un budget de formation continue \n  Une prime \u00e0 la signature possible \n  Une r\u00e9elle trajectoire de carri\u00e8re ax\u00e9e sur un accompagnement illimit\u00e9 \u00e0 la formation continue, le d\u00e9veloppement des comp\u00e9tences et les opportunit\u00e9s de gestion \n  Du mentorat par un r\u00e9seau national d\u2019experts (physioth\u00e9rapeutes FCAMPT, professeurs d\u2019universit\u00e9, soigneurs des Canadiens de Montr\u00e9al) et accompagnement clinique tout au long de votre carri\u00e8re \n  La possibilit\u00e9 de travailler de concert avec des organismes externes, comme les Olympiques sp\u00e9ciaux du Canada \n  Un environnement clinique ax\u00e9 sur les meilleures pratiques et l\u2019opportunit\u00e9 de si\u00e9ger sur un comit\u00e9 d\u00e9di\u00e9 \n  Un excellent soutien administratif, pour pouvoir vous consacrer \u00e0 vos patients \n  Des horaires flexibles, qui permettent la conciliation travail-famille et mettent l\u2019accent sur la qualit\u00e9 de vie \n  \n \u00c0 propos de cette opportunit\u00e9 : \n  \n  Temps plein ou temps partiel, permanent \n  \n   \n    Excellence Physio et Readaptation - Gatineau, 85 Chemin de la Savane, local 202, Gatineau, QC, J8T 8L5\n     \n \n \u00c0 quoi ressembleront vos journ\u00e9es chez CBI Sant\u00e9 : \n \n  Offrir des soins de qualit\u00e9, \u00e0 la fin pointe des donn\u00e9es probantes (milieux aigus et complexes) \n  Entretenir des partenariats privil\u00e9gi\u00e9s avec des tiers-payeurs renomm\u00e9s \n  Servir une client\u00e8le diversifi\u00e9e : blessures sportives, accident\u00e9s de la route ou du travail, post-chirurgie, etc. \n  Collaborer avec d\u2019autres professionnels au sein d\u2019une \u00e9quipe interdisciplinaire \n  \n Ce dont vous avez besoin pour avoir du succ\u00e8s dans ce r\u00f4le : \n  \n  \u00catre membre en r\u00e8gle de l\u2019OPPQ (ou en voie d\u2019obtention d\u2019\u00e9quivalence ou de votre dipl\u00f4me de ma\u00eetrise) \n  Exp\u00e9rience en r\u00e9adaptation interdisciplinaire : un atout \n  \n \u00c0 propos de nous \n  CBI Sant\u00e9 est le principal fournisseur de soins de sant\u00e9 \u00e0 la communaut\u00e9 au Canada avec plus de 250 emplacements. Nous desservons plus de 800 communaut\u00e9s. Notre \u00e9quipe passionn\u00e9e est au c\u0153ur de ce que nous accomplissons. Tous les jours, les 13 000 membres de notre personnel font une r\u00e9elle diff\u00e9rence dans la vie de nos clients. Nous incarnons des valeurs qui nous d\u00e9finissent : la passion, le respect, la fiabilit\u00e9, le travail d\u2019\u00e9quipe et l\u2019innovation. Joignez-vous \u00e0 l\u2019\u00e9quipe de CBI Sant\u00e9 et d\u00e9couvrez comment nous sommes ici, pour \u00eatre mieux. Visitez le cbisante.ca pour en savoir plus. \n  CBI Sant\u00e9 s\u2019engage \u00e0 offrir un milieu de travail diversifi\u00e9, \u00e9quitable et inclusif, o\u00f9 tout le monde se sent en s\u00e9curit\u00e9 et accept\u00e9 dans son unicit\u00e9. Nous sommes activement \u00e0 la recherche de candidats qualifi\u00e9s qui partagent notre engagement envers l\u2019\u00e9quit\u00e9 et l\u2019inclusion et contribuent \u00e0 la diversification des id\u00e9es et des perspectives qui nous aident \u00e0 innover et \u00e0 fournir les meilleurs soins possibles \u00e0 notre client\u00e8le. \n  Nous accueillons toutes les candidatures sans \u00e9gard \u00e0 l\u2019origine ethnique, la religion, le genre, l\u2019identit\u00e9 ou l\u2019expression de genre, l\u2019orientation sexuelle, l\u2019\u00e2ge, le handicap ou toute autre caract\u00e9ristique qui nous rend toutes et tous uniques. \n  ______________________________________________________________________________________________________________________________ \n  At CBI Health, you get all the benefits of a large company with the resources to support the development of your full potential, while being part of a large family on a daily basis. \n  What CBI Health offers you: \n  \n  Competitive salary and a full range of benefits, including group health, dental and vision benefits, paid 100% by the employer \n  Reimbursement of the annual membership fee to the professional order \n  Continuing education budget \n  Signing bonus (to be discussed) \n  A real career path based on unlimited support for continuing education, skills development, and management opportunities \n  Mentorship through a national network of experts (FCAMPT physiotherapists, university professors, Montreal Canadiens' trainers) and clinical coaching throughout your career \n  Opportunity to work with external organizations, such as Special Olympics Canada \n  A clinical environment based on best practices and opportunity to sit on a dedicated committee \n  Excellent administrative support, so you can focus on your patients \n  Flexible hours, which allow work-life balance and focus on quality of life \n  \n About this opportunity: \n  \n  Full-time or part-time, permanent \n  \n   \n    Excellence Physio et Readaptation - Gatineau, 85 Chemin de la Savane, Suite 202, Gatineau, QC, J8T 8L5\n     \n \n Take an inside look at what you\u2019ll do each day: \n  \n  Providing quality care at the cutting edge of evidence-based knowledge (acute and complex environments) \n  Maintain privileged partnerships with reputable third-party payers \n  Serving a diverse clientele including sports injuries, road or workplace accidents, post-operation, etc. \n  Collaborate with other professionals in an interdisciplinary team \n  \n What you need to be successful: \n  \n  Member in good standing of the OPPQ (or in the process of obtaining an equivalence or your master\u2019s degree) \n  Experience in interdisciplinary rehabilitation, an asset \n  \n About Us \n  CBI Health is Canada\u2019s leading community healthcare provider with 250+ locations. We are supporting more than 800 communities. Our passionate team is at the heart of what we do. Every day, our 13,000 staff make a meaningful difference in our clients\u2019 lives as we live the core values that define us: heart, respect, reliability, teamwork and innovation. Join the new CBI Health and find where your better begins. Learn more at cbihealth.ca. \n  CBI Health is committed to providing a diverse, equitable, and inclusive workplace where everyone feels safe and accepted as their authentic selves. We actively seek qualified candidates who share our commitment to equity and inclusion and contribute to the diversification of ideas and perspectives that help us innovate and provide the best possible care to our clients. \n  We welcome applications from all individuals regardless of race, colour, religion, gender, gender identity or expression, sexual orientation, national origin, genetics, disability, age, veteran status, or any other characteristics that make each of us different."
}