{
    "id": "397fb3af008bc108",
    "company": "Actalent",
    "positionName": "Test Automation Developer",
    "jobType": [
        "Contract",
        "Fixed term contract"
    ],
    "location": "Ottawa, ON",
    "salary": null,
    "postingDateParsed": "2024-01-07T03:09:57.917Z",
    "url": "https://www.indeed.ca/pagead/clk?mo=r&ad=-6NYlbfkN0ChYVx_I3yfZ_JDY3EFoivtqvi_stwnZ_kRt8Dowt_l_Th23phn_g9jtNUSey9g1YntMmYY7koBKMV5d0OA5pz2PIMTe4mhxD0GR9mUKWKIy59i1hfrAC-R88fdgZoJuxQfalWaMtWv_81y_x5B8WDmVEaY2dtqSyIeLcXCs7GmscsP7S7bYwyMbwcg1suHIeghvsB8GeysGJMxDNI15eiakEcdCb1H5P-e-g0TGnDBoMvSgSy3NrXUj8kQt2pLerVifjOTBgYQ8sIyECYCJ8b1YvWTZS-buFE9ujXuaVe1JBJIfNKBHHezHQDo65LcraipqoV-YcQa2FBeP6Di6bDUbVs3jIby9CIdxzHSrQ5HwmdOUCHh5domU4mpq9XLPB2IEcGzx3ho8A6nbHFM7tvzsHpX7_sAGYZUp0vkYhIdLteBhH6hlrJogYx0vg8eo4m8rj6qhtIaR4dzVE_dDvdg9AsgXHlIIogwisbOashPn0cuYpJ2ZmkEhWdF4Fg7KtGOIvnfn_-jayxo7QCNrEBTlsiZ2i88kAmNoYnUkTgPqztmNWgTNQQQ6gJmKfoBj0ia-fAv05esZgVz-f7VnqLgcNxV0X07pA4iI-giq8ASjLdLxj7SCdMKN_PMQwnt4WjrItT21PIozscBsF9rqsAfiTC7EVETKfU8VEunE0lluK2czzqvxXLYBQ1cz9liuuxbC7QXRbKI6xsq0AFWjn8eTk79uaY3K8B1HgncCSUseG5F62xBagEHRWiRKSRFZi70Ua5vHahLfN_kwl_E-TYlBioTBCjpi5KOzUbAdOmgSJlpfAxdOmqDoa-ovizfU37d5HqpODMiAYh70hhm4eI4XVPQIKKGlD5gsW8yjwSO6C_xQBVGV1NBjU0DY6Y9sf8SH9NEDQLOm-7CaobQcYuiEFp14ixgDXFhEkr55S6dbO3wrKpar_BZ69LetMUpR-yPefH03NqzinanCODUX5AzUb1wcodv1XVzzQX5MLxEKUpav7qDnfqyQqukgu8KmFKAt95QNdHxAEaijrpjtsks_n66gfSYgjIkXvjGYZT6NNh3ovVWTkLXpr4CKA-O0TZipZcpQyGQz4qHgfVIWBPFNZm39ba5m3WX4Xc6Vh_kN2s4tN-u3eCPUbqrWdBJJnZ6mrHhtxL4c4IYjq36Pl8iPbNqMXSz37Zz4sj6wdhOPXhJiLprvX_RG3dB6W1PH5BFpZnwb4j04JGSrPv_fB42&xkcb=SoDE6_M3G2Ob3i2f7x0HbzkdCdPP&p=12&fvj=0&vjs=3&jsa=1831&tk=1hjm3501uhbi2800&from=jasx&wvign=1",
    "externalApplyLink": "https://careers.actalentservices.com/us/en/job/JP-004238593/Test-Automation-Developer?utm_source=Recruitics&utm_medium=equest&s_id=4106&icid=indeed_recruitics&rx_a=1&rx_c=canada---actalent&rx_ch=jobp4p&rx_group=273056&rx_job=JP-004238593&rx_medium=cpc&rx_r=none&rx_source=Indeed&rx_ts=20240109T000001Z&rx_vp=cpc&rx_p=SULNJOHXYT&rx_viewer=96937026ae9c11ee8c80c590505e1c1b1a7422691ea741d287b7ba55a77a1639",
    "job_info_group": {
        "extracted_phone_numbers": [],
        "extracted_links": [
            "HTTP/HTTPS Links",
            "General Links",
            "WWW Links",
            "TLDs"
        ],
        "extracted_emails": [],
        "extracted_location_data": [
            "Ontario",
            "Linux",
            "Ottawa"
        ],
        "extracted_dates": [
            "3+ Years",
            "Every day"
        ],
        "extracted_languages": [],
        "extracted_laws": [],
        "extracted_norps": [
            "sans"
        ],
        "extracted_orgs": [
            "JIRA Methodical",
            "information g\u00e9n\u00e9tique ou",
            "le monde entier inspirent au quotidien",
            "ing\u00e9nierie et en sciences",
            "un d\u00e9veloppement",
            "L'entreprise",
            "QNX",
            "\u00e2ge",
            "Allegis Group",
            "leader mondial des solutions de candidats talentueux",
            "Android",
            "a Test Automation Developer"
        ],
        "extracted_persons": [
            "de r\u00e9aliser",
            "La diff\u00e9rence",
            "Actalent"
        ],
        "extracted_products": [],
        "extracted_money": [],
        "processed_text": "actively seek position automotive field locate description Architecture Software Platform group responsible software platform enable connectivity advanced application feature generation vehicle . team design build generation software platform vehicle architecture structure high performance compute cluster zonal aggregator . team successful involve testing cut edge embed software system component provide enable framework additional functional service operating system service driver . primary responsibility include develop execute functional integration test plan component Software Platform group . automate test execution critical test coverage require knowledge Python scripting . high perform team encourage contribute idea solution daily . position provide unique gain help deliver cut edge software service industry leader . responsibility analyze product requirement cross functional collaboration team design test plan test setup software solution span multiple domain . Test Automation development python Test failure analysis test coverage analysis person test OS software embed system . Required Skills software testing embed mobile consumer electronic platform strong test automation field . asset testing embed operating system testing automotive Familiarity agile development process capable prioritize tight deadline . excellent communicator oral write . propos d'Actalent actalent relie passion mission . solution candidats talentueux performance services produisent valeur les resultat tout apportant competence permet client . expert situes dans . nous soutenon les initiative essentielle par les experiences favorisent continu . c'est gen . Actalent est une societe d'exploitation d'Allegis Group . souscrit au principe d'egalite d'acces lthemploi prendra compte toutes les candidature distinction race sexe couleur religion nationalite statut veteran handicap orientation sexuelle identite sexuelle toute autre distinction protegee par loi . connect passion purpose . scalable talent solution service capability drive result provide expertise help customer achieve . expert globe impact . support critical initiative engineering science advance company serve . promote consultant care engagement enable continuous development . people difference . operate company global leader talent solution . company equal employer consider application regard race sex age color religion national origin veteran status sexual orientation gender identity genetic information characteristic protect law ."
    },
    "companyDescription": "",
    "description": "Actalent is actively seeking a Test Automation Developer for a position in the automotive field located in Ottawa, Ontario! \n Description:\n  The Architecture and Software Platform group is responsible for the software platform that enables connectivity and advanced application features within next generation vehicles. The team is designing and building the next generation software platform for the vehicle architecture structured around high performance compute clusters and zonal aggregators.\n  Working as a member of this team, the successful candidate will be involved in testing of cutting edge embedded software, working on system components that either provide enabling frameworks or additional functional services above the operating system services and drivers.\n  Primary responsibilities will include developing and executing functional and integration test plans for all components owned by the Software Platform group. Automated test execution is a critical part of the overall test coverage which requires the candidate to have working knowledge of Python scripting. The candidate will work as part of a high performing team and will be encouraged to contribute ideas and solutions as part of their daily work. This position will provide the candidate with the unique opportunity to gain experience in helping to deliver cutting edge software and services with an industry leader.\n  Responsibilities:\n \n   Analyzing product requirements\n   Cross-functional collaboration with teams to design test plans and test setups for software solutions that span multiple domains.\n   Test Automation development in python\n   Test failure analysis\n   Test coverage analysis\n   This person will be testing OS software/embedded systems such as Linux, QNX, or Android.\n \n  Required Skills:\n \n   3+ Years of software testing experience on one of more of the following: embedded, mobile, or consumer electronic platforms\n   Strong test automation experience with Python\n   Bachelors degree in Computer Science, Mathematics, Engineering, or a related field.\n \n  Assets:\n \n   Experience in testing embedded operating systems\n   Experience in testing for automotive\n   Familiarity with Agile development processes\n   Experience using JIRA\n   Methodical; capable of prioritizing work and working to tight deadlines.\n   An excellent communicator, both oral and written.\n \n  \n \n \u00c0 propos d'Actalent: \n Actalent relie la passion \u00e0 la mission. Nos solutions de candidats talentueux et la performance de nos services produisent la valeur et les r\u00e9sultats, tout en apportant la comp\u00e9tence qui permet \u00e0 nos clients de r\u00e9aliser plus. Nos experts situ\u00e9s dans le monde entier inspirent au quotidien. Nous soutenons les initiatives essentielles en ing\u00e9nierie et en sciences, par les exp\u00e9riences qui favorisent un d\u00e9veloppement continu. La diff\u00e9rence, c\u2019est nos gens. Actalent est une soci\u00e9t\u00e9 d\u2019exploitation d\u2019Allegis Group, leader mondial des solutions de candidats talentueux. \n L\u2019entreprise souscrit au principe d\u2019\u00e9galit\u00e9 d\u2019acc\u00e8s \u00e0 l\u2019emploi et prendra en compte toutes les candidatures sans distinction de race, sexe, \u00e2ge, couleur, religion, nationalit\u00e9, statut de v\u00e9t\u00e9ran, handicap, orientation sexuelle, identit\u00e9 sexuelle, information g\u00e9n\u00e9tique ou toute autre distinction prot\u00e9g\u00e9e par la loi. \n About Actalent: \n Actalent connects passion with purpose. Our scalable talent solutions and services capabilities drive value and results and provide the expertise to help our customers achieve more. Every day, our experts around the globe are making an impact. We\u2019re supporting critical initiatives in engineering and sciences that advance how companies serve the world. Actalent promotes consultant care and engagement through experiences that enable continuous development. Our people are the difference. Actalent is an operating company of Allegis Group, the global leader in talent solutions. \n  The company is an equal opportunity employer and will consider all applications without regards to race, sex, age, color, religion, national origin, veteran status, disability, sexual orientation, gender identity, genetic information or any characteristic protected by law."
}