{
    "id": "28c21b273d3c62e5",
    "company": "Ciena",
    "positionName": "Waveserver Software Developer - New Grad",
    "jobType": [],
    "location": "Ottawa, ON",
    "salary": null,
    "postingDateParsed": "2023-10-17T18:51:04.558Z",
    "url": "https://www.indeed.ca/rc/clk?jk=28c21b273d3c62e5&from=jasx&tk=1hcvfjcolkedt800&vjs=3",
    "externalApplyLink": "https://careers.ciena.com/us/en/job/CIENUSR023697ENUS/Waveserver-Software-Developer-New-Grad?utm_source=indeed&utm_medium=phenom-feeds",
    "job_info_group": {
        "extracted_phone_numbers": [],
        "extracted_links": [
            "HTTP/HTTPS Links",
            "General Links",
            "WWW Links",
            "TLDs"
        ],
        "extracted_emails": [],
        "extracted_location_data": [
            "Git"
        ],
        "extracted_dates": [
            "every day",
            "1992"
        ],
        "extracted_languages": [],
        "extracted_laws": [],
        "extracted_norps": [],
        "extracted_orgs": [
            "Ciena",
            "GDB",
            "GCC",
            "Electrical/Computer Engineering, Computer Science",
            "Yocto",
            "Waveserver Software Developer",
            "Insight",
            "RSU",
            "a Waveserver Software Developer"
        ],
        "extracted_persons": [
            "Grafana",
            "Jenkins",
            "Docker",
            "Bitbucket"
        ],
        "extracted_products": [],
        "extracted_money": [],
        "processed_text": "committed people philosophy . team enjoy culture focus prioritize personalized flexible environment empower individual's passion growth wellbeing belonging . technology company lead humanity \u2014 drive business priority alongside meaningful social community societal impact . drive relentless pursuit network innovation . network grow smart agile responsive . digitally interact pick phone streaming video texte friend love \u2013 interaction enable Ciena technology . social entertainment business existence real . contribute requirement telecommunication network constantly evolve product advance scale meet customer deliver uniform consistent user . dynamic team environment push boundary optical network solution . contribute project play critical role network solution help build innovative technology . challenge bring fresh idea challenge lead example . play key role craft develop testing deploy maintain improve software . accountable manage individual project priority assignment timeline . participate software development lifecycle collaborate multi functional team developer User designer quality assurance team release manager . Ciena expect initiative \u2013 starter limited direction committed deliver aggressive deadline . agility \u2013 key decision manage compete change account priority . communication expertise \u2013 influence tailor message idea audience ensure understanding buy . ' ladder ' \u2013 capable big picture understand detail analysis . flexibility independently broad team \u2013 thrive multi disciplinary team environment comfortable independently require . relationship builder \u2013 innate influence develop trust connection multi site . commitment innovation \u2013 abreast market competitive development keen formulate idea problem solve . Haves Bachelor's degree relate field couple prove track record software development . demonstrate develop follow programming language C++ Python . Linux base developer tool debug environment GNU . knowledge development tool JIRA . familiarity Continuous Integration framework kubernete . asset proven develop software embed solution engineer performance reliability multi processor highly concurrent system . big proponent life integration provide flexibility tool reality remote . inclusive diverse barrier free environment empowered committed employee . recognize offer program benefit support sustain mental physical health employee family provide variety pay family leave program . committed employee development offer tuition reimbursement house learning mentorship . financial security . offer competitive salary incentive program level specific employee share option purchase program . realize recharge negotiable . offer unlimited pay great deserve recognition . robust recognition program ongoing enhance award exemplary performance . commitment diversity inclusion foster environment respect individual's strength perspective idea meet customer globally . diversity workforce respect employee individual race ethnicity religion gender age national origin sexual orientation veteran marital status category protect applicable law . tolerate form discrimination . committed compliance fair employment practice regard citizenship immigration status . contact relation advise timely fashion specific accommodation measure require assess fair equitable manner . committed build foster environment employee feel respect hear . diversity workforce respect employee individual . tolerate form discrimination . contact relation advise accommodation measure require ."
    },
    "companyDescription": "",
    "description": "Ciena is committed to our people-first philosophy. Our teams enjoy a culture focused on prioritizing a personalized and flexible work environment that empowers an individual\u2019s passions, growth, wellbeing and belonging. We\u2019re a technology company that leads with our humanity\u2014driving our business priorities alongside meaningful social, community, and societal impact. \n \n Waveserver Software Developer\n \n  Since 1992, Ciena has been driven by a relentless pursuit of network innovation. We believe in a network that grows smarter, more agile, and more responsive every day. This means that when you digitally interact in your world - picking up the phone, streaming video, texting a friend or loved one \u2013 your interactions are being enabled by Ciena technologies. Ciena makes your social/entertainment/business existence REAL.\n  How You Will Contribute:\n \n  Requirements for telecommunications networks are constantly evolving, and our products also need to advance and scale to meet the needs of our customers while also delivering uniform and consistent user experiences.\n \n  As a Waveserver Software Developer in a dynamic team environment, you will push the boundaries of what is possible in optical network solutions. You will contribute to projects that play critical roles in our network solutions and help build upon our innovative technology. You will also challenge yourself and others by bringing fresh ideas to new challenges and leading by example.\n \n \n   You will play a key role in crafting, developing, testing, deploying, maintaining, and improving software.\n   You will be accountable for managing individual project priorities, assignments, and timelines.\n   You will participate in the full software development lifecycle, collaborating with multi-functional teams of developers, UX designers, quality assurance teams & release managers.\n \n \n  What Does Ciena Expect of You?\n \n \n   Initiative \u2013 You are a self-starter who works with limited direction and is committed to delivering against aggressive deadlines.\n   Agility \u2013 you are readily able to make key decisions and manage competing and ever-changing account priorities.\n \n \n   Communication expertise \u2013 the ability to influence and tailor your message and ideas to the audience to ensure understanding and buy in.\n   An ability to go \u2018up and down the ladder\u2019 \u2013 capable of seeing the big picture, but also understanding the importance of the details and analysis.\n   The flexibility to work independently and as part of a broader team \u2013 you thrive in a multi-disciplinary team environment, but are comfortable working independently as required.\n   Relationship builder \u2013 with an innate ability to influence, you can quickly develop trusted connections and get work done across multi sites.\n   A commitment to innovation \u2013 you keep abreast of the market and competitive developments and are always keen to formulate new ideas and problem solve.\n \n \n  The Must Haves:\n \n \n   Bachelor\u2019s degree in Electrical/Computer Engineering, Computer Science or a related field coupled with a proven track record in software development.\n   Demonstrated ability to develop with one or more of the following programming languages - C, C++ or Python.\n   Experience working with Linux-based developer tools and debugging environment such as GNU, GCC, GDB, Insight.\n   Knowledge of development tools such as Git, JIRA, Yocto, Docker, Bitbucket.\n   Familiarity with CI frameworks such as Jenkins, Grafana, Kubernetes.\n \n \n  Assets:\n \n   Proven experience developing software embedded solutions engineered for performance and reliability on multi-processor, highly concurrent systems.\n \n \n  Why Ciena:\n \n   We are big proponents of life-work integration and provide the flexibility and tools to make it a reality with remote work and potentially, part-time work.\n   We believe an inclusive, diverse, and barrier-free work environment makes for empowered and committed employees.\n   We recognize the importance of well-being and offer programs and benefits to support and sustain the mental and physical health of our employees and their families and provide a variety of paid family leave programs.\n   We are committed to employee development, offering tuition reimbursement, in-house learning, and mentorship opportunities.\n   We know that financial security is important. We offer competitive salaries and incentive programs, RSU\u2019s (job level specific) and an employee share option purchase program.\n   We realize time away to recharge is non-negotiable. We offer unlimited paid time off!\n   Great work deserves recognition. We have a robust recognition program, with ongoing and enhanced awards for exemplary performance.\n \n  As part of our commitment to diversity and inclusion, we want to foster an environment that values and respects all individual\u2019s strengths, perspectives, ideas, and ability to meet the needs of our customers globally. Ciena values the diversity of its workforce and respects its employees as individuals, regardless of race, ethnicity, religion, gender, age, national origin, disability, sexual orientation, veteran or marital status or any other category protected by applicable law. We do not tolerate any form of discrimination.\n  Ciena is also committed to compliance with all fair employment practices regarding citizenship and immigration status.\n  If contacted in relation to a job opportunity, you should advise Ciena in a timely fashion of the specific accommodation measures required for you to be assessed in a fair and equitable manner.\n \n  At Ciena, we are committed to building and fostering an environment in which our employees feel respected, valued, and heard. Ciena values the diversity of its workforce and respects its employees as individuals. We do not tolerate any form of discrimination.\n \n  If contacted in relation to a job opportunity, please advise Ciena of any accommodation measures you may require."
}