{
    "id": "6cf5c8a1d9429e19",
    "company": "Solink",
    "positionName": "Hardware Tester",
    "jobType": [],
    "location": "Ottawa, ON",
    "salary": null,
    "postingDateParsed": "2023-10-17T18:52:01.624Z",
    "url": "https://www.indeed.ca/rc/clk?jk=6cf5c8a1d9429e19&from=jasx&tk=1hcvfkunqk7dc802&vjs=3",
    "externalApplyLink": "https://solink.bamboohr.com/careers/265?source=indeed&src=indeed&postedDate=2023-10-16",
    "job_info_group": {
        "extracted_phone_numbers": [],
        "extracted_links": [
            "HTTP/HTTPS Links",
            "General Links",
            "WWW Links",
            "TLDs"
        ],
        "extracted_emails": [
            "peopleops@SolinkCorp.com"
        ],
        "extracted_location_data": [
            "Canada"
        ],
        "extracted_dates": [
            "Today",
            "a day/week/month",
            "Monday to Friday",
            "the day"
        ],
        "extracted_languages": [
            "English"
        ],
        "extracted_laws": [],
        "extracted_norps": [
            "our Solinkians"
        ],
        "extracted_orgs": [
            "BOBA FETT",
            "even Human Resources",
            "Quality Assurance",
            "Finance",
            "HARDWARE TESTER Solink",
            "our Field Services,",
            "Solink",
            "peopleops@SolinkCorp.com"
        ],
        "extracted_persons": [],
        "extracted_products": [],
        "extracted_money": [],
        "processed_text": "kind datum analytic software company . surveillance video source powerful insight business owner franchise retail chain . focus security application combat fraud proactively easy owner track problem . focus loss prevention future department video data drive decision marketing operation . amazing team tackle big data problem . venture focus continuous execution delight customer . creative collaborative environment employee meaningful equity company . bit role ... motivated solution minded individual enjoy problem solve join Fulfilment team Hardware Tester . role collaborate fulfillment team daily basis . closely team ensure hardware clean test perform grow customer base . previous networking technical environment op . technical knowledge familiar hard drive basic networking understanding . excellently communicate Written Read Spoken . superb attention detail fast paced environment . impeccable organization skill maintain area orderly fashion love hand perform repetitive task . prove problem solve skill suggestion process improvement . independently team environment . comfortably MS Office suite software . adjust priority meet compete goal . office environment . nice ... previous role electronic care maintenance testing consider asset security requirement undergo criminal record check hire canadian Citizen dual citizen include eligible comply Solink's security policy standard . clean test perform warranty RMA exchange hard drive network recording system equipment hardware Solink installation . set return unit remote viewing device replace customer's request . clean test return unit functionality ensure future installation . finance fulfillment team write dispose serviceable equipment return . assist physically connect unit office network advance software provisioning . maintain receiving return area office ensure clean organize setup . support receiving shipment busy period . SOLINK Solink transform conventional datum 'smart' datum . Solink connect synchronize brick mortar business system video + Point sale datum create insight loss prevention security operation issue . find powerful business real datum footage create daily standard system . Ottawa's fast grow company . tech security company rapidly evolve video security datum analytic technology . enhance status quo positively impact client customer' business . steep growth trajectory lot lot learn lot exciting adventure ahead great travel companion ... Solink thrive team business daily people difference . people drive curiosity hungry innovate strive impact . SOLINK company input allow bring idea life . offer collaborative creative supportive environment culture undeniably fun ... offer ... .. flexibility help stuff encourage life balance growth base merit skill initiative friendly welcoming team orient atmosphere foster collaboration creative innovative environment mentor support motivate inspire impact interesting exciting assignment range size type complexity open door policy communication brainstorming encourage positive fun environment incredibly energetic team fully pay Health dental benefit offer additional spending account item cover amazing benefit program monthly reimbursement health wellness extracurricular solinkian social event annual solink mayo learn sport team lunch team builder note position office . Solink encourage application people . accommodation request aspect selection process . accommodation email . unique . Solink Equal Employer . build team great people form . committed diverse representative workforce open inclusive environment encourage interest apply . provide accommodation request selection process . apply submit cover letter resume address outline fit position ."
    },
    "companyDescription": "",
    "description": "HARDWARE TESTER\n \n  Solink is a different kind of data analytics software company. We\u2019ve successfully made surveillance video a source of powerful insight for business owners of franchise and retail chains. We focus on security applications that combat fraud proactively and make it easier for owners to track down problems. Today we focus on loss prevention and in the future, we see every department using video to make data-driven decisions: marketing, operations, and even HR.\n \n  A job at Solink means working with an amazing team and tackling one of the biggest data problems out there. We are venture-backed and focus on continuous execution to delight our customers. We have a creative and collaborative work environment, and all of our employees have meaningful equity in the company.\n \n  A bit about the role\u2026\n \n  We are looking for a motivated, solutions-minded, individual that enjoys problem-solving to join our Fulfilment team as a Hardware Tester. In this role, you will be collaborating with our Field Services, Quality Assurance, Finance, and Fulfillment teams on a daily basis. You will be working closely with these teams to ensure hardware is being cleaned, tested, and performing as needed for our growing customer base.\n \n  WHO YOU ARE\n  \n \n  \n   You have previous work experience working in a networking/technical environment (CO-OP Experience Welcome!). \n  You have technical knowledge - familiar with hard drives and basic networking understanding. \n  You have the ability to excellently communicate in English (Written, Read, Spoken). \n  You have superb attention to detail in a fast paced environment. \n  You have impeccable organization skills - this is important to you, and you can maintain your area in an orderly fashion! \n  You love working with your hands and you can perform repetitive tasks. \n  You have proven problem solving skills, and the ability to make suggestions to process improvements. \n  You have the ability to work independently and within a team environment.  \n  You can comfortably use MS Office suite and similar software. \n  You can adjust your priorities throughout the day to meet competing goals within a day/week/month.  \n  You can work in an office environment from Monday to Friday.\n \n  \n  \n  Nice to have...\n  \n \n  \n   You have previous experience working in a role of electronic care, maintenance, and testing or similar would be considered an asset\n \n  \n  \n  SECURITY REQUIREMENTS:\n  \n \n  \n   Candidates must undergo a criminal records check upon hire; \n  Be a Canadian Citizen (dual citizens included), or eligible to work in Canada; \n  Be willing to comply with Solink\u2019s own security policies and standards.\n \n  \n  \n  WHAT WILL YOU DO?\n  \n \n  \n   Clean, test, and perform warranty RMA exchanges for hard drives, network recording systems, and other equipment/hardware that is used in Solink installations. \n  Set up returned units for remote viewing after the device is replaced, at the customer's request. \n  Clean and test returned units for functionality and to ensure their re-use for future installations. \n  Work with the finance and fulfillment teams to write off and dispose of any non-serviceable equipment returns. \n  Assist with physically connecting new units to the office network in advance of their software provisioning. \n  Maintain the receiving and returns area of the office, ensuring a clean and well-organized setup. \n  Support the receiving of shipments during busy periods.\n \n  \n  \n  WHAT IS SOLINK?\n \n  Solink is transforming conventional data into \u2018smart\u2019 data. Solink connects and synchronizes brick-and-mortar business systems like video + Point of Sale data, to create insight into loss prevention, security, and operations issues. We find new and powerful ways for businesses to get real value from the data and footage created daily by their standard systems.\n \n  We\u2019re one of Ottawa\u2019s fastest growing companies. We're not just a tech and security company - we are rapidly evolving the way that we use and think about video security, data analytics and technology. We're enhancing the status quo to positively impact clients and customers' businesses.\n \n  We\u2019re on a steep growth trajectory, which means lots to do, lots to learn, and lots to experience! What an exciting adventure ahead - and our Solinkians make the greatest travel companions\u2026\n \n  Solink thrives because of our team; we know that in our business and in our daily work, people make all the difference. We\u2019re looking for people who are driven by curiosity, hungry to innovate and striving to make an impact.\n \n  WHY WORK AT SOLINK?\n \n  Working with us means you\u2019ll be working for a company that values your input and allows you to bring your ideas to life. We offer a collaborative, creative, supportive work environment with a culture that is undeniably fun\u2026\n \n  All that - PLUS we offer\u2026..\n  \n \n  \n   Flexibility in your chosen hours of work by helping you get \"stuff\" done (encourages that work life balance); \n  Opportunities for growth based on merit, skill, and initiative; \n  Friendly, welcoming and team-oriented atmosphere that fosters collaboration; \n  Creative and innovative environment that mentors, supports, motivates and inspires you to make an impact; \n  Interesting and exciting assignments ranging in size, type and complexity; \n  An \u201copen-door\u201d policy where communication and brainstorming is encouraged; \n  A really positive and fun environment working with an incredibly ENERGETIC team; \n  Fully paid Health / dental benefits offered immediately (an additional $500 spending account for items that aren\u2019t covered in our AMAZING benefits program); \n  Monthly reimbursement toward a health and wellness; \n  Extracurricular SOLINKIAN social events (annual \u201csolink-o de mayo\u201d, so-learns, sports teams, so-lunches, team builders, and much more) \n  Please note: This position is in-office, Monday to Friday.\n \n  \n  \n  Solink welcomes and encourages applications from people with disabilities. Accommodations are available on request for candidates taking part in all aspects of the selection process. Should you need accommodations, please email peopleops@SolinkCorp.com.\n \n  We know that everyone has different experiences and that\u2019s what makes all of us so unique. Solink is an Equal Opportunity Employer. We\u2019re looking at building our team of great people and we know that comes in various forms. We are committed to a diverse and representative workforce, an open and inclusive work environment and we encourage all candidates with interest to apply. We will provide accommodation on request through all parts of the selection process.\n \n  HOW TO APPLY?\n \n  Please submit your cover letter and resume addressed to BOBA FETT outlining why you would be the right fit for this position."
}