{
    "id": "c1cdd36052f38be7",
    "company": "Baird & Associates",
    "positionName": "Marine Structural Engineer",
    "jobType": [],
    "location": "Ottawa, ON",
    "salary": null,
    "postingDateParsed": "2024-01-17T05:13:25.523Z",
    "url": "https://www.indeed.ca/rc/clk?jk=c1cdd36052f38be7&from=jasx&tk=1hkikipjiii32800&bb=g3LG73kDIG2DKbipZ3VbGBYHK4COjZ-dNJn0WLtO0K-PD3sjm49Oj7RARSevdt4fxo0EQNa3phx5GxyWg6CEvy2n6Db7W85okXQOXZaYJw-ufVO_QgFzFQ%3D%3D&xkcb=SoD367M3FShE7dQ2y50AbzkdCdPP&vjs=3",
    "externalApplyLink": "https://www.baird.com/job-postings/4595-2/",
    "job_info_group": {
        "extracted_phone_numbers": [],
        "extracted_links": [
            "HTTP/HTTPS Links",
            "General Links",
            "WWW Links",
            "TLDs"
        ],
        "extracted_emails": [],
        "extracted_location_data": [
            "Chile",
            "North and South America",
            "Southeast Asia",
            "the U.S.",
            "Canada",
            "Middle East",
            "Africa",
            "Nice",
            "the Caribbean",
            "Australia",
            "Barbados"
        ],
        "extracted_dates": [
            "10+ years"
        ],
        "extracted_languages": [
            "English"
        ],
        "extracted_laws": [],
        "extracted_norps": [],
        "extracted_orgs": [
            "Computer-Aided Design",
            "Or M.Eng",
            "SAP2000",
            "Professional Engineers Ontario",
            "W.F. Baird & Associates Coastal Engineers Ltd.",
            "or M.Eng",
            "a motivated, dynamic, and personable Marine Structural Engineer",
            "Overview W.F. Baird & Associates Coastal Engineers Ltd."
        ],
        "extracted_persons": [
            "Baird"
        ],
        "extracted_products": [],
        "extracted_money": [],
        "processed_text": "provide professional engineering technical service relate design coastal structure facility interact world's ocean lake river . recognize successful completion innovative practical project . provide stimulate environment domestic international travel professional development ownership potential company . person engineering firm specialize coastal marine riverine engineering office . firm dedicate exclusively marine coastal project encourage visit website gain additional insight company capability . seek analysis design construction port offshore waterfront structure . position complement expand exist team strength coastal marine structure navigation engineering risk analysis offshore wind coastal protection restoration river engineering resiliency port engineering construction management . responsibility develop manage assist routine complex port offshore marine waterfront structural engineering project wide include flood protection project office zone manage design engineering preparation plan specification construction oversight administration Manage project delivery conception completion mentoring technical oversight junior engineer scientist participate proposal preparation interview Minimum qualification structural engineering marine infrastructure registration analyze design individual contributor . create concrete steel drawing detail manually perform analysis FE program . deep foundation pier harbour wall bulkhead retain wall cofferdam . knowledge code standard good accepted practice relevant marine structural engineering strong report writing skill excellent interpersonal verbal write communication skill excellent project management skill flexible style thrive dynamic environment meet challenging deadline client multi disciplinary geographically distribute team internal external tight deadline change scope willingness travel week period domestically internationally . occasional assignment long qualification geotechnical arctic offshore construction engineering include EnSoft software product M.Sc . . Sc . . prefer broad interest multiple area marine coastal engineering creativity flexibility design collaboration client employee . offer competitive compensation benefit . equal employer . qualified applicant receive consideration employment regard race colour religion sex include pregnancy sexual orientation gender identity expression national origin protect veteran status genetic citizenship status legally authorize discriminate base characteristic status protect law regulation location operate . interest . diverse inclusive workplace background walk life . encourage apply match requirement disclaimer information description design indicate general nature level perform employee classification . design interpret comprehensive inventory duty responsibility qualification require employee assign position ."
    },
    "companyDescription": "",
    "description": "Overview \n  \n   W.F. Baird & Associates Coastal Engineers Ltd. (Baird) provides professional engineering and technical services related to the design of coastal structures and facilities that interact with the world\u2019s oceans, lakes, and rivers. Baird is recognized for the successful completion of innovative and practical projects throughout North and South America, the Caribbean, Middle East, Africa, and Southeast Asia. \n    We provide a stimulating work environment, with opportunities for domestic and international travel, professional development, and ownership potential within the company. Baird is a 100-person engineering firm specializing in coastal, marine, and riverine engineering with offices in the U.S., Canada, Barbados, Chile, and Australia. We are one of the only firms in the world dedicated exclusively to marine and coastal projects, and we encourage you to visit our website (www.baird.com) to gain additional insight into our company, capabilities, and experience. \n    W.F. Baird & Associates Coastal Engineers Ltd. (Baird) is seeking a motivated, dynamic, and personable Marine Structural Engineer with experience in analysis, design, and construction of port, offshore, and waterfront structures. This position will complement and expand our existing team strengths in coastal and marine structures, navigation engineering & risk analysis, offshore wind, coastal protection and restoration, river engineering, resiliency, port engineering, and construction management.\n    \n    \n    Job Responsibilities: \n   \n    Develop, manage, and assist with routine and complex port, offshore, marine and waterfront structural engineering projects world-wide, including flood protection projects \n    Work across our different offices and time zones \n    Manage design, engineering, preparation of plans and specifications, and construction oversight and administration \n    Manage project delivery from conception through completion \n    Mentoring and technical oversight of junior engineers and scientists \n    Participate in proposal preparation and interviews, as necessary\n   \n    \n    \n    Minimum Qualifications: \n   \n    10+ years of experience in the structural engineering of marine infrastructure \n    Professional Engineers Ontario registration \n    The ability to analyze and design as an individual contributor. The ability to create concrete and steel drawings and details (manually or by CAD) and to perform analyses in SAP2000 or a similar FE program. Experience with deep foundations, piers, harbour walls, bulkheads, retaining walls, and or cofferdams. \n    Working knowledge of codes, standards, and best accepted practices relevant to marine structural engineering \n    Strong report-writing skills \n    Excellent interpersonal, verbal, and written communication skills (English) \n    Excellent project management skills \n    Flexible work style, with the ability to thrive in a dynamic work environment, meet challenging deadlines and client needs \n    Ability to work well on multi-disciplinary, geographically distributed teams (internal and external) under tight deadlines and changing scope \n    Willingness to travel for several 1-2 week periods domestically and internationally. Occasional assignments may be longer\n   \n    \n    \n    Nice to have Qualifications: \n   \n    Experience with geotechnical, arctic, offshore, or construction engineering, including EnSoft software products \n    M.Sc. or M.Eng. \n    Sc. Or M.Eng. (preferred) \n    Broad interest in multiple areas of marine and coastal engineering \n    Creativity and flexibility in design, as part of collaboration with a client\n   \n    \n    \n    Baird is employee-owned. We offer competitive compensation and benefits. \n    Baird is an equal-opportunity employer. All qualified applicants will receive consideration for employment without regard to race, colour, religion, sex (including pregnancy), sexual orientation, gender identity and/or expression, national origin, protected veteran status, disability, genetics, or citizenship status (when otherwise legally authorized to work) and will not be discriminated against based on such characteristics or any other status protected by the laws or regulations in the locations where Baird operates. \n    We thank all candidates for their interest. Baird is a diverse and inclusive workplace that is welcoming to all backgrounds and walks of life. We encourage you to apply even if you don\u2019t match all of our job requirements! \n    Disclaimer: The above information on this description has been designed to indicate the general nature and level of work performed by employees with this classification. It is not designed to contain or be interpreted as a comprehensive inventory of all duties, responsibilities, and qualifications required of employees assigned to this position."
}