{
    "id": "fa2b60d32443b696",
    "company": "Jacobs",
    "positionName": "Intermediate Bridge Engineer",
    "jobType": [
        "Full-time"
    ],
    "location": "Ottawa, ON",
    "salary": null,
    "postingDateParsed": "2024-01-25T12:16:54.537Z",
    "url": "https://www.indeed.ca/rc/clk?jk=fa2b60d32443b696&from=jasx&tk=1hl5djl94h7hv800&bb=iUirdYeM7xa45dqAjnQXmp_RBXgr_rScswb2Zcc4Zxw62rTKUOq1O7CnZMvB7zeUttPSUbiwpH5p7499wr5J0zm0BOq9ce6JJnQiajy_HNgn8Yrohg6ejg%3D%3D&xkcb=SoAe67M3FlTBd5TAAx0GbzkdCdPP&vjs=3",
    "externalApplyLink": "https://careers.jacobs.com/job/19783487/intermediate-bridge-engineer-ottawa-ca/",
    "job_info_group": {
        "extracted_phone_numbers": [],
        "extracted_links": [
            "HTTP/HTTPS Links",
            "General Links",
            "WWW Links",
            "TLDs"
        ],
        "extracted_emails": [],
        "extracted_location_data": [
            "Ontario"
        ],
        "extracted_dates": [
            "tomorrow",
            "12 months",
            "today",
            "completed structure Year"
        ],
        "extracted_languages": [
            "English"
        ],
        "extracted_laws": [],
        "extracted_norps": [
            "French"
        ],
        "extracted_orgs": [
            "Concrete Culvert Design Detailing Manual, Structure Rehabilitation Manual",
            "CAC-Cement Association of Canada",
            "an Intermediate Bridge Engineer",
            "RSS Design Guide",
            "Computer-Aided Design Drafters",
            "CSA",
            "Transportation Structures",
            "Jacobs",
            "less experienced Engineers",
            "Concrete Institute",
            "our growing Ontario Transportation Business",
            "Project/Lead Engineers",
            "Civil Engineering",
            "MS Project",
            "PEO",
            "Bluebeam",
            "(EIT",
            "CSiBridge",
            "the Canadian Highway Bridge Design Code",
            "EIT",
            "CSA Canadian Standards Association",
            "a Professional Engineers License",
            "Professional Engineers License",
            "CISC-Canadian Institute for Steel Construction"
        ],
        "extracted_persons": [
            "M. Eng"
        ],
        "extracted_products": [
            "Integral Abutment Manual",
            "Semi Integral Abutment Manual",
            "the their Cover Letter and Resume"
        ],
        "extracted_money": [
            {
                "amount": "$13 billion",
                "noun_phrases": []
            }
        ],
        "processed_text": "People Places Solutions business \u2013 reinforce drive improve life people epitomize \u2013 tremendous positive impact solution bring community society . facility deliver life save therapy ensure clean water enable connection people mode transportation provide access technology \u2013 integrate multitude solution element build smart environment . start Jacobs career company inspire empower deliver good evolve grow succeed \u2013 . impact transform intangible idea innovative solution design future . . impact help solve real life challenge . future company . rely provide support team critical project foster culture continuous learning inclusion bring fresh idea table . Pave career company inspire empower deliver good evolve grow succeed \u2013 . partner globe create good project outcome maximize design digital technology . join commit support engage team build company . search Intermediate Bridge Engineer join . individual highly personable quick learner . initial role produce supervise manage small medium scale bridge project include field review field inspection structural calculation draw production variety structure . follow initial integration period role progressively grow include support business development project delivery team . incumbent team environment interact client approval agency assist engineer project manager deliverable . responsibility perform supervise bridge culvert retain wall rehabilitation design include technical report structural analysis design calculation quantity specification calculation check . produce technical report memo support design . provide input guidance project . closely phase project planning execution closeout . provide technical engineering service construction include review contractor submission . prepare proposal project schedule budget estimate project pursuit . perform design inspection task include site investigation support design OSIM bridge culvert retain wall inspection . independently team . mentor junior staff promote continual development . build maintain effective relationship client . duty require . prefer office expectation travel client site meeting occasional team meeting . prefer office expectation travel client site meeting occasional team meeting . Bachelor's degree accredited university . Master's degree m.a.sc . specialize structure bridge accredited university . currently hold eligible . requirement minimum year' design include bridge structural culvert retain wall . practical develop write structural design structure planning report . practical knowledge structural analysis software MIDAS Civil . practical knowledge S6 MTO Structural Manual . practical knowledge applicable MTO design guideline Structure Inspection Manual . practical knowledge MTO standard drawing specification . additional requirement closely draft professional effectively develop draw package transportation structure . strong verbal write communication skill essential role digital markup software consider asset . effectively coordinate discipline proactively address project requirement . provide career guidance mentoring direction support project support structural designer . mentorship key aspect role successful expect dedicate pass knowledge . key success project effective quality assurance quality control . transportation structure project review senior engineer successful utilize constructive criticism feedback improve current future deliverable . follow item consider asset PHD specialize structure bridge accredit university consider asset . additional relevant training specialize bridge structure consider asset CPCI Canadian Precast prestresse . knowledge AutoCAD consider asset . collaborate highway engineer geotechnical engineer hydraulic engineer utility company environmental agency consultant consider asset . knowledge project scheduling software consider asset . perform OSIM bridge culvert inspection consider asset . fully consider asset . applicant provide addition project sheet recognize bridge culvert retain wall project career detail follow bridge culvert retain wall locate start completion Contract Type Lump Sum TandM role project construction engineering deliverable Photo construction add client Client reference challenge reinvent solve world's critical problem thrive city resilient environment mission critical outcome operational advancement scientific discovery cutting edge manufacturing turn abstract idea reality transform good . revenue talent force provide spectrum professional service include consulting technical scientific project delivery government private sector ."
    },
    "companyDescription": "We deliver impactful global solutions to create a more connected, sustainable world \u2014 from intelligence to infrastructure, cybersecurity to space exploration. Our more than 60,000 employees across 50 countries work every day, challenging the expectations of today to reinvent the way we\u2019ll all live tomorrow. ",
    "description": "Our People & Places Solutions business \u2013 reinforces our drive to improve the lives of people everywhere and epitomizes the \"why\" of what we do \u2013 the tremendous positive impact and value our solutions bring to our communities and society as a whole. From facilities delivering life-saving therapies and ensuring clean water to enabling the connection of people through all modes of transportation and providing access to technology \u2013 we're integrating a multitude of these solution elements to build the smart environments of tomorrow.  Start your Jacobs career with a company that inspires and empowers you to deliver your best work so you can evolve, grow and succeed \u2013 today and into tomorrow.\n  \n  \n Your Impact:\n  At Jacobs, we\u2019re transforming intangible ideas into innovative solutions designing the future - today. As an Intermediate Bridge Engineer, you will too. \n You'll impact the world around you by helping us solve real-life challenges. You are the future of our company. We\u2019ll rely on you to provide support to our teams on critical projects while fostering a culture of continuous learning and inclusion as you bring fresh ideas to the table. \n Pave the way for your career with a company that inspires and empowers you to deliver your best work so you can evolve, grow and succeed \u2013 today and into tomorrow. \n We\u2019re partnering across the globe to create the best project outcomes by maximizing the design and digital technology. By joining Jacobs, you\u2019ll commit to supporting and engaging with these teams, as we work to build a company like no other. \n Jacobs is searching for an Intermediate Bridge Engineer to join our growing Ontario Transportation Business. This individual needs to be highly personable and a quick learner. Your initial role will be to produce, supervise and manage small and medium scale bridge projects including field reviews, field inspections, structural calculations, and drawing production on a variety of structures. Following an initial integration period your role will progressively grow to include supporting our business development and project delivery teams. The incumbent should be willing to work in a team environment, interact with clients and approval agencies, and assist other engineers and project managers in their deliverables. \n Responsibilities: \n \n  Perform and supervise bridge, culvert and retaining wall rehabilitations and new designs including: technical reports, structural analysis, design calculations, quantities, specifications, and calculation checks. \n  Produce technical reports and memos to support design. \n  Providing input and guidance to CAD Drafters, EIT\u2019s, and less experienced Engineers working on projects. \n  Work closely with Project/Lead Engineers during all phases of project planning, execution, and closeout. \n  Providing technical engineering services during construction, including the review of contractor submissions. \n  Prepare proposals, project schedules and budget estimates for project pursuits. \n  Perform design and inspection tasks including: site investigations to support design and OSIM bridge, culvert and retaining wall inspections. \n  Work independently and as part of a team. \n  Act as a mentor for junior staff and promote continual development. \n  Build and maintain effective working relationships with clients. \n  Other duties as required. \n  You\u2019ll be working mainly from home (unless you prefer coming into the office), with the expectation to travel for client /site meetings and occasional team meetings. \n \n You\u2019ll be working mainly from home (unless you prefer coming into the office), with the expectation to travel for client /site meetings and occasional team meetings.\n  \n Here\u2019s What You\u2019ll Need:\n  \n  \n  Bachelor\u2019s degree in Civil Engineering from an accredited university. \n  Master\u2019s degree (M. Eng, or M.A.Sc.) in Civil Engineering specializing in structures/bridges from an accredited university. \n  Must currently hold a Professional Engineers License with PEO in Ontario or be eligible to obtain Professional Engineers License with PEO within 12 months. \n \n Work Experience Requirements: \n \n  Minimum of 5 years\u2019 design experience working on Transportation Structures including: bridges, structural culverts and retaining walls. \n  Practical experiences developing and writing structural design and structure planning reports. \n  Practical working knowledge of structural analysis software (such as CSiBridge or MIDAS Civil). \n  Practical working knowledge of the Canadian Highway Bridge Design Code CSA S6-19 and the MTO Structural Manual. \n  Practical working knowledge of other applicable MTO design guidelines: Semi Integral Abutment Manual, Integral Abutment Manual, Concrete Culvert Design Detailing Manual, Structure Rehabilitation Manual, RSS Design Guide, Ontario Structure Inspection Manual, etc. \n  Practical working knowledge of MTO standard drawings and specifications. \n \n Additional Requirements: \n \n  Experience working closely with drafting professionals to effectively develop drawing packages for transportation structures. Strong verbal and written communication skills are essential for this role and experience working with digital markup software, such as Bluebeam, is considered an asset. \n  Ability to effectively coordinate with other disciplines and proactively address project requirements. \n  Provide career guidance (mentoring), direction and support on project work, and support to structural designers (EIT\u2019s). Mentorship is a key aspect of this this role and the successful candidate should expect to dedicate 15 % of their time to passing on knowledge and experiences to others. \n  A key to success in our projects is effective quality assurance and quality control. All Transportation Structure projects within Jacobs are reviewed by senior engineers and the successful candidate must be able to utilize constructive criticism and feedback to improve current and future deliverables. \n \n The following items would be considered an asset: \n \n  PHD in Civil Engineering specializing in structures/bridges from an accredited university would be considered an asset. \n  Additional relevant training specializing in bridge structures would be considered an asset: CISC-Canadian Institute for Steel Construction, CPCI-Canadian Precast prestressed Concrete Institute, CAC-Cement Association of Canada, CSA Canadian Standards Association. \n  Knowledge of AutoCAD is considered an asset. \n  Experience collaborating with highway engineers, geotechnical engineers, hydraulic engineers, utility companies, environmental agencies, sub consultants, etc, is considered an asset. \n  Working knowledge of project scheduling software such as MS Project is considered an asset. \n  Experience performing OSIM bridge and culvert inspections is considered an asset. \n  Fully bilingual in English and French is considered an asset. \n \n We ask applicants to provide in addition the their Cover Letter and Resume a project sheet for their most recognized bridge/culvert/retaining wall project from their career detailing the following: \n \n  bridge / culvert / retaining wall located in Canada \n  Project start and completion date \n  Contract Type (Lump Sum or T&M) \n  Your role in the project \n  Construction value \n  Engineering value, hours worked and deliverables \n  Photo of completed structure \n  Year of construction \n  Value add to client \n  Client reference \n \n  \n At Jacobs, we\u2019re challenging today to reinvent tomorrow by solving the world\u2019s most critical problems for thriving cities, resilient environments, mission-critical outcomes, operational advancement, scientific discovery and cutting-edge manufacturing, turning abstract ideas into realities that transform the world for good. With $13 billion in revenue and a talent force of more than 55,000, Jacobs provides a full spectrum of professional services including consulting, technical, scientific and project delivery for the government and private sector."
}