{
    "id": "b370fd3b1d0e2567",
    "company": "CHEO RESEARCH INSTITUTE",
    "positionName": "RI-23-053 AI Research Analyst",
    "jobType": [],
    "location": "401 Smyth Road, Ottawa, ON",
    "salary": null,
    "postingDateParsed": "2023-10-23T20:06:37.906Z",
    "url": "https://www.indeed.ca/rc/clk?jk=b370fd3b1d0e2567&from=jasx&tk=1he3lftbdk7tt800&vjs=3",
    "externalApplyLink": null,
    "job_info_group": {
        "extracted_phone_numbers": [],
        "extracted_links": [
            "HTTP/HTTPS Links",
            "General Links",
            "WWW Links",
            "TLDs"
        ],
        "extracted_emails": [
            "lblake@bornontario.ca",
            "researchhr@cheo.on.ca"
        ],
        "extracted_location_data": [
            "au Canada",
            "Canada",
            "Ottawa",
            "par l'entremise de l'IR de CHEO et de BORN Ontario",
            "Contribuer \u00e0 l'\u00e9laboration de pr\u00e9sentations \u00e9clair\u00e9es",
            "BORN Ontario"
        ],
        "extracted_dates": [
            "2023",
            "October 23, 2023 to November 6",
            "1 year",
            "6 novembre 2023"
        ],
        "extracted_languages": [],
        "extracted_laws": [
            "the CHEO Precision Child and Youth Mental Health Initiative"
        ],
        "extracted_norps": [
            "avec",
            "au besoin"
        ],
        "extracted_orgs": [
            "p\u00e9rinatale ou dans",
            "notamment la recherche",
            "le processus d'embauche",
            "Police Record Check",
            "source de soutien dans notre collectivit\u00e9",
            "CHEORI",
            "biotechnologique ou universitaire",
            "qui",
            "Christine Armour Children's Hospital",
            "de recherche",
            "gr\u00e2ce \u00e0 des recherches",
            "Effectuer une analyse statistique pour rendre compte des r\u00e9sultats des exp\u00e9riences et des essais de mod\u00e8les",
            "ON K1H 8L1",
            "an Artificial Intelligence Research Analyst",
            "computationnelle",
            "dans le secteur pharmaceutique",
            "Machine Learning",
            "avec des publics techniques",
            "Human Resources",
            "L'Institut de recherche de CHEO valorise la diversit\u00e9 et est un",
            "aux pratiques exemplaires",
            "CHEO RI's Universal COVID-19 Vaccination Policy",
            "de pointe en sant\u00e9 mentale",
            "accro\u00eetre l'\u00e9quit\u00e9, la diversit\u00e9 et l'inclusion dans",
            "de recherche en",
            "a complete Curriculum Vitae",
            "Concevoir",
            "the Principal Investigator",
            "et de nouvelles preuves pour soutenir CHEO dans sa",
            "handicap\u00e9es de l'Ontario \u00e0 l'adresse",
            "avec une concentration en sciences des donn\u00e9es et",
            "Eastern Ontario Research Institute",
            "cr\u00e9er de nouvelles connaissances",
            "L'Institut de recherche de CHEO cherche \u00e0",
            "POSTE",
            "\u00e0 la recherche d'un",
            "un domaine scientifique connexe",
            "\u00e0 la Loi sur l'accessibilit\u00e9 pour les",
            "du Centre",
            "la famille et les donateurs",
            "Applied Epidemiology/Biostatistics /Computer Science/Data Science",
            "l'Institut de recherche de CHEO",
            "The CHEO Research Institute",
            "Analyste de recherche",
            "ETP",
            "CHEO RI",
            "un mod\u00e8le de",
            "The Artificial Intelligence Research Analyst",
            "the Artificial Intelligence Research Analyst",
            "qui m\u00e8nent \u00e0 des soins de sant\u00e9 de pr\u00e9cision",
            "Ottawa Children's Treatment Centre",
            "the University of Ottawa",
            "de la",
            "\u00e0 la",
            ", COMP\u00c9TENCES ET CAPACIT\u00c9S Ma\u00eetrise en \u00e9pid\u00e9miologie appliqu\u00e9e",
            "L'analyste de recherche",
            "Forte capacit\u00e9 d'\u00e9tablir les priorit\u00e9s et de communiquer",
            "the Children's Hospital of Eastern Ontario",
            "de la mod\u00e9lisation des donn\u00e9es et de l'architecture logicielle",
            "les cas d'utilisation analytique avanc\u00e9e",
            "Excellentes",
            "\u00eatre une",
            "la poursuite de recherches qui ont une",
            "en informatique",
            "l'analyste de recherche",
            "de l'importance des caract\u00e9ristiques et de l'explicabilit\u00e9 des mod\u00e8les",
            "SAS",
            "IA hautement"
        ],
        "extracted_persons": [
            "L'IR de CHEO",
            "joindra \u00e0 l'\u00e9quipe de recherche de la Dre Christine Armour",
            "d'am\u00e9liorer le mieux-\u00eatre",
            "sommes heureux de recevoir les demandes de tous les candidats",
            "Christine Armour L'Institut de recherche du Centre",
            "AUTRES EXIGENCES \u00catre autoris\u00e9 \u00e0 travailler au Canada",
            "des mod\u00e8les",
            "Lia Blake",
            "les personnes handicap\u00e9es",
            "orientation sexuelle ou une",
            "Exp\u00e9rience avec les",
            "Exp\u00e9rience d\u00e9montr\u00e9e des techniques",
            "IA DUR\u00c9E",
            "RESPONSABILIT\u00c9S Sous la",
            "les personnes ayant une",
            "; V\u00e9rification du casier judiciaire",
            "P\u00e9riode d'affichage",
            "Travailler avec une \u00e9quipe",
            "Veuillez envoyer un Curriculum Vitae",
            "d\u00e9fendant des projets qui r\u00e9solvent des probl\u00e8mes",
            "jeune et famille de notre collectivit\u00e9 et ailleurs",
            "enfants de l'est de l'Ontario",
            "Capacit\u00e9 de d\u00e9finir et d'\u00e9laborer des strat\u00e9gies",
            "IA devra",
            "de donn\u00e9es de soins de sant\u00e9",
            "appuyer l'Initiative de sant\u00e9 mentale de pr\u00e9cision",
            "Capacit\u00e9 de travailler harmonieusement dans",
            "Souplesse de travailler dans",
            "les ensembles de donn\u00e9es d\u00e9mographiques",
            "au besoin",
            "Chercheuse",
            "L'IR de CHEO travaille pour"
        ],
        "extracted_products": [
            "math\u00e9matiques"
        ],
        "extracted_money": [
            {
                "amount": "$60,000 - $",
                "noun_phrases": []
            },
            {
                "amount": "60 000 $",
                "noun_phrases": []
            },
            {
                "amount": "70 000 $",
                "noun_phrases": []
            },
            {
                "amount": "60,000.00-$70,000.00",
                "noun_phrases": []
            }
        ],
        "processed_text": "DESCRIPTION RI Posting Period position Artificial Intelligence Research Analyst term FTE \u2013 contract possibility renewal salary Computer aid Design annum benefit report Principal Investigator CHEO RI research arm \u2013 CHEO affiliated institute . CHEO beloved institution workplace recognize anchor community . create knowledge evidence support CHEO provision class care child . mission connect exceptional talent technology pursuit life change research child youth family community . requirement . seek highly skilled motivated Artificial Intelligence Research Analyst join Dr. Christine Armour's research team support . contribute machine learn datum science project goal develop predictive algorithm population base dataset . exciting improve mental wellness generation cutting edge mental health research lead precision healthcare child youth family . responsibility general supervision Design implement iteratively improve appropriate datum science machine learning framework support goal project . contribute development deployment appropriate datum science Machine Learning model derive outcome datum . train evaluate retrain system model . perform statistical analysis report experimental result model testing . demonstrate specialized skill standardized datum science technique e.g. regression segmentation deep learning feature model explainability experiment logging model drift monitoring . . team identify acquire datum source provide input datum transformation rule require prepare datum advanced analytic case . prepare output analysis review include graph table figure interpretation experimental result . maintain documentation code analysis result understand repeat code good practice . contribute insightful presentation communicate technical material grow other' technical understanding . support innovation proactively identify championing project solve complex problem application datum science Machine Learning technique . qualification skill abilitie Master's degree equivalent concentration datum science machine learning programming technique required support degree education biology biochemistry biostatistic bioinformatics computational biology computer science apply mathematic machine learning perinatal research relate scientific field + year' computational biology bioinformatics machine learning pharma biotech academic setting preferred understanding datum structure datum modeling software architecture Required Mastery analytical programming language Python Stata learn adapt programming language . require demonstrate datum visualization technique tool effective presentation result required define develop datum analysis strategy minimal supervision high degree scientific competence organizational attention detail preferred knowledge quantitative technique normalization standardization apply statistic clinical result preferred large scale healthcare datum set preferred Transformer base Machine Learning architecture preferred image image processing computer vision preferred outstanding analytical problem solve skill . concise communication scientific concept datum analysis clinical interpretation reporting . excellent communication skill verbal write . high energy starter passion large scale datum analysis . enjoy fast pace environment love impact . strong prioritize communicate technical technical audience alike . working condition flexibility hybrid model include remote occasional site . requirement eligible compliance . apply send cover letter . diversity equal employer . committed provide inclusive barrier free environment start hiring process interest qualified applicant . applicant require accommodation application process Accessibility Ontarians Disabilities notify . seek increase equity diversity inclusion activity include research education career development patient family donor partnership . diverse traditional career path perspective skill resilience collaboration relationship building . application racialized minority indigenous people person person minority sexual orientation gender identity skill knowledge productively engage diverse community . application consider eligible . applicant interest invite interview contact . DESCRIPTION POSTE RI \u2014 du octobre au poste temps plein \u2014 contrat d'un possibilite renouvellement SALAIRE \u2013 par annee les avantage sociaux RELEVE principale hospitalier pour \u00ab IR CHEO \u00bb est l'organisme recherche du Centre traitement pour enfant hospitalier pour enfant l'est l'Ontario situe \u00ab CHEO \u00bb institut affilie l'Universite d'Ottawa . CHEO est une institution milieu travail nous cherisson est largement reconnu pour . prestation soins classe mondiale enfant . Notre mission est relier des technology des talent exceptionnel dans incidence sur vie chaque enfant . immediatement besoin d'un d'une analyste IA . Nous sommes analyste qualifie motive se pour pour les enfant les jeunes CHEO . IA contribuera projet d'apprentissage automatique science des donnees dans d'elaborer des algorithmes predictifs pour . Il s'agit d'une occasion interessante mental prochaine generation pour les enfant les adolescent leurs familles . supervision generale chercheuse principale mettre \u0153uvre ameliorer facon iterative cadre approprie science des donnees d'apprentissage automatique pour soutenir les objectifs des projet . Contribuer l'elaboration au deploiement modeles pertinent science des donnees d'apprentissage automatique pour obtenir des resultats tirer pleinement parti des donnees . evaluer recycler les systemes les modele . . Demontrer des competences specialisees des techniques science des donnees normalisees par exemple regression segmentation apprentissage profond documentation surveillance derive . . pour identifier acquerir nouvelles sources donnees fournir des conseils ce trait aux regle transformation des donnees necessaires pour preparer les donnees pour . Preparer les resultats des analysis aux fins d'examen compris les graphiques les tableaux les chiffres l'interpretation des resultats des . Tenir jour documentation code l'analyse les resultats afin travail puisse etre compris repete conformement codage . communication materiel technique comprehension technique des autres . Soutenir l'innovation identifiant maniere proactive complexe par l'application science des donnees des techniques d'apprentissage automatique . qualification biostatistique informatique science des donnees l'equivalent programmation technique d'apprentissage automatique Obligatoire Diplome formation complementaire biologie biochimie biostatistique bio informatique biologie appliquees apprentissage automatique recherche ainsi qu'une professionnelle deux ans biologie bio informatique apprentissage automatique Preferable Comprehension des structure donnees Obligatoire Maitrise d'un plusieurs langages programmation analytique tel Python Stata capacite apprendre s'adapter nouveaux langages programmation Obligatoire des outils visualisation des donnees pour une presentation efficace des resultats Obligatoire d'analyse donnees sous une supervision minimale demontrer haut niveau competence scientifique d'organisation d'attention aux detail Preferable Connaissance des technique quantitative normalisation standardisation statistique appliquees pour les resultats clinique travail utilisant grand ensemble architecture transformatrices d'apprentissage automatique travail sur les image traitement d'image vision informatique Preferable Excellentes capacites d'analyse resolution probleme . communication concise des concept scientifique l'analyse des donnees l'interpretation clinique des rapport . aptitude communication l'oral l'ecrit . Esprit d'initiative dynamisme passion pour son travail l'analyse donnees grande echelle . environnement rythme rapide ambition d'apporter une contribution . efficacement technique . condition TRAVAIL travail hybride pourrait fois inclure travail distance l'occasion travail sur place . Respecter politique universelle vaccination contre COVID l'IR du CHEO . POUR POSTULER complet une lettre motivation employeur souscrit au principe l'egalite d'acces . nous nous engageon fournir environnement travail inclusif sans obstacle commencant par nous qualifie . Les candidats auront besoin mesures d'adaptation durant processus demande dthemploi sont pries d'envoyer courriel aux Ressources humaines conformement personnes suivante . toutes ses activites l'education l'avancement carriere les partenariat avec les patient . nous valorison les parcour les perspectives carriere diversifies traditionnel ainsi les competences telles resilience collaboration l'etablissement relation . nous inviton les membres minorites racisees peuple autochtone identite genre minoritaire toute autre personne ayant les competences les connaissances necessaires presenter leur demande afin s'engager maniere productive aupres diverses communautes . Seules les candidature des personnes autorisees travailler seront prise consideration . nous remercion tous les candidats leur interet toutefois nous ne communiquerons qu'avec ceux celles seront convoques une entrevue . type salary location hybrid remote"
    },
    "companyDescription": "",
    "description": "JOB DESCRIPTION RI-23-053\nPosting Period: October 23, 2023 to November 6, 2023\nPOSITION: AI Research Analyst\nTERM: Full-time (FTE 1.0) \u2013 1 year contract with possibility of renewal\nSALARY: $60,000 - $70,000 CAD per annum, plus benefits\nREPORTS TO: Principal Investigator, Christine Armour\nChildren\u2019s Hospital of Eastern Ontario Research Institute (\u201cCHEO RI\u201d) is the research arm of the Children\u2019s Hospital of Eastern Ontario \u2013 Ottawa Children\u2019s Treatment Centre (\u201cCHEO\u201d) and an affiliated institute of the University of Ottawa. CHEO is a beloved institution and workplace that is widely recognized for being an anchor in our community. CHEO RI works to create new knowledge and evidence to support CHEO in its provision of world-class care for our children. Our mission at CHEORI is to connect exceptional talent and technology in pursuit of life-changing research for every child, youth and family in our community and beyond.\nCHEO RI has an immediate requirement for an AI Research Analyst.\nWe are seeking a highly skilled and motivated AI Research Analyst to join Dr. Christine Armour\u2019s research team, in support of the CHEO Precision Child and Youth Mental Health Initiative. The AI Research Analyst will contribute to a machine learning (ML) and data science project (via CHEO RI and BORN Ontario) with the goal of developing predictive algorithms for population-based datasets. This is an exciting opportunity to improve mental wellness for the next generation through cutting-edge mental health research leading to precision healthcare for children, youth and families.\nRESPONSIBILITIES\nUnder the general supervision of the Principal Investigator, the AI Research Analyst will:\n\n Design, implement, and iteratively improve an appropriate data science and machine learning framework to support the goals of the projects.\n Contribute to the development and deployment of appropriate data science and ML models to derive outcomes and obtain value from the data.\n Train, evaluate, and retrain systems and models as needed.\n Perform statistical analysis to report on experimental results and model testing.\n Demonstrate specialized skills and standardized data science techniques (e.g., regression, segmentation, deep learning, feature importance, model explainability, experiment logging, model drift monitoring, etc.).\n Work with a team to identify and acquire new data sources and provide input into data transformation rules required to prepare data for advanced analytics use cases.\n Prepare output of analyses for review including graphs, tables, figures, and interpretation of experimental results.\n Maintain documentation, code, analysis, and results so work can be understood and repeated in accordance with coding best practices.\n Contribute to insightful presentations, communicating technical material, and growing others\u2019 technical understanding.\n Support innovation by proactively identifying and championing projects that solve complex problems through the application of data science and ML techniques.\n\nQUALIFICATIONS, SKILLS, AND ABILITIES\n\n Master\u2019s degree in Applied Epidemiology/Biostatistics /Computer Science/Data Science, or equivalent, with a concentration in data science and machine learning programming and techniques (Required)\n Supporting degree or education in biology/biochemistry, biostatistics, bioinformatics, computational biology, computer science, applied mathematics, machine learning, perinatal research or related scientific fields with 2+ years\u2019 working experience in computational biology, bioinformatics and/or machine learning in pharma, biotech or academic setting (Preferred)\n Understanding of data structures, data modeling and software architecture (Required)\n Mastery of one or more analytical programming languages such as R, Python, SAS, Stata, and the ability to learn and adapt to new programming languages as needed. (Required)\n Demonstrated experience with data visualization techniques and tools for effective presentation of results (Required)\n Ability to define and develop data analysis strategies under minimal supervision with high degree of scientific competence and organizational attention to detail (Preferred)\n Knowledge of quantitative techniques (normalization, standardization, applied statistics) for clinical results (Preferred)\n Experience working with large-scale healthcare data sets (Preferred)\n Experience with Transformer-based ML architectures (Preferred)\n Experience working with images, image processing, and computer vision (Preferred)\n Outstanding analytical and problem-solving skills.\n Concise communication of scientific concepts, data analysis, clinical interpretation, and reporting.\n Excellent communication skills, verbal and written.\n High-energy self-starter with experience and passion for large scale data analysis. You enjoy working in fast-paced environments and love making an impact.\n Strong ability to prioritize and communicate to technical and non-technical audiences alike.\n\nWORKING CONDITIONS\n\n Flexibility to work in a hybrid work model that would include both remote work and occasional on-site work.\n\nOTHER REQUIREMENTS\n\n Eligible to work in Canada;\n Compliance with CHEO RI\u2019s Universal COVID-19 Vaccination Policy; and\n Police Record Check.\n\nTO APPLY\nPlease send a complete CV and cover letter to Lia Blake: lblake@bornontario.ca.\nThe CHEO Research Institute values diversity and is an equal opportunity employer. We are committed to providing an inclusive and barrier-free work environment, starting with the hiring process and welcome interest from all qualified applicants. Should an applicant require any accommodations during the application process, as per the Accessibility for Ontarians with Disabilities Act, please notify Human Resources at researchhr@cheo.on.ca.\nThe CHEO Research Institute seeks to increase equity, diversity and inclusion in all of its activities, including research, education and career development, patient, family and donor partnerships. We value diverse and non-traditional career paths and perspectives, and value skills such as resilience, collaboration, and relationship-building. We welcome applications from members of racialized minorities, Indigenous peoples, persons with disabilities, persons of minority sexual orientations and gender identities, and others with the skills and knowledge to productively engage with diverse communities.\nApplications will only be considered from those that are eligible to work in Canada. We thank all applicants for their interest, however, only those invited for an interview will be contacted.\nDESCRIPTION DE POSTE RI-23-053\nP\u00e9riode d\u2019affichage \u2014 du 23 octobre au 6 novembre 2023\nPOSTE : Analyste de recherche en IA\nDUR\u00c9E : Poste \u00e0 temps plein (ETP 1,0) \u2014 contrat d\u2019un (1) an avec possibilit\u00e9 de renouvellement\nSALAIRE : 60\u2009000 $ \u2013 70\u2009000 $ CAN par ann\u00e9e, plus les avantages sociaux\nREL\u00c8VE DE : Chercheuse principale, Christine Armour\nL\u2019Institut de recherche du Centre hospitalier pour enfants de l\u2019est de l\u2019Ontario (\u00ab\u2009IR de CHEO\u2009\u00bb) est l\u2019organisme de recherche du Centre de traitement pour enfants du Centre hospitalier pour enfants de l\u2019est de l\u2019Ontario situ\u00e9 \u00e0 Ottawa (\u00ab\u2009CHEO\u2009\u00bb), et un institut affili\u00e9 de l\u2019Universit\u00e9 d\u2019Ottawa. CHEO est une institution et un milieu de travail que nous ch\u00e9rissons et qui est largement reconnu pour \u00eatre une source de soutien dans notre collectivit\u00e9. L\u2019IR de CHEO travaille pour cr\u00e9er de nouvelles connaissances et de nouvelles preuves pour soutenir CHEO dans sa prestation de soins de classe mondiale \u00e0 nos enfants. Notre mission, \u00e0 l\u2019Institut de recherche de CHEO, est de relier des technologies et des talents exceptionnels dans la poursuite de recherches qui ont une incidence sur la vie de chaque enfant, jeune et famille de notre collectivit\u00e9 et ailleurs.\nL\u2019IR de CHEO a imm\u00e9diatement besoin d\u2019un ou d\u2019une analyste de recherche en IA.\nNous sommes \u00e0 la recherche d\u2019un analyste de recherche en IA hautement qualifi\u00e9 et motiv\u00e9 qui se joindra \u00e0 l\u2019\u00e9quipe de recherche de la Dre Christine Armour pour appuyer l\u2019Initiative de sant\u00e9 mentale de pr\u00e9cision pour les enfants et les jeunes de CHEO. L\u2019analyste de recherche en IA contribuera \u00e0 un projet d\u2019apprentissage automatique (ML) et de science des donn\u00e9es (par l\u2019entremise de l\u2019IR de CHEO et de BORN Ontario) dans le but d\u2019\u00e9laborer des algorithmes pr\u00e9dictifs pour les ensembles de donn\u00e9es d\u00e9mographiques. Il s\u2019agit d\u2019une occasion int\u00e9ressante d\u2019am\u00e9liorer le mieux-\u00eatre mental de la prochaine g\u00e9n\u00e9ration gr\u00e2ce \u00e0 des recherches de pointe en sant\u00e9 mentale, qui m\u00e8nent \u00e0 des soins de sant\u00e9 de pr\u00e9cision pour les enfants, les adolescents et leurs familles.\nRESPONSABILIT\u00c9S\nSous la supervision g\u00e9n\u00e9rale de la chercheuse principale, l\u2019analyste de recherche en IA devra :\n\n Concevoir, mettre en \u0153uvre et am\u00e9liorer de fa\u00e7on it\u00e9rative un cadre appropri\u00e9 de science des donn\u00e9es et d\u2019apprentissage automatique pour soutenir les objectifs des projets.\n Contribuer \u00e0 l\u2019\u00e9laboration et au d\u00e9ploiement de mod\u00e8les pertinents de science des donn\u00e9es et d\u2019apprentissage automatique pour en obtenir des r\u00e9sultats et tirer pleinement parti des donn\u00e9es.\n Former, \u00e9valuer et recycler les syst\u00e8mes et les mod\u00e8les, au besoin.\n Effectuer une analyse statistique pour rendre compte des r\u00e9sultats des exp\u00e9riences et des essais de mod\u00e8les.\n D\u00e9montrer des comp\u00e9tences sp\u00e9cialis\u00e9es et des techniques de science des donn\u00e9es normalis\u00e9es (par exemple, r\u00e9gression, segmentation, apprentissage profond, documentation de l\u2019importance des caract\u00e9ristiques et de l\u2019explicabilit\u00e9 des mod\u00e8les, surveillance de la d\u00e9rive des mod\u00e8les, etc.).\n Travailler avec une \u00e9quipe pour identifier et acqu\u00e9rir de nouvelles sources de donn\u00e9es, et fournir des conseils en ce qui a trait aux r\u00e8gles de transformation des donn\u00e9es n\u00e9cessaires pour pr\u00e9parer les donn\u00e9es pour les cas d\u2019utilisation analytique avanc\u00e9e.\n Pr\u00e9parer les r\u00e9sultats des analyses aux fins d\u2019examen, y compris les graphiques, les tableaux, les chiffres et l\u2019interpr\u00e9tation des r\u00e9sultats des exp\u00e9riences.\n Tenir \u00e0 jour la documentation, le code, l\u2019analyse et les r\u00e9sultats afin que le travail puisse \u00eatre compris et r\u00e9p\u00e9t\u00e9 conform\u00e9ment aux pratiques exemplaires de codage.\n Contribuer \u00e0 l\u2019\u00e9laboration de pr\u00e9sentations \u00e9clair\u00e9es, \u00e0 la communication de mat\u00e9riel technique et \u00e0 la compr\u00e9hension technique des autres.\n Soutenir l\u2019innovation en identifiant de mani\u00e8re proactive et en d\u00e9fendant des projets qui r\u00e9solvent des probl\u00e8mes complexes par l\u2019application de la science des donn\u00e9es et des techniques d\u2019apprentissage automatique.\n\nQUALIFICATIONS, COMP\u00c9TENCES ET CAPACIT\u00c9S\n\n Ma\u00eetrise en \u00e9pid\u00e9miologie appliqu\u00e9e, en biostatistique, en informatique, en science des donn\u00e9es, ou l\u2019\u00e9quivalent, avec une concentration en sciences des donn\u00e9es et en programmation et techniques d\u2019apprentissage automatique (Obligatoire)\n Dipl\u00f4me ou formation compl\u00e9mentaire en biologie ou en biochimie, en biostatistique, en bio-informatique, en biologie computationnelle, en informatique, en math\u00e9matiques appliqu\u00e9es, en apprentissage automatique, en recherche p\u00e9rinatale ou dans un domaine scientifique connexe, ainsi qu\u2019une exp\u00e9rience professionnelle de plus de deux (2) ans en biologie computationnelle, en bio-informatique et (ou) en apprentissage automatique dans le secteur pharmaceutique, biotechnologique ou universitaire (Pr\u00e9f\u00e9rable)\n Compr\u00e9hension des structures de donn\u00e9es, de la mod\u00e9lisation des donn\u00e9es et de l\u2019architecture logicielle (Obligatoire)\n Ma\u00eetrise d\u2019un ou plusieurs langages de programmation analytique tels que R, Python, SAS, Stata, et capacit\u00e9 \u00e0 apprendre et \u00e0 s\u2019adapter \u00e0 de nouveaux langages de programmation, au besoin (Obligatoire)\n Exp\u00e9rience d\u00e9montr\u00e9e des techniques et des outils de visualisation des donn\u00e9es pour une pr\u00e9sentation efficace des r\u00e9sultats (Obligatoire)\n Capacit\u00e9 de d\u00e9finir et d\u2019\u00e9laborer des strat\u00e9gies d\u2019analyse de donn\u00e9es sous une supervision minimale et de d\u00e9montrer un haut niveau de comp\u00e9tence scientifique, d\u2019organisation et d\u2019attention aux d\u00e9tails (Pr\u00e9f\u00e9rable)\n Connaissance des techniques quantitatives (normalisation, standardisation, statistiques appliqu\u00e9es) pour les r\u00e9sultats cliniques (Pr\u00e9f\u00e9rable)\n Exp\u00e9rience de travail en utilisant de grands ensembles de donn\u00e9es de soins de sant\u00e9 (Pr\u00e9f\u00e9rable)\n Exp\u00e9rience avec les architectures transformatrices d\u2019apprentissage automatique (Pr\u00e9f\u00e9rable)\n Exp\u00e9rience de travail sur les images, le traitement d\u2019images et la vision informatique (Pr\u00e9f\u00e9rable)\n Excellentes capacit\u00e9s d\u2019analyse et de r\u00e9solution de probl\u00e8mes.\n Communication concise des concepts scientifiques, de l\u2019analyse des donn\u00e9es, de l\u2019interpr\u00e9tation clinique et des rapports.\n Excellentes aptitudes de communication, \u00e0 l\u2019oral et \u00e0 l\u2019\u00e9crit.\n Esprit d\u2019initiative, dynamisme, passion pour son travail, et exp\u00e9rience de l\u2019analyse de donn\u00e9es \u00e0 grande \u00e9chelle. Capacit\u00e9 de travailler harmonieusement dans un environnement \u00e0 rythme rapide et ambition d\u2019apporter une contribution.\n Forte capacit\u00e9 d\u2019\u00e9tablir les priorit\u00e9s et de communiquer efficacement avec des publics techniques et non techniques.\n\nCONDITIONS DE TRAVAIL\n\n Souplesse de travailler dans un mod\u00e8le de travail hybride qui pourrait \u00e0 la fois inclure le travail \u00e0 distance et, \u00e0 l\u2019occasion, le travail sur place.\n\nAUTRES EXIGENCES\n\n \u00catre autoris\u00e9 \u00e0 travailler au Canada;\n Respecter la politique universelle de vaccination contre la COVID-19 de l\u2019IR du CHEO;\n V\u00e9rification du casier judiciaire.\n\nPOUR POSTULER\nVeuillez envoyer un CV complet et une lettre de motivation \u00e0 Lia Blake : lblake@bornontario.ca\nL\u2019Institut de recherche de CHEO valorise la diversit\u00e9 et est un employeur qui souscrit au principe de l\u2019\u00e9galit\u00e9 d\u2019acc\u00e8s. Nous nous engageons \u00e0 fournir un environnement de travail inclusif et sans obstacle, en commen\u00e7ant par le processus d\u2019embauche, et nous sommes heureux de recevoir les demandes de tous les candidats\nqualifi\u00e9s. Les candidats qui auront besoin de mesures d\u2019adaptation durant le processus de demande d\u2019emploi sont pri\u00e9s d\u2019envoyer un courriel aux Ressources humaines, conform\u00e9ment \u00e0 la Loi sur l\u2019accessibilit\u00e9 pour les personnes handicap\u00e9es de l\u2019Ontario \u00e0 l\u2019adresse suivante : researchhr@cheo.on.ca.\nL\u2019Institut de recherche de CHEO cherche \u00e0 accro\u00eetre l\u2019\u00e9quit\u00e9, la diversit\u00e9 et l\u2019inclusion dans toutes ses activit\u00e9s, notamment la recherche, l\u2019\u00e9ducation, l\u2019avancement de carri\u00e8re et les partenariats avec les patients, la famille et les donateurs. Nous valorisons les parcours et les perspectives de carri\u00e8re diversifi\u00e9s et non traditionnels, ainsi que les comp\u00e9tences telles que la r\u00e9silience, la collaboration et l\u2019\u00e9tablissement de relations. Nous invitons les membres de minorit\u00e9s racis\u00e9es ou de peuples autochtones, les personnes handicap\u00e9es, les personnes ayant une orientation sexuelle ou une identit\u00e9 de genre minoritaire, et toute autre personne ayant les comp\u00e9tences et les connaissances n\u00e9cessaires \u00e0 pr\u00e9senter leur demande, afin de s\u2019engager de mani\u00e8re productive aupr\u00e8s de diverses communaut\u00e9s.\nSeules les candidatures des personnes autoris\u00e9es \u00e0 travailler au Canada seront prises en consid\u00e9ration. Nous remercions tous les candidats de leur int\u00e9r\u00eat, toutefois, nous ne communiquerons qu\u2019avec ceux et celles qui seront convoqu\u00e9s \u00e0 une entrevue.\nJob Type: Full-time\nSalary: $60,000.00-$70,000.00 per year\nWork Location: Hybrid remote in Ottawa, ON K1H 8L1"
}