{
    "id": "4b472e5885567227",
    "company": "National Arts Centre",
    "positionName": "LAUNDRY ATTENDANT",
    "jobType": [],
    "location": "Ottawa, ON",
    "salary": null,
    "postingDateParsed": "2024-01-20T05:10:03.634Z",
    "url": "https://www.indeed.ca/rc/clk?jk=4b472e5885567227&from=jasx&tk=1hkik8vp5k633800&bb=3fcFSWL0Q64YUe5hx9GNdk5PB2BZa75y3lnytpFJUx7v_Sey4UkXhsaXKgF2CagBQrL7mGrIue0uj7ZUfFoUralH0B4SFNIkfWPjlbQFnOMK-voNNvxBPw%3D%3D&xkcb=SoC_67M3FSgsJ1gB1z0LbzkdCdPP&vjs=3",
    "externalApplyLink": "https://nac.njoyn.com/cl4/xweb/xweb.asp?tbtoken=Z1teSx1YDVAGYnQHRFwhYE9KeRIsaVUvdFRMWy5%2FfHleLTcdLTBoBxRwcUQYGhJWTHJiF3U%3D&chk=ZVpaShM%3D&CLID=74526&page=jobdetails&JobID=J1122-1597&lang=1",
    "job_info_group": {
        "extracted_phone_numbers": [],
        "extracted_links": [
            "HTTP/HTTPS Links",
            "General Links",
            "WWW Links",
            "TLDs"
        ],
        "extracted_emails": [],
        "extracted_location_data": [
            "Canada"
        ],
        "extracted_dates": [
            "our 2023-2026 Strategic Plan",
            "February 25, 2024",
            "January 19, 2024 Closing Date:"
        ],
        "extracted_languages": [],
        "extracted_laws": [],
        "extracted_norps": [],
        "extracted_orgs": [
            "The NAC",
            "French Theatre, Indigenous Theatre",
            "Aware of occupational Health and Safety",
            "Working Hours",
            "WHMIS",
            "English Theatre",
            "the NAC",
            "Popular Music and Variety",
            "the NAC Orchestra, Dance",
            "the Anishinabe Algonquin Nation",
            "Preference",
            "the National Arts Centre",
            "The National Arts Centre"
        ],
        "extracted_persons": [
            "the Executive Sous Chef",
            "Executive Sous Chef Key Activities Reporting"
        ],
        "extracted_products": [],
        "extracted_money": [
            {
                "amount": "$19.41 - $",
                "noun_phrases": []
            }
        ],
        "processed_text": "introduce NAC Canada's multi disciplinary perform art . NAC create produce produce perform art programming stream nurture generation audience artist . locate traditional unceded unsurrendered territory . perform art vital human . house dream canadian perform art artist art organization land revitalize sector . curious learn read . Equity Diversity Inclusion Anti Racism accessibility journey commit ensure equity diversity inclusion accessibility anti racism reconciliation indigenous people guide action . application help meet vision contribute diversity live perspective approaches. join inclusive community hard dismantle barrier employees' access potential success . actively seek identify woman Indigenous Black person Colour IBPoC 2slgbtqia+ community people . encourage identify recruitment process . number J1122 title LAUNDRY ATTENDANT employment type continue Category Hospitality Open Positions posting salary Hour Language Requirement asset include evening weekend holiday report responsible washing dry press tablecloth napkin uniform duty . skill Requirements high school diploma equivalent asset institutional commercial laundry asset Operation laundry machinery basic knowledge laundry chemistry care fabric basic understanding procedure proper handling hazardous material pressure busy environment flexibility availability irregular schedule meet business evening weekend holiday stand shift . physically safely lift wet laundry lift lb regular basis stand exert pace mobility official language asset record satisfactory attendance punctuality requirement . regular attendance expectation employment essential . apply person reside canadian citizen reside abroad . canadian citizen . NAC's interview process person interview require . ensure information resume include current email address . appreciate application select interview contact . Notice National Arts Centre NAC commit inclusive employee recruitment selection . encourage application people . require accommodation selection process inform effort fulfill accommodation request . successful require provide original true certify copy education credential appropriate proof valid Criminal Background check condition employment ."
    },
    "companyDescription": "",
    "description": "Introducing the National Arts Centre The National Arts Centre (NAC) is Canada's bilingual, multi-disciplinary home for the performing arts. The NAC presents, creates, produces, and co-produces performing arts programming in various streams-the NAC Orchestra, Dance, English Theatre, French Theatre, Indigenous Theatre, and Popular Music and Variety-and nurtures the next generation of audiences and artists from across Canada. The NAC is located on the traditional, unceded, unsurrendered territory of the Anishinabe Algonquin Nation.  At the National Arts Centre, we believe the performing arts are vital to the human experience. A house of dreams for the Canadian performing arts, we work with artists and arts organizations from across this land to revitalize our sector.  Curious to learn more? Read our 2023-2026 Strategic Plan, The Journey Ahead.  Equity, Diversity, Inclusion, Anti-Racism and Accessibility We are on a journey, committed to ensuring that equity, diversity, inclusion, accessibility, anti-racism and reconciliation with Indigenous peoples will guide our actions.   The NAC welcomes applications from?candidates who can help us meet our vision, and contribute to the diversity of?lived experiences, perspectives, and approaches.?When you join the NAC, you will be part of an inclusive?community working hard to dismantle barriers to employees'?well-being, access, potential, and success. The NAC actively seeks candidates who identify as women, Indigenous, Black, Persons of Colour (IBPoC), members of 2SLGBTQIA+ communities, and people?with disabilities. We encourage you to self-identify in the recruitment process. \n  \n \n \n  \n   Job Number: J1122-1597 \n  \n  \n   Job Title: LAUNDRY ATTENDANT \n  \n  \n   Employment Type: Part-Time continuing \n  \n  \n   Job Category: Hospitality \n  \n  \n   Open Positions: 1 \n  \n  \n   Posting Date: January 19, 2024 \n  \n  \n   Closing Date: February 25, 2024 \n  \n  \n   Salary: $19.41 - $19.41/Hour \n  \n  \n   Language Requirement: Bilingual is an asset \n  \n  \n   Working Hours: As needed, including afternoons, evenings, weekends and holidays \n  \n  \n   Job Reports To: Executive Sous Chef\n    \n  \n \n  \n  \n  \n \n \n  \n   Key Activities \n   Reporting to the Executive Sous Chef, you will be responsible for washing, drying and pressing tablecloths, napkins and uniforms and other related duties. \n  \n  \n   Skill Requirements \n   \n    High school diploma or equivalent is an asset;\n    One year experience in an institutional or commercial laundry is an asset;\n    Operation of laundry machinery and basic knowledge of laundry chemistry and care of fabrics;\n    Basic understanding of WHMIS;\n    Aware of occupational Health and Safety procedures and proper handling of hazardous materials;\n    Ability to work under pressure in a very busy environment;\n    Flexibility and availability to work an irregular schedule to meet business needs (days, evenings, weekends and holidays); \n    Able to stand at all times during the shift.\n    Physically able to safely lift and move wet laundry;\n    Must be able to lift up to 30 lbs on a regular basis;\n    Must be able to stand & exert well-paced mobility for up to 12 hours;\n    Bilingual in both official languages would be an asset;\n    A past record of satisfactory attendance and punctuality is a requirement*.\n   \n    \n   \n    Regular attendance at work is an expectation of employment and an essential part of every job.\n    \n  \n  \n   Who Can Apply \n   Persons residing in Canada and Canadian citizens residing abroad. Preference will be given to Canadian citizens.  As part of NAC's interview process, in-person interviews may be required. Please ensure to have the most up-to-date information on your r\u00e9sum\u00e9 including your current email address.  While we appreciate all applications, only those selected for an interview will be contacted by us. \n  \n  \n   Important Notice \n   The National Arts Centre (NAC) is committed to inclusive employee recruitment and selection. The NAC welcomes and encourages applications from people with disabilities. If you require accommodation during the selection process, please inform us as soon as possible and we will make every effort to fulfill your accommodation request.  The successful candidate will be required to provide the original or a true certified copy of their education credentials as appropriate, along with proof of a valid Criminal Background Check as a condition of employment."
}