{
    "id": "0ffdeb643db547ee",
    "company": "Canadian Security Intelligence Service",
    "positionName": "Student: Science and Research",
    "jobType": [],
    "location": "Ottawa, ON",
    "salary": null,
    "postingDateParsed": "2023-10-01T20:09:06.661Z",
    "url": "https://www.indeed.ca/rc/clk?jk=0ffdeb643db547ee&from=jasx&tk=1he3lkogbirpe800&vjs=3",
    "externalApplyLink": "https://ca.indeed.com/rc/clk?jk=0ffdeb643db547ee&atk=&xpse=SoA367I3IDjauVSKHR0LbzkdCdPP",
    "job_info_group": {
        "extracted_phone_numbers": [],
        "extracted_links": [
            "HTTP/HTTPS Links",
            "General Links",
            "WWW Links",
            "TLDs"
        ],
        "extracted_emails": [],
        "extracted_location_data": [
            "(Quebec",
            "Ontario Montreal (Quebec) Toronto",
            "Canada"
        ],
        "extracted_dates": [
            "Winter 2025",
            "every four months",
            "January \u2013 April",
            "12 or 16 months",
            "8"
        ],
        "extracted_languages": [],
        "extracted_laws": [
            "the Privacy Act"
        ],
        "extracted_norps": [
            "the Canadians",
            "Canadians"
        ],
        "extracted_orgs": [
            "Canadian Security Intelligence Service Offices",
            "The Canadian Security Intelligence Service",
            "Applied Science Chemistry Biochemistry Applicants",
            "the Public Service Employment Act",
            "scientific domains Teamwork",
            "Diverse work force Education Candidates",
            "Working",
            "Program of Study: Post Secondary School",
            "Canadian Security Intelligence Service",
            "Security Requirements Candidates"
        ],
        "extracted_persons": [
            "PSEA"
        ],
        "extracted_products": [],
        "extracted_money": [],
        "processed_text": "discuss application include social medium partner close family remind discreet . close Reference Number STU STS Category op Internship program Student apply canadian Citizens Location Salary Range hourly Salary Status Term month Language Requirement language requirement Summary term commit build workforce representative serve cultivate diverse inclusive workplace environment . achieve increase employment equity group representation include person visible minority indigenous people woman level organization hiring talent management practice . ensure appropriate accommodation e.g. specialized equipment change physical workspace provide employment qualified . support achieve great diverse skilled workforce encourage individual belong employment equity group identify apply student thrive tackle diverse challenge unique environment . challenge join high performing team doubt contribution provide meaningful impact mission help safe national security threat . offer student gain valuable possibility return multiple placement area . student cultivate skill knowledge pair experienced employee provide feedback term . broaden knowledge choose career specialization . system allow select location . interested consider location mention highlight cover letter additional location apply . program design identify develop potential employee . student assist task include limit follow hand project variety individual contribution exposure knowledgeable passionate subject matter expert Collaborative environment improve project management skill currently enrol graduate level science program Masters Doctorate Level . subject area interest include limit register post secondary student accredited academic institution recognize term . special consideration enrol accredited op internship program . preferable acquire formal informal setting e.g. school volunteer project . interpret research specification develop plan satisfy requirement . conduct desktop research multiple source gather datum . analyze interpret pattern trend . anticipate research issue resolve . write proposal deliver presentation require . planning conduct experiment processing analyze result datum collaborate industry academia apply result research develop technique product practice multidisciplinary team academia industry . competency problem solve Analytical Skills Teamwork Communication Initiative Conditions Employment Applicants register post secondary student accredited academic institution recognize . priority consideration enrol accredited op internship program . note submit application applicant include follow information cover letter order consideration student Graduation location interest indicate desire location applicable . travel cost benefit apply . information disclose interview process . Category \u2013 apply op placement internship specific current program enrollment student . availability term current study expect graduation . tips Cover Letter resume story objective . technical applicable . volunteer applicable . project applicable . second language evaluation test administer . simply fill student placement position . program design identify develop potential employee . apply high volume application . failure provide requested information result rejection application . eligible receive Enhanced secret security clearance . process involve security interview polygraph background investigation include credit financial verification . illegal drug criminal offense . drug factor consider reliability suitability assessment selection process . illegal drug submit application . Applicants demonstrate application meet Education criterion . failure result applicant screen career . separate employer subject . classification compensation system staffing regime . staffing process terminology . committed build workforce representative serve cultivate diverse inclusive workplace environment . achieve increase employment equity group representation include person visible minority indigenous people woman level organization hiring talent management practice . ensure appropriate accommodation e.g. specialized equipment change physical workspace provide employment qualified . support achieve great diverse skilled workforce encourage individual belong employment equity group identify apply . require accommodation relation selection process . information confidential . locate ancestral traditional land . spirit reconciliation acknowledge Indigenous People connection land . personal information provide application protect hold Personal Information Bank SIS PU . applicant interest . select consideration contact ."
    },
    "companyDescription": "",
    "description": "Important \n      Do not discuss your application with others (including on social media) besides your partner, or close family members - who should also be reminded about the need to be discreet. \n      \n    \n   \n  \n  \n   \n    \n     \n      \n       \n        \n         \n          Closing Date\n          \n         \n          2023-11-10\n          \n        \n         \n        \n         \n          Reference Number\n          \n         \n          25-968-STU-STS-01\n          \n        \n         \n        \n         \n          Job Category\n          \n         \n           Co-op \n           Internship program \n           Student Job\n         \n          \n        \n         \n        \n         \n           Who Can Apply\n          \n         \n          Canadian Citizens\n          \n        \n         \n       \n      \n     \n    \n    \n     \n      \n       \n        \n         \n          Location\n          \n         \n           Ottawa, Ontario \n           Montreal (Quebec) \n           Toronto (Quebec)\n         \n          \n        \n         \n        \n         \n           Salary Range\n          \n         \n          Hourly Salary\n          \n        \n         \n        \n         \n          Status\n          \n         \n          Term - 4 to 16 months\n          \n        \n         \n        \n         \n          Language Requirement\n          \n         \n          Various language requirements\n          \n        \n         \n       \n      \n     \n    \n   \n  \n  \n   \n    \n     Job Summary \n    \n   \n  \n  \n   Work Term: Winter 2025 (January \u2013 April) \n    The Canadian Security Intelligence Service (CSIS) is committed to building a workforce that is truly representative of the Canadians it serves by cultivating a diverse and inclusive workplace environment. This will be achieved by increasing employment equity group representation (including persons with disabilities, visible minorities, Indigenous peoples and women) at all levels within the organization through hiring and talent management practices. We will also ensure that appropriate accommodations are made (e.g., specialized equipment, changes to the physical workspace) to provide employment opportunities for all qualified candidates. In support of achieving a greater, diverse and skilled workforce, we strongly encourage those individuals who belong to one or more of the employment equity groups to self-identify when applying \n    CSIS is looking for students who thrive on tackling diverse challenges in a unique environment. If you are up for the challenge and want to join one of our highest performing teams, there is no doubt that your contributions to CSIS will provide a meaningful impact to our mission of helping keep Canadians safe against national security threats. \n    CSIS offers opportunities for students to gain valuable experience with the possibility to return for multiple placements in different areas. Students will be given the opportunity to cultivate their skills and knowledge by being paired with experienced employees who will provide feedback during the work term. They will have the opportunity to broaden their knowledge and experience before choosing a career specialization. \n    The system will allow you to select only one location of work. If you are interested to be considered for various locations of work as mentioned above, please highlight, in your cover letter, the additional locations you would like to apply to. \n    Our program is designed to identify and develop potential full-time employees. \n    Students will assist with tasks including but not limited to the following: \n    \n    Hands on work experience with projects in a variety of scientific domains \n    Teamwork and individual contributions \n    Exposure to knowledgeable and passionate subject matter experts \n    Collaborative work environments \n    Improve time and project management skills \n    Diverse work force \n   \n  \n  \n   \n    \n     Education \n    \n   \n  \n  \n   Candidates must be currently enrolled in a graduate level science program (Masters or Doctorate Level). Subject areas of interest include but are not limited to: \n    \n    Applied Science \n    Chemistry \n    Biochemistry \n    \n   Applicants must be registered as a full-time, post-secondary student in an accredited academic institution recognized in Canada during their work term. Special consideration may be given to those enrolled in an accredited co-op/internship program. \n  \n  \n  \n   Candidates with experience with the following is preferable: \n    Experience may have been acquired through formal and informal settings (e.g. school, volunteer, work experience or projects). \n    \n    Interpreting research specifications and developing a work plan that satisfies requirements. \n    Conducting desktop research, and using multiple sources to gather data. \n    Analyzing and interpreting patterns and trends. \n    Anticipating research issues and promptly resolving them. \n    Writing proposals and delivering presentations when required. \n    Planning and conducting experiments \n    Processing and analyzing results and data \n    Collaborating with industry/academia to apply the results of research and develop new techniques, products or practices \n    Working in multidisciplinary teams, with academia or industry. \n   \n  \n  \n   \n    \n     Competencies \n    \n   \n  \n  \n   \n    Problem Solving \n    Analytical Skills \n    Teamwork \n    Communication \n    Initiative \n   \n  \n  \n   \n    \n     Conditions of Employment \n    \n   \n  \n  \n   Applicants must be registered as a full-time, post-secondary student in an accredited academic institution recognized in Canada. Priority consideration may be given to those enrolled in an accredited co-op/internship program. \n  \n  \n   \n    \n     Notes \n    \n   \n  \n  \n   How to submit application: \n    Applicants MUST include the following information in their cover letter in order to be given further consideration: \n    Name of Student: \n    Graduation date: \n    Program of Study: \n    Post Secondary School: \n    \n    Location of interest:\n      \n      Indicate your desired location of work if applicable. \n      Travel costs benefits may apply. Further information will be disclosed during the interview process. \n     \n    Job Category \u2013 Applying for a co-op placement, internship (specific to current program enrollment) or student job. \n    Availability of your work term (4, 8, 12 or 16 months)? \n    Your current year of study and expected graduation date. \n    \n   Tips for your Cover Letter and Resume: \n    \n    Tell us your story: why do you want to work for CSIS? \n    Work objectives. \n    Technical abilities (where applicable). \n    Volunteer or work Experience (where applicable). \n    Projects (where applicable). \n    \n   Second language evaluation tests may be administered. \n    At CSIS, we are not looking to simply fill student placement positions every four months. Our program is designed to identify and develop potential full-time employees. \n    Candidates are asked to apply once, due to the high volume of applications. \n    Failure to provide the requested information may result in the rejection of your application.\n    \n  \n  \n  \n   \n    \n     \n    \n   \n  \n  \n   \n    \n     Security Requirements \n    \n   \n  \n  \n   \n    \n     Candidates must be eligible to receive an Enhanced Top Secret security clearance. The process involves a security interview, a polygraph, and a background investigation that includes credit and financial verifications. The use of illegal drugs is a criminal offense. Drug use is an important factor considered in your reliability and suitability assessment during the selection process. Therefore it is important not to use any illegal drugs from the time you submit your application. \n    \n   \n  \n  \n   \n    \n     Others \n    \n   \n  \n  \n   \n    \n     \n      Important \n      \n       Applicants must clearly demonstrate in their application how they meet each Education and Experience criteria. Failure to do so will result in the applicant being screened out of the career opportunity.\n       \n       CSIS is a separate employer and is not subject to the Public Service Employment Act (PSEA). CSIS has its own classification, compensation system, and a different staffing regime. As such, we use a different staffing process and terminology. \n       CSIS is committed to building a workforce that is truly representative of the Canadians it serves by cultivating a diverse and inclusive workplace environment. This will be achieved by increasing employment equity group representation (including persons with disabilities, visible minorities, Indigenous peoples, and women) at all levels within the organization through hiring and talent management practices. We will also ensure that appropriate accommodations are made (e.g., specialized equipment, changes to physical workspace) to provide employment opportunities for all qualified candidates. In support of achieving a greater, diverse and skilled workforce, we strongly encourage those individuals who belong to one or more of the employment equity groups to self-identify when applying. \n       Should you require accommodation in relation to a disability, please tell us at the beginning of the selection process. This information will be kept confidential. \n       CSIS Offices in Canada are located on various ancestral and traditional lands. In the spirit of reconciliation, we acknowledge all Indigenous People across Canada and their connection to these lands. \n       The personal information provided in your application is protected under the Privacy Act and will be held in Personal Information Bank SIS/P-PU-025. \n     \n    \n   \n  \n  \n   \n    \n     We thank all applicants for their interest in CSIS. However, only those who are selected for further consideration will be contacted."
}