{
    "id": "54530145a2439096",
    "company": "Vars Concrete",
    "positionName": "Artwork Coordinator",
    "jobType": [],
    "location": "2 Gurdwara Rd, Nepean, ON",
    "salary": null,
    "postingDateParsed": "2023-10-06T02:05:02.327Z",
    "url": "https://www.indeed.ca/rc/clk?jk=54530145a2439096&from=jasx&tk=1hc6geptqk7pr800&vjs=3",
    "externalApplyLink": null,
    "job_info_group": {
        "extracted_phone_numbers": [],
        "extracted_links": [
            "HTTP/HTTPS Links",
            "General Links",
            "WWW Links",
            "TLDs"
        ],
        "extracted_emails": [],
        "extracted_location_data": [
            "Ottawa"
        ],
        "extracted_dates": [
            "2005",
            "2 years",
            "2023-11-01",
            "Friday",
            "Monday"
        ],
        "extracted_languages": [],
        "extracted_laws": [],
        "extracted_norps": [],
        "extracted_orgs": [
            "Primary Duties & Responsibilities Manage",
            "DCS / DEC",
            "Marcan Pharmaceuticals",
            "Marcan Pharmaceuticals Inc.",
            "Health Canada",
            "Emcure Pharmaceuticals",
            "Prepare"
        ],
        "extracted_persons": [],
        "extracted_products": [
            "Collaborate",
            "Illustrator"
        ],
        "extracted_money": [
            {
                "amount": "50,000.00-$60,000.00",
                "noun_phrases": []
            }
        ],
        "processed_text": "currently search dynamic detail orient individual join artwork Coordinator Graphic Design skill . locate nation's capital company vision develop manufacture supply low cost high quality finished dose generic canadian marketplace . global multinational company product sell country globally . strong organizational communication attention detail administrative skill . school diploma equivalency certificate require . relevant area prefer . permanent position . entire design life cycle design inception label approval finish product label inspection manage artwork approval process customer develop label maintain system tracking artwork maintain file current deadline packaging configuration product label creation send cross license artwork HC submission updating artwork base HC recommendation coordinate supplier deadline Proof Approve Marcan label maintain database product relate code web design maintenance multichannel company ensure communication project label timeline understand Design create marketing material retail include limit poster online post trade material Design maintain company logo \u2013 Letterhead envelope business card . french English translation Desired Skills Strong organization communication administrative skill industry lead software technology Photoshop mandatory Collaborative attitude creatively develop design concept graphic layout creative team bring concept creative idea life amend final design management comment gain approval management skill meet deadline multiple project attention detail calm steady fast change environment essential critical thinking photo editing manipulation solid understanding print digital production good practice prepare design print publication Enthusiastic motivated independently . solid communication skill capable wide range people multiple discipline . stay current design trend . box offer unique design solution . highly creative imaginative strong design interpersonal skill . strong understanding pre press process . receive constructive feedback provide solution uphold integrity main idea . statement reflect general detail consider performance duty . construe detailed description requirement . valid permit consider . accommodation hire manager . applicant interest select interview contact . type salary benefit dental care extended health care Paid Schedule supplemental pay type bonus pay commute relocate Nepean K2E 1a2 reliably commute plan relocate start require education preferred graphic design require location person application deadline start"
    },
    "companyDescription": "",
    "description": "We are currently searching for a dynamic and detail oriented individual to join Marcan Pharmaceuticals as an Artwork Coordinator with Graphic Design skills.\nMarcan Pharmaceuticals Inc., located in the nation\u2019s capital Ottawa, a company that was founded in 2005 with the vision to develop, manufacture & supply low cost, high quality finished dose generics in the Canadian marketplace. We are now part of Emcure Pharmaceuticals a global multinational company with product being sold to over 65 countries globally.\nStrong organizational, communication, attention to detail and administrative skills are important. School diploma or equivalency certificate is required. Experience of 2 years in the relevant area is preferred. The job is full time permanent position.\nPrimary Duties & Responsibilities\n\n Manage the entire design life cycle from design inception to label approval to finished product label inspection\n Manage the artwork approval process for all customers that are developing their own labels\n Maintain a system for tracking artwork\n Maintain files with current deadlines and packaging configurations\n Product label creation\n Prepare and send cross license artwork for Health Canada (HC) submissions\n Updating artwork based on HC recommendations\n Coordinate with suppliers for deadlines\n Proof & Approve Marcan labels\n Maintain a database for product related codes\n Web design and maintenance\n Work with multichannel within the company to ensure communication on projects and labels timelines are understood\n Design and create marketing materials for retail use which includes but not limited to posters, online posts, trade show material\n Design and maintain company logos \u2013 Letterhead, Envelopes, business cards, Etc.\n French/English Translation\n\nDesired Skills & Experience\n\n Strong organization, communication, and administrative skills\n Up to date with industry leading software and technologies (Illustrator, Photoshop mandatory)\n Collaborative attitude\n Think creatively and develop new design concepts, graphics and layouts\n Collaborate with the creative team to bring concepts and creative ideas to life\n Amend final designs to management comments and gain full approval\n Time management skills to meet deadlines on multiple projects\n Attention to detail\n Ability to keep calm and steady in a fast-changing environment is essential\n Critical thinking\n Photo editing and manipulation\n Solid understanding of print and digital production best practices\n Preparing designs for print publication\n Enthusiastic, self-motivated and has an ability to work independently.\n Has solid communication skills and is capable of working well with a wide range of people across multiple disciplines.\n Stays current and on top of new design trends.\n Able to think outside the box and offer new and unique design solutions.\n Highly creative and imaginative with strong design and interpersonal skills.\n A strong understanding of the pre-press process.\n Ability to receive constructive feedback and provide solutions that uphold the integrity of the main idea.\n\nThe above statement reflects the general details considered necessary to performance the duties of the job. This shall not be construed as a detailed description of all the requirements of the job. Only candidates with a valid work permit to work will be considered. Should you need accommodation please let the hiring manager know. We thank all applicants for their interest, however only those candidates selected for interviews will be contacted.\nJob Type: Full-time\nSalary: $50,000.00-$60,000.00 per year\nBenefits:\n\n Dental care\n Extended health care\n Paid time off\n\nSchedule:\n\n Monday to Friday\n\nSupplemental pay types:\n\n Bonus pay\n\nAbility to commute/relocate:\n\n Nepean, ON K2E 1A2: reliably commute or plan to relocate before starting work (required)\n\nEducation:\n\n DCS / DEC (preferred)\n\nExperience:\n\n Graphic design: 2 years (required)\n\nWork Location: In person\nApplication deadline: 2023-10-20Expected start date: 2023-11-01"
}