{
    "id": "44414e6e87d6dbb1",
    "company": "University of Ottawa",
    "positionName": "Senior Technologist, Chemistry Teaching Laboratory",
    "jobType": [],
    "location": "40 Ruskin St, Ottawa, ON",
    "salary": null,
    "postingDateParsed": "2023-10-23T20:06:40.907Z",
    "url": "https://www.indeed.ca/rc/clk?jk=44414e6e87d6dbb1&from=jasx&tk=1he3lftbdk7tt800&vjs=3",
    "externalApplyLink": "https://uottawa.wd3.myworkdayjobs.com/en-US/uOttawa_External_Career_Site/job/Ottawa-ON/Senior-Technologist--Chemistry-Teaching-Laboratory_JR6810",
    "job_info_group": {
        "extracted_phone_numbers": [],
        "extracted_links": [
            "HTTP/HTTPS Links",
            "General Links",
            "WWW Links",
            "TLDs"
        ],
        "extracted_emails": [
            "hrtalentmanagement@uottawa.ca"
        ],
        "extracted_location_data": [
            "Canada"
        ],
        "extracted_dates": [
            "May",
            "October 23",
            "Months",
            "the day prior",
            "November 03",
            "May 1, 2022",
            "Minimum 3 years"
        ],
        "extracted_languages": [
            "English"
        ],
        "extracted_laws": [],
        "extracted_norps": [
            "Bilingualism - French",
            "Canadians"
        ],
        "extracted_orgs": [
            "the University",
            "The University",
            "Department of Chemistry and Biomolecular Sciences Campus:",
            "The University of Ottawa",
            "Undergraduate Lab",
            "uOttawa",
            "Knowledge of Health and Safety",
            "N/A Job Family: Laboratory Support # of Open Positions",
            "WHMIS",
            "our cutting-edge Advanced Research Complex",
            "our extensive Biosciences Complex",
            "Faculty.",
            "the Official Languages and Bilingualism Institute",
            "Undergraduate Chemistry Laboratories",
            "Inventory Control",
            "the Occupational Health and Safety Act",
            "the Faculty of Science",
            "the Faculty of Science: Welcome",
            "1 Faculty/Service - Department",
            "Technical Advice, Design & Fabrication"
        ],
        "extracted_persons": [
            "Mitigates"
        ],
        "extracted_products": [],
        "extracted_money": [
            {
                "amount": "$67,783.00 - $",
                "noun_phrases": []
            }
        ],
        "processed_text": "type employee duration term Main Campus Union Affiliation SSUO post closing note application accept Project Manager week Salary grade SSUO Grade Salary range great place learn explore question discover \u2014 open mind push boundary . exciting rewarding career life science natural science mathematic . access class facility include Science Technology Engineering Mathematics STEM Complex envy university . strong link multitude government private research centre provide countless . true centre excellence earn recognition abroad prowess teaching laboratory researcher address relevant scientific question . testimonial passion future . position purpose reporting Manager incumbent perform variety technical activity support client include student teaching assistant faculty scientific engineering professional assign group specialized scientific teaching lab infrastructure . provide complex technical advice support training client research analysis design development production set testing operation maintenance laboratory system specification department faculty curriculum research requirement order achieve experimental objective ensure safe working practice . perform minimal supervision general guideline require awareness technology . note position require incumbent flexible schedule meet operation requirement . role responsibility include Technical Support meet client identify analyze special purpose complex scientific research lab equipment material . design assemble install test maintain repair assign laboratory equipment material meet specific client ensure accurate proper functionality . analyze diagnosis lab malfunction carry require repair action order maintain lab functionality client . direction supervisor faculty carry apply research relate experimental method field relate assign lab . training train perform demonstration support teaching assistant student lab equipment material improve user proficiency . promote supervise responsible lab equipment material contribute safety user safeguard University's asset . interact student teaching assistant provide support demonstration assist description concept analysis datum ensure experimental objective achieve . evaluates component student performance understanding grading process . Health Safety ensure assign laboratory operate Health Safety rule applicable regulation . responsible collection storage disposal hazardous material . risk ensure lab staff schedule lab client facility lab . provide advice regard design lab equipment accessory ensure feasibility fabrication provide build fabricate consultation service require . translate product specification verbal request sketch design equipment accessory . participate fabrication specialized lab equipment create prototype meet teaching research requirement user . resource person field impart skill knowledge client level design fabrication . track inventory equipment instrumentation material locate assign lab . assigns proper identification maintain record inventory database . track movement item lab environment . documentation participate ensure manual technical documentation experiment equipment lab client . maintain proper technical literature acquire knowledge equipment operation perform repair . contribute writing development production technical document consultation faculty . bring undergraduate degree Chemistry discipline equivalent combination education . provide support technical advice teaching research laboratory . knowledge specialized area research support department knowledge laboratory tool equipment instrument material hazard safe usage . rule regulation university policy procedure relate operation lab lab equipment material . knowledge computer datum acquisition procedure . provide technical support advice user lab equipment . designing fabricate assemble building test repair special purpose lab equipment . prepare develop scientific experiment . writing develop technical report documentation . read understand text considerable difficulty require understanding concept procedure instruction . analytical skill diagnose repair laboratory equipment material issue . communicate technical concept user . teaching student evaluation . flexible schedule meet operational requirement . speak write . LI Onsite Key Competencies require competency employee planning organize series action event order realize objective project . plan organize priority regular daily activity . initiative demonstrate creativity initiative improvement encourage positive result . proactive starting . availability willingness . Client Service Orientation help serve meet . imply anticipate identify internal external client find solution meet . teamwork Cooperation cooperate team reach common goal . accept constructive feedback . adjust behaviour reach goal team . embrace diversity inclusion workplace . passionate people commit employment equity . foster culture respect teamwork inclusion collaboration innovation creativity fuel quest research teaching excellence . qualified person invite apply application qualified indigenous person racialize person person woman lgbtqia2s+ person . commit create maintain accessible barrier free environment . committed applicant request accommodation recruitment assessment selection process . applicant contact communicate accommodation . qualified encourage apply permanent resident priority . note union position hiring process govern current collective agreement relate union affiliation note click find . position responsibility interact student select rate low advanced proficiency level high oral comprehension reading comprehension second official language . rating determine proficiency test design . prior require student faculty staff visitor include contractor fully vaccinate Covid define Policy \u2013 Covid Vaccination . policy suspend effective reinstate point future depend public health guideline recommendation expert ."
    },
    "companyDescription": "",
    "description": "Job Type:\n  Employee\n \n \n   Duration in Months (for fixed-term jobs):\n  N/A\n \n \n   Job Family:\n  Laboratory Support\n \n \n   # of Open Positions:\n  1\n \n \n   Faculty/Service - Department:\n  Undergraduate Lab, Department of Chemistry and Biomolecular Sciences\n \n \n   Campus:\n  Main Campus\n \n \n   Union Affiliation:\n  SSUO\n \n \n   Date Posted:\n  October 23, 2023\n \n \n   Closing Date:\n  November 03, 2023\n \n   Note: Applications will be accepted until 11:59 PM on the day prior to the Posting End Date above\n \n \n \n   Hours per week:\n  35\n \n \n   Salary Grade:\n  SSUO Grade 09\n \n \n   Salary Range:\n  $67,783.00 - $85,623.00\n  About the Faculty of Science:\n  \n  Welcome to the Faculty of Science, a great place to learn, to explore, to question, to discover \u2014 opening your mind and pushing boundaries. It\u2019s an exciting time to be part of a rewarding career in life sciences, natural sciences and mathematics. You will have access to world-class facilities, including our Science, Technology, Engineering and Mathematics (STEM) Complex, our extensive Biosciences Complex and our cutting-edge Advanced Research Complex, that are the envy of many universities. We have strong links with a multitude of government and private research centres, providing countless opportunities and experiences.\n  \n  We have become a true centre of excellence, earning recognition across Canada and abroad for our prowess in teaching and in our laboratories, where our researchers are addressing some of the most important and relevant scientific questions of our time. Our past is a testimonial to our passion, so will be our future. Will you be part of it?\n \n \n   Position Purpose\n   Reporting to the Manager of Undergraduate Chemistry Laboratories, the incumbent performs a variety of technical activities in support of clients, including students, teaching assistants, faculty members, and other scientific or engineering professionals, in an assigned group of specialized scientific teaching lab infrastructures. Provides complex technical advice, support, and training to clients in the research, analysis, design, development, production, set-up, testing, operation, and maintenance of laboratory systems to the specification of the department or faculty\u2019s curriculum or research requirements in order to achieve the experimental objectives and ensure safe working practices. The work is performed with minimal supervision, under general guidelines, and requires full awareness of the various technologies used.\n \n \n \n   Note: This position requires that the incumbent be available to work on a flexible schedule to meet operation requirements.\n \n \n \n   In this role, your responsibilities will include:\n \n \n   Technical Support: Meets with clients to identify and analyze their needs for special purpose complex scientific/research lab equipment and materials. Designs, assembles, installs, tests, maintains and repairs assigned laboratory equipment and materials to meet specific client needs and to ensure accurate and proper functionality. Analyzes and diagnoses the causes of lab malfunctions and carries out the required repair actions in order to maintain lab functionality for clients. Under the direction of the supervisor or faculty, carries out applied research related to experimental methods in fields related to the assigned labs.\n   Training: Trains, performs demonstrations for, and supports teaching assistants and students in the use of lab equipment and materials to improve end-user proficiency. Promotes and supervises the responsible use of all lab equipment and materials to contribute to the safety of all users and to safeguard the value of the University\u2019s assets. May interact with students and teaching assistants to provide support beyond demonstrations that assists with the description of concepts and the analysis of data to ensure that experimental objectives are successfully achieved. Evaluates components of student performance and understanding as part of the grading process.\n   Health and Safety: Ensures that all assigned laboratories operate in accordance with the Health and Safety rules of the University, the Occupational Health and Safety Act, WHMIS and any other applicable regulations. May be responsible for the collection, storage or disposal of hazardous materials. Mitigates risk by ensuring that there is always a lab staff member present during scheduled labs, as well as during operating hours when clients may use the facilities outside of labs.\n   Technical Advice, Design & Fabrication: Provides advice regarding the design of lab equipment and accessories to ensure the feasibility of fabrication and provides build or fabricating consultation services when required. Translates product specifications, such as verbal requests or sketches, to design equipment and accessories. May participate in the fabrication of this specialized lab equipment to create prototypes to meet teaching and research requirements of users. Acts as a resource person within the field by imparting skills and knowledge to clients at all levels of design and fabrication.\n   Inventory Control: Keeps track of the inventory of equipment, instrumentation and materials located in the assigned lab. Assigns proper identification and maintains records in the inventory database. Tracks the movement of items within the lab environment.\n   Documentation: Participates in ensuring that manuals and other technical documentation is up to date for all experiments and equipment in the lab and that it is made available when necessary to clients. Maintains proper technical literature to be able to acquire knowledge on the equipment operation and to perform repairs if necessary. Contributes to the writing, development and production of new technical documents in consultation with faculty.\n \n \n   What you will bring:\n \n \n   Undergraduate degree in Chemistry or related discipline or an equivalent combination of education and experience.\n   Minimum 3 years of experience providing support and technical advice in a teaching/research laboratory.\n   Knowledge of the specialized areas of research supported by the department or Faculty.\n   Knowledge of laboratory tools, equipment, instruments, materials, and hazards and their safe usage.\n   Knowledge of Health and Safety rules, regulations and University policies and procedures related to the operation of labs and lab equipment/material.\n   Knowledge of computers and data acquisition procedures.\n   Experience in providing technical support and advice to users for lab equipment.\n   Experience in designing, fabricating, assembling, building, testing and repairing special purpose lab equipment.\n   Experience in preparing and developing scientific experiments.\n   Experience in writing and developing technical reports and other related documentation.\n   Ability to read and understand texts of considerable difficulty requiring understanding of concepts, procedures, and instructions.\n   Analytical skills to diagnose and repair laboratory equipment and material issues.\n   Ability to communicate technical concepts to users.\n   Experience in teaching and student evaluation.\n   Ability to work on a flexible schedule to meet operational requirements.\n   Bilingualism - French and English (spoken and written).\n \n \n \n   #LI-Onsite\n \n \n \n   Key Competencies at uOttawa:\n   Here are the required competencies for all or our employees at uOttawa:\n   \n   Planning: Organize in time a series of actions or events in order to realize an objective or a project. Plan and organize own work and priorities in regular daily activities.\n   Initiative: Demonstrate creativity and initiative to suggest improvements and encourage positive results. Is proactive and self-starting. Show availability and willingness to go above and beyond whenever it is possible.\n   Client Service Orientation: Help or serve others to meet their needs. This implies anticipating and identifying the needs of internal and external clients and finding solutions on how to meet them.\n   Teamwork and Cooperation: Cooperate and work well with other members of the team to reach common goal(s). Accept and give constructive feedback. Able to adjust own behaviour to reach the goals of the team.\n   \n   The University of Ottawa embraces diversity and inclusion in the workplace. We are passionate about our people and committed to employment equity. We foster a culture of respect, teamwork and inclusion, where collaboration, innovation, and creativity fuel our quest for research and teaching excellence. While all qualified persons are invited to apply, we welcome applications from qualified Indigenous persons, racialized persons, persons with disabilities, women and LGBTQIA2S+ persons. The University is committed to creating and maintaining an accessible, barrier-free work environment. The University is also committed to working with applicants with disabilities requesting accommodation during the recruitment, assessment and selection processes. Applicants with disabilities may contact hrtalentmanagement@uottawa.ca to communicate the accommodation need. All qualified candidates are encouraged to apply; however, Canadians and permanent residents will be given priority.\n   \n   Note: if this is a union position: The hiring process will be governed by the current collective agreement related to the union affiliation noted above; you can click \n  \n   here\n   to find out more.\n   \n   \n  If this is a front-line position with responsibilities to interact with students, selected candidates must be rated at the Low Advanced proficiency level or higher for both oral comprehension and reading comprehension in their second official language. The rating is determined by a proficiency test designed by the Official Languages and Bilingualism Institute.\n \n \n \n   Prior to May 1, 2022, the University required all students, faculty, staff, and visitors (including contractors) to be fully vaccinated against Covid-19 as defined in Policy 129 \u2013 Covid-19 Vaccination. This policy was suspended effective May 1, 2022 but may be reinstated at any point in the future depending on public health guidelines and the recommendations of experts."
}