{
    "id": "7540af5a7629997f",
    "company": "Ciena",
    "positionName": "Lab Administrator",
    "jobType": [],
    "location": "Ottawa, ON",
    "salary": null,
    "postingDateParsed": "2023-09-27T06:48:41.476Z",
    "url": "https://www.indeed.ca/rc/clk?jk=7540af5a7629997f&from=jasx&tk=1hbkvt5cukf2u802&vjs=3",
    "externalApplyLink": "https://careers.ciena.com/us/en/job/CIENUSR023467ENUS/Lab-Administrator?utm_source=indeed&utm_medium=phenom-feeds",
    "job_info_group": {
        "extracted_phone_numbers": [],
        "extracted_links": [
            "HTTP/HTTPS Links",
            "General Links",
            "WWW Links",
            "TLDs"
        ],
        "extracted_emails": [],
        "extracted_location_data": [
            "Petaluma",
            "the Santa Clara",
            "Java",
            "Ottawa",
            "Bitbucket"
        ],
        "extracted_dates": [],
        "extracted_languages": [],
        "extracted_laws": [],
        "extracted_norps": [
            "JIRA"
        ],
        "extracted_orgs": [
            "Ciena",
            "University Degree in Computer Engineering, Computer Science, Electrical Engineering",
            "ESD",
            "Electronics Programming",
            "Install",
            "HW & SW Experience",
            "Knowledge of Lab Equipment"
        ],
        "extracted_persons": [],
        "extracted_products": [],
        "extracted_money": [],
        "processed_text": "committed people philosophy . team enjoy culture focus prioritize personalized flexible environment empower individual's passion growth wellbeing belonging . technology company lead humanity \u2014 drive business priority alongside meaningful social community societal impact . ideal career competitive salary freedom live life recognition accomplishment \u2014 inclusive diverse people environment . success drive support thriving team uphold benefit employee . empower flexible pay reimburse house development resource support mental physical asset attain goal . contribute onsite role lab . lab administrator detail orient dependable administrator report Senior Lab Manager . lab team learn remote Data Center Management tool monitor control lab help inventory lab asset count include lab space lab rack test instrument . duty include handle lab equipment maintenance repair prepare lab test gear project base HW design team specification support lab safety protocol practice good lab etiquette ensure asset tracking inventory procedure follow . accurate inventory asset answer JIRA ticket lab service engineer productive learn proper rack mount cable management Ciena expect sense urgency \u2013 customer equally . thing priority . integrity \u2013 hold high level personal professional standard conduct . commitment innovation \u2013 continually seek learn understand technology change market condition endeavor apply knowledge Ciena's advantage . embrace change \u2013 thrive diverse environment change priority stressful situation . Haves interest Computers HW SW development lab router switch server test tool learn application CONFLUENCE Artifactory proficiency write speak English strong interpersonal skill asset College Diploma scripting skill web Bash Expect Python CM onsite committed build foster environment employee feel respect hear . diversity workforce respect employee individual . tolerate form discrimination . contact relation advise accommodation measure require ."
    },
    "companyDescription": "",
    "description": "Ciena is committed to our people-first philosophy. Our teams enjoy a culture focused on prioritizing a personalized and flexible work environment that empowers an individual\u2019s passions, growth, wellbeing and belonging. We\u2019re a technology company that leads with our humanity\u2014driving our business priorities alongside meaningful social, community, and societal impact. \n \n You know what your ideal career looks like: a competitive salary, freedom to live your life as you like, and recognition for your accomplishments\u2014all in an inclusive and diverse people-first environment. Our success is driven by a supported, thriving team; this is why Ciena upholds these benefits for all our employees. Ciena empowers you with flexible paid time off, reimbursed and in-house development resources, support for mental and physical well-being, and assets you may need to attain your goals both at and away from work.\n \n  How You Will Contribute:\n  This is an onsite role at our lab in Ottawa. As a Lab Administrator you are a detail-oriented, dependable administrator reporting into the Senior Lab Manager. You will work with the Santa Clara and Petaluma and Ottawa lab teams, and learn about: remote Data Center Management tools to monitor and control the lab, help with inventory and lab assets counts, including lab space, lab racks, test instruments, etc.\n  Other duties include:\n \n   Handling lab equipment maintenance, and repair\n   Install and prepare lab test gear for projects based on HW design team specifications\n   Support lab safety protocols, ESD practices and good lab etiquette\n   Ensuring asset tracking and inventory procedures are followed. keep an accurate inventory of all assets\n   Answering JIRA tickets to keep lab in service and engineers productive\n   Learn proper rack mounting, cable management\n \n  What Does Ciena Expect of You: \n \n  A sense of urgency \u2013 what\u2019s important to the customer is equally important to you. You make getting things done a priority.\n   Integrity \u2013 you hold yourself to the highest level of personal and professional standards of conduct.\n   A commitment to innovation \u2013 you continually seek to learn, understand new technologies and ever-changing market conditions, and endeavor to apply that knowledge to Ciena\u2019s advantage.\n   You embrace change \u2013 thriving in a diverse environment of ever-changing priorities and sometimes stressful situations.\n \n \n  The Must Haves:\n \n   Interest in Computers, HW & SW\n   Experience in HW/SW development labs\n   Knowledge of Lab Equipment: routers, switches, servers, and test tools\n   Learn applications such as JIRA, CONFLUENCE, Artifactory, Bitbucket, etc\n   Proficiency in written and spoken English\n   Strong interpersonal skills\n \n \n  Assets:\n \n   College Diploma or University Degree in Computer Engineering, Computer Science, Electrical Engineering, or Electronics\n   Programming and scripting skills, Web, Bash, Expect, Python, Java, A plus\n \n \n  #LI-CM #LI-onsite\n \n  At Ciena, we are committed to building and fostering an environment in which our employees feel respected, valued, and heard. Ciena values the diversity of its workforce and respects its employees as individuals. We do not tolerate any form of discrimination.\n \n  If contacted in relation to a job opportunity, please advise Ciena of any accommodation measures you may require."
}