{
    "id": "2d2e9d55608dcad7",
    "company": "Innovapost",
    "positionName": "Tester",
    "jobType": [],
    "location": "365 March Road, Ottawa, ON",
    "salary": null,
    "postingDateParsed": "2023-10-15T18:52:49.668Z",
    "url": "https://www.indeed.ca/rc/clk?jk=2d2e9d55608dcad7&from=jasx&tk=1hcvfn7eljiim800&vjs=3",
    "externalApplyLink": "https://jobs.innovapost.com/job/Ottawa-Tester-ON-K2K-3N5/572237417/?feedId=276117&utm_source=Indeed&utm_campaign=Innovapost_Indeed",
    "job_info_group": {
        "extracted_phone_numbers": [],
        "extracted_links": [
            "HTTP/HTTPS Links",
            "General Links",
            "WWW Links",
            "TLDs"
        ],
        "extracted_emails": [],
        "extracted_location_data": [
            "Innovapost",
            "Canada",
            "INNOvating",
            "Degreed"
        ],
        "extracted_dates": [
            "tomorrow",
            "2-3 years",
            "3-5 years"
        ],
        "extracted_languages": [],
        "extracted_laws": [],
        "extracted_norps": [
            "every Canadian",
            "INNOvative",
            "Canadians"
        ],
        "extracted_orgs": [
            "SCI.",
            "Microsoft Enterprise Skills",
            "middleware and infrastructure Convert",
            "Inclusion & Belonging",
            "the Canada Post Group of Companies",
            "the Quality Assurance Centre of Expertise",
            "the Quality Assurance CoE",
            "Microsoft Microsoft Azure Data Factory",
            "Diversity, Inclusion and Belonging",
            "a Leadership Developmental Program",
            "a Canada Post Reliability Security Clearance",
            "LinkedIn Learning",
            "GitHub",
            "the Group",
            "GitLab",
            "Recommend",
            "Develop",
            "Information Systems",
            "BitBucket",
            "Canada Post",
            "client-specific Information Technology",
            "Structured Query Language",
            "The Application Programming Interface Tester",
            "Microsoft Microsoft Azure Storage Accounts"
        ],
        "extracted_persons": [],
        "extracted_products": [
            "XUnit"
        ],
        "extracted_money": [],
        "processed_text": "requisition number Province country Employment Type Regular level L2 technology arm include Purolator Innovapost provide business solution service exclusively help deliver innovative solution . transform operation modernize business meet demand evolve mail courier logistic industry . join positive impact send receive package mail . neighbour pick mail receive package join continuous improvement focus Environmental Social Governance investment hybrid workplace feather cap . award Canada's Digital Transformation Award Large Public Sector organization . technology evolve provide high perform workforce skill continuous learning career growth . offer access learning platform \u2013 \u2013 Innovapost enable connect learn skill map skill open company . role play participate hand testing contribute quality assurance software test . closely developer solution architect product owner assist team decision making . Tester responsible ensure quality software provide thorough coverage limit product testing testing functional testing test script development defect tracking reporting . Tester create script automation test . incumbent apply agile test principle test early test support testing effort acquire domain knowledge apply software testing expertise . responsible maintain execute automate test suite .net api . collaborate development team understand Application Programming Interface functionality design comprehensive test plan . Microsoft Microsoft Azure host tool manage test Application Programming Interface deployment functionality . apply structured Query Language knowledge develop comprehensive database testing procedure . conduct automation testing databrick big datum analytic processing . automate testing pipeline ensure datum transformation integration process meet requirement . execute system integration regression ad hoc test moderate complex cross functional component software requirements user story design documents solution landscape set test case script implement track report test metric . analyze datum recommend improvement compile report base finding closely functional group resolve issue ensure thorough testing . provide guidance assistance team require adjustment current testing process procedure ensure continuous improvement collaboration collaboration ensure quality standard software product stage product development life cycle role testing moderate complex cross functional component software middleware infrastructure automation testing api .net testing framework . java base framework JMeter beneficial . code repository version control collaborative development . include create complex query understanding database schemas comprehensive testing . deep understanding restful api testing Application Programming Interface endpoint . proficiency develop execute maintain automate test suite ensure code Application Programming Interface functionality meet requirement quality standard . familiarity Microsoft Microsoft Azure ecosystem associated tool host manage api . develop case create positive negative path test case base requirement user story create traceability matrix functional integration regression functional testing automation testing databrick pipeline knowledge test tool process adapt emerge test tool trend additional skill set apart knowledge understand blob storage file storage storage option . knowledge testing framework leverage cloud Knowledge Agile Scrum Software Development Life cycle process Education certification academic collegiate diploma computer science equivalent require certification skill Software Development Life cycle methodology Agile Scrum Iterative Development courageous \u2013 thing \u2013 lead visionary mindset Inclusive \u2013 listen judgement challenging bias inspirational \u2013 positive attitude interest accountability curious \u2013 inquisitive learn continuously team mutual respect inherent bias action continuously improve trust play role . diversity Innovapost diversity essential company operate future . attract develop retain people reflect diversity essential success . encourage application woman indigenous people person visible minority . Accommodation Innovapost commit provide inclusive barrier free environment start hiring process . contact Innovapost regard advise restriction accommodate . information receive relation accommodation confidential . Innovapost impact . eligible . good luck forward hear"
    },
    "companyDescription": "",
    "description": "Requisition Number: 2830\n  Province: Ontario (CA-ON)\n  Country: Canada (CA)\n  Employment Type: Regular\n  Job Level: L2\n \n  Who are we?\n  We are the technology arm of the Canada Post Group of Companies which includes Canada Post, Purolator, and SCI. Innovapost provides client-specific Information Technology (IT), Information Systems (IS), and business solution services exclusively within the Group and helps them deliver innovative solutions and value to Canadians. Our work transforms operations and modernizes business to meet the demands of the evolving mail, courier, and logistics industries. By joining us you will be able to make a positive impact on how every Canadian sends and receives their packages and mail. Next time you see your neighbour picking up their mail and receiving a package, you will be able to say, \u201cyou\u2019re welcome!\u201d\n \n  Why join us?\n  Continuous improvement; a focus on Diversity, Inclusion and Belonging; Environmental and Social Governance; and an investment in a hybrid workplace are just a few of the feathers in our cap. We were also awarded IT World Canada\u2019s 2022 Digital Transformation Award for Large Public Sector organizations. As technology evolves, we believe in providing our high-performing workforce with the skills of tomorrow through continuous learning and career growth. Offering access to learning platforms like Degreed, LinkedIn Learning, Microsoft Enterprise Skills \u2013 as well as a Leadership Developmental Program \u2013 Innovapost enables you to connect learning with skills and map your skills to open opportunities within the company.\n \n \n  \n   \n     What role will you play?\n   \n   \n     The API Tester will participate in hands-on testing and contribute to the quality assurance of the software under test. He/ she will work closely with the developers, solution architects and product owners and assist team members in decision making. The Tester is responsible for ensuring the overall quality of software and provides a thorough coverage of, but not limited to, product testing, end-to-end testing, non-functional testing, test scripts development, defect tracking and reporting. The Tester may also create scripts for automation tests. The incumbent will apply agile test principles of test early, test often and will support the testing effort by acquiring domain knowledge while applying their software testing expertise.\n   \n  \n  \n   \n     What you'll be responsible for:\n   \n   \n    \n      Develop, maintain, and execute automated test suites for .NET APIs.\n      Collaborate with the development team to understand API functionality and design comprehensive test plans.\n      Work with Azure hosting tools to manage and test API deployment and functionality.\n      Apply SQL knowledge to develop comprehensive database testing procedures.\n      Conduct automation testing of Databricks for big data analytics and processing.\n      Automate testing of Azure Data Factory pipelines to ensure data transformation and integration processes meet requirements.\n      Execute various systems, integration, regression, and ad-hoc tests for moderate to complex cross-functional components from software to middleware and infrastructure\n      Convert requirements/ user stories and design documents/ solution landscapes into a set of test cases and scripts\n      Develop, implement, track and report test metrics. Analyze data, recommend improvements and compile reports based on findings\n      Work closely with different functional groups to resolve issues and ensure thorough testing. Provide guidance and assistance to team members as required\n      Recommend adjustments to current testing processes and procedures to ensure continuous improvements, in collaboration with the QA Centre of Expertise\n      In collaboration with the QA CoE, ensure quality standards of software products through all stages of product development life cycle\n    \n   \n  \n  \n   \n     What does it take for this role to be yours?\n   \n   \n    \n      3-5 years experience in testing moderate to complex cross-functional components from software to middleware and infrastructure\n      3-5 years of experience in automation testing for APIs, specifically using .NET testing frameworks such as XUnit. Experience with Java-based frameworks like JMeter will be beneficial.\n      3-5 years of experience using code repositories such as GitHub, GitLab, or BitBucket for version control and collaborative development.\n      2-3 years of experience in SQL, including creating complex queries and understanding database schemas for comprehensive testing.\n      Deep understanding of RESTful APIs and experience testing API endpoints.\n      Proficiency in developing, executing, and maintaining automated test suites to ensure code and API functionality meets requirements and quality standards.\n      Familiarity with the Azure ecosystem and its associated tools for hosting and managing APIs.\n      Experience in developing use cases and creating positive & negative path test cases based on requirements/user stories and creating a traceability matrix\n      Experience in functional, Integration, regression and non-functional testing\n      Experience in automation testing of Databricks and Azure Data Factory pipelines\n      Knowledge of various test tools and processes and ability to adapt new and emerging test tools and trends\n    \n   \n  \n  \n   \n     Additional skills that set you apart:\n   \n   \n    \n      Knowledge of Azure Storage Accounts, understanding blob storage, file storage, and other storage options.\n      Knowledge of testing frameworks leveraged on the cloud\n      Knowledge of Agile/Scrum and SDLC process\n    \n   \n  \n  \n  \n   \n     Education and certification:\n   \n   \n    \n      Academic: collegiate diploma in computer science or equivalent experience (required)\n      Certifications / skills: SDLC Methodology - Agile / Scrum / Iterative Development\n    \n   \n  \n \n \n  What do we value?\n  At Innovapost, we believe in being: \n \n  Courageous \u2013 doing the right thing\n   INNOvative \u2013 leading with a visionary mindset\n   Inclusive \u2013 listening without judgement and challenging biases\n   Inspirational \u2013 having a positive attitude, interest, and accountability\n   Curious \u2013 being inquisitive to learn continuously\n \n \n  We also believe in thinking and acting as one team, having mutual respect, having an inherent bias for action, continuously improving and INNOvating, and trusting others to play their roles.\n \n  Diversity, Inclusion & Belonging at Innovapost\n  We value diversity as an essential part of who we are as a company, how we operate and how we see our future. We believe that attracting, developing, and retaining people who reflect the diversity of Canada is essential to our success. We encourage applications from women, Indigenous people, persons with disabilities and visible minorities.\n \n  Accommodation\n  Innovapost is committed to providing an inclusive and barrier-free work environment, starting with the hiring process. If you are contacted by Innovapost regarding a job opportunity, please advise if you have any restrictions that need to be accommodated. All information received in relation to accommodation will be kept confidential.\n \n  The work we do at Innovapost impacts every Canadian. To work with us, you must be eligible to obtain a Canada Post Reliability Security Clearance.\n  Good luck! We look forward to hearing from you!"
}