{
    "id": "16bad4ab2e2d2045",
    "company": "TendTo.",
    "positionName": "Personal Support Worker (PSW)",
    "jobType": [],
    "location": "Ottawa, ON",
    "salary": null,
    "postingDateParsed": "2023-10-15T18:53:57.586Z",
    "url": "https://www.indeed.ca/rc/clk?jk=16bad4ab2e2d2045&from=jasx&tk=1hcvfpcsqi5dk800&vjs=3",
    "externalApplyLink": null,
    "job_info_group": {
        "extracted_phone_numbers": [],
        "extracted_links": [
            "HTTP/HTTPS Links",
            "General Links",
            "WWW Links",
            "TLDs"
        ],
        "extracted_emails": [],
        "extracted_location_data": [
            "Ottawa"
        ],
        "extracted_dates": [
            "2023-11-01",
            "the first year",
            "5 years",
            "at least 2 days"
        ],
        "extracted_languages": [],
        "extracted_laws": [],
        "extracted_norps": [
            "French"
        ],
        "extracted_orgs": [
            "PSW Insurance",
            "ON Job Type",
            "TendTo",
            "Secondary School",
            "Home Support Worker",
            "empathetic and dedicated Personal Support Workers"
        ],
        "extracted_persons": [],
        "extracted_products": [],
        "extracted_money": [
            {
                "amount": "25.00-$29.00",
                "noun_phrases": []
            }
        ],
        "processed_text": "title Personal Support Worker PSW Company TendTo location casual TendTo mission redefine care strong focus provide compassionate personalize flexible support client . continue expand seek PSWs join team . passionate difference life love board . Position Overview PSW TendTo essential client' life offer assistance daily activity promote independence improve quality life . flexible position allow choose working hour provide fulfil help accommodate schedule . key responsibility deliver personalized care companionship support client comfort . assist client activity daily living include bathing dressing grooming meal preparation . assist medication watchful eye health status client require . engage meaningful conversation provide emotional support companionship enhance . maintain accurate record care provide report change client's condition . ensure safety comfort client care . qualification valid certificate Personal Support Worker internationally Trained Nurse Health Care Aid complete currently enrol Nursing program deep commitment deliver high quality care empathy compassion . exceptional communication interpersonal skill . reliable motivate independently manage .. possession valid driver's license access reliable transportation . clean criminal background vulnerable sector screening . benefit extremely competitive hourly pay flexibility choose working hour ongoing professional development growth . supportive collaborative team environment . chance dynamic company change future care . incentive reward program high perform team conclusion caring passionate individual commit enhance life senior individual invite apply . join team TendTo mission provide exceptional care service focus flexibility empathy . apply submit resume video introduction detail qualification drive PSW TendTo . forward team . equal employer dedicate foster diverse inclusive workforce . qualified applicant receive consideration employment regard race color religion gender gender identity expression sexual orientation national origin genetic age veteran status . type casual salary hour benefit flexible schedule Flexible Language Requirement require schedule shift Evening shift Morning shift night shift weekend application question currently week education preferred Caregiving PSW require Licence Certification PSW Certificate completion program require equivalent preferred location road Application deadline start"
    },
    "companyDescription": "",
    "description": "Job Title: Personal Support Worker (PSW)\nCompany: TendTo\nLocation: Ottawa, ON\nJob Type: Casual/Part-Time\nAbout Us:\nAt TendTo, we're on a mission to redefine home care with a strong focus on providing compassionate, personalized, and flexible support to our clients. As we continue to expand, we're seeking empathetic and dedicated Personal Support Workers (PSWs) to join our team. If you're passionate about making a difference in the lives of those who need it most, we'd love to have you on board.\nPosition Overview:\nAs an PSW at TendTo, you'll be an essential part of our clients' lives, offering assistance with daily activities, promoting independence, and improving their overall quality of life. This flexible, part-time position allows you to choose your working hours, providing a fulfilling way to help others while accommodating your schedule.\nKey Responsibilities:\n\n Deliver personalized care, companionship, and support to clients in the comfort of their homes.\n Assist clients with activities of daily living, including bathing, dressing, grooming, and meal preparation.\n Assisting with medications and keeping a watchful eye on the health status of clients as required.\n Engage in meaningful conversations and provide emotional support/companionship to enhance their well-being.\n Maintain accurate records of care provided and promptly report any changes in a client's condition.\n Ensure the safety and comfort of clients in your care.\n\nQualifications:\n\n Valid certificate as a Personal Support Worker, Internationally Trained Nurse, Health Care Aid, Home Support Worker, or have completed the first year and are currently enrolled in a Nursing program\n A deep commitment to delivering high-quality care with empathy and compassion.\n Exceptional communication and interpersonal skills.\n Reliable and self-motivated, with the ability to work independently and manage your time accordingly..\n Possession of a valid driver's license and access to reliable transportation, if needed.\n A clean criminal background and a recent vulnerable sector screening.\n\nBenefits:\n\n Extremely competitive hourly pay (25$-28$/h)\n Flexibility to choose your working hours\n Opportunities for ongoing professional development and growth.\n A supportive, collaborative team environment.\n The chance to be part of a dynamic company that's changing the future of home care.\n Incentive/reward program for highest performing team members\n\nConclusion\nIf you're a caring and passionate individual committed to enhancing the lives of seniors and individuals with disabilities, we invite you to apply. Join our team at TendTo and be part of our mission to provide exceptional home care services with a focus on flexibility and empathy.\nTo apply, please submit your resume along with a brief video introduction detailing your qualifications and your drive to become an PSW with TendTo. We look forward to welcoming you to our team.\nTendTo is an equal opportunity employer, dedicated to fostering a diverse and inclusive workforce. All qualified applicants will receive consideration for employment without regard to race, color, religion, gender, gender identity or expression, sexual orientation, national origin, genetics, disability, age, or veteran status.\nJob Type: Casual\nSalary: $25.00-$29.00 per hour\nBenefits:\n\n Flexible schedule\n\nFlexible Language Requirement:\n\n French not required\n\nSchedule:\n\n Day shift\n Evening shift\n Morning shift\n Night shift\n On call\n Weekends as needed\n\nApplication question(s):\n\n Do you currently have at least 2 days per week available?\n\nEducation:\n\n Secondary School (preferred)\n\nExperience:\n\n Caregiving/PSW: 5 years (required)\n\nLicence/Certification:\n\n PSW Certificate or completion of a similar program? (required)\n PSW Insurance or equivalent? (preferred)\n\nWork Location: On the road\nApplication deadline: 2023-11-01Expected start date: 2023-11-01"
}