{
    "id": "a068891cb11fef08",
    "company": "Ministry of the Solicitor General",
    "positionName": "Nurse Practitioner",
    "jobType": [],
    "location": "2244 Innes Road, Ottawa, ON",
    "salary": null,
    "postingDateParsed": "2024-01-19T05:10:45.206Z",
    "url": "https://www.indeed.ca/rc/clk?jk=a068891cb11fef08&from=jasx&tk=1hkikdavvii12803&bb=Z_xYV__n_sQAK0ynFsc1LlLnHwVo7tEObgk2wAnHUKGsRi4E2jf9zcQWEM3yY9P_pxgIVvzW6WAUYT-ErbExhxyLLtb4gbfxQATUyzXDxaZYwrjv_cJv1g%3D%3D&xkcb=SoBv67M3FSg6uFQ22p0ZbzkdCdPP&vjs=3",
    "externalApplyLink": "https://www.gojobs.gov.on.ca/Preview.aspx?Language=English&JobID=209800&utm_source=Indeed&utm_medium=organic&utm_campaign=Indeed",
    "job_info_group": {
        "extracted_phone_numbers": [],
        "extracted_links": [
            "HTTP/HTTPS Links",
            "General Links",
            "WWW Links",
            "TLDs"
        ],
        "extracted_emails": [],
        "extracted_location_data": [
            "Ontario",
            "East Region",
            "Ottawa"
        ],
        "extracted_dates": [
            "7 days",
            "14 calendar days",
            "Thursday, January 18, 2024"
        ],
        "extracted_languages": [],
        "extracted_laws": [
            "the Criminal Code",
            "the OPS Anti-Racism Policy",
            "care Act"
        ],
        "extracted_norps": [],
        "extracted_orgs": [
            "ESCP",
            "the Ministry of Health",
            "the Ministry of the Solicitor General",
            "the Ontario Public Service",
            "the TSO",
            "the College of Nurses of Ontario",
            "Corporate Talent Programs Branch",
            "(i.e., Health Care Consent Act",
            "The Ministry of the Solicitor General",
            "College of Nurses of Ontario Practice Standards and Ministry expectations Practice",
            "The Ontario Public Service",
            "Ontario Public Service Employees Union Understanding",
            "Ontario's Human Rights Code",
            "Specialized Knowledge",
            "caring and compassionate Nurse Practitioners",
            "the OPS Diversity and Inclusion Blueprint",
            "Ontario Public Service",
            "the Transition and Security Office",
            "appropriate interventions Practice"
        ],
        "extracted_persons": [],
        "extracted_products": [
            "Collaborate"
        ],
        "extracted_money": [],
        "processed_text": "consider career large employer province wide range exciting career . core trust fairness diversity excellence creativity collaboration efficiency responsiveness . invite join team embark large scale initiative modernize Ontariofs correctional system focus enhance safety security infrastructure service institution province . consider rewarding career correctional service join difference life individual custody community safe . Carleton Detention Centre seek passionate primary health care health care team . addition primary health care competency ideal chronic disease management pain symptom management mental health addiction . practice focus health promotion disease prevention . Nurse Practitioner clinical decision plan care inter professional health care team . Nurse Practitioner practice environment support experienced primary care practitioner include physician nurse practitioner psychiatrist nurse social worker pharmacist . participate leader continue development Nurse Practitioner role deliver comprehensive health care people correction . offer comprehensive competitive compensation package include define benefit pension plan maternity parental leave benefit comprehensive health dental plan Life insurance progressive environment promote life balance flexible learning developmental include online education mentorship program career advancement specialization OPS Commitment Diversity Inclusion Accessibility Anti racism committed build workforce reflect community serve promote diverse anti racist inclusive accessible merit base respectful equitable workplace . invite interested individual apply encourage application people Indigenous Black racialize individual people diversity ethnic cultural origin sexual orientation gender identity expression . visit learn OPS commitment advance racial equity accessibility diversity inclusion public service . offer employment accommodation recruitment process aspect employment consistent requirement . refer apply require relate accommodation . expect role role specialized knowledge skill provide patient centre primary care . assess diagnose prescribe treatment emphasis health promotion disease prevention Communicate diagnosis treatment plan option inter professional team development patient plan care develop implement strategy promote health prevent illness Advocate facilitate principle care involve offender plan resource patient staff external stakeholder respond emergency situation implement security requirement institution qualify mandatory requirement register Registered Nurse Extended Class Nurse Practitioner good standing Nurse Practitioner specialty certificate primary health care adult care Clinical Assessment critical reasoning Analytical Skills demonstrate clinical expertise assessment skill elicit interpret utilize information inmate source respond emergency situation implement appropriate intervention evaluate response treatment modify treatment plan achieve establish goal leadership skill leadership skill coordinate deliver primary health care service embed quality improvement lead consultation engagement healthcare staff partner internal external stakeholder knowledge illness disease theory health promotion prevention pharmaceutical diagnostic laboratory testing evidence base practice current treatment modality knowledge mental health addiction treatment option interpret apply legislation practice Personal Health Information Protection Regulated Health Professions . Communication Interpersonal Skills communicate effectively information clear concise manner document care progress prepare progress note write treatment plan clinical summary adapt communication skill provide information health teaching diverse population advocate encourage patient participation plan care support patient implementation modification treatment plan week . expect rotate shift health care unit provide week service . additional information address english Permanent Innes Vulnerable Sector check Credit history check Local Police Databases Search PIP NICHE RMS Compensation Group ad definition schedule category Health Social Services post note OPS Employment Screening Checks Policy require undergo security screening check . refer determine screening check require position . required security screening check write consent send TSO Talent Leadership Division evaluate result . applicable write consent request additional employment screening check directly . record federal offence record automatically ineligible position . employment screen check review evaluate purpose security clearance decision . detail individual's employment screening check consider specific relation duty responsibility position fill . employment screening check record maintain strictly confidential . employee congregate living setting require provide proof fully vaccinate fully vaccinate define refer COVID fully vaccinated Status include pass receive final dose covid vaccine . employee congregate living setting require undergo regular rapid antigen testing vaccination status determine Employer ."
    },
    "companyDescription": "",
    "description": "Consider Your Next Career with the Ministry of the Solicitor General, Ontario Public Service!\n   \n   The Ontario Public Service is one of the largest employers in the province, with a wide range of exciting career opportunities. We believe in the core values of trust, fairness, diversity, excellence, creativity, collaboration, efficiency and responsiveness. We invite you to join our teams!\n   \n   The Ministry of the Solicitor General is embarking on a large-scale initiative to modernize Ontario's correctional system, with a focus on enhancing safety and security, infrastructure and services in institutions across the province. Consider a rewarding career in correctional services and join us in making a difference in the lives of individuals in custody and in keeping our communities safe. \n   \n   The Ministry of the Solicitor General, Ottawa-Carleton Detention Centre, is seeking caring and compassionate Nurse Practitioners who are passionate about primary health care to become part of the health care team. In addition to primary health care competencies, the ideal candidates will have experience in chronic disease management, pain and symptom management, and mental health and addictions. Your practice will have a focus on health promotion and disease prevention. As a Nurse Practitioner, you will make clinical decisions and plan care as part of an inter-professional health care team. \n   \n   Working as a Nurse Practitioner with the Ministry of the Solicitor General, you will have the opportunity to practice in an environment where you are supported by experienced primary care practitioners, including physicians, nurse practitioners, psychiatrists, nurses, social workers and pharmacists. This is an opportunity to participate as a leader in the continued development of the Nurse Practitioner role, delivering comprehensive health care for people in corrections. \n   \n   The Ministry of the Solicitor General offers a comprehensive and competitive compensation package, including:\n   \n   \n  \n   A defined benefit pension plan\n   Maternity and parental leave top-up benefits\n   A comprehensive health and dental plan\n   Life and disability insurance\n   A progressive work environment that promotes work/life balance\n   Flexible learning and developmental opportunities, including online, education and mentorship programs\n   Opportunities for career advancement and specialization\n  \n   OPS Commitment to Diversity, Inclusion, Accessibility, and Anti-Racism: We are committed to build a workforce that reflects the communities we serve and to promote a diverse, anti-racist, inclusive, accessible, merit-based, respectful and equitable workplace.\n   \n   We invite all interested individuals to apply and encourage applications from people with disabilities, Indigenous, Black, and racialized individuals, as well as people from a diversity of ethnic and cultural origins, sexual orientations, gender identities and expressions.\n   \n   Visit the \n  OPS Anti-Racism Policy and the \n  OPS Diversity and Inclusion Blueprint pages to learn more about the OPS commitment to advance racial equity, accessibility, diversity, and inclusion in the public service.\n   \n   We offer employment accommodation across the recruitment process and all aspects of employment consistent with the requirements of Ontario's \n  Human Rights Code. Refer to the \"How to apply\" section if you require a disability-related accommodation.\n   \n   What can I expect to do in this role? In this role, you will use your specialized knowledge and skills to provide patient-centred primary care. Specifically, you will:\n   \n   \n  \n   Assess, diagnose and prescribe treatment with an emphasis on health promotion and disease prevention\n   Communicate diagnosis and treatment plan options\n   Collaborate with an inter-professional team in the development of the patient plan of care, and to develop and implement strategies that promote health and prevent illness\n   Advocate for, and facilitate, the principles of self-care by involving offenders in their own plan of care\n   Act as a resource for patients, staff and external stakeholders\n   Respond to emergency situations and implement appropriate interventions\n   Practice in accordance with College of Nurses of Ontario Practice Standards and Ministry expectations\n   Practice in accordance with the security requirements of the institution\n  \n   How do I qualify?\n   Mandatory Requirements\n  \n   You are registered as a Registered Nurse Extended Class (Nurse Practitioner) in good standing with the College of Nurses of Ontario\n   You have a Nurse Practitioner specialty certificate in primary health care or adult care\n  \n   Clinical Assessment, Critical Reasoning and Analytical Skills\n  \n   You demonstrate clinical expertise and assessment skills to elicit, interpret and utilize information from inmates and other sources\n   You can respond to emergency situations and implement appropriate interventions\n   You can evaluate responses to treatment and modify the treatment plan to achieve established goals\n  \n   Leadership Skills\n  \n   You have leadership skills to coordinate and deliver primary health care services, embed quality improvement and lead consultation and engagement with healthcare staff and partners, as well as internal and external stakeholders\n  \n   Specialized Knowledge\n  \n   You have knowledge of illness/disease theory, health promotion and prevention, pharmaceuticals, diagnostic and laboratory testing, evidence-based practice and current treatment modalities \n   You have knowledge of mental health and addiction treatment options\n   You can interpret and apply legislation to practice (i.e., Health Care Consent Act, Personal Health Information Protection Act, Regulated Health Professions Act, etc.)\n  \n   Communication and Interpersonal Skills\n  \n   You can communicate effectively and present information in a clear and concise manner\n   You can document care and progress by preparing progress notes, written treatment plans and clinical summaries\n   You can adapt your communication skills to provide information and health teaching to a diverse population\n   You can advocate for and encourage patient participation in their plan of care\n   You can support patients in the implementation and modification of their treatment plan\n  \n   Hours of Work\n  \n   The hours of work are 36.25 hours per week. You are expected to work rotating shifts in a health care unit that provides 7 days per week service, up to 24 hours a day.\n  \n   \n \n \n  Additional Information: \n  \n   \n    \n     Address: \n    \n    \n     \n      2 English Permanent - Full Time, 2244 Innes Rd, Ottawa, East Region, Vulnerable Sector Check, Credit History Check, Local Police Databases Search, PIP/NICHE/RMS\n      \n    \n   \n    \n  \n  \n   \n    \n     Compensation Group: \n    \n    \n     Ontario Public Service Employees Union \n    \n   \n    \n  \n  \n   \n    \n     \n      Understanding the job ad - definitions \n     \n     Schedule:\n      \n    \n    \n     3-7 \n    \n   \n    \n  \n  \n   \n    \n     Category: \n    \n    \n     Health and Social Services \n    \n   \n    \n  \n  \n   \n    \n     Posted on: \n    \n    \n     Thursday, January 18, 2024 \n    \n   \n    \n  \n \n \n  Note: \n   \n  \n   In accordance with the Ontario Public Service (OPS), Employment Screening Checks Policy (ESCP), the top candidate(s) may be required to undergo a security screening check. Refer to the above to determine the screening checks that are required for this position.  Required security screening checks along with your written consent, will be sent to the Transition and Security Office (TSO), Corporate Talent Programs Branch, Talent and Leadership Division to evaluate the results. If applicable, the TSO, with your written consent, will request and obtain any additional employment screening checks that were not obtained directly by you.  A record under the Criminal Code and/or other federal offence record(s) does not automatically mean you will be ineligible for the position. The employment screening check(s) will only be reviewed and evaluated by the TSO for the purpose of making a security clearance decision. The details of an individual's employment screening check(s) will be considered in specific relation to the duties and responsibilities of the position being filled. Employment screening check records will be maintained by the TSO and kept strictly confidential.\n    Employees working in congregate living settings may be required to provide proof they are fully vaccinated, meaning they are fully vaccinated as defined by the Ministry of Health (refer to: COVID-19 Fully Vaccinated Status in Ontario), including 14 calendar days have passed since receiving their final dose of the COVID-19 vaccine. Furthermore, employees working in congregate living settings may be required to undergo regular rapid antigen testing, regardless of vaccination status, as determined by the Employer."
}