{
    "id": "5c608c4ae90f686a",
    "company": "Natural Resources Canada",
    "positionName": "Mining Technologist",
    "jobType": [
        "Full-time"
    ],
    "location": "Ottawa, ON",
    "salary": "$70,159\u2013$88,195 a year",
    "postingDateParsed": "2024-01-25T12:14:54.213Z",
    "url": "https://www.indeed.ca/rc/clk?jk=5c608c4ae90f686a&from=jasx&tk=1hl5dg16dk7ek800&bb=tMKIoX8lf2spUOlVC2NDMMd8dDCZHimxqzxRul3zyiVr47wBUwfqTH6PDCbrf3KcvkDsFzbgCm0qyphSsOdd-kLMUNWwBcw5K7Q6Z2LqLV5MDZU0u8f1IQ%3D%3D&xkcb=SoBe67M3FlTP8hgNR70WbzkdCdPP&vjs=3",
    "externalApplyLink": "https://emploisfp-psjobs.cfp-psc.gc.ca/psrs-srfp/applicant/page1800;jsessionid=8MZK2DQDzffSW4uCk54ezNjzUdPHRrGkH_CVK7QoDo953Mbcf7GC!1778468437?iscr=iscr&icr=icr&poster=2107319",
    "job_info_group": {
        "extracted_phone_numbers": [],
        "extracted_links": [
            "HTTP/HTTPS Links",
            "General Links",
            "WWW Links",
            "TLDs"
        ],
        "extracted_emails": [],
        "extracted_location_data": [
            "Nunavut",
            "Canada"
        ],
        "extracted_dates": [
            "a later date",
            "more than 3 years",
            "7 February 2024 - 23:59"
        ],
        "extracted_languages": [],
        "extracted_laws": [],
        "extracted_norps": [
            "the Canadians",
            "https://www.canada.ca/en/public-servicecommission/jobs/services/publicservice-jobs/canadian-armed-forcesmembers-veterans.html",
            "Nunavut Inuit"
        ],
        "extracted_orgs": [
            "The Government of Canada",
            "Pacific Time Who",
            "Canadian Veterans",
            "Initiative Dependability Working",
            "The Public Service of Canada",
            "Preference Preference",
            "Natural Resources Canada - Lands and Minerals Sector Ottawa (Ontario) EG-04 $",
            "the Canadian Information Centre for International Credentials",
            "employment equity Organizational Needs: Natural Resources Canada",
            "NRCan",
            "the Canadian Armed Forces",
            "Natural Resources Canada"
        ],
        "extracted_persons": [],
        "extracted_products": [],
        "extracted_money": [
            {
                "amount": "70,159",
                "noun_phrases": []
            },
            {
                "amount": "88,195",
                "noun_phrases": []
            }
        ],
        "processed_text": "information organization visit Natural Resources closing apply person reside canadian citizen permanent resident abroad . apply online message committed provide inclusive barrier free environment start hiring process . accommodate phase evaluation process contact information request specialized accommodation . information receive relation accommodation confidential . assessment accommodation commit build skilled workforce representative Canada's diversity include recruitment release Canadian Armed Forces personnel encourage applicant identify competency acquire employment applicable . environment federal government develop leadership skill foster teamwork support creativity innovation . people diverse pool talent happen . people . employee enjoy diverse employment range career development program learn culture support learn ongoing basis . support balance private life offer benefit flexible arrangement . transition hybrid environment offer employee telework designate location subject operational requirement . position require office presence minimum week . intent process intent selection process staff indeterminate position . position fill information provide resume . order consider application explain meet essential qualification education successful completion acceptable post secondary training program mining geological engineering technology earth resource technology acceptable combination education training Degree equivalency extensive laboratory field relevant duty position database spreadsheet software provide service external client possess follow application explain meet qualification Asset Qualifications geological civil engineering testing laboratory research development environment machine shop equipment industrial equipment apply assess essential English essential Information language requirement Knowledge mining method technology canadian mining industry laboratory testing practice relate geomechanic Knowledge datum processing analysis knowledge technique validate datum accuracy Knowledge standard operating procedure laboratory environment knowledge laboratory safety practice Competencies organize field laboratory datum manage effectively communicate effectively orally communicate effectively write Personal Suitability effective interpersonal relationship attention detail minimal supervision apply assess selection limit follow Employment Equity group aboriginal person person visible minority woman Information commit establish maintain representative workforce . organizational identify appointment decision . case qualified declare visible minority group indigenous people person woman consider priority . condition employment Reliability Status security clearance information commit build skilled diverse workforce reflect serve . promote employment equity encourage indicate belong designate group apply . information employment equity hire organization accept application . application submit Government website . submit application select button apply Online . person prevent apply contact person . intention communicate email assessment purpose . include communication invitation write test interview . include valid email address application . candidate's responsibility ensure address functional accept message unknown user email system block type email . candidate's responsibility ensure accurate information provide update require . invite interview require bring proof education credential form diploma official transcript original document . foreign credential provide proof canadian equivalency . consult information . reference check seek . interview administer . test administer . provide proof education credential . person entitle participate appointment process official language choice . veteran canadian citizen permanent resident exception locate appoint . information preference veteran apply . select consideration contact ."
    },
    "companyDescription": "Natural Resources Canada develops policies and programs that enhance the contribution of the natural resources sector to the economy, improve the quality of life for all Canadians and conduct innovative science in facilities across Canada to generate ideas and transfer technologies. We also represent Canada at the international level to meet the country's global commitments related to the sustainable development of natural resources.",
    "description": "Natural Resources Canada - Lands and Minerals Sector \n    Ottawa (Ontario) \n    EG-04 \n    $70,159 to $88,195 \n   For further information on the organization, please visit Natural Resources Canada \n   Closing date: 7 February 2024 - 23:59, Pacific Time \n   Who can apply: Persons residing in Canada, and Canadian citizens and Permanent residents abroad. \n   Apply online \n  \n \n Important messages \n We are committed to providing an inclusive and barrier-free work environment, starting with the hiring process. If you need to be accommodated during any phase of the evaluation process, please use the Contact information below to request specialized accommodation. All information received in relation to accommodation will be kept confidential.\n  Assessment accommodation \n The Government of Canada is committed to building a skilled workforce that is representative of Canada's diversity, which includes the recruitment of Canadian Veterans and releasing Canadian Armed Forces personnel: https://www.canada.ca/en/public-servicecommission/jobs/services/publicservice-jobs/canadian-armed-forcesmembers-veterans.html  We encourage applicants to identify any abilities, competencies, and/or experiences acquired through employment with the Canadian Armed Forces where applicable. \n Work environment\n  At Natural Resources Canada, a Federal government job means developing leadership skills, fostering teamwork, and supporting creativity and innovation. We know it takes people from diverse pools of talent to make this happen. That is why we are looking for people like you. As an employee at Natural Resources Canada you can enjoy diverse employment opportunities, a range of career development programs, and a learning culture that supports you to learn on an ongoing basis. We support balancing your work and private life by offering the benefits of flexible work arrangements.  NRCan has transitioned to a hybrid work environment which offers employees the opportunity to telework and work from the designated work location, subject to operational requirements. This position will require an in-office presence for a minimum of two (2) days a week. \n Intent of the process \n The intent of this selection process is to staff a full-time indeterminate position. \n Positions to be filled: 1 \n Information you must provide \n Your r\u00e9sum\u00e9. \n In order to be considered, your application must clearly explain how you meet the following (essential qualifications)\n  Education: Successful completion of an acceptable post-secondary training program in mining or geological engineering technology ou earth resources technology or an acceptable combination of education, training and/or experience\n  Degree equivalency\n \n   Experience\n   \n  \n   Extensive experience of more than 3 years of laboratory or field work, relevant to the duties of the position\n   Experience working with database or spreadsheet software\n   Experience providing services for external clients\n  \n \n  If you possess any of the following, your application must also clearly explain how you meet it (other qualifications)\n \n   Asset Qualifications\n   \n  \n   Experience working in a geological or civil engineering testing laboratory\n   Experience working in a research and development environment \n   Experience working with machine shop equipment\n   Experience with industrial equipment\n  \n \n  The following will be applied / assessed at a later date (essential for the job)\n  English essential\n  Information on language requirements\n \n   Knowledge\n   \n  \n   Of mining methods and technologies used in the Canadian mining industry\n   Of laboratory testing practices related to geomechanics\n   Knowledge of data processing and analysis\n   Knowledge of techniques for validating data for accuracy\n   Knowledge of standard operating procedures in a laboratory environment\n   Knowledge of laboratory safety practices\n  \n \n \n   Abilities/Competencies\n   \n  \n   Ability to organize field or laboratory data \n   Ability to manage time effectively\n   Ability to communicate effectively orally\n   Ability to communicate effectively in writing\n  \n \n \n   Personal Suitability\n   \n  \n   Effective interpersonal relationships\n   Attention to detail\n   Initiative\n   Dependability\n   Working under minimal supervision\n  \n \n  The following may be applied / assessed at a later date (may be needed for the job)\n  Selection may be limited to members of the following Employment Equity groups: Aboriginal persons, persons with disabilities, visible minorities, women\n  Information on employment equity\n  Organizational Needs: Natural Resources Canada is committed to establishing and maintaining a representative workforce. This organizational need may be identified as part of the appointment decision. In such cases, qualified candidates who self-declare as members of a visible minority group, Indigenous peoples, persons with disabilities or women could be considered in priority.\n  Conditions of employment\n  Reliability Status security clearance \n Other information \n The Public Service of Canada is committed to building a skilled and diverse workforce that reflects the Canadians we serve. We promote employment equity and encourage you to indicate if you belong to one of the designated groups when you apply.\n  Information on employment equity \n The hiring organization will accept applications on-line only. All job applications must therefore be submitted through the Government of Canada jobs website. To submit an application on-line, please select the button \u201cApply Online\u201d below. Persons with disabilities preventing them from applying on-line are asked to contact the person named below.  It is our intention to communicate with candidates via email for assessment purposes. This will include communication of invitations to written tests and interviews. To that end, candidates must include a valid email address in their application. It is the candidate\u2019s responsibility to ensure that this address is functional and that it accepts messages from unknown users (some email systems block these types of email). It is also the candidate\u2019s responsibility to ensure accurate information is provided and updated as required.  Candidates invited to an interview will be required to bring proof of their education credentials, in the form of a diploma or official transcript (original documents only). Candidates with foreign credentials must provide proof Canadian equivalency. Consult the Canadian Information Centre for International Credentials for further information at http://www.cicic.ca.  Reference checks may be sought.  An interview may be administered.  A test may be administered.  You must provide proof of your education credentials.  Persons are entitled to participate in the appointment process in the official language(s) of their choice. \n Preference \n Preference will be given to veterans first and then to Canadian citizens and permanent residents, with the exception of a job located in Nunavut, where Nunavut Inuit will be appointed first.\n  Information on the preference to veterans \n We thank all those who apply. Only those selected for further consideration will be contacted."
}