{
    "id": "3b90b6045605aff3",
    "company": "KPMG",
    "positionName": "Account Coordinator",
    "jobType": [
        "Full-time"
    ],
    "location": "Ottawa, ON",
    "salary": null,
    "postingDateParsed": "2024-01-26T12:14:40.306Z",
    "url": "https://www.indeed.ca/rc/clk?jk=3b90b6045605aff3&from=jasx&tk=1hl5df1tjjgbv802&bb=Z1g7BKmuG1p3giV72g1dcRbo3IOfYMVaNBT4o1fYEUeqcQ4R3NBpRxg0CZOaJNj-utPvaKbJaD0Dd50hMaSOXxA8fZ7yPpR98__CAt1LBXxtcvJvpctnxg%3D%3D&xkcb=SoAC67M3FlSzmxgNR70KbzkdCdPP&vjs=3",
    "externalApplyLink": "https://ca.indeed.com/applystart?jk=3b90b6045605aff3&from=vj&pos=top&mvj=0&spon=0&sjdu=o7sfz71MPdMgyiV0LZq0d4DDplm6SwWjHcxyoDIphKmDnEEXZcoS8tZlZxtxxlslhZbqx9czcadwFdNI1ClQa9jfOmhb7TpFsm0rWP8OnYn1lkO7GRo9qan6ePLxpgGaXyiAeG1sclGEN0I79YGABNsbkzOlZ1gCBcI0OFTR1hI0pyfjkb4j824Dn55K60Jrw9_XINGINv7OnqX9-Wv1cg&vjfrom=serp&astse=253b0539ac02f4d0&assa=9551",
    "job_info_group": {
        "extracted_phone_numbers": [],
        "extracted_links": [
            "HTTP/HTTPS Links",
            "General Links",
            "WWW Links",
            "TLDs"
        ],
        "extracted_emails": [],
        "extracted_location_data": [
            "Canada"
        ],
        "extracted_dates": [],
        "extracted_languages": [
            "English",
            "French"
        ],
        "extracted_laws": [],
        "extracted_norps": [],
        "extracted_orgs": [
            "our Centre of Excellence",
            "Inclusion, Diversity & Equity in Recruitment",
            "MS Office Superior",
            "Task Authorizations",
            "KPMG",
            "our Federal Government Account",
            "Quarterly Reporting and Insurance Certifications Support",
            "the Account Pipeline Document"
        ],
        "extracted_persons": [
            "Keen"
        ],
        "extracted_products": [
            "Collaborate"
        ],
        "extracted_money": [],
        "processed_text": "overview join team diverse dedicated problem solver connect common turn insight client community . Account Coordinator join establish support . Account Coordinator collaborate Senior Account Manager COE team client service team ensure optimization client . fulltime person position office requirement evening support marketing event . support Senior Account Manager meet client expectation revenue target support federal government account sponsorship event plan execution management logistic include attend evening event regular basis maintain contract database Communicate contract relate information internal stakeholder Manage contract relate correspondence record keeping ensure contract compliance area review request proposal contract term condition ensure alignment KPMG policy assist requirement quick turn resume review quality assurance assist Senior Account Manager creation report presentation assist review maintenance maintain information share record tool reference datum source information reporting analytic utilize compliance audits team ensure business met actively participate efficient functioning high perform team adopt digital tool strategy drive innovation contribute process improvement bring role minimum progressive responsibility quantifiable result contract administration risk management large professional service organization federal government asset strong knowledge federal government contracting vehicle demonstrate trusted advisor deal multiple stakeholder include senior firm members partner contractor external service provider subject matter expert prove fast pace highly demanding team environment manage high volume vary degree complexity Organized manage compete priority multiple stakeholder eye continuous improvement efficiency strong aptitude conduct impact analysis assessment demonstrate success operational process drive initiative proficient comfortable multiple technology attention detail accuracy paramount advanced knowledge write verbal communication skill asset manage simultaneous event sponsorship asset Keys success high degree personal professional integrity build network nurture excellent relationship maintenance development Trusted Advisor relationship current future client starter proven operate effectively collaborative environment proven effectively high perform team collaborative team environment propose creative strategic pragmatic solution resolve business issue manage multiple project high quality timely product fast pace deadline drive environment Team player build trust create effective relationship business internal external stakeholder excellent communication interpersonal skill proactive commitment operational excellence drive continuously learn seek feedback develop base feedback KPMG individual Deliver impact | seek growth | Inspire Trust understand diverse workforce enable deepen relationship strengthen business . provide support good information Canada's benefit click . KPMG integrity | Excellence learn improve | courage boldly | respect draw strength difference | matter equal employer committed create respectful inclusive barrier free workplace allow people reach potential . diverse workforce key success bring . qualified apply choose employer choice . information click . question accessible employment confidential conversation individual accessibility accommodation recruitment process encourage visit accessibility ."
    },
    "companyDescription": "KPMG LLP is the Canadian member firm of KPMG International. We provide Audit, Tax, and Advisory services to many of the public and private business, not-for profit, and public sector organizations in Canada. Nationally, there are 40 offices and over 700 partners and 10,000 employees working together to help Canadian businesses achieve their goals.\r\n\r\nAt KPMG, you'll have the opportunity to collaborate and innovate with teams across Audit, Tax, Advisory, Enterprise, Digital and Business Enablement Services to make a difference for clients, communities and the people you work with. Every day, in ways big and small, you make a meaningful and positive difference for clients, people and the communities we serve. \r\n\r\nYour unique experiences and perspectives belong here. Both individually and as a team, you will understand and value the differences that lead to stronger insights and innovation.\r\n\r\nBuild relationships with colleagues who take care of each other. You will have the KPMG community at your side, providing the support you need to be at your best and create opportunities for yourself and others.\r\n\r\nYour aspirations and initiative make KPMG better. Wherever you work, be recognized for the impact you make, the leadership you show, and the success you create with others. Find opportunity everywhere with KPMG.\r\n",
    "description": "Overview: \n  At KPMG, you\u2019ll join a team of diverse and dedicated problem solvers, connected by a common cause: turning insight into opportunity for clients and communities around the world.\n  The opportunity\n \n  KPMG is looking for an Account Coordinator to join our Centre of Excellence establish to support our Federal Government Account. The Account Coordinator will collaborate with the Senior Account Manager, COE team and client services teams to ensure optimization of the client experience.\n \n \n   This is a fulltime in person position in our Ottawa office with the requirement to work evenings to support marketing events.\n  What you will do: \n \n  Support the Senior Account Manager in successfully meeting client expectations and revenue targets\n   Support federal government account sponsorships/event planning through execution and management of logistics including attending evening events on a regular basis\n   Maintain contracts database \n  Communicate contract-related information to internal stakeholders\n   Manage contract-related correspondence and record keeping\n   Ensures contract compliance in areas such as Quarterly Reporting and Insurance Certifications \n  Support the review of RFP contract terms and conditions to ensure alignment with KPMG policies\n   Assist with requirements for Task Authorizations with a quick turn-around (resume review and quality assurance)\n   Assist the Senior Account Manager in the creation of reports and presentations\n   Assist in the review and maintenance of the Account Pipeline\n   Document and maintain information in shared record-keeping tools to be used as reference data, source information for reporting and analytics, and be utilized for compliance audits\n   Collaborate with other members of the team to ensure business needs are met\n   Actively participate in the efficient functioning of a high-performing team by adopting digital tools and strategies, driving innovation, and contributing to process improvements\n  What you bring to this role: \n \n  A minimum of two years progressive responsibility with quantifiable results in contract administration and risk management in a large professional services organization\n   Experience working with the federal government is an asset\n   Strong knowledge of federal government contracting vehicles \n  Demonstrated ability to act as a trusted advisor, and ability to deal with multiple stakeholders including senior firm members/ Partners, contractors, external service providers, and various subject-matter experts\n   Proven ability to work well in a fast paced, highly demanding, team environment, and manage a high volume of work with varying degrees of complexity\n   Organized, and able to manage competing priorities for multiple stakeholders\n   Keen eye for continuous improvement and efficiency, with a strong aptitude for conducting impact analysis assessments\n   Demonstrated success on operational, process driven initiatives\n   Proficient and comfortable with working in multiple technologies \n  Attention to detail and accuracy is paramount\n   Advanced knowledge of MS Office\n   Superior written and verbal communications skills in English and French is an asset\n   Experience managing simultaneous events/sponsorships in an asset\n \n  Keys to your success:\n  \n \n \n   High degree of personal and professional integrity\n   Ability to build a network and nurture excellent working relationships\n   Maintenance and development of Trusted Advisor relationships with current and future clients\n   A self-starter with proven ability to operate effectively in a collaborative environment\n   Proven ability to work effectively with high-performing teams in a collaborative team environment\n   Ability to propose creative, strategic and pragmatic solutions to resolve business issues\n   Ability to manage multiple projects with high-quality and timely work product in a fast-paced, deadline-driven environment\n   Team player with the ability to build trust and create effective working relationships across business lines, and with internal and external stakeholders\n   Excellent communication and interpersonal skills\n   Proactive commitment to operational excellence\n   Driven to continuously learn from experiences and seek out feedback and develop opportunities based on the feedback given\n \n \n \n   KPMG individuals \n  Deliver Impact | Seek Growth | Inspire Trust and understand that a diverse workforce enables us to deepen relationships and strengthen our business.\n \n \n \n   Providing you with the support you need to be at your best\n \n \n \n   For more information about KPMG in Canada\u2019s Benefits and well-being, click here.\n  Our Values, The KPMG Way: \n \n   Integrity, we do what is right | \n  Excellence, we never stop learning and improving | \n  Courage, we think and act boldly | \n  Together, we respect each other and draw strength from our differences | \n  For Better, we do what matters\n \n \n \n   KPMG in Canada is a proud equal opportunities employer and we are committed to creating a respectful, inclusive and barrier-free workplace that allows all of our people to reach their full potential. A diverse workforce is key to our success and we believe in bringing your whole self to work. We welcome all qualified candidates to apply and hope you will choose KPMG in Canada as your employer of choice. For more information about Inclusion, Diversity & Equity in Recruitment, please click here.\n \n \n \n   If you have a question about accessible employment at KPMG, or to begin a confidential conversation about your individual accessibility or accommodation needs through the recruitment process, we encourage you to visit our accessibility page."
}