{
    "id": "5dcbbb7a54ccb851",
    "company": "Brunet",
    "positionName": "Laboratory Cashier",
    "jobType": [],
    "location": "795 Boul Wilfrid-Lavigne, Gatineau, QC",
    "salary": null,
    "postingDateParsed": "2023-09-01T06:50:40.939Z",
    "url": "https://www.indeed.ca/rc/clk?jk=5dcbbb7a54ccb851&from=jasx&tk=1hbl00rvqkp1k800&vjs=3",
    "externalApplyLink": "https://www.brunet.ca/Carrieres/RechercheDetail.aspx?posteID=37530&utm_source=Indeed&utm_medium=organic&utm_campaign=Indeed",
    "job_info_group": {
        "extracted_phone_numbers": [
            " (819) 684-8222",
            "(819) 684-8222"
        ],
        "extracted_links": [
            "HTTP/HTTPS Links",
            "General Links",
            "WWW Links",
            "TLDs"
        ],
        "extracted_emails": [],
        "extracted_location_data": [],
        "extracted_dates": [
            "1855"
        ],
        "extracted_languages": [],
        "extracted_laws": [],
        "extracted_norps": [],
        "extracted_orgs": [
            "de grande qualit\u00e9 et en",
            "La conseiller",
            "entour\u00e9 de professionnels passionn\u00e9s par leur m\u00e9tier",
            "R\u00e9pondre aux demandes des patients selon les",
            "entre autre",
            "\u00e0 la",
            "l'op\u00e9ration de la caisse",
            "au Qu\u00e9bec"
        ],
        "extracted_persons": [
            "Sous",
            "le ou la caissier",
            "Wilfrid-Lavigne Gatineau",
            "boul",
            "Brunet",
            "et toujours pr\u00eate \u00e0 offrir le meilleur \u00e0 chacun de ses",
            "confidentiels de fa\u00e7on s\u00fbre",
            "seuls ceux s\u00e9lectionn\u00e9s seront contact\u00e9s",
            "son poste",
            "l\u00e9gales applicables",
            "divulgu\u00e9es Transmettre",
            "affili\u00e9es \u00e0 Brunet vous offre la possibilit\u00e9 d'\u00e9voluer",
            "attentif aux besoins des clients",
            "\u00c0 l'adresse mentionn\u00e9e ci-haut",
            "Connaissance de base \u00c0 propos de Brunet Fond\u00e9e",
            "Les t\u00e2ches ci-haut mentionn\u00e9es le sont \u00e0 titre"
        ],
        "extracted_products": [],
        "extracted_money": [],
        "processed_text": "Type poste Temps plein horaire Jour Nombre d'heure heure prevue d'entree fonction Succursale . Quality Control J9J Description supervision du technicien chef ere au laboratoire effectue principalement enregistreuse tout offrant service clientele etant repondant leurs demande . caissier ere au laboratoire est responsable Offrir service clientele exemplaire limites respectant confidentialite des information conserver detruire les renseignements appropriee Effectuer des suivis telephoniques Reapprovisionner les etalage marchandises Balancer caisse enregistreuse indicatif . Scolarite Diplome d'etudes secondaire DES Termine mois d'experience Langue francaise Tres bonne connaissance Langue anglaise Brunet pour mission d'offrir aux Quebecois les conseil les services relies sante les personnalise . compte reseau quelque etablissement franchises poursuit son developpement bonifiant sans cesse son offre produits service . Travailler au sein du reseau Brunet reseau des pharmacies dans environnement stimulant . Vous souhaitez travailler au quotidien avec clientele l'orienter Rejoignez des maintenant une equipe humaine dediee au bien etre sa clientele client . Brunet est dedie promotion d'un milieu travail diversifie . nous considereron tous les candidats qualifies pour lthemploi postule . nous remercion tous les candidats leur interet . Cependant . Contactez nous Par personne contacter personne ."
    },
    "companyDescription": "",
    "description": "Type de poste : \n     Temps plein\n      \n     Horaire : \n     Jour\n      \n     Nombre d'heures : \n     Plus de 35 heures\n      \n     Date pr\u00e9vue d'entr\u00e9e en fonction : \n     2023-09-08\n      \n    \n    \n     Succursale - 5136\n      \n     795, boul. Wilfrid-Lavigne\n      \n     Gatineau, QC J9J 1V2\n      \n    \n   \n  \n  \n  \n   \n    \n     Description \n     \n      Sous la supervision du technicien-chef, le ou la caissier/\u00e8re au laboratoire effectue principalement l'op\u00e9ration de la caisse enregistreuse tout en offrant un service \u00e0 la client\u00e8le de grande qualit\u00e9 et en \u00e9tant attentif aux besoins des clients et en r\u00e9pondant \u00e0 leurs demandes.\n       Le ou la caissier/\u00e8re au laboratoire est, entre autre, responsable de : \n      \n       Offrir un service \u00e0 la client\u00e8le exemplaire \n       R\u00e9pondre aux demandes des patients selon les limites l\u00e9gales applicables \u00e0 son poste en respectant la confidentialit\u00e9 des informations divulgu\u00e9es \n       Transmettre, conserver ou d\u00e9truire les renseignements confidentiels de fa\u00e7on s\u00fbre et appropri\u00e9e \n       Effectuer des suivis t\u00e9l\u00e9phoniques \n       R\u00e9approvisionner les \u00e9talages de marchandises \n       Balancer la caisse enregistreuse \n       \n      \n       Les t\u00e2ches ci-haut mentionn\u00e9es le sont \u00e0 titre indicatif.\n       \n     \n     \n      Scolarit\u00e9 : \n      Dipl\u00f4me d\u2019\u00e9tudes secondaires (DES) - Termin\u00e9\n       \n      Exp\u00e9rience : \n      1 \u00e0 6 mois d\u2019exp\u00e9rience\n       \n      Langue fran\u00e7aise : \n      Tr\u00e8s bonne connaissance\n       \n      \n       Langue anglaise : \n       \n        Connaissance de base\n         \n       \n      \n     \n     \n      \u00c0 propos de Brunet Fond\u00e9e en 1855, Brunet a pour mission d\u2019offrir aux Qu\u00e9b\u00e9cois les conseils et les services reli\u00e9s \u00e0 la sant\u00e9 les plus personnalis\u00e9s. Brunet, qui compte un r\u00e9seau de quelque 180 \u00e9tablissements franchis\u00e9s au Qu\u00e9bec, poursuit son d\u00e9veloppement en bonifiant sans cesse son offre de produits et de services. \n      Travailler au sein du r\u00e9seau de Brunet Le r\u00e9seau des pharmacies affili\u00e9es \u00e0 Brunet vous offre la possibilit\u00e9 d\u2019\u00e9voluer dans un environnement stimulant, entour\u00e9 de professionnels passionn\u00e9s par leur m\u00e9tier. Vous souhaitez travailler au quotidien avec la client\u00e8le? La conseiller, l'orienter? Rejoignez d\u00e8s maintenant une \u00e9quipe humaine, d\u00e9di\u00e9e au bien-\u00eatre de sa client\u00e8le et toujours pr\u00eate \u00e0 offrir le meilleur \u00e0 chacun de ses clients. \n       Brunet est d\u00e9di\u00e9 \u00e0 la promotion d'un milieu de travail diversifi\u00e9. Nous consid\u00e9rerons tous les candidats qualifi\u00e9s pour l'emploi postul\u00e9. \n       Nous remercions tous les candidats de leur int\u00e9r\u00eat. Cependant, seuls ceux s\u00e9lectionn\u00e9s seront contact\u00e9s. \n     \n    \n   \n  \n \n \n  \n   Contactez-nous \n   \n    \n     \n      Par t\u00e9l\u00e9phone : \n      (819) 684-8222, personne \u00e0 contacter : \n       \n      En personne : \n      \u00c0 l'adresse mentionn\u00e9e ci-haut."
}