{
    "id": "67aba7607cde3a30",
    "company": "Stantec",
    "positionName": "Senior Acoustics Engineer/Consultant",
    "jobType": [
        "Temporary",
        "Part-time",
        "Full-time"
    ],
    "location": "3001331 Clyde Avenue, Ottawa, ON",
    "salary": null,
    "postingDateParsed": "2024-01-25T12:17:51.816Z",
    "url": "https://www.indeed.ca/rc/clk?jk=67aba7607cde3a30&from=jasx&tk=1hl5djsk1h7hv800&bb=xjPBkK6OIlrxY1Te1w3p5TqNzUeKh0-BhlOujvFnALmcTnRMUPJb9pQsy8vgyc2uBsNDx20VnHGqt6rKqzsRDvDq6OyAd_utCq8x5G1huH0f9PvbVi35ZA%3D%3D&xkcb=SoAU67M3FlTATHzAAx0ObzkdCdPP&vjs=3",
    "externalApplyLink": "https://stantec.jobs/ottawa-on/senior-acoustics-engineerconsultant/BB56F24B6CC64CD6A5963437F643397A/job/?vs=1554&utm_source=Indeed-DE&utm_medium=Job%20Aggregator&utm_campaign=Indeed",
    "job_info_group": {
        "extracted_phone_numbers": [],
        "extracted_links": [
            "HTTP/HTTPS Links",
            "General Links",
            "WWW Links",
            "TLDs"
        ],
        "extracted_emails": [],
        "extracted_location_data": [
            "NC",
            "Canada",
            "Canada-Ontario-Stoney Creek"
        ],
        "extracted_dates": [
            "a minimum 10 years",
            "Jan 24, 2024",
            "10 years",
            "annually"
        ],
        "extracted_languages": [],
        "extracted_laws": [],
        "extracted_norps": [],
        "extracted_orgs": [
            "(e.g., Microsoft Office",
            "Professional Engineer",
            "Education and Experience Graduate",
            "Computer-Aided Design",
            "the Professional Engineer of Ontario",
            "Toronto ON Organization",
            "240000BQ Stantec",
            "Stantec",
            "INSUL",
            "BC-1609 EnvSvcs-CA Ontario West Employee Status :",
            "Your Opportunity Stantec Canada"
        ],
        "extracted_persons": [
            "Stamina"
        ],
        "extracted_products": [],
        "extracted_money": [],
        "processed_text": "Senior Acoustics Engineer consultant 240000bq description ground safety quality ethic expert lead field guide rigor creative spirit vision growth . draw technical specialty globe committed foster inclusive community diverse talent background expertise . place apply passion collaborate environmental talent critical client community support . join team environment science . seek motivated individual help support participate continuous growth service building acoustic market . ideal interest technical client management complex project build environment integration acoustic design high perform building . Key Responsibilities directly Noise Vibration Acoustics NVA group's building acoustic lead support build acoustic project internal external client . proactive motivated meet agree deadline . manage building acoustic project range small large scale inception completion project deliverable schedule scope budget project . collaborate project manager manage acoustic scope deliverable multi discipline stantec project . contribute grow building acoustic service . identify develop prepare effective technical proposal active role development business exist client . collaborate client expand client relationship generate repeat business . undertake architectural acoustic vibration design include evaluate designing noise vibration control mechanical electrical plumbing MEP system . develop clear recommendation communicate write document sketch client architect engineer contractor . lead meeting workshop client include prepare carry presentation . conduct supervise sound vibration measurement site . conduct supervise field review contract administration review shop drawing support construction phase project . responsible financial management project . participate conduct site visit undertake research datum collection field survey datum summary document observation . maintain professional growth development seminar workshop professional affiliation abreast late trend software technology . conduct datum collection desktop base technical analysis modeling post processing interpretation documentation result . coordinate project team internal external . assist streamline standardize method datum collection analysis . overseeing train junior intermediate staff field analysis report preparation . collaborate Stantec practitioner multiple office global organization . qualification Capabilities Credentials knowledge architectural acoustic mechanical HVAC noise control design vibration isolation require . strong mechanical noise background prefer . design Build public Private Partnership project delivery model asset . familiarity noise vibration datum acquisition practice software . build acoustic testing include ASTC AIIC . sound vibration measurement instrument model software e.g. CADNA TNM STAMSON EASE ODEON . asset . demonstrate team environment communicating external client . knowledge software . . Creative organize multi task independently . excellent communication write verbal strategic thinking negotiation presentation people skill . diligent detail orient desire learn . flexibility scheduling require travel relate site survey . valid driver's license require . availability conduct field extended period require . willingness occasional travel internationally . accredited university college applicable engineering technical degree . consult field architectural acoustic mechanical noise consulting . register eligible register canadian province asset . description comprehensive listing activity duty responsibility require employee duty responsibility activity assign change notice . place good bright build other's talent exciting impact . join redefine personal good . benefit summary regular employee access health dental vision plan program health care spending account wellness spending account group register retirement saving plan employee stock purchase program group tax free saving account life accidental death dismemberment adandd insurance short term long term plan emergency travel benefit tuition reimbursement professional membership fee coverage pay . temporary casual employee access group register retirement saving plan employee stock purchase program group tax free saving account . benefit information list apply union position benefit position govern applicable collective bargaining agreement . Primary Location Mississauga Locations Alberta Calgary Toronto Montreal Locations regular level Individual Contributor Travel schedule posting Req provide equal employment qualified employee applicant future current employment prohibit discrimination ground race color religion sex national origin age marital status genetic information protect veteran status sexual orientation gender identity gender expression . prohibit discrimination decision concern recruitment hiring referral promotion compensation fringe benefit training termination condition employment . compliance local state federal law regulation ensure equitable aspect employment . EEO include protect Veterans"
    },
    "companyDescription": "Communities are fundamental. Whether around the corner or across the globe, they provide a foundation, a sense of place and of belonging. That\u2019s why at Stantec, we always design with community in mind. \r\n\r\nWe care about the communities we serve\u2014because they\u2019re our communities too. This allows us to assess what\u2019s needed and connect our expertise, to appreciate nuances and envision what\u2019s never been considered, to bring together diverse perspectives so we can collaborate toward a shared success.  \r\n\r\nWe\u2019re designers, engineers, scientists, and project managers, innovating together at the intersection of community, creativity, and client relationships. Balancing these priorities results in projects that advance the quality of life in communities across the globe. \r\n\r\nStantec is a place where the best and brightest come to build on each other's talents, do exciting work, and make an impact on the world around us. Join us and redefine your personal best. Visit us at Stantec.com/careers ",
    "description": "Senior Acoustics Engineer/Consultant - ( 240000BQ ) \n Description \n Grounded in safety, quality, and ethics, our experts lead their fields and guide our work with rigor, a creative spirit, and vision for growth. We draw from more than 20 technical specialties around the globe and are committed to fostering an inclusive community of diverse talents, backgrounds, and expertise. We\u2019re a place to apply your passion and collaborate with top environmental talents on work that\u2019s critical to our clients and the communities they support. Join a team that has the environment down to a science. \n Your Opportunity \n Stantec Canada seeks motivated individuals with a minimum 10 years of experience to help support and participate in the continuous growth of our services in the building acoustics market. The ideal candidate will have an interest in the technical and client management of complex projects in the built environment, and the integration of acoustics into the design of high performing buildings. \n Your Key Responsibilities \n \n  Working directly with the Noise, Vibration and Acoustics (NVA) group\u2019s building acoustic lead to support building acoustic projects for both internal and external clients. \n  Be proactive and motivated to meet agreed deadlines. \n  Manage building acoustics projects ranging from small to large scale from inception to completion; Project deliverables are on schedule, within the scope and budget of the project. \n  Collaborate with project managers to manage acoustic scope and deliverables on multi-discipline Stantec projects. \n  Contribute to growing new building acoustics services annually. \n  Identify and develop new opportunities, prepare effective technical proposals, and take an active role in the development of our business with new and existing clients. \n  Collaborate with clients and expand client relationships that generate repeat business. \n  Undertake architectural acoustic and vibration design, including evaluating, specifying, and designing noise and vibration controls for mechanical, electrical, and plumbing (MEP) systems. \n  Develop clear recommendations and communicate via written documents and sketches to clients, architects, engineers, and contractors. \n  Lead meetings and workshops with clients, including preparing and carrying out presentations. \n  Conduct and supervise sound and vibration measurements on-site. \n  Conduct and supervise field reviews during contract administration, review shop drawings and support the construction phase of projects. \n  Responsible for financial management of projects. \n  Participate in conducting site visits, undertaking research, data collection/field surveys, data summary, and documenting observations. \n  Maintaining professional growth and development through seminars, workshops, and professional affiliations to keep abreast of the latest trends, software, and technology. \n  Conducting data collection, desktop based technical analysis and modeling, post processing, interpretation, and documentation of results. \n  Coordinating with project teams (internal and external). \n  Working to assist in streamlining and standardizing methods for data collection and analysis. \n  Overseeing and training junior and intermediate staff in both field work, analysis and report preparation. \n  Collaborate with other Stantec practitioners from multiple offices around the global organization. \n \n Qualifications \n Your Capabilities and Credentials \n \n  Knowledge of architectural acoustics, mechanical HVAC noise control design and vibration isolation is required. Those with a strong mechanical noise background are preferred. \n  Experience on Design-Build and Public-Private-Partnership (P3) project delivery models would be an asset. \n  Familiarity with noise and vibration data acquisition practices and software. \n  Experience with building acoustics testing, including ASTC, AIIC and NC. \n  Experience with sound and vibration measurement instruments and modeling software (e.g., CADNA/A, TNM, Stamina, STAMSON, INSUL, EASE, ODEON etc.) would be an asset. \n  Demonstrated experience in working in a team environment and communicating with external clients. \n  Working knowledge of software (e.g., Microsoft Office, CAD, etc.). \n  Creative, organized, and able to multi-task while working independently. \n  Excellent communication (written/verbal), strategic thinking, negotiation, presentation, and \u201cpeople\u201d skills. \n  Diligent and detail oriented with the desire to learn. \n  Flexibility in scheduling required for travel related to site surveys. \n  A valid driver\u2019s license is required. \n  Availability to conduct field work during and outside normal business hours, and for extended periods as required. \n  Willingness for occasional travel, within Canada or internationally. \n \n Education and Experience \n \n  Graduate of an accredited university or college with applicable engineering and/or technical degree. \n  10 years of consulting in the field of architectural acoustics and/or mechanical noise consulting. \n  Registered or eligible to register as Professional Engineer with the Professional Engineer of Ontario or other Canadian provinces is an asset. \n \n This description is not a comprehensive listing of activities, duties or responsibilities that may be required of the employee and other duties, responsibilities and activities may be assigned or may be changed at any time with or without notice. \n Stantec is a place where the best and brightest come to build on each other's talents, do exciting work, and make an impact on the world around us. Join us and redefine your personal best. \n Benefits Summary: Regular full-time and part-time employees will have access to health, dental, and vision plans, a well-being program, health care spending account, wellness spending accounts, group registered retirement savings plan, employee stock purchase program, group tax-free savings account, life and accidental death & dismemberment (AD&D) insurance, short-term/long-term disability plans, emergency travel benefits, tuition reimbursement, professional membership fee coverage, and paid time off. \n Temporary/casual employees will have access to group registered retirement savings plan, employee stock purchase program, and group tax-free savings account. \n The benefits information listed above may not apply to union positions because benefits for such positions are governed by applicable collective bargaining agreements. \n Primary Location : Canada-Ontario-Mississauga \n Other Locations : Canada-Ontario-Stoney Creek, Canada-Alberta-Calgary, Canada-Ontario-Ottawa, Canada-Ontario-Toronto, Canada-Quebec-Montr\u00e9al \n Work Locations : \n Toronto ON \n Organization : BC-1609 EnvSvcs-CA Ontario West \n Employee Status : Regular \n Job Level : Individual Contributor \n Travel : Yes, 25 % of the Time \n Schedule : Full-time \n Job Posting : Jan 24, 2024, 9:29:47 AM \n Req ID: 240000BQ \n Stantec provides equal employment opportunities to all qualified employees and applicants for future and current employment and prohibit discrimination on the grounds of race, color, religion, sex, national origin, age, marital status, genetic information, disability, protected veteran status, sexual orientation, gender identity or gender expression. We prohibit discrimination in decisions concerning recruitment, hiring, referral, promotion, compensation, fringe benefits, job training, terminations or any other condition of employment. Stantec is in compliance with local, state and federal laws and regulations and ensures equitable opportunities in all aspects of employment. EEO including Disability/Protected Veterans"
}