{
    "id": "01b33d24fb14b674",
    "company": "Assembly of First Nations",
    "positionName": "Policy Analyst, Environmental Health / Analyste des politiques - Sant\u00e9 de l\u2019environnement",
    "jobType": [],
    "location": "Ottawa, ON",
    "salary": null,
    "postingDateParsed": "2023-11-08T20:16:46.561Z",
    "url": "https://www.indeed.ca/rc/clk?jk=01b33d24fb14b674&from=jasx&tk=1hgol57rgk5r3800&vjs=3",
    "externalApplyLink": "https://afn.bamboohr.com/careers/232?source=indeed&src=indeed&postedDate=2023-11-07",
    "job_info_group": {
        "extracted_phone_numbers": [],
        "extracted_links": [
            "HTTP/HTTPS Links",
            "General Links",
            "WWW Links",
            "TLDs"
        ],
        "extracted_emails": [],
        "extracted_location_data": [
            "sera",
            "L'APN",
            "Ottawa",
            "ce qui",
            ", f\u00e9d\u00e9raux, provinciaux, territoriaux",
            "du Nord"
        ],
        "extracted_dates": [
            "9 days",
            "l'\u00e9laboration",
            "3 weeks",
            "December-January holidays",
            "3-5 years",
            "paid vacation per year",
            "per year"
        ],
        "extracted_languages": [
            "English"
        ],
        "extracted_laws": [],
        "extracted_norps": [
            "l'APN",
            "English/French"
        ],
        "extracted_orgs": [
            "de la s\u00e9curit\u00e9 alimentaire",
            "de planification et d'organisation",
            "meilleurs employeurs",
            "L'APN s'engage \u00e0 mettre en",
            "R\u00f4le L'Assembl\u00e9e des Premi\u00e8res Nations",
            "la recherche d'une",
            "les comit\u00e9s",
            "cherche \u00e0",
            "la sensibilisation du public et",
            "Le projet des 100 meilleurs employeurs du Canada",
            "L'Assembl\u00e9e des Premi\u00e8res Nations",
            "Premi\u00e8res Nations-en",
            "The Assembly of First Nations",
            "LCPE",
            "au Canada",
            "planning & organizational",
            "enjeux",
            "L'APN se r\u00e9serve",
            "the Canadian Human Rights Act",
            "la justice et la souverainet\u00e9 de chaque Premi\u00e8re Nation d\u00e9tentrice de droits guident le travail de l'organisation",
            "efficace de d\u00e9fense des int\u00e9r\u00eats",
            "\u00e0 la communication",
            "r\u00e9soudre divers probl\u00e8mes nationaux auxquels se heurtent les Premi\u00e8res Nations",
            "each rights-holding First Nation",
            "nationale visant \u00e0 d\u00e9terminer",
            "\u00e0 la s\u00e9curit\u00e9 et \u00e0 la souverainet\u00e9",
            "un domaine directement li\u00e9 \u00e0 la sant\u00e9/science de l'environnement",
            "First Nations Ancestry",
            "CEPA",
            "les gouvernements et les repr\u00e9sentants des Premi\u00e8res Nations",
            "les F\u00eates de fin d'ann\u00e9e",
            "un",
            "\u00e0 la justice",
            "First Nations Leadership",
            "avec une \u00e0 deux ann\u00e9es d'exp\u00e9rience",
            "\u00e0 la pr\u00e9vention de la pollution, aux sciences sociales ou \u00e0 tout autre domaine d'\u00e9tudes connexe",
            "First Nations Environmental Health",
            "rechercher et \u00e0 comprendre la terminologie",
            "promouvoir les droits inh\u00e9rents et issus des trait\u00e9s des Premi\u00e8res Nations",
            "the Canadian Environmental Protection Act",
            "d\u00e9rouleront",
            "d'effectuer des analyses et de r\u00e9diger des documents concernant principalement la sant\u00e9 de l'environnement au sein des Premi\u00e8res Nations",
            "de la pr\u00e9vention de la",
            "First Nations",
            "First Nations Inherent and Treaty Rights",
            "l'\u00e9laboration conjointe de lois visant \u00e0 renforcer les capacit\u00e9s des Premi\u00e8res Nations",
            "organisation de d\u00e9fense des int\u00e9r\u00eats des Premi\u00e8res Nations",
            "inclusifs",
            "First Nations Environmental Health programs Knowledge",
            "la diversit\u00e9"
        ],
        "extracted_persons": [
            "\u00c9tant donn\u00e9 que nous recevons un grand nombre de candidatures",
            "Capacit\u00e9 av\u00e9r\u00e9e \u00e0",
            "un entretien vous sera propos\u00e9",
            "Comment postuler : Les entretiens",
            "Qui sommes-nous",
            "des cong\u00e9s pay\u00e9s",
            "Si vous avez des besoins pr\u00e9cis",
            "de la qualit\u00e9 de l'air \u00e0 l'int\u00e9rieur et \u00e0 l'ext\u00e9rieur",
            "L'APN s'est vu d\u00e9cerner l'honneur d'\u00eatre d\u00e9sign\u00e9e comme l'un des 100",
            "Entregent",
            "autochtone",
            "des cong\u00e9s g\u00e9n\u00e9reux",
            "que le respect des droits de la personne",
            "le droit d'annuler",
            "de plaidoyer de l'APN \u00e0 l'\u00e9chelle nationale",
            "L'APN offre des salaires comp\u00e9titifs",
            "La pr\u00e9f\u00e9rence",
            "jusqu'\u00e0 ce que le poste soit combl\u00e9",
            "se distinguent dans",
            "compl\u00e9ment de cong\u00e9 de maternit\u00e9 et de cong\u00e9",
            "un r\u00e9gime de retraite et d'avantages"
        ],
        "extracted_products": [
            "improvement Collaborate"
        ],
        "extracted_money": [],
        "processed_text": "Internal External posting Permanent Location hybrid prefer open location suitable applicant find . Salary range commensurate education . AFN offer competitive salary generous start pay pay sick leave special leave pension benefit plan annual physical fitness professional development maternity parental leave . application instruction interview hold ZOOM qualified person preference s.16 . close open fill AFN dedicate inclusive selection process environment . require accommodation advise Human Resources representative invite meet regard employment . AFN advocacy organization direction fulfil mandate direct Nations assembly resolution . national advocacy organization AFN seek advance development policy public education applicable development legislation build Nations capacity . AFN create desire Nations leadership strong effective collective advocacy organization . respect human diversity justice sovereignty guide organization . AFN honor Canada's employer . Canada's employer project national competition determine employer lead industry offer exceptional workplace employee . diverse talented team impact national issue face . role Assembly Nations seek experienced skilled motivated individual responsible research information statistic conduct analysis prepare write document relate . policy analyst provide recommendation policy development interpretation application . incumbent responsible achievement define plan objective aim support advance AFN's national advocacy position interest strategy Nations Environmental Health relate issue priority include chemical management environmental justice protection food security sovereignty climate change impact zoonotic disease nuclear waste management . report Director Environment Policy Analyst follow key duty responsibility conduct comprehensive research analysis program policy . evaluate exist policy regulation identify gap inefficiency area key partner include government official agency community base organization gather insight perspective priority relate Nations Environmental Health Develop evidence base policy recommendation briefing note speak note report branch sector leadership . stay informed current trend good practice late development research finding relate Nations Environmental Health policy . participate policy advocacy effort internally AFN group participation external meeting . qualification undergraduate degree environment biology social science field study minimum relevant equivalent combination education relate understanding environmental health issue Nations community include environmental contaminant pollution prevention food safety security indoor outdoor air quality climate change impact zoonotic disease . knowledge understanding relate legislation excellent verbal write communication skill translate complex idea information audience demonstrate research understand statistical terminology demonstrate analyze large set complex change datum communicate clear concise ensure colleague AFN committee partner understand finding recognize significance demonstrate federal provincial territorial government official demonstrate interpersonal skill teamwork judgement demonstrate management skill attention detail . language official language asset . fluency Nations language asset . interest employment AFN appreciate application carefully review resume . receive high number application inform contact shortlist . AFN cancel postpone revise employment . affichage interne externe Temps plein Permanent Lieu travail preference hybride autres lieux possibles si candidat adequat est trouve . Echelle salariale fonction l'experience formation . semaines vacances payees par pour commencer pour semaines conges maladie payes par jour conges speciaux par sociaux des montant annuel pour conditionnement physique perfectionnement professionnel ainsi qu'un parental . se Zoom . accordee aux personnes qualifiees d'ascendance conformement l'article Loi canadienne sur les droits personne . cloture ouvert . place processus selection environnement travail . veuillez informer l'agent des ressources humaines au moment . APN est une prend ses directive accomplit ses mandats conformement aux resolutions adoptee par les assemblee . tant qu'organisation nationale defense des interets des Premieres Nations l'APN par l'elaboration politiques cas echeant . est nee volonte des dirigeants des Premieres Nations se doter d'une organisation collective forte . Des valeurs . . est une initiative quel employeur leurs domaines offrant des milieux travail exceptionnel leurs employes . Nous ne pourrion etre fiers compter sur une equipe diversifiee talentueuse contribue . est personne experimentee competente motivee sera chargee rechercher des information des statistique . l'analyste des politiques formulera des recommandations pour l'interpretation l'application des politiques . titulaire sera egalement responsable realiser des plan travail des objectifs definis visant promouvoir les position les interets les strategies concerne les les priorites lies sante l'environnement notamment ce trait gestion des produits chimique justice protection l'environnement alimentaires aux repercussion des changement climatique aux malady zoonotique gestion des dechet nucleaire . qualification Diplome d'etudes postsecondaire dans protection l'environnement directement pertinente une combinaison equivalente d'etudes d'experience . Au moin d'experience travail avec les Premieres Nations les programme politiques connexe . Connaissance comprehension des enjeux relatifs sante l'environnement dans les communautes des Premieres Nations compris des contaminants environnementaux pollution des effets des changements climatique des malady zoonotique . Connaissance comprehension des legislations connexes telles Loi canadienne sur protection l'environnement . Excellentes aptitude orale ecrite capacite traduire des idees des information complex pour n'importe quel public . liee aux statistique . averee l'analyse vastes ensemble donnees complex changeante communication ces donnees maniere claire concise veillant ce les collegues l'organisation les dirigeants des Premieres Nations d'autres party prenante importantes comprennent les resultats reconnaissent l'importance . travail averee avec municipaux internationaux . travail d'equipe jugement . Competences averees matiere gestion du temps ainsi qu'un souci du detail . L'anglais est langue travail mais capacite communiquer efficacement francais dans une langue autochtone serait egalement atout . Nous vous remercion l'interet vous portez nous vous remercion votre candidature nous examinerons attentivement votre curriculum vitae . nous tenon vous informer nous ne communiquerons qu'avec les candidats selectionnes . reporter modifier les offres dthemploi tout moment ."
    },
    "companyDescription": "",
    "description": "Internal/ External Posting Full-time/ Permanent Location: Ottawa (hybrid) is preferred, open to other locations if a suitable applicant is found. Salary Range: Commensurate with experience and education. AFN offers competitive salaries, generous time off (3 weeks of paid vacation per year to start, paid time off for December-January holidays, 3 weeks of paid sick leave per year, 9 days of special leave per year), a pension and benefit plan, annual amounts towards physical fitness and professional development, and maternity & parental leave top up.  Application Instructions: Interviews will be held over ZOOM \n  Qualified persons of First Nations Ancestry will be given preference in accordance with s.16(1) of the Canadian Human Rights Act. Closing Date: Open until filled  The AFN is dedicated to an inclusive selection process and work environment. If you require accommodation, please advise the Human Resources representative when you are invited to meet regarding this employment opportunity.\n  \n  \n  Who We Are:\n  \n  \n  The Assembly of First Nations (AFN) is an advocacy organization, taking direction and fulfilling mandates as directed by First Nations in-Assembly through resolutions. As a national advocacy organization for First Nations, the AFN seeks to advance First Nations Inherent and Treaty Rights through the development policy, public education and where applicable, the co-development of legislation to build First Nations capacity.  The AFN was created out of a desire among First Nations leadership for a strong and effective collective advocacy organization. From this, values such as respect for human rights, diversity, justice, and the sovereignty of each rights-holding First Nation guide the work of the organization.  The AFN is honored to be named as one of Canada\u2019s Top 100 Employers 2023. Canada\u2019s Top 100 Employers project is a national competition to determine which employers lead their industries in offering exceptional workplaces for their employees. We couldn\u2019t be prouder of having our diverse and talented team making an impact on various national issues facing First Nations.\n  \n  \n  The Role:\n  \n  The Assembly of First Nations is seeking an experienced, skilled, and motivated individual who will be responsible for researching information and statistics, conducting analysis and preparing written documents related primarily to First Nations Environmental Health. The policy analyst will provide recommendations for policy development, interpretation, and application.\n  \n  \n The incumbent will also be responsible for the achievement of defined work plans and objectives aimed at supporting and advancing AFN\u2019s national advocacy positions, interests and strategies in First Nations Environmental Health related issues and priorities, including chemicals management, environmental justice and protection, food security/sovereignty, climate change impacts, zoonotic diseases and nuclear waste management.\n \n  Reporting to the Director, Environment, the Policy Analyst will have the following key duties and responsibilities:\n  \n  \n  \n  Conduct comprehensive research and analysis on First Nations Environmental Health and other related programs and policies. \n  Evaluate existing policies and regulations to identify gaps, inefficiencies and areas for improvement \n  Collaborate with key partners, including First Nations Leadership, government officials and agencies, and community-based organizations, to gather insights and perspectives on priorities related to First Nations Environmental Health \n  Develop evidence-based policy recommendations, briefing notes, speaking notes and reports for branch and sector leadership. \n  Stay informed about current trends, best practices, latest developments and research findings related to First Nations Environmental Health policies. \n  Participate in policy advocacy efforts internally within the AFN at various working groups, and participation in external meetings.\n \n  \n  \n  Qualifications: \n  \n  An undergraduate degree in environment, biology or social sciences or a related field of study with a minimum of 3-5 years of relevant experience, or an equivalent combination of education and experience related to First Nations Environmental Health programs \n  Knowledge and understanding of the environmental health issues in First Nations communities, including environmental contaminants, pollution prevention, food safety/security, indoor/outdoor air quality, climate change impacts, and zoonotic diseases. \n  Knowledge and understanding of related legislations such as the Canadian Environmental Protection Act (CEPA) \n  Excellent verbal and written communication skills and ability to translate complex ideas and information to any audience; \n  Demonstrated ability to research and understand statistical related terminology; \n  Demonstrated experience analyzing large sets of complex and changing data, and communicating it in a clear and concise way, ensuring colleagues across the AFN, committees, First Nations Leadership and other partners understand findings and recognize significance; \n  Demonstrated experience working with First Nations, federal, provincial, territorial governments and officials; \n  Demonstrated interpersonal skills, teamwork and judgement; \n  Demonstrated time management, planning & organizational skills and attention to detail.  \n  English is the working language however the ability to work in both official languages (English/French) is an asset. Fluency in a First Nations language is also an asset.\n \n  \n  Thank you for your interest in employment with the AFN! We truly appreciate your application and will carefully review your resume. As we receive a high number of applications, we want to inform you that we can only contact shortlisted candidates.\n  \n  \n  AFN may cancel, postpone, or revise employment opportunities at any time.\n \n  **** \n  ************************ \n  Affichage interne/externe Temps plein / Permanent\n \n  Lieu de travail : Ottawa de pr\u00e9f\u00e9rence (hybride), autres lieux possibles si un(e) candidat(e) ad\u00e9quat(e) est trouv\u00e9(e).\n   \u00c9chelle salariale : En fonction de l'exp\u00e9rience et de la formation. L'APN offre des salaires comp\u00e9titifs, des cong\u00e9s g\u00e9n\u00e9reux (3 semaines de vacances pay\u00e9es par an pour commencer, des cong\u00e9s pay\u00e9s pour les F\u00eates de fin d\u2019ann\u00e9e, 3 semaines de cong\u00e9s de maladie pay\u00e9s par an, 9 jours de cong\u00e9s sp\u00e9ciaux par an), un r\u00e9gime de retraite et d'avantages sociaux, des montants annuels pour le conditionnement physique et le perfectionnement professionnel, ainsi qu'un compl\u00e9ment de cong\u00e9 de maternit\u00e9 et de cong\u00e9 parental.\n   Comment postuler : Les entretiens se d\u00e9rouleront via Zoom. \n  La pr\u00e9f\u00e9rence sera accord\u00e9e aux personnes qualifi\u00e9es d'ascendance autochtone, conform\u00e9ment \u00e0 l'article 16 (1) de la Loi canadienne sur les droits de la personne. \n  Date de cl\u00f4ture: ouvert jusqu'\u00e0 ce que le poste soit combl\u00e9.\n   L'APN s'engage \u00e0 mettre en place un processus de s\u00e9lection et un environnement de travail inclusifs. Si vous avez des besoins pr\u00e9cis, veuillez en informer l'agent(e) des ressources humaines au moment o\u00f9 un entretien vous sera propos\u00e9.\n  \n  \n  Qui sommes-nous?  L'Assembl\u00e9e des Premi\u00e8res Nations (APN) est une organisation de d\u00e9fense des int\u00e9r\u00eats des Premi\u00e8res Nations, qui prend ses directives et accomplit ses mandats conform\u00e9ment aux r\u00e9solutions adopt\u00e9es par les Premi\u00e8res Nations-en-assembl\u00e9e. En tant qu'organisation nationale de d\u00e9fense des int\u00e9r\u00eats des Premi\u00e8res Nations, l'APN cherche \u00e0 promouvoir les droits inh\u00e9rents et issus des trait\u00e9s des Premi\u00e8res Nations par l'\u00e9laboration de politiques, la sensibilisation du public et, le cas \u00e9ch\u00e9ant, l'\u00e9laboration conjointe de lois visant \u00e0 renforcer les capacit\u00e9s des Premi\u00e8res Nations.\n  \n  \n  L'APN est n\u00e9e de la volont\u00e9 des dirigeants des Premi\u00e8res Nations de se doter d'une organisation collective forte et efficace de d\u00e9fense des int\u00e9r\u00eats. Des valeurs telles que le respect des droits de la personne, la diversit\u00e9, la justice et la souverainet\u00e9 de chaque Premi\u00e8re Nation d\u00e9tentrice de droits guident le travail de l'organisation.\n  \n  \n  L'APN s\u2019est vu d\u00e9cerner l\u2019honneur d'\u00eatre d\u00e9sign\u00e9e comme l'un des 100 meilleurs employeurs au Canada en 2023. Le projet des 100 meilleurs employeurs du Canada est une initiative nationale visant \u00e0 d\u00e9terminer quels employeurs se distinguent dans leurs domaines en offrant des milieux de travail exceptionnels \u00e0 leurs employ\u00e9s. Nous ne pourrions \u00eatre plus fiers de compter sur une \u00e9quipe diversifi\u00e9e et talentueuse qui contribue \u00e0 r\u00e9soudre divers probl\u00e8mes nationaux auxquels se heurtent les Premi\u00e8res Nations.\n  \n  R\u00f4le \n  L'Assembl\u00e9e des Premi\u00e8res Nations est \u00e0 la recherche d'une personne exp\u00e9riment\u00e9e, comp\u00e9tente et motiv\u00e9e qui sera charg\u00e9e de rechercher des informations et des statistiques, d'effectuer des analyses et de r\u00e9diger des documents concernant principalement la sant\u00e9 de l\u2019environnement au sein des Premi\u00e8res Nations. L'analyste des politiques formulera des recommandations pour l'\u00e9laboration, l'interpr\u00e9tation et l'application des politiques.\n  \n  \n Le(la) titulaire sera \u00e9galement responsable de r\u00e9aliser des plans de travail et des objectifs d\u00e9finis visant \u00e0 promouvoir les positions, les int\u00e9r\u00eats et les strat\u00e9gies de plaidoyer de l'APN \u00e0 l\u2019\u00e9chelle nationale en ce qui concerne les enjeux et les priorit\u00e9s li\u00e9s \u00e0 la sant\u00e9 de l\u2019environnement, notamment en ce qui a trait \u00e0 la gestion des produits chimiques, \u00e0 la justice et \u00e0 la protection de l\u2019environnement, \u00e0 la s\u00e9curit\u00e9 et \u00e0 la souverainet\u00e9 alimentaires, aux r\u00e9percussions des changements climatiques, aux maladies zoonotiques et \u00e0 la gestion des d\u00e9chets nucl\u00e9aires.\n \n  Qualifications : \n  \n  Dipl\u00f4me d\u2019\u00e9tudes postsecondaires dans un domaine directement li\u00e9 \u00e0 la sant\u00e9/science de l\u2019environnement, \u00e0 la justice et/ou \u00e0 la protection de l'environnement, \u00e0 la pr\u00e9vention de la pollution, aux sciences sociales ou \u00e0 tout autre domaine d'\u00e9tudes connexe, avec une \u00e0 deux ann\u00e9es d'exp\u00e9rience directement pertinente, ou une combinaison \u00e9quivalente d'\u00e9tudes et d'exp\u00e9rience. \n  Au moins un an d'exp\u00e9rience de travail avec les Premi\u00e8res Nations et les programmes ou politiques connexes. \n  Connaissance et compr\u00e9hension des enjeux relatifs \u00e0 la sant\u00e9 de l\u2019environnement dans les communaut\u00e9s des Premi\u00e8res Nations, y compris des contaminants environnementaux, de la pr\u00e9vention de la pollution, de la s\u00e9curit\u00e9 alimentaire, de la qualit\u00e9 de l'air \u00e0 l'int\u00e9rieur et \u00e0 l'ext\u00e9rieur, des effets des changements climatiques et des maladies zoonotiques. \n  Connaissance et compr\u00e9hension des l\u00e9gislations connexes telles que la Loi canadienne sur la protection de l'environnement (LCPE). \n  Excellentes aptitudes \u00e0 la communication orale et \u00e9crite et capacit\u00e9 \u00e0 traduire des id\u00e9es et des informations complexes pour n'importe quel public. \n  Capacit\u00e9 av\u00e9r\u00e9e \u00e0 rechercher et \u00e0 comprendre la terminologie li\u00e9e aux statistiques. \n  Exp\u00e9rience av\u00e9r\u00e9e de l'analyse de vastes ensembles de donn\u00e9es complexes et changeantes, et de la communication de ces donn\u00e9es de mani\u00e8re claire et concise, en veillant \u00e0 ce que les coll\u00e8gues de l'organisation, les comit\u00e9s, les dirigeants des Premi\u00e8res Nations et d'autres parties prenantes importantes comprennent les r\u00e9sultats et en reconnaissent l'importance. \n  Exp\u00e9rience de travail av\u00e9r\u00e9e avec les gouvernements et les repr\u00e9sentants des Premi\u00e8res Nations, f\u00e9d\u00e9raux, provinciaux, territoriaux, du Nord, municipaux et internationaux. \n  Entregent, travail d'\u00e9quipe et jugement. \n  Comp\u00e9tences av\u00e9r\u00e9es en mati\u00e8re de gestion du temps, de planification et d'organisation, ainsi qu'un souci du d\u00e9tail. \n  L'anglais est la langue de travail, mais la capacit\u00e9 \u00e0 communiquer efficacement en fran\u00e7ais ou dans une langue autochtone serait \u00e9galement un atout. \n  \n Nous vous remercions de l'int\u00e9r\u00eat que vous portez \u00e0 l'APN! Nous vous remercions de votre candidature et nous examinerons attentivement votre curriculum vitae. \u00c9tant donn\u00e9 que nous recevons un grand nombre de candidatures, nous tenons \u00e0 vous informer que nous ne communiquerons qu\u2019avec les candidats s\u00e9lectionn\u00e9s.\n  \n  \n  L'APN se r\u00e9serve le droit d'annuler, de reporter ou de modifier les offres d'emploi \u00e0 tout moment."
}