{
    "id": "e3ed45338a9929ba",
    "company": "Fellow Insights Inc",
    "positionName": "Director of IT and Information Security",
    "jobType": [],
    "location": "Ottawa, ON",
    "salary": null,
    "postingDateParsed": "2024-01-17T05:13:55.277Z",
    "url": "https://www.indeed.ca/rc/clk?jk=e3ed45338a9929ba&from=jasx&tk=1hkikipjiii32800&bb=g3LG73kDIG2DKbipZ3VbGN_a0QfnCzzRwYlc7YWPG-HqYqqvYEn_miT8TpoYicSwVPBFQwidVxWV8iGrOBNArQzgPJJxCL6HEek31kFp_ztl4lOohwcEyQ%3D%3D&xkcb=SoAN67M3FShE7dQ2y50LbzkdCdPP&vjs=3",
    "externalApplyLink": "https://fellowapp.bamboohr.com/careers/85?source=indeed&src=indeed&postedDate=2024-01-16",
    "job_info_group": {
        "extracted_phone_numbers": [],
        "extracted_links": [
            "HTTP/HTTPS Links",
            "General Links",
            "WWW Links",
            "TLDs"
        ],
        "extracted_emails": [],
        "extracted_location_data": [
            "Vanta",
            "Toronto",
            "Canada",
            "Ottawa",
            "Drata",
            "Montreal"
        ],
        "extracted_dates": [
            "8+ years",
            "the coming years",
            "2017",
            "3+ years"
        ],
        "extracted_languages": [],
        "extracted_laws": [],
        "extracted_norps": [],
        "extracted_orgs": [
            "BC/DR",
            "e.g. GDPR",
            "equivalent Resident of Canada Ideal Candidate Profile",
            "Security & Compliance",
            "Administering Google Workspace",
            "all IT administration & Information Security",
            "e.g. CSA CAIQ",
            "Bachelor's Degree",
            "Security questionnaires Interfacing",
            ", HIPAA",
            "Slack GRC",
            "Focus",
            "Infosec",
            "G2",
            "corporate Risk Register Interface",
            "CCM"
        ],
        "extracted_persons": [
            "Amin",
            "SOC2"
        ],
        "extracted_products": [
            "Deploy"
        ],
        "extracted_money": [],
        "processed_text": "hey Founder Fellow . seek experienced professional lead dual area Fellow continue growth . role security subject matter expert lead relate matter organization . cross functional role expect ensure team uphold security bar . small company ~ independently area help scale future . combo role nature unorthodox perfect ambitious individual tangible administration secure future venture startup destine greatness . hire remotely office working space pop fellow employee person key responsibility Select Configure MDM fleet macbook provide support employee include onboarding offboarding troubleshooting . manage procurement licensing provisioning administration major software system business Manage asset procurement maintenance disposal improve process ensure business continuity align security posture . monitor employee system ensure compliance security policy Key Infosec responsibility build maintain security compliance program e.g. iso27001 advise ensure compliance datum privacy regulation ccpa senior leadership periodically review update security policy plan conduct vendor risk assessment remediation maintain auditor ongoing security compliance certification Manage training general infosec awareness security centric development practice assist rest team cybersecurity threat response directly customer prospect security questionnaire maintain pre complete version common SIG SIG Lite Minimum qualification management Mac shop cybersecurity infosec certification information system lead function tech startup Resilient strong prioritization skill excel quiet high pressure period focused efficiency adaptability hand leader lead example build team Deep expertise security privacy audit legal security standard guideline principle enforce secure code practice threat modeling identity access management security incident response recovery . CISSP CISA CISM infosec certification prefer direct follow area product ... mdm Mac environment draft infosec policy external auditor compliance program Fellow Fellow.app software company help team organization level meeting habit drive productivity engagement accountability \u2014 meeting . Fellow great meeting start . product meeting management software trust world's good team . establish teamwork remotely city guide mission \u2014 include employee ambitious team build big thing love journey . Equal Employer Fellow understand diverse team . provide equal employment race national ethnic origin colour religion age sex sexual orientation gender identity expression marital status family status genetic characteristic conviction . require accommodation recruitment process ."
    },
    "companyDescription": "",
    "description": "Hey there I'm Amin, Co-Founder of Fellow. We are seeking an experienced IT and Infosec professional to lead these dual areas for Fellow as we continue our growth in the coming years.\n \n  About the role \n  You will be the security subject-matter expert and lead all IT administration & Information Security-related matters across the organization. This is a cross-functional role and the candidate will be expected to ensure each team upholds our security bar.\n \n  Being a relatively small company (~70), you must be able to work independently in these areas to help us scale into the future. Although a combo role of this nature is unorthodox, this is a perfect opportunity for an ambitious individual with tangible experience in both IT administration as well as Security & Compliance to secure a future in a venture backed startup destined for greatness.\n \n  We're hiring remotely across Canada, but have offices and co-working spaces available in Ottawa, Montreal, and Toronto where you can pop in to work with other Fellow employees when you want some in-person time!\n \n  Key IT Responsibilities: \n  \n  Select, Configure, and Deploy an MDM for our fleet of Macbooks \n  Provide IT support to all employees, including onboarding, offboarding, and any troubleshooting needs that may arise. \n  Manage procurement, licensing, provisioning, and administration of all major software systems needed to run the business \n  Manage all IT asset procurement, maintenance, and disposal as needed \n  Focus on improving IT processes to ensure business continuity and align with our security posture. \n  Monitor employee systems to ensure compliance with security policies\n \n  \n  \n  Key Infosec Responsibilities: \n  \n  Build out and maintain our security compliance programs (e.g. SOC2, ISO27001, HIPAA, etc) \n  Advise on and ensure compliance with data privacy regulations (e.g. GDPR, CCPA, etc) \n  Work with senior leadership to periodically review and update all security policies and BC/DR plans \n  Conduct vendor risk assessments, remediation, and maintain corporate Risk Register  \n  Interface with auditors on obtaining ongoing security compliance certifications \n  Manage training for general infosec awareness and security centric development practices \n  Assist the rest of the team with cybersecurity threats and response \n  Work directly with our customers and prospects on security questionnaires, and maintain pre-completed versions of common ones (e.g. CSA CAIQ, CCM, SIG/SIG-Lite)\n \n  \n  \n  Minimum Qualifications: \n  \n  8+ years in IT management (at least 2 in a Mac shop) \n  3+ years cybersecurity / infosec experience \n  Bachelor\u2019s Degree or certification in information systems or equivalent \n  Resident of Canada\n \n  \n  \n  Ideal Candidate Profile: \n  \n  Past experience leading this function at a tech startup \n  Resilient, with strong prioritization skills, able to excel in both quiet and high-pressure periods with focused efficiency and adaptability \n  A hands on leader who is able to lead by example and who can build a team over time  \n  Deep expertise across security, privacy, IT audit, and legal security standards, guidelines, and principles \n  Experience enforcing secure coding practices, threat modeling, identity, access management, and security incident response and recovery. \n  CISSP, CISA, CISM or other infosec certifications preferred \n  Direct experience in the following areas \n   \n    Administering Google Workspace, Slack \n    GRC products such as Vanta, Drata, etc\u2026 \n    MDMs in a Mac environment \n    Drafting infosec policies \n    Security questionnaires  \n    Interfacing with external auditors on compliance programs\n   \n \n  \n  \n What is Fellow? \n  Fellow.app is a software company that helps teams and organizations level-up their meeting habits to drive productivity, engagement, and accountability\u2014before, during, and after every meeting.\n \n  With Fellow, great meetings are just the start. Our product is the #1 meeting management software on G2, and is trusted by the world\u2019s best teams.\n \n  Established in 2017, our team works remotely from cities across Canada, guided by our mission: Make Work Better for Everyone\u2014and that includes our own employees! We\u2019re an ambitious team building the next big thing and we'd love to have you on this journey with us.\n \n  Equal Opportunity Employer \n  At Fellow, we understand the value of having a diverse team. That\u2019s why we believe in providing equal opportunity employment regardless of race, national or ethnic origin, colour, religion, age, sex, sexual orientation, gender identity or expression, marital status, family status, genetic characteristics, disability, and conviction. Please let us know if you require accommodation during the recruitment process."
}