{
    "id": "26b8b9243a170707",
    "company": "Net2Source",
    "positionName": "Customer Service Representative",
    "jobType": [
        "Contract",
        "Fixed term contract"
    ],
    "location": "Ottawa, ON",
    "salary": null,
    "postingDateParsed": "2024-01-06T03:11:27.835Z",
    "url": "https://www.indeed.ca/pagead/clk?mo=r&ad=-6NYlbfkN0A3rG3dZ5WfNaNJs6V9enKNEctPJMpk-MUHmgvI39SdXV_BHbdo41agHzVZp1hhj7rrz7AS6fUNpdeFjfTvmT9sp4U4J5Fgd5PkcIGP1Z3vuisb8Wh96T9NCsw5QUDWZNWlYDhv6mtJsHrPZIpmiMdFZ5Bcfr44gcuycFnWjaoVvZfN7BTV_0wCHamKc1mTX3FSiqS2GHGjleQm_DHw10CPexaUh59oshdFJdbk2egt5t_0NdMQsDBaVsm5z9nDUml-SYs9OHSA6iNXdUp_7L1uvUGlE2aqWto2GLpwNmM_xlDPJeLx25U35R2ywJ5WNA1ic0vrfBGOWK8eT7NqaJER5CRg8hWV5JTUonvWmlf9cddNK1YbI-aIMFpLCzTv5xdLq_9D3QHqQAkK3HZemAW_RZHNw-f36lzH24Rg4_OpNQkYbe389IpZ2H8FCUuJmI-WikRFubepyvuZZFUZ7keEx5qAzFppXslEZTIcRL2aii9qaxKafhpfKSFF8vERSZPdxZXEZtlol9ckrqfcIJalLPTz4oLMQDpvV88asqOTThWT6ycuRBXBN38hbjLh4TgkFr1ypzCh7-edsWUDZAr5eGJ0ZJnbsMX_AfgkSL8hVr0vzxRK0L49TpIkHBeN4Dp61ethKHzY8Mf-Dg2o_3rndlkBiAoTeHF2QYIHWcNVnxyXNHtM-Ropweq1g-qwSjMXxc7tERhCZlzbJ4XSa7CkYc1fHJfknNFL12jH1nql9Y7I32W-V0aq_-PIaR3FCX37pgAETuJCzDnEw8PW5ilcTx9Pl8jdm9yBiEyf7JwgcRnmXpt4G5xiOSSBcPNyyzNSqHVZTd8N3S_fId13gNdFmmDXKCM1yKjpNu-1jlwnMufQlfbktYZdDs6Y7capPMJD-82dGohnzQsigPx7Lxcrq6Z3LCOpZD_pwbzfBnHwuHzdVmtxDvm32zLEUEK58gLtI58PQnDQoJq1mVnmwMDKNI8gjxq78RmvWPFNy26m8Nd_357KzmItpHK54iCTig-2XTFrMh9G9J-VU7Up6NoyYeThAgFAaB5JIbZ_7EzlTla8nl7Q6ZkGEDr3W0KZTCAxKYems8RozAIGd5QRnZOwpLHxQMaE4XzbV_ElYIgLIaS6I6KY3voszC2h95Wza3GhIBzzeCIEdLNGIB86P4ciGSxC-20HWVtMBH1D5ulTbhmh_aZHXi6TeDf6SpeIolGm1Ha3hUJvibArtrpLKdGP&xkcb=SoCA6_M3G2OQofQd0Z0MbzkdCdPP&p=7&fvj=0&vjs=3&jsa=5624&tk=1hjm37rl8irr6800&from=jasx&wvign=1",
    "externalApplyLink": "https://www2.jobdiva.com/portal/?a=fyjdnwkqny26xqof9rceu6y6gam6750308agqi8uui1cmk3v9j6duy26aoewnusi&jobid=21064740#/jobs/21064740?compid=0&SearchString=&StatesString=&id=21064740&source=indeed.com",
    "job_info_group": {
        "extracted_phone_numbers": [],
        "extracted_links": [
            "HTTP/HTTPS Links",
            "General Links",
            "WWW Links",
            "TLDs"
        ],
        "extracted_emails": [
            "shan@net2source.com"
        ],
        "extracted_location_data": [
            "Toronto",
            "Canada",
            "the US"
        ],
        "extracted_dates": [
            "2020, 2019,",
            "8 consecutive years in a row",
            "6 weeks",
            "Monday \u2013 Friday 9:00am to 6:30pm EST",
            "the Year",
            "the entire quarter",
            "2020 and 2019",
            "2020",
            "Monday to Friday 9:00am to 5:30pm EST Hours of Operation",
            "2020, 2019"
        ],
        "extracted_languages": [],
        "extracted_laws": [],
        "extracted_norps": [
            "Agile1(Act1 Group) Regards"
        ],
        "extracted_orgs": [
            "an Equal Opportunity Employer",
            "Net2Source",
            "Dallas Business Journal",
            "NJ Biz",
            "Social Media Products",
            "#ITC",
            "the Return on Investment",
            "the US 12th Fastest-Growing Staffing Company",
            "the USA by Staffing Industry Analysts",
            "the Social Media Advertisers",
            "Spirit of Alliance Award by Agile1 2018",
            "Fastest Growing Business",
            "Global Workforce Solutions Ltd."
        ],
        "extracted_persons": [
            "Shan Singh"
        ],
        "extracted_products": [],
        "extracted_money": [],
        "processed_text": "position title Customer Service Representative Duration month description . training start week training \u2013 proactively outreach outbound decision maker phone email increase advertisement optimize ad performance increase investment . assign book business quarterly basis require multiple conversation advertiser assign . proactively fill calendar scheduled outreaching introduction program engage . \u2022 improve client's drive optimal appropriate product adoption . applicable manage portfolio book client SMB client responsibility grow revenue . scope area knowledge provide preand post sales assistance applicable product . expert Social Media advertising solution . identify trend solve problem . provide vital product insight feedback share feedback . champion produce success story advertiser success grow business Social Media product . Equal Employment Statement . discriminate difference age ethnicity gender gender identity expression religion sexual orientation . rich diversity innovative competitive creative help serve client community . employment decision regard age race creed color religion sex national origin ancestry status veteran status sexual orientation gender identity expression genetic information marital status citizenship status basis protect federal state local law . award Accolades America's honored business award USPAAC fast fast grow company list . Proven Supplier Workforce Logiq Best Best Platinum Award Agile1 TechServe Alliance Excellence Awards Winner Best Best Gold Award N2S 5th floor \u2013 Suite M5L 1e2 email"
    },
    "companyDescription": "",
    "description": "Position Title: Customer Service Representative \n \n  Duration: 12 months \n  Job description: See below. \n  Training start time & how many weeks for training: 6 weeks \u2013 Monday to Friday 9:00am to 5:30pm EST \n  Hours of Operation: Monday \u2013 Friday 9:00am to 6:30pm EST\n \n  \n  \n  \n \u2022 Proactively outreach (outbound calls) to decision-makers over the phone and via email to increase the ROI for their advertisements by optimizing their ad performance and increasing their investments. The assigned book of business will be on a quarterly basis which requires multiple conversations with each advertiser assigned. \n  \n \u2022 Proactively fill calendar with scheduled calls for the entire quarter through outreaching by introduction to the program if not already engaged. \u2022 Improve client's experience by driving optimal and appropriate product adoption. When applicable, manage a portfolio (book of clients) of SMB clients with responsibility for growing revenue.\n  \n \u2022 When within scope and area of knowledge, provide pre- and post-sales assistance for all applicable products.\n  \n \u2022 Become an expert on all Social Media Advertising solutions. \n  \n \u2022 Ability to identify trends and solve problems.\n  \n \u2022 Providing vital product insights feedbacks, from their own experience using Social Media Products and sharing the feedback from the Social Media Advertisers. \n  \n \u2022 Champion and produce success stories for advertisers who have had success in growing their business by using the Social Media products. \n  \n  \n Equal Employment Opportunity Statement:\n  Net2Source is an Equal Opportunity Employer. We believe that no one should be discriminated against because of their differences, such as age, disability, ethnicity, gender, gender identity and expression, religion, or sexual orientation. Our rich diversity makes us more innovative, more competitive, and more creative, which helps us better serve our clients and our communities. All employment decisions shall be made without regard to age, race, creed, color, religion, sex, national origin, ancestry, disability status, veteran status, sexual orientation, gender identity or expression, genetic information, marital status, citizenship status, or any other basis as protected by federal, state, or local law.\n  \n  \n Awards and Accolades: \n \n  America's Most Honored Businesses (Top 10%) \n  Awarded by USPAAC for Fastest Growing Business in the US \n  12th Fastest-Growing Staffing Company in the USA by Staffing Industry Analysts in the US (2020, 2019, 2020) \n  Fastest 50 by NJ Biz (2020, 2019, 2020) \n  INC 5000 Fastest growing for 8 consecutive years in a row (only 1.26% of companies make it to this list). \n  Top 100 by Dallas Business Journal (2020 and 2019) \n  Proven Supplier of the Year by Workforce Logiq (2020 and 2019) \n  2019 Spirit of Alliance Award by Agile1 \n  2018 Best of the Best Platinum Award by Agile1 \n  2018 TechServe Alliance Excellence Awards Winner \n  2017 Best of the Best Gold Award by Agile1(Act1 Group) \n  \n  Regards,\n  \n Shan Singh\n  N2S Global Workforce Solutions Ltd.\n  30 Wellington St W, 5th Floor \u2013 Suite 504,\n  Toronto, ON M5L 1E2\n  Canada\n  \n Email: \n shan@net2source.com\n  #ITC"
}