{
    "id": "629491e280ec0e14",
    "company": "Leisure Days RV Group",
    "positionName": "Sales Professional",
    "jobType": [
        "Full-time"
    ],
    "location": "4815 Bank Street, Gloucester, ON",
    "salary": "$50,000\u2013$70,000 a year",
    "postingDateParsed": "2024-01-25T12:16:10.631Z",
    "url": "https://www.indeed.ca/rc/clk?jk=629491e280ec0e14&from=jasx&tk=1hl5di2e1lllk800&bb=zpJiOyyz_0fgQiL3EewKgHv8EHOTlEtcFhLiwVpmMbiNb_iLvLLDFkylWS-nCZGEUXxJhCjjcTBw_W_bSLfP0vGvjGHIMn1XbmrK76faH7cOLh1JAx0Ilw%3D%3D&xkcb=SoBx67M3FlTHimWfyB0HbzkdCdPP&vjs=3",
    "externalApplyLink": null,
    "job_info_group": {
        "extracted_phone_numbers": [],
        "extracted_links": [
            "HTTP/HTTPS Links",
            "General Links",
            "WWW Links",
            "TLDs"
        ],
        "extracted_emails": [],
        "extracted_location_data": [
            "Nova Scotia",
            "Canada",
            "North America",
            "New Brunswick",
            "British Columbia",
            "Ontario",
            "Gloucester"
        ],
        "extracted_dates": [
            "6 months",
            "1 year",
            "Weekend"
        ],
        "extracted_languages": [],
        "extracted_laws": [],
        "extracted_norps": [
            "French"
        ],
        "extracted_orgs": [
            "ON K1X",
            "Leisure Days RV Group Inc.",
            "the right RV",
            "an effective and charismatic RV Sales Professional",
            "various RV",
            "RV",
            "Leisure Days RV Group",
            "Ottawa Camping Trailers Key Responsibilities & Accountabilities"
        ],
        "extracted_persons": [],
        "extracted_products": [],
        "extracted_money": [
            {
                "amount": "$50,000 - $70,000",
                "noun_phrases": []
            },
            {
                "amount": "50,000.00-$70,000.00",
                "noun_phrases": []
            }
        ],
        "processed_text": "4th large RV dealership group large RV Dealership group dealership province . subsidiary seek join store . commission base position . motivate thrill sale win person overview RV Sales Professional match customer good recreational vehicle travel lifestyle . position dealership sale professional expect uphold high ethical standard . People automotive retail industry evening weekend achieve goal . position eligible company benefit fully compensate salary + commission pay annual earning range . report General Manager ensure unforgettable client connect personal level client interaction meaningful . assist customer select lifestyle individual exceptional sale service process . highlight educate customer feature benefit sale presentation . help client enthusiastic product ready close successful deal . build rapport customer answer inquiry competently resolve concern . complete documentation accurately follow customer build trust confidence . grow sale profit customer base . highly motivated ambitious Dedicated deliver incredible result client . essential skill problem solve champion listen question lead empathy client concern . solid understanding finance payment plan possess entrepreneurial mindset owner accountability issue collaborate team find solution . deeply understand product offer dealership proactively recommend product help achieve financial goal . reliable strong ethic professional appearance . strong communication skill verbal write listen provide solution customer issue . passion great strive exceed expectation . possess strong conflict resolution skill . highly motivated ambitious . dedicated deliver incredible result client . qualification Minimum High School Diploma Equivalent . sale prefer sale prefer . valid driver's license clean acceptable driving record . rv automotive sale asset . provincially licensed license recognize MVDA omvic . evening weekend shift . qualified individual receive consideration employment regard race color age sex sexual orientation gender identity religion national origin genetic information criterion protect govern law . applicant apply applicant select interview contact . application receive maintain file period reference future staffing requirement . type salary benefit company event dental care Employee assistance program extended health care Life insurance site parking Paid RRSP match require Schedule shift evening shift Supplemental pay type bonus pay Commission pay Overtime pay sale prefer inside sale preferred Licence Certification driving licence preferred commute 1g6 require location person"
    },
    "companyDescription": null,
    "description": "Leisure Days RV Group is the 4th largest RV dealership group in North America, and largest RV Dealership group in Canada with over 36 dealerships in 4 provinces - British Columbia, Ontario, Nova Scotia, and New Brunswick.\nOttawa Camping Trailers (a subsidiary of Leisure Days RV Group Inc.) is seeking an effective and charismatic RV Sales Professional to join its store. This is a full-time, commission-based position.\nIf you are motivated by the thrill of a sale or a win, you may be just the person we are looking for!\nOverview:\nThe RV Sales Professional matches customers with the best recreational vehicle (RV) for their travel and lifestyle needs. As with all positions within dealerships, sales professionals are expected to uphold the highest ethical standards. People working within the automotive retail industry often must work extended hours, evenings, and weekends to achieve their goals.\nThis position is eligible for company benefits, and fully compensated with salary + commission pay, with annual earnings in the range of $50,000 - $70,000.\nReports to: General Manager, Ottawa Camping Trailers\nKey Responsibilities & Accountabilities:\n\n Ensure an unforgettable client experience by connecting on a personal level with the client to make every interaction meaningful.\n Assist customers to select the right RV for their lifestyle and individual needs through an exceptional sales and service process.\n Highlight and educate customers on the features and benefits of various RV's during sales presentations.\n Help clients, enthusiastic about the product, and ready to close successful deal.\n Build rapport with customers, answer inquiries and competently resolve any concerns.\n Complete necessary documentation accurately\n Follow up with customers to build trust and confidence.\n Grow sales and profit within customer base.\n Highly motivated and ambitious\n Dedicated to deliver incredible results to clients.\n\nEssential Skills:\n\n Be a problem-solving champion, by listening and asking questions and leading with empathy any of the client concerns.\n Solid understanding of finance and payment plans\n Possess entrepreneurial mindset, by acting like an owner, taking accountability for issues, and knowing when to collaborate and use your team to find the right solutions.\n Deeply understand the products offered by the dealership, and proactively recommend products that will help achieve their financial goals.\n Reliable, strong work ethic, professional appearance is a must.\n Strong communication skills, verbal and written, with the ability to listen and provide solutions to customer issues.\n Should have a passion to do a great job and strive to exceed expectation.\n Must possess strong conflict resolution skills.\n Highly motivated and ambitious.\n Dedicated to deliver incredible results to clients.\n\nQualifications:\n\n Minimum High School Diploma or Equivalent.\n Outside sales: 1 year (preferred), and sales: 1 year (preferred).\n Valid G driver's license with clean and acceptable driving record.\n RV and/or automotive sales experience an asset.\n Provincially licensed, or able to be licensed, as recognized by the MVDA (OMVIC).\n Willing to work evening and weekend shifts.\n\nAll qualified individuals will receive consideration for employment without regard to race, color, age, sex, sexual orientation, gender identity, religion, national origin, disability, genetic information, or any other criteria protected by governing law.\nWe would like to thank all applicants for applying; however, only those applicants selected for an interview will be contacted. Applications received will be maintained on file for a period of 6 months and may be referenced for future staffing requirements.\nJob Type: Full-time\nSalary: $50,000.00-$70,000.00 per year\nBenefits:\n\n Company events\n Dental care\n Employee assistance program\n Extended health care\n Life insurance\n On-site parking\n Paid time off\n RRSP match\n Work from home\n\nFlexible Language Requirement:\n\n French not required\n\nSchedule:\n\n 8 hour shift\n Evening shift\n Every Weekend\n\nSupplemental pay types:\n\n Bonus pay\n Commission pay\n Overtime pay\n\nExperience:\n\n Outside sales: 1 year (preferred)\n Inside sales: 1 year (preferred)\n\nLicence/Certification:\n\n Driving Licence (preferred)\n\nAbility to Commute:\n\n Gloucester, ON K1X 1G6 (required)\n\nWork Location: In person"
}