{
    "id": "a3d0d8856a5e3c6f",
    "company": "City of Ottawa",
    "positionName": "Customer Communications Officer",
    "jobType": [],
    "location": "Ottawa, ON",
    "salary": null,
    "postingDateParsed": "2023-10-13T18:54:49.067Z",
    "url": "https://www.indeed.ca/rc/clk?jk=a3d0d8856a5e3c6f&from=jasx&tk=1hcvfqthu2mmn000&vjs=3",
    "externalApplyLink": "https://jobs-emplois.ottawa.ca/city-jobs/job/Ottawa%2C-ON-Customer-Communications-Officer-ON/728022047/",
    "job_info_group": {
        "extracted_phone_numbers": [
            "613-580-2424",
            " 613-580-2424"
        ],
        "extracted_links": [
            "HTTP/HTTPS Links",
            "General Links",
            "WWW Links",
            "TLDs"
        ],
        "extracted_emails": [],
        "extracted_location_data": [
            "1500 St.Laurent City",
            "The City of Ottawa",
            "Ottawa"
        ],
        "extracted_dates": [
            "at least one year",
            "3 years",
            "per year",
            "annually"
        ],
        "extracted_languages": [
            "English"
        ],
        "extracted_laws": [],
        "extracted_norps": [
            "French"
        ],
        "extracted_orgs": [
            "Marketing/Branding, Sponsorship/Advertising",
            "Microsoft Office Suite",
            "the Human Resources Service Centre",
            "Customer Service",
            "TweetDeck",
            "Fare Sales and Operations",
            "Transit Strategic Communications & External Relations Service Branch",
            "Content Management System Expressing Engine",
            "the Canadian Human Rights Act",
            "Council",
            "the Transit Customer Systems and Planning Service",
            "Community Relations",
            "Councillors",
            "OC Transpo",
            "Internal Communications",
            "the Ontario Human Rights Code",
            "ON Job Category:",
            "Transit Customer Service",
            "Transit Services Department Service",
            "Self-motivated Organized and dependable Works",
            "the Transit Commission"
        ],
        "extracted_persons": [],
        "extracted_products": [
            "Demonstrate"
        ],
        "extracted_money": [
            {
                "amount": "$88,182.64",
                "noun_phrases": [
                    "$88,182.64"
                ]
            }
        ],
        "processed_text": "requisition Department Transit Strategic Communications Branch Employment Type temporary month hour week affiliation atu Salary Information rate pay location transportation application close summary mandate provide customer service service planning technology control system support gear provide excellence customer service delivery transit customer conventional bus para transit rail operation . responsible deliver broad range program area service relate Information . responsible write post send information transit service transit service status channel include live information channel signage social medium research write correspondence senior management . responsible prepare relay accurate high quality information public transit service offer ensure information communicate customer staff general public consistent clear effective accurate writing edit proofread write communication internal external stakeholder coordinate live information update activity transit mode include social medium monitoring engage support customer social medium develop coordinate content social medium public alert . addition coordinate development provision response issue inquiry respond request receive formal channel i.e. councillor inquiry Mayor's office digital platform include web direct email social medium serve technical advisor provide functional administrative expertise relate live update participate planning coordination implementation Transit Services' live update strategy tactic prepare provide regular status report live update medium activity assist communication special event emergency crisis communication require . education completion university degree communication journalism public relation field Minimum field communication public relation journalism marketing medium relation include social medium environment . KNOWLEDGE depth knowledge social media dashboard program . current social medium channel Photoshop content management system effective communication tactic technique traditional web base channel trend communication transit industry approach local current event effective medium relation City governance initiative program service Customer service requirement quality assurance procedure knowledge applicable health safety legislation include duty worker competency skill ABILITIES proficiency social medium dashboard program . current social medium channel Photoshop content management system Superior verbal communication write edit skill exceptional eye detail editorial judgment grammatical skill conceptualize solicit research write story official blog creative logically effective organization coordination management skill Research analytical skill identify issue public domain exercise effective judgment independent decision excellent interpersonal relationship management skill independently team prepare detailed concise report fast pace deadline drive environment exercise effective judgment independent decision exercise tact discretion confidentiality directly City staff elect official senior management prepare comprehensive communication strategy influence inform stakeholder regard application communication tactic technique customer service sensitivity meet diverse customer requirement good judgment tact discretion diplomacy creativity initiative positive attitude effectively high pressure situation interest current event public affair flexibility accommodate morning night weekend shift evening weekend holiday require Language Requirement Designated \u2013 specific level language proficiency oral reading write oral reading write meet language requirement require participate training . formal training combine demonstrate performance substitute stipulate academic requirement . save copy poster . closing pass long . applicant interest effort apply position . select interview contact . promote principle diversity inclusion adhere tenet . encourage application Indigenous Black racialized community person woman binary person person ethnic origin religion sexual orientation class gender identity expression . encourage identify designate employment equity group identification questionnaire . provide accommodation hiring process request applicant . contact proceed selection process advise require accommodation . accessible format communication support request . contact extension ."
    },
    "companyDescription": "",
    "description": "Requisition ID: 10174 Department: Transit Services Department Service: Transit Strategic Communications & External Relations Service Branch: Transit Strategic Communications Branch Employment Type: 1 Full-time Temporary - Up to 18 months Work Hours: 35.00 hours per week Affiliation: ATU 1760 Salary Information: $62,167.56 - $88,182.64 annually (2023 rates of pay) Location: 1500 St.Laurent City: Ottawa, ON Job Category: Transportation Application Close: 26/10/2023 \n       \n        \n         \n           JOB SUMMARY\n         \n         \n           The mandate of the Transit Customer Systems and Planning Service is to provide customer service, service planning, and technology and control systems support for OC Transpo, geared to providing excellence in customer service delivery to 100 million transit customers per year by means of conventional bus, para transit and rail operations. Transit Customer Service is responsible for delivering a broad range of program areas and services related to Marketing/Branding, Sponsorship/Advertising, Customer Service, Information, Fare Sales and Operations, Community Relations, and Internal Communications. \n          You are responsible for writing and posting or sending information about transit service and transit service status through several channels, including OC Transpo live information channels and signage, and social media, and for researching and writing correspondence from or for Councillors and senior management. \n          You are also responsible for: preparing and relaying accurate and high-quality information about the public transit services offered by OC Transpo; ensuring that the information communicated to customers, staff, members of Council and the Transit Commission, and the general public is consistent, clear, effective, accurate and up to date; writing, editing and proofreading written communication to internal and external stakeholders; coordinating live information update activities for all transit modes, including social media monitoring; engaging with and supporting customers via social media; and developing and coordinating content for social media and public alerts. \n          In addition, you: coordinate the development and provision of responses to issues and inquiries; respond to requests received through formal channels (i.e. councillor inquiries or from Mayor\u2019s office) and digital platforms, including the web, direct emails and social media; serve as a technical advisor and provide functional and administrative expertise relating to live updates; participate in the planning, coordination and implementation of Transit Services' live update strategy and tactics; prepare and provide regular status reports on live update and media activities; and assist with communication on special events, emergency and/or crisis communications, as required. \n         \n        \n        \n         \n           EDUCATION AND EXPERIENCE\n         \n         \n           Completion of 3 year university degree in communications, journalism or public relations, or related field \n          Minimum of 3 years of experience in the field of communications, public relations, journalism, marketing and/or media relations including at least one year working in a social media work environment. \n         \n        \n        \n         \n           KNOWLEDGE \n         \n         \n          \n           In-depth knowledge of social media dashboard programs (CMS Expressing Engine, TweetDeck, etc.), current social media channels, Microsoft Office Suite, Photoshop, and content management systems \n           Effective communication tactics and techniques using traditional and web-based channels \n           Trends in communications and transit industries and approaches \n           Local and current events \n           Effective media relations \n           City governance, initiatives, programs and services \n           Customer service requirements \n           Quality assurance procedures \n           Knowledge of applicable health and safety legislation, including the rights and duties of workers \n          \n         \n        \n        \n         \n          COMPETENCIES, SKILLS AND ABILITIES \n         \n         \n          \n           Proficiency in Social media dashboard programs (CMS Expressing Engine, TweetDeck, etc.), current social media channels, Microsoft Office Suite, Photoshop, and content management systems \n           Superior verbal communications, writing and editing skills \n           Exceptional eye for detail, editorial judgment, and grammatical skills \n           Ability to conceptualize, solicit, research and write stories for official blog \n           Ability to be creative and think logically \n           Effective organization, coordination and time management skills \n           Research and analytical skills \n           Ability to identify issues in the public domain \n           Ability to exercise effective judgment and independent decision making \n           Excellent interpersonal and relationship management skills \n           Ability to work independently and as part of a team \n           Ability to prepare detailed and concise reports \n           Ability to work in a fast-paced, deadline driven environment \n           Exercises effective judgment and independent decision making \n           Exercises tact, discretion and confidentiality \n           Ability to work directly with City staff, elected officials and senior management \n           Ability to prepare comprehensive communications strategies \n           Ability to influence and inform stakeholders regarding the application of communications tactics and techniques \n           Customer service sensitivity to meet diverse customer requirements \n           Demonstrate good judgment, tact, discretion, diplomacy, creativity and initiative \n           Positive attitude \n           Self-motivated \n           Organized and dependable \n           Works effectively in high pressure situations \n           Interest in current events and public affairs \n           Flexibility in accommodating morning/night/weekends shifts Must be willing to work evenings, weekends and/or holidays, should it be required \n          \n         \n        \n       \n       WHAT YOU NEED TO KNOW \n       \n        Language Requirement: Designated Bilingual \u2013 specific level of language proficiency: French: oral, reading, writing English: oral, reading, writing Candidates who do not meet language requirements will be required to participate in training. \n        Experience and formal training combined with demonstrated performance and ability may substitute for stipulated academic requirements. \n        Please save a copy of the job poster. Once the closing date has passed, it will no longer be available.\n       \n        \n        \n       We wish to thank all applicants for their interest and effort in applying for this position. Only candidates selected for interviews will be contacted.\n        \n        \n       The City of Ottawa promotes the principles of diversity and inclusion and adheres to the tenets of the Canadian Human Rights Act and the Ontario Human Rights Code. We encourage applications from members of Indigenous, Black and other racialized communities, persons with disabilities, women and non-binary persons, persons of all ethnic origins, religions, sexual orientations, classes, gender identities and expressions. Candidates are encouraged to self-identify as a member of one or more designated employment equity groups in the self-identification questionnaire.\n        \n        \n       The City of Ottawa provides accommodation during all parts of the hiring process, upon request, to applicants with disabilities. If contacted to proceed to the selection process, please advise us if you require any accommodation.\n        \n        \n       Accessible formats and communication supports are available upon request. Please contact the HR Service Centre at 613-580-2424, extension 47411."
}