{
    "id": "02d51a70bb77c5c5",
    "company": "Ainsworth",
    "positionName": "HVAC Working Foreman",
    "jobType": [
        "Full-time"
    ],
    "location": "69 Auriga Drive, Ottawa, ON",
    "salary": null,
    "postingDateParsed": "2024-01-24T12:17:27.694Z",
    "url": "https://www.indeed.ca/rc/clk?jk=02d51a70bb77c5c5&from=jasx&tk=1hl5djsk1h7hv800&bb=xjPBkK6OIlrxY1Te1w3p5TR_XUGtbeXzhuTWvRXg8IdQJwuvzx7mH60AWIcyffR_8J2PZh9v2zrW_Ci69JbTTjenUrLIZUp_0xrNL_BkFZu7kVpmqXvPzhzdXk2GqjpE&xkcb=SoDH67M3FlTATHzAAx0HbzkdCdPP&vjs=3",
    "externalApplyLink": null,
    "job_info_group": {
        "extracted_phone_numbers": [],
        "extracted_links": [
            "HTTP/HTTPS Links",
            "General Links",
            "WWW Links",
            "TLDs"
        ],
        "extracted_emails": [],
        "extracted_location_data": [
            "the Ontario Region",
            "Ottawa"
        ],
        "extracted_dates": [
            "weekly",
            "today",
            "Monday"
        ],
        "extracted_languages": [],
        "extracted_laws": [],
        "extracted_norps": [],
        "extracted_orgs": [
            "GDI",
            "Service Technicians",
            "HSandS",
            "Ainsworth Inc.",
            "Ensure Environmental Health and Safety Policies",
            "our Accommodation Policy",
            "Quotation Department"
        ],
        "extracted_persons": [
            "Ainsworth",
            "the Ainsworth",
            "a certified Journeyperson"
        ],
        "extracted_products": [],
        "extracted_money": [],
        "processed_text": "thrive team orient workplace challenge skill drive career development embrace diversity reward innovation competitive pay great employee program join GDI company team position summary HVAC Working Foreperson report directly Regional Operations Manager support team . specific responsibility position encompass follow Key Performance Indicators . responsibility establish maintain professional customer relation . provide equipment service maintenance repair exist customer base . assist solve equipment problem development implementation solution prevent future occurrence . recommend reduce cost eliminate unnecessary expense . provide technical assistance training development motivation leadership team . assist Operations Manager Project planning scheduling prioritizing contract extra follow ensure service provide timely manner . special project field recommendation . recruitment performance management . plan participation staff meeting . adhere safe procedure participate talk . conduct monthly vehicle inspection . support Service Coordinator Manager manage dispatch service technician service requirement . visit regular basis service site meet customer ensure quality delivery relationship . assist review quote . support sale team develop quote service project relate . approve Regional Supervisor . wage collective agreement Foreman's rate . duty require . qualification previous HVAR relate hold current refrigeration license ODP card . additional license consider asset . OBT1 309a electrician ... hold Gas Fitter certificate sound knowledge HVAC system design building maintenance . strong training presentation skill . excellent management planning organization skill . good understanding Ainsworth product service subsidiary company grow unprecedented rate help attract retain talent provide benefit . offer wide variety benefit include follow benefit comprehensive health dental medical benefit include wellness support RRSP matching generous vacation reward service milestone peer recognition Employee Discounts Incentives Flexibility hybrid working model applicable diversity inclusive organization embrace diversity belonging great team atmosphere future potential promotion company . dynamic result orient professional passion lead talented drive group invite apply . join team contribute success continue provide innovative solution client . subsidiary commit create diverse environment equal employer . qualified applicant receive consideration employment regard race color religion gender gender identity expression sexual orientation national origin genetic age veteran status request . appreciate application receive advise consideration contact . subsidiary integrated multi trade company offer service solution asset maintenance refurbishment requirement customer . continually strive create advanced product provide high quality service . rapidly grow talented professional help drive vision good multi trade company country join ... . difference . type benefit dental care extended health care life insurance Paid vision care schedule hour shift Friday Licence Certification Gas Fitter certificate require refrigeration license ODP card require commute K2E 7Z2 require location person"
    },
    "companyDescription": "Headquartered in Toronto, Ontario, Ainsworth operates offices across Canada in most major cities and in both official languages. Ainsworth is one of Canada\u2019s leading integrated multi-trade companies providing high-quality technical trades services, including HVAC, mechanical, electrical, data cabling, and building and industrial automation for institutional, commercial, and industrial clients across the country. As an integrated multi-trade company, we offer end-to-end services and solutions for all asset maintenance and refurbishment requirements of our customers.\r\n\r\nAinsworth is a wholly owned subsidiary of GDI Integrated Facility Services, a publicly traded company on the Toronto Stock Exchange (TSX:GDI) and a leader and innovator in the industry. GDI is the fifth-largest facility services business in North America with more than 20,000 employees, servicing over 500 million square feet, and with operations across Canada and the United States.\r\n\r\nThe strength of Ainsworth and the GDI family is unparalleled in the marketplace for delivery of value-added facility services across all our clients\u2019 needs.\r\n\r\nSince 1933, Ainsworth has been a significant and growing force in the maintenance renovation service industries of Canada. Our maintenance and retrofit services have allowed us to build and develop relationships with customers, from the project installation stage to ongoing maintenance, service operations, and life-cycle replacement.\r\n\r\nOur commitment to quality and our ISO 9001 certification are an essential part of our core values, guiding our actions to deliver products and services that are safe, compliant, and preferred by our customers. We believe it is essential to deliver quality-of-service in everything we do in order to be recognized as our customers\u2019 trusted advisor across all technical trades.",
    "description": "If you thrive in a team-oriented workplace that challenges your skills, to drive your career development, embraces diversity, and rewards innovation, with competitive pay and great employee programs, join the Ainsworth (a GDI company) team today!\nPosition Summary:\nThe HVAC Working Foreperson will report directly to the Regional Operations Manager and will support a team of Service Technicians within the Ontario Region. The specific responsibilities of the position will encompass each of the following KPI's.\nResponsibilities:\n\n Establish and maintain professional customer relations.\n Provide equipment service, maintenance and repairs for existing customer base.\n Assist in solving equipment problems and development/implementation of solutions to prevent future occurrence.\n Recommend ways to reduce costs and eliminate unnecessary expenses.\n Provide technical assistance, training, development, motivation and leadership to the team.\n Assist Operations Manager with; Project planning, scheduling and prioritizing of contracts and extra work with follow up to ensure service is provided in a timely manner.\n Special projects and field recommendations.\n Recruitment and performance management.\n Plan and participation in staff meetings.\n Ensure Environmental Health and Safety Policies are adhered to, safe work procedures and participate in weekly HS&S talks.\n Conduct Monthly vehicle inspections.\n With the support of the Service Coordinator Manager, manage and dispatch service technicians to the service call requirements.\n Visit on a regular basis different service sites, meet the customers to ensure quality of delivery while furthering the relationship.\n Assist and review quotes with Quotation Department.\n Support Sales team to develop quotes for service and project related work.\n Down time to be approved by Regional Supervisor.\n Wages as per the collective agreement (Foreman\u2019s rate).\n All other duties as required.\n\nQualifications:\n\n 10 years previous experience as a certified Journeyperson or HVAR related experience and hold a current refrigeration license and ODP card. Any additional Licenses would be considered an asset. ie OBT1 or 2, 309A Electrician...\n Must hold Gas Fitter 1 certificate and have sound working knowledge of HVAC system design and building maintenance.\n Strong training and presentation skills.\n Excellent time management, planning and organization skills.\n A good understanding of Ainsworth products and services\n\nWhy work at Ainsworth?\nAinsworth, a subsidiary of GDI, company is growing at an unprecedented rate and to help attract and retain top talent, we provide benefits on your first day with us. We offer a wide variety of benefits including the following:\nBenefits: Comprehensive health, dental and medical benefits, including wellness supports, RRSP matching and generous vacation\nRewards: Service milestones and peer recognition plus Employee Discounts and Incentives\nFlexibility: Hybrid working models, where applicable\nDiversity: An inclusive organization that embraces diversity and belonging; work in a great team atmosphere with future potential for promotion within company.\nIf you are a dynamic and results-oriented professional with a passion to lead a talented and driven group, we invite you to apply. Join our team and contribute to the success of Ainsworth Inc. as we continue to provide innovative solutions to our clients.Ainsworth, a subsidiary of GDI, is committed to creating a diverse environment and is proud to be an equal-opportunity employer. All qualified applicants will receive consideration for employment without regard to race, color, religion, gender, gender identity or expression, sexual orientation, national origin, genetics, disability, age, or veteran status as per our Accommodation Policy, available upon request.\nWhile we appreciate all applications we receive, we advise that only candidates under consideration will be contacted.\nAinsworth, a subsidiary of GDI, is an integrated multi-trade company, offering an end-to-end services and solutions for all asset maintenance and refurbishment requirements of our customers. We are continually striving to create better and more advanced products as well as provide the highest quality service. We are rapidly growing and need talented professionals to help drive our vision at becoming the best multi-trade company in the country! Join us\u2026. Make a difference.\nJob Type: Full-time\nBenefits:\n\n Dental care\n Extended health care\n Life insurance\n Paid time off\n Vision care\n\nSchedule:\n\n 8 hour shift\n Monday to Friday\n\nLicence/Certification:\n\n Gas Fitter 1 certificate (required)\n refrigeration license and ODP card (required)\n\nAbility to Commute:\n\n Ottawa, ON K2E 7Z2 (required)\n\nWork Location: In person"
}