{
    "id": "3e65f7cd3a263abc",
    "company": "Bartlett Tree Experts",
    "positionName": "Arborist Climber",
    "jobType": [],
    "location": "Nepean, ON",
    "salary": null,
    "postingDateParsed": "2023-10-17T18:50:44.858Z",
    "url": "https://www.indeed.ca/rc/clk?jk=3e65f7cd3a263abc&from=jasx&tk=1hcvfjcolkedt800&vjs=3",
    "externalApplyLink": "https://canadacareers-bartlett.icims.com/jobs/23519/job?utm_source=indeed_integration&iis=Job%20Board&iisn=Indeed&indeed-apply-token=73a2d2b2a8d6d5c0a62696875eaebd669103652d3f0c2cd5445d3e66b1592b0f",
    "job_info_group": {
        "extracted_phone_numbers": [],
        "extracted_links": [
            "HTTP/HTTPS Links",
            "General Links",
            "WWW Links",
            "TLDs"
        ],
        "extracted_emails": [],
        "extracted_location_data": [],
        "extracted_dates": [],
        "extracted_languages": [],
        "extracted_laws": [],
        "extracted_norps": [],
        "extracted_orgs": [
            "Healthcare",
            "medical and dental RPP Plan",
            "SRT",
            "Life, LTD",
            "PPE",
            "The F. A. Bartlett Tree Expert Company",
            "Class B CDL",
            "Rigging Removals Properly",
            "the Bartlett Tree Experts Research Laboratories"
        ],
        "extracted_persons": [
            "Bartlett",
            "Bartlett Tree Experts",
            "Instagram @LifeatBartlett"
        ],
        "extracted_products": [],
        "extracted_money": [
            {
                "amount": "up to $200 Access",
                "noun_phrases": []
            }
        ],
        "processed_text": "summary enjoy outdoors professional safe environment consider career strong culture excellence safety scientific research lifelong learning career development . Arborist Climber integral tree care crew primary responsibility tree climb assist perform tree shrub care service residential commercial property . benefit offer competitive compensation safety culture professional workplace Advancement promote ADD spending account pay vacation holiday Industry credential license pay increase company pay uniform gear equipment boot reimbursement training continue education program variety resource provide find life check . responsibility Arborist Climber play role perform ground tree climbing aerial lift duty support specific assignment direct Arborist Crew Leader Local Manager Safely perform aspect arboriculture include brace maintain operating equipment hand tool chainsaw chipper aerial lift Learning understanding adhere safety rule company safety policy qualification passion nature environment outdoors tree climbing DdRT aerial lift operation tree care industry valid driver's license clean motor vehicle record prefer outdoors round weather condition Equal Employer . location Location State Province category production Arborist late Post career type regular"
    },
    "companyDescription": "",
    "description": "Summary:\n \n \n   If you enjoy working outdoors in a professional and safe environment, consider a career with Bartlett Tree Experts! At Bartlett, we value a strong culture of excellence in safety, scientific research, lifelong learning, and career development.\n \n \n   \n \n \n  As an Arborist Climber, you will be an integral member of a tree care crew with the primary responsibility of tree climbing and assisting Arborist Crew Leaders in performing all tree and shrub care services on residential and commercial properties.\n \n  \n  Benefits:\n \n \n   We offer competitive compensation, as well as:\n \n \n   A safety-first culture and professional workplace\n   Advancement opportunities - we promote from within\n   Life, LTD, ADD, medical and dental\n   RPP Plan, Healthcare spending account, and paid vacation and holidays\n   Industry credential/license pay increases\n   Company-paid uniforms, PPE, gear, and equipment\n   Boot reimbursement up to $200\n   Access to training, continuing education programs, and a variety of resources provided by the Bartlett Tree Experts Research Laboratories\n \n \n \n   To find out more about what life is like at Bartlett, check us out on Instagram @LifeatBartlett.\n \n  \n  Responsibilities:\n \n \n   As an Arborist Climber, you will play an important role in:\n \n \n   Performing ground, tree climbing, and aerial lift duties in support of specific job assignments, as directed by the Arborist Crew Leader and Local Manager\n   Safely performing all aspects of arboriculture, including: \n   \n     Pruning\n     Cabling and bracing\n     Rigging\n     Removals\n     Properly maintaining and operating equipment (hand tools, chainsaws, chippers, and aerial lifts)\n   \n   Learning, understanding, and adhering to all safety rules and company safety policies\n  Qualifications: \n \n  A passion for nature, the environment, and the outdoors\n   At least one (1) year of tree climbing (DdRT or SRT) and aerial lift operation experience in the tree care industry\n   Valid driver's license and clean motor vehicle record (Class B CDL preferred)\n   Ability to work outdoors year-round in all weather conditions\n \n \n \n   The F. A. Bartlett Tree Expert Company is an Equal Opportunity Employer.\n \n  \n  Location : Name: Ottawa Location : State/Province: ON Category: Production Arborist Latest Post Date: Canada Careers: 10/16/2023 Type: Regular Full-Time"
}