{
    "id": "3db6b2df810bd5f1",
    "company": "Walmart",
    "positionName": "Front End Assistant Manager (Temp 6 Months Contract)",
    "jobType": [],
    "location": "450 Terminal Ave, Ottawa, ON",
    "salary": null,
    "postingDateParsed": "2024-01-17T05:13:21.188Z",
    "url": "https://www.indeed.ca/rc/clk?jk=3db6b2df810bd5f1&from=jasx&tk=1hkikipjiii32800&bb=g3LG73kDIG2DKbipZ3VbGA0M-dJCS9b0uHLL0zN3cBPF6B2KwKa4akS51CwSJWcymPX0SJFkkAfo0Wq3vNDx5VYvsIvJh1xkV1KkReGuYT4uORIYr7E8Tg%3D%3D&xkcb=SoB567M3FShE7dQ2y50HbzkdCdPP&vjs=3",
    "externalApplyLink": "https://walmart.wd5.myworkdayjobs.com/fr-CA/WalmartExternal/job/Ottawa-ON/Front-End-Assistant-Manager--Temp-6-Months-Contract-_R-1764126?codes=1-INDEED",
    "job_info_group": {
        "extracted_phone_numbers": [],
        "extracted_links": [
            "HTTP/HTTPS Links",
            "General Links",
            "WWW Links",
            "TLDs"
        ],
        "extracted_emails": [],
        "extracted_location_data": [
            "Trouver"
        ],
        "extracted_dates": [],
        "extracted_languages": [],
        "extracted_laws": [],
        "extracted_norps": [],
        "extracted_orgs": [
            "Canada \u00cates-vous actuellement un associ\u00e9 de Walmart",
            "avec des incapacit\u00e9s",
            "e.g. District Human Resources Managers",
            "Serves Customers",
            "the Store",
            "Managers and Associates",
            "the Store Management Team",
            "450 TERMINAL AVE",
            "Associates",
            "les besoins des associ\u00e9s",
            "Leads Associates",
            "Walmart offrira des accommodements",
            "the OMNI",
            "par la loi",
            "ce poste",
            "postuler \u00e0 cet",
            "OTTAWA",
            "the Management Team",
            "the Total Store"
        ],
        "extracted_persons": [
            "Veuillez",
            "Si aucune n'est indiqu\u00e9e",
            "Indiquez ci-dessous les comp\u00e9tences recherch\u00e9es facultatives"
        ],
        "extracted_products": [],
        "extracted_money": [
            {
                "amount": "as much as $250,000",
                "noun_phrases": []
            }
        ],
        "processed_text": "resume des fonction ... Soutenir gerant succursale gerer les activites succursale conformement aux directive Compagnie diriger les associes afin d'assurer service aimable utile generer des ventes rentable pour succursale Ce vous ferez ... . drive profitable sale achievement sale profit goal budget management sale forecast . proactively analyze utilize sale financial report economic trend community identify respond market change control expenditure . communicate sale result associate guide interpretation result . create balance operational plan prioritize delegate provide clear direction . ensure optimal store condition effective merchandise presentation accurate competitive pricing store standard company policy guideline . implement store program accord Company direction evaluate effectiveness achieve successful result relate Fresh Operations specific area incumbent oversee . Assistant Manager cross trained proficiently area . . execute monitor asset protection safety control maintain quality assurance standard oversee safety operational review ensure compliance Walmart policy procedure established safety security sale financial record keeping procedure practice . anticipate proactively respond compliance issue include Total Loss general control . . ambassador store greet customer seek feedback ensure customer complaint issue resolve Company guideline create positive shopping . management model enforce provide direction associate friendly helpful customer service approach technique . support store initiative serve community participate support community event develop relationship key community group . participate company sponsor program event sustainability effort associate customer emphasize store's role integral community . . conduct regular store meeting communicate operational direction initiative focus . drive engagement recognize reward accomplishment provide professional growth . develop associate identify high potential associate provide training development increase capability . . demonstrate company hold accountable timely honest specific respectful performance feedback corrective disciplinary action . build manage relationship support function store district . . complie company standard procedure handle merchandise include limit ammunition narcotic high ticket . ensure appropriate cash control handle . \u200e Competences minimales ... Indiquez ci dessous les competence minimales requise pour ce poste . il n'y pas competences minimales . age Competences recherchees ... pour . il n'y pas competences recherchees . Comme requis pour . Emplacement Principal ... vous connecter votre compte Workday utiliser rapport des emplois pour emploi . des emplois"
    },
    "companyDescription": "",
    "description": "R\u00e9sum\u00e9 des fonctions... Soutenir le g\u00e9rant de succursale et g\u00e9rer les activit\u00e9s de la succursale conform\u00e9ment aux directives de la Compagnie et diriger les associ\u00e9s afin d\u2019assurer un service aimable, utile et de g\u00e9n\u00e9rer des ventes rentables pour la succursale \n \n Ce que vous ferez... \n 1. As a member of the Store Management Team drives profitable sales through achievement of sales and profit goals, budget management and sales forecasts. Proactively analyzes and utilizes sales/financial reports, economic trends and community needs to identify and respond to market changes while controlling expenditures. Communicates sales results associates and guides interpretation of results \n 2. Creates, with the balance of the Management Team, operational plans; prioritizes, delegates and provides clear direction to Managers and Associates. Ensures optimal store conditions through effective merchandise presentation, accurate and competitive pricing and store standards within Company policies and guidelines. Implements new store programs according to Company direction, while evaluating effectiveness to achieve successful results specifically related to the (Front End or Back End or Fresh or Operations - specific area that the incumbent will oversee). An Assistant Manager is cross-trained to work proficiently in all areas of the Store when needed. \n 3. Executes and monitors asset protection and safety controls; maintains quality assurance standards; oversees safety and operational reviews while ensuring compliance with Walmart policies and procedures and with established safety, security, sales, financial and record keeping procedures and practices. Anticipates and proactively responds to compliance issues, including Total Loss/general controls. \n 4. Serves Customers as an ambassador for their store by greeting customers, seeking their feedback and ensuring customer needs, complaints, and issues are resolved within Company guidelines to create a positive shopping experience. As a member of management, models, enforces, and provides direction to associates on friendly and helpful customer service approaches and techniques \n 5. Supports store initiatives to serve the community by participating in and supporting community events and developing relationships with key community groups. Participates in company-sponsored programs, events, and sustainability efforts for associates and customers to emphasize the store\u2019s role as an integral part of the community. \n 6. Leads Associates by conducting regular store meetings and communicating operational direction and initiatives with a focus on the OMNI and the Total Store. Drives engagement, recognizes and rewards accomplishments and provides opportunities for professional growth. Develops all associates and identifies high-potential associates, providing training and development to increase capability. \n 7. Demonstrates Company values by holding Associates accountable through timely, honest, specific and respectful performance feedback and corrective and disciplinary action. Builds and manages relationships with supporting functions within the store and district (e.g. District HR Managers, etc.). \n 8. Complies to all Company standards and procedures when handling all merchandise, including but not limited to: alcohol, ammunition, narcotics, and high-ticket. Ensures appropriate cash controls, handling as much as $250,000 per day. \u200e \n \n Comp\u00e9tences minimales... \n Indiquez ci-dessous les comp\u00e9tences minimales requises pour ce poste. Si aucune n\u2019est indiqu\u00e9e, il n\u2019y a pas de comp\u00e9tences minimales. Age - 16 or older \n \n Comp\u00e9tences recherch\u00e9es... \n Indiquez ci-dessous les comp\u00e9tences recherch\u00e9es facultatives pour ce poste. Si aucune n\u2019est indiqu\u00e9e, il n\u2019y a pas de comp\u00e9tences recherch\u00e9es. \n \n Comme requis par la loi, Walmart offrira des accommodements pour les besoins des associ\u00e9s avec des incapacit\u00e9s. \n \n Emplacement Principal... 450 TERMINAL AVE, OTTAWA, ON K1G 0Z3, Canada \n \n \u00cates-vous actuellement un associ\u00e9 de Walmart ? \n Veuillez vous connecter \u00e0 votre compte Workday et utiliser le rapport Trouver des emplois pour postuler \u00e0 cet emploi. \n \n  Trouver des emplois"
}