{
    "id": "af55ca8d3b900610",
    "company": "Architecture49",
    "positionName": "Architect, Science & Technology",
    "jobType": [],
    "location": "Ottawa, ON",
    "salary": null,
    "postingDateParsed": "2023-11-08T20:14:46.438Z",
    "url": "https://www.indeed.ca/rc/clk?jk=af55ca8d3b900610&from=jasx&tk=1hgol2fdqk27v800&vjs=3",
    "externalApplyLink": "https://ca.indeed.com/applystart?jk=af55ca8d3b900610&from=vj&pos=top&mvj=0&spon=0&sjdu=o7sfz71MPdMgyiV0LZq0d4DDplm6SwWjHcxyoDIphKnETJSL0skEuLoE6FtIWG08kN0wkll9wDHc3mnStM4Hmg&vjfrom=serp&astse=bfd8063b120f7e1c&assa=1686",
    "job_info_group": {
        "extracted_phone_numbers": [],
        "extracted_links": [
            "HTTP/HTTPS Links",
            "General Links",
            "WWW Links",
            "TLDs"
        ],
        "extracted_emails": [],
        "extracted_location_data": [
            "Canada",
            "the Ottawa",
            "ON area"
        ],
        "extracted_dates": [
            "5+ years"
        ],
        "extracted_languages": [],
        "extracted_laws": [],
        "extracted_norps": [],
        "extracted_orgs": [
            "Validate",
            "Architecture",
            "Architecture49Inc",
            "Interested",
            "an Architect, Science & Technology"
        ],
        "extracted_persons": [],
        "extracted_products": [
            "P3"
        ],
        "extracted_money": [],
        "processed_text": ". currently seek . A49 office location allow successful A49 location preference . position focus Science Technology project responsible follow responsibility serve Laboratory Specialist variety role Science Technology project National Science Technology Leader assist long term strategic plan develop meet market target client goal assume leadership role exist body strong client team talented architect engineer design deliverable conform guideline code requirement regulation advise team design technical solution specific project type attend design team meeting attend project site construction observation . qualification degree diploma accredited institution Registered Architect eligible register canadian province laboratory project multiple delivery model include design build design bid build strong listener genuinely interested people build followership teammate client alike Track record develop business relationship variety client operate develop construct lead laboratory project collaborative style effective thing great communicator \u2013 verbally write form good mentor \u2013 colleague feel good interest heart extensive background laboratory planning design resourceful creative problem solver motivated energetic driver idea impact current future Science Technology industry fun ."
    },
    "companyDescription": "",
    "description": "Architecture49Inc. is currently seeking an Architect, Science & Technology. A49 has office location across Canada, and will allow the successful candidate to work from any A49 location in Canada, with preference for the Ottawa, ON area. This position will focus on Science & Technology projects and be responsible for the following: \n RESPONSIBILITIES \n \n  Serve as Laboratory Specialist for a variety of roles on Science & Technology projects; \n  Work with the National Science & Technology Leader to assist with our long-term strategic plan to develop and meet market and target client goals; \n  Assume leadership roles for our existing body of work with strong clients and a team of talented architects and engineers; \n  Validate that designs and deliverables conform to guidelines, code requirements and other regulations; \n  Advise team members on design and/or technical solutions specific to the project types; \n  Attend design team meetings; and \n  Attend project sites for construction observation. \n \n QUALIFICATIONS \n \n  A degree or diploma in Architecture from an accredited institution; \n  Must be a Registered Architect in Canada, or eligible to be registered in a Canadian province; \n  5+ years of experience in laboratory projects; \n  Experience with multiple delivery models including design-build, P3, and design-bid-build; \n  Strong listener, genuinely interested in people, and able to build followership among teammates and clients, alike; \n  Track record of developing new business and relationships with a variety of clients who may own, operate, develop, construct and lead laboratory projects; \n  Collaborative work style, always looking for a more effective way to do things; \n  Great communicator \u2013 verbally and in written form; \n  Good mentor \u2013 colleagues feel that you have their best interests at heart; \n  An extensive background in laboratory planning and design; \n  Resourceful and creative problem solver, motivated and energetic; \n  Interested in the drivers and ideas impacting the current and future Science & Technology industry; and \n  Has fun at work."
}