{
    "id": "9d9311042119ee91",
    "company": "University of Ottawa",
    "positionName": "Tenure track positions in comparative physiology - BIO",
    "jobType": [],
    "location": "40 Ruskin St, Ottawa, ON",
    "salary": null,
    "postingDateParsed": "2023-11-08T20:16:18.424Z",
    "url": "https://www.indeed.ca/rc/clk?jk=9d9311042119ee91&from=jasx&tk=1hgol57rgk5r3800&vjs=3",
    "externalApplyLink": "https://uottawa.wd3.myworkdayjobs.com/en-US/uOttawa_External_Career_Site/job/Ottawa-ON/Tenure-track-positions-in-comparative-physiology---BIO_JR7950",
    "job_info_group": {
        "extracted_phone_numbers": [
            "613-562-5729",
            " 613-562-5486",
            "613-562-5486",
            " 613-562-5729"
        ],
        "extracted_links": [
            "HTTP/HTTPS Links",
            "General Links",
            "WWW Links",
            "TLDs"
        ],
        "extracted_emails": [
            "biochair.assistant@uottawa.ca",
            "vra.affairesprofessorales@uottawa.ca"
        ],
        "extracted_location_data": [
            "Ottawa"
        ],
        "extracted_dates": [
            "novembre 17",
            "the day prior",
            "May 1, 2023",
            "May 1, 2022",
            "January 10, 2024",
            "July 1, 2024"
        ],
        "extracted_languages": [
            "English",
            "French"
        ],
        "extracted_laws": [],
        "extracted_norps": [
            "Canadians"
        ],
        "extracted_orgs": [
            "the University",
            "the Office of the Vice-Provost",
            "Canada The University of Ottawa",
            "the Ottawa Hospital Research Institute",
            "the Department",
            "The University of Ottawa",
            "Carleton University",
            "APUO Faculty/Department:",
            "the Association of Professors",
            "The Department of Biology",
            "its Official Languages and Bilingualism Institute",
            "The Department",
            "Academic Careers",
            "Department of Biology_FT Campus",
            "University of Ottawa",
            "Faculty of Science",
            "The Faculty of Science",
            "University of Ottawa Brain and Mind Institute",
            "Department of Biology",
            "the University of Ottawa Careers",
            "Faculty Relations at vra.affairesprofessorales@uottawa.ca",
            ", Faculty Relations",
            "(e.g., Canadian Museum of Nature",
            "the Faculty of Science",
            "Indigenous Peoples in Canada",
            "the University of Ottawa",
            "Ottawa Heart Institute",
            "the Canadian Museum of Nature"
        ],
        "extracted_persons": [
            "30 Marie Curie Private"
        ],
        "extracted_products": [],
        "extracted_money": [
            {
                "amount": "89,622",
                "noun_phrases": []
            }
        ],
        "processed_text": "Family Academic Leadership Faculty Union affiliation stem post closing note application accept Project Manager REVISED tenure track position comparative physiology invite application tenure track position rank Assistant Professor . position successful demonstrate potential build internationally recognize externally fund research program fully engage trainee level build collaboration collegial research intensive department . teach hire undergraduate graduate level . exceptional Associate Professor level consider . starting . position comparative physiology invertebrate model . seek application expertise area invertebrate physiology . successful application invertebrate model computer base simulation strengthen comparative physiology approach improve understanding fundamental characteristic process mechanism biological system range cell entire organism . successful join research intensive grow department researcher wide range field include cell molecular biology physiology ecotoxicology neuroscience developmental biology ecology conservation evolutionary biology bioinformatic . maintain close collaboration researcher federal science department agency . provide access core facility molecular biology genomic chemistry microscopy aquatic animal care . title position Assistant Associate Professor duty responsibility include maintain robust externally fund research program supervision graduate undergraduate student thesis project department teach undergraduate graduate course contribute English French Biology Biomedical Sciences curriculum perform active role department contribute administrative academic activity . rank salary regular tenure track academic appointment salary consistent collective agreement . salary scale assistant professor start base scale . require qualification discipline . postdoctoral expect . demonstrate track record research excellence commitment strategy teaching graduate training . teach official language hiring . application package information regard find online . application submit electronically portal . include application cover letter formally express interest position include statement regard teach french English curriculum vitae include career interruption parental sick leave impact record research . consideration selection process detailed research plan maximum statement teach interest principle equity diversity inclusion include training research group contact information reference peer review publication identification form commit ensure equity diversity inclusion scholarly leadership environment student staff faculty contact information Chair K1N 6n5 . fax location K1N 6n5 . application deadline review application . application receive receive consideration . select interview contact . information tradition bilingualism . provide training staff spouse second official language . locate unceded ancestral territory Anishinabe Algonquin people heart Canada's capital unparalleled collaboration governmental agency funding sample GSC . Immigration requirement qualified person invite submit application priority canadian citizen permanent resident . commit ensure equity diversity inclusion scholarly leadership environment student staff faculty . encourage application visible minority racialize person person woman qualified skill knowledge productively engage equitable diverse inclusive community . consider designate group complete confidential Identification Questionnaire complete application . provide accommodation applicant recruitment process . invite proceed selection process notify accommodation require contact . information send handle respectfully complete confidence . commit ensure equity diversity inclusion scholarly leadership environment student staff faculty . encourage application visible minority racialize person person woman qualified skill knowledge productively engage equitable diverse inclusive community . consider designate group complete confidential Identification Questionnaire complete application . qualified invite apply preference permanent resident . submit application indicate legally entitle provide accommodation applicant recruitment process . invite proceed selection process notify accommodation require contact email . information send handle respectfully complete confidence . tradition bilingualism . provide training staff spouse second official language . prior require student faculty staff visitor include contractor fully vaccinate Covid define Policy \u2013 Covid Vaccination . policy suspend effective reinstate point future depend public health guideline recommendation expert ."
    },
    "companyDescription": "",
    "description": "Job Family:\n  Academic Leadership and Faculty\n \n   Union affiliation:\n \n  APUO\n \n \n   Faculty/Department:\n  Department of Biology_FT\n \n \n   Campus:\n  STEM\n \n \n   Date Posted:\n  novembre 17, 2023\n \n \n   Closing Date:\n \n \n   Note: Applications will be accepted until 11:59 PM on the day prior to the Posting End Date above\n \n \n \n   REVISED\n \n \n \n   Tenure track positions in comparative physiology\n \n \n \n   The Department of Biology at University of Ottawa invites applications for a tenure-track position at the rank of Assistant Professor. For this position, the successful candidate will demonstrate potential to build internationally-recognized and externally funded research program that fully engages trainees at all levels, building collaborations within and beyond our collegial, research-intensive department. Candidates must be able to teach in both French and English at the time of hiring at undergraduate and graduate levels. Exceptional candidates at Associate Professor level may also be considered. The starting date is July 1, 2024.\n \n \n \n   This position is for comparative physiology using invertebrate models. We seek applications from candidates with expertise in any area of invertebrate physiology. The successful application will us invertebrate models and/or computer-based simulation to strengthen comparative physiology approaches to improve understanding of fundamental characteristics, processes, and mechanisms for biological systems ranging from cells to entire organisms.\n \n \n \n   The successful candidate will join a research-intensive, growing department of 40 researchers working in a wide range of fields, including cell and molecular biology, physiology, ecotoxicology, neuroscience, developmental biology, ecology and conservation, evolutionary biology, and bioinformatics. The Department maintains close collaborations with researchers at the Ottawa Hospital Research Institute, University of Ottawa Brain and Mind Institute, Ottawa Heart Institute, Carleton University, federal science departments and agencies, and the Canadian Museum of Nature. The Faculty of Science provides access to core facilities for molecular biology, genomics, chemistry, microscopy and aquatic animal care to all of its members.\n \n \n \n   Title of the position: Assistant or Associate Professor\n \n \n \n   Duties: The responsibilities include: 1) maintaining a robust, externally funded research program; 2) supervision of graduate and undergraduate student thesis projects in the department; 3) teaching undergraduate and graduate courses that contribute to the bilingual (English-French) Biology or Biomedical Sciences curriculum; and 4) performing an active role within the department by contributing to administrative and academic activities of the Department, and Faculty of Science.\n \n \n \n   Rank and salary: Regular tenure-track academic appointment in the Faculty of Science, with a salary consistent with the collective agreement of the Association of Professors of the University of Ottawa. The salary scale for assistant professors starts at $89,622 (based on the scale in effect on May 1, 2023).\n \n \n \n   Required qualifications: PhD in Biology or a related discipline. Postdoctoral experience is expected. A demonstrated track record of research excellence must be clearly presented, along with commitment and strategies for teaching and graduate training. The candidate must be able to teach in both French and English, the two official languages of the University, at the time of hiring.\n \n \n \n   Application Package: More information regarding \n  \n   Academic Careers can be found online\n  . Applications must be submitted electronically through the \n  \n   University of Ottawa Careers portal\n  . Candidates should include the following in their application:\n \n \n \n   A one-page cover letter formally expressing interest in the position and including a statement regarding their ability to teach in French and English\n   A full curriculum vitae (please include career interruptions such as parental or sick leaves that may have impacted your record of research. These will be taken into consideration in the selection process)\n   A detailed research plan (3 pages maximum)\n   A statement of teaching interests and how principles of equity, diversity, and inclusion will be included in training of research group members (1 page)\n   Contact information of three references\n   Three peer-reviewed publications\n   Self-Identification Form: The University of Ottawa is committed to ensuring equity, diversity and inclusion in the scholarly and leadership environments of our students, staff, and faculty\n \n \n \n   Contact information: Chair, Department of Biology, 30 Marie Curie Private, Ottawa, ON K1N 6N5, biochair.assistant@uottawa.ca. Telephone: 613-562-5729, fax: 613-562-5486\n \n \n \n   Location of work: Department of Biology, University of Ottawa, 30 Marie Curie Private, Ottawa, ON K1N 6N5.\n \n \n \n   Application deadline: Review of applications will begin January 10, 2024. Applications received before this date will receive full consideration. Only candidates selected for an interview will be contacted.\n \n \n \n   Other information: The University of Ottawa is proud of its more than 160-year tradition of bilingualism. Through its Official Languages and Bilingualism Institute, the University provides training to staff members and to their spouses in their second official language. Located on the unceded ancestral territory of the Anishinab\u00e9-Algonquin people, the University of Ottawa is at the heart of Canada\u2019s capital with unparalleled opportunity for collaborations with governmental agencies for funding and samples (e.g., Canadian Museum of Nature, GSC).\n \n \n   In accordance with Immigration Canada requirements, any qualified person is invited to submit their application; however, priority will be given to Canadian citizens and permanent residents. The University of Ottawa is committed to ensuring equity, diversity and inclusion in the scholarly and leadership environments of our students, staff, and faculty\n  . Accordingly, we strongly encourage applications from Indigenous Peoples in Canada, visible minorities members (racialized persons), persons with disabilities, women, as well as from all qualified candidates with the skills and knowledge to productively engage with equitable, diverse and inclusive communities. Candidates who wish to be considered as a member of one or more designated groups are asked to complete the confidential Self-Identification Questionnaire, to be completed at the time of application.\n \n \n   The University of Ottawa provides accommodations for applicants with disabilities throughout the recruitment process. If you are invited to proceed in the selection process, please notify us of any accommodations that you require by contacting the Office of the Vice-Provost, Faculty Relations at \n  \n   vra.affairesprofessorales@uottawa.ca\n  \n  . Any information you send us will be handled respectfully and in complete confidence.\n \n \n \n   The University of Ottawa is committed to ensuring equity, diversity, and inclusion in the scholarly and leadership environments of our students, staff, and faculty. Accordingly, we strongly encourage applications from Indigenous Peoples in Canada, visible minorities members (racialized persons), persons with disabilities, women, as well as from all qualified candidates with the skills and knowledge to productively engage with equitable, diverse, and inclusive communities. Candidates who wish to be considered as a member of one or more designated groups are asked to complete the confidential Self-Identification Questionnaire, to be completed at the time of application.\n \n \n \n   All qualified candidates are invited to apply; however, preference will be given to Canadians and permanent residents. When submitting your application, please indicate if you are legally entitled to work in Canada\n \n \n \n   The University of Ottawa provides accommodations for applicants with disabilities throughout the recruitment process. If you are invited to proceed in the selection process, please notify us of any accommodations that you require by contacting the Office of the Vice-Provost, Faculty Relations by email at \n  \n   vra.affairesprofessorales@uottawa.ca\n  . Any information you send us will be handled respectfully and in complete confidence.\n \n \n \n   The University of Ottawa is proud of its 160-year tradition of bilingualism. Through its Official Languages and Bilingualism Institute, the University provides training to staff members and to their spouses in their second official language.\n \n \n \n   Prior to May 1, 2022, the University required all students, faculty, staff, and visitors (including contractors) to be fully vaccinated against Covid-19 as defined in Policy 129 \u2013 Covid-19 Vaccination. This policy was suspended effective May 1, 2022 but may be reinstated at any point in the future depending on public health guidelines and the recommendations of experts."
}