{
    "id": "6eba0d66fbafbaef",
    "company": "CHEO RESEARCH INSTITUTE",
    "positionName": "RI-24-003 Research Technician",
    "jobType": [],
    "location": "20 Marie-Curie Private, Ottawa, ON",
    "salary": null,
    "postingDateParsed": "2024-01-18T05:12:56.471Z",
    "url": "https://www.indeed.ca/rc/clk?jk=6eba0d66fbafbaef&from=jasx&tk=1hkikfdo3kecu801&bb=WxOhatT4U5HJji5qaEXltIhiYYiMtzDLUwRpFCNGEa8PhCmTIEHQ8UtpNCu9VoUE7eb9zYkCnp-I1L3RA3BdOribz-5FwSdf7uPk-Gke7LA4u40p0yJPYA%3D%3D&xkcb=SoC467M3FSgyYCQ9SB0JbzkdCdPP&vjs=3",
    "externalApplyLink": null,
    "job_info_group": {
        "extracted_phone_numbers": [],
        "extracted_links": [
            "HTTP/HTTPS Links",
            "General Links",
            "WWW Links",
            "TLDs"
        ],
        "extracted_emails": [
            "kgalpin@cheo.on.ca",
            "researchhr@cheo.on.ca"
        ],
        "extracted_location_data": [
            "l'exp\u00e9rience",
            "dans le",
            "au Canada",
            "Canada",
            "Ottawa",
            "DE",
            "sexuelles minoritaires"
        ],
        "extracted_dates": [
            "January 17 to January 31",
            "20"
        ],
        "extracted_languages": [],
        "extracted_laws": [],
        "extracted_norps": [
            "avec"
        ],
        "extracted_orgs": [
            "d\u00e9partement de p\u00e9diatrie",
            "Institut de recherche de CHEO L'Institut de recherche du Centre",
            "Une exp\u00e9rience avec le poisson z\u00e8bre et l'\u00e9dition de g\u00e8nes est un plus, mais toute la formation sera fournie",
            "le processus d'embauche",
            "\u00e9quipe de recherche",
            "source de soutien dans notre collectivit\u00e9",
            "your Curriculum Vitae",
            "veuillez communiquer avec les Ressources",
            "CHEOResearch Institute Children's Hospital of Eastern Ontario Research Institute",
            "Canada Compliance with",
            "(Microsoft Office",
            "proc\u00e9dures de s\u00e9curit\u00e9 appropri\u00e9es pour la",
            "Forte capacit\u00e9 d'organisation",
            "Berman est \u00e0 la recherche d'une",
            "Human Resources",
            "un laboratoire de recherche \u2013 Centre de recherche avanc\u00e9e en",
            "la ligne",
            "accro\u00eetre l'\u00e9quit\u00e9, la diversit\u00e9 et l'inclusion dans",
            "Le candidat ou la candidate travaillera en \u00e9troite collaboration avec des membres du personnel dirigeant et des \u00e9tudiants",
            "la recherche",
            "CRAGE",
            "avec",
            "RT-Polymerase Chain Reaction semi-quantitative et qPCR Hybridation",
            "et de nouvelles preuves pour soutenir CHEO dans sa",
            "du processus de recrutement",
            "ON K1N 9B4 OTHER REQUIREMENTS Eligible",
            "kgalpin@cheo.on.ca",
            "g\u00e9notypage",
            "l'analyse Polymerase Chain Reaction et qPCR",
            "la leuc\u00e9mie",
            "cr\u00e9er de nouvelles connaissances",
            "RESPONSABILIT\u00c9S Manipulation du poisson z\u00e8bre",
            "POSTE",
            "du Centre",
            "The CHEO Research Institute",
            "Department of Pediatrics",
            "Le candidat ou",
            "CHEO RI",
            "ON K1N 6N5",
            "\u00e0 la Loi sur l'accessibilit\u00e9 pour les personnes en",
            "\u00e0 fond clair et confocale Analyser les donn\u00e9es et tenir des registres de donn\u00e9es clairs et pr\u00e9cis \u00c9tablir de mani\u00e8re ind\u00e9pendante les t\u00e2ches",
            "Ottawa Children's Treatment Centre",
            "a research laboratory setting - Center for Advanced Research in Environmental Genomics (CAREG",
            "the University of Ottawa",
            "a Research Technician",
            "Haut niveau d'adaptabilit\u00e9",
            "L'Institut de recherche CHEO cherche \u00e0",
            "the Children's Hospital of Eastern Ontario",
            "un seul document PDF",
            "\u00eatre une",
            "(1,0 ETP",
            "adolescent et famille de notre communaut\u00e9 et au-del\u00e0",
            "la famille et les donateurs",
            "Le laboratoire"
        ],
        "extracted_persons": [
            "L'IR de CHEO",
            "la microscopie et la manipulation du poisson z\u00e8bre",
            "Utiliser",
            "Technicien ou technicienne de recherche DUR\u00c9E",
            "Dr. Jason Berman",
            "doit avoir de",
            "sommes heureux de recevoir des demandes",
            "de d\u00e9montrer une",
            "et histologie Microscopie fluorescente",
            "V\u00e9rification du casier judiciaire",
            "de personnes",
            "enfants de l'est de l'Ontario",
            "diversifi\u00e9es",
            "Kristianne Galpin",
            "20 Marie-Curie Private",
            "Marie-Curie Private",
            ", jugement s\u00fbr et capacit\u00e9 \u00e0",
            "histology Fluorescent",
            "doit\u00eatre capable",
            "Clonage mol\u00e9culaire Analyse de l'expression g\u00e9n\u00e9tique",
            "Dr Jason Berman",
            "L'IR de CHEO travaille pour"
        ],
        "extracted_products": [],
        "extracted_money": [
            {
                "amount": "22.32-$32.32",
                "noun_phrases": []
            }
        ],
        "processed_text": "description post RI Posting Period \u2013 position research Technician term fte | contract possibility extension salary commensurate skill report Professor CHEO RI research arm \u2013 CHEO affiliated institute . CHEO beloved institution workplace recognize anchor community . create knowledge evidence support CHEO provision class care child . mission connect exceptional talent technology pursuit life change research child youth family community . requirement . Berman lab highly motivated individual technical general molecular biology technique include limit DNA rna extraction Polymerase Chain Reaction qpcr analysis microscopy zebrafish handling . demonstrate record strong ethic enthusiasm independently research team . close collaboration senior staff graduate student study leukemia leukemia predisposition syndrome . responsibility zebrafish handling genotyping breed adult microinjection embryo molecular cloning gene expression analysis semi quantitative RT Polymerase Chain reaction qpcr mount zebrafish embryo situ hybridization antibody label flow cytometry brightfield confocal microscopy analyze datum maintain clear accurate data record independently identify additional task perform appropriate safety procedure handling storage disposal biological material qualification skill ABILITIES strong knowledge molecular biology technique zebrafish gene editing training provide Minimum Bachelor's degree biological science excellent interpersonal relation communication skill sound judgment foster cooperative environment strong organize manage task high level adaptability attention detail excellent organizational skill learn integrate technique methodology proficiency computer skill working condition site CHEO RI's universal COVID vaccination policy Police record check apply interested send cover letter pdf document subject \u2013 . diversity equal employer . committed provide inclusive barrier free environment start hiring process interest qualified applicant . applicant require accommodation application process Accessibility Ontarians Disabilities notify . seek increase equity diversity inclusion activity include research education career development patient family donor partnership . diverse traditional career path perspective skill resilience collaboration relationship building . application racialized minority indigenous people person person minority sexual orientation gender identity skill knowledge productively engage diverse community . application consider eligible . applicant interest invite interview contact . \u2013 Du janvier au janvier poste temps plein d'un possibilite prolongation SALAIRE Proportionnel aux competences RELEVE professeur hospitalier pour \u00ab IR CHEO \u00bb est l'organisme recherche du Centre traitement pour enfant hospitalier pour enfant l'est l'Ontario situe \u00ab CHEO \u00bb institut affilie l'Universite d'Ottawa . CHEO est une institution milieu travail nous cherisson enormement est largement reconnu pour . prestation soins classe mondiale enfant . Notre mission l'ir CHEO est mettre relation des talent des technologies exceptionnel mener des recherche permettant changer vie chaque enfant . immediatement besoin d'un technicien ne recherche . personne tres motivee ayant une technique dans les technique generales biologie moleculaire compris mais sans s'y limiter l'extraction d'ADN d'ARN . forte ethique travail enthousiasme travailler maniere independante tout faisant partie d'une . diplomes etudiant leucemie les syndrome predisposition . reproduction des adultes micro injection des embryon par situ dthembryon poisson zebre entiers marquage d'anticorps Cytometrie flux supplementaires effectuer les manipulation stockage l'elimination du materiel biologique qualification COMPETENCES CAPACITES candidat solide connaissance une des techniques biologie moleculaire . . Minimum d'un baccalaureat sciences biologique d'une connexe . excellente relation interpersonnelle competences communication favoriser environnement travail cooperatif . gestion des tache . . Souci du detail excellent sens l'organisation . Capacite d'apprendre d'integrer nouvelles techniques methodologie . Competence informatique . condition travail travail sur place dans genomique environnementale K1N 9b4 autres exigence admissible travailler au Respect politique vaccination contre COVID du IR CHEO . POUR postuler Les candidat les interesses doivent envoyer leur Curriculum Vitae lettre presentation indiquant dans d'objet \u00ab Candidature technicien recherche \u00bb \u2013 Nom Prenom . L'Institut recherche CHEO valorise diversite est employeur souscrit au principe l'egalite d'acces . nous nous sommes engages fournir environnement travail inclusif sans obstacle commencant par nous provenant tous les candidats qualifie . Si vous avez besoin mesures d'adaptation pendant l'une des phase conformement situation handicap l'Ontario humaine . toutes ses activites compris l'avancement professionnel les partenariat avec les patient . nous accordon l'importance aux parcours carriere aux perspectives traditionnelles nous valorison les competences telles resilience collaboration l'etablissement relation . nous accueillon favorablement les demandes membres minorites raciales d'Autochtones situation handicap personnes ayant des orientations des identites genre ainsi d'autres personnes possedant les competence les connaissances necessaires pour collaborer facon productive diverses communautes . Seules les candidature des personnes autorisees travailler seront prise consideration . nous remercion tous les candidats leur interet cependant nous ne communiquerons qu'avec ceux seront convoques une entrevue . type salary hour education Bachelor's Degree require commute require location person"
    },
    "companyDescription": "",
    "description": "JOB DESCRIPTION Posting # RI-24-003 \nPosting Period \u2013 January 17 to January 31, 2024 \nPOSITION: Research Technician\nTERM: Full-time (1.0 FTE) | 1 Year contract with possibility of extension\nSALARY: Will commensurate with skills and experience\nREPORTS TO: Dr. Jason Berman, Professor, Department of Pediatrics, CHEOResearch Institute\nChildren\u2019s Hospital of Eastern Ontario Research Institute (\u201cCHEO RI\u201d) is the research arm of the Children\u2019s Hospital of Eastern Ontario \u2013 Ottawa Children\u2019s Treatment Centre (\u201cCHEO\u201d) and an affiliated institute of the University of Ottawa. CHEO is a beloved institution and workplace that is widely recognized for being an anchor in our community. CHEO RI works to create new knowledge and evidence to support CHEO in its provision of world-class care to our children. Our mission at CHEO RI is to connect exceptional talent and technology in pursuit of life-changing research for every child, youth, and family in our community and beyond.\nCHEO RI has an immediate requirement for a Research Technician. \nThe Berman lab is looking for a highly motivated individual with technical experience in general molecular biology techniques, including but not limited to DNA and RNA extraction, PCR and qPCR analysis, microscopy and zebrafish handling. The candidate should be able to demonstrate a record of a strong work ethic and enthusiasm to work independently while being part of a research team. The candidate will work in close collaboration with senior staff members and graduate students studying leukemia and leukemia predisposition syndromes.\nRESPONSIBILITIES \n\n Zebrafish handling, genotyping, breeding adults and microinjection of embryos\n Molecular cloning\n Gene-expression analysis by semi-quantitative RT-PCR and qPCR\n Whole-mount zebrafish embryo in situ hybridization and antibody labeling\n Flow cytometry and histology\n Fluorescent, brightfield and confocal microscopy\n Analyzing data and maintaining clear and accurate data records\n Independently identifying additional tasks which need to be performed\n Using appropriate safety procedures for handling, storage, and disposal of biological materials\n\nQUALIFICATIONS, SKILLS AND ABILITIES \n\n The candidate should have strong knowledge of and experience with molecular biology techniques\n Experience with zebrafish and gene editing is a plus, but all the training will be provided\n Minimum of a Bachelor\u2019s degree in biological sciences and related experience\n Excellent interpersonal relations and communications skills, sound judgment and ability to foster a cooperative work environment\n Strong ability to organize and manage tasks\n High level of adaptability\n Attention to detail and excellent organizational skills\n Ability to learn and integrate new techniques & methodologies\n Proficiency in computer skills (Microsoft Office)\n\nWORKING CONDITIONS \nOn-site work in a research laboratory setting - Center for Advanced Research in Environmental Genomics (CAREG), 20 Marie-Curie Private, Ottawa, ON K1N 9B4\nOTHER REQUIREMENTS \n\n Eligible to work in Canada\n Compliance with CHEO RI\u2019s universal COVID-19 vaccination policy\n Police record check\n\nTO APPLY \nInterested candidates please send your CV and cover letter as one PDF document with the subject line \u201cResearch Technician Application \u2013 Last name, First name\u201d to Kristianne Galpin (kgalpin@cheo.on.ca).\nThe CHEO Research Institute values diversity and is an equal opportunity employer. We are committed to providing an inclusive and barrier-free work environment, starting with the hiring process and welcome interest from all qualified applicants. Should an applicant require any accommodations during the application process, as per the Accessibility for Ontarians with Disabilities Act, please notify Human Resources at researchhr@cheo.on.ca.\nThe CHEO Research Institute seeks to increase equity, diversity and inclusion in all of its activities, including research, education and career development, patient, family and donor partnerships. We value diverse and non-traditional career paths and perspectives, and value skills such as resilience, collaboration, and relationship-building. We welcome applications from members of racialized minorities, Indigenous peoples, persons with disabilities, persons of minority sexual orientations and gender identities, and others with the skills and knowledge to productively engage with diverse communities.\nApplications will only be considered from those that are eligible to work in Canada. We thank all applicants for their interest, however, only those invited for an interview will be contacted.\nDESCRIPTION DE POSTE Num\u00e9ro d\u2019affichage RI-24-003 \nP\u00e9riode d\u2019affichage \u2013 Du 17 janvier 2024 au 31 janvier 2024 \nPOSTE : Technicien ou technicienne de recherche\nDUR\u00c9E : Poste \u00e0 temps plein (1,0 ETP) d\u2019un (1) an avec possibilit\u00e9 de prolongation\nSALAIRE : Proportionnel aux comp\u00e9tences et \u00e0 l\u2019exp\u00e9rience\nREL\u00c8VE DE : Dr Jason Berman, professeur, d\u00e9partement de p\u00e9diatrie, Institut de recherche de CHEO\nL\u2019Institut de recherche du Centre hospitalier pour enfants de l\u2019est de l\u2019Ontario (\u00ab IR de CHEO \u00bb) est l\u2019organisme de recherche du Centre de traitements pour enfants du Centre hospitalier pour enfants de l\u2019est de l\u2019Ontario situ\u00e9 \u00e0 Ottawa (\u00ab CHEO \u00bb) et un institut affili\u00e9 de l\u2019Universit\u00e9 d\u2019Ottawa. CHEO est une institution et un milieu de travail que nous ch\u00e9rissons \u00e9norm\u00e9ment et qui est largement reconnu pour \u00eatre une source de soutien dans notre collectivit\u00e9. L\u2019IR de CHEO travaille pour cr\u00e9er de nouvelles connaissances et de nouvelles preuves pour soutenir CHEO dans sa prestation de soins de classe mondiale \u00e0 nos enfants. Notre mission \u00e0 l\u2019IR de CHEO est de mettre en relation des talents et des technologies exceptionnels, dans le but de mener des recherches permettant de changer la vie de chaque enfant, adolescent et famille de notre communaut\u00e9 et au-del\u00e0.\nL\u2019IR de CHEO a imm\u00e9diatement besoin d\u2019un(e) technicien(ne) de recherche.\nLe laboratoire Berman est \u00e0 la recherche d\u2019une personne tr\u00e8s motiv\u00e9e ayant une exp\u00e9rience technique dans les techniques g\u00e9n\u00e9rales de biologie mol\u00e9culaire, y compris, mais sans s\u2019y limiter, l\u2019extraction d\u2019ADN et d\u2019ARN, l\u2019analyse PCR et qPCR, la microscopie et la manipulation du poisson z\u00e8bre. Le candidat ou la candidate doit\u00eatre capable de d\u00e9montrer une forte \u00e9thique de travail et un enthousiasme \u00e0 travailler de mani\u00e8re ind\u00e9pendante tout en faisant partie d\u2019une \u00e9quipe de recherche. Le candidat ou la candidate travaillera en \u00e9troite collaboration avec des membres du personnel dirigeant et des \u00e9tudiants dipl\u00f4m\u00e9s \u00e9tudiant la leuc\u00e9mie et les syndromes de pr\u00e9disposition \u00e0 la leuc\u00e9mie.\nRESPONSABILIT\u00c9S \n\n Manipulation du poisson z\u00e8bre, g\u00e9notypage, reproduction des adultes et micro-injection des embryons\n Clonage mol\u00e9culaire\n Analyse de l\u2019expression g\u00e9n\u00e9tique par RT-PCR semi-quantitative et qPCR\n Hybridation in situ d\u2019embryons de poisson z\u00e8bre entiers et marquage d\u2019anticorps\n Cytom\u00e9trie en flux et histologie\n Microscopie fluorescente, \u00e0 fond clair et confocale\n Analyser les donn\u00e9es et tenir des registres de donn\u00e9es clairs et pr\u00e9cis\n \u00c9tablir de mani\u00e8re ind\u00e9pendante les t\u00e2ches suppl\u00e9mentaires \u00e0 effectuer\n Utiliser les proc\u00e9dures de s\u00e9curit\u00e9 appropri\u00e9es pour la manipulation, le stockage et l\u2019\u00e9limination du mat\u00e9riel biologique\n\nQUALIFICATIONS, COMP\u00c9TENCES ET CAPACIT\u00c9S \n\n Le candidat ou la candidate doit avoir de solides connaissances et une exp\u00e9rience des techniques de biologie mol\u00e9culaire.\n Une exp\u00e9rience avec le poisson z\u00e8bre et l\u2019\u00e9dition de g\u00e8nes est un plus, mais toute la formation sera fournie.\n Minimum d\u2019un baccalaur\u00e9at en sciences biologique et d\u2019une exp\u00e9rience connexe.\n Excellentes relations interpersonnelles et comp\u00e9tences en communication, jugement s\u00fbr et capacit\u00e9 \u00e0 favoriser un environnement de travail coop\u00e9ratif.\n Forte capacit\u00e9 d\u2019organisation et de gestion des t\u00e2ches.\n Haut niveau d\u2019adaptabilit\u00e9.\n Souci du d\u00e9tail et excellent sens de l\u2019organisation.\n Capacit\u00e9 d\u2019apprendre et d\u2019int\u00e9grer de nouvelles techniques et m\u00e9thodologies.\n Comp\u00e9tence en informatique (Microsoft Office).\n\nCONDITIONS DE TRAVAIL \nTravail sur place dans un laboratoire de recherche \u2013 Centre de recherche avanc\u00e9e en g\u00e9nomique environnementale (CRAGE), 20, Marie-Curie Private (Ottawa) ON K1N 9B4\nAUTRES EXIGENCES \n\n Admissible \u00e0 travailler au Canada\n Respect de la politique de vaccination contre la COVID-19 du IR de CHEO;\n V\u00e9rification du casier judiciaire.\n\nPOUR POSTULER \nLes candidats et les candidates int\u00e9ress\u00e9s doivent envoyer leur CV et lettre de pr\u00e9sentation en un seul document PDF en indiquant dans la ligne d\u2019objet \u00ab Candidature technicien de recherche \u00bb \u2013 Nom, Pr\u00e9nom \u00e0 Kristianne Galpin (kgalpin@cheo.on.ca).\nL\u2019Institut de recherche de CHEO valorise la diversit\u00e9 et est un employeur qui souscrit au principe de l\u2019\u00e9galit\u00e9 d\u2019acc\u00e8s. Nous nous sommes engag\u00e9s \u00e0 fournir un environnement de travail inclusif et sans obstacle, en commen\u00e7ant par le processus d\u2019embauche et nous sommes heureux de recevoir des demandes provenant de tous les candidats qualifi\u00e9s. Si vous avez besoin de mesures d\u2019adaptation pendant l\u2019une des phases du processus de recrutement, conform\u00e9ment \u00e0 la Loi sur l\u2019accessibilit\u00e9 pour les personnes en situation de handicap de l\u2019Ontario, veuillez communiquer avec les Ressources humaines \u00e0 researchhr@cheo.on.ca.\nL\u2019Institut de recherche CHEO cherche \u00e0 accro\u00eetre l\u2019\u00e9quit\u00e9, la diversit\u00e9 et l\u2019inclusion dans toutes ses activit\u00e9s, y compris la recherche, l\u2019avancement professionnel, les partenariats avec les patients, la famille et les donateurs. Nous accordons de l\u2019importance aux parcours de carri\u00e8re et aux perspectives diversifi\u00e9es et non traditionnelles et nous valorisons les comp\u00e9tences telles que la r\u00e9silience, la collaboration et l\u2019\u00e9tablissement de relations. Nous accueillons favorablement les demandes de membres de minorit\u00e9s raciales, d\u2019Autochtones, de personnes en situation de handicap, de personnes ayant des orientations sexuelles minoritaires et des identit\u00e9s de genre, ainsi que d\u2019autres personnes poss\u00e9dant les comp\u00e9tences et les connaissances n\u00e9cessaires pour collaborer de fa\u00e7on productive avec diverses communaut\u00e9s.\nSeules les candidatures des personnes autoris\u00e9es \u00e0 travailler au Canada seront prises en consid\u00e9ration. Nous remercions tous les candidats de leur int\u00e9r\u00eat, cependant, nous ne communiquerons qu\u2019avec ceux qui seront convoqu\u00e9s \u00e0 une entrevue.\nJob Type: Full-time\nSalary: $22.32-$32.32 per hour\nEducation:\n\n Bachelor's Degree (required)\n\nAbility to Commute:\n\n Ottawa, ON K1N 6N5 (required)\n\nWork Location: In person"
}