{
    "id": "6f3b5add6fbf90b1",
    "company": "Marriott International, Inc",
    "positionName": "Guest Services Associate",
    "jobType": [
        "Full-time"
    ],
    "location": "11 Colonel By Dr, Ottawa, ON",
    "salary": null,
    "postingDateParsed": "2024-01-25T12:16:35.824Z",
    "url": "https://www.indeed.ca/rc/clk?jk=6f3b5add6fbf90b1&from=jasx&tk=1hl5dhvd9ia2n800&bb=sVrMdsVcIt_OfIQS18JHMTqACYiOaUkfRIq_gLKaIAzAUJJpVIETaxM_J0DSyGNOl8-wmGcR9pBXeW_CpmJNT5T3yIX-RHQoyJHgKAxeAx-heJ_0cNcpjA%3D%3D&xkcb=SoAX67M3FlTIK7WZUZ0PbzkdCdPP&vjs=3",
    "externalApplyLink": "https://ca.indeed.com/applystart?jk=6f3b5add6fbf90b1&from=vj&pos=top&mvj=0&spon=0&sjdu=o7sfz71MPdMgyiV0LZq0d4DDplm6SwWjHcxyoDIphKkEvRr2ew4kw-jY4SJLSud8DvEWjy9bgVOClqpLAeC_FB5M-OiGnA16wjKpMBE3gZC9SbL6eWTshmL-nvOQBiaTFdf249_5hn77jpVjZzTnPmtgx1kAEaDJYUqFBUGatBo_KMEZeadx4Me9mj8OGHs2w9_XINGINv7OnqX9-Wv1cg&vjfrom=serp&astse=70964d847fb3d1d9&assa=5207",
    "job_info_group": {
        "extracted_phone_numbers": [
            " 905-366-5227",
            "905-366-5227"
        ],
        "extracted_links": [
            "HTTP/HTTPS Links",
            "General Links",
            "WWW Links",
            "TLDs"
        ],
        "extracted_emails": [
            "CanadaApplicationAccommodation@marriott.com"
        ],
        "extracted_location_data": [
            "The Westin Ottawa",
            "Canada",
            "Ottawa"
        ],
        "extracted_dates": [
            "2005"
        ],
        "extracted_languages": [],
        "extracted_laws": [],
        "extracted_norps": [],
        "extracted_orgs": [
            "The Westin Ottawa",
            "Marriott International",
            "Westin",
            "email CanadaApplicationAccommodation@marriott.com",
            "the Accessibility for Ontarians with Disabilities Act",
            "Nova Scotia Accessibility Act",
            "Housekeeping"
        ],
        "extracted_persons": [
            "ONT"
        ],
        "extracted_products": [],
        "extracted_money": [],
        "processed_text": "Additional Information number Category Rooms Guest Services Operations Location Colonel Drive view MAP schedule located remotely Relocation Position Type management position summary Process guest check check room assignment room change late check request . secure payment activate reissue room key . ensure rate match market code document exception . verify adjust billing guest . communicate appropriate staff guest wait room . advise guest message . clear departure computer system . coordinate track room status guest concern . file guest paperwork documentation . operate switchboard station . check daily report contingency list credit card authorization report . supply guest direction information . answer record process guest request question concern follow ensure meet guest' satisfaction . arrange transportation guest visitor . count secure bank shift . cash guest' check process payment type voucher pay charge provide change . notify Loss Prevention Security report theft . follow company policy procedure report accident injury unsafe condition manager ensure uniform personal appearance clean professional maintain confidentiality proprietary information protect company asset . acknowledge guest accord company standard anticipate address guest' service assist individual guest genuine appreciation . speak clear professional language answer appropriate etiquette . develop maintain positive working relationship support team reach common goal listen respond appropriately concern employee . comply quality assurance standard . stand sit walk extended period . lift carry push pull place object weigh equal pound assistance . perform reasonable duty request supervisor . equal employer . hire diverse workforce sustain inclusive people culture . committed discrimination protect basis veteran status basis cover applicable law . notification Applicants seriously obligation provincial human accessibility legislation Accessibility Manitobans . happy provide accommodation applicant assistance . require accommodation relation posting online application interview Human Resources team respond request . note phone number email individual request accessibility accommodation recruiting process . committed empower guest regain control enhance travel ensure good version . achieve brand mission preeminent wellness brand hospitality passionate engage associate bring brand's unique programming life . associate embrace practice property . ideal Westin passionate active pride maintain optimistic adventurous . good purpose belong amazing globalteam good version ."
    },
    "companyDescription": "As the #1 leader in hospitality worldwide, Marriott International has 8,300+ hotel properties and 30+ leading hotel brands. We\u2019re in 138 countries and territories, and we\u2019re still growing. The next step in your career could lead to your greatest adventure. Exciting opportunities await you! Visit marriott.com/careers to apply.\r\n\r\n\r\n",
    "description": "Additional Information Full Time\n  \n Job Number 24009322\n  \n Job Category Rooms & Guest Services Operations\n  \n Location The Westin Ottawa, 11 Colonel By Drive, Ottawa, ONT, Canada VIEW ON MAP\n  \n Schedule Full-Time\n  \n Located Remotely? N\n  \n Relocation? N\n  \n Position Type Non-Management\n \n   \n  POSITION SUMMARY\n   \n  Process all guest check-ins, check-outs, room assignments, and room change/late check-out requests. Secure payment; activate/reissue room keys. Ensure rates match market codes, document exceptions. Verify/adjust billing for guests. Communicate to appropriate staff when guests are waiting for an available room. Advise guest of messages. Clear departures in computer system. Coordinate with Housekeeping to track room status and guest concerns. File guest paperwork or documentation. Operate telephone switchboard station. Run and check daily reports, contingency lists, and credit card authorization reports. Supply guests with directions and information. Answer, record, and process all guest calls, requests, questions, or concerns; follow up to ensure each has been met to guests\u2019 satisfaction. Arrange transportation for guests/visitors. Count and secure bank at beginning and end of shift. Cash-guests' checks, process all payment types, vouchers, paid-outs, charges, and provide change. Notify Loss Prevention/Security of any reports of theft.\n   \n  Follow company policies and procedures; report accidents, injuries, and unsafe work conditions to manager; ensure uniform and personal appearance are clean and professional; maintain confidentiality of proprietary information; protect company assets. Welcome and acknowledge guests according to company standards; anticipate and address guests\u2019 service needs; assist individuals with disabilities; thank guests with genuine appreciation. Speak using clear and professional language; answer telephones using appropriate etiquette. Develop and maintain positive working relationships; support team to reach common goals; listen and respond appropriately to the concerns of employees. Comply with quality assurance standards. Stand, sit, or walk for an extended period of time. Move, lift, carry, push, pull, and place objects weighing less than or equal to 10 pounds without assistance. Perform other reasonable job duties as requested by Supervisors.\n  \n   \n \n \n Marriott International is an equal opportunity employer. We believe in hiring a diverse workforce and sustaining an inclusive, people-first culture. We are committed to non-discrimination on any protected basis, such as disability and veteran status, or any other basis covered under applicable law.\n \n  Notification to Applicants: The Westin Ottawa takes seriously its obligations under provincial human rights and accessibility legislation (such as the Accessibility for Ontarians with Disabilities Act, 2005, the Accessibility for Manitobans Act, and Nova Scotia Accessibility Act). We are happy to provide accommodations to job applicants needing assistance. If you require an accommodation in relation to this job posting, our online application or an interview, please call 905-366-5227 or email CanadaApplicationAccommodation@marriott.com and a member of our Human Resources team will respond to your request. Please note that this phone number and email are only for those individuals who would like to request an accessibility accommodation as part of the recruiting process.\n  At Westin, we are committed to empowering guests to regain control and enhance their well-being when they need it most while traveling, ensuring they can be the best version of themselves. To achieve the brand mission of becoming the preeminent wellness brand in hospitality, we need passionate and engaged associates to bring the brand\u2019s unique programming to life. We want our associates to embrace their own well-being practices both on and off property. You are the ideal Westin candidate if you are passionate; you are active and take pride in how you maintain your well-being; you are optimistic; you are adventurous. \n Be where you can do your best work, \n begin your purpose, \n belong to an amazing globalteam, and \n become the best version of you."
}