{
    "id": "d9de22542425b8dc",
    "company": "Ciena",
    "positionName": "Service Solution Architect IP",
    "jobType": [
        "Full-time"
    ],
    "location": "Ottawa, ON",
    "salary": null,
    "postingDateParsed": "2024-01-09T03:09:10.060Z",
    "url": "https://www.indeed.ca/rc/clk?jk=d9de22542425b8dc&from=jasx&tk=1hjm33n93k6rj800&vjs=3",
    "externalApplyLink": "https://careers.ciena.com/us/en/job/CIENUSR024294ENUS/Service-Solution-Architect-IP?utm_source=indeed&utm_medium=phenom-feeds",
    "job_info_group": {
        "extracted_phone_numbers": [],
        "extracted_links": [
            "HTTP/HTTPS Links",
            "General Links",
            "WWW Links",
            "TLDs"
        ],
        "extracted_emails": [],
        "extracted_location_data": [
            "SR-MPLS",
            "Java"
        ],
        "extracted_dates": [
            "15+ years"
        ],
        "extracted_languages": [],
        "extracted_laws": [],
        "extracted_norps": [],
        "extracted_orgs": [
            "Ciena",
            "RSVP-TE",
            "OSPF",
            "Data Center",
            "Global Engineering and Learning Solutions",
            "Management Information Systems",
            "BGP",
            "customer IP Network Architecture & Design",
            "MCP",
            "Control and Planning",
            "an Equal Opportunity Employer",
            "Relational",
            "Programing Languages",
            "RESTFul Application Programming Interface",
            "a Service Solutions Architect",
            "Netconf"
        ],
        "extracted_persons": [],
        "extracted_products": [
            "Cloud Provider and Large Enterprise"
        ],
        "extracted_money": [],
        "processed_text": "committed people philosophy . team enjoy culture focus prioritize personalized flexible environment empower individual's passion growth wellbeing belonging . technology company lead humanity \u2014 drive business priority alongside meaningful social community societal impact . . contribute reporting Senior Director support delivery network transformation modernization set service analyze customer's network identify network solution party plan integration conversion requirement meet customer's . play key role support Sales Account team Product Manager Engineering Account Owner proposal activity design identify revenue hardware service . serve consultant Ciena team develop revenue hardware service support feature development enhancement test validation procedure regularly guide product architect security prime developer technology specialty . track technology specific guidance development industry create documentation guideline product release incorporate security documentation package . internal external organization drive solution customer . perform technical oversight include site customer engagement support customer internal architectural discussion requirement . provide advice aspect Telecommunication Network design Layer Layer include create multi disciplinary technical innovation solution complex risky business situation . support regional engineering team specific project deliverable enable region sufficient aspect engineering business tool technology enable creation outcome audit optimization service telecommunication network . develop complex network modernization solution perform network audits architecture design enable introduction complete network modernization . validate test specific procedural step Ciena Customer equipment laboratory . provide leadership technical consultation service Ciena field service team ensure propose solution technically viable meet customer requirement provide maximum benefit . support pre sales customer service estimate subject matter expert close solution lead proposal . Ciena expect curiosity \u2013 exploration research drive insatiable curiosity . initiative \u2013 starter limited direction committed deliver thoughtful relevant actionable insight . agility \u2013 key decision manage compete change account priority . communication expertise \u2013 influence tailor message idea audience ensure understanding consensus . ' ladder ' \u2013 capable big picture understand detail analysis . flexibility independently broad team \u2013 thrive multi disciplinary team environment comfortable independently require . relationship builder \u2013 influence develop trust connection influence outcome . trusted advisor team account executive importantly key external customer researcher . commitment innovation \u2013 ahead market competitive development keen extrapolate current technology future . Haves excellent working knowledge IP networking protocol include . understand Northbound integration language YANG SNMP gNMI . architecture ip mpls network Tier Service provider segment . previous include manage successful customer engagement initial requirement gathering HLD LLD creation validation MOP execution deployment . extensive IP Network Architecture Design plan deploy ip mpls network multitude customer network architecture Access Residential Aggregation Core Peering . extract network design requirement customer engagement balance exist product capability create realizable deployable design . minimum bachelor's degree computer science Engineering relate field couple extensive functional technical project lead role telecommunication industry . executive communication leadership prove build partnership influence . strong technical writing presentation skill . prove Professional Services organization demonstrate people leadership consultancy skill . advanced knowledge ip protocol networking device technology SAOS software Manage NMS system . datum analytic Business Intelligence platform software development methodology Development Operations toolchain drive fast innovation . knowledge Python nosql database . strong technical background knowledge Ciena's optical packet technology . asset ccnp CCNE certification . telecommunications equipment vendor industry . advanced degree computer science engineering Project management committed build foster environment employee feel respect hear . diversity workforce respect employee individual . tolerate form discrimination . include protect veteran status . contact relation advise accommodation measure require ."
    },
    "companyDescription": "",
    "description": "Ciena is committed to our people-first philosophy. Our teams enjoy a culture focused on prioritizing a personalized and flexible work environment that empowers an individual\u2019s passions, growth, wellbeing and belonging. We\u2019re a technology company that leads with our humanity\u2014driving our business priorities alongside meaningful social, community, and societal impact. \n \n .\n  How You Will Contribute:\n \n  Reporting to the Senior Director of Global Engineering and Learning Solutions, as a Service Solutions Architect, you will support the delivery of network transformation and modernization via a set of services that analyze the customer\u2019s network, identify the network solutions (Ciena and/or third party), and plan the integration/conversion requirements to meet the customer\u2019s needs. You will also play a key role supporting the Sales Account team, Product Line Manager, Engineering Account Owner on proposal activities designed to identify revenue (hardware and services) opportunities.\n \n \n   You will serve as a consultant to various Ciena teams to develop revenue (hardware and service opportunities) as well as support feature development and enhancement, test and validation procedures, and regularly guide product architects, security primes, and developers with their technology specialty.\n   You will track technology specific guidance and developments across the industry and create documentation and guidelines for product releases to be incorporated into security documentation packages.\n   You will work with both internal and external organizations to drive solutions for our customers. You\u2019ll also perform technical oversight, including on-site customer engagements and support customer and internal architectural discussions and requirements.\n   You will provide advice on all aspect of the Telecommunication Network design from Layer 0 to Layer 3, including RESTFul API, creating multi-disciplinary technical innovations and solutions for the most complex or risky business situations.\n   You will support regional engineering teams on specific project deliverables, enabling the regions to be self-sufficient on all aspects of the engineering business, from tools to technology, enabling the creation and outcomes of audit and optimization service of telecommunication networks.\n \n \n   You will develop and present complex network modernization end to end solutions and perform network audits and architecture design to enable the introduction of complete end to end network modernization.\n   You will validate and test specific procedural steps in Ciena or Customer equipment laboratory.\n   You will provide leadership and technical consultation services to all Ciena field service teams, ensuring the proposed solutions are technically viable, meet customer requirements and provide maximum benefit to Ciena.\n   You will support pre-sales customer service estimates and act as a subject matter expert to close a solution lead proposal.\n \n \n  What Does Ciena Expect of You?\n \n \n   Curiosity \u2013 Exploration and research is driven by insatiable curiosity.\n   Initiative \u2013 You\u2019re a self-starter who works with limited direction and is committed to delivering thoughtful, relevant and actionable insights.\n   Agility \u2013 you are readily able to make key decisions and manage competing and ever-changing account priorities.\n \n \n   Communication expertise \u2013 the ability to influence and tailor your message and ideas to the audience to ensure understanding and consensus.\n   An ability to go \u2018up and down the ladder\u2019 \u2013 capable of seeing the big picture, but also understanding the importance of details and analysis.\n   The flexibility to work independently and as part of a broader team \u2013 you thrive in a multi-disciplinary team environment, but are comfortable working independently as required.\n   Relationship builder \u2013 with an ability to influence, you\u2019re able to quickly develop trusted connections and influence outcomes. Become a \u201ctrusted advisor\u201d for the team, with our account executives and most importantly key external customers and researchers.\n   A commitment to innovation \u2013 you keep ahead of the market and competitive developments and are always keen to extrapolate current technologies into the future.\n \n \n  The Must Haves: \n \n \n  Excellent working knowledge of IP Networking protocols including OSPF, IS-IS, BGP, RSVP-TE, SR-MPLS, etc.\n   Understanding of Northbound integration language Netconf, YANG, SNMP, gNMI, etc.\n   Architecture experience with IP/MPLS networks across Tier 1 Service provider, Cloud Provider and Large Enterprise segments.\n   Previous experience in customer IP Network Architecture & Design, including managing successful customer engagements from initial requirements gathering, to HLD/LLD creation/validation, MOP execution and deployment.\n \n \n   Extensive IP Network Architecture/Design experience in planning and/or deploying IP/MPLS networks across a multitude of customer networks architectures (Access, Residential, Aggregation, Core, Peering, Data Center).\n   Ability to extract network design requirements through customer engagement and balance them with existing product capabilities to create a realizable/deployable design.\n   Minimum bachelor\u2019s degree in computer science, Management Information Systems, Engineering or a related field coupled with extensive experience in a functional and/or technical project lead role in the telecommunications industry. \n  Executive communication and leadership experience and a proven ability to build partnerships and influence others.\n   Strong technical writing and presentation skills.\n   15+ years of proven experience within a Professional Services organization, with demonstrated people and thought leadership experience & consultancy skills.\n   Advanced knowledge of IP protocols and networking devices/technologies, SAOS software from Ciena and MCP (Manage, Control and Planning) NMS system from Ciena.\n   Experience in data analytics and working experience with BI platforms as well as with various software development methodologies and DevOps toolchains to drive faster innovations.\n   Working knowledge with Programing Languages such as Python or Java and Relational and NoSQL Databases.\n   A strong technical background with a working knowledge of Ciena's optical and packet technologies.\n \n \n  Assets:\n \n   CCNP and CCNE certification.\n   Experience specifically in the telecommunications equipment vendor industry.\n   Advanced degree in computer science or engineering\n   Project management experience\n \n \n  At Ciena, we are committed to building and fostering an environment in which our employees feel respected, valued, and heard. Ciena values the diversity of its workforce and respects its employees as individuals. We do not tolerate any form of discrimination.\n \n  Ciena is an Equal Opportunity Employer, including disability and protected veteran status.\n \n  If contacted in relation to a job opportunity, please advise Ciena of any accommodation measures you may require."
}