{
    "id": "ac6c21ad1a27cb9a",
    "company": "General Dynamics Mission Systems - Canada",
    "positionName": "Graphics Specialist",
    "jobType": [
        "Permanent"
    ],
    "location": "Ottawa, ON",
    "salary": null,
    "postingDateParsed": "2024-01-27T12:12:16.161Z",
    "url": "https://www.indeed.ca/rc/clk?jk=ac6c21ad1a27cb9a&from=jasx&tk=1hl5db43ij458800&bb=KvwRMHBYecBH_BhsdnvHhvqh4zr8tYpjPPS0e4QMTmJn0xOH_iyOdHm4uHn9uD8WykroTQorY4H4hK2Y6Daw7QEgIjHcic0gQOhmMi-kuSA4LGGyNzPc6Q%3D%3D&xkcb=SoDh67M3FlSjXfRcgp0NbzkdCdPP&vjs=3",
    "externalApplyLink": "https://jobs.smartrecruiters.com/GDMSI/743999963251912-graphics-specialist",
    "job_info_group": {
        "extracted_phone_numbers": [],
        "extracted_links": [
            "HTTP/HTTPS Links",
            "General Links",
            "WWW Links",
            "TLDs"
        ],
        "extracted_emails": [
            "recruitment@gd-ms.ca"
        ],
        "extracted_location_data": [
            "Canada"
        ],
        "extracted_dates": [
            "Approximately 6 years",
            "Friday",
            "no two days",
            "May"
        ],
        "extracted_languages": [],
        "extracted_laws": [],
        "extracted_norps": [],
        "extracted_orgs": [
            "Human Resources via recruitment@gd-ms.ca",
            "Personalized Career Development",
            "Canadian Security Clearance",
            "an Educational Assistance Program",
            "Assist Team",
            "a Computer Graphics Specialist",
            "required Learn",
            "Wordpress",
            "Blender",
            "General Dynamics Mission Systems",
            "e.g. Webflow, Squarespace"
        ],
        "extracted_persons": [
            "Retouch"
        ],
        "extracted_products": [
            "e.g. Adobe Creative Suite"
        ],
        "extracted_money": [],
        "processed_text": "company description \u2013 focus extend engineering technology solution \u2014 dedicate cultivate career . mission establish workplace thrive diversity belief cultural background idea contribute collective strength . seek purpose drive career solve world's critical problem alongside bright engineering mind application . join community unique perspective propel innovation . description international Strategic Communications Marketing team play key role support design visually stunning immersive graphic variety digital application . emerge talent fresh perspective learn collaborate multidisciplinary team engineer designer marketer bring idea life innovative high quality graphic video . Graphic Design . spoiler alert dynamic team . design prepare wide variety digital occasion print medium text graphic sound animation \u2013 include traditional application product \u2013 support company activity create 2d 3d asset include illustration render animation video industry standard 3d graphic video audio editing tool electronic distribution e.g. webpage develop interactive application touchscreen leverage industry standard website software test imaging graphic software determine suitability occasion coordinate supplier include 3d model file sourcing house graphic printing photography videography visual trade project design graphic assemble trade exhibit prepare equipment mock enhance photo record equipment photo video require prepare electronic image design layout integrate output produce desire result . produce print artwork product plate backup final production plate Collaboration Development identify customer requirement apply appropriate cost effective viable process solution prepare storyboard final asset closely cross functional team understand project goal contribute creative discussion research technology good practice lead preparation project estimate guide assist junior team perform relate duty experiment emerge technology Quality Assurance Follow company graphic standard brand guideline ensure quality consistency graphic platform . conduct testing optimization ensure graphic performance . apply appropriate specification standard illustration graphic design . Qualifications Education Bachelor's degree college diploma graphic design illustration computer science discipline relevant equivalent level combine education Familiarity Hypertext Markup Language Additional Qualifications Proven computer graphic 2d 3d design video proficiency industry standard design video editing tool Maya Unity practice website design editing tool fundamental skill photography videography Strong portfolio showcase range graphic design animation project excellent collaboration communication skill fast pace dynamic environment maintain positive Controlled Goods Assessment . eligibility canadian Citizen Permanent Resident Additional Information success fuel individual diversity encourage application woman LGBTQ2+ community multi cultural background person . workplace accommodation require application process . require accommodation question contact . comprehensive benefit package reason employee stick enjoy model choice enjoy perk commitment foster healthy life balance . growth organization support . anticipate regular progress review access personalized development plan tailor aspiration . total reward Package consider cover \u2014 health dental . early access pension plan couple perk acknowledge contribution organization . apply workplace define ."
    },
    "companyDescription": "As one of Canada\u2019s largest, most established defence and security technology companies, General Dynamics Mission Systems\u2013Canada is a dynamic force in the business community, tapping into the skills and resources of Canadian suppliers, building Canada\u2019s manufacturing base, working with small businesses and Aboriginal companies, and supporting research and development; while providing an innovation-driven workplace for approximately 1,100 employees across Canada.\r\n\r\nWe provide advanced thinking, design expertise, and implementation know-how to equip military and first responders with leading-edge hardware, software and systems. \r\n\r\nOur business groups include: Land Communications, Airborne Mission Systems, Underwater Warfare and Public Safety & Security Solutions. \r\n",
    "description": "Company Description\n  At General Dynamics Mission Systems\u2013Canada, our focus extends beyond engineering technology solutions\u2014we are dedicated to cultivating careers. Our mission is to establish a workplace that thrives on diversity, where your beliefs, cultural background, experiences, and ideas are valued and contribute to our collective strength. If you seek a purpose-driven career solving some of the world\u2019s most critical problems, alongside some of the brightest engineering minds, your application is welcome. Join a community where your unique perspective propels innovation.\n  Job Description\n  As a Computer Graphics Specialist in our international Strategic Communications and Marketing team, you will play a key role in supporting the design of visually stunning and immersive graphics for a variety of digital applications. As an emerging talent with a fresh perspective, you will learn from and collaborate with our multidisciplinary team of engineers, designers, and marketers to bring ideas to life through innovative and high-quality graphics and videos.\n  Graphic Design\n  This is what most of your days will look like. Spoiler alert: no two days will be the same in our dynamic team.\n \n   Design and prepare a wide variety of digital, and on occasion, print media (text, graphics, sound and animation) \u2013 which may include traditional applications and products \u2013 in support of Company activities\n   Create 2D and 3D assets, including illustrations and renders, animations, videos and others, using industry standard 3D graphics and video/audio editing tools for electronic distribution (e.g. webpages)\n   Develop interactive applications for touchscreens, leveraging industry-standard website software\n   Test new imaging/graphics software to determine suitability\n \n  On occasion, you may be asked to:\n \n   Coordinate outside suppliers including 3D model file sourcing, in-house graphics, printing, photography, and videography, visual and trade show projects\n   Design graphics and assembles trade show exhibits; prepare equipment mock-ups for shows\n   Retouch or enhance photos and may use recording equipment to take photos/videos as required\n   Prepare electronic images, designs and page layouts; integrate output to produce desired results.\n   May produce and print artwork for product ID plates, and act as a backup for final production of ID plates\n \n  Collaboration and Development\n \n   Identify customer requirements and apply the most appropriate cost effective and viable processes/solutions to prepare storyboards and final assets\n   Work closely with cross-functional teams to understand project goals, and contribute to creative discussions\n   Research new technology and best practices\n   Assist Team Lead with preparation of project estimates; guides and assists junior team members; and performs other related duties as required\n   Learn from others and experiment with emerging technology\n \n  Quality Assurance\n \n   Follow company graphic standards/brand guidelines, ensuring quality and consistency of graphics across different platforms. Conduct testing and optimization to ensure graphic performance.\n   Apply the appropriate specification and standards to illustrations and graphic designs.\n \n  \n  Qualifications\n  Education/Experience\n \n   Bachelor's degree or college diploma in graphic design, illustration, computer science, or other related discipline\n   Approximately 6 years of relevant experience or equivalent level of combined education and experience\n   Familiarity with HTML 5\n \n  Additional Qualifications\n \n   Proven experience in computer graphics, 2D/3D design, and video\n   Proficiency in industry-standard design and video editing tools (e.g. Adobe Creative Suite, Blender, Maya, Unity)\n   Practice in website design using editing tools (e.g. Webflow, Squarespace, Wordpress)\n   Fundamental skills in photography and videography\n   Strong portfolio showcasing a range of graphic design and animation projects\n   Excellent collaboration and communication skills\n   Able to work in a fast-paced, dynamic environment\n \n  Must be able to obtain and maintain Canadian Security Clearance and a positive Controlled Goods Assessment. Eligibility to work in Canada either as a Canadian Citizen or Permanent Resident\n  Additional Information\n  Our success is fueled by individual diversity, encouraging applications from women, members of the LGBTQ2+ community, multi-cultural backgrounds, and persons with disabilities. We will work with you around any workplace accommodation required during our application process. If you require accommodation or have questions, please contact Human Resources via recruitment@gd-ms.ca.\n  Our comprehensive benefits package is just another reason our employees stick around, enjoy:\n \n   A Flexible Working Environment: Embracing a Hybrid work model with the choice of enjoying every other Friday off is more than a perk; it's a commitment to fostering a healthy work-life balance.\n   Personalized Career Development: Your growth within the organization is not just supported; it's valued. Anticipate regular progress reviews, access to an Educational Assistance Program, and a personalized development plan tailored to your aspirations.\n   Total Rewards Package: Consider it covered\u2014health, dental, and beyond. Early access to a pension plan, coupled with various perks to acknowledge your contributions to the organization.\n \n  Apply now to be a part of a workplace defined by who we are, and who we do it for."
}