{
    "id": "d489f25dfc3eb27d",
    "company": "Sunglass Hut",
    "positionName": "Sales Associate Sunglass Hut",
    "jobType": [
        "Part-time",
        "Casual"
    ],
    "location": "50 Rideau St, Ottawa, ON",
    "salary": null,
    "postingDateParsed": "2024-01-25T12:17:01.463Z",
    "url": "https://www.indeed.ca/rc/clk?jk=d489f25dfc3eb27d&from=jasx&tk=1hl5djsk1h7hv800&bb=xjPBkK6OIlrxY1Te1w3p5fe28-5wchkwDoEIJSzF1WXzFPah6w6h-ABZaVjs9si-AmXJKxQrg07jRPHvW3gPLdkKY7CSXuRY9L5loJSkygWr8g9fGoux2w%3D%3D&xkcb=SoCg67M3FlTATHzAAx0PbzkdCdPP&vjs=3",
    "externalApplyLink": "https://careers.essilorluxottica.com/job/Ottawa-Sales-Associate-Sunglass-Hut-ON-K1N-9J7/1028696501/",
    "job_info_group": {
        "extracted_phone_numbers": [
            "1-888-887-3348",
            "888-887-3348"
        ],
        "extracted_links": [
            "HTTP/HTTPS Links",
            "General Links",
            "WWW Links",
            "TLDs"
        ],
        "extracted_emails": [
            "HRCompliance@luxotticaretail.com"
        ],
        "extracted_location_data": [
            "the US",
            "North America",
            "Luxottica"
        ],
        "extracted_dates": [],
        "extracted_languages": [],
        "extracted_laws": [],
        "extracted_norps": [
            "Native Americans"
        ],
        "extracted_orgs": [
            "004088 Sunglass Hut Position",
            "Sunglass Hut",
            "N.A. Luxottica",
            "the Luxottica Ethics Compliance Hotline",
            "EssilorLuxottica",
            "Tribal Law",
            "GED Embrace"
        ],
        "extracted_persons": [],
        "extracted_products": [],
        "extracted_money": [],
        "processed_text": "requisition store casual Total reward benefit Incentive Information Sunglass Hut global leader sale premium sunglass retail store . join team grow bright retail offer competitive benefit valuable training unlimited growth . freedom expression inclusivity authenticity bring exclusive style high quality fashion performance sunglass . GENERAL function sale Associates vital success . bring authentic fun energic customer help find premium quality eyewear . MAJOR duty responsibility consistently deliver sale plan company objective cultivate exist customer relationship build brand loyalty . confidently provide exceptional customer connection attention detail offer personalized unique shopping result customer satisfaction . actively participate contribute positive store environment foster strong professional relationship peer management . pride appearance store initiative display inventory clean attractive organized . secure company asset one's control . help foster inclusive culture treat customer colleague respect . basic QUALIFICATIONS High School Diploma technology change high level accuracy accountability sale result sell skill drive meet goal .. strong communication skill oral write motivator demonstrate multi task respond flexibly change environment leader design manufacture distribution fashion luxury sport eyewear . employee pay determine multiple factor include geography qualification skill local minimum wage requirement . addition offer competitive bonus commission plan complement class total reward package . benefit include health care retirement saving pay vacation employee discount . request consistent applicable law provide reasonable accommodation individual assistance application hiring process . request reasonable accommodation provide contact information follow timely manner email . Equal Employer . qualified applicant receive consideration employment regard race color gender national origin social origin social condition perceive victim domestic violence sexual aggression stalk religion age sexual orientation gender identity expression citizenship ancestry veteran military status marital status pregnancy include unlawful discrimination basis legally protect pregnancy maternity leave genetic information characteristic protect law . receive preference ."
    },
    "companyDescription": "At Sunglass Hut, we're always in the sun. With us, you\u2019ll bring warmth into the hearts and souls of our customers and the world we live in. You\u2019ll feel the joy of our warm welcome from day one. Our uniqueness is what empowers us to shine in our light and be our true selves. We\u2019re people who work for people. Trust and authenticity always come first, in our relationships with one another and our communities. \r\n\r\nWe are a culture that wants to see you succeed, develop your customer expertise and care, and feel supported by people who embrace you.  We\u2019re here to unlock the entrepreneur and style expert in our team. From day one, every new thing you learn, every new opportunity you grab \u2013 your talents will shine and be recognized, incentivized, and rewarded. With every individual experience and achievement, we propel further together creating a dynamic space with endless possibilities to grow your career.\r\n\r\nA world leader in the specialty sunglass retail business with over 3,000 stores worldwide, we believe in the freedom of self-expression, inclusivity and authenticity, which is why we bring exclusive styles of high-quality fashion and performance sunglasses to all.\r\n\r\nAs part of EssilorLuxottica, global leader in the design, manufacture and distribution of ophthalmic lenses, frames and sunglasses, we are part of a network of 190,000 employees in 150 countries, committed to helping people around the world to see more and be more by addressing their evolving vision needs and personal style aspirations. \r\nBring every shade of you. Join Sunglass Hut. \r\n\r\nLearn more at https://www.sunglasshut.com/us/sunglasses/careers\r\n",
    "description": "Requisition ID: 833877\n   \n  Store #: 004088 Sunglass Hut\n   \n  Position:Casual Part-Time\n   \n  Total Rewards: \n  Benefits/Incentive Information\n \n  \n  \n \n  Sunglass Hut is a global leader in the sale of premium sunglasses with over 1600 retail stores across North America. By joining our team you'll grow with the brightest in retail!\n \n  \n  \n \n  We offer competitive benefits, valuable training, and unlimited growth opportunities.\n \n  \n  \n \n  We believe in the freedom of self-expression, inclusivity and authenticity, which is why we bring exclusive styles of high-quality fashion and performance sunglasses to all.\n \n  \n  \n \n   GENERAL FUNCTION \n \n \n  Our Sales Associates are vital to the success of Sunglass Hut. You will bring an authentic, fun and energic experience to all customers while helping them find premium quality eyewear.\n \n  \n  \n \n   MAJOR DUTIES AND RESPONSIBILITIES\n  \n  \n  Consistently deliver sales plan and company objectives through cultivating new and existing customer relationships building brand loyalty. \n  Confidently provides an exceptional customer experience through making a connection, attention to detail and offering a personalized and unique shopping experience resulting in customer satisfaction. \n  Actively participates and contributes to a positive store environment, fostering strong, professional relationships with peers and management. \n  Takes pride in the appearance of store and shows initiative to keep displays and inventory clean, attractive and organized. Secures all company assets under one\u2019s control. \n  Helps foster an inclusive culture by treating customers and colleagues with respect.\n \n  \n  \n \n   BASIC QUALIFICATIONS\n  \n  \n  High School Diploma or GED \n  Embrace new technology and change with high level of accuracy \n  Self-accountability for sales results through use of selling skills and a drive to meet goals.. \n  Strong communication skills (both oral and written) \n  Self-Motivator with a demonstrated ability to multi-task; ability to respond flexibly in a quickly changing environment \n  \n \n  Sunglass Hut is a part of Luxottica, N.A. Luxottica is a leader in the design, manufacture and distribution of fashion, luxury and sports eyewear.\n \n \n   Employee pay is determined by multiple factors, including geography, experience, qualifications, skills and local minimum wage requirements. In addition, you may also be offered a competitive bonus and/or commission plan, which complements a first-class total rewards package. Benefits may include health care, retirement savings, paid time off/vacation, and various employee discounts.\n   \n   Upon request and consistent with applicable laws, EssilorLuxottica will provide reasonable accommodations to individuals with disabilities who need assistance in the application and hiring process. To request a reasonable accommodation, please call the Luxottica Ethics Compliance Hotline at 1-888-887-3348 (be sure to provide your name and contact information so that we may follow up in a timely manner) or email HRCompliance@luxotticaretail.com.\n   \n   We are an Equal Opportunity Employer. All qualified applicants will receive consideration for employment without regard to race, color, gender, national origin, social origin, social condition, being perceived as a victim of domestic violence, sexual aggression or stalking, religion, age, disability, sexual orientation, gender identity or expression, citizenship, ancestry, veteran or military status, marital status, pregnancy (including unlawful discrimination on the basis of a legally protected pregnancy or maternity leave), genetic information or any other characteristics protected by law. Native Americans in the US receive preference in accordance with Tribal Law."
}