{
    "id": "ad1c71412a96d6aa",
    "company": "The Anglican Diocese of Ottawa",
    "positionName": "Donor Relations and Development Officer",
    "jobType": [
        "Permanent",
        "Full-time"
    ],
    "location": "71 Bronson Ave, Ottawa, ON",
    "salary": null,
    "postingDateParsed": "2024-01-09T03:10:11.926Z",
    "url": "https://www.indeed.ca/rc/clk?jk=ad1c71412a96d6aa&from=jasx&tk=1hjm3501uhbi2800&vjs=3",
    "externalApplyLink": null,
    "job_info_group": {
        "extracted_phone_numbers": [],
        "extracted_links": [
            "HTTP/HTTPS Links",
            "General Links",
            "WWW Links",
            "TLDs"
        ],
        "extracted_emails": [
            "hr@ottawa.anglican.ca"
        ],
        "extracted_location_data": [
            "Canada",
            "Ottawa",
            "western Quebec",
            "eastern Ontario",
            "Belong Ottawa"
        ],
        "extracted_dates": [
            "a 35-hour workweek",
            "3 weeks",
            "Monday"
        ],
        "extracted_languages": [],
        "extracted_laws": [],
        "extracted_norps": [
            "French"
        ],
        "extracted_orgs": [
            "Raiser's Edge",
            "Refugee Ministry Office",
            "the Director of Communications and Development",
            "(Customer Relationship Management",
            "the Accessibility for Ontarians with Disabilities Act",
            "Customer Relationship Management",
            "the Ontario Human Rights Code",
            "the Anglican Diocese of Ottawa",
            "Cornerstone Housing for Women",
            "Ottawa Pastoral Counselling Centre",
            "Perks & Benefits",
            "a dedicated Donor Relations and Development",
            "Ellwood House",
            "Your Skills & Qualifications"
        ],
        "extracted_persons": [
            "e.g. Hollyer House"
        ],
        "extracted_products": [],
        "extracted_money": [
            {
                "amount": "60,000.00-$65,000.00",
                "noun_phrases": []
            }
        ],
        "processed_text": "join dynamic team meaningful impact vast kilometer region span include . key player community service ADO serve local community focus social connection spiritual nourishment social justice compassionate service . seek Officer play pivotal role development stewardship strategy . purpose role nurture affinity stewardship cultivate key partner volunteer donor' continued support ADO initiative ministry . reporting integral innovative collaborative small team environment . cultivate maintain positive relationship internal external partner foster continue engagement support . include support parish ministry community ministry initiative affordable housing project . AreYou excited grow nonprofit space role showcase exceptional communication skill high standard donor relation activity include maintain accurate donor information donor database . drive spark vital financial support require community initiative ministry thrive . area grant development fundraising . ready impact stewardship introduce engage donor . exciting join team contribute building strategy process . Donor Relations Development Officer focus donor space donor relation research build nurture relationship individual corporate partner donor . collaborate achieve development goal support development effort strategize implement stewardship donor cultivation engagement strategy . Track Report oversee online donation maintain donor database accuracy process donation issue receipt prepare financial reconciliation report analyze create provide regular tracking report Post secondary education business profit management communication marketing field blend relevant education . demonstrate proven track record tangible example showcase capability achievement relevant area role . communication skill relationship building excellent write verbal skill strong cultivate maintain positive relationship key partner donor volunteer Project management business development result drive demonstrate manage multiple project simultaneously track record achieve exceed development financial goal Ethical Standards adherence ethical stewardship fundraising practice commitment maintain donor confidentiality Customer Relationship Management database management proficiency database effective donor tracking relationship management skilled generate report analyze campaign performance inform strategic decision making . business development sale advertising marketing consider role . offer comprehensive healthcare dental coverage define benefit pension plan generous employer contribution . collaborative environment celebrate innovation diversity . enjoy life balance generous compensation package include vacation . excite role apply diverse background . qualification essential range . click apply position submit application . dedicate review application forward receive application gratefully receive individual select consideration contact . organization commit create diverse environment equal employer . qualified applicant receive consideration employment regard race color religion gender gender identity expression sexual orientation national origin genetic age veteran status . accommodate applicant AODA . advise search process require accommodation contact type permanent salary benefit company pension Dental care insurance extended health care flexible schedule Flexible Language Requirement require schedule shift Friday Location person"
    },
    "companyDescription": "",
    "description": "Join our dynamic team and make a meaningful impact across a vast 46,620-kilometer region spanning eastern Ontario and western Quebec, including Ottawa, Canada.\nAs a key player in community service, the Anglican Diocese of Ottawa (ADO) serves over 50 local communities with a focus on social connection, spiritual nourishment, social justice, and compassionate service. We're seeking a dedicated Donor Relations and Development Officer to play a pivotal role in our development and stewardship strategy. The purpose of this role is to nurture affinity through stewardship to cultivate key partners, volunteers, and donors' continued support of ADO initiatives and ministries.\nWho We Need\nReporting to the Director of Communications and Development, you would be an integral part of working in an innovative, collaborative, small team environment. You\u2019ll cultivate and maintain positive relationships with internal and external partners, fostering continued engagement and support. This includes supporting our parish ministries and community ministries of Belong Ottawa, Centre 105, Cornerstone Housing for Women, Ottawa Pastoral Counselling Centre, and Refugee Ministry Office as well as initiatives like our affordable housing projects (e.g. Hollyer House, Ellwood House).\nWho You AreYou are excited to grow in the nonprofit space and are looking for a role where you can showcase your exceptional communication skills and high standards in donor relations activities, including maintaining accurate donor information in the donor database.\nYour drive will spark the vital financial support required for our community initiatives and ministries to thrive. You have experience in the areas of grant development and fundraising. You\u2019re ready to make an impact on stewardship and introduce new ways to engage donors. It\u2019s an exciting time to join the team and contribute to building strategies and processes.\nAs our new Donor Relations and Development Officer, you will:\n\n Focus on donor experience: You will own the space around donor relations, research, build, and nurture relationships with individual, corporate, and partnering donors.\n Collaborate to achieve development goals: You will support development efforts by strategizing and implementing stewardship, donor cultivation, and engagement strategies.\n Track and Report: You will oversee online donations and maintain donor database with accuracy and process donations, issue receipts, prepare financial reconciliation reports, and analyze, create, and provide regular tracking reports (Raiser\u2019s Edge)\n\nYour Skills & Qualifications:\n\n Post Secondary education: business, non-profit management, communications, marketing, or related field, or a blend of relevant experience and education.\n Demonstrated Experience: Proven track record and tangible examples showcasing capabilities and achievements in the relevant areas of the role.\n Communications skills and relationship building: Excellent written and verbal skills; strong ability to cultivate and maintain positive relationships with key partners, donors, volunteers\n Project management, business development, and results driven: demonstrated ability to manage multiple projects simultaneously; track record of achieving and exceeding development and financial goals\n Ethical Standards: Adherence to ethical stewardship, fundraising practices, and commitment to maintaining donor confidentiality\n CRM database management: Proficiency in using Customer Relationship Management (CRM) databases for effective donor tracking and relationship management; skilled in generating reports to analyze campaign performance and inform strategic decision making.\n Business development, sales, advertising, or marketing experience would be considered a plus for this role.\n\nPerks & Benefits\nWe offer comprehensive healthcare and dental coverage, and a defined benefit pension plan with generous employer contribution. You'll be part of a collaborative work environment that celebrates innovation and diversity. Enjoy work-life balance with a generous compensation package that includes a 35-hour workweek and 3 weeks of vacation.\nExcited about the role? Apply! We welcome diverse experiences and backgrounds. While certain qualifications are essential, we value a range of experiences. Click on \"Apply for This Position\" and submit your application.\nWe're dedicated to reviewing applications promptly and would look forward to receiving yours!\nWhile all applications will be gratefully received, only individuals selected for further consideration will be contacted.\nOur organization is committed to creating a diverse environment and is proud to be an equal-opportunity employer. All qualified applicants will receive consideration for employment without regard to race, color, religion, gender, gender identity or expression, sexual orientation, national origin, genetics, age, veteran status, or disability. We will accommodate the needs of applicants under the Ontario Human Rights Code and the Accessibility for Ontarians with Disabilities Act (AODA). Please advise during the search process if you require accommodation by contacting us at hr@ottawa.anglican.ca\nJob Types: Full-time, Permanent\nSalary: $60,000.00-$65,000.00 per year\nBenefits:\n\n Company pension\n Dental care\n Disability insurance\n Extended health care\n Flexible schedule\n\nFlexible Language Requirement:\n\n French not required\n\nSchedule:\n\n Day shift\n Monday to Friday\n\nWork Location: In person"
}