{
    "id": "cf2d12c9897bd865",
    "company": "Nutrition International",
    "positionName": "Senior Officer, Global Risk and Assurance",
    "jobType": [],
    "location": "180 Elgin St, Ottawa, ON",
    "salary": null,
    "postingDateParsed": "2024-01-17T05:12:46.895Z",
    "url": "https://www.indeed.ca/rc/clk?jk=cf2d12c9897bd865&from=jasx&tk=1hkiki05kk5qp800&bb=iO4yZqI4ohUn2TL4sGjb0h1Y7rYs1mKEIaLHiWK5I20DK0c5sdVykWNzckksTDZFTDp7SVE1nLwpfYIIOQR6v8lfOukASG2v9GTYRlYoV7JnrujuqoLCNQ%3D%3D&xkcb=SoA-67M3FShH06x1FB0GbzkdCdPP&vjs=3",
    "externalApplyLink": null,
    "job_info_group": {
        "extracted_phone_numbers": [],
        "extracted_links": [
            "HTTP/HTTPS Links",
            "General Links",
            "WWW Links",
            "TLDs"
        ],
        "extracted_emails": [],
        "extracted_location_data": [
            "Asia",
            "Canada",
            "Africa",
            "Ottawa"
        ],
        "extracted_dates": [
            "the year",
            "3 years",
            "four weeks",
            "February 4th",
            "2024 About",
            "Friday",
            "Monday"
        ],
        "extracted_languages": [
            "English"
        ],
        "extracted_laws": [],
        "extracted_norps": [
            "French"
        ],
        "extracted_orgs": [
            "e.g. CPA/CIA/CISA/Customer Relationship Management",
            "Global Risk and Assurance",
            "Infrequent International Travel",
            ": Internal Quality Assurance Executes Nutrition International's Internal Audit Policy",
            "Nutrition International's Corporate Services",
            "Nutrition International",
            "Nutrition International's",
            "IM/IT",
            "NI's Finance, Audit and Compensation Committee",
            "Executive Management",
            "Nutrition International's Counter Fraud Investigations",
            "Compliance, Contracting and Procurement",
            "Country, Regional or HQ",
            "RRSP match Vision care Wellness program Work",
            "Budget",
            "the Corporate Risk Register",
            "Information Management and Information Technology"
        ],
        "extracted_persons": [],
        "extracted_products": [],
        "extracted_money": [],
        "processed_text": "employment Type permanent timelocation HybridDeadline submission difference nutrition difference . weave fabric approach passion drive global team people office country common goal transform life people improved nutrition . motivated passionate individual share conviction improved nutrition leave find global team clear vision hear . consider apply position . team CS unit dedicated team Finance Administrative expert extensive global . unit lead provide global Accounting Finance Facilities management . currently seek application Senior Officer base . minimum compliance external internal audit enterprise risk management . international canadian auditing standard external internal audit combination prefer . accounting designation technical professional designation equivalent progress . develop policy procedure documentation handle multiple task simultaneously . capable supervise staff cross cultural interact international team . fluency require . consider asset . role role support independent objective assurance service manage coordinate organization internal audit function globally oversee global enterprise risk reporting assessment organization enterprise Risk Management ERM Framework . role . develop document Nutrition International's Internal Audit Plan yearly basis consider risk materiality rotation expenditure coverage ratio test design effectiveness internal control compliance donor policy procedure govern asset expenditure . execute internal audit plan mix desk field review organize manage internal audit team external audit firm consultant require . prepare standardized internal audit report clear observation recommendation management response follow action point agree assist Chief Financial Officer compile annual summary analysis report . actively participate coordinate relevant unit department level follow Nutrition International's Fraud Response Manual standard operating procedure . risk Management execute global risk reporting process ensure coordination follow support corporate risk reporting include country report Regions regional reporting HQ HQ unit report follow Nutrition International's Enterprise Risk Management Policy Framework . Consolidate Global Field Risk Register . provide subject matter expertise Risk Management practice include establish context identify risk analyze evaluate treat risk assist support team corporate specialized risk assessment business case project product system . workshop online email support . assist duty require include limit policy formulation process transformation system design internal control set . NI International office . require manage contact counterpart . offer competitive market pay pension health dental benefit professional development allowance flexible hour vacation public holiday . offer collaborative engage environment . selected current legal entitlement Permanent Residency Current Permit Citizenship USMCA eligibility reciprocal trade agreement . interest select interview contact . equal employer . celebrate diversity committed inclusive equitable accessible environment . request accommodation selection process . note offer conditional subject appropriate screening check satisfactory reference check . type Permanent benefit company event dental care insurance extended health care flexible schedule life insurance Paid require Schedule hour shift supplemental pay type bonus pay location hybrid remote K2P 2k3"
    },
    "companyDescription": "",
    "description": "Employment Type: Permanent, Full timeLocation: Ottawa, Canada - HybridDeadline for submission: February 4th, 2024\nAbout us\nAt Nutrition International, we make a difference, because nutrition is the difference.\nWoven into the very fabric of our approach is the passion and drive of our global team of over 600 people, working in 13 offices across 11 countries with one common goal: transforming the lives of people who need it most through improved nutrition.\nIf you are a motivated and passionate individual who shares our conviction that a better world is possible through improved nutrition, wants to leave the world a little better than they found it, and is looking to be part of a global team with a clear vision, we want to hear from you. Please consider applying for the position below.\nKnow our team\nNutrition International\u2019s Corporate Services (CS) unit is a dedicated team of Finance and Administrative experts with extensive global experience. The unit leads on providing global Accounting, Finance, Budget, and Compliance, Contracting and Procurement, Facilities management, and Information Management and Information Technology (IM/IT). Currently, Nutrition International is seeking applications for a Senior Officer, Global Risk and Assurance to be based in Ottawa, Canada.\nAbout you\nYou are someone with a minimum of 3 years of experience in compliance, external and internal audit, or enterprise risk management. International or Canadian auditing standards for external and internal audits or a combination of either is preferred. You have an accounting designation or other technical/professional designation (e.g. CPA/CIA/CISA/CRM or equivalent) obtained or in progress.\nYou are experienced in developing policies, procedures, and documentation and have the ability to handle multiple tasks simultaneously. You are capable of supervising staff and have the cross-cultural ability to interact with international teams.\nFluency in English is required. French will be considered an asset.\nAbout the role\nThis role will support the independent and objective assurance service to manage and coordinate the organizations internal audit function globally and oversee global enterprise risk reporting and assessments in line with the organizations Enterprise Risk Management (ERM) Framework.\nIn this role you will:\nInternal Quality Assurance\n\n Executes Nutrition International\u2019s Internal Audit Policy.\n Develops and documents Nutrition International\u2019s Internal Audit Plan on a yearly basis considering risks, materiality, rotation, expenditure coverage ratios, testing design and effectiveness of internal controls and compliance with Nutrition International\u2019s and/or donor policies and procedures governing assets and expenditure.\n Execute the internal audit plan for the year with a mix of self desk or field reviews, organizing and managing internal audit teams and using external audit firms or consultants as required.\n Prepare standardized internal audit reports with clear observations, recommendations, management responses and follow up on action points agreed and assist the CFO in compiling annual summary analysis for reporting to NI\u2019s Finance, Audit and Compensation Committee.\n Actively participates in or coordinates Nutrition International\u2019s Counter Fraud Investigations with relevant units and departments at Country, Regional or HQ levels by following Nutrition International\u2019s Fraud Response Manual and standard operating procedures.\n\nRisk Management\n\n Execute the global risk reporting process by ensuring coordination, follow up and support on corporate risk reporting including Country reporting to Regions, Regional reporting to HQ, and HQ unit reporting to Executive Management by following Nutrition International\u2019s Enterprise Risk Management Policy and Framework.\n Consolidate Global (Field) Risk Register and the Corporate Risk Register.\n Provides subject matter expertise on Risk Management practices, including establishing contexts, identifying risks, analyzing, evaluating, and treating risks by assisting and supporting teams with corporate or specialized risk assessments for business cases, new projects/product/systems etc. through workshops, online or email support.\n Assist in any other duties as required including but not limited to policy formulation, process transformation, system designs, internal control setting etc.\n\nInfrequent International Travel (up to 5%) to NI International offices in Africa and Asia.\nFlexible working hours are required to manage contact with counterparts in Africa and Asia.\nWhat we offer\nA competitive market pay, pension, health and dental benefits, professional development allowance, flexible work hours, and four weeks of vacation (plus public holidays). We offer a collaborative and engaging work environment.\nSelected candidates must have current legal entitlement to work in Canada (Permanent Residency, Current Work Permit, Citizenship, USMCA eligibility or other reciprocal trade agreement).\nWe thank you for your interest, however only those selected for an interview will be contacted.\nNutrition International is an equal opportunity employer. We celebrate diversity and are committed to an inclusive, equitable and accessible work environment. Upon request, accommodations due to a disability are available throughout the selection process.\nPlease note that all our offers are conditional subject to appropriate screening checks and satisfactory reference checks.\nJob Types: Full-time, Permanent\nBenefits:\n\n Company events\n Dental care\n Disability insurance\n Extended health care\n Flexible schedule\n Life insurance\n Paid time off\n RRSP match\n Vision care\n Wellness program\n Work from home\n\nFlexible Language Requirement:\n\n French not required\n\nSchedule:\n\n 8 hour shift\n Monday to Friday\n\nSupplemental pay types:\n\n Bonus pay\n\nWork Location: Hybrid remote in Ottawa, ON K2P 2K3"
}