{
    "id": "b0095bafbe8feaa8",
    "company": "LensCrafters",
    "positionName": "Sales Associate LensCrafters",
    "jobType": [
        "Part-time",
        "Casual"
    ],
    "location": "50 Rideau St, Ottawa, ON",
    "salary": null,
    "postingDateParsed": "2024-01-04T03:14:24.019Z",
    "url": "https://www.indeed.ca/rc/clk?jk=b0095bafbe8feaa8&from=jasx&tk=1hjm3csar2cja000&vjs=3",
    "externalApplyLink": "https://ca.indeed.com/applystart?jk=b0095bafbe8feaa8&from=vj&pos=top&mvj=0&spon=0&sjdu=o7sfz71MPdMgyiV0LZq0d4DDplm6SwWjHcxyoDIphKlUdkS3Pmu2Vcr83kVQRc9ZBJ6y5wMvOX1pQdKrNT6g7msPRPO2ARtu-IwV7rb6IHdNwWhNBU8BXGyWF65Tgp7dFfpG0TUQEGfEcgQ3KOd7P3GsaD0ZEB4zSPcNzivnRr9Rra4mzNAHcaVbdWV-d093w9_XINGINv7OnqX9-Wv1cg&vjfrom=serp&log=1&astse=cc2ae54050ddfd36&assa=3658",
    "job_info_group": {
        "extracted_phone_numbers": [
            "1-888-887-3348",
            "888-887-3348"
        ],
        "extracted_links": [
            "HTTP/HTTPS Links",
            "General Links",
            "WWW Links",
            "TLDs"
        ],
        "extracted_emails": [
            "HRCompliance@luxotticaretail.com"
        ],
        "extracted_location_data": [
            "the US",
            "North America",
            "Luxottica"
        ],
        "extracted_dates": [
            "over 35 years"
        ],
        "extracted_languages": [],
        "extracted_laws": [],
        "extracted_norps": [
            "Native Americans"
        ],
        "extracted_orgs": [
            "Luxottica",
            "N.A. Luxottica",
            "the Luxottica Ethics Compliance Hotline",
            "EssilorLuxottica",
            "Tribal Law",
            "Sales Associate"
        ],
        "extracted_persons": [],
        "extracted_products": [
            "every LensCrafters",
            "LensCrafters"
        ],
        "extracted_money": [],
        "processed_text": "requisition store LensCrafters Position casual Total reward benefit Incentive Information passionate bring people sight . people background . join team learn optical industry develop customer service sale technique grow career . large optical retailer + store eyewear industry leader high standard quality leader vision care . GENERAL function Sales Associate set standard quality eye care eyewear ensure patient customer good . role help establish premier destination vision community . MAJOR duty responsibility consistently deliver sale plan company objective cultivate exist customer relationship build . utilize optical prescription recommend specific lense lens coating . assist patient selection frame coordinate frame optical measurement assist customer choose perfect vision solution . conduct measurement appropriate optical tool consult Optician . actively participate contribute positive store environment foster strong professional relationship peer management doctor support staff Target Host partner . pride appearance store initiative display inventory clean attractive organized . helps foster inclusive culture treat customer colleague respect BASIC qualifications High School Diploma GED + retail customer service Familiarity point sale system computer calculator basic phone math skill embrace technology change high level accuracy sell sale skill accountability sale result desire meet goal strong communication skill oral write motivator demonstrate multi task respond flexibly change environment leader design manufacture distribution fashion luxury sport eyewear . employee pay determine multiple factor include geography qualification skill local minimum wage requirement . addition offer competitive bonus commission plan complement class total reward package . benefit include health care retirement saving pay vacation employee discount . request consistent applicable law provide reasonable accommodation individual assistance application hiring process . request reasonable accommodation provide contact information follow timely manner email . Equal Employer . qualified applicant receive consideration employment regard race color gender national origin social origin social condition perceive victim domestic violence sexual aggression stalk religion age sexual orientation gender identity expression citizenship ancestry veteran military status marital status pregnancy include unlawful discrimination basis legally protect pregnancy maternity leave genetic information characteristic protect law . receive preference ."
    },
    "companyDescription": "",
    "description": "Requisition ID: 831484\n   \n  Store #: 000961 LensCrafters\n   \n  Position:Casual Part-Time\n   \n  Total Rewards: \n  Benefits/Incentive Information\n \n  \n  \n \n  At LensCrafters, we're passionate about bringing people better sight. And it takes thousands of people from all backgrounds to do this.\n \n  \n  \n \n  By joining our team, you'll learn about the optical industry while developing the customer service and sales techniques needed to grow in your career.\n \n  \n  \n \n  LensCrafters is the largest optical retailer in North America with 1,000+ stores and as part of an eyewear industry leader, Luxottica, our higher standard of quality has made LensCrafters a leader in vision care for over 35 years.\n \n  \n  \n \n   GENERAL FUNCTION \n \n \n  The Sales Associate sets the standard of quality in eye care and eyewear by ensuring every patient and customer has the best experience in every LensCrafters every time. The role of Sales Associate helps establish LensCrafters as the premier destination for all vision needs in your community.\n \n  \n  \n \n   MAJOR DUTIES & RESPONSIBILITIES\n  \n  \n  Consistently deliver sales plan and company objectives through cultivating existing customer relationships and building new ones. \n  Utilizes optical prescription to recommend specific lenses and lens coatings. \n  Assists patients in the selection of frames and coordinates frames with optical measurements assisting our customers in choosing the perfect vision solution. \n  Conducts measurements using appropriate optical tools and consults with Optician as needed. \n  Actively participates and contributes to a positive store environment, fostering strong, professional relationships with peers, management, doctors and support staff (Target Host partners). \n  Takes pride in the appearance of store & shows initiative to keep displays & inventory clean, attractive & organized. \n  Helps foster an inclusive culture by treating customers and colleagues with respect\n \n  \n  \n \n   BASIC QUALIFICATIONS\n  \n  \n  High School Diploma or GED \n  1+ years experience in retail or customer service \n  Familiarity with point of sale systems, computers & calculators with basic phone and math skills \n  Embrace new technology & change with high level of accuracy \n  Ability to sell through use of sales skills and accountability for sales results, with a desire to meet goals \n  Strong communication skills (both oral and written) \n  Self-Motivator with a demonstrated ability to multi-task; ability to respond flexibly in a quickly changing environment\n \n  \n  \n \n   LensCrafters is a part of Luxottica, N.A. Luxottica is a leader in the design, manufacture and distribution of fashion, luxury and sports eyewear.\n \n \n   Employee pay is determined by multiple factors, including geography, experience, qualifications, skills and local minimum wage requirements. In addition, you may also be offered a competitive bonus and/or commission plan, which complements a first-class total rewards package. Benefits may include health care, retirement savings, paid time off/vacation, and various employee discounts.\n   \n   Upon request and consistent with applicable laws, EssilorLuxottica will provide reasonable accommodations to individuals with disabilities who need assistance in the application and hiring process. To request a reasonable accommodation, please call the Luxottica Ethics Compliance Hotline at 1-888-887-3348 (be sure to provide your name and contact information so that we may follow up in a timely manner) or email HRCompliance@luxotticaretail.com.\n   \n   We are an Equal Opportunity Employer. All qualified applicants will receive consideration for employment without regard to race, color, gender, national origin, social origin, social condition, being perceived as a victim of domestic violence, sexual aggression or stalking, religion, age, disability, sexual orientation, gender identity or expression, citizenship, ancestry, veteran or military status, marital status, pregnancy (including unlawful discrimination on the basis of a legally protected pregnancy or maternity leave), genetic information or any other characteristics protected by law. Native Americans in the US receive preference in accordance with Tribal Law."
}