{
    "id": "8de6e94a1bf0fa0b",
    "company": "SIRVA",
    "positionName": "Bilingual (French/English) Planning Session Agent (Temp-to-Perm)",
    "jobType": [
        "Full-time"
    ],
    "location": "Ottawa, ON",
    "salary": null,
    "postingDateParsed": "2024-01-27T12:12:43.824Z",
    "url": "https://www.indeed.ca/rc/clk?jk=8de6e94a1bf0fa0b&from=jasx&tk=1hl5db43ij458800&bb=KvwRMHBYecBH_BhsdnvHhnshULGRd-AKOUU_tNSuJargPyjdrVwHkDBM9xe7RrEjslxWpCR5Ewlad4PI-HC8l5I841TnEZxoxyRKbgyGo4iRUHVlqdFX-w%3D%3D&xkcb=SoCV67M3FlSjXfRcgp0BbzkdCdPP&vjs=3",
    "externalApplyLink": "https://jobs.dayforcehcm.com/en-US/sirva/CANDIDATEPORTAL/jobs/12936?source=Other%20(Please%20Specify)",
    "job_info_group": {
        "extracted_phone_numbers": [],
        "extracted_links": [
            "HTTP/HTTPS Links",
            "General Links",
            "WWW Links",
            "TLDs"
        ],
        "extracted_emails": [
            "HRSIRVA@SIRVA.com"
        ],
        "extracted_location_data": [],
        "extracted_dates": [
            "wellness program Generous company-paid vacation days"
        ],
        "extracted_languages": [],
        "extracted_laws": [
            "the prescribed Relocation Directive",
            "our Service Level Agreement"
        ],
        "extracted_norps": [],
        "extracted_orgs": [
            "SIRVA Worldwide Relocation and Moving",
            "(CSO",
            "Team Relocations",
            "CIISD",
            "Human Resources",
            "HRSIRVA@SIRVA.com",
            "Allied",
            "northAmerican, & SMARTBOX",
            "PWGSC",
            "TPSP",
            "SIRVA",
            "Brands"
        ],
        "extracted_persons": [],
        "extracted_products": [],
        "extracted_money": [],
        "processed_text": "role OverviewAs Planning Session Agent contribute Sirva's success provide relocation policy advice customer scheduled planning session channel \u2013 video chat . relocation advice administer meet expect level service require base . successful accept ownership effectively handle customer issue inquiry ensure customer satisfaction core decision . Deliver daily average minute planning session request Customers Record detailed note planning session Customer's profile reconcile relocation file ensure compliance Relocation Directive Review Customer's submit expense claim provide guidance require future claim submission effectively resolve complex relocation problem constraint Relocation Directive contact appropriate individual urgent emergency request ensure request handle timely manner identify area utilize skill knowledge improvement effectively manage fast pace environment administrative task include record keeping datum entry Assist General Inquiries claim team processing claim miscellaneous CAF communication expense management chat email phone voicemail advance claim payment perform administrative task support bring Sirva Background relocation service asset Professional starter assume additional responsibility flexible hour require previous customer support role contact center asset capable method communication simultaneously i.e. email video chat good interpersonal communication skill superior customer service skill orientation Collaborative style maintain professionalism stressful situation strong organizational skill plan manage constraint direct supervision Bilingualism asset foster belong encourage authenticity . inclusive diversity recognize behavior empower inspire positive action promote innovation . information reliability status security clearance grant require security clearance application facilitate Sirva Company Security Officer Sirva Offers competitive salary incentive plan workplace flexibility balanced life approach Comprehensive benefit package holiday challenging collaborative diverse corporate culture ongoing learning career development global leader relocation service offer solution mobility program company size . location franchise agent location country offer unmatched global breadth support localize attention innovative technology strike balance service human support . relocation household good commercial moving storage portfolio provide integrate relocation solution industry . leverage global network deliver superior shop provide . team globally provide good service locally mdash company . information visit . bring strong collaborative people dynamic culture mutual respect support passion brand product . innovation drive win performance constantly challenge good aspect business . surround bright driven people industry . great company committed cultivate workplace reflect diversity global organization serve . recognize build inclusive engage company culture result empowered employee reflect wide range approach perspective . perspective lead idea . idea lead innovation excellence . approach diversity equality inclusion drive commitment belief diversity company strong . equal employer . evaluate qualified applicant regard race color religion sex sexual orientation gender identity national origin age military status genetic information consideration unlawful applicable federal state local law . prohibit harassment applicant employee base protect category . reasonable accommodation employment process send email nature request contact information . type"
    },
    "companyDescription": "Sirva Worldwide, Inc. provides HR and mobility professionals with the resources, guidance, and support they need to achieve the best possible relocation for talent, and for the companies that move them. As a leading global relocation management and moving services company, we bring together personalized program solutions, expansive global reach, innovative technology, and an unmatched supply chain to transform businesses of any size and empower talent moving to their next opportunity. From corporate relocation and household goods to home sale and commercial moving and storage, our portfolio of brands (including Sirva, Allied, northAmerican, Global Van Lines, Alliance, Sirva Mortgage and SMARTBOX) provide everything needed to move talent and deliver experience.",
    "description": "Role OverviewAs a Planning Session Agent, you will contribute to Sirva\u2019s success by providing relocation policy advice to our Customers through scheduled planning sessions across different channels \u2013 telephone, video call, and chat. All relocation advice must be administered within the prescribed Relocation Directive, while also meeting the expected level of service as required based on our Service Level Agreement.\nThe successful candidate will be able to accept ownership for effectively handling customer issues and inquiries; ensuring customer satisfaction is at the core of every decision.\nWhat You\u2019ll Be Doing\n\n Deliver a daily average of seven 30 minute planning sessions as requested by Customers\n Record detailed notes for each planning session in the Customer\u2019s profile for future review\n Review and reconcile relocation files, ensuring compliance with the Relocation Directive\n Review Customer\u2019s submitted expense claims, while providing guidance as to what is required for future claims submissions\n Effectively resolve complex relocation problems within the constraints of the Relocation Directive\n Contact appropriate individuals for urgent and emergency requests to ensure requests are handled in a timely manner\n Identify areas of opportunity and utilize your skill and knowledge to suggest improvements\n Effectively manage your time while working in a fast-paced environment\n Various administrative tasks including record keeping and data entry\n Assist General Inquiries and Claims team with processing claims and miscellaneous CAF Member communication and expense management (chats, emails, phone calls, voicemails, advances, claims and TPSP payments)\n Perform various administrative tasks to support the Contact Centre\n\nWhat You Bring to Sirva\n\n Background in relocation services is an asset\n Professional, self-starter with the ability to assume additional responsibilities and work flexible hours as required\n Previous experience in a customer support role through a contact center is an asset\n Capable of using different methods of communication simultaneously; i.e. email, telephone, video call, and chat\n Good interpersonal and communication skills\n Superior customer service skills and orientation\n Collaborative style needed\n Ability to maintain professionalism at all times under stressful situations\n Strong organizational skills\n Ability to plan and manage work under time constraints, without direct supervision\n Bilingualism is an asset\n You foster belonging and encourage authenticity. You are inclusive, value diversity, and recognize that these behaviors empower and inspire positive action and promote innovation.\n\nOther Information:\n\n Reliability status security clearance granted by CIISD, PWGSC is required; the security clearance application will be facilitated via the Sirva Company Security Officer (CSO)\n\nWhat Sirva Offers\n\n Competitive salary and incentive plans\n Workplace flexibility for a balanced work/life approach\n Comprehensive benefits packages and wellness program\n Generous company-paid vacation days and holiday time\n Challenging, collaborative, diverse corporate culture\n Ongoing opportunities for learning and career development\n\nSIRVA Worldwide Relocation and Moving is a global leader in moving and relocation services, offering solutions for mobility programs to companies of every size. With 75 owned locations and more than 1,000 franchised and agent locations in 177 countries, we offer unmatched global breadth supported by localized attention and innovative technology that strikes the right balance of self service and human support. From relocation and household goods to commercial moving and storage, our portfolio of Brands (SIRVA, Team Relocations, Allied, northAmerican, & SMARTBOX) provides the only integrated moving/relocation solution in the industry. By leveraging our global network, we deliver a superior experience that only a \u201cone-stop shop\u201d can provide. We\u2019re a team that works globally to provide the best service locally &mdash; a company that is everything you need, everywhere you need it. For more information please visit www.sirva.com.\nSIRVA brings together strong, collaborative people in a dynamic culture of mutual respect, support, and passion for the brand and product. We believe innovation drives winning performance, and we constantly challenge ourselves to be the very best we can in every aspect of our business. You will be surrounded by some of the brightest and most driven people in the industry. At SIRVA, you will be in great company!\nAt SIRVA, we're committed to cultivating a workplace that reflects the diversity of the global organizations that we serve. We recognize that building an inclusive, engaged company culture results in empowered employees that reflect a wide range of approaches and perspectives. Those perspectives lead to new ideas. New ideas lead to innovation and excellence. Our approach to diversity, equality and inclusion is driven by a commitment to these values and a belief that diversity makes our company stronger.\nSIRVA is an equal opportunity employer. We evaluate qualified applicants without regard to race, color, religion, sex, sexual orientation, gender identity, national origin, age, disability, military status, genetic information or any other consideration made unlawful by applicable federal, state, or local laws. SIRVA also prohibits harassment of applicants and employees based on any of these protected categories.\nIf you need a reasonable accommodation because of a disability of any part of the employment process, please send an email to Human Resources at HRSIRVA@SIRVA.com and let us know the nature of your request and your contact information.\nJob Type: Full-time"
}