{
    "id": "4650d633d31bc847",
    "company": "La-Z-Boy Ottawa & Kingston",
    "positionName": "La-Z-Boy Sales Associate",
    "jobType": [],
    "location": "Ottawa, ON",
    "salary": null,
    "postingDateParsed": "2023-10-17T18:51:29.066Z",
    "url": "https://www.indeed.ca/rc/clk?jk=4650d633d31bc847&from=jasx&tk=1hcvfjcolkedt800&vjs=3",
    "externalApplyLink": null,
    "job_info_group": {
        "extracted_phone_numbers": [],
        "extracted_links": [
            "HTTP/HTTPS Links",
            "General Links",
            "WWW Links",
            "TLDs"
        ],
        "extracted_emails": [],
        "extracted_location_data": [],
        "extracted_dates": [
            "Day"
        ],
        "extracted_languages": [],
        "extracted_laws": [],
        "extracted_norps": [
            "French"
        ],
        "extracted_orgs": [
            "Google Suite",
            "La-Z-Boy Interior Designers",
            "La-Z-Boy",
            "The Sales Associate",
            "La-Z-Boy Team with Store",
            "Store",
            "Exceptional People",
            "Interior Designer",
            "La-Z-Boy Sales Associate",
            "Develop",
            "All Sales Associates"
        ],
        "extracted_persons": [],
        "extracted_products": [
            "Demonstrate"
        ],
        "extracted_money": [
            {
                "amount": "$45,000 - $",
                "noun_phrases": []
            },
            {
                "amount": "45,000.00-$70,000.00",
                "noun_phrases": []
            }
        ],
        "processed_text": "outgoing energetic ready build amazing place great living difference hire location comfort start + team globe transform power comfort . employee power change life community . foster inclusive environment honor legacy build family . Z boy's success people . prove record exceptional product represent invest growth . ready join industry lead organization people asset innovation propel future ready seat . TRANSFORMATIONAL POWER COMFORT summary basic function Sales Associate sell z boy product service . involve develop selling customer service skill train meet exceed company goal . responsible achieve store goal maintain trust loyalty z boy's customer team provide high level customer service . furniture service provide customer beautifully design showroom offer great team environment play achieve succeed . responsible create sale utilize exceptional customer service knowledge z boy selling process product service . Sales Associate strive create long term customer relationship lead increase sale profitability . Sales Associate develop awareness interior design practical observation interaction . Sales Representative team bring wide variety sale sales relate . previous high school college athlete hotel restaurant associate retail manager stay parent return . hire ambition attitude ethic train furniture knowledge sale process . best customer selective trust care . Key Responsibilities contribute store sale goal sell furniture accessory service offer Manager sell team promote Design Program drive store sale consistently execute Z Boy Comfort Selling Process provide positive clientele utilize sale skill principle include approach rapport building discovery customize portfolio presentation answer objection closing follow sale service continue contact previous potential clientele . maximize store promotion marketing initiative grassroot program maintain strong knowledge feature benefit product company standard z boy service internal software procedure assist Interior Designer achieve Design program sale goal scheduling consultation customize room design include sample fabric furniture table accessory recommendation benefit z boy professional design installation service provide store support incoming email scheduling customer delivery accurately complete order information collect payment clientele record assist handle customer concern provide appropriate solution alternative positive enthusiastic drive attitude alongside staff clientele . require qualification previous selling role asset strong interpersonal skill build rapport effectively communicate positively influence demonstrate persuasion negotiation skill flexible hour base business include evening weekend holiday strong attention detail proficiency proficiency general computer tablet z boy offer generous benefit package include health dental coverage long term life insurance grow lead brand furnishing potential earn average income . legal Disclaimer Equal Employer Z boy Incorporated subsidiary equal employer support subscribe policy nondiscrimination aspect employment . discriminate basis race colour national origin religion age sex pregnancy sexual orientation gender identity expression genetic information protect veteran status reason prohibit applicable law . type Permanent Compensation benefit dental care site parking discount range weekend availability Flexible Language Requirement asset shift hour shift Afternoon shift shift setting Specialty store Location person expect start Report type salary benefit dental care Vision care shift hour shift setting Specialty store sale preferred location person"
    },
    "companyDescription": "",
    "description": "La-Z-Boy Sales Associate\nAre you outgoing and energetic? Are you ready to build something amazing?Are you looking for a place to make a great living AND make a difference?\nWe are hiring NOW in our Ottawa locations!\nComfort starts with our 13,000+ team members across the globe, who are transforming the power of comfort every day. Our employees have the power to change lives, in our homes, work and communities. We foster an inclusive environment while honoring a legacy built on family, where everyone can be themselves.\nLa-Z-Boy's success is due to our people. We have a proven record of exceptional products represented by Exceptional People and are invested in their growth.\nIf you are ready to join an industry leading organization where our people are the most important asset, and innovation propels us into the future, you\u2019re ready to take your seat at La-Z-Boy Canada Retail Incorporated.\nWE BELIEVE IN THE TRANSFORMATIONAL POWER OF COMFORT\nJob Summary:\nThe basic function of the Sales Associate is to sell La-Z-Boy products and services. This involves using and developing all selling and customer service skills trained to meet and exceed company goals. All Sales Associates are responsible for achieving store goals and maintaining the trust and loyalty of all of La-Z-Boy\u2019s customers and team members and providing the highest level of customer service.\nFrom our furniture and the services we provide to our customers, to our beautifully designed showrooms, we offer a great team environment to work, play, achieve, and succeed. The Sales Associate is responsible for creating sales utilizing exceptional customer service and knowledge of the La-Z-Boy selling process, products and services. The Sales Associate strives to create long-term customer relationships that will lead to increased sales and profitability. The Sales Associate develops awareness of interior design through practical experience, observation and interaction with La-Z-Boy Interior Designers.\nOur Sales Representative team members bring a wide variety of sales and non-sales-related experience. We have previous high school and college athletes, hotel/restaurant associates, retail managers, stay-at-home parents returning to work and much more. We hire for ambition, attitude and ethics then train for furniture knowledge and sales process. We have the BEST customers in the world and are very selective about who we trust to care for them.\nKey Responsibilities\n\n Contribute to store sales goals by selling furniture, accessories, and services offered by La-Z-Boy\n Team with Store Manager, Interior Designer, and selling team to promote the In-Home Design Program and drive overall store sales\n Consistently execute the La-Z-Boy Comfort Selling Process and provide a positive experience for all clientele\n Develop and utilize sales skills and principles including approach, rapport building, needs discovery, customized portfolio presentations, answering objections, closing, follow-up, after sale service, and continuing contact with all previous and potential clientele.\n Maximize store promotions, marketing initiatives and grassroots programs\n Maintain strong knowledge of features and benefits of product line-up, company standards, La-Z-Boy services, and internal software and procedures\n Assist the Interior Designer to achieve Design program sales goals by scheduling consultations, to present customized room designs, including sample fabrics, furniture, tables and accessories recommendations as well as the benefits of the La-Z-Boy professional design and installation services\n Provide store support for incoming calls and emails and scheduling customer deliveries\n Accurately complete order information, collect payments, keep clientele records\n Assist in handling customer concerns by providing appropriate solutions and alternatives\n Demonstrate a positive, enthusiastic, driving attitude working alongside staff and clientele.\n\nRequired Qualifications:\n\n Previous experience in a selling role is an asset\n Strong interpersonal skills to build rapport, effectively communicate, and positively influence\n Demonstrated persuasion and negotiation skills\n Ability to work flexible hours based on the needs of the business including evenings, weekends and holidays\n Strong attention to detail with proficiency in Google Suite and proficiency with general use of computers and tablets\n\nLa-Z-Boy offers a generous benefits package including health and dental coverage, long-term disability and life insurance, and the opportunity to grow in the leading brand in home furnishings with the potential to earn an above average income.\nLegal Disclaimer: An Equal Opportunity Employer, La-Z-Boy Incorporated and its subsidiaries are equal opportunity employers that support and subscribe to a policy of nondiscrimination in all aspects of employment. La-Z-Boy will not discriminate on the basis of race, colour, national origin, religion, age, sex, pregnancy, sexual orientation, gender identity or expression, disability, genetic information, protected veteran status, or any other reason prohibited by applicable law.\nJob Types: Full-time, Permanent\nCompensation: $45,000 - $70,000.00\nBenefits:\n\n Dental care\n On-site parking\n Store discount\n\nDay range:\n\n Weekend availability\n\nFlexible Language Requirement:\n\n French is an asset\n\nShift:\n\n 8 hour shift\n Afternoon shift\n Day shift\n\nWork setting:\n\n Specialty store\n\nWork Location: In person\nExpected start date: November 2023\nReport job\nJob Type: Full-time\nSalary: $45,000.00-$70,000.00 per year\nBenefits:\n\n Dental care\n Vision care\n\nShift:\n\n 8 hour shift\n\nWork setting:\n\n Specialty store\n\nExperience:\n\n sales: 1 year (preferred)\n\nWork Location: In person"
}