{
    "id": "9139f6c99f7c7c04",
    "company": "SPS Global",
    "positionName": "Lobby/Office Receptionist",
    "jobType": [
        "Full-time"
    ],
    "location": "SPS Global in Ottawa, ON",
    "salary": null,
    "postingDateParsed": "2024-01-27T12:12:53.273Z",
    "url": "https://www.indeed.ca/rc/clk?jk=9139f6c99f7c7c04&from=jasx&tk=1hl5db43ij458800&bb=KvwRMHBYecBH_BhsdnvHhvlkk4vKC6TYW3VYArFL6VGoawFkiB9MOxfLXh4kpWhQTU_UHyDxET2Z-WoNGlaKBdudWTzhxwq5Xz_2_156To9EBf6CxE735Q%3D%3D&xkcb=SoBG67M3FlSjXfRcgp0IbzkdCdPP&vjs=3",
    "externalApplyLink": null,
    "job_info_group": {
        "extracted_phone_numbers": [],
        "extracted_links": [
            "HTTP/HTTPS Links",
            "General Links",
            "WWW Links",
            "TLDs"
        ],
        "extracted_emails": [],
        "extracted_location_data": [
            "Ottawa"
        ],
        "extracted_dates": [
            "At least 2 years",
            "2 years",
            "2+ years",
            "the end of the year",
            "Monday"
        ],
        "extracted_languages": [],
        "extracted_laws": [],
        "extracted_norps": [],
        "extracted_orgs": [
            "SPS",
            "a Medical, Dental, Life, ADandD and LTD, Employee Assistance Program",
            "other professional services SPS",
            "Us SPS",
            "Secondary School",
            "Administrative, Information Technology",
            "Microsoft Outlook",
            "Mailroom",
            "Microsoft Suite",
            "other Guest Services"
        ],
        "extracted_persons": [],
        "extracted_products": [],
        "extracted_money": [],
        "processed_text": "explore power possibility career excellent experienced Lobby Office Receptionist grow team position ideal relevant stable place learn develop . cross functional team eager lasting contribution offer competitive benefit package include offering fulltime permanent position RRSP match . month probation period benefit pay leave client shutdown . employee vacation schedule \u2013 demonstrate flexibility satisfy customer demand high volume production environment consistently adhere business practice guideline policy direction supervisor site manager participate cross training maintain log report documentation attention detail adhere safety procedure prove customer service office representative role . excellent verbal write communication skill . proficiency Microsoft Office Suite . effectively individually team fast pace environment . resourceful proactive issue competency perform multiple functional task . meet employer's attendance policy . willingness cross training function . lift lb . maximum allow current State Law accommodation sit stand long period reasonable accommodation responsibility maintain positive empathetic professional attitude customer . serve visitor greeting direct appropriately . ensure visitor office possess badge i.e. employee temporary guest badge notifies employee contractor visitor arrival . answer screen forward incoming phone . correspond email . provide special project administrative support ad hoc basis . effectively address resolve client customer concern complaint . responsible submit case company case management system maintenance janitorial issue regard lobby follow ensure timely completion . datum entry word processing . statistical datum service provide . ensure reception area tidy presentable stationery material processing incoming outgoing mail package global outsourcing organization offer business document processing service . client Fortune company sector advertising investment banking corporate fashion finance law operate country worldwide provide specialized workplace support function area Document Production . committed deliver high caliber outsourcing client offer employee challenge exciting career North America region globally . commit invest professional development employee offer competitive comprehensive benefit diverse development training program lead building career . embrace uniqueness employee committed fair equal treatment people applicant employee promote culture access inclusion equity diversity . provide equal employment EEO employee applicant employment regard race color religion sex sexual reproductive health choice national origin age genetic military status gender identity expression sexual orientation status protect law . posting snapshot design cover duty assign position . description find company website . type benefit dental care Employee assistance program extended health care Paid RRSP match vision care schedule hour shift shift Friday Overtime Education preferred desk prefer administrative prefer receptionist preferred office prefer hospitality prefer Customer service prefer commute require location person"
    },
    "companyDescription": "WE CONNECT THE PHISICAL AND DIGITAL WORLDS\r\nSPS is a global market leader in the field of Business Process Services for Document Management solutions, leveraging digitalization and new technologies. With its 8'000 employees and a global rollout spread across more than 20 countries, SPS is addressing needs of clients from various sectors such as banking, insurance and other professional services, including many Fortune 500 companies.",
    "description": "Come explore the Power of Possibility with a career at SPS!\nWe have an excellent opportunity for an experienced Lobby/Office Receptionist to come grow with our team in Ottawa, ON! This full-time position is ideal for someone with 2+ years of relevant experience looking for a stable place to work, learn, and develop. We are a cross functional team looking for someone eager to make a lasting contribution!\nSPS offers a competitive benefits package including offerings of: A fulltime (permanent) position with a Medical, Dental, Life, AD&D and LTD, Employee Assistance Program, RRSP(match). [After the 3 month probation period benefits are available, with paid leave at the end of the year for client shutdown. On top of employee vacation]\nSchedule: Typically Monday - Friday, 8:00 am \u2013 5:00 pm\nWhat you will be doing: \n\n Demonstrating flexibility in satisfying customer demands in a high volume, production environment\n Consistently adhering to business practice guidelines and policies\n Taking direction from supervisor or site manager\n Participating in cross-training\n Maintaining all logs and reporting documentation with attention to detail\n Adhering to all safety procedures\n\nWhat we need from you: \n\n At least 2 years of proven work experience in customer service, front office representative, or similar role.\n Excellent verbal and written communication skills.\n Proficiency in Microsoft Office Suite.\n Ability to effectively work individually or within a team in a fast-paced environment.\n Ability to be resourceful and proactive when issues arise\n Competency in performing multiple functional tasks.\n Ability to meet employer's attendance policy.\n Willingness to cross-training for other job functions.\n Ability to lift up to 40 lbs. or maximum allowed by current State Law with or without accommodations\n The ability to sit and/or stand for long periods of time with or without reasonable accommodation\n\nResponsibilities:\n\n Maintaining a positive, empathetic, and professional attitude toward customers at all times.\n Serves visitors by greeting, welcoming, and directing them appropriately.\n Ensure all visitors into the office possess a badge i.e. employee, temporary or guest badge\n Notifies employees or contractors of visitor arrival.\n Answer, screen, and forward incoming phone calls.\n Corresponding via email using Microsoft Outlook.\n Provide special project and administrative support on an ad hoc basis.\n Effectively addressing and resolving client and customer concerns and/or complaints.\n Responsible for submitting cases through the company\u2019s on-line case management system for all maintenance or janitorial issues regarding the lobby as well as following up as needed to ensure timely completion.\n Data entry & word processing using Microsoft Suite.\n Keeping statistical data on services provided.\n Ensure reception area is tidy and presentable, with all necessary stationery and materials\n Processing of incoming and outgoing mail and packages\n\nAbout Us \nSPS is a global outsourcing organization that offers both business and document processing services. Our clients are Fortune 500 companies in sectors such as advertising, investment banking, corporate, fashion, finance, law, and other professional services SPS operates in more than 15 countries worldwide providing specialized workplace support functions in areas such as Administrative, Information Technology, Mailroom, Document Production, and other Guest Services. \nSPS is committed to delivering high caliber outsourcing experience to our clients and offering our employees challenging and exciting career opportunities throughout the North America region and globally. SPS is committed to investing in the professional development of our employees and offers competitive comprehensive benefits and diverse development training programs that leads to building careers. \nAt SPS we embrace the uniqueness of our employees and are committed to the fair and equal treatment of all people, applicants, and employees by promoting a culture of access, inclusion, equity, and diversity. SPS provides equal employment opportunities (EEO) to all employees and applicants for employment without regard to race, color, religion, sex, sexual and reproductive health choices, national origin, age, disability, genetics, military status, gender identity or expression, sexual orientation and/or any other status protected by law. \nThis job posting is a snapshot and not designed to cover all duties assigned to this position. A full job description can be found on our company website. www.spsglobal.com\nJob Type: Full-time\nBenefits:\n\n Dental care\n Employee assistance program\n Extended health care\n Paid time off\n RRSP match\n Vision care\n\nSchedule:\n\n 8 hour shift\n Day shift\n Monday to Friday\n Overtime\n\nEducation:\n\n Secondary School (preferred)\n\nExperience:\n\n Front desk: 2 years (preferred)\n Administrative experience: 2 years (preferred)\n Receptionist: 2 years (preferred)\n Office: 2 years (preferred)\n Hospitality: 2 years (preferred)\n Customer service: 2 years (preferred)\n\nAbility to Commute:\n\n Ottawa, ON K2K 3E8 (required)\n\nWork Location: In person"
}