{
    "id": "4bcdcbd0048d301f",
    "company": "The Ottawa Hospital",
    "positionName": "Manager, Research Services",
    "jobType": [
        "Full-time"
    ],
    "location": "Ottawa, ON",
    "salary": null,
    "postingDateParsed": "2024-01-24T12:17:31.195Z",
    "url": "https://www.indeed.ca/rc/clk?jk=4bcdcbd0048d301f&from=jasx&tk=1hl5dju1ci4nl800&bb=gCzgXPzOG1uTP-CnMJvHBfIH6rldxKFe7mpZRPeX1ZeCBe_7dSyCSmi7myoFk7bDPI4Wtjl7v64J8SLWCVNLMfZ0t5RYdsPJa_5vW7XrIWZL4O0dDoNDug%3D%3D&xkcb=SoAV67M3FlTAH9xNAp0NbzkdCdPP&vjs=3",
    "externalApplyLink": "https://ohhcmdmzweb01.ottawahospital.on.ca/psc/HRPRD/?cmd=login&errorPg=ckreq&languageCd=ENG",
    "job_info_group": {
        "extracted_phone_numbers": [],
        "extracted_links": [
            "HTTP/HTTPS Links",
            "General Links",
            "WWW Links",
            "TLDs"
        ],
        "extracted_emails": [
            "domcareers@toh.ca"
        ],
        "extracted_location_data": [],
        "extracted_dates": [
            "7 years",
            "today"
        ],
        "extracted_languages": [
            "both English"
        ],
        "extracted_laws": [],
        "extracted_norps": [
            "French"
        ],
        "extracted_orgs": [
            "DOM",
            "the Research Plus Program",
            "The Ottawa Hospital",
            "Research Services",
            "the Department of Medicine",
            "The San Francisco Declaration on Research Assessment",
            "DORA",
            "Technical Solutions Office",
            "the University of Ottawa Medical Associates",
            "the Accessibility for Ontarians with Disabilities Act",
            "the Ottawa Hospital",
            "The University of Ottawa Medical Associates",
            "Medical Education Research",
            "the Research Office"
        ],
        "extracted_persons": [
            "DoM",
            "scientometric"
        ],
        "extracted_products": [],
        "extracted_money": [],
        "processed_text": "position Information report Vice Chair VC Research Manager responsible positive culture development implementation maintenance practice permit delivery high quality efficient research coordination service build excellence capacity respond research portfolio . include manage team administration distribution workload communicate team perform quality control assurance activity require . Manager develop process procedure ensure fair equitable access resource identify address improve process support facilitate project communication increase research productivity impact . rotation shift hour shift . responsibility VC Research VC Support TSO develop maintain online 'hub ' researcher navigate complexity researcher environment ensure equity access Office service resource manage staff prioritize delegate workload meet multiple demand ensure deadline meet provide guidance training coaching Research Office employee provide operational support Vice Chair Research include prepare manage annual Office budget monitor office\u00bfs program service offering appropriate recommendation capitalize mitigate risk resolve issue build maintain productive supportive relationship facilitate research provide advice guidance funding complex REB submission ethic proposal publication . manage compliance limitation maintenance internal research output measurement system coordinate operational support Director develop strategy increase visibility DoM's research accomplishment promote research event activity . Basic Requirements Minimum clinical research academic hospital prefer include limit clinical trial management academic lead study Familiarity research ethic guideline application REB requirement Familiarity concept demonstrate relevant clinical research knowledge minimum supervisory management working knowledge clinical research standard regulation govern human research ethic set priority pressure meet deadline attention detail leadership mentor create positive working relationship demonstrate tact diplomacy manage budget metric reporting handle highly sensitive confidential information excellent interpersonal verbal write communication skill Client service orient effectively highly diverse environment exercise judgement decision minimal supervision proficiency speak comprehend Level b+ asset . interested apply apply exciting forward resume cover letter quote corresponding position title email notice support staff employee . paymaster employee . employee office employ . committed principle equal employment practice provide environment free discrimination harassment employee . request provide accommodation ."
    },
    "companyDescription": "The Ottawa Hospital is one of Canada\u2019s largest learning and research hospitals, with more than 1,100 beds, approximately 12,000 staff members and an annual budget of about $1.2 billion. \r\n\r\nOur focus on learning and research helps us develop new and innovative ways to treat patients and improve care. As a multi-campus hospital affiliated with the University of Ottawa, we deliver specialized care to the Eastern Ontario region, but our techniques and research discoveries are adopted around the world. We engage the community at all levels to support our vision for better patient care.\r\n\r\nFrom the compassion of our people to the relentless pursuit of new discoveries, The Ottawa Hospital never stops seeking solutions to the most complex health-care challenges.",
    "description": "Position Information\n   \n     \n    \n      \n     \n     Reporting to the Vice Chair (VC) of Research, the Manager, Research Services is responsible for a positive work culture, the development, implementation, and maintenance of work practices to permit the delivery of high-quality and efficient research coordination services while building excellence and capacity to respond to the research portfolio within the Department of Medicine (DoM). This includes managing a team, the administration and distribution of workload, communicating across teams, and performing quality control and assurance activities as required. The Manager develops processes and procedures, ensures fair and equitable access to resources, and identifies and addresses opportunities to improve processes and support and facilitate projects and communication to increase research productivity and impact. \n    \n   \n  \n \n \n  \n    Rotation/Shifts\n   \n     \n    \n      \n     \n     Days, 8 hour shifts. \n    \n   \n  \n \n \n  \n    Responsibilities\n   \n     \n    \n      \n     \n     \n      Work with the VC of Research, the VC of Member Support, and Technical Solutions Office (TSO) to develop and maintain an online 'hub' for researchers to navigate the complexity of the researcher environment;\n      Ensures equity in accessing Office services and resources;\n      Manages the staff of the Research Office, prioritizes and delegates workload to meet multiple demands, ensuring deadlines are met; provides guidance/training/coaching to Research Office employees;\n      Provide operational support to Vice-Chair of Research, including preparing and managing the annual Office budget;\n      Monitors the Office\u00bfs programs and service offerings and makes appropriate recommendations to capitalize on opportunities, mitigate risk, and resolve issues;\n      Build and maintain productive and supportive relationships to facilitate research within DOM;\n      Provide advice and guidance on funding opportunities, complex REB submissions, ethics proposals, publications, etc.;\n      Manage compliance, limitations, and maintenance of the internal research output measurement system;\n      Coordinate operational support for the Research Plus Program and the Director, Medical Education Research;\n      Works to develop strategies to increase the visibility of DoM's research accomplishments and promote research events and activities.\n      \n    \n   \n  \n \n \n  \n    Basic Requirements\n   \n    \n     \n       \n     \n     \n       \n      \n       Minimum of 7 years of experience in clinical research at an academic hospital is strongly preferred, including but not limited to clinical trial management, and academic-led studies;\n       Familiarity with scientometric;\n       Experience with research ethics guidelines, applications and REB requirements;\n       Familiarity with concepts of The San Francisco Declaration on Research Assessment (DORA);\n       Demonstrated relevant clinical research knowledge;\n       A minimum of 5 years supervisory/management experience;\n       Working knowledge of clinical research standards and regulations governing human research ethics;\n       Ability to set priorities, work under pressure and meet deadlines with an attention to detail;\n       Experience in leadership, mentoring, and creating positive working relationships, demonstrating tact and diplomacy;\n       Experiencing with managing a budgets and metric reporting;\n       Ability to handle highly sensitive and confidential information;\n       Excellent interpersonal, verbal, and written communication skills;\n       Client service oriented, with the ability to work effectively in a highly diverse environment;\n       Ability to exercise judgement and make decisions while working with minimal supervision;\n       Proficiency in speaking and comprehending both English and French (Level B+) is an asset .\n      \n      \n    \n   \n  \n \n \n  \n    Interested? Apply today!\n   \n     \n    \n      \n     \n     To apply for this exciting opportunity, please forward your resume and cover letter, quoting the corresponding position title, by email at domcareers@toh.ca\n      IMPORTANT NOTICE: Support staff are employees of the University of Ottawa Medical Associates. The Ottawa Hospital is the paymaster of our employees. Although our employees have offices within the Ottawa Hospital, they are not employed by the Ottawa Hospital. The University of Ottawa Medical Associates is committed to the principle of equal opportunity in its employment practices and to providing an environment free from discrimination and harassment for all employees. The University of Ottawa Medical Associates will, upon request, provide accommodations in accordance with the Accessibility for Ontarians with Disabilities Act."
}