{
    "id": "78b02fa9681c17b0",
    "company": "Marriott International, Inc",
    "positionName": "Bellperson/ Valet",
    "jobType": [],
    "location": "101 Lyon St N, Ottawa, ON",
    "salary": null,
    "postingDateParsed": "2024-01-19T05:09:03.303Z",
    "url": "https://www.indeed.ca/rc/clk?jk=78b02fa9681c17b0&from=jasx&tk=1hkikb4a7k5qp800&bb=lTPy9GC8AEMesPUlCsHFKnWfqjeLadb6RJI84C33zezf2KxPYBPkG6HHGLNItnoSyPrztHAmgOkiamXxHDM3xCwJORjsOQGAnIDFcEBjEYPnCrh-NjJHDw%3D%3D&xkcb=SoC-67M3FSgjV4x1FB0GbzkdCdPP&vjs=3",
    "externalApplyLink": "https://jobs.marriott.com/marriott/jobs/24010863?lang=en-us&utm_medium=jobboard&utm_source=indeed",
    "job_info_group": {
        "extracted_phone_numbers": [
            " 905-366-5227",
            "905-366-5227"
        ],
        "extracted_links": [
            "HTTP/HTTPS Links",
            "General Links",
            "WWW Links",
            "TLDs"
        ],
        "extracted_emails": [
            "CanadaApplicationAccommodation@marriott.com"
        ],
        "extracted_location_data": [
            "the United States",
            "Canada",
            "Ottawa",
            "the United Kingdom"
        ],
        "extracted_dates": [
            "2005"
        ],
        "extracted_languages": [],
        "extracted_laws": [],
        "extracted_norps": [],
        "extracted_orgs": [
            "Marriott International",
            "Delta Hotels",
            "email CanadaApplicationAccommodation@marriott.com",
            "the Accessibility for Ontarians with Disabilities Act",
            "Nova Scotia Accessibility Act",
            "Delta Hotels Ottawa City Centre",
            "Marriott"
        ],
        "extracted_persons": [
            "ONT"
        ],
        "extracted_products": [],
        "extracted_money": [],
        "processed_text": "Additional Information Weekends Evenings Drivers License number Category Rooms Guest Services Operations Location Delta Hotels City Centre view MAP schedule located remotely Relocation Position Type management position SUMMARY Greet escort guest room . open door assist guest visitor enter leave property . inform guest property amenity service operation local area interest activity . identify explain room feature guest e.g. room key mini bar ice vending area room safe valet laundry service . transport guest luggage guest room designate bell area . assist luggage storage retrieval . assist guest visitor vehicle include assist guest loading unloading luggage . supply guest direction . arrange transportation e.g. taxi cab shuttle bus limousine sedan service guest visitor record advance transportation request . communicate parking procedure guest visitor . follow company policy procedure report accident injury unsafe condition manager . maintain awareness undesirable person property premise . ensure uniform personal appearance clean professional maintain confidentiality proprietary information . acknowledge guest anticipate address guest' service assist individual guest genuine appreciation . speak clear professional language answer appropriate etiquette . develop maintain positive relationship . comply quality assurance expectation standard . read visually verify information variety format e.g. small print . speed require respond situation e.g. walk jog . stand sit walk extended period entire shift . lift carry push pull place object weigh equal pound assistance object weigh excess pound assistance . slope uneven slippery surface stair service ramp . reach overhead knee include bend twisting pull stoop . perform reasonable duty request supervisor . equal employer . hire diverse workforce sustain inclusive people culture . committed discrimination protect basis veteran status basis cover applicable law . seriously obligation provincial human accessibility legislation Accessibility Manitobans . happy provide accommodation applicant assistance . require accommodation relation posting online application interview Human Resources team respond request . note phone number email individual request accessibility accommodation recruiting process . provide seamless travel thoughtfully design essential modern frequent traveler mind . flawlessly deliver key essential guest hard eliminate . warm wise control guest focus . strong presence rapidly expand market . enjoy deliver purposeful service focus detail matter invite explore . join join portfolio brand . good purpose belong amazing global team good version ."
    },
    "companyDescription": "",
    "description": "Additional Information Full Time, Weekends, Evenings, Ontario G Drivers License\n  \n Job Number 24010863\n  \n Job Category Rooms & Guest Services Operations\n  \n Location Delta Hotels Ottawa City Centre, 101 Lyon Street North, Ottawa, ONT, Canada VIEW ON MAP\n  \n Schedule Full-Time\n  \n Located Remotely? N\n  \n Relocation? N\n  \n Position Type Non-Management\n \n   \n  POSITION SUMMARY\n   \n  Greet and escort guests to rooms. Open doors and assist guests/visitors entering and leaving property. Inform guests of property amenities, services, and hours of operation, and local areas of interest and activities. Identify and explain room features to guests (e.g., use of room key, mini-bar, ice and vending areas, in-room safe, valet laundry services). Transport guest luggage to and from guest rooms and/or designated bell area. Assist with luggage storage and retrieval. Assist guests/visitors in and out of vehicles, including assisting guests with loading/unloading luggage. Supply guests with directions. Arrange transportation (e.g., taxi cab, shuttle bus, limousine/sedan service) for guests/visitors, and record advance transportation request as needed. Communicate parking procedures to guests/visitors.\n   \n  Follow all company policies and procedures, and report accidents, injuries, and unsafe work conditions to manager. Maintain awareness of undesirable persons on property premises. Ensure uniform and personal appearance are clean and professional and maintain confidentiality of proprietary information. Welcome and acknowledge all guests, anticipate and address guests\u2019 service needs, assist individuals with disabilities, and thank guests with genuine appreciation. Speak with others using clear and professional language, and answer telephones using appropriate etiquette. Develop and maintain positive working relationships with others. Comply with quality assurance expectations and standards. Read and visually verify information in a variety of formats (e.g., small print). Move at a speed required to respond to work situations (e.g., run, walk, jog). Stand, sit, or walk for an extended period of time or for an entire work shift. Move, lift, carry, push, pull, and place objects weighing less than or equal to 50 pounds without assistance and objects weighing in excess of 75 pounds with assistance. Move over sloping, uneven, or slippery surfaces as well as up and down stairs and/or service ramps. Reach overhead and below the knees, including bending, twisting, pulling, and stooping. Perform other reasonable job duties as requested by Supervisors.\n  \n   \n \n \n Marriott International is an equal opportunity employer. We believe in hiring a diverse workforce and sustaining an inclusive, people-first culture. We are committed to non-discrimination on any protected basis, such as disability and veteran status, or any other basis covered under applicable law.\n \n  Delta Hotels Ottawa City Centre takes seriously its obligations under provincial human rights and accessibility legislation (such as the Accessibility for Ontarians with Disabilities Act, 2005, the Accessibility for Manitobans Act, and Nova Scotia Accessibility Act). We are happy to provide accommodations to job applicants needing assistance. If you require an accommodation in relation to this job posting, our online application or an interview, please call 905-366-5227 or email CanadaApplicationAccommodation@marriott.com and a member of our Human Resources team will respond to your request. Please note that this phone number and email are only for those individuals who would like to request an accessibility accommodation as part of the recruiting process.\n  Delta Hotels provide a seamless travel experience that has been thoughtfully designed with the essential needs of the modern frequent traveler in mind. We flawlessly deliver the key essentials guests need and we work hard to eliminate everything they don\u2019t. At Delta Hotels by Marriott, we are always warm, wise and in control so our guests can focus on what\u2019s most important. With a strong presence in Canada, the United Kingdom, and the United States, Delta Hotels by Marriott is rapidly expanding across markets all around the world. If you enjoy delivering purposeful service and focusing on the details that matter, we invite you to explore jobs at Delta Hotels by Marriott. In joining Delta Hotels, you join a portfolio of brands with Marriott International. \n Be where you can do your best work, \n begin your purpose, \n belong to an amazing global team, and \n become the best version of you."
}