{
    "id": "d740fce3d304ef3b",
    "company": "Atomic Energy of Canada, Ltd.",
    "positionName": "Executive Administrative Assistant (Term)",
    "jobType": [],
    "location": "Ottawa, ON",
    "salary": null,
    "postingDateParsed": "2023-10-06T02:04:49.613Z",
    "url": "https://www.indeed.ca/rc/clk?jk=d740fce3d304ef3b&from=jasx&tk=1hc6geptqk7pr800&vjs=3",
    "externalApplyLink": "https://careersen-aecl.icims.com/jobs/1087/job?utm_source=indeed_integration&iis=Job%20Board&iisn=Indeed&indeed-apply-token=73a2d2b2a8d6d5c0a62696875eaebd669103652d3f0c2cd5445d3e66b1592b0f",
    "job_info_group": {
        "extracted_phone_numbers": [],
        "extracted_links": [
            "HTTP/HTTPS Links",
            "General Links",
            "WWW Links",
            "TLDs"
        ],
        "extracted_emails": [
            "hr@aecl.ca"
        ],
        "extracted_location_data": [
            "AECL's Chalk River",
            "en Ontario",
            "Canada",
            "le Canada",
            "relever les d\u00e9fis auxquels vous",
            "Ottawa",
            "organisation du secteur priv\u00e9, les Laboratoires nucl\u00e9aires canadiens",
            "du Canada",
            "Ontario",
            "d'EACL \u00e0 Chalk River",
            "\u00e0 l'avenir"
        ],
        "extracted_dates": [
            "one year",
            "October 23, 2023",
            "2015",
            "5 years"
        ],
        "extracted_languages": [
            "English"
        ],
        "extracted_laws": [],
        "extracted_norps": [
            "appuyez",
            "French",
            "Indigenous Peoples"
        ],
        "extracted_orgs": [
            "5 ans d'exp\u00e9rience en soutien aux cadres sup\u00e9rieurs",
            "pouvons vous aider en",
            "un r\u00e9gime de retraite \u00e0",
            "Atomic Energy of Canada Limited",
            "EACL fournit un soutien et des am\u00e9nagements",
            "sur vos connaissances pratiques et",
            "LNC",
            "des ordres du jour",
            "Business Administration",
            "Dans ce r\u00f4le",
            "inh\u00e9rentes au soutien d'une",
            "promotion de la diversit\u00e9",
            "Un",
            "Connaissances avanc\u00e9es des produits Microsoft Office",
            "www.aecl.ca @AECL",
            "jonglez avec des demandes",
            "CNL",
            "aborder le travail avec tact",
            "the Government of Canada's",
            "Ce \u00e0 quoi vous pouvez vous attendre : Cette annonce demeurera affich\u00e9e",
            "PowerPoint",
            "confidentielles",
            "AECL",
            "(AECL",
            "Environmental Remediation Management",
            "Microsoft Office Products",
            "prestations d\u00e9termin\u00e9es index\u00e9es",
            "compte les besoins d'accessibilite d'un candidat",
            "confidentiel d'aide aux employ\u00e9s pour",
            "l'appui des priorit\u00e9s et des besoins du gouvernement",
            "OGEE",
            "des am\u00e9nagements qui prennent en",
            "en mati\u00e8re d'habilitation de s\u00e9curit\u00e9",
            "tant que soci\u00e9t\u00e9 d'\u00c9tat canadienne",
            "Canadian Nuclear Laboratories",
            "the Federal Nuclear Science and Technology Work Plan",
            "soutenir votre sant\u00e9 mentale",
            "\u00e0 la",
            "notre processus de recrutement",
            "Preference",
            "@AECL",
            "gratitude que nous op\u00e9rons sur des territoires qui, depuis des temps imm\u00e9moriaux"
        ],
        "extracted_persons": [
            "Vous prenez",
            "La pr\u00e9f\u00e9rence peut \u00eatre donn\u00e9e aux membres d'un groupe d\u00e9sign\u00e9 afin de rem\u00e9dier \u00e0",
            "s\u00e9lectionn\u00e9s",
            "Capacit\u00e9 et volont\u00e9 de travailler avec un",
            "Bien que nous appr\u00e9cions sinc\u00e8rement toutes les demandes d'emploi",
            "envoyant un courriel",
            "selon lequel une",
            "trouver des gains d'efficacit\u00e9 et am\u00e9liorer continuellement les processus",
            "avec un",
            "Le candidat s\u00e9lectionn\u00e9 doit satisfaire aux exigences du gouvernement du Canada",
            "tant en personne qu'au t\u00e9l\u00e9phone",
            "Si vous souffrez",
            "diplomatie et un haut niveau de confiance et de discr\u00e9tion dans",
            "votre retraite",
            "des personnes handicap\u00e9es",
            "avec professionnalisme",
            "des proc\u00e8s-verbaux",
            "vous anticipez les besoins",
            "r\u00e9pondre aux besoins des intervenants internes et externes avec tact",
            "La pr\u00e9f\u00e9rence peut \u00eatre donn\u00e9e aux personnes bilingues",
            "ferez",
            "Acc\u00e8s instantan\u00e9",
            "rigoureuse aux d\u00e9tails et",
            "seuls les candidats",
            "Vous pensez",
            "Le bilinguisme",
            "les co\u00fbts et les risques pour",
            "l'adjoint(e) de direction est"
        ],
        "extracted_products": [
            "Excel",
            "PowerPoint et Excel"
        ],
        "extracted_money": [],
        "processed_text": "Description acknowledge gratitude operate territory immemorial traditional land indigenous people . federal Crown corporation mandate enable nuclear science technology manage radioactive waste liability . deliver mandate government contractor operate GoCo business model private sector organization responsible manage operate aecl's site behalf pursuant long term agreement . AECL's objective GoCo model include accelerate manage support government priority build class nuclear laboratory fulfil government priority grow commercial revenue reduce cost risk . report vice president Executive Assistant responsible ensure organization efficiency customer service relationship management delivery key administrative activity executive . role professionalism tact manage extensive range executive level administrative task sensitive confidential nature . organize thrive resolve administrative difficulty inherent support diversified team fast pace environment . bring Diploma . Bilingualism consider asset . previous support executive . solid understanding corporate document standard strict attention detail accuracy maintenance record agenda electronic file . solid planning skill highly organize approach . team orient effective communicator promote positive environment . demonstrate approach tactfully diplomacy high level trust discretion handling sensitive confidential information . willingness minimal supervision team environment require initiative . motivated efficiently level employee person effectively interface group aecl site group external . motivate find efficiency continuously improve process procedure . problem solve effective critical thinker advanced proficiency Word Outlook aptitude learn software technology system . creativity innovation flexibility adaptability handle multiple priority schedule . expect ad remain post review application . posting temporary position duration . position base office base AECL's office . competition round interview . select meet Government security clearance requirement . sincerely appreciate application select interview contact . individual . committed build authentic workplace promote diversity equity inclusion accessibility matter . application woman visible minority person person gender identity expression sexual orientation . designate group address identify representation . encourage identify . provide support reasonable accommodation recruitment process applicant include accommodation consider applicant accessibility . require accommodation recruitment process assist email . Description du poste energie atomique du limitee EACL reconnait avec sont les terres traditionnelles des peuples autochtone . EACL vous convient EACL pour mandat permettre developpement science technologie nucleaires gerer les responsabilites du gouvernement du matiere dechets radioactifs . Depuis EACL execute son mandat par l'intermediaire d'un modele d'organisme gouvernemental exploite par entrepreneur est responsable gestion l'exploitation des site d'EACL vertu d'accords long terme . Les objectifs d'EACL gestion du Plan travail federal matiere science technologie nucleaire construction d'un laboratoire nucleaire calibre mondial repond aux priorites du gouvernement augmente les revenus commerciaux tout reduisant limitant . Ce vous Sous responsabilite d'un vice president charge d'assurer l'efficacite l'organisation service clientele gestion des relations realisation d'activites administrative cles pour maximum quatre dirigeants es . vous agissez tact tout gerant une vaste gamme taches administrative niveau executif sont nature sensible confidentielle . Vous etes organise vous aidez resoudre les difficultes administrative equipe diversifiee dans environnement constante evolution . des initiative concurrente tout recherchant des possibilites d'ameliorer les processus pratiques administrative . Vous vous specialisees matiere des processus procedures soutien aux entreprises pour discretion . vous acquittez vos responsabilites minimum directive . Ce vous apportez Diplome administration des affaire . francais anglais est considere comme atout . . Une comprehension solide des normes documentaires l'entreprise une attention precision dans tenue des dossiers des fichiers electroniques . solide competence matiere planification approche tres organisee du travail . Doit avoir l'esprit d'equipe savoir communiquer efficacement afin promouvoir environnement travail positif . aptitude averee traitement d'information sensible . minimum supervision dans environnement d'equipe requiert l'initiative . Capacite s'auto motiver travailler efficacement avec tous les niveaux dthemployes capacite d'interagir efficacement avec d'autres groupe particulier ceux des autres sites d'EACL d'autres groupes externe EACL . Motive pour les procedure . capacite aresoudre des problemes faire preuve d'un esprit critique efficace . Word Outlook aptitude apprendre nouveaux logiciels technologies systemes . Creativite innovation flexibilite adaptabilite pour gerer les multiple priorites calendriers d'EACL . Ce nous offron Prestations medicales dentaires completes par l'entremise du gouvernement du . participation au Regime pension retraite fonction publique pour vous aider planifier . Des vacance des conge personnel des jours flottants utiliser pour favoriser votre bien etre physique mental . programme vous aider vos personnes votre charge pouvez etre confrontes . heure sur jour sur des medecins ligne par l'intermediaire Maple vous couvre vos personnes votre charge cas besoin medical . ressource sur pleine conscience meditation par l'intermediaire Headspace pour . modele travail hybride flexible vous permet trouver equilibre entre travail domicile l'entretien des relations personne . mais nous commencerons examiner les candidature octobre . Cette annonce concerne deux postes temporaire temps plein d'une duree d'un . premier poste sera base au bureau second au bureau d'EACL . Ce concours comporte deux serie d'entrevue . . pour une entrevue seront contactes . . EACL nous nous engageon creer milieu travail authentique l'equite l'inclusion l'accessibilite nous tient c\u0153ur . nous accueillon les candidature des femmes des minorites visible des autochtone des personnes toute identite expression genre toute orientation sexuelle . une sous representation identifiee . nous encourageon les candidats s'identifier . raisonnable dans les processus recrutement aux candidats handicapes compris . d'un handicap necessite une mesure d'adaptation pendant faite nous savoir comment nous . propos d'EACL"
    },
    "companyDescription": "",
    "description": "Job Description: \n \n   AECL acknowledges with gratitude that we operate on territories that have, since time immemorial, been the traditional lands of Indigenous peoples in Canada.\n \n \n  Is AECL right for you?\n \n   As a federal Crown corporation, Atomic Energy of Canada Limited (AECL) has a mandate to enable nuclear science and technology and manage the Government of Canada\u2019s radioactive waste liabilities. Since 2015, AECL has been delivering its mandate through a Government-owned, Contractor-operated (GoCo) business model, whereby a private-sector organization, Canadian Nuclear Laboratories (CNL), is responsible for managing and operating AECL\u2019s sites on its behalf, pursuant to long term agreements. AECL\u2019s objectives under the GoCo model include accelerating Environmental Remediation Management, managing the Federal Nuclear Science and Technology Work Plan in support of government priorities and needs, and building a world-class nuclear laboratory that fulfils government priorities and grows commercial revenues, while reducing or containing costs and risks to Canada.\n \n  What you will do:\n \n   Reporting to a vice president, the Executive Assistant is responsible for ensuring organization efficiency, customer service, relationships management and delivery on key administrative activities for up to four executives. In this role, you act with professionalism and tact while managing an extensive range of executive-level administrative tasks that are sensitive and confidential in nature. You are organized and thrive in resolving administrative difficulties that are inherent in supporting a diversified team within a fast-paced environment.\n \n \n  What you bring:\n \n   Diploma in Business Administration.\n   Bilingualism in English and French is considered an asset.\n   5 years of previous experience supporting executives.\n   Solid understanding of corporate document standards and strict attention to detail and accuracy in the maintenance of records, agenda, minutes, electronic files, etc.\n   Solid planning skills and a highly organized approach to work.\n   Must be team oriented and an effective communicator to promote a positive work environment.\n   Demonstrated ability to approach work tactfully, with diplomacy and high a level of trust and discretion in handling of sensitive and confidential information.\n   Ability and willingness to work with minimal supervision in a team environment that requires initiative.\n   Ability to be self-motivated and work efficiently with all levels of employees both in person and on the telephone; ability to effectively interface with other groups, particularly those at other AECL sites, and other groups external to AECL.\n   Motivated to find efficiencies and continuously improve processes and procedures.\n   Ability to problem solve and be an effective critical thinker\n   Advanced proficiency with Microsoft Office Products (Word, Outlook, PowerPoint, and Excel) as well as an aptitude for learning new software, technologies, and systems.\n   Creativity, innovation, flexibility, and adaptability to handle the multiple priorities and schedules of AECL.\n \n  What you can expect:\n \n   While this ad will remain posted, we will begin reviewing applications on October 23, 2023.\n   This posting is for two, full-time temporary positions that will be one year in duration. One position will be based out of AECL\u2019s Chalk River, Ontario office, and the other will be based out of AECL\u2019s Ottawa, Ontario office.\n   This competition will have two rounds of interviews.\n   The selected candidate must successfully meet Government of Canada security clearance requirements.\n   While we sincerely appreciate all applications, only those candidates selected for an interview will be contacted.\n   Preference may be given to individuals who are bilingual.\n \n \n \n   At AECL, we are committed to building an authentic workplace; promoting diversity, equity, inclusion, and accessibility matters to us. We welcome applications from women, visible minorities, Indigenous Peoples, persons with disabilities, and persons of any gender identity, expression, and sexual orientation. Preference may be given to members of a designated group to address identified under-representation. We encourage candidates to self-identify.\n \n \n \n   AECL provides support and reasonable accommodations in its recruitment processes to applicants with disabilities including accommodations that consider an applicant\u2019s accessibility needs. If you have a disability that requires accommodation during our recruitment process, let us know how we can assist you by emailing hr@aecl.ca.\n \n \n   \n \n About AECL:\n \n \n  \n   \n     www.aecl.ca\n   \n  \n  \n  \n   \n     @AECL\n   \n  \n  \n  \n   \n     @AECL_EACL\n   \n  \n  \n  \n   \n    \n      @atomicenergycanada\n    \n   \n  \n \n  \n  Description du poste: \n \n   \u00c9nergie atomique du Canada limit\u00e9e (EACL) reconna\u00eet avec gratitude que nous op\u00e9rons sur des territoires qui, depuis des temps imm\u00e9moriaux, sont les terres traditionnelles des peuples autochtones du Canada.\n \n \n   \n \n EACL vous convient?\n \n   En tant que soci\u00e9t\u00e9 d\u2019\u00c9tat canadienne, EACL a pour mandat de permettre le d\u00e9veloppement de la science et la technologie nucl\u00e9aires, et de g\u00e9rer les responsabilit\u00e9s du gouvernement du Canada en mati\u00e8re de d\u00e9chets radioactifs. Depuis 2015, EACL ex\u00e9cute son mandat par l\u2019intermediaire d\u2019un mod\u00e8le d\u2019organisme gouvernemental exploit\u00e9 par un entrepreneur (OGEE), selon lequel une organisation du secteur priv\u00e9, les Laboratoires nucl\u00e9aires canadiens (LNC), est responsable de la gestion et de l\u2019exploitation des sites d\u2019EACL, en vertu d\u2019accords \u00e0 long terme. Les objectifs d\u2019EACL dans le cadre du mod\u00e8le OGEE comprennent l\u2019acc\u00e9l\u00e9ration de la gestion de l\u2019assainissement de l\u2019environnement, la gestion du Plan de travail f\u00e9d\u00e9ral en matiere de science et de technologie nucl\u00e9aires \u00e0 l\u2019appui des priorit\u00e9s et des besoins du gouvernement, et la construction d\u2019un laboratoire nucl\u00e9aire de calibre mondial qui r\u00e9pond aux priorit\u00e9s du gouvernement et qui augmente les revenus commerciaux, tout en r\u00e9duisant ou en limitant les co\u00fbts et les risques pour le Canada.\n \n  Ce que vous ferez :\n \n   Sous la responsabilit\u00e9 d\u2019un(e) vice-pr\u00e9sident(e), l\u2019adjoint(e) de direction est charg\u00e9(e) d\u2019assurer l\u2019efficacit\u00e9 de l\u2019organisation, le service \u00e0 la client\u00e8le, la gestion des relations et la realisation d\u2019activit\u00e9s administratives cl\u00e9s pour un maximum de quatre dirigeants(es). Dans ce r\u00f4le, vous agissez avec professionnalisme et tact tout en g\u00e9rant une vaste gamme de t\u00e2ches administratives de niveau ex\u00e9cutif qui sont de nature sensible et confidentielle. Vous \u00eates organis\u00e9(e) et vous aidez \u00e0 r\u00e9soudre les difficult\u00e9s administratives inh\u00e9rentes au soutien d\u2019une \u00e9quipe diversifi\u00e9e dans un environnement en constante \u00e9volution.\n \n \n \n   Vous prenez des initiatives et jonglez avec des demandes concurrentes tout en recherchant des possibilit\u00e9s d\u2019am\u00e9liorer les processus et pratiques administratives. Vous vous appuyez sur vos connaissances pratiques et sp\u00e9cialis\u00e9es en mati\u00e8re des processus et proc\u00e9dures de soutien aux entreprises pour r\u00e9pondre aux besoins des intervenants internes et externes avec tact et discr\u00e9tion. Vous pensez \u00e0 l\u2019avenir, vous anticipez les besoins et vous acquittez vos responsabilit\u00e9s avec un minimum de directives.\n \n  Ce que vous apportez :\n \n   Dipl\u00f4me en administration des affaires.\n   Le bilinguisme (fran\u00e7ais et anglais) est consid\u00e9r\u00e9 comme un atout.\n   5 ans d\u2019exp\u00e9rience en soutien aux cadres sup\u00e9rieurs.\n   Une compr\u00e9hension solide des normes documentaires de l\u2019entreprise et une attention rigoureuse aux d\u00e9tails et \u00e0 la pr\u00e9cision dans la tenue des dossiers, des ordres du jour, des proc\u00e8s-verbaux, des fichiers \u00e9lectroniques, etc.\n   Solides comp\u00e9tences en mati\u00e8re de planification et approche tr\u00e8s organis\u00e9e du travail.\n   Doit avoir l\u2019esprit d\u2019\u00e9quipe et savoir communiquer efficacement afin de promouvoir un environnement de travail positif.\n   Aptitude av\u00e9r\u00e9e \u00e0 aborder le travail avec tact, diplomatie et un haut niveau de confiance et de discr\u00e9tion dans le traitement d\u2019informations sensibles et confidentielles.\n   Capacit\u00e9 et volont\u00e9 de travailler avec un minimum de supervision dans un environnement d\u2019\u00e9quipe qui requiert de l\u2019initiative.\n   Capacit\u00e9 \u00e0 s\u2019auto-motiver et \u00e0 travailler efficacement avec tous les niveaux d\u2019employ\u00e9s, tant en personne qu\u2019au t\u00e9l\u00e9phone; capacit\u00e9 d\u2019interagir efficacement avec d\u2019autres groupes, en particulier ceux des autres sites d\u2019EACL, et d\u2019autres groupes externes \u00e0 EACL.\n   Motiv\u00e9 pour trouver des gains d\u2019efficacit\u00e9 et am\u00e9liorer continuellement les processus et les proc\u00e9dures.\n   Capacit\u00e9 \u00e0r\u00e9soudre des probl\u00e8mes et \u00e0 faire preuve d\u2019un esprit critique efficace.\n   Connaissances avanc\u00e9es des produits Microsoft Office (Word, Outlook, PowerPoint et Excel) et aptitude \u00e0 apprendre de nouveaux logiciels, technologies et syst\u00e8mes.\n   Cr\u00e9ativit\u00e9, innovation, flexibilit\u00e9 et adaptabilit\u00e9 pour g\u00e9rer les multiples priorit\u00e9s et calendriers d\u2019EACL.\n \n  Ce que nous offrons :\n \n   Prestations m\u00e9dicales et dentaires compl\u00e8tes par l\u2019entremise du gouvernement du Canada.\n   Participation au R\u00e9gime de pension de retraite de la fonction publique (un r\u00e9gime de retraite \u00e0 prestations d\u00e9termin\u00e9es index\u00e9es) pour vous aider \u00e0 planifier votre retraite.\n   Des vacances, des conges personnels et des jours flottants \u00e0 utiliser pour favoriser votre bien-\u00eatre physique et mental.\n   Un programme confidentiel d\u2019aide aux employ\u00e9s pour vous aider \u00e0 relever les d\u00e9fis auxquels vous ou vos personnes \u00e0 votre charge pouvez \u00eatre confront\u00e9s.\n   Acc\u00e8s instantan\u00e9, 24 heures sur 24 et 7 jours sur 7, \u00e0 des m\u00e9decins en ligne par l\u2019interm\u00e9diaire de Maple, qui vous couvre, et vos personnes \u00e0 votre charge en cas de besoin m\u00e9dical.\n   Ressources sur la pleine conscience et la m\u00e9ditation par l\u2019interm\u00e9diaire de Headspace pour soutenir votre sant\u00e9 mentale.\n   Un mod\u00e8le de travail hybride flexible qui vous permet de trouver un \u00e9quilibre entre le travail \u00e0 domicile et l\u2019entretien des relations en personnes.\n \n  Ce \u00e0 quoi vous pouvez vous attendre :\n \n   Cette annonce demeurera affich\u00e9e, mais nous commencerons \u00e0 examiner les candidatures le 23 octobre 2023.\n   Cette annonce concerne deux postes temporaires \u00e0 temps plein d\u2019une dur\u00e9e d\u2019un an. Le premier poste sera base au bureau d\u2019EACL \u00e0 Chalk River, en Ontario, et le second au bureau d\u2019EACL \u00e0 Ottawa, en Ontario.\n   Ce concours comporte deux s\u00e9ries d\u2019entrevues.\n   Le candidat s\u00e9lectionn\u00e9 doit satisfaire aux exigences du gouvernement du Canada en mati\u00e8re d\u2019habilitation de s\u00e9curit\u00e9.\n   Bien que nous appr\u00e9cions sinc\u00e8rement toutes les demandes d\u2019emploi, seuls les candidats s\u00e9lectionn\u00e9s pour une entrevue seront contact\u00e9s.\n   La pr\u00e9f\u00e9rence peut \u00eatre donn\u00e9e aux personnes bilingues.\n \n \n   \n \n \n  A EACL, nous nous engageons \u00e0 cr\u00e9er un milieu de travail authentique; la promotion de la diversit\u00e9, de l\u2019\u00e9quit\u00e9, de l\u2019inclusion et de l\u2019accessibilit\u00e9 nous tient \u00e0 c\u0153ur. Nous accueillons les candidatures des femmes, des minorit\u00e9s visibles, des autochtones, des personnes handicap\u00e9es et des personnes de toute identit\u00e9, et expression de genre et de toute orientation sexuelle. La pr\u00e9f\u00e9rence peut \u00eatre donn\u00e9e aux membres d\u2019un groupe d\u00e9sign\u00e9 afin de rem\u00e9dier \u00e0 une sous-repr\u00e9sentation identifi\u00e9e. Nous encourageons les candidats \u00e0 s\u2019identifier.\n \n \n   \n \n \n  EACL fournit un soutien et des am\u00e9nagements raisonnable dans les processus de recrutement aux candidats handicapes, y compris des am\u00e9nagements qui prennent en compte les besoins d\u2019accessibilite d\u2019un candidat. Si vous souffrez d\u2019un handicap qui n\u00e9cessite une mesure d\u2019adaptation pendant notre processus de recrutement, faites-nous savoir comment nous pouvons vous aider en envoyant un courriel \u00e0 \n  hr@aecl.ca.\n \n  \u00c0 propos d\u2019EACL :\n \n \n  \n   \n     www.aecl.ca\n   \n  \n  \n  \n   \n     @AECL\n   \n  \n  \n  \n   \n     @AECL_EACL\n   \n  \n  \n  \n   \n    \n      @atomicenergycanada"
}