{
    "id": "a7764e4ef3d50577",
    "company": "Giatec Scientific Inc.",
    "positionName": "Quality Engineer",
    "jobType": [],
    "location": "Ottawa, ON",
    "salary": null,
    "postingDateParsed": "2023-11-03T20:18:50.838Z",
    "url": "https://www.indeed.ca/rc/clk?jk=a7764e4ef3d50577&from=jasx&tk=1hgol9m42jjhg800&vjs=3",
    "externalApplyLink": "https://giatecscientific.bamboohr.com/careers/203?source=indeed&src=indeed&postedDate=2023-05-25",
    "job_info_group": {
        "extracted_phone_numbers": [],
        "extracted_links": [
            "HTTP/HTTPS Links",
            "General Links",
            "WWW Links",
            "TLDs"
        ],
        "extracted_emails": [],
        "extracted_location_data": [
            "North America",
            "Giatec",
            "Ottawa",
            "Europe",
            "Asia Pacific"
        ],
        "extracted_dates": [
            "over 10 years",
            "3 to 5 years"
        ],
        "extracted_languages": [],
        "extracted_laws": [],
        "extracted_norps": [],
        "extracted_orgs": [
            "Possess Electronics Technology",
            "Giatec Scientific Inc.",
            "Purpose and Integrity",
            "a Quality Engineer",
            "Concrete Producers"
        ],
        "extracted_persons": [
            "GIATEC"
        ],
        "extracted_products": [],
        "extracted_money": [],
        "processed_text": "Giatec Quality Engineer QE Product Development Supply Chain Management team . responsible ensure electrical mechanical component Hardware HW assembly meet exceed quality standard requirement . role cross functional team collaborate designer engineer supplier manufacturer deliver high quality product customer . location role onsite i.e. Giatec's office lab . responsibility read interpret drawing sketch bill material manufacturing instruction product specification determine requirement . perform receiving process final inspection material component assembly finished electronic product . manage satisfactory resolution conforming product establish procedure . conduct regular site vendor assessment production process auditing identifying resolve quality issue train Contract manufacture . contribute designing assembly test inspection procedure collaboration product engineer supplier manufacturer . analyse datum detect anomaly determine root implement corrective action . contribute development product validation procedure represent QE perspective requirement . REQUIRED skill inspect electro mechanical assembly audit manufacturer . manufacture PCBA electronic assembly finished product box building IPC class II . exposure quality management standard iso9001 IATF AS9000 good understanding concept involve . strong computer base analytical skill computer programming skill scripting language attention detail excellent problem solve skill . independently minimum supervision . excellent communication skill lift . valid driver's licence travel . Engineering degree . Giatec mission transform concrete industry . product enable save money critically lower GHG emission . customer . diverse group people commit continuous learning build company . grow profitable . fundamentally attract smart talented people key success . creative passionate people join rapidly expand team . apply skill encourage apply love review unique application learn send cover letter resume indicate good fit role . diversity inclusion sense belongingness critical success . employee diverse background strengthen workplace culture boost creativity help revolutionize concrete industry . Giatec dedicate create barrier free environment start hiring process . require special accommodation support recruitment process indicate email ."
    },
    "companyDescription": "",
    "description": "Giatec Scientific Inc. (Giatec) is looking for a Quality Engineer (QE) to be part of the Product Development / Supply Chain Management team. As a Quality Engineer, you will be responsible for ensuring all electrical or mechanical components, parts, or Hardware (HW) assemblies meet or exceed quality standards and requirement.\n \n  In this role, you will also become part of a cross functional team collaborating with designers, engineers, suppliers, and manufacturers to deliver highest quality products to our customers. \n \n  \n The work location for this role is primarily onsite (i.e. at Giatec's office/lab in Ottawa, ON).\n \n  RESPONSIBILITIES: \n  \n  Read and interpret drawings, sketches, bill of materials, manufacturing instructions and product specifications to determine requirements. \n  Perform receiving, in-process, and final inspections on material, components, assemblies and finished electronics products. \n  Manage satisfactory resolution of non-conforming products through established procedures. \n  Conduct regular on-site vendor assessment of production process, auditing, identifying, and resolving quality issues and training Contract Manufactures. \n  Contribute to designing assembly, test and inspection procedures in collaboration with product engineers and suppliers/manufacturers. \n  Analyse data, detect anomalies, determine root cause and implement corrective actions. \n  Contribute to the development of new products and validation procedures representing QE perspective and requirements.\n \n  \n  \n  REQUIRED SKILLS AND EXPERIENCE: \n  \n  3 to 5 years of experience inspecting/working with electro-mechanical assemblies or auditing manufacturers. \n  Experience with manufacturing PCBA/electronics assemblies and finished product box building to IPC 610 class II. \n  Exposure to quality management standards (ex: ISO9001, IATF 16949, AS9000) and good understanding of concepts involved in them. \n  Strong computer based analytical skills (Computer programming skills using scripting languages is a plus) \n  Attention to detail and excellent problem-solving skills. \n  Able to work independently and with minimum supervision. \n  Excellent communication skills \n  Must be able to lift 15Kg. \n  Must have a valid driver\u2019s licence and be able to travel up to 25% of the time. \n  Possess Electronics Technology or Engineering degree.\n \n \n  ABOUT GIATEC: \n  Giatec is on a mission to transform the Concrete industry. We have products that enable Concrete Producers to save time and money, and most critically, lower their GHG emissions. We have customers throughout North America, Europe, and Asia Pacific. We are a diverse group of people committed to continuous learning and building a company with Purpose and Integrity. We have been growing and profitable for over 10 years.\n  \n  \n  We fundamentally believe that attracting and keeping smart and talented people is a key to our success. We are looking for creative and passionate people to join our rapidly expanding team.\n  \n  \n  TO APPLY: \n  Do you have some of these skills but maybe not all? We still encourage you to apply as we would love to review your unique application and learn more about you! Please send a brief cover letter and resume to us indicating why you believe you would be a good fit for this role.\n  \n  \n  At Giatec, we know that diversity, inclusion, and a sense of belongingness are critical to our success. We believe that employees with diverse backgrounds and experiences strengthen our workplace culture, boost our creativity, and help us to revolutionize the concrete industry.\n  \n  \n  Giatec is dedicated to creating a barrier-free environment starting with the hiring process. If you require any special accommodation or support during the recruitment process, please indicate in your email to us."
}