{
    "id": "c871dc1f902ae7a3",
    "company": "Definity Financial Corporation",
    "positionName": "Sr Catastrophic Claims Representative NEW",
    "jobType": [],
    "location": "Ottawa, ON",
    "salary": null,
    "postingDateParsed": "2024-01-20T05:09:26.029Z",
    "url": "https://www.indeed.ca/rc/clk?jk=c871dc1f902ae7a3&from=jasx&tk=1hkikb4a7k5qp800&bb=lTPy9GC8AEMesPUlCsHFKlS_LsaJ2ODsUA2afYShzEM7y1f3QVFME71PEM2ymolRpxq3I4NiEckOkq6K3EVHvFTXthdJ5UUzw-a2sG4rIxGTuw9hSE0Y1A%3D%3D&xkcb=SoDZ67M3FSgjV4x1FB0ObzkdCdPP&vjs=3",
    "externalApplyLink": "https://careers.definityfinancial.com/jobs/13849321-sr-catastrophic-claims-representative?source=Indeed",
    "job_info_group": {
        "extracted_phone_numbers": [],
        "extracted_links": [
            "HTTP/HTTPS Links",
            "General Links",
            "WWW Links",
            "TLDs"
        ],
        "extracted_emails": [
            "accessibility@definity.com"
        ],
        "extracted_location_data": [
            "Canada",
            "Ottawa"
        ],
        "extracted_dates": [
            "1871",
            "Paid volunteer days",
            "2 years"
        ],
        "extracted_languages": [],
        "extracted_laws": [
            "the Structural Damage Quantification Protocol"
        ],
        "extracted_norps": [],
        "extracted_orgs": [
            "Definity",
            "Economical Insurance",
            "Reservations of Rights",
            "the Quantification Team",
            "Family Insurance Solutions",
            "102,800 Definity",
            "Petline Insurance",
            "national Vendors",
            "Focus",
            "Understanding of Provincial"
        ],
        "extracted_persons": [
            "CADD",
            "Xactware"
        ],
        "extracted_products": [],
        "extracted_money": [
            {
                "amount": "$55,800 - $",
                "noun_phrases": []
            },
            {
                "amount": "$ $54,800 - $100,800",
                "noun_phrases": []
            }
        ],
        "processed_text": "category claim brand Definity regular temporary regular Fulltime Parttime Location posting Range include Canada's long stand innovative insurance brand include Sonnet Insurance . strong root grow digital leader insurance industry . help client community adapt thrive constant change . promise . care provide employee collaborative ambitious rewarding empower . ambition Canada's leading innovative PandC insurer . journey love . offer flexible hybrid employee office virtually depend type . leader partner team find balance site remote meet team colleague broker customer ensure collaboration teamwork accountability goal . report Team Leader CAT successful accountable adjust file ensure investigation evaluation settlement moderate complex party personal commercial claim economical Catastrophe claim standard . successful provide guidance training technical direction coach mentor claim professional relative estimate vendor management complex structural commercial building damage large loss . expect role deploy approve economical loss cost control program technology investigate negotiate settle moderate complex personal commercial claim assign . adjust file ensure investigation loss site occur person economical quantification program . develop record information pertain claim coverage document note appropriate system drive claim final disposition . respond write inquiry claim assignment economical guideline . review interpret policy wording regulation legislation contract assess impact coverage . review claim evidence statement photo investigative documentation assist identify subrogation identify potential party liability exposure . identifie process salvage . retain direct appropriate vendor expert corporate guideline . provide oversite quality assurance outsourced quantification assignment . quantifie large loss Complex Commercial Lines structural damage claim support nationally . subject matter expert build code law issue relate loss cost quantification closely program pricing protocol . support regional adjusting function deploy CAT catastrophe clean backfille teammate . support national appraisal function deploy CAT complete reinspection manage exception Contractor Connection program complete large loss appraisal task behalf region partner . write denial letter complex correspondence require . maintain effective diary system ensure proactive claim file management disposition . bring role university degree college diploma field cip designation minimum loss adjuster appraiser . demonstrate complete scope repair moderately complex loss National Building Codes solid understanding residential commercial construction terminology technique good practice . estimate software platform include . read understand blueprint drawing proficient MS Word Excel strong verbal write communication skill autonomously professional friendly courteous interaction flexible remain calm pressure travel site notice typical CAT 7am 7pm week depend event response require . salary range actual salary role vary depend location successful factor include limit skill education working condition local labour market . addition base pay eligible employee participate incentive plan pay discretion company subject individual company performance . potential consideration . exact insight application cover letter . ahead expect lot \u2014 deserve hybrid schedule role Company share ownership program pension saving program company match RRSP contribution company match charitable donation educational resource tuition assistance pay study exam inclusion employee group support gender affirmation surgery access BIPOC counsellor access program parent Wellness recognition program discount product service inclusive environment diversity support accessibility . require accommodation recruitment process contact background check role require successful clearance background check include criminal check leadership reference . LI Hybrid"
    },
    "companyDescription": "",
    "description": "Job ID : 7167 Category : Claims Brand : Definity Regular/Temporary : Regular Fulltime/Parttime : Full Time Location : Ottawa, Canada Posting Range : $55,800 - $102,800\n  \n  \n  \n   \n     \n   \n  \n \n \n  Definity includes some of Canada\u2019s most long-standing and innovative insurance brands, including Economical Insurance, Sonnet Insurance, Family Insurance Solutions, and Petline Insurance. With strong roots that date back to 1871, we\u2019ve grown to become a digital leader in the insurance industry. We\u2019re proud to help our clients and communities adapt and thrive in a world of constant change. \n   Our promise to you: It\u2019s better here. Why? Because we CARE, and we provide an employee experience that\u2019s collaborative, ambitious, rewarding, and empowering. \n   Our ambition is to be one of Canada\u2019s leading and most innovative P&C insurers. Come be a part of our journey, and love what you do. \n   Definity offers a flexible, hybrid work experience where employees work from the office and virtually depending on the type of work they are doing and who they are working with. Leaders partner with their teams to find the right balance of on-site and remote work that best meets the needs of their teams, colleagues, brokers and customers, while ensuring collaboration, teamwork and accountability for goals. \n  \n  Reporting to the Team Leader CAT the successful candidate is accountable for adjusting files to ensure investigation, evaluation, and the settlement of moderate to complex first party Personal and Commercial claims as per Economical Catastrophe claims standards. The successful candidate will also provide guidance, on the job training, technical direction, coaching and mentoring to Claim Professionals relative to estimates, vendor management and complex structural commercial building damage large losses. \n   What can you expect from this role? \n   \n   Deploy approved Economical loss cost control programs and technology to investigate, negotiate and settle moderate to complex personal and commercial claims as assigned. Adjusts files to ensure that full investigation of loss site has occurred in person or through use of Economical quantification programs. \n   Develops and records information pertaining to the claim and/or coverage, documenting notes in the appropriate system(s) and driving the claim towards final disposition. \n   Responds to written and telephone inquiries and new claim assignments promptly as per Economical guidelines. \n   Reviews and interprets policy wordings, acts, regulations, legislation, and contracts to assess impact on coverage. Reviews claim evidence, statements, photos, and investigative documentation to assist in identifying subrogation opportunities or identifying potential third-party liability exposure. Identifies and processes all salvage. Retains and directs appropriate vendors & experts within corporate guidelines. \n   Provides oversite and quality assurance on outsourced quantification assignments. Quantifies large loss Complex Commercial Lines structural damage claims as a member of the Quantification Team in support of the Structural Damage Quantification Protocol nationally. \n   Subject matter expert on building code and by-law issues as they relate to loss cost quantifications and works closely with national Vendors on programs, pricing, and protocols. \n   Supports regional adjusting function while not deployed on CAT by working catastrophe clean up and backfilling teammates. Supports national appraisal function while not deployed on CAT by completing reinspection\u2019s, managing exceptions through the Contractor Connection program, completes large loss appraisals and tasks on behalf of region partners. \n   Writing denial letters, Reservations of Rights and other complex correspondence when required. Maintaining an effective diary system to ensure proactive claim file management and disposition. \n   \n  What you bring to this role? \n   \n   University degree or a college diploma (specified field) or the CIP designation and a minimum of 2 years as a loss adjuster or appraiser. \n   Demonstrated ability to complete scopes of repair for up to moderately complex losses \n   Understanding of Provincial and National Building Codes along with a solid understanding of residential and commercial construction terminology, techniques, and best practices. \n   Experience with estimating software platforms including Xactware. \n   Experience with and ability to read and understand blueprints and CADD drawings \n   Proficient in MS Word and Excel \n   Strong verbal and written communication skills and ability to work autonomously \n   Professional, friendly, courteous in all interactions, flexible, and ability to remain calm while under pressure \n   Ability to travel to sites across Canada with little notice \n   The typical CAT day is 7AM to 7PM 6 or 7 days per week depending on the event and the response required. \n   \n  Salary range is $ $54,800 - $100,800 \n   Actual salary for the role may vary depending on work location of the successful candidate and other factors including but not limited to, skills, education, experience, working conditions and the local labour market. In addition to base pay,eligible employees may participate various incentive plans which are paid out at the discretion of the company and subject to individual and company performance. \n  We also take potential into consideration. If you don\u2019t have this exact experience, but you know you have what it takes, be sure to give us more insight through your application and cover letter.\n   Go ahead and expect a lot \u2014 you deserve it, and we\u2019ve got it:\n  \n    Hybrid work schedule for most roles\n    Company share ownership program\n    Pension and savings programs, with company-matched RRSP contributions\n    Paid volunteer days and company matching on charitable donations\n    Educational resources, tuition assistance, and paid time off to study for exams\n    Focus on inclusion with employee groups, support for gender affirmation surgery, access to BIPOC counsellors, access to programs for working parents\n    Wellness and recognition programs\n    Discounts on products and services\n  \n   Our inclusive work environment welcomes diversity and supports accessibility. If you require accommodation at any time during the recruitment process, please let us know by contacting: accessibility@definity.com\n   Background checks This role requires successful clearance of a background check (including criminal checks and leadership references).\n   #LI-Hybrid"
}