{
    "id": "0ca768ac2b6c52b4",
    "company": "Sunglass Hut",
    "positionName": "Sales Associate Sunglass Hut",
    "jobType": [
        "Part-time"
    ],
    "location": "100 Bayshore Dr, Nepean, ON",
    "salary": null,
    "postingDateParsed": "2024-01-05T03:13:15.382Z",
    "url": "https://www.indeed.ca/rc/clk?jk=0ca768ac2b6c52b4&from=jasx&tk=1hjm3b4amipag801&vjs=3",
    "externalApplyLink": "https://ca.indeed.com/applystart?jk=0ca768ac2b6c52b4&from=vj&pos=top&mvj=0&spon=0&sjdu=o7sfz71MPdMgyiV0LZq0d4DDplm6SwWjHcxyoDIphKkcpR8pTBoNRKOpAzhV6JZVb7vwR-ifiNBa_jVABkOEN4XHI4fIjw9veVoSxJES6-KZMNRS_czfz4-fL1_gU93wWYFaodTNAORLboaj3Hy9wxwLaR7bPPW2_614oaAha57iTEV075MtV2a04_LSkk_pw9_XINGINv7OnqX9-Wv1cg&vjfrom=serp&log=1&astse=7a9b75b38adf63e1&assa=4979",
    "job_info_group": {
        "extracted_phone_numbers": [
            "1-888-887-3348",
            "888-887-3348"
        ],
        "extracted_links": [
            "HTTP/HTTPS Links",
            "General Links",
            "WWW Links",
            "TLDs"
        ],
        "extracted_emails": [
            "HRCompliance@luxotticaretail.com"
        ],
        "extracted_location_data": [
            "the US",
            "North America",
            "Luxottica"
        ],
        "extracted_dates": [],
        "extracted_languages": [],
        "extracted_laws": [],
        "extracted_norps": [
            "Native Americans"
        ],
        "extracted_orgs": [
            "Sunglass Hut",
            "001748 Sunglass Hut Position",
            "N.A. Luxottica",
            "the Luxottica Ethics Compliance Hotline",
            "EssilorLuxottica",
            "Tribal Law",
            "GED Embrace"
        ],
        "extracted_persons": [],
        "extracted_products": [],
        "extracted_money": [],
        "processed_text": "requisition store Total reward benefit Incentive Information Sunglass Hut global leader sale premium sunglass retail store . join team grow bright retail offer competitive benefit valuable training unlimited growth . freedom expression inclusivity authenticity bring exclusive style high quality fashion performance sunglass . GENERAL function sale Associates vital success . bring authentic fun energic customer help find premium quality eyewear . MAJOR duty responsibility consistently deliver sale plan company objective cultivate exist customer relationship build brand loyalty . confidently provide exceptional customer connection attention detail offer personalized unique shopping result customer satisfaction . actively participate contribute positive store environment foster strong professional relationship peer management . pride appearance store initiative display inventory clean attractive organized . secure company asset one's control . help foster inclusive culture treat customer colleague respect . basic QUALIFICATIONS High School Diploma technology change high level accuracy accountability sale result sell skill drive meet goal .. strong communication skill oral write motivator demonstrate multi task respond flexibly change environment leader design manufacture distribution fashion luxury sport eyewear . employee pay determine multiple factor include geography qualification skill local minimum wage requirement . addition offer competitive bonus commission plan complement class total reward package . benefit include health care retirement saving pay vacation employee discount . request consistent applicable law provide reasonable accommodation individual assistance application hiring process . request reasonable accommodation provide contact information follow timely manner email . Equal Employer . qualified applicant receive consideration employment regard race color gender national origin social origin social condition perceive victim domestic violence sexual aggression stalk religion age sexual orientation gender identity expression citizenship ancestry veteran military status marital status pregnancy include unlawful discrimination basis legally protect pregnancy maternity leave genetic information characteristic protect law . receive preference ."
    },
    "companyDescription": "",
    "description": "Requisition ID: 831700\n   \n  Store #: 001748 Sunglass Hut\n   \n  Position:Part-Time\n   \n  Total Rewards: \n  Benefits/Incentive Information\n \n  \n  \n \n  Sunglass Hut is a global leader in the sale of premium sunglasses with over 1600 retail stores across North America. By joining our team you'll grow with the brightest in retail!\n \n  \n  \n \n  We offer competitive benefits, valuable training, and unlimited growth opportunities.\n \n  \n  \n \n  We believe in the freedom of self-expression, inclusivity and authenticity, which is why we bring exclusive styles of high-quality fashion and performance sunglasses to all.\n \n  \n  \n \n   GENERAL FUNCTION \n \n \n  Our Sales Associates are vital to the success of Sunglass Hut. You will bring an authentic, fun and energic experience to all customers while helping them find premium quality eyewear.\n \n  \n  \n \n   MAJOR DUTIES AND RESPONSIBILITIES\n  \n  \n  Consistently deliver sales plan and company objectives through cultivating new and existing customer relationships building brand loyalty. \n  Confidently provides an exceptional customer experience through making a connection, attention to detail and offering a personalized and unique shopping experience resulting in customer satisfaction. \n  Actively participates and contributes to a positive store environment, fostering strong, professional relationships with peers and management. \n  Takes pride in the appearance of store and shows initiative to keep displays and inventory clean, attractive and organized. Secures all company assets under one\u2019s control. \n  Helps foster an inclusive culture by treating customers and colleagues with respect.\n \n  \n  \n \n   BASIC QUALIFICATIONS\n  \n  \n  High School Diploma or GED \n  Embrace new technology and change with high level of accuracy \n  Self-accountability for sales results through use of selling skills and a drive to meet goals.. \n  Strong communication skills (both oral and written) \n  Self-Motivator with a demonstrated ability to multi-task; ability to respond flexibly in a quickly changing environment \n  \n \n  Sunglass Hut is a part of Luxottica, N.A. Luxottica is a leader in the design, manufacture and distribution of fashion, luxury and sports eyewear.\n \n \n   Employee pay is determined by multiple factors, including geography, experience, qualifications, skills and local minimum wage requirements. In addition, you may also be offered a competitive bonus and/or commission plan, which complements a first-class total rewards package. Benefits may include health care, retirement savings, paid time off/vacation, and various employee discounts.\n   \n   Upon request and consistent with applicable laws, EssilorLuxottica will provide reasonable accommodations to individuals with disabilities who need assistance in the application and hiring process. To request a reasonable accommodation, please call the Luxottica Ethics Compliance Hotline at 1-888-887-3348 (be sure to provide your name and contact information so that we may follow up in a timely manner) or email HRCompliance@luxotticaretail.com.\n   \n   We are an Equal Opportunity Employer. All qualified applicants will receive consideration for employment without regard to race, color, gender, national origin, social origin, social condition, being perceived as a victim of domestic violence, sexual aggression or stalking, religion, age, disability, sexual orientation, gender identity or expression, citizenship, ancestry, veteran or military status, marital status, pregnancy (including unlawful discrimination on the basis of a legally protected pregnancy or maternity leave), genetic information or any other characteristics protected by law. Native Americans in the US receive preference in accordance with Tribal Law."
}