{
    "id": "23e2160b55ea211d",
    "company": "Business Sherpa Group",
    "positionName": "Academic Programs Specialist",
    "jobType": [],
    "location": "Ottawa, ON",
    "salary": null,
    "postingDateParsed": "2023-10-13T18:55:21.674Z",
    "url": "https://www.indeed.ca/rc/clk?jk=23e2160b55ea211d&from=jasx&tk=1hcvfr1frj4hv800&vjs=3",
    "externalApplyLink": "https://www.businesssherpagroup.com/job/academic-programs-specialist-sogc/",
    "job_info_group": {
        "extracted_phone_numbers": [],
        "extracted_links": [
            "HTTP/HTTPS Links",
            "General Links",
            "WWW Links",
            "TLDs"
        ],
        "extracted_emails": [],
        "extracted_location_data": [
            "(SOGC",
            "Canada",
            "SOGC",
            "Ottawa",
            "the SOGC",
            "The SOGC",
            "2023 Location Ottawa"
        ],
        "extracted_dates": [
            "academic days",
            "October 6",
            "one year Three weeks",
            "1944"
        ],
        "extracted_languages": [
            "English"
        ],
        "extracted_laws": [],
        "extracted_norps": [
            "French"
        ],
        "extracted_orgs": [
            "funded projects Establishes",
            "Coordinates the SOGC Resident Committee",
            "The Society of Obstetricians",
            "SharePoint",
            "The Academic Programs Specialist",
            "Communicates",
            "Coordinates the Abstract Program",
            "Science, Health or Education"
        ],
        "extracted_persons": [],
        "extracted_products": [
            "Word",
            "PowerPoint"
        ],
        "extracted_money": [],
        "processed_text": "Gynaecologists publish Hybrid Category Administration type associate description career established reputable national organization real difference woman's health employee offer comprehensive total compensation package include hybrid program Gynaecologists ongoing mission lead advancement woman's health excellence collaborative professional practice . comprise obstetrician gynaecologist family physician nurse midwife ally health professional field sexual reproductive health . continue lead national international authority sexual reproductive health evidence base training education . lead development \u2013 clinical practice guideline host regional continue medical education meeting Annual Clinical Scientific Conference . coordinate host person virtual academic program participant stage career medical student resident practice health professional . position description facilitate development implementation key aspect SOGC's academic program include education practice exam training stage practice . key responsibility coordinate activity academic program committee include postgraduate program director undergraduate program director content development event resident practice multiple choice exam medical student program abstract program SOGC's leadership team develop implement strategic plan academic program obstetric gynaecology Coordinates support development innovative education training include online course hand program organize process selection academic award monitor budget academic program regularly department obstetric gynaecology regard academic program SOGC initiative facilitate creation resource resident Identifies external funding educational innovation support preparation funding application execution maintain relationship internal external stakeholder duty Chief Scientific Officer qualification KEY SKILLS University degree \u2013 post graduate degree prefer demonstrate manage multiple project multiple stakeholder demonstrate project management include planning budget independently initiative possess depth knowledge field woman's reproductive health excellent oral write communication skill strong asset focus quality assurance strong attention detail demonstrate effectively prioritize execute task minimal supervision independently team orient collaborative environment proficient Microsoft Office user Excel Outlook Teams team player locate surround National Capital Region ADDITIONAL requirement weekend overtime evening teleconference month travel require demonstrate meet requirement position application cover letter . equal employer encourage qualified applicant apply . encourage application people . accommodation request aspect selection process . commit provide staff learn grow position organization . OFFER competitive salary benefit month pension matching vacation + week Christmas Hybrid flexible workplace split office office schedule apply interested position submit cover letter resume email . applicant interest select interview contact ."
    },
    "companyDescription": "",
    "description": "The Society of Obstetricians and Gynaecologists of Canada \n     \n      sogc.org \n     \n    \n   \n  \n  \n   \n    \n     Published \n    \n    \n     October 6, 2023 \n    \n   \n   \n    \n     Location \n    \n    \n     Ottawa (Hybrid), Canada \n    \n   \n   \n    \n     Category \n    \n    \n     Administration \n    \n   \n   \n    \n     Job Type \n    \n    \n     Full-time \n    \n   \n   \n    \n     Experience\n     \n    \n     Associate \n    \n   \n  \n  \n   Description \n   \n    Looking for a career opportunity with an established and reputable national organization that makes a real difference in women\u2019s health, values its employees and offers a comprehensive total compensation package including a hybrid working from home program? \n     The Society of Obstetricians and Gynaecologists of Canada\u2019s (SOGC) ongoing mission is to lead the advancement of women\u2019s health through excellence and collaborative professional practice. \n     The SOGC has over 3,000 members, comprised of obstetricians, gynaecologists, family physicians, nurses, midwives, and allied health professionals working in the field of sexual and reproductive health. \n     Since 1944, the SOGC continues to be a leading national and international authority on sexual and reproductive health and on evidence-based training and education. The SOGC leads the development of 12\u201317 clinical practice guidelines per year and hosts three regional continuing medical education meetings, and an Annual Clinical and Scientific Conference. The SOGC also coordinates and hosts in-person and virtual academic programs for participants at all stages of their career: medical students, residents and practicing health professionals. \n     POSITION DESCRIPTION \n     The Academic Programs Specialist facilitates the development and implementation of key aspects of the SOGC\u2019s academic programs, including education, practice exams, and training at all stages of practice. \n     KEY RESPONSIBILITIES \n    \n     Coordinates all activities of academic program committees including postgraduate program directors, undergraduate program directors, content development for academic days at events, resident practice multiple choice exam, medical student programs, and Best of the Best abstract program \n     Works with the SOGC\u2019s leadership team to develop and implement a strategic plan for the academic programs in obstetrics and gynaecology \n     Coordinates and supports the development of innovative education and training opportunities, including online courses and hands-on programs \n     Organizes the process and selection of Academic awards \n     Monitors budgets for academic programs \n     Communicates regularly with departments of obstetrics and gynaecology across Canada regarding academic programs and SOGC initiatives \n     Coordinates the SOGC Resident Committee and facilitates the creation of resources for residents \n     Coordinates the Abstract Program \n     Identifies opportunities for external funding for educational innovation, supports the preparation of funding applications and in the execution of funded projects \n     Establishes and/or maintains relationships with internal and external stakeholders \n     Other duties as needed by Chief Scientific Officer \n    \n    QUALIFICATIONS, EXPERIENCE and KEY SKILLS \n    \n     University degree in Science, Health or Education \u2013 Post-graduate degree preferred \n     Demonstrated experience in managing multiple projects with multiple stakeholders \n     Demonstrated experience in project management, including work planning and budgets \n     Ability to work independently and take initiative \n     Possesses an in-depth knowledge of the field of women\u2019s reproductive health \n     Excellent oral and written communication skills in English; Ability to work in French is a strong asset \n     Focuses on quality assurance and very strong attention to detail \n     Demonstrates ability to effectively prioritize and execute tasks with minimal supervision \n     Able to work both independently and in a team-oriented, collaborative environment \n     Proficient Microsoft Office user (Excel, Outlook, Word, PowerPoint, Teams, SharePoint) \n     Is a team player \n     Must be located in Ottawa or the surrounding National Capital Region \n    \n    ADDITIONAL JOB REQUIREMENTS \n    \n     Ability to work weekends and overtime \n     Ability to work evenings from home via teleconference 2-4 hours per month \n     Some travel may be required \n     \n    Please clearly demonstrate how you meet the requirements of the position in your application/cover letter. \n    The SOGC is an equal opportunity employer and encourages all qualified applicants to apply. SOGC welcomes and encourages applications from people with disabilities. Accommodations are available on request for candidates taking part in all aspects of the selection process. The SOGC is committed to providing opportunities for staff to learn and grow in their positions and across the organization. \n     WHAT WE OFFER \n    \n     Competitive salary \n     Benefits after three months \n     Pension matching after one year \n     Three weeks of vacation + a week off at Christmas \n     Hybrid flexible workplace split between in-office and home office schedules \n    \n    How to Apply \n     Should you be interested in this position, please submit your cover letter and resum\u00e9 via email here. \n     We thank all applicants for their interest; however, only those selected for an interview will be contacted."
}