{
    "id": "3b8896437c4bda3a",
    "company": "City of Ottawa",
    "positionName": "Project Management Technician",
    "jobType": [],
    "location": "Ottawa, ON",
    "salary": null,
    "postingDateParsed": "2023-10-16T18:53:20.739Z",
    "url": "https://www.indeed.ca/rc/clk?jk=3b8896437c4bda3a&from=jasx&tk=1hcvfn7eljiim800&vjs=3",
    "externalApplyLink": "https://jobs-emplois.ottawa.ca/city-jobs/job/Ottawa%2C-ON-Project-Management-Technician-ON/727916847/",
    "job_info_group": {
        "extracted_phone_numbers": [
            "613-580-2424",
            " 613-580-2424"
        ],
        "extracted_links": [
            "HTTP/HTTPS Links",
            "General Links",
            "WWW Links",
            "TLDs"
        ],
        "extracted_emails": [],
        "extracted_location_data": [
            "The City of Ottawa",
            "Nepean City",
            "Ottawa"
        ],
        "extracted_dates": [
            "5 years",
            "Standards and Quality Management Branch Employment Type: 2 Full-time Temporary (up to 2 years",
            "annually"
        ],
        "extracted_languages": [],
        "extracted_laws": [],
        "extracted_norps": [],
        "extracted_orgs": [
            "CUPE 503 Inside/Outside Salary Information",
            "MTO",
            "Construction Engineering",
            "Infrastructure & Water Services Department Service",
            "ON Job Category: Planning and Infrastructure Application",
            "Civil Engineering",
            "MAP",
            "the Human Resources Service Centre",
            "the Ontario Human Rights Code",
            "the Canadian Human Rights Act",
            "MOE",
            "the Quality Management System"
        ],
        "extracted_persons": [
            "COMPETENCIES"
        ],
        "extracted_products": [
            "Excel",
            "100 Constellation"
        ],
        "extracted_money": [
            {
                "amount": "82,264.00",
                "noun_phrases": []
            }
        ],
        "processed_text": "requisition department Infrastructure Services Branch hour week affiliation rate pay location close SUMMARY Quality Assurance Standards oversee Capital Project delivery practice include development maintenance City design construction standard guideline project quality management process development implementation reporting project construction quality assurance engineering standard . provide assistance design construction branch technical written communication aid coordination administration monitoring Infrastructure Services project . education completion community college program equivalent minimum design construction KNOWLEDGE basic principle sewer water roadway structure construction practice awareness stage project management understand correlation cost phase project OPSS city standard specification Computer application MS Word Access Computer Aided Design software municipal working environment include departmental council committee structure knowledge applicable health safety legislation include duty worker . skill communicate effectively public professional elect official contractor prepare clear concise technical report interpret compile datum statistic organize format strong communication organizational management skill strong interpersonal skill Neat legible writing skill high initiative minimal supervision Language Requirement english oral reading write initially pay starting rate pay collective agreement . formal training combine demonstrate performance substitute stipulate academic requirement . save copy poster . closing pass long . applicant interest effort apply position . select interview contact . promote principle diversity inclusion adhere tenet . encourage application Indigenous Black racialized community person woman binary person person ethnic origin religion sexual orientation class gender identity expression . encourage identify designate employment equity group identification questionnaire . provide accommodation hiring process request applicant . contact proceed selection process advise require accommodation . accessible format communication support request . contact extension ."
    },
    "companyDescription": "",
    "description": "Requisition ID: 9845 Department: Infrastructure & Water Services Department Service: Infrastructure Services Branch: Standards and Quality Management Branch Employment Type: 2 Full-time Temporary (up to 2 years) Work Hours: 35.00 hours per week Affiliation: CUPE 503 Inside/Outside Salary Information: $70,308.42 - $82,264.00 annually (2023 rates of pay) Location: 100 Constellation, Nepean City: Ottawa, ON Job Category: Planning and Infrastructure Application Close: 27/10/2023 \n       \n        \n         \n           JOB SUMMARY \n         \n         \n           Quality Assurance & Standards oversees Capital Project delivery practices including the development and maintenance of City design and construction standards and guidelines, project and quality management processes; development, implementation and reporting of project and construction quality assurance and engineering standards; and the Quality Management System. \n          You provide assistance to the design and construction branch through both technical and written communication, aiding with the coordination, administration and monitoring of Infrastructure Services projects. \n         \n        \n        \n         \n           EDUCATION AND EXPERIENCE \n         \n         \n           Completion of 2 year community college program in Civil Engineering, Construction Engineering or equivalent \n          Minimum of 5 years of related design and construction experience \n         \n        \n        \n         \n           KNOWLEDGE \n         \n         \n          \n           Basic principles of sewer, water, roadway, structures, construction practices \n           Awareness of various stages of project management to understand the correlation of costs with various phases of the project \n           OPSS, MTO, MOE and city standards and specifications \n           Computer applications (MS Word, Excel, Access, MAP and Computer Aided Design software) \n           Municipal working environment, including departmental, council and committee structure \n           Knowledge of applicable health and safety legislation, including the rights and duties of workers. \n          \n         \n        \n        \n         \n          COMPETENCIES, SKILLS AND ABILITIES \n         \n         \n          \n           Communicating effectively with the public, professionals, elected officials and contractors \n           Ability to prepare clear and concise technical report \n           Ability to interpret and compile data and statistics in an organized format \n           Strong communication, organizational and time management skills \n           Strong interpersonal skills \n           Neat and legible writing skills High initiative and ability to work with minimal supervision \n          \n         \n        \n       \n       WHAT YOU NEED TO KNOW \n       \n        Language Requirement: English oral, reading, writing \n        You may initially be paid 95% of your starting rate of pay, in accordance with the collective agreement. \n        Experience and formal training combined with demonstrated performance and ability may substitute for stipulated academic requirements. \n        Please save a copy of the job poster. Once the closing date has passed, it will no longer be available.\n       \n        \n        \n       We wish to thank all applicants for their interest and effort in applying for this position. Only candidates selected for interviews will be contacted.\n        \n        \n       The City of Ottawa promotes the principles of diversity and inclusion and adheres to the tenets of the Canadian Human Rights Act and the Ontario Human Rights Code. We encourage applications from members of Indigenous, Black and other racialized communities, persons with disabilities, women and non-binary persons, persons of all ethnic origins, religions, sexual orientations, classes, gender identities and expressions. Candidates are encouraged to self-identify as a member of one or more designated employment equity groups in the self-identification questionnaire.\n        \n        \n       The City of Ottawa provides accommodation during all parts of the hiring process, upon request, to applicants with disabilities. If contacted to proceed to the selection process, please advise us if you require any accommodation.\n        \n        \n       Accessible formats and communication supports are available upon request. Please contact the HR Service Centre at 613-580-2424, extension 47411."
}