{
    "id": "7c69bff5a01cdf0f",
    "company": "National Arts Centre",
    "positionName": "ASSOCIATE DIRECTOR - OPERATIONS",
    "jobType": [],
    "location": "Ottawa, ON",
    "salary": null,
    "postingDateParsed": "2024-01-20T05:08:01.070Z",
    "url": "https://www.indeed.ca/rc/clk?jk=7c69bff5a01cdf0f&from=jasx&tk=1hkik8vp5k633800&bb=3fcFSWL0Q64YUe5hx9GNdsoDG0SZIXy2a_m_X6TRR3p2aArvUTBkMMewN33Qb_juvwfE4nuHEskOnj6hTwK_GMhRB_xwFzihyrIxlit8oRWT1S2jPTcfyA%3D%3D&xkcb=SoCW67M3FSgsJ1gB1z0JbzkdCdPP&vjs=3",
    "externalApplyLink": "https://nac.njoyn.com/cl4/xweb/xweb.asp?tbtoken=Z1teRRlbDVB2a3N3N10iFE9JBmFcaVVYd1JMIi1%2Be3lZXEVuLzFvdxB8BU0YGhJWTHJiF3U%3D&chk=ZVpaShM%3D&CLID=74526&page=jobdetails&JobID=J0124-0933&lang=1",
    "job_info_group": {
        "extracted_phone_numbers": [],
        "extracted_links": [
            "HTTP/HTTPS Links",
            "General Links",
            "WWW Links",
            "TLDs"
        ],
        "extracted_emails": [],
        "extracted_location_data": [
            "Canada"
        ],
        "extracted_dates": [
            "our 2023-2026 Strategic Plan",
            "Monday to Friday",
            "February 18, 2024",
            "January 19, 2024 Closing Date:"
        ],
        "extracted_languages": [
            "English"
        ],
        "extracted_laws": [],
        "extracted_norps": [
            "French"
        ],
        "extracted_orgs": [
            "Knowledgeable in Health and Safety",
            "First Aid",
            "the National Arts Centre",
            "The NAC",
            "WHMIS",
            "Popular Music and Variety",
            "the Anishinabe Algonquin Nation",
            "Fire",
            "The National Arts Centre",
            "MandE",
            "Engineering or Project Management",
            "MS Project",
            "English Theatre",
            "the NAC",
            "the NAC Orchestra, Dance",
            "mechanical & electrical systems",
            "French Theatre, Indigenous Theatre",
            "Working Hours",
            "Executive Director of Operations and Security Services",
            "MS Office",
            "Preference",
            "the Executive Director of Operations and Security Services"
        ],
        "extracted_persons": [],
        "extracted_products": [
            "Demonstrate"
        ],
        "extracted_money": [
            {
                "amount": "$114,000.00 - $",
                "noun_phrases": []
            },
            {
                "amount": "142,500.00",
                "noun_phrases": []
            }
        ],
        "processed_text": "introduce NAC Canada's multi disciplinary perform art . NAC create produce produce perform art programming stream nurture generation audience artist . locate traditional unceded unsurrendered territory . perform art vital human . house dream canadian perform art artist art organization land revitalize sector . curious learn read . Equity Diversity Inclusion Anti Racism accessibility journey commit ensure equity diversity inclusion accessibility anti racism reconciliation indigenous people guide action . application help meet vision contribute diversity live perspective approach . join inclusive community hard dismantle barrier employee ' access potential success . actively seek identify woman Indigenous Black person Colour IBPoC 2slgbtqia+ community people . encourage identify recruitment process . number J0124 title associate DIRECTOR OPERATIONS Employment Type continue Category Operations Open Positions posting salary Language Requirement asset week . position benefit pension plan . report . Key Activities report incumbent responsible implementation recapitalization project include administrative activity duty relate management construction project contract . successful lead construction initiative relate building include limit building envelope building structure interior exterior vertical transportation design service mechanical electrical system . ensure interfere NAC's programming operational constraint . strong link construction activity nac department stakeholder . additional responsibility include limit create tracking project management benchmark include scope budget construction schedule implement quality assurance procedure ensure construction practice meet NAC standard manage procurement recapitalization service NAC policy maintain accurate building system documentation ensure standard safe working condition place uphold provide regular briefing Associate Director Executive Director project status risk incumbent emergency . skill Requirements Bachelor degree preferably technical certification field engineering architecture building relate field minimum construction project environment equivalent combination education knowledgeable project management principal technique relate real property construction building asset infrastructure interior fit include planning development delivery phase project procurement process contract management construction engineering service familiar applicable code regulation safety standard Building Plumbing Electrical code high degree professionalism integrity fairness respect ethic interaction dealing demonstrate deal multiple stakeholder client diverging Superior analytical problem solve skill decision making skill leadership skill financial management knowledge good organizational skill initiative autonomy initiative limited supervision collaborate effectively advance computer software knowledge include . working knowledge asset pressure react emergency situation regulation proof valid driver's license equivalent class permit clean driver abstract certification training definite asset require hire official language asset oral write record satisfactory attendance punctuality requirement . regular attendance expectation employment essential . apply person reside canadian citizen reside abroad . canadian citizen . NAC's interview process person interview require . ensure information resume include current email address . appreciate application select interview contact . Notice National Arts Centre NAC commit inclusive employee recruitment selection . encourage application people . require accommodation selection process inform effort fulfill accommodation request . successful require provide original true certify copy education credential appropriate proof valid Criminal Background check condition employment ."
    },
    "companyDescription": "",
    "description": "Introducing the National Arts Centre The National Arts Centre (NAC) is Canada's bilingual, multi-disciplinary home for the performing arts. The NAC presents, creates, produces, and co-produces performing arts programming in various streams-the NAC Orchestra, Dance, English Theatre, French Theatre, Indigenous Theatre, and Popular Music and Variety-and nurtures the next generation of audiences and artists from across Canada. The NAC is located on the traditional, unceded, unsurrendered territory of the Anishinabe Algonquin Nation.  At the National Arts Centre, we believe the performing arts are vital to the human experience. A house of dreams for the Canadian performing arts, we work with artists and arts organizations from across this land to revitalize our sector.  Curious to learn more? Read our 2023-2026 Strategic Plan, The Journey Ahead.  Equity, Diversity, Inclusion, Anti-Racism and Accessibility We are on a journey, committed to ensuring that equity, diversity, inclusion, accessibility, anti-racism and reconciliation with Indigenous peoples will guide our actions.   The NAC welcomes applications from candidates who can help us meet our vision, and contribute to the diversity of lived experiences, perspectives, and approaches. When you join the NAC, you will be part of an inclusive community working hard to dismantle barriers to employees' well-being, access, potential, and success. The NAC actively seeks candidates who identify as women, Indigenous, Black, Persons of Colour (IBPoC), members of 2SLGBTQIA+ communities, and people with disabilities. We encourage you to self-identify in the recruitment process. \n  \n \n \n  \n   Job Number: J0124-0933 \n  \n  \n   Job Title: ASSOCIATE DIRECTOR - OPERATIONS \n  \n  \n   Employment Type: Full-Time continuing \n  \n  \n   Job Category: Operations \n  \n  \n   Open Positions: 1 \n  \n  \n   Posting Date: January 19, 2024 \n  \n  \n   Closing Date: February 18, 2024 \n  \n  \n   Salary: $114,000.00 - $142,500.00/Year \n  \n  \n   Language Requirement: Bilingual is an asset \n  \n  \n   Working Hours: Monday to Friday, 9:00 a.m. to 5:00 p.m. (35 hours per week). Position with benefits and pension plan. \n  \n  \n   Job Reports To: Executive Director of Operations and Security Services.\n    \n  \n \n  \n  \n  \n \n \n  \n   Key Activities \n   \n    Reporting to the Executive Director of Operations and Security Services, the incumbent is responsible for the implementation of recapitalization projects including all administrative activities and duties relating to the management of construction projects and contracts. The successful candidate will lead all construction initiatives related to the building, including but not limited to: building envelope, building structure, interior and exterior works, vertical transportation, design services and mechanical and electrical systems at the National Arts Centre. The candidate will also ensure that work does not interfere with the NAC\u2019s programming and operational constraints. You will be a strong link between the construction activity and various NAC departments and stakeholders.\n     \n     Additional responsibilities include but are not limited to:\n     \n     \n    \n     Creating and tracking project management benchmarks including scope of work, budget and construction schedules;\n     Implementing quality assurance procedures to ensure construction practices meet NAC standards;\n     Managing procurement of recapitalization services working in accordance with NAC policies;\n     Maintain accurate building system documentation;\n     Ensuring standards for safe working conditions are in place and upheld;\n     Providing regular briefings to Associate Director and Executive Director on project status and risk;\n     The incumbent must be available for emergency calls and for work after regular business hours.\n    \n    \n  \n  \n   Skill Requirements \n   \n    Bachelor degree preferably in Engineering or Project Management or a technical certification in the field of engineering, architecture, buildings, M&E or related fields with a minimum of approximately ten (10) years experience in a construction or project environment or an equivalent combination of education and experience;\n    Knowledgeable in project management principals and techniques related to real property, construction of buildings, assets, mechanical & electrical systems, infrastructure, and interior fit up, including planning and development to the delivery phase of the project;\n    Experience in procurement processes and contract management for construction and engineering services;\n    Familiar with applicable code regulations and safety standards such as Fire, Building, Plumbing and Electrical code;\n    Demonstrate a high degree of professionalism, integrity, fairness, respect, and ethics in all interactions and dealings;\n    Demonstrated experience in dealing with multiple stakeholder/clients and diverging needs;\n    Superior analytical and problem-solving skills, decision making skills, leadership skills and financial management knowledge;\n    Good organizational skills, initiative and autonomy;\n    Ability to take initiative and work with limited supervision;\n    Ability to collaborate and work effectively with others;\n    Advance computer software knowledge including MS Office. Working knowledge of MS Project would be an asset;\n    Ability to work under pressure and to react quickly in emergency situations;\n    Knowledgeable in Health and Safety regulations;\n    Proof of a valid driver\u2019s license (equivalent to an Ontario G class permit) and clean driver abstract;\n    First Aid certification and WHMIS training a definite asset and will be required upon hire;\n    Bilingual in both official languages is an asset (English and French), oral and written;\n    A past record of satisfactory attendance and punctuality is a requirement*.\n   \n    \n   \n    Regular attendance at work is an expectation of employment and an essential part of every job.\n    \n  \n  \n   Who Can Apply \n   Persons residing in Canada and Canadian citizens residing abroad. Preference will be given to Canadian citizens.  As part of NAC's interview process, in-person interviews may be required. Please ensure to have the most up-to-date information on your r\u00e9sum\u00e9 including your current email address.  While we appreciate all applications, only those selected for an interview will be contacted by us. \n  \n  \n   Important Notice \n   The National Arts Centre (NAC) is committed to inclusive employee recruitment and selection. The NAC welcomes and encourages applications from people with disabilities. If you require accommodation during the selection process, please inform us as soon as possible and we will make every effort to fulfill your accommodation request.  The successful candidate will be required to provide the original or a true certified copy of their education credentials as appropriate, along with proof of a valid Criminal Background Check as a condition of employment."
}