{
    "id": "e12699284148d5a8",
    "company": "Defence Construction Canada",
    "positionName": "Coordinator, Professional Services Contracts",
    "jobType": [],
    "location": "National Capital Region, ON",
    "salary": null,
    "postingDateParsed": "2023-10-17T18:52:00.458Z",
    "url": "https://www.indeed.ca/rc/clk?jk=e12699284148d5a8&from=jasx&tk=1hcvfkunqk7dc802&vjs=3",
    "externalApplyLink": "https://ca.indeed.com/rc/clk?jk=e12699284148d5a8&atk=&xpse=SoBm67I3JfXXuHSKLx0LbzkdCdPP",
    "job_info_group": {
        "extracted_phone_numbers": [],
        "extracted_links": [
            "HTTP/HTTPS Links",
            "General Links",
            "WWW Links",
            "TLDs"
        ],
        "extracted_emails": [
            "careers@dcc-cdc.gc.ca"
        ],
        "extracted_location_data": [
            "Canada"
        ],
        "extracted_dates": [
            "17 weeks",
            "five years",
            "10 years",
            "two years",
            "at least 5 years"
        ],
        "extracted_languages": [],
        "extracted_laws": [
            "the Code"
        ],
        "extracted_norps": [
            "Indigenous Peoples"
        ],
        "extracted_orgs": [
            "Telus Virtual Health Care Maternity",
            "the Standard on Security Screening",
            "DCC Employees",
            "Working",
            "e.g. Certified Engineering Technologist",
            "DCC",
            "the contract and payment certification Develop",
            "Defence Construction Canada",
            "the Client Partners",
            "Health and safety management Formal Education and/or Certification(s",
            "the Canadian Human Rights Act",
            "the Client-Partners",
            "LEADERSHIP Provides",
            "DCC's Code of Business Conduct",
            "the President's Office",
            "Coordinator, Professional Services Contracts",
            "Project",
            "Prepare"
        ],
        "extracted_persons": [],
        "extracted_products": [
            "Deluxe"
        ],
        "extracted_money": [
            {
                "amount": "$300 Wellness Allowance",
                "noun_phrases": [
                    "$300 Wellness Allowance"
                ]
            },
            {
                "amount": "1,500",
                "noun_phrases": []
            }
        ],
        "processed_text": "apply internal external General Public Salary range employment status Continuing Term length security level Secret Language Requirement Preferred Closing country report title Program Leader Coordinator Professional Services Contracts manage administer medium risk professional service contract . incumbent manage contract relate risk manage multiple contract require provide regular report supervisor . incumbent manage contract cost scope schedule . addition incumbent monitor submission coordinate review consultant deliverable confirm compliance contract . incumbent manage Client Partner relationship consultant performance document key communication consultant Client Partner project manager apprise contract risk status . key periodic activity duty responsibility list representative inclusive Primary Manage multiple contract compete priority require provide support coordinate service . e.g. pre tender review manage risk associate contract estimate negotiate cost additional contract scope ensure consultant deliverable comply contract requirement e.g. review invoice statement deliverable carry quality assurance contract write contract performance review Track monitor schedule include milestone deliverable manage financial aspect maintain effective relationship industry stakeholder ensure quality standard meet corporate Client Partner expectation manage risk associate contract Review statement problem relate contract management visit construction site coordinate construction phase activity performance construction coordinator ensure consultant comply health safety industrial security environmental requirement support lead business development activity duty assign SKILLS General Specific Knowledge good practice method trend legislation professional service Estimation fee professional service construction product material procurement mechanism contract law consultant bidding process design process typical deliverable e.g. pre design schematic design design development construction document contract risk management principle Minimum college diploma engineering architecture field year' relevant equivalent Preferred certification applicable field applicable computer software operating system apply project contract risk management technique development functional advice guidance employee Client partner working condition typical office environment occasional travel locate construction site incumbent occasionally require wear basic safety equipment check benefit offer excellent growth \u2013 entitle market's good benefit package . role package salary . package include public service pension employer pay annual sick leave health dental premium life accidental death shortand long term insurance e.g. gym membership mental health service regular paramedical coverage Health Care Spending Account medical expense cover provincial plan standard insurance plan parental leave plan regular gross earning maximum hybrid workplace option include allowance support option enhance inconfidence employee family assistance program travel benefit plan comprehensive vacation pay leave plan career canadian Citizen permanent resident . condition employment minimum reliability security status clearance require role require secret security status clearance . responsible Personnel Security Clearance process . typically eligible reliability clearance verifiable background information eligible secret clearance verifiable background information . process involve reference inquiry verification qualification criminal record check credit check require require fingerprint . information security clearance review . appropriate security clearance condition employment candidate's employee's responsibility ensure maintain require security level clearance continue employment . failure maintain appropriate level security clearance employee receive offer conditional offer render null void employment terminate . thorough security clearance process apply employee consider appointment process include inquiry verification assessment regard matter limit criminal record check reference check previous employment open source check credit financial status Code condition employment . serve enhance public confidence integrity provide clarity employee number issue include real perceive conflict interest . apply position familiarize Code employee require certify read understand agree observe Code commence . employee require review obligation notify change circumstance early complete Annual Update . diverse inclusive workplace committed ensure voice authentic workplace . actively encourage application include limit woman person visible minority LGBTQ2 + community . application canadian citizen eligible verifiable background information . equal employer consider request accommodation base medical contraindication religion prohibit ground discrimination . require accommodation email ."
    },
    "companyDescription": "",
    "description": "Who Can Apply?:\n     \n    \n     Internal (DCC Employees) and External (General Public)\n     \n   \n   \n    \n     Salary Range:\n     \n    \n     $72,119- $97,360\n     \n   \n   \n    \n     Employment status:\n     \n    \n     Continuing\n     \n   \n   \n    \n     Term Length:\n     \n   \n   \n   \n    \n     Security Level:\n     \n    \n     Secret\n     \n   \n   \n    \n     Language Requirement:\n     \n    \n     Bilingual Preferred\n     \n   \n   \n    \n     Closing Date:\n     \n    \n     30/10/23\n     \n   \n   \n    \n     Country:\n     \n    \n     Canada\n     \n   \n   \n    \n     Reporting to (Title):\n     \n    \n     Program Leader\n     \n    \n  \n \n \n \n  The Coordinator, Professional Services Contracts, manages and administers medium-risk professional services contracts. The incumbent manages contract-related risks, manages multiple contracts, as required, and provides regular reports to supervisors and the Client Partners. The incumbent manages the contract cost, scope and schedule. In addition, the incumbent monitors submissions and coordinates the review of consultant deliverables to confirm compliance with the contract. The incumbent also manages the Client-Partner relationship and consultant performance, documents key communications with consultants and keeps Client-Partner project managers apprised of contract risks and status. \n   KEY AND PERIODIC ACTIVITIES  The duties and responsibilities listed below are representative but not all-inclusive:  Primary \n   \n   Manage multiple contracts and competing priorities, as required \n   Provide support to and coordinate work with other service lines. (e.g. on pre-tender reviews) \n   Manage risks associated with contracts \n   Prepare estimates and negotiate costs for additional contract scope \n   Ensure consultant deliverables comply with contract requirements (e.g. review invoices, statements of work, deliverables) \n   Carry out quality assurance for contract work and write contract performance reviews \n   Track and monitor schedule, including all milestone deliverables \n   Manage the financial aspects of the contract and payment certification \n   Develop and maintain effective relationships within DCC, and with industry, the Client-Partners and/or stakeholders \n   Ensure quality standards are met, in line with corporate and Client-Partner expectations \n   Manage risks associated with contracts \n   \n  Other \n   \n   Review statements of work for problems related to contract management \n   Visit construction sites, and coordinate construction-phase activities and performance with construction coordinators \n   Ensure consultant work complies with health and safety, industrial security and environmental requirements \n   Support and/or lead business development activities \n   Other duties as assigned \n   \n  SKILLS  General and Specific Knowledge \n   \n   Best practices, methods, trends and legislation in professional services \n   Estimation of fees for professional services \n   Construction products and materials \n   Procurement mechanisms, contract law and consultant bidding process \n   Design process and typical deliverables (e.g. pre-design, schematic design, design development, construction documents) \n   Project, contract and risk management principles \n   Health and safety management \n   \n  Formal Education and/or Certification(s) and Experience \n   \n   Minimum: college diploma in engineering, architecture or related field with four years\u2019 relevant experience, or the equivalent \n   Preferred: certification in applicable field (e.g. Certified Engineering Technologist) \n   \n  Abilities \n   \n   Use applicable computer software and operating systems \n   Apply project, contract and risk management techniques \n   \n  DEVELOPMENT AND LEADERSHIP \n   \n   Provides functional advice and guidance to employees and to Client-Partners \n   \n  WORKING CONDITIONS \n   \n   Typical office environment with occasional travel \n   Some work may be located on construction sites; incumbent may occasionally be required to wear basic safety equipment \n   \n  \n   Check out the benefits\n  \n   \n   \n  \n    Working with DCC offers excellent opportunities for growth \u2013 and entitles you to one of the job market\u2019s best benefits packages. In your role as Coordinator, Professional Services Contracts, your package is valued at 25% to 30% of your salary.\n  \n   \n   \n  \n    Your package will include:\n  \n   \n   \n   \n   Public service pension \n   100% employer-paid annual sick leave, health and dental premiums, and life, accidental death, and short- and long-term disability insurance \n   $300 Wellness Allowance (e.g., gym membership) \n   $1,500 for mental health services on top of regular $1,500 paramedical coverage \n   $750 Health Care Spending Account (for some medical expenses that aren\u2019t covered under provincial plans or our standard insurance plan) \n   Telus Virtual Health Care \n   Maternity and parental leave top-up plan to 93% of regular gross earnings for a maximum of 17 weeks \n   Hybrid workplace options including $400 allowance every two years to support work-from-home options \n   Enhanced inConfidence employee and family assistance program \n    Deluxe travel benefit plans \n   Comprehensive vacation and other paid leave plans \n   \n \n \n \n  \n   \n    \n     \n      To begin a career with Defence Construction Canada (DCC), you must be a Canadian Citizen or a permanent resident of Canada. As a condition of employment with DCC, a minimum reliability security status clearance is required and some roles may require secret security status clearance.\n       \n      \n       DCC is responsible for the Personnel Security Clearance process. Typically to be eligible for a \"Reliability\" clearance, you must have five years of verifiable background information and to be eligible for a \"Secret\" clearance, you must have 10 years of verifiable background information. The process usually involves reference inquiries, verification of qualifications, criminal records checks, and credit checks (as required) and may require fingerprints. For more information about obtaining a security clearance, please review the Standard on Security Screening.\n       \n      \n       The appropriate security clearance is a condition of employment and it is the candidate\u2019s or employee\u2019s responsibility to ensure, they are able to obtain and maintain their required security level clearance to begin or continue their employment with DCC. Failure to obtain or maintain, the appropriate level of security clearance means either the candidate or employee will not receive a job offer, the conditional offer will be rendered null and void or their employment will be terminated with cause. A thorough security clearance process will be applied to all candidates or employees considered for an appointment; this process includes inquiries, verifications and assessments regarding matters such as, but not limited to:\n       \n       \n      \n      \n       criminal record checks\n      \n       \n      \n        reference checks\n      \n       \n      \n        previous employment\n      \n       \n      \n        open source checks\n      \n       \n      \n        credit/financial status\n      \n     \n     \n       \n     \n     DCC's Code of Business Conduct (Code) is a condition of employment. It serves to enhance public confidence in the integrity of DCC Employees and provides clarity to Employees on a number of issues, including real or perceived conflicts of interest. Before applying to this (or any) position at DCC, candidates shall familiarize themselves with the Code, because new employees are required to certify that they have read, understood, and agreed to observe the Code upon commencing work at DCC. Employees are further required to review their obligations under the Code and notify the President's Office of any changes in their circumstances at the earliest possible opportunity, and to complete the Annual Update once a year.\n     \n     \n       Be part of a diverse and inclusive workplace!\n       \n      \n       At DCC, we are committed to ensuring everyone has a voice and can be their authentic selves in our workplace. We actively encourage applications from all, including but not limited to, women, Indigenous Peoples, persons with disabilities, visible minorities and members of the LGBTQ2+ community. We also welcome applications from those who are not Canadian citizens who are eligible to work in Canada and have at least 5 years of verifiable background information.\n       \n      \n       DCC is an equal opportunity employer and will consider all requests for accommodation based on a medical contraindication, religion or another prohibited ground for discrimination under the Canadian Human Rights Act. Should you require accommodation, please email careers@dcc-cdc.gc.ca."
}