{
    "id": "224a96241aa8d177",
    "company": "Bruy\u00e8re Continuing Care",
    "positionName": "Research Associate I",
    "jobType": [],
    "location": "Ottawa, ON",
    "salary": null,
    "postingDateParsed": "2023-09-12T22:41:39.948Z",
    "url": "https://www.indeed.ca/pagead/clk?mo=r&ad=-6NYlbfkN0Az2iNjeEfHXNwE0SzwhSkmDNQI8i9Vjon05RnpHnjhnTRb7LUcI3252DSCathDV_mYJh-z1DkuVxKYYx2qaWvNijvvD4BTtGg7Hv9QV1VNrTJt92ntVYzSfRcFQpILgn74CRlRgGyTSgFjKph2_XbxRDcowM2ohFYS6-sZcx_qPZzpg6UNKhtD_jIXEv0mU30YzVJyWWwCLh3FgVB4NST_pOZNnks_FASn_RZWhefB5BHIFVqpDZg-KqHRAwBY7BdKZyHueqINyhUZkO3dNE1rSYFzvuLLxDe7CSXbW5YPVloi6YaDrbqWN_CroLL4Ptp0o3VbZvBbWgshcDNIswY7udEebwRpYznx1v90M5oMeFQjMRi40b9O8MNHG2AVPzKQFZ8ftOWAAUr_qmOikw-Oo5eFapMq7Qvzov4-3g5S2UmVqqJV-wLNXnDiml92UpwN5kmBscEoRTUtfCFTFA0ld9k5t4hsZfGtSVZa1a-8V_VfStroruAK6Zqngtg0mTFNvb9CeIOBo_mK4iFXg4YLzwZwp0ZjRQb18xpRyeSgBr9nv8mb9vM3&xkcb=SoB3-_M3Ki2RxaS2IJ0LbzkdCdPP&p=0&fvj=0&vjs=3&jsa=1500&tk=1hb2v7gsrk60m800&from=jasx&wvign=1",
    "externalApplyLink": "https://www.bruyere.org/en/hr?job=17997",
    "job_info_group": {
        "extracted_phone_numbers": [],
        "extracted_links": [
            "HTTP/HTTPS Links",
            "General Links",
            "WWW Links",
            "TLDs"
        ],
        "extracted_emails": [
            "Resources@bruyere.org"
        ],
        "extracted_location_data": [],
        "extracted_dates": [
            "2023"
        ],
        "extracted_languages": [
            "English",
            "French"
        ],
        "extracted_laws": [],
        "extracted_norps": [],
        "extracted_orgs": [
            "an experienced and motivated Research Associate",
            "Bruy\u00e8re Continuing Care",
            "BRI",
            "(i.e., R-Programming",
            "The Ottawa Hospital Research Institute",
            "Communicate",
            "the University of Ottawa",
            "BRI-Human Resources@bruyere.org Attention Human Resources",
            "Bruy\u00e8re Research Institute",
            "your Curriculum Vitae",
            "the Bruy\u00e8re Research Institute",
            "OHRI",
            "Develop",
            "SAS",
            "Required Qualifications",
            "Microsoft Word"
        ],
        "extracted_persons": [
            "Dr. Kobewka",
            "Dr. Daniel Kobewka"
        ],
        "extracted_products": [
            "Excel"
        ],
        "extracted_money": [],
        "processed_text": "Bruyere Research Institute partner stakeholder conduct relevant practical health science research relate medical education improve quality life age population people require continue care . function summary research team lead investigator clinical scientist . team focus build evidence inform care planning share decision making patient life . research team focus improve communication decision making people illness life . illness treatment prolong life case harm increase discomfort prolong suffering . people illness open communication goal critical . communication happen treatment inconsistent goal administer . illness care inform matter person realistic prognosis outcome matter people . lab create clarification tool prognostic model inform illness decision making . join . join research team . role participate conceptualization development ongoing future program research team growth contribute aspect research design analysis dissemination . activity include coaching mentorship team collaborator development research objective grant development maintain data integrity strong methodological contribution plan execute qualitative quantitative analysis . main duty responsibility undertake contribute health research project vary complexity apply appropriate quantitative qualitative research method e.g. literature review interview survey statistical model produce high quality write research report datum analysis plan executive summary blog datum visualization proposal interpret datum result ease clarity key message visualization range audience write grant proposal \u2013 include limit budget planning literature review administrative grant task collaborator meeting update request specific feedback plan budget individual project program research \u2013 review current budget estimate require fund overtime maintain administrative record institutional research ethic ICES privacy documentation ongoing complete project support team cohesion growth include provide mentorship team improve skill knowledge independence confidence provide area manage project \u2013 include lead project coach project lead e.g. collaborate clinical expert junior team student . plan project typically manuscript series project help ensure step execute accord timeline budget research standard effectively team clinical collaborator colleague research advisor patient partner external stakeholder provide logistical support research relate task \u2013 include scheduling host attend regular meeting ongoing administrative collaborator correspondence coordinate Research Institutes' Finance Human Resources team pertain team management budgeting staff hiring onboarde maintain system track progress research project stakeholder outreach additional duty add project progress competency graduate degree msc biostatistic epidemiology equivalent Minimum year' clinical health service research include lead manage multi study demonstrate training quantitative study design methodology study project management academic research environment peer mentorship mentorship research student staff exceptional writing skill communicate effectively variety audience proven expertise lead research study e.g. peer review publication research product demonstrate expertise advanced data analysis technique knowledge computer software package include PowerPoint independently collaboratively strong organizational interpersonal skill set priority deliver high quality product meet deadline excellent communication skill write oral English Fluent asset Preferred Competencies ICES datum internally analyst student collaborate researcher research staff write grant peer review publication design study conduct statistical analysis STATA . interpret result proactive approach study planning understanding research lifecycle health service clinical research project follow area asset predictive modelling systematic review clinical decision making adult population life long term care research interested submit cover letter resume subject \u2013 . note incomplete application review . equal employer diversity workplace . qualified applicant receive consideration employment base skill outline cover letter . commit develop inclusive barrier free selection process environment . contact regard competition advise accommodation measure require enable assess fair equitable manner . researcher employee student long term care college university partner require comply vaccination policy external organization complete . note vaccination policy subject change . requirement comply evolve policy change . interest position choose interview contact . Bruyere employee require provide proof vaccination enhanced covid immunization policy . extra information process submission . press refresh ."
    },
    "companyDescription": "",
    "description": "The Bruy\u00e8re Research Institute partners with Bruy\u00e8re Continuing Care, the University of Ottawa and other stakeholders to conduct relevant and practical health sciences research related to medical education and improving the quality of life for the aging population and people requiring continuing care.\n  \n  \n  \n  \n Function Summary We are a research team led by Dr. Daniel Kobewka, who is an investigator at the Bruy\u00e8re Research Institute (BRI) and is a clinical scientist at The Ottawa Hospital Research Institute (OHRI). Our team focuses on building evidence that informs care planning and shared decision-making, for older patients and those at the end of life.\n  \n  Our research team is focused on improving communication and decision making for people with serious illness and for those nearing the end of their lives. During serious illness treatments to prolong life may not work in some cases cause harm by increasing discomfort or prolonging suffering. For people with serious illness open communication about their goals and wishes is critical. Unfortunately, when communication does not happen, treatments that are inconsistent with their goals may be administered. Serious illness care needs to be informed by what matters most to the person and by realistic prognoses for the outcomes that matter most to people. Our lab works to create values clarification tools and prognostic models to inform serious illness decision making. Join us in this important work.\n  \n  We are looking for an experienced and motivated Research Associate to join our research team. This role participates in the conceptualization and development of the ongoing and future programs of research and team growth by contributing to all aspects of the research design, analysis and dissemination. These activities include coaching and mentorship of team members and collaborators, the development of research objectives, grant development, maintaining data integrity, and strong methodological contributions to planning and executing both qualitative/quantitative analyses.\n  \n  \n  \n  \n Main duties and responsibilities\n \n   Undertake and contribute to health research projects of varying complexity applying appropriate quantitative and/or qualitative research methods (e.g., literature reviews, interviews, surveys, and statistical models)\n   Produce high quality, well written research reports, data analysis plans, executive summaries, blogs, data visualizations, and proposals\n   Interpret data results with ease and clarity into key messages and visualizations for a range of audiences\n   Plan and write grant proposals \u2013 this includes but is not limited to budget planning, literature review, administrative grant tasks, collaborator meetings, updates, or requests for specific feedback\n   Plan budget for individual projects and programs of research \u2013 reviewing current budgets and estimating the required funds overtime\n   Maintain up-to-date administrative records of institutional research ethics and ICES privacy documentation for each ongoing and completed project\n   Support team cohesion and growth, which includes providing mentorship to team members to improve their skills, knowledge, independence, confidence, and/or provide experience in a new area\n   Manage the project \u2013 this may include both leading projects and coaching other project leads (e.g., collaborating clinical expert, junior team member, student, etc.) in planning a project (typically a manuscript within a series of projects) and helping ensure each step is executed according to timelines, budget, and research standards\n   Communicate effectively with team members, clinical collaborators, colleagues, research advisors, patient partners, and external stakeholders\n   Provide logistical support for research-related tasks \u2013 this may include scheduling, hosting, attending regular meetings, as well as ongoing administrative and collaborator correspondence\n   Communicate and coordinate with Research Institutes\u2019 Finance and HR teams as it pertains to team management (namely for budgeting, staff hiring, and onboarding)\n   Develop and maintain systems to track progress of research projects and stakeholder outreach\n   Additional duties may be added as projects progress\n \n  Required Qualifications and competencies\n \n   Graduate degree (MSc or PhD) in biostatistics, epidemiology, or equivalent\n   Minimum four (4) years\u2019 experience in clinical or health services research, including leading or managing multi-year studies\n   Demonstrated training and experience in quantitative study design and methodology \n  Experience in study or project management in an academic research environment \n  Experience with peer-mentorship or mentorship of research students and/or staff \n  Exceptional writing skills and ability to communicate effectively across a variety of audiences\n   Proven expertise leading research studies (e.g., peer-reviewed publications or other research products)\n   Demonstrated expertise with advanced data analysis techniques\n   Knowledge of computer software packages including Microsoft Word, Excel, PowerPoint\n   Ability to work independently and collaboratively\n   Strong organizational and interpersonal skills\n   Ability to set priorities, deliver high quality products and meet deadlines\n   Excellent communication skills, written and oral, in English\n   Fluent in French and English, an asset\n \n  Preferred Competencies\n \n   Experience with ICES data, either internally (analyst or student) or as collaborating researcher or research staff\n   Experience writing grants and peer-reviewed publications\n   Experience in designing studies, conducting statistical analyses (i.e., R-Programming, SAS, STATA, etc.) and interpreting the results\n   Proactive approach to study planning, with an understanding of the research lifecycle for both health services and clinical research projects\n   Experience in the following areas is an asset: predictive modelling, systematic reviews, clinical decision-making, older adult populations, end-of-life or long-term care research\n \n \n   If you are interested in this opportunity, please submit your cover letter and resume to\n \n \n   BRI-HR@bruyere.org\n \n \n   Attention Human Resources with subject line \u201cResearch Associate I \u2013 Dr. Kobewka\u201d,\n \n \n   no later than October 6, 2023.\n \n \n   Please note that incomplete applications may not be reviewed.\n \n  Bruy\u00e8re Research Institute is an equal opportunity employer and values diversity in its workplace. All qualified applicants will receive consideration for employment based on skills and experience as outlined in your CV and cover letter.\n  \n  Bruy\u00e8re Research Institute is committed to developing inclusive, barrier-free selection processes and work environments. If contacted regarding this competition, please advise of the accommodation measures which may be required to enable you to be assessed in a fair and equitable manner.\n  \n  All researchers, employees and students of the Bruy\u00e8re Research Institute who will work with long-term care homes, colleges, universities and other partners are required to comply with the vaccination policies of those external organizations to complete their work. Of note, vaccination policies are subject to change. The requirement to comply with those evolving policies does not change.\n  \n  We thank you for your interest in this position, however; only those chosen for an interview will be contacted.\n  \n  All Bruy\u00e8re employees are required to provide proof of full vaccination as per our Enhanced COVID-19 Immunization policy. Extra Information:\n  \n  \n  \n \n \n  \n   \n    We are processing your submission.\n     \n    Please do not press back or refresh."
}