{
    "id": "f1dd55977484a147",
    "company": "LifeLabs",
    "positionName": "Lab Patient Technician- Part Time Regular",
    "jobType": [],
    "location": "Ottawa, ON",
    "salary": null,
    "postingDateParsed": "2023-10-25T20:06:48.357Z",
    "url": "https://www.indeed.ca/rc/clk?jk=f1dd55977484a147&from=jasx&tk=1he3lftbdk7tt800&vjs=3",
    "externalApplyLink": "https://ca.indeed.com/rc/clk?jk=f1dd55977484a147&atk=&xpse=SoBh67I3IDjLXDwYrh0LbzkdCdPP",
    "job_info_group": {
        "extracted_phone_numbers": [],
        "extracted_links": [
            "HTTP/HTTPS Links",
            "General Links",
            "WWW Links",
            "TLDs"
        ],
        "extracted_emails": [
            "careers@lifelabs.com"
        ],
        "extracted_location_data": [
            "Canada",
            "Ottawa"
        ],
        "extracted_dates": [
            "occasional Saturdays",
            "today",
            "the Orleans site weekdays",
            "over 50 years"
        ],
        "extracted_languages": [],
        "extracted_laws": [],
        "extracted_norps": [
            "Canadians"
        ],
        "extracted_orgs": [
            "Canada's Best Employers",
            "Benefits Canada",
            "Customer Driven",
            "an award-winning Mental Health Program",
            "the Accessibility for Ontarians with Disabilities Act",
            "LifeLabs Medical Laboratory Services",
            "Graduate",
            "the Ontario Human Rights Code",
            "LifeLabs' Accessibility Policy",
            "Forbes"
        ],
        "extracted_persons": [],
        "extracted_products": [],
        "extracted_money": [],
        "processed_text": "LifeLabs large community diagnostic laboratory serve healthcare . team centre customer lab requisition sample test investment technology individual family count . consistently LifeLabs recognize . passion commitment diverse innovative team unite motivate ensure customer receive high quality test result trust . agile customer centre caring teamwork live support customer healthcare provider drive forward vision empower healthy . difference \u2013 join LifeLabs team help improve patient' healthcare outcome . canadian company year' . provide laboratory testing service help healthcare provider diagnose treat monitor prevent disease patient . LifeLabs currently Lab Patient Technician join team successful schedule . schedule support nearby psc cover vacation sick . lab Patient Technician responsible specimen collection process greet patient preparation specimen transportation . role patient care business difference patient' life . regular role suitable individual flexible schedule include pick additional shift LifeLabs location . role greet request require information patient explain specimen collection process ensure patient follow test protocol prior specimen collection . perform phlebotomy connect disconnect holter monitor perform ECG tracing . perform special test collection medical legal drug screen paternity test clinical trial complete documentation . maintain client relationship include respond inquiry follow request . complete datum entry require patient demographic requisition information information relate process test result . prepare specimen transportation testing . person role focus great customer patient service relate patient client stressful situation . key quality include empathy flexibility adaptability change problem solve skill . requirement include approve Laboratory Assistant program equivalent . phlebotomy . excellent communication skill . good computer skill minimum typing speed wpm . maintain strict standard patient privacy confidentiality . passionate individual share Caring agile Team live . ready difference apply . LifeLabs strive create inclusive equitable workplace team community serve feel accept respect . accommodation request aspect recruitment selection process . confidential inquiry request accommodation contact recruiter email . LifeLabs commit provide safe environment employee customer community serve . leader covid pandemic regard health safety measure employee customer center decision . organization health care sector covid vaccination add layer protection complement extensive health safety protocol . mind currently require LifeLabs employee contractor student volunteer fully vaccinate . LifeLabs operate distribute workforce model employee flexibility key priority . information provide interview process employee ."
    },
    "companyDescription": "",
    "description": "LifeLabs is the largest community diagnostics laboratory in Canada, serving the healthcare needs of Canadians for over 50 years. Our team members are truly centred around our customers, and we know that behind every lab requisition, sample being tested, or investment in technology is an individual and their family counting on us. \n Consistently named one of Canada's Best Employers by Forbes, LifeLabs has also been recognized for having an award-winning Mental Health Program from Benefits Canada. The passion and commitment of over 6,000 diverse and innovative team members unites and motivates us to ensure our customers receive high quality tests and results that they can trust. Agile, customer-centred, caring and teamwork: we live these values every day in what we do to support our customers and healthcare providers, driving forward our vision of empowering a healthier you.\n  Make a difference \u2013 join the LifeLabs team today!\n  Do you want to help improve patients\u2019 healthcare outcomes? Now you can. LifeLabs Medical Laboratory Services is a proud Canadian company with over 50 years\u2019 experience. We provide laboratory testing services that help healthcare providers diagnose, treat, monitor and prevent disease in patients.\n \n  LifeLabs is currently looking for a Lab Patient Technician to join our team in Ottawa, ON\n \n  The successful candidate will be scheduled at the Orleans site weekdays and occasional Saturdays. The candidate may also be scheduled to support at nearby PSCs to cover vacation or sick calls.\n \n  As a Lab Patient Technician you will be responsible for the specimen collection process, from greeting patients through to preparation of specimens for transportation. This is an important role in patient care and our business, and will let you see the difference that you make in patients\u2019 lives. This is a Regular Part Time role suitable for an individual with a flexible schedule and includes the opportunity to pick up additional shifts at other LifeLabs locations.\n  In this role you will:\n  \n \n   Greet and request required information from patients, explain the specimen collection process, and ensure patients have followed necessary test protocol prior to specimen collection.\n   Perform phlebotomies, connect/disconnect holter monitors, and perform ECG tracings.\n   Perform special test collections, such as medical/legal drug screens, paternity tests, and clinical trials, and complete related documentation.\n   Maintain client relationships, including responding to inquiries and following up on requests.\n   Complete data entry of required patient demographics, requisition information, and other information related to processing test results.\n   Prepare specimens for transportation and testing.\n \n \n  The right person for this role will be focused on great customer/patient service, and be able to relate to patients and clients even in stressful situations. Some key qualities include: empathy, flexibility, adaptability to change, and problem solving skills. Other requirements include\n  \n \n   Graduate of an approved Laboratory Assistant program or equivalent.\n   Phlebotomy experience.\n   Excellent communication skills.\n   Good computer skills with a minimum typing speed of 40 wpm.\n   Ability to maintain the strictest standards of patient privacy and confidentiality.\n \n  We are looking for passionate individuals who share in the importance of our values: Caring, Customer Driven, Agile and One Team and can live these values with us every day.\n \n  Ready to make a difference? Apply today.\n  At LifeLabs, we strive to create an inclusive and equitable workplace where our team members and the communities we serve feel accepted, valued, and respected.\n  In accordance with LifeLabs\u2019 Accessibility Policy, the Accessibility for Ontarians with Disabilities Act, and the Ontario Human Rights Code, accommodations are available by request for candidates taking part in all aspects of the recruitment and selection process. For a confidential inquiry or to request an accommodation, please contact your recruiter or email careers@lifelabs.com. \n LifeLabs is committed to providing a safe environment for our employees, customers, and the communities we serve. We have been a leader throughout the COVID-19 pandemic regarding health and safety measures and have always put our employees and customers at the center of every decision that we make. As an organization in the health care sector, we believe the COVID vaccination adds a layer of protection that complements the extensive and necessary health and safety protocols that we have taken to date. With this in mind, we currently require all LifeLabs employees, contractors, students and volunteers to be fully vaccinated. \n LifeLabs operates under a distributed workforce model, where employee flexibility is a key priority. Further information will be provided during the interview process on what this means for employees."
}