{
    "id": "49af1c76fd9f79d2",
    "company": "SOTAX",
    "positionName": "Lab Technician (CDD)",
    "jobType": [],
    "location": "Orleans, ON",
    "salary": null,
    "postingDateParsed": "2023-10-01T20:10:19.240Z",
    "url": "https://www.indeed.ca/rc/clk?jk=49af1c76fd9f79d2&from=jasx&tk=1hgol9m42jjhg800&vjs=3",
    "externalApplyLink": "https://ca.indeed.com/rc/clk?jk=49af1c76fd9f79d2&atk=&xpse=SoBY67I3IDjRWLW5ZZ0LbzkdCdPP",
    "job_info_group": {
        "extracted_phone_numbers": [],
        "extracted_links": [
            "HTTP/HTTPS Links",
            "General Links",
            "WWW Links",
            "TLDs"
        ],
        "extracted_emails": [
            "pharmaservices@sotax.com"
        ],
        "extracted_location_data": [
            "soumission au"
        ],
        "extracted_dates": [],
        "extracted_languages": [],
        "extracted_laws": [],
        "extracted_norps": [
            "Orl\u00e9ans"
        ],
        "extracted_orgs": [
            "avec les exigences",
            "envois r\u00e9guliers des r\u00e9sultats",
            "avec les r\u00e8glementations BPF/ Good Manufacturing Practice",
            "www.sotax.com Par ailleurs",
            "avec l'\u00e9quipe Assurance Qualit\u00e9",
            "th\u00e9oriques et pratiques de l'High-Performance Liquid Chromatography/ UPLC",
            "nous commercialisons nos appareils et les prestations de services associ\u00e9es \u00e0 une",
            "Ainsi",
            "d'une Licence Pro",
            "un entretien r\u00e9gulier A la gestion des syst\u00e8mes informatis\u00e9s du laboratoire",
            "d\u00e9bouch\u00e9 en CDI probable R\u00e9mun\u00e9ration envisag\u00e9e :",
            "avec les Chefs de Projets",
            "BPF/ Good Manufacturing Practice",
            "vous organisez et participez \u00e0 la conception",
            "temps plein",
            "Autonomie",
            "La connaissance des logiciels Empower\u2122 et / ou WinSOTAX\u00ae",
            "avec prise",
            "occuper cette fonction",
            "exp\u00e9rience pass\u00e9e dans",
            "Gr\u00e2ce \u00e0 notre organisation internationale",
            "la r\u00e9alisation, l'\u00e9valuation, la fiabilit\u00e9 et la communication des r\u00e9sultats des \u00e9tudes analytiques",
            "selon profil Avantages",
            "notamment \u00e0 l'international",
            "High-Performance Liquid Chromatography",
            "Au quotidien",
            "Votre fonction Votre"
        ],
        "extracted_persons": [
            "commandes de r\u00e9actifs",
            "relevant du champ de la chimie",
            "mutuelle",
            "et les \u00e9volutions de celles-ci Votre profil Vous \u00eates titulaire d'un DUT",
            "notamment bureautiques",
            "Ou par courrier",
            "A la gestion des achats",
            "Envoyer votre candidature d\u00e9taill\u00e9e",
            "Afin d'accompagner la croissance de la soci\u00e9t\u00e9",
            "Karl Fischer",
            "Lieu de Travail",
            "vous prendrez donc",
            "\u00e9chelle mondiale",
            "Granulom\u00e9trie",
            "interm\u00e9diaires et de fin d'\u00e9tude",
            "assurer le suivi des analyses qui vous sont confi\u00e9es",
            "De ce fait",
            "Id\u00e9alement",
            "KF",
            "Duret\u00e9"
        ],
        "extracted_products": [],
        "extracted_money": [],
        "processed_text": "SOTAX est leader sur marche des instruments controle dans domaine des industry pharmaceutique . SOTAX est groupe pleine expansion . . SOTAX Pharma Services souhaite aujourd'hui recruter au sein ses laboratoires d'Orleans France Technicien Chimiste CDD contrat propose cdd mois mois restaurant d'entreprise avec prise charge employeur salarie isole forfait famille charge employeur Loiret deplacement tres ponctuel mission principale consiste . . cela se traduira par Realisation autonomie des analyses selon des methodes etablie exploiter les resultat essais dissolution analyse UV ... . Developpement validation des nouvelles methodes analytiques participation redaction des methodes d'analyse coordination . Redaction des comptes rendus sur les analyses effectuees validation des resultats avant responsable . Assurer qualite fiabilite des donnees ainsi leur tracabilite appliquant niveau qualite requis . Interpretation des donnees obtenue proposition cas echeant solution . communication avec les Clients pendant cycle vie du projet redaction des rapports ... . participation des reunion projet . revue des procedure Standard Operating Procedures place leur mise jour l'implementation celle necessaires fonctionnement accord l'installation qualification des equipement suivi metrologique statut qualification Au maintien des conditions du laboratoire par validation sauvegarde ... gestion des stock du laboratoire destruction des dechet ... Aux action formation ponctuellement l'encadrement des stagiaires . vous serez directement implique dans gestion du systeme qualite pharmaceutique collaboration pour participation support dans cadre des audit inspection suivi des action participation l'amelioration continue des process du niveau qualite accord bts issu tous ces diplome analytique des sciences vie . vous pouvez justifier d'une domaine pharmaceutique laboratoire Research Development Controle Qualite . Vous possedez bonnes connaissance des essais dissolution ainsi des methodes d'analyse Spectro uv visible ir ... . Votre maitrise l'anglais vous permet comprendre rediger des document technique ainsi d'utiliser les differentes pharmacopees . Vous utilisez maniere courante les outils informatique . serait . sens l'organisation esprit d'equipe seront des qualites necessaires pour . Interesse Curriculum Vitae lettre motivation Par email SOTAX Pharma Services rue Chateaubriand Orleans Cedex France"
    },
    "companyDescription": "",
    "description": "SOTAX est leader sur le march\u00e9 des instruments de contr\u00f4le \n   dans le domaine des industries pharmaceutiques. SOTAX est \n   un groupe en pleine expansion. Gr\u00e2ce \u00e0 notre organisation \n   internationale, nous commercialisons nos appareils et les \n   prestations de services associ\u00e9es \u00e0 une \u00e9chelle mondiale. \n   Afin d\u2019accompagner la croissance de la soci\u00e9t\u00e9, notamment \u00e0 l\u2019international, SOTAX Pharma Services souhaite  aujourd\u2019hui recruter au sein de ses laboratoires d\u2019Orl\u00e9ans (France) un \n   \n   Technicien Chimiste H/F  (CDD)   \n   Contrat propos\u00e9 : CDD 12 mois \u00e0 temps plein, d\u00e9bouch\u00e9 en CDI probable \n   R\u00e9mun\u00e9ration envisag\u00e9e : selon profil \n   Avantages : 13\u00e8me mois, restaurant d\u2019entreprise (avec prise en charge employeur), mutuelle  (salari\u00e9 isol\u00e9 ou forfait famille, avec prise en charge employeur de 60%) \n   Lieu de Travail : Orl\u00e9ans (Loiret, R\u00e9gion Centre-Val de Loire) \n   D\u00e9placements : tr\u00e8s ponctuels \n   \n   Votre fonction \n   Votre mission principale consiste \u00e0 assurer le suivi des analyses qui vous sont confi\u00e9es. Ainsi, vous organisez et  participez \u00e0 la conception, la r\u00e9alisation, l\u2019\u00e9valuation, la fiabilit\u00e9 et la communication des r\u00e9sultats des \u00e9tudes  analytiques. \n   Au quotidien, cela se traduira par : \n   \n    R\u00e9alisation, en autonomie, des analyses selon des m\u00e9thodes \u00e9tablies et en exploiter les r\u00e9sultats \n   (essais de dissolution, analyses HPLC, UV, KF, Duret\u00e9, Granulom\u00e9trie\u2026). \n   \n    D\u00e9veloppement et validation des nouvelles m\u00e9thodes analytiques et participation \u00e0 la r\u00e9daction des m\u00e9thodes \n   d\u2019analyse, en coordination avec les Chefs de Projets. \n   \n    R\u00e9daction des comptes-rendus sur les analyses effectu\u00e9es et validation des r\u00e9sultats avant soumission au \n   responsable. \n   \n    Assurer la qualit\u00e9 et la fiabilit\u00e9 des donn\u00e9es ainsi que leur tra\u00e7abilit\u00e9 en appliquant le niveau de qualit\u00e9 requis \n   (BPF/ GMP). \n   \n    Interpr\u00e9tation des donn\u00e9es obtenues et proposition, le cas \u00e9ch\u00e9ant, de solutions. \n   \n   \n    Communication avec les Clients pendant le cycle de vie du projet (envois r\u00e9guliers des r\u00e9sultats, r\u00e9daction \n   des rapports interm\u00e9diaires et de fin d'\u00e9tude, etc\u2026). \n   \n    Participation \u00e0 des r\u00e9unions \"projet\". \n   \n   De ce fait, vous prendrez donc part : \n   \n    A la revue des proc\u00e9dures (SOPs) en place, leur mise \u00e0 jour et \u00e0 l\u2019impl\u00e9mentation de celles n\u00e9cessaires \u00e0 un \n   fonctionnement en accord avec les r\u00e8glementations BPF/ GMP ; \n   \n    A l\u2019installation et la qualification des \u00e9quipements : suivi m\u00e9trologique et statut de qualification ; \n   \n   \n    Au maintien des conditions du laboratoire par un entretien r\u00e9gulier \n   \n   \n    A la gestion des syst\u00e8mes informatis\u00e9s du laboratoire : validation, sauvegardes, etc\u2026 \n   \n   \n    A la gestion des stocks du laboratoire : commandes de r\u00e9actifs, destructions des d\u00e9chets, etc\u2026 \n   \n   \n    Aux actions de formation et ponctuellement \u00e0 l\u2019encadrement des stagiaires ; \n   \n   \n    A la gestion des achats. \n   \n   \n   www.sotax.com \n  \n \n \n \n  \n   Par ailleurs, vous serez directement impliqu\u00e9 dans la gestion du syst\u00e8me qualit\u00e9 pharmaceutique en collaboration  avec l\u2019\u00e9quipe Assurance Qualit\u00e9 pour : \n   \n    Participation et support dans le cadre des audits/inspections et suivi des actions \n   \n   \n    Participation \u00e0 l\u2019am\u00e9lioration continue des process et du niveau de qualit\u00e9 en accord avec les exigences et les \n   \u00e9volutions de celles-ci \n   Votre profil \n   \n    Vous \u00eates titulaire d\u2019un DUT, BTS ou issu d\u2019une Licence Pro, tous ces dipl\u00f4mes relevant du champ de la \n   chimie analytique ou des sciences de la vie. Id\u00e9alement, vous pouvez justifier d\u2019une exp\u00e9rience pass\u00e9e dans \n    le domaine pharmaceutique (laboratoire de R&D ou Contr\u00f4le Qualit\u00e9). \n   \n    Vous poss\u00e9dez de bonnes connaissances th\u00e9oriques et pratiques de l\u2019HPLC/ UPLC, des essais de dissolution \n   ainsi que des m\u00e9thodes d\u2019analyse (Spectro UV-Visible, IR, Karl Fischer, etc\u2026). \n   \n    Votre ma\u00eetrise de l\u2019anglais vous permet de comprendre et r\u00e9diger des documents techniques ainsi que \n   d\u2019utiliser les diff\u00e9rentes pharmacop\u00e9es. \n   \n    Vous utilisez de mani\u00e8re courante les outils informatiques, notamment bureautiques. La connaissance des \n   logiciels Empower\u2122 et / ou WinSOTAX\u00aeplus serait un plus. \n   \n    Autonomie, sens de l\u2019organisation et esprit d\u2019\u00e9quipe seront des qualit\u00e9s n\u00e9cessaires pour occuper cette \n   \n   fonction. \n   Int\u00e9ress\u00e9? \n   Envoyer votre candidature d\u00e9taill\u00e9e (CV et lettre de motivation) : \n   \n    Par email : pharmaservices@sotax.com \n   \n   \n    Ou par courrier : SOTAX Pharma Services \n   3 rue Chateaubriand \n    45071 Orl\u00e9ans Cedex 2 \n    France \n   \n   www.sotax.com"
}