{
    "id": "cb7bceb274590f9c",
    "company": "Maximus",
    "positionName": "Bilingual Supervisor - Contact Centre - Federal",
    "jobType": [
        "Full-time"
    ],
    "location": "Ottawa, ON",
    "salary": "$59,543.57\u2013$64,048.99 a year",
    "postingDateParsed": "2024-01-27T12:12:58.117Z",
    "url": "https://www.indeed.ca/rc/clk?jk=cb7bceb274590f9c&from=jasx&tk=1hl5db43ij458800&bb=KvwRMHBYecBH_BhsdnvHhnPjSKrgboIH1dLO7h7H-ey0ItDMZ0HSlF2807j0kOkkWMwHY5YMOZ_cqDChPzPSQ5xFPR4WVUqMpPIDSDbuWkEbMvziz0omwg%3D%3D&xkcb=SoDy67M3FlSjXfRcgp0JbzkdCdPP&vjs=3",
    "externalApplyLink": "https://can-external-maximus.icims.com/jobs/95829/job?utm_source=indeed_integration&iis=Job%20Board&iisn=Indeed&indeed-apply-token=73a2d2b2a8d6d5c0a62696875eaebd669103652d3f0c2cd5445d3e66b1592b0f&mode=job&iis=Internet+-+Indeed&iisn=Indeed.com",
    "job_info_group": {
        "extracted_phone_numbers": [],
        "extracted_links": [
            "HTTP/HTTPS Links",
            "General Links",
            "WWW Links",
            "TLDs"
        ],
        "extracted_emails": [],
        "extracted_location_data": [
            "Italy",
            "Sweden",
            "the United Kingdom",
            "Singapore",
            "the United States",
            "South Korea",
            "Saudi Arabia",
            "Australia"
        ],
        "extracted_dates": [
            "Three weeks",
            "each month",
            "February 09, 2024",
            "Your typical week"
        ],
        "extracted_languages": [
            "English"
        ],
        "extracted_laws": [
            "each challenge Collaboration - Partnering"
        ],
        "extracted_norps": [
            "French"
        ],
        "extracted_orgs": [
            "Additional Information",
            "Human Resources",
            "Workflow Streams Per Department",
            "PowerPoint",
            "SLO",
            "Contact Centre operations Knowledge",
            "Maximus Canada",
            "paid vacation Group Retirement Savings Plan Hybrid",
            "SLR",
            "Federal Reliability Security Clearance",
            "Recruit",
            "MAXIMUS Canada",
            "Customer Focus - Cultivating",
            "various Healthcare Administration",
            "Job Description: Department Overview"
        ],
        "extracted_persons": [
            "Maximus"
        ],
        "extracted_products": [
            "Word, Excel"
        ],
        "extracted_money": [],
        "processed_text": "company profile Maximus share authentic desire meaningful help succeed . apply deep operational expertise technology innovation digitally enable citizen engagement help government solve complex problem . reinvent government agency engage citizen seek government solve complex problem . support Employment Citizen service program worldwide . mission affect fundamental change life individual engage touchpoint . ultimately improve people's life . testament ingenuity commitment compassion bring role dedication connect citizen service Government agency . encourage application people . accommodation request aspect selection process support service connect citizen information referral quick high satisfaction . position summary Supervisor lead team staff handle variety . Supervisor responsible deliver departmental strategic outcome coaching mentoring employee development drive performance attendance management outcome participate internal external project initiative . role require solid leadership technical competency ensure Service Level target departmental key performance indicator key Performance Indicators meet . tight deadline detailed client deliverable require supervisor manage stream agility confidence utilize diverse competency profile motivate employee high performance culture . Maximus Lead workforce order meet enhance employee engagement performance communicate execute business goal high performance culture . assign workflow oversee departmental activity effective utilization resource system . identify improvement Continuous Improvement agent lead change . customer focus ensure strong business relationship build internally externally daily activity project relate initiative . play key role change management encourage innovation creativity . implement goal create individual team goal advocate employee empowerment accountability . lead workforce contribute positive workplace growth successful business . duty require offer Knowledge Skills Abilities select hire individual qualified perform requirement position . provide leadership ensure Quality Assurance goal meet . monitor track report designate number Quality Assurance check employee . initiate appropriate timing phase performance management continuum identify high perform high potential employee facilitate development stretch assignment employee development strategy . ensure compliance daily weekly monthly workflow schedule . investigate resolve employee client escalation regard business policy procedure . report system failure appropriate temporarily change process ensure meet . ensure process adhere client policy . review policy procedure document recommendation update procedure policy change . perform supervisory duty human standard effective management principle manner foster productive employee . initiate idea generate solution benefit team department company . i.e. analyze resolve root performance inhibitor recommend resource change recommend process change . communicate verbally write concisely appropriate tone message . escalate resource workforce process concern manager colleague timely manner . acknowledge reward employee achievement formal informal employee recognition activity program . chair team committee meeting inform convey clear consistent compelling message link employee company's business goal positive quality drive workplace culture . collaborate client client' affiliate Maximus stakeholder recommend change business policy process . education Minimum year' supervise operational unit employee current relevant centre leadership asset post secondary education business administration human relation public administration . depth knowledge principle employee engagement motivation proven business process improvement principle relate human employment standard legislation proficient knowledge MS Office suite . clear offer enable continuously raise bar serve citizen worldwide . offer follow competitive market base salary Comprehensive employer pay benefit remote environment Workplace Telework allowance employee appreciation event passionate employee place center people strategy . committed build workforce reflect community serve . diversity equity inclusion invite interested individual apply encourage application people indigenous ethnic cultural origin sexual orientation gender identity recognize paramount growth success organization . Salary Range \u2013 cdn Maximus Global Core accountability accept responsibility solve problem rise instill trust Compassion empower humanity apply empathy insight interaction authentic desire help succeed innovation embrace change champion forward respect people serve accept application Project Manager . note application appreciate select interview contact . Agencies"
    },
    "companyDescription": "As a well-respected government contractor, we\u2019re moving people forward by providing transformative technology services, digitally enabled customer experiences, and clinical health services that change lives. \r\n\r\nOur employees share an authentic desire to make vital services available to the public and support the mission of our customers. This is why we\u2019re committed to creating the best employee experience possible\u2014 continuously improving our compensation offers, benefits, work environment, diversity, equity, and inclusion initiatives, and engagement events.  \r\n\r\n",
    "description": "Company Profile: \n \n   About Maximus\n \n \n   At Maximus, we share an authentic desire to do something meaningful to help others succeed. We apply our deep operational expertise, technology innovation, and digitally enabled citizen engagement in new ways and help governments solve complex problems.\n \n \n \n   Maximus has been reinventing the way government agencies engage with citizens and are sought out by governments to solve complex problems. By supporting various Healthcare Administration, Employment and Citizen service programs worldwide in the United States, Australia, Italy, Saudi Arabia, Singapore, South Korea, Sweden and the United Kingdom.\n \n \n \n   Our mission is to affect fundamental change in the lives of every individual with whom we engage and at every touchpoint. But ultimately, what we do is improve people\u2019s lives. And that is a testament to the ingenuity, commitment, and compassion everyone brings to their role at Maximus and their dedication to connecting citizens with the services they need from Government agencies.\n \n \n \n   We welcome and encourage applications from people with disabilities. Accommodations are available on request for candidates taking part in all aspects of the selection process\n  Job Description: \n  Department Overview\n \n \n   This is a front line support service connecting citizens with all the information and referrals they need quicker and with higher satisfaction.\n \n \n   \n \n Position Summary\n \n  The Supervisor leads a team of 15 to 25 staff who handle a variety of calls. The Supervisor is responsible for delivering departmental strategic outcomes, coaching/mentoring, employee development, driving performance and attendance management outcomes, and participating in internal and external projects and initiatives.\n \n  The role requires solid leadership and technical competencies to ensure Service Level targets and departmental key performance indicators (KPI\u2019s) are met. Tight deadlines along with detailed client deliverables require the supervisor to manage several streams of work with agility and confidence, and to utilize a diverse competency profile to motivate employees within a high performance culture.\n \n  Your typical week at Maximus\n  \n \n \n   Lead the workforce in order to meet SLR\u2019s and SLO\u2019s, enhance employee engagement and performance, communicate and execute business goals, all within a high performance culture.\n   Assign workflow and oversee departmental activities for effective utilization of resources and systems.\n   Identify opportunities for improvement and work with the Continuous Improvement agents to lead change.\n   Customer focus: ensure strong business relationships are built internally and externally while working on daily activities and project-related initiatives.\n   Play a key role in change management by encouraging innovation and creativity.\n   Implement goals: create individual and team goals, while at the same time advocating employee empowerment and accountabilities.\n   Lead the workforce to contribute to a positive workplace and to the growth of a successful business.\n   Other duties as required\n \n \n  What you offer us\n  Knowledge, Skills and Abilities\n  \n \n \n   Recruit, select and hire individuals most qualified to perform the requirements of each position.\n   Provide leadership to ensure Quality Assurance goals are met.\n   Monitor, track and report a designated number of Quality Assurance checks for each employee, each month.\n   Initiate appropriate timing and phases of the performance management continuum:\n   Identify high-performing/high-potential employees and facilitate development through \u201cstretch assignments\u201d or other employee development strategies available. \n  Ensure compliance with daily/weekly/monthly workflow schedules (see Workflow Streams Per Department).\n   Investigate and resolve employee/client escalations regarding business policies or procedures.\n   Report system failures immediately and, when appropriate, temporarily change processes to ensure SLR\u2019s are met.\n   Ensure all processes adhere to client and MAXIMUS Canada policies.\n   Review policies and procedure documents and make recommendations for updates due to procedure or policy changes.\n   Perform all supervisory duties in accordance to human rights standards and effective management principles, in a manner that fosters productive employees.\n   Initiate and act on ideas, and generate solutions that benefit your team, department, and company. (i.e., analyze and resolve root causes of performance inhibitors, recommend resource changes, recommend process changes).\n   Communicate verbally and in writing clearly and concisely, with an appropriate tone and message.\n   Escalate resource, workforce or process concerns to managers, HR, and colleagues in a timely manner.\n   Acknowledge and reward employee achievement through formal and informal employee recognition activities or programs.\n   Chair team and committee meetings to inform, and to convey a clear, consistent, and compelling message that links employees to the company\u2019s business goals and to a positive, quality-driven workplace culture.\n   Collaborate with clients, clients\u2019 affiliates and Maximus stakeholders to recommend changes to business policies and processes.\n \n \n  Education and Experience\n  \n \n \n   Minimum 2 years\u2019 experience supervising an operational unit of a least 15 employees\n   Current and/or relevant call centre leadership experience an asset\n   Related post-secondary education in business administration, human relations, public administration, etc.\n   In-depth knowledge of Contact Centre operations\n   Knowledge of the principles of employee engagement and motivation\n   Proven experience in business process improvement\n   Principles related to human rights and employment standards legislation\n   Proficient knowledge of MS Office suite; Word, Excel, PowerPoint, etc.\n \n  \n Other\n \n   Must clear Federal Reliability Security Clearance\n   Must be bilingual (French and English)\n \n  What we offer you \n \n  We value your work, which enables us to continuously raise the bar on how we can best serve citizens worldwide. Maximus Canada offers the following:\n \n  \n \n \n   Competitive market-based salaries\n   Comprehensive employer-paid benefits\n   Three weeks of paid vacation\n   Group Retirement Savings Plan\n   Hybrid and remote work environments in Canada\n   Workplace Telework allowance \n  Employee appreciation events\n \n \n   \n \n \n  Maximus is passionate about our employees and place their well-being at the center of our people strategy. We are committed and proud to build a workforce that reflects the communities we serve. We value diversity, equity and inclusion and invite all interested individuals to apply and encourage applications from people with disabilities, Indigenous, ethnic and cultural origins, sexual orientations and gender identities recognizing that this is paramount for the growth and success of our organization.\n \n \n \n   Salary Range \u2013 $59,543.57 - $64,048.99 CDN\n \n \n  Maximus Global Core Values\n \n   Accountability - Accepting responsibility to solve problems and rise to each challenge\n   Collaboration - Partnering to instill trust and working as one\n   Compassion - Empowering humanity by applying empathy and insight to every interaction\n   Customer Focus - Cultivating an authentic desire to help others succeed\n   Innovation - Embracing change and championing new ways forward\n   Respect - Valuing the work we do, who we do it with, and the people we serve\n \n  \n  Additional Information: \n \n   We will be accepting applications until 11:59 PM on February 09, 2024.\n \n \n \n   Please note that while all applications are appreciated, only those candidates selected for an interview will be contacted\n  . \n  (No Agencies, Please)"
}