{
    "id": "c4b0ebbf483162ad",
    "company": "National Research Council Canada",
    "positionName": "Technical Officer, Contaminated Sites",
    "jobType": [],
    "location": "1200 Montreal Rd, Ottawa, ON",
    "salary": null,
    "postingDateParsed": "2023-10-17T20:07:13.662Z",
    "url": "https://www.indeed.ca/rc/clk?jk=c4b0ebbf483162ad&from=jasx&tk=1hcvfjcolkedt800&vjs=3",
    "externalApplyLink": "https://ca.indeed.com/rc/clk?jk=c4b0ebbf483162ad&atk=&xpse=SoBX67I3IDjIXuQd7p0LbzkdCdPP",
    "job_info_group": {
        "extracted_phone_numbers": [
            " 613-298-5697",
            "613-298-5697"
        ],
        "extracted_links": [
            "HTTP/HTTPS Links",
            "General Links",
            "WWW Links",
            "TLDs"
        ],
        "extracted_emails": [
            "Canada.NRCHiring-EmbaucheCNRC.CNRC@nrc-cnrc.gc.ca"
        ],
        "extracted_location_data": [
            "Canada"
        ],
        "extracted_dates": [
            "Tuesday 7 November - 23:59",
            "more than 2 years",
            "months",
            "the last 6 years"
        ],
        "extracted_languages": [
            "English"
        ],
        "extracted_laws": [
            "the Bilingualism Bonus of $800"
        ],
        "extracted_norps": [],
        "extracted_orgs": [
            "Preference",
            "(e.g., Canadian Environmental Protection Act",
            "the National Research Council Canada",
            "National Research Council Canada's Health, Safety and Environment Branch",
            "the National Research Council Canada HSE Branch",
            "Canada Labour Code",
            "The HSE Branch",
            "your Education",
            "National Research Council Canada",
            "National Research Council Canada.NRCHiring-EmbaucheCNRC.CNRC@nrc-cnrc.gc.ca Telephone",
            "Contaminated Sites Group",
            "The National Research Council",
            "Science or Engineering",
            "Education University",
            "the National Research Council of Canada (National Research Council Canada",
            "Behavioural Competencies Technology",
            "Health, Safety and Environment",
            "Canadian Citizens and Permanent Residents of Canada",
            "Treasury Board Policies",
            "Health, Safety and the Environment",
            "Integrity, Excellence",
            "the Federal Contaminated Sites Action Plan"
        ],
        "extracted_persons": [],
        "extracted_products": [],
        "extracted_money": [
            {
                "amount": "73,744",
                "noun_phrases": []
            },
            {
                "amount": "94,839",
                "noun_phrases": []
            }
        ],
        "processed_text": "help bring research life drive career forward large research technology organization . Technical Officer Specialist Contaminated Sites . select share core respect creativity . love variety enjoy respond unexpected achieve objective people person passionate improve health safety environmental management place peer colleague describe result oriented team player strong communication problem solve skill answer ... consider join team . operate lab research facility country unique challenge relate health safety environmental management . involve innovative research transportation engineering life medical science emerge technology computer science electronic astronomy nanotechnology . area wide exciting variety health safety environment relate aspect range worker health protection animal safety biosafety radiation safety hazardous material management noise air emission waste water specie risk list . HSE proactively establish promote implement good practice health safety environmental management . provide enable support service National Research Council Canada's Research Development activity assure health safety employee neighbouring community environment . team proactively provide leadership advise guide researcher trade people engineer manager contractor HSE good management practice . closely regulatory authority help ensure National Research Council Canada's operation compliant applicable federal provincial municipal law policy . shop touch aspect contaminate site management . technical administrative staff consultant National Research Council business unit responsible ordination National Research Council Canada's contaminate site project support program . gain practical assessment remediation risk management contaminate site strategic planning operation procurement contract management program management technical review financial management stakeholder relation . screen Criteria Applicants demonstrate content application meet follow screening criterion order consideration degree recognize post secondary institution acceptable specialization relevant position e.g. chemistry geology physics biology ecology biochemistry environmental science environmental chemical civil engineering . Equivalency College diploma relevant field expertise consider . information certificate diploma issue abroad degree equivalency interpret assess compliance apply federal provincial municipal legislation regulation relate regulation Species Risk Impact Assessment environmental emergency . perform fieldwork relate environmental field survey environmental site assessment inspection health safety environmental audit . planning write evaluate technical documentation . management regulated health safety environmental aspect halocarbon petroleum storage tank wastewater air noise emission hazardous material hazardous waste spill response specie risk contaminate site . manage provide oversight investigation characterization remediation risk management project . asset program reporting context FCSAP consider asset . define . define gain . condition Employment Reliability Status Language Requirements Imperative BBB BBB Information language requirement assessment test Assessment Criteria assess basis follow criterion Technical Competencies Knowledge federal provincial municipal regulation policy relate . research analyze synthesize complex information multiple source identify issue key relevance provide sound recommendation complex problem . conduct risk assessment provide relevant technical advice health safety environmental implication initiative project . develop produce report provide sound recommendation subject concisely high quality write oral briefing acquire support . develop plan include cost estimate corresponding initiative . support client focus Level technology support Communication Level technology support conceptual analytical level technology support Initiative Level technology support result orientation Level technology support development Level technology support Teamwork Level competency profile position evaluate follow competency profile Technology Support Relocation Relocation assistance determine National Research Council Canada's directive . compensation salary review annum . addition incumbent imperative position receive . National Research Council employee enjoy wide range competitive benefit include comprehensive health dental plan pension insurance plan vacation leave entitlement . note answer provide instrumental select assessment . aware assessment board assumption . answer application question provide concrete example detail explain acquire . include substantiate detail outline breadth relevant timeline . length include . resume secondary source validate describe answer screening question . successful validate information provide contact relevant reference process . failure answer screening question provide appropriate factual information application result rejection application . note unable contact incomplete information . pre qualified list establish period position tenure english essential linguistic profile . National Research Council employee enjoy wide range benefit include comprehensive health dental plan pension insurance plan vacation leave entitlement . . include citizenship information application . incumbent adhere safe workplace practice . working condition find ordinary office environment . occasionally travel handle hazardous material situation visit industrial laboratory component test cell environment presence enhanced noise level perform occasional inspection construction site . apply select consideration contact . direct question requisition number mail closing Eastern"
    },
    "companyDescription": "",
    "description": "Help bring research to life and drive your career forward with the National Research Council of Canada (NRC), Canada\u2019s largest research and technology organization. \n\n We are looking for a Technical Officer, Specialist in Contaminated Sites. The selected candidate would be someone who shares our core values of Integrity, Excellence, Respect and Creativity. \n\n Do you love variety in your day and enjoy responding to the unexpected while working to achieve your work objectives? \n\n Are you a people person, passionate about improving health, safety and environmental management in the work place? \n\n \nDo your peers or colleagues describe you as: results-oriented;a team player; and having strong communication and problem-solving skills? \n\n If you answered, \u201cYes\u201d, \u2026 Consider joining our team. We may have the job for you! \n\n The National Research Council operates labs and research facilities across the country, each with its own unique challenges related to health, safety and environmental management. NRC is involved with innovative research in transportation, engineering, life and medical sciences, and emerging technologies in computer science, electronics, astronomy and nanotechnology. Each area presents a wide and exciting variety of health, safety and environment related aspects ranging from worker health and protection, to animal safety, biosafety, radiation safety, hazardous materials management, noise and air emissions, waste waters, species at risk, and the list goes on. \n\n NRC\u2019s Health, Safety and Environment Branch (HSE) proactively establishes, promotes and implements best practices in health, safety and environmental management. The HSE Branch provides enabling and support services to NRC\u2019s Research & Development activities, assuring the health and safety of our employees, our neighbouring communities and our environment. \n\n As a team member within the NRC HSE Branch, you will proactively provide leadership by advising and guiding researchers, trades people, engineers, managers and contractors using HSE best management practices. You will also work closely with regulatory authorities to help ensure the NRC\u2019s operations are compliant with applicable federal, provincial and municipal laws and policies. \n\n Contaminated Sites Group; a one-stop shop that touches all aspects of contaminated sites management. Working with technical and administrative staff, consultants, and other NRC business units, you will be responsible for the co-ordination of NRC\u2019s contaminated sites projects and supporting programs. You will gain practical experience in assessment and remediation and risk management of contaminated sites, strategic planning, operations, procurement and contract management, program management, technical review, financial management, and stakeholder relations. \nScreening Criteria \nApplicants must demonstrate within the content of their application that they meet the following screening criteria in order to be given further consideration as candidates: \nEducation \nUniversity degree from a recognized post-secondary institution in Science or Engineering, with acceptable specialization relevant to the position (e.g. chemistry, geology, physics, biology, ecology, biochemistry, environmental science or environmental, chemical or civil engineering). \n\n Equivalency \n\n College diploma and significant relevant experience in the field of expertise may also be considered. \n\n For information on certificates and diplomas issued abroad, please see Degree equivalency \nExperience \n\n Significant* and recent** experience in interpreting, assessing compliance or applying federal, provincial and municipal legislation and regulations related to Health, Safety and the Environment (e.g., Canadian Environmental Protection Act and related regulations, Species at Risk Act, Impact Assessment Act , Canada Labour Code, environmental emergencies, Treasury Board Policies). \n\n Significant* experience in performing fieldwork related to environmental field surveys, environmental site assessments, or inspections for health, safety and environmental audits. \n\n Significant* experience in planning, writing or evaluating technical documentation. \n\n Significant* and recent** experience in management of regulated health, safety and environmental aspects, such as halocarbons, petroleum storage tanks, wastewater, air and noise emissions, hazardous materials, hazardous waste, spill response and species at risk or contaminated sites. \n\n Significant* experience in managing and providing oversight of investigation, characterization, remediation, and risk management projects. \n\n \nAsset:\n \n \n Recent** experience with program reporting in the context of the Federal Contaminated Sites Action Plan (FCSAP) may be considered an asset. \n Significant experience is defined as more than 2 years of experience. \n **Recent experience is defined as experience gained within the last 6 years. \n\n Condition of Employment \nReliability Status \nLanguage Requirements \nEnglish or Bilingual Imperative BBB/BBB \n\n Information on language requirements and self-assessment tests \nAssessment Criteria \nCandidates will be assessed on the basis of the following criteria: \nTechnical Competencies \n\n Knowledge of federal, provincial, and municipal regulations and policies related to Health, Safety and Environment. \n\n Ability to research, analyze and synthesize complex information from multiple sources, identifying issues of key relevance and providing sound recommendations to complex problems. \n\n Ability to conduct risk assessments and to provide relevant technical advice on the health, safety and environmental implications of an initiative/project. \n\n Ability to develop and produce reports, provide sound recommendations and to present subjects concisely using high quality written and oral briefings to acquire the necessary support(s). \n\n Ability to develop work plans that include time and cost estimates for the corresponding initiatives. \n\n Behavioural Competencies \nTechnology support - Client focus (Level 2) \nTechnology support - Communication (Level 2) \nTechnology support - Conceptual and analytical ability (Level 2) \nTechnology support - Initiative (Level 2) \nTechnology support - Results orientation (Level 2) \nTechnology support - Self-knowing and self-development (Level 2) \nTechnology support - Teamwork (Level 2) Competency Profile(s) \nFor this position, the NRC will evaluate candidates using the following competency profile(s): Technology Support \n\n Relocation \nRelocation assistance will be determined in accordance with the NRC's directives. \nCompensation \n\n Salary under review \n\n From $73,744 to $94,839 per annum. \n\n In addition, the incumbent in a bilingual imperative position will receive the Bilingualism Bonus of $800 per year. \n\n NRC employees enjoy a wide-range of competitive benefits including comprehensive health and dental plans, pension and insurance plans, vacation and other leave entitlements. \nNotes \n\n How your answers are provided is instrumental in selecting the candidates for assessment. Please be aware that the assessment board cannot and will not make assumptions about your Education and Experience. Therefore, clearly answer all application questions providing concrete examples with significant details to explain WHEN, WHERE and HOW you acquired each experience. Please be sure to include substantiating details that clearly outline the breadth of experience as well as relevant timelines. The length of time can be important so please include how many months or years you did this work. Resumes will only be used as a secondary source to validate the experience described in the answers to the screening questions. If you are the successful candidate, we will validate the information that you provided by contacting your relevant references at the end of the process. \n\n Failure to answer the screening questions or provide appropriate or factual information in the application may result in the rejection of your application. \n\n Please note that we are unable to contact candidates for incomplete or possible missing information. \n\n A pre-qualified list may be established for a one year period for similar positions of various tenures and Bilingual and English essential linguistic profiles. \n\n NRC employees enjoy a wide-range of benefits including comprehensive health and dental plans, pension and insurance plans, vacation and other leave entitlements. \n\n Preference will be given to Canadian Citizens and Permanent Residents of Canada. Please include citizenship information in your application. \n\n The incumbent must adhere to safe workplace practices at all times. \n\n The working conditions are those found in an ordinary office environment. \n\n \nMust be willing to occasionally: travel, handle hazardous materials and/or situations, visit industrial laboratory and/or component test cell environment, work with the presence of enhanced noise levels and perform occasional inspections at construction sites. \n\n We thank all those who apply, however only those selected for further consideration will be contacted. \n\n Please direct your questions, with the requisition number ( 20662 ) to: \n\n \nE-mail: NRC.NRCHiring-EmbaucheCNRC.CNRC@nrc-cnrc.gc.ca \n\n \nTelephone : 613-298-5697 \n\n \nClosing Date: Tuesday 7 November - 23:59 Eastern Time"
}