{
    "id": "5221928fb0cdb2c7",
    "company": "Stantec",
    "positionName": "Senior Compensation Consultant",
    "jobType": [],
    "location": "3001331 Clyde Avenue, Ottawa, ON",
    "salary": null,
    "postingDateParsed": "2024-01-18T05:12:03.834Z",
    "url": "https://www.indeed.ca/rc/clk?jk=5221928fb0cdb2c7&from=jasx&tk=1hkikgnghkee4800&bb=705ODd93W8sq4u4Hp1uXMdWdhNQ4UREkJWOk0NySXNK6Ccu7Ju3luFyyeV5D8U482UudeGxYz3oCGZc4QKeU5xJV8_j9aa3q8edevFeX-9i3_lCOjvVBdQ%3D%3D&xkcb=SoA167M3FShNKBx1FB0HbzkdCdPP&vjs=3",
    "externalApplyLink": "https://stantec.jobs/ottawa-on/senior-compensation-consultant/680B17DBFF1A4226BD3DF1B397994C21/job/?vs=1554&utm_source=Indeed-DE&utm_medium=Job%20Aggregator&utm_campaign=Indeed",
    "job_info_group": {
        "extracted_phone_numbers": [],
        "extracted_links": [
            "HTTP/HTTPS Links",
            "General Links",
            "WWW Links",
            "TLDs"
        ],
        "extracted_emails": [],
        "extracted_location_data": [
            "North America"
        ],
        "extracted_dates": [
            "7 years",
            "( 2400008D",
            "Jan 19, 2024"
        ],
        "extracted_languages": [],
        "extracted_laws": [],
        "extracted_norps": [],
        "extracted_orgs": [
            "Human Resources",
            "2400008D Stantec",
            "Corporate Development",
            "Stantec",
            "Edmonton AB Organization",
            "Human Resources, Business",
            "CCP",
            "FST",
            "preferably Oracle",
            "Marketing/Communications",
            "Practice Services",
            "Our Functional Services Team"
        ],
        "extracted_persons": [],
        "extracted_products": [],
        "extracted_money": [],
        "processed_text": "Senior Compensation Consultant description grow good . join smart creative inspire team support operational excellence . Stantec community unite employee location continent . include Finance HSSE legal Real Estate Procurement . bring individual diverse background talent expertise fst vital company strong . explore . exciting Senior Compensation professional join team . primary responsibility provide strategic compensation consultation assign business operating unit lead participate variety compensation project . client focus professional demonstrate consulting capability research analyze recommend sound compensation solution support Human Resources strategy organizational objective . understand compensation datum modeling interpret business human resource leader influence positive change inform pay decision level organization . join remote collaborative Global Compensation team play integral role deliver strategic compensation service . offer flexible working arrangement . role remote hybrid office . Key Responsibilities engage Human Resources business partner business leader diagnose complex compensation issue guide business leader manager application compensation program policy guideline support organization goal . lead participate development delivery compensation training human resource business leader . lead key team variety compensation project . develop competitive assessment salary analysis advise human resource business leader pay management strategy decision . develop maintain variety excel base tool datum model support team client base project process . conduct interpret datum analytic deliver actionable relevant insight support inform compensation planning . perform duty nature level require . qualification Capabilities Credentials consult compensation program policy practice support inform decision making . advanced understanding compensation good practice principle . develop deliver compensation training human resource business leader support organization goal . compile analyze interpret large information datum multiple source . develop datum model effectively leverage datum story support inform decision making . understanding application project management approach tool phase project lifecycle . apply effective oral write communication presentation skill . demonstrate problem solving critical thinking skill . exercise confidentiality discretion sound judgment . proficient MS Office Suite skill require advanced Excel skill require . Human Resources Information System Systems . understand apply compensation relate legislation rule regulation require multi national knowledge prefer . prefer progress . education Bachelor's degree equivalent field minimum compensation . typical office environment computer remain sedentary long period . travel require . description comprehensive listing activity duty responsibility require employee duty responsibility activity assign change notice . place good bright build other's talent exciting impact . join redefine personal good . benefit summary regular employee access health dental vision plan program health care spending account wellness spending account group register retirement saving plan employee stock purchase program group tax free saving account life accidental death dismemberment adandd insurance short term long term plan emergency travel benefit tuition reimbursement professional membership fee coverage pay . temporary casual employee access group register retirement saving plan employee stock purchase program group tax free saving account . benefit information list apply union position benefit position govern applicable collective bargaining agreement . Primary Location Alberta Calgary Locations Alberta Edmonton Waterloo Locations BC Human Resources Talent Services Employee Status regular level Individual Contributor travel schedule posting Req provide equal employment qualified employee applicant future current employment prohibit discrimination ground race color religion sex national origin age marital status genetic information protect veteran status sexual orientation gender identity gender expression . prohibit discrimination decision concern recruitment hiring referral promotion compensation fringe benefit training termination condition employment . compliance local state federal law regulation ensure equitable aspect employment . EEO include protect Veterans"
    },
    "companyDescription": "",
    "description": "Senior Compensation Consultant - ( 2400008D ) \n Description \n Grow with the best. Join a smart, creative, and inspired team that works to support operational excellence. The Stantec community unites more than 28,000 employees working in over 400 locations across 6 continents. Our Functional Services Team (FST) includes Corporate Development, Finance, HR, HSSE, IT, Legal, Marketing/Communications, Practice Services and Real Estate and Procurement. Bringing together individuals with diverse backgrounds, talents, and expertise, our FSTs are vital to making our Company stronger. Explore opportunities in Human Resources. \n Your Opportunity \n We have an exciting opportunity for a Senior Compensation professional to join our team. The primary responsibilities will be to provide strategic compensation consultation for assigned business operating units and lead and participate in a variety of compensation projects. As a client focused professional with demonstrated consulting capabilities, you will research, analyze, and recommend sound compensation solutions in support of our Human Resources strategy and other organizational objectives. You will also understand compensation data modeling and be able to interpret for business and human resources leaders to influence positive change and inform pay decisions at all levels of the organization. Join our remote collaborative Global Compensation team and play an integral role delivering strategic compensation services. We offer flexible working arrangement. This role can be remote, hybrid, or in-office. \n Your Key Responsibilities \n \n  Engage with HR business partners and business leaders to diagnose complex compensation issues and guide business leaders and managers on application of our compensation programs, policies, and guidelines in support of organization goals. \n  Lead and participate in the development and delivery of compensation training for human resources and business leaders. \n  Lead or be a key team member on a variety of compensation projects. \n  Develop and present competitive assessments and salary analysis to advise human resources and business leaders on pay management strategies and decisions. \n  Develop and/or maintain a variety of excel based tools and data models to support team and client-based projects and processes. \n  Conduct and interpret data analytics to deliver actionable and relevant insights in support of informed compensation planning. \n  Perform other duties of a similar nature and level as required. \n \n Qualifications \n Your Capabilities and Credentials \n \n  Experience consulting on compensation programs, policies, and practices that support informed decision making. \n  Advanced understanding of compensation best practices and principles. \n  Experience developing and delivering compensation training for human resources and business leaders in support of organization goals. \n  Ability to compile, analyze, and interpret large amounts of information/data from multiple sources. \n  Experience developing and running data models; effectively leveraging data to tell the story in support of informed decision making. \n  Understanding and application of project management approaches, tools, and phases of the project lifecycle. \n  Apply effective oral/written communication and presentation skills. \n  Demonstrate problem solving and critical thinking skills. \n  Exercise confidentiality, discretion, and sound judgment. \n  Proficient MS Office Suite skills required; advanced Excel skills required. \n  Experience with HRIS Systems (preferably Oracle). \n  Understand and apply compensation-related legislation, rules, and regulations for North America (required); multi-national knowledge strongly preferred. \n  CCP preferred or in progress. \n \n Education and Experience \n Bachelor\u2019s degree or equivalent in Human Resources, Business, or related field; Minimum of 7 years of related experience in compensation. \n Typical office environment working with computers and remaining sedentary for long periods of time. Travel may be required throughout North America. \n This description is not a comprehensive listing of activities, duties or responsibilities that may be required of the employee and other duties, responsibilities and activities may be assigned or may be changed at any time with or without notice. \n Stantec is a place where the best and brightest come to build on each other\u2019s talents, do exciting work, and make an impact on the world around us. Join us and redefine your personal best. \n Benefits Summary: Regular full-time and part-time employees will have access to health, dental, and vision plans, a well-being program, health care spending account, wellness spending accounts, group registered retirement savings plan, employee stock purchase program, group tax-free savings account, life and accidental death & dismemberment (AD&D) insurance, short-term/long-term disability plans, emergency travel benefits, tuition reimbursement, professional membership fee coverage, and paid time off. \n Temporary/casual employees will have access to group registered retirement savings plan, employee stock purchase program, and group tax-free savings account. \n The benefits information listed above may not apply to union positions because benefits for such positions are governed by applicable collective bargaining agreements. \n Primary Location : Canada-Alberta-Calgary \n Other Locations : Canada-Alberta-Edmonton, Canada-Ontario-Ottawa, Canada-Ontario-Waterloo \n Work Locations : \n Edmonton AB \n Organization : BC-1197 HR Talent Services-CA Canada \n Employee Status : Regular \n Job Level : Individual Contributor \n Travel : No \n Schedule : Full-time \n Job Posting : Jan 19, 2024, 7:13:21 AM \n Req ID: 2400008D \n Stantec provides equal employment opportunities to all qualified employees and applicants for future and current employment and prohibit discrimination on the grounds of race, color, religion, sex, national origin, age, marital status, genetic information, disability, protected veteran status, sexual orientation, gender identity or gender expression. We prohibit discrimination in decisions concerning recruitment, hiring, referral, promotion, compensation, fringe benefits, job training, terminations or any other condition of employment. Stantec is in compliance with local, state and federal laws and regulations and ensures equitable opportunities in all aspects of employment. EEO including Disability/Protected Veterans"
}