{
    "id": "a70d9a29ae3701d2",
    "company": "Chemsyn Services Inc.",
    "positionName": "Gestionnaire de Comptes Strat\u00e9giques (GCS)",
    "jobType": [],
    "location": "Ottawa, ON",
    "salary": null,
    "postingDateParsed": "2024-01-19T05:10:48.278Z",
    "url": "https://www.indeed.ca/rc/clk?jk=a70d9a29ae3701d2&from=jasx&tk=1hkikdavvii12803&bb=Z_xYV__n_sQAK0ynFsc1LgOGtgApnqHc-gFce17Ilx6XXHwBG9sxox-nGiHiNtC9s64B392HGTi3pCKmUZDdNHoH2SVlYAn6od8hyrxXPtTvB76OJQnNFg%3D%3D&xkcb=SoD867M3FSg6uFQ22p0HbzkdCdPP&vjs=3",
    "externalApplyLink": null,
    "job_info_group": {
        "extracted_phone_numbers": [],
        "extracted_links": [
            "HTTP/HTTPS Links",
            "General Links",
            "WWW Links",
            "TLDs"
        ],
        "extracted_emails": [],
        "extracted_location_data": [
            "The SBM",
            "Souci",
            "Capacit\u00e9 \u00e0 interagir",
            "SBM"
        ],
        "extracted_dates": [
            "3-5 years"
        ],
        "extracted_languages": [],
        "extracted_laws": [],
        "extracted_norps": [
            "\u00b7 Faire des appels t\u00e9l\u00e9phoniques",
            "par 2 ans d'exp\u00e9rience en ventes internes Excellentes"
        ],
        "extracted_orgs": [
            "Chemsyn",
            "Job Qualifications University Degree in Business",
            "\u00e9thique de",
            "Chemsyn \u00e0 l'interne",
            "R\u00e9mun\u00e9ration - Gains sur la bonne voie jusqu'\u00e0 100 000 $",
            "g\u00e9rer les priorit\u00e9s num\u00e9riques de chaque compte cl\u00e9 sur",
            "Recueillir des informations sur le march\u00e9",
            "external Key Accounts",
            "connexe Minimum de 3",
            "maintenir et poss\u00e9der les relations avec le si\u00e8ge",
            "GCS",
            "Microsoft Office",
            "fonction de l'exp\u00e9rience",
            "Support Customer Marketing Team",
            "Maladie Compl\u00e9mentaire Assurance",
            "un",
            "Le GCS est",
            "d\u00e9fendre les arguments des grands",
            "de performance mensuelles et trimestrielles avec les grands",
            "Bonnes capacit\u00e9s d'organisation",
            "de la",
            "Permanent Salaire",
            "avec des comptes cl\u00e9s externes"
        ],
        "extracted_persons": [
            "Capacit\u00e9 \u00e0 d\u00e9montrer une",
            "Acc\u00e9l\u00e9rer la r\u00e9solution des probl\u00e8mes",
            "de strat\u00e9gies et d'initiatives tactiques de marketing/ventes",
            "professionnellement avec des cadres sup\u00e9rieurs",
            "et Capacit\u00e9 \u00e0 g\u00e9rer plusieurs priorit\u00e9s",
            "Horaires de",
            "Responsable",
            "\u00b7 Construire",
            "de pr\u00e9f\u00e9rence compl\u00e9t\u00e9e",
            "Le Gestionnaire de ComptesLe Gestionnaire de Comptes",
            "Type d'emploi",
            "d'augmenter l'empreinte de Chemsyn"
        ],
        "extracted_products": [],
        "extracted_money": [
            {
                "amount": "100,000",
                "noun_phrases": []
            },
            {
                "amount": "55 000,00$ \u00e0",
                "noun_phrases": []
            },
            {
                "amount": "60 000,00$ par",
                "noun_phrases": [
                    "60 000,00$ par"
                ]
            }
        ],
        "processed_text": "Strategic Business Manager responsible increase Chemsyn footprint acquire key account chain account national account . champion Chemsyn brand internally externally organisation promote partner solve real problem provide cohesive approach win customer' business loyalty . compensation Track earning base inclusive commission earn commission cap . \u00b7 development annual customer business plan utilize strategy tactic create win win partnership \u00b7 development execution evaluation customize Key Account program \u00b7 build maintain Key Accounts' Head Office relationship \u00b7 develop customize program strategy tactical marketing sale initiative \u00b7 accountable manage component customer's budget \u00b7 build internal external communication plan \u00b7 responsible manage monthly quarterly performance review key account \u00b7 person visit presentation exist prospective customer \u00b7 expedite resolution customer problem complaint \u00b7 participate trade convention sale meeting \u00b7 gather market intelligence . field Minimum Field sale preferably complement sale office excellent relationship building skill strong presentation skill champion Key Account pitch interact professionally senior level Suite representative Key Accounts Strong budget management manage budget provide partnership strong project management organization skill manage number priority premise key account proficient computer include Word Excel Outlook communicate effectively write verbal strong problem solving skill accountable dependable team environment independently exceptional attention detail quality good organizational management prioritizing skill demonstrate positive attitude strong ethic handle multiple priority task . Strategiques est charge acquerant des comptes cles des comptes chaine des comptes nationaux . champion marque l'externe l'organisation faisant promotion Chemsyn tant partenaire precieux dans resolution problemes reels offrant une approche coherente pour gagner les affaires fidelite client . . les commission n'ont pas plafond . \u00b7 elaboration d'un plan d'affaires client annuel utilisant des strategies des tactique pour creer des partenariats gagnant gagnant \u00b7 Developpement execution evaluation programme personnalise pour grand comptes social des grands comptes \u00b7 Soutenir l'equipe marketing client dans developpement programme personnalises \u00b7 Responsable gestion toutes les composantes du budget du client \u00b7 Construire des plan communication interne externe \u00b7 Responsable gestion des revue comptes aux client existant potentiels \u00b7 des plaintes des client \u00b7 Participer des foire commerciales congres reunions vente \u00b7 . qualification professionnelle Diplome universitaire commerce dans domaine ans d'experience vente sur terrain competence matiere d'etablissement relation Solides competence presentation pour compte des membres l'executif grands comptes Solide gestion budgetaire gerer budget pour fournir partenariat solide competence gestion projet organisation pour site Maitrise l'utilisation d'un ordinateur compris Word Excel Outlook capable communiquer efficacement anglais francais tant l'ecrit qu'a l'oral solide competence resolution probleme fiable capable travailler equipe ainsi facon autonome exceptionnel du detail qualite du travail gestion du temps priorisation attitude positive une solide travail tache . Strategique GCS est charge d'augmenter lthempreinte Chemsyn acquerant des comptes cles des comptes chaine des comptes nationaux . champion marque l'externe l'organisation faisant promotion Chemsyn tant partenaire precieux dans resolution problemes reels offrant une approche coherente pour gagner les affaires fidelite client . Temps plein avantage Assurance Dentaire Assurance Vision travail Heures Types paie supplementaire Commissions Lieu du poste presentiel"
    },
    "companyDescription": "",
    "description": "The Strategic Business Manager (SBM) is responsible for increasing the Chemsyn footprint by acquiring key accounts, chain accounts and national accounts. The SBM is a champion for the Chemsyn brand internally and externally of the organisation promoting Chemsyn as a valued partner in solving real problems and providing a cohesive approach to winning our customers\u2019 business and loyalty.\nCompensation - On Track Earnings: $100,000 based on experience, inclusive of commissions earned; commissions have no cap.\n\u00b7 Development of annual customer business plan utilizing strategies and tactics to create win-win partnerships\n\u00b7 Development, execution and evaluation of customized Key Account programs\n\u00b7 Build, maintain, and own Key Accounts' Head Office relationships\n\u00b7 Support Customer Marketing Team in developing customized programs, strategies and tactical marketing/sales initiatives\n\u00b7 Accountable for managing all components of the customer's budget\n\u00b7 Build internal and external communication plans\n\u00b7 Responsible for managing the monthly and quarterly performance reviews with the key accounts\n\u00b7 Make telephone calls, in-person visits, and presentations to existing and prospective customers;\n\u00b7 Expedite the resolution of customer problems and complaints\n\u00b7 Participate in trade shows, conventions, and sales meetings;\n\u00b7 Gather market intelligence.\nJob Qualifications\n\n University Degree in Business or related field\n Minimum of 3-5 years of Field Sales experience, preferably complemented with 2 years Sales Back-Office experience\n Excellent relationship building skills\n Strong presentation skills to champion Key Account pitches\n Ability to interact professionally with senior levels, C-Suite representatives of Key Accounts\n Strong budget management experience (manage budget to provide partnership with external Key Accounts)\n Strong project management and organization skills to manage the number priorities from each on-premise key account\n Proficient in using a computer, including Microsoft Office (Word, Excel, Outlook);\n Able to communicate effectively (both written and verbal);\n Strong problem-solving skills;\n Accountable and dependable;\n Able to work in a team environment as well as independently;\n Exceptional attention to detail and quality of work;\n Good organizational, time management and prioritizing skills;\n Ability to demonstrate a positive attitude and strong work ethic; and\n Ability to handle multiple priorities and tasks.\n\nx\nLe Gestionnaire de ComptesLe Gestionnaire de Comptes Strat\u00e9giques (GCS) est charg\u00e9 d'augmenter l'empreinte de Chemsyn en acqu\u00e9rant des comptes cl\u00e9s, des comptes de cha\u00eene et des comptes nationaux. Le GCS est un champion de la marque Chemsyn \u00e0 l'interne et \u00e0 l'externe de l'organisation, faisant la promotion de Chemsyn en tant que partenaire pr\u00e9cieux dans la r\u00e9solution de probl\u00e8mes r\u00e9els et offrant une approche coh\u00e9rente pour gagner les affaires et la fid\u00e9lit\u00e9 de nos clients.\nR\u00e9mun\u00e9ration - Gains sur la bonne voie jusqu'\u00e0 100 000 $ en fonction de l'exp\u00e9rience. Les commissions n'ont pas de plafond.\n\u00b7 \u00c9laboration d'un plan d'affaires client annuel utilisant des strat\u00e9gies et des tactiques pour cr\u00e9er des partenariats gagnant-gagnant\n\u00b7 D\u00e9veloppement, ex\u00e9cution et \u00e9valuation de programmes personnalis\u00e9s pour grands comptes\n\u00b7 Construire, maintenir et poss\u00e9der les relations avec le si\u00e8ge social des grands comptes\n\u00b7 Soutenir l'\u00e9quipe de marketing client dans le d\u00e9veloppement de programmes personnalis\u00e9s, de strat\u00e9gies et d'initiatives tactiques de marketing/ventes\n\u00b7 Responsable de la gestion de toutes les composantes du budget du client\n\u00b7 Construire des plans de communication interne et externe\n\u00b7 Responsable de la gestion des revues de performance mensuelles et trimestrielles avec les grands comptes\n\u00b7 Faire des appels t\u00e9l\u00e9phoniques, des visites en personne et des pr\u00e9sentations aux clients existants et potentiels ;\n\u00b7 Acc\u00e9l\u00e9rer la r\u00e9solution des probl\u00e8mes et des plaintes des clients\n\u00b7 Participer \u00e0 des foires commerciales, congr\u00e8s et r\u00e9unions de vente;\n\u00b7 Recueillir des informations sur le march\u00e9.\nQualifications professionnelles\n\n Dipl\u00f4me universitaire en commerce ou dans un domaine connexe\n Minimum de 3 \u00e0 5 ans d'exp\u00e9rience en vente sur le terrain, de pr\u00e9f\u00e9rence compl\u00e9t\u00e9e par 2 ans d'exp\u00e9rience en ventes internes\n Excellentes comp\u00e9tences en mati\u00e8re d'\u00e9tablissement de relations\n Solides comp\u00e9tences de pr\u00e9sentation pour d\u00e9fendre les arguments des grands comptes\n Capacit\u00e9 \u00e0 interagir professionnellement avec des cadres sup\u00e9rieurs et des membres de l\u2019ex\u00e9cutif de grands comptes\n Solide exp\u00e9rience en gestion budg\u00e9taire (g\u00e9rer le budget pour fournir un partenariat avec des comptes cl\u00e9s externes)\n Solides comp\u00e9tences en gestion de projet et en organisation pour g\u00e9rer les priorit\u00e9s num\u00e9riques de chaque compte cl\u00e9 sur site\n Ma\u00eetrise de l'utilisation d'un ordinateur, y compris Microsoft Office (Word, Excel, Outlook);\n Capable de communiquer efficacement en anglais et en fran\u00e7ais (tant \u00e0 l'\u00e9crit qu'\u00e0 l'oral);\n Solides comp\u00e9tences en r\u00e9solution de probl\u00e8mes;\n Responsable et fiable ;\n Capable de travailler en \u00e9quipe ainsi que de fa\u00e7on autonome;\n Souci exceptionnel du d\u00e9tail et qualit\u00e9 du travail;\n Bonnes capacit\u00e9s d'organisation, de gestion du temps et de priorisation ;\n Capacit\u00e9 \u00e0 d\u00e9montrer une attitude positive et une solide \u00e9thique de travail; et\n Capacit\u00e9 \u00e0 g\u00e9rer plusieurs priorit\u00e9s et t\u00e2ches. Strat\u00e9gique (GCS)est charg\u00e9 d'augmenter l'empreinte de Chemsyn en acqu\u00e9rant des comptes cl\u00e9s, des comptes de cha\u00eene et des comptes nationaux. Le GCS est un champion de la marque Chemsyn \u00e0 l'interne et \u00e0 l'externe de l'organisation, faisant la promotion de Chemsyn en tant que partenaire pr\u00e9cieux dans la r\u00e9solution de probl\u00e8mes r\u00e9els et offrant une approche coh\u00e9rente pour gagner les affaires et la fid\u00e9lit\u00e9 de nos clients.\n\nType d'emploi : Temps plein, Permanent\nSalaire\u00a0: 55\u00a0000,00$ \u00e0 60\u00a0000,00$ par an\nAvantages\u00a0:\n\n Assurance Dentaire\n Assurance Maladie Compl\u00e9mentaire\n Assurance Vision\n\nHoraires de travail\u00a0:\n\n 8 Heures\n\nTypes de paie suppl\u00e9mentaire\u00a0:\n\n Commissions\n\nLieu du poste : En pr\u00e9sentiel"
}