{
    "id": "bf807e9355c1ae7a",
    "company": "ACI Federal\u2122",
    "positionName": "Program Manager",
    "jobType": [
        "Full-time"
    ],
    "location": "National Capital Region, ON",
    "salary": null,
    "postingDateParsed": "2024-01-05T03:13:36.574Z",
    "url": "https://www.indeed.ca/rc/clk?jk=bf807e9355c1ae7a&from=jasx&tk=1hjm3b3kbip98800&vjs=3",
    "externalApplyLink": "https://ca.indeed.com/applystart?jk=bf807e9355c1ae7a&from=vj&pos=top&mvj=0&spon=0&sjdu=o7sfz71MPdMgyiV0LZq0d4DDplm6SwWjHcxyoDIphKkaZXFA0Nab5-O5uc_Tk63V49WvwkpoG9hYf01tCUekuG4CGjHxia1C8rAOtMy4tuc6C8cgJHQWCr-VZ67n6vhqYIwyPg4aBUahmA7MyTTpQIsU4NokSNieDe-Ta6oU2kTNq2EBT-Tu0u9jmjmOhQDpw9_XINGINv7OnqX9-Wv1cg&vjfrom=serp&log=1&astse=41d58178566739e9&assa=6133",
    "job_info_group": {
        "extracted_phone_numbers": [],
        "extracted_links": [
            "HTTP/HTTPS Links",
            "General Links",
            "WWW Links",
            "TLDs"
        ],
        "extracted_emails": [],
        "extracted_location_data": [
            "Maryland",
            "NCs",
            "OH",
            "the District of Columbia"
        ],
        "extracted_dates": [],
        "extracted_languages": [],
        "extracted_laws": [
            "the PerSCs"
        ],
        "extracted_norps": [],
        "extracted_orgs": [
            "Staff Nurses",
            "the Site Staffing Plan",
            "HHS",
            "SNs",
            "Program Support Center",
            "PowerPoint",
            "Medical Administrative Support Staff",
            "The U.S. Department of Health and Human Services",
            "qualified and competent Personal Service Contractors",
            "Federal Occupational Health (FOH",
            "Microsoft Outlook",
            "Area Clinical Managers",
            "the Federal Government.",
            "FOH",
            "Medical Technical Assistants"
        ],
        "extracted_persons": [],
        "extracted_products": [
            "the incumbent Contractor",
            "Excel",
            "newly awarded Contractor"
        ],
        "extracted_money": [],
        "processed_text": "title Program Manager PSC provide Occupational Health consultation direct service safety program FOH define comprehensive approach public health focus improve health safety federal workforce decrease government's liability health care cost clinical environmental educational risk base prevention program . location minimum Program Manager locate Virginia region . role responsibility contractor recruit hire retain include ACMs Physicians physician Assistants PAs Nurse Practitioners NPs Nurse Coordinators MASS professional . specific task Program Manager responsible credentialing maintain complete credential file outline direct FOH policy procedure Personal Service Contractors . maintain adequate PRN pool supplement ad hoc hour substitute assign PerSC vacation sick unavailable identify . consistency Staff furnish PerSC day's performance identify essential steady state site staffing plan . provide project planning expertise . perform project scheduling task breakdown . identify project requirement . provide change version control . track project issue problem risk . assess manage risk . Program Manager Project Manager develop project plan . provide Government insight successful execution applicable project . Program Manager ACI Federal's Quality Control Plan provide performance quality indicator provide visibility develop trend forecast potential future problem risk relate cost resource quality schedule . develop execute calendar transition plan ensure seamless continuity service . provide surge capacity hire support rapid response . ensure comprehensive quality assurance performance monitoring . participate quarterly program review FOH Leadership Education Training Program Manager possess knowledge College Degree relevant include demonstrate proficiency personnel management data collection analysis knowledge utilize Word datum collection analytic application proofread correct document spelling grammar . Project Management Professional PMP Certification ."
    },
    "companyDescription": "",
    "description": "Title: Program Manager \n\n The U.S. Department of Health and Human Services (HHS), Program Support Center (PSC), Federal Occupational Health (FOH) provides Occupational Health (OH) consultation, direct services, and safety programs throughout the Federal Government. FOH defines OH as a comprehensive approach with a public health focus, to improving the health and safety of the Federal workforce and decreasing the Government's liability and health care costs through various clinical, environmental, educational, and risk-based prevention programs. \n\n \nLocation: At a minimum there shall be a Program Manager located in the District of Columbia, Maryland, or Virginia region. \n\n \nRoles and Responsibilities:\n The Contractor will recruit, hire, and retain qualified and competent Personal Service Contractors to include Area Clinical Managers (ACMs), Physicians, Physician Assistants (PAs), Nurse Practitioners (NPs), Nurse Coordinators (NCs), Staff Nurses (SNs), Medical Administrative Support Staff (MASS), Medical Technical Assistants, and other professionals as necessary. \n\n \nSpecific Tasks:\n \nThe Program Manager shall be responsible for:\n \nCredentialing: maintain complete and up-to-date credential files as specifically outlined and directed by FOH policies and procedures for all Personal Service Contractors (PerSCs). \n\n \nPRN PerSCs: maintain an adequate PRN pool to supplement the PerSCs for ad-hoc hours as well as substitutes for steady-state hours when assigned PerSC is on vacation, sick, or is otherwise unavailable as identified on the Site Staffing Plan. \n\n \nConsistency of Staff: furnish the same PerSC for each day's performance for hours identified as essential steady-state on the site staffing plan. \n\n Provide project planning expertise. \n\n Perform project scheduling and task breakdown. \n\n Identify project requirements. \n\n Provide change and version control. \n\n Track project issues, problems, and risks. \n\n Assess and manage risks. \n\n The Program Manager (PM) shall develop project plans. \n\n Provide the Government insight into the successful execution of the applicable project. \n\n The Program Manager will use ACI Federal's Quality Control Plan and will provide performance and quality indicators that provide visibility into developing trends and to forecast potential/future problems/risks related to cost, resources, quality, and schedule. \n\n Develop and execute a 30-calendar day transition plan that ensures seamless continuity of services between the incumbent Contractor and newly awarded Contractor. \n\n Provide \u201csurge\u201d capacity for hires that support rapid response. \n\n Ensure comprehensive quality assurance and performance monitoring. \n\n Participate in quarterly program reviews with FOH Leadership Education and Training \n\n The Program Manager shall possess a working knowledge of FOH, a College Degree and at least five (5) years of relevant experience, including demonstrated proficiency in personnel management, data collection and analysis, knowledge to utilize Microsoft Outlook, Word, Excel, and PowerPoint or newer data collection and analytic application, and are able to proofread and correct documents for spelling grammar. \n\n Project Management Professional (PMP) Certification."
}