{
    "id": "6213617fedf81bc7",
    "company": "AECOM",
    "positionName": "Buildings Senior Project Manager - Laboratory Facilities Projects",
    "jobType": [],
    "location": "Ottawa, ON",
    "salary": null,
    "postingDateParsed": "2023-11-22T20:15:23.527Z",
    "url": "https://www.indeed.ca/rc/clk?jk=6213617fedf81bc7&from=jasx&tk=1hgol2euhk7i3800&vjs=3",
    "externalApplyLink": "https://jobs.smartrecruiters.com/AECOM2/743999945786132-buildings-senior-project-manager-laboratory-facilities-projects",
    "job_info_group": {
        "extracted_phone_numbers": [],
        "extracted_links": [
            "HTTP/HTTPS Links",
            "General Links",
            "WWW Links",
            "TLDs"
        ],
        "extracted_emails": [],
        "extracted_location_data": [],
        "extracted_dates": [
            "an asset Fifteen (15) years",
            "fiscal year 2022",
            "eight (8) years"
        ],
        "extracted_languages": [
            "English"
        ],
        "extracted_laws": [],
        "extracted_norps": [
            "French"
        ],
        "extracted_orgs": [
            "an Equal Opportunity Employer",
            "@AECOM",
            "MS Project",
            "Additional Information Relocation",
            "AECOM AECOM",
            "Leadership in Energy & Environmental Design AP",
            "the Design Team",
            "Project Managers",
            "AECOM",
            "other Project Managers"
        ],
        "extracted_persons": [
            "Keen"
        ],
        "extracted_products": [],
        "extracted_money": [
            {
                "amount": "$176,000 - $",
                "noun_phrases": []
            },
            {
                "amount": "239,000",
                "noun_phrases": []
            },
            {
                "amount": "$13.1 billion",
                "noun_phrases": []
            }
        ],
        "processed_text": "company description deliver . infrastructure create . improve commute light provide access clean water transform skyline help people community thrive . client trust bring good people idea technical expertise digital solution transportation building water environment energy . global team \u2013 strong \u2013 drive common purpose deliver . freedom grow . flexibility good hybrid option . AECOM office remote location client site dynamic environment integrity entrepreneurial spirit pioneering mindset champion . help foster culture equity diversity inclusion \u2013 safe respectful workplace invite bring unique talent background expertise create transformational outcome client . encourage grow develop career technical professional development program diverse career . leadership level . matter sit organization lasting impact project team committee join business . offer competitive pay benefit program support family development resource advance career . join connect collaborate global network expert \u2013 planner designer engineer scientist consultant program construction manager \u2013 lead change sustainable equitable future . join start . Description AECOM Buildings + place build pipeline qualified Design Construction Senior Project Manager hire federal government laboratory facility project Montreal area . summary role experienced project manager trusted advisor client build strong relationship senior leader . bring depth knowledge lead manage complex science project team start finish \u2013 budget . wealth lead major Science facility project complexity construction cost 250m . fully dedicated single individual accountable manage coordinate direct entire project lifetime design construction management large project . Senior Project Manager responsible implement design vision technical performance include coordination project design design discipline . Senior Project Manager inspire team foster collaborative creative environment team meet goal outline project devise strategy support project objective lead team perform efficiently . Major responsibility develop strong client relationship lead science project achieve client's goal objective lead program project planning scheduling budgeting consultant tendering selection operational readiness planning contract administration effort regularly report client project status schedule update meet financial record report Manage project staff allocate project peer review deliverable continuously develop knowledge capability Chair client project site meeting find resolution issue coordinate multiple stakeholder provide oversight leadership change management process payment certificate contract project relate administrative document ensure client expectation satisfaction meet exceed project client's good interest represent respect contractual technical issue select organize project team establish level authority communication Manages portfolio client multiple project . responsible deliver revenue assign specific client result repeat business flawless execution project . consistently deliver profit margin plan . consistently complete project write multipli erosion . typically manage project involve RTF risk triggering factor . manage complex client project . decision authority direct recognize risk uncertainty plan mitigate eliminate . direct staff operate minimize exposure claim . supervise direct multiple project program project . Qualifications Minimum Requirements order consider applicant possess follow University Degree relevant field study + relevant project management deliver build capital improvement project . demonstrate equivalency education consider . preferred Requirements university degree diploma design architecture PMP designation accreditation project management deliver build capital improvement project deliver project science sector advise collaboratively senior stakeholder understanding federal lab organization operational constraint depth knowledge program project planning scheduling budgeting interior base building construction technique operational readiness contract administration preparation request Proposal tender tender closing award procedure excellent write verbal communication presentation skill strong computer skill include knowledge scheduling word processing Word spreadsheet Excel software application position . sponsorship canadian employment authorization position . offer rate compensation base individual education qualification location . salary range position . world's trust infrastructure consulting firm deliver professional service project lifecycle \u2013 advisory planning design engineering program construction management . project span transportation building water energy environment publicand private sector client trust solve complex challenge . team drive common purpose deliver unrivaled technical digital expertise culture equity diversity inclusion commitment environmental social governance priority . Fortune firm Professional Services business revenue . deliver sustainable legacy generation . freedom grow flexibility good hybrid option . AECOM office remote location client site dynamic environment integrity entrepreneurial spirit pioneering mindset champion . help foster culture equity diversity inclusion \u2013 safe respectful workplace invite bring unique talent background expertise create transformational outcome client . provide wide array compensation benefit program meet diverse employee family . provide robust global program . world's trust global infrastructure firm \u2013 growth success . join benefit global publicly trade firm \u2013 access industry lead technology thinking transformational big impact flexibility . person's potential help reach . information confidential accord EEO guideline ."
    },
    "companyDescription": "",
    "description": "Company Description\n  At AECOM, we\u2019re delivering a better world.\n  We believe infrastructure creates opportunity for everyone. Whether it\u2019s improving your commute, keeping the lights on, providing access to clean water or transforming skylines, our work helps people and communities thrive.\n  Our clients trust us to bring together the best people, ideas, technical expertise and digital solutions to our work in transportation, buildings, water, the environment and new energy. We\u2019re one global team \u2013 47,000 strong \u2013 driven by a common purpose to deliver a better world.\n  Here, you will have freedom to grow in a world of opportunity.\n  We will give you the flexibility you need to do your best work with hybrid work options. Whether you\u2019re working from an AECOM office, remote location or at a client site, you will be working in a dynamic environment where your integrity, entrepreneurial spirit and pioneering mindset are championed.\n  You will help us foster a culture of equity, diversity and inclusion \u2013 a safe and respectful workplace, where we invite everyone to bring their whole selves to work using their unique talents, backgrounds and expertise to create transformational outcomes for our clients.\n  We will encourage you to grow and develop your career with us through our technical and professional development programs and diverse career opportunities. We believe in leadership at all levels. No matter where you sit in the organization you can make a lasting impact on the projects you work on, the teams and committees you join and our business.\n  We offer competitive pay and benefits, well-being programs to support you and your family, and the development resources you need to advance your career.\n  When you join us, you will connect and collaborate with a global network of experts \u2013 planners, designers, engineers, scientists, consultants, program and construction managers \u2013 leading the change toward a more sustainable and equitable future. Join us and let\u2019s get started.\n \n \n\n Job Description\n  AECOM Buildings + Places is building a pipeline of qualified Design and Construction Senior Project Manager candidates to potentially hire from to work on federal government laboratory facilities projects in the Ottawa and/or Montreal area.\n  Job Summary:\n  In this role, we are looking for an experienced project manager who can act as a trusted advisor to our clients and can built strong, lasting relationships with senior leaders. You bring in-depth knowledge and have led and managed complex science project teams from start to finish \u2013 on time and on budget.\n  You have a wealth of experience leading major Science facilities projects with significant complexity, with construction cost over 250M$.\n  The fully dedicated (day-to-day) single individual accountable to manage, coordinate and direct the Design Team throughout the entire project lifetime, with experience in design and construction management of large projects. The Senior Project Manager is responsible to implement the design vision as part of the technical performance of the work, including the full coordination of the overall project design with all other design disciplines. The Senior Project Manager will inspire their teams to foster a more collaborative and creative environment, making sure their teams meet the goals outlined in the project, devise strategies to support project objectives, and lead their team to perform efficiently.\n  Major Responsibilities\n \n   Develop strong client relationships and lead science projects from beginning to end, to achieve our client\u2019s goals and objectives\n   Lead program and project planning, scheduling and budgeting, consultant tendering and selection, operational readiness planning, and contract administration efforts\n   Regularly report to the client on project status by means of schedule updates, meeting minutes, financial records and other reports\n   Manage project staff allocated to your projects, peer reviewing their deliverables and continuously developing their knowledge and capabilities\n   Chair client, project and site meetings, find resolution to issues and coordinate between multiple stakeholders\n   Provide oversight and leadership to the change management process, payment certificates and other contract or project related administrative documents\n   Ensure that client expectations and satisfaction are met or exceeded on all projects and the client\u2019s best interests are represented with respect to contractual and technical issues\n   Select and organize project teams and establish levels of authority and lines of communication\n   Manages portfolio of clients with multiple projects.\n   Responsible for delivering revenues assigned from specific clients as a result of repeat business caused by flawless execution of projects.\n   Consistently delivers profit margins planned.\n   Consistently completes project without write-downs or multiplier erosion.\n   Typically manages projects involving RTF (Risk Triggering Factors).\n   Manages more complex clients and projects.\n   Has decision-making authority and directs other Project Managers in recognizing risk and uncertainty with plans to mitigate and eliminate such.\n   Directs staff to operate and minimize exposure to claims.\n   Supervises and directs Project Managers with multiple projects or program of projects.\n \n \n \n\n Qualifications\n  Minimum Requirements:\n  In order to be considered, applicants must possess no less than the following:\n  University Degree in relevant field of study + eight (8) years of relevant experience in project management, delivering new build and capital improvement projects.\n  Demonstrated equivalency of experience and/or education may be considered.\n  Preferred Requirements:\n \n   A university degree or diploma in design, architecture or engineering\n   MBA, PMP designation and LEED AP accreditation is an asset\n   Fifteen (15) years of experience in project management, delivering new build and capital improvement projects\n   Recent experience delivering projects in the science sector, advising and working collaboratively with senior stakeholders\n   Keen understanding of Federal lab organizations and their operational constraints\n   Depth of knowledge in program and project planning, scheduling and budgeting, interior and base building construction techniques, operational readiness, and contract administration\n   Experience with the preparation of RFP's, tenders and tender closing/award procedures\n   Excellent written and verbal communication (French and English) and presentation skills\n   Strong computer skills, including a working knowledge of scheduling (MS Project), word processing (Word) and spreadsheet (Excel) software applications\n \n  Additional Information\n  \n \n   Relocation is not available for this position.\n   Sponsorship for Canadian employment authorization is not available for this position.\n   Offered rate of compensation will be based on individual education, qualifications, experience, and work location. The salary range for this position is $176,000 - $239,000.\n \n \n  About AECOM\n  AECOM is the world\u2019s trusted infrastructure consulting firm, delivering professional services throughout the project lifecycle \u2013 from advisory, planning, design and engineering to program and construction management. On projects spanning transportation, buildings, water, new energy and the environment, our public- and private-sector clients trust us to solve their most complex challenges. Our teams are driven by a common purpose to deliver a better world through our unrivaled technical and digital expertise, a culture of equity, diversity and inclusion, and a commitment to environmental, social and governance priorities. AECOM is a Fortune 500 firm and its Professional Services business had revenue of $13.1 billion in fiscal year 2022. See how we are delivering sustainable legacies for generations to come at aecom.com and @AECOM.\n \n  Freedom to Grow in a World of Opportunity\n  You will have the flexibility you need to do your best work with hybrid work options. Whether you\u2019re working from an AECOM office, remote location or at a client site, you will be working in a dynamic environment where your integrity, entrepreneurial spirit and pioneering mindset are championed.\n  You will help us foster a culture of equity, diversity and inclusion \u2013 a safe and respectful workplace, where we invite everyone to bring their whole selves to work using their unique talents, backgrounds and expertise to create transformational outcomes for our clients.\n  AECOM provides a wide array of compensation and benefits programs to meet the diverse needs of our employees and their families. We also provide a robust global well-being program. We\u2019re the world\u2019s trusted global infrastructure firm, and we\u2019re in this together \u2013 your growth and success are ours too.\n  Join us, and you\u2019ll get all the benefits of being a part of a global, publicly traded firm \u2013 access to industry-leading technology and thinking and transformational work with big impact and work flexibility. As an Equal Opportunity Employer, we believe in each person\u2019s potential, and we\u2019ll help you reach yours.\n  All your information will be kept confidential according to EEO guidelines."
}