{
    "id": "7a496fd032d224bf",
    "company": "Actalent",
    "positionName": "Technical Writer",
    "jobType": [
        "Contract",
        "Fixed term contract"
    ],
    "location": "Ottawa, ON",
    "salary": "$30\u2013$35 an hour",
    "postingDateParsed": "2024-01-25T12:15:45.587Z",
    "url": "https://www.indeed.ca/pagead/clk?mo=r&ad=-6NYlbfkN0ChYVx_I3yfZ_JDY3EFoivtqvi_stwnZ_kRt8Dowt_l_Th23phn_g9jtNUSey9g1Yn7glieV4V4fN7nUxBMR92xtyZOFeLb7O0kuBgYfoqg1dWTTYCT755OSyER5pfHGNDoJR0GXNEAo_TB-FIZ3OmTX1byCENwpmtNTMMnkQ6Cx94-s0rTHsb8gmd3eHavxUd4fCy2c1Ruhb9SDcFniPBOIH1j8lxUc2_b8toTKwGh_HBwgb1F6mCVnuSlsHsu2slIQql7DYSTSv_l1W4zMPb0X_R_AqGszbQjOuFgFTP_4Ft52slvoWS_BsoTGFaGVXGu1EFHEK1oDikfv8h2_CnoBFp39q4hb_8ijAdHriNrfCexhqUuIeyz_PSkGpvaamjT6RT29ntzRIczYFH34d3Ihp5TpGmDN1SlW3Q7DfDGIIY36usc7ukwByQLlaIjift7aK6ufi3VByPkz_JS2QaxVoPP02vCtGxpfQnSrPqsaaqR2ymdoRbUXPmbQSBWwYWBwO8E7p-f1nkFWbfoq0r0-PK0x0bhL70eyJeSkVECpUy-iydnjvVsZwC9OZtTBXAMHZ69iaXnbn6vK8IHWrvkZIWHI3filFMGIuCDrBF1YiDzoZtEIXHoRU8xotbmVxsImqE0M0f0sol4kFCNefTL6iJBjb7V-VVrca54inajkNVP31_QdcD-IfxtZm24OCtCaLn9Jmvvtn3Medeq3mY61AmSALRNlGXgZzBZUxHNNyltXCYVpuzSj3jjljVikAve-E1WWfMBEpe8WNS3P109gQRVUKZKTPt5wyPTuGIwBVlr7KZXuMR_T9jVCRixgGJ-SwaqJv6GghCsd_5uJUltjn2_zxT1ZuySGaGJ2YV-yx6_EjFfG6og_67_dVw5cz4xMZuFM9bZVLZlPNcHGDnj_zf-vshXMtcmYjQe2b6VfgHtnCiZWWGSkwQY4QcaifOblwRFU_CLs-NF_A1YKefohORbpgrLtLXOg8e3bjK32WpHh8nVip1i_yzFqEHOrZYU0dT9jEwItCow5BQx5J8osztueEENlVua69hP2f0RsdV2y-C0YqxC0YB9V5P6xekN_KdxtuZGcFROqowtoD0mzBBidVAUKp1IysSTGzmutahspq5_tg9QYpP0fQOCzIBVNcClk2fLr37H-ldmk3CdPLa83ZsrSDxNNPbey_lq6TFEPvDVQ-soqCxPSGMaMV2RG8jLIP9Rj-QjFB6CaaUf&xkcb=SoAG6_M3FlTKKaxytJ0BbzkdCdPP&p=10&fvj=0&vjs=3&jsa=4893&tk=1hl5dhff5iqv3800&from=jasx&wvign=1",
    "externalApplyLink": "https://ca.indeed.com/applystart?jk=7a496fd032d224bf&from=vj&pos=top&mvj=0&spon=1&adid=424377251&ad=-6NYlbfkN0ChYVx_I3yfZ_JDY3EFoivtqvi_stwnZ_kRt8Dowt_l_Th23phn_g9jtNUSey9g1Yn7glieV4V4fN7nUxBMR92xtyZOFeLb7O0kuBgYfoqg1ea99HasVo4tT9oQJ6YcIvinAn1r9HYSTL6oXRUAXK0JT0nAwmg6hxHnWted21-4FcziUCB7XmntNWeC_aM8ALU-R8lWtEPsKBHlXv86vYiSLhL3YKg3YFn6X6SHAKLFxCrHflxfFTxgxeq_ESc5ZKCrNITZ7vBwC3RA97-69YmRVhYL1HhdNs4uGEfALuEc7cHCMevPb3WA96Trpjj6cClYPfcj2puANaXluH3vNXhaweL5JdHmIxduG6GOiTXYBr_3eIo_IP4ioidCPiNXDbafK0QJX2SHVH66i6BmF5LR8AN0avmpfMcf_IIh-T81IPpFweDR6bNUGTjmD-QfsXyIOQscoZBqKRz9EMqmT63NtvYyxxUmUMQo4abYTdBfLb_wfWJfjWQtWqHMwXBgv-xiSg_Lwph5jA%3D%3D&xkcb=SoAG6_M3FlTKKaxytJ0BbzkdCdPP&xpse=SoAg6_I3FlTJIEyirB0JbzkdCdPP&sjdu=9nrDNPdV1DghkDNnC2WJlW1nrk21-asFvjSk9jx-s_OxHbmPGQm77InFz2AtGf03iisdRpQWak0Jg18FnR-LHieSyO2uK222eLZfSSCSLSH_Kb7O9nmoDsQBLSporaYPQCNONI3F9McHcUBaQ-HMRZ_oiR-CdCDiHzlAurkQdKIiMAjnxtfYRWpXqKKTsas4zPwGd_DcwrzWsV7x07BSbEBDNCzjfKj-N3XYttKFhLO4Aj95wM5J6532Xu4NFTc-gPPiMaZZ_IXNjg-NiASbKJOedDRpt-pxFCz4w5f0ty1G506n6C-gPs9TOrCciQCIR9XS5red7i1M63lo34bjfNrJfvgCtsZ-Wq4BKtb7WDAy3p5y3oKxh3Tpt-ngEJape182vxya2JIyllsK6_btCx6WhxXIgszKi10MaevvoUPpjpbeIjTfR-apg2z3k6MqijjTuDLyh8rCC-vpMMH5DQTCOSA8Wg7CTibVEmAAXeKT4vrCTDBv-ooYQa25vIve&vjfrom=serp&astse=055ecfcf180f214d&assa=5206",
    "job_info_group": {
        "extracted_phone_numbers": [],
        "extracted_links": [
            "HTTP/HTTPS Links",
            "General Links",
            "WWW Links",
            "TLDs"
        ],
        "extracted_emails": [],
        "extracted_location_data": [
            "Ottawa"
        ],
        "extracted_dates": [
            "1 to 4 years",
            "Every day"
        ],
        "extracted_languages": [],
        "extracted_laws": [],
        "extracted_norps": [
            "sans"
        ],
        "extracted_orgs": [
            "information g\u00e9n\u00e9tique ou",
            "le monde entier inspirent au quotidien",
            "ing\u00e9nierie et en sciences",
            "Calgary Additional Skills & Qualifications",
            "un d\u00e9veloppement",
            "L'entreprise",
            "Allegis Group",
            "the Aerospace and Defense Industry Description",
            "leader mondial des solutions de candidats talentueux",
            "\u00e2ge",
            "Working With Actalent Actalent"
        ],
        "extracted_persons": [
            "de r\u00e9aliser",
            "La diff\u00e9rence",
            "Actalent"
        ],
        "extracted_products": [
            "Collaborate"
        ],
        "extracted_money": [],
        "processed_text": "seek Junior Technical Writer client Technical Writer assign development variety documentation software hardware system help client coordinate conduct tactical operation . alongside Team Lead collaborate directly engineering team research evaluate information help development documentation information . key responsibility write rewrite edit technical document technical procedure manual user manual programming manual service manual operational specification relate technical publication wide range tactical system . acquire subject knowledge collaborate interview engineering refer technical specification blueprint engineering illustration trade journal . conduct quality review material . adhere advise stakeholder government publishing guideline team improve internal process document change . recommend implement documentation method format serve satisfy technical customer requirement . requirement technical writing develop technical documentation Software Hardware system manage multiple task independently remote synthesize complex technical datum concise user documentation develop structured technical documentation problem tracking tool process documentation defect resolution worldwide leader engineering consult talent solution . specialize support engineer long term company hire passionate people invest career . diverse client prefer thrill help cut edge startup deploy late technology impact large corporation modernize legacy system . cover range discipline address specific industry area specialization . encourage apply propos d'Actalent actalent relie passion mission . solution candidats talentueux performance services produisent valeur les resultat tout apportant competence permet client . expert situes dans . nous soutenon les initiative essentielle par les experiences favorisent continu . c'est gen . Actalent est une societe d'exploitation d'Allegis Group . souscrit au principe d'egalite d'acces lthemploi prendra compte toutes les candidature distinction race sexe couleur religion nationalite statut veteran handicap orientation sexuelle identite sexuelle toute autre distinction protegee par loi . connect passion purpose . scalable talent solution service capability drive result provide expertise help customer achieve . expert globe impact . support critical initiative engineering science advance company serve . promote consultant care engagement enable continuous development . people difference . operate company global leader talent solution . company equal employer consider application regard race sex age color religion national origin veteran status sexual orientation gender identity genetic information characteristic protect law propos d'Actalent actalent relie passion mission . solution candidats talentueux performance services produisent valeur les resultat tout apportant competence permet client . expert situes dans . nous soutenon les initiative essentielle par les experiences favorisent continu . c'est gen . Actalent est une societe d'exploitation d'Allegis Group . souscrit au principe d'egalite d'acces lthemploi prendra compte toutes les candidature distinction race sexe couleur religion nationalite statut veteran handicap orientation sexuelle identite sexuelle toute autre distinction protegee par loi . connect passion purpose . scalable talent solution service capability drive result provide expertise help customer achieve . expert globe impact . support critical initiative engineering science advance company serve . promote consultant care engagement enable continuous development . people difference . operate company global leader talent solution . company equal employer consider application regard race sex age color religion national origin veteran status sexual orientation gender identity genetic information characteristic protect law ."
    },
    "companyDescription": "Actalent connects passion with purpose. Our scalable talent solutions and services capabilities drive value and results and provide the expertise to help our customers achieve more. Every day, our experts around the globe are making an impact. We\u2019re supporting critical initiatives in engineering and sciences that advance how companies serve the world. \r\n \r\nActalent\u2019s global footprint and flexible delivery models ensure access to specialized talent where and when you need it. We promote consultant engagement through professional development and provide experiences to ensure continuous learning. Our people are the difference.\r\n \r\nOur expertise spans capabilities in engineering including product and manufacturing, systems and software, construction management, environmental, architecture and civil; and power and utilities. We focus on sciences capabilities in laboratory sciences, healthcare, and clinical research. \r\n \r\nActalent is an operating company of Allegis Group, the global leader in talent solutions. Learn more at actalentservices.com. ",
    "description": "Actalent is seeking a Junior Technical Writer for our client in the Aerospace and Defense Industry\n  Description:\n  As a Technical Writer, you\u2019ll be assigned to the development of a variety of documentation for software & hardware systems that help our client coordinate and conduct their tactical operations. You will work alongside the Team Lead on a day-to-day and collaborate directly with engineering teams to research and evaluate information to help with the development of documentation and information.\n  Some of your key responsibilities:\n \n  Write, rewrite, and/or edit technical documents such as technical procedure manuals, user manuals, programming manuals, service manuals, operational specifications, and related technical publications for a wide range of tactical systems.\n  Acquires subject knowledge by collaborating and interviewing engineering and referring to technical specifications, blueprints, engineering illustrations, and trade journals.\n  Conduct quality review of materials.\n  Adhere to, and advise stakeholders on government publishing guidelines\n  Collaborate with team members to improve internal processes and documenting any changes.\n  Recommend and implement new documentation methods and formats that serve and satisfy technical and customer requirements.\n \n  Requirements:\n \n  Technical writing experience - 1 to 4 years\n  Experience developing technical documentation for Software or Hardware systems \ufeff\n \n \n  Ability to manage multiple tasks independently \n \n ***Remote job but the candidate must be in Ottawa or Calgary ***\n  Additional Skills & Qualifications:\n \n  Ability to synthesize complex technical data into concise end user documentation\n  Experience developing structured technical documentation\n  Experience with problem tracking tools, processes, and documentation defect resolution\n \n  Working With Actalent\n  Actalent is a worldwide leader in engineering consulting talent solutions. We specialize in supporting engineers with long-term opportunities, we're a company that hires passionate people and invest in their careers. You'll have the opportunity to work with diverse clients, whether you prefer the thrill of helping cutting-edge startups deploy the latest technology or the ability of impacting large corporations modernizing legacy systems. We cover a range of disciplines to address specific industry needs within different areas of specialization.\n  We encourage you to apply as soon as possible!\n  \u00c0 propos d'Actalent:\n  Actalent relie la passion \u00e0 la mission. Nos solutions de candidats talentueux et la performance de nos services produisent la valeur et les r\u00e9sultats, tout en apportant la comp\u00e9tence qui permet \u00e0 nos clients de r\u00e9aliser plus. Nos experts situ\u00e9s dans le monde entier inspirent au quotidien. Nous soutenons les initiatives essentielles en ing\u00e9nierie et en sciences, par les exp\u00e9riences qui favorisent un d\u00e9veloppement continu. La diff\u00e9rence, c\u2019est nos gens. Actalent est une soci\u00e9t\u00e9 d\u2019exploitation d\u2019Allegis Group, leader mondial des solutions de candidats talentueux.\n  L\u2019entreprise souscrit au principe d\u2019\u00e9galit\u00e9 d\u2019acc\u00e8s \u00e0 l\u2019emploi et prendra en compte toutes les candidatures sans distinction de race, sexe, \u00e2ge, couleur, religion, nationalit\u00e9, statut de v\u00e9t\u00e9ran, handicap, orientation sexuelle, identit\u00e9 sexuelle, information g\u00e9n\u00e9tique ou toute autre distinction prot\u00e9g\u00e9e par la loi.\n  About Actalent:\n  Actalent connects passion with purpose. Our scalable talent solutions and services capabilities drive value and results and provide the expertise to help our customers achieve more. Every day, our experts around the globe are making an impact. We\u2019re supporting critical initiatives in engineering and sciences that advance how companies serve the world. Actalent promotes consultant care and engagement through experiences that enable continuous development. Our people are the difference. Actalent is an operating company of Allegis Group, the global leader in talent solutions.\n  The company is an equal opportunity employer and will consider all applications without regards to race, sex, age, color, religion, national origin, veteran status, disability, sexual orientation, gender identity, genetic information or any characteristic protected by law\n  \n \n \u00c0 propos d'Actalent: \n Actalent relie la passion \u00e0 la mission. Nos solutions de candidats talentueux et la performance de nos services produisent la valeur et les r\u00e9sultats, tout en apportant la comp\u00e9tence qui permet \u00e0 nos clients de r\u00e9aliser plus. Nos experts situ\u00e9s dans le monde entier inspirent au quotidien. Nous soutenons les initiatives essentielles en ing\u00e9nierie et en sciences, par les exp\u00e9riences qui favorisent un d\u00e9veloppement continu. La diff\u00e9rence, c\u2019est nos gens. Actalent est une soci\u00e9t\u00e9 d\u2019exploitation d\u2019Allegis Group, leader mondial des solutions de candidats talentueux. \n L\u2019entreprise souscrit au principe d\u2019\u00e9galit\u00e9 d\u2019acc\u00e8s \u00e0 l\u2019emploi et prendra en compte toutes les candidatures sans distinction de race, sexe, \u00e2ge, couleur, religion, nationalit\u00e9, statut de v\u00e9t\u00e9ran, handicap, orientation sexuelle, identit\u00e9 sexuelle, information g\u00e9n\u00e9tique ou toute autre distinction prot\u00e9g\u00e9e par la loi. \n About Actalent: \n Actalent connects passion with purpose. Our scalable talent solutions and services capabilities drive value and results and provide the expertise to help our customers achieve more. Every day, our experts around the globe are making an impact. We\u2019re supporting critical initiatives in engineering and sciences that advance how companies serve the world. Actalent promotes consultant care and engagement through experiences that enable continuous development. Our people are the difference. Actalent is an operating company of Allegis Group, the global leader in talent solutions. \n  The company is an equal opportunity employer and will consider all applications without regards to race, sex, age, color, religion, national origin, veteran status, disability, sexual orientation, gender identity, genetic information or any characteristic protected by law."
}