{
    "id": "af77b81366a911d6",
    "company": "Paracel Laboratories",
    "positionName": "Junior Laboratory Analyst",
    "jobType": [],
    "location": "2319 St. Laurent Blvd Suite 300, Ottawa, ON",
    "salary": null,
    "postingDateParsed": "2023-10-23T20:06:40.674Z",
    "url": "https://www.indeed.ca/rc/clk?jk=af77b81366a911d6&from=jasx&tk=1he3lftbdk7tt800&vjs=3",
    "externalApplyLink": "https://ca.indeed.com/rc/clk?jk=af77b81366a911d6&atk=&xpse=SoBw67I3IDjMWly2DZ0LbzkdCdPP",
    "job_info_group": {
        "extracted_phone_numbers": [],
        "extracted_links": [
            "HTTP/HTTPS Links",
            "General Links",
            "WWW Links",
            "TLDs"
        ],
        "extracted_emails": [],
        "extracted_location_data": [
            "Kingston",
            "Toronto",
            "Mississauga",
            "Canada",
            "Richmond Hill",
            "Calgary",
            "Ottawa",
            "Niagara",
            "London",
            "Windsor",
            "Southwestern Ontario"
        ],
        "extracted_dates": [],
        "extracted_languages": [],
        "extracted_laws": [],
        "extracted_norps": [],
        "extracted_orgs": [
            "Quality Assurance",
            "analysis Quality Control",
            "or Chemical/Biology/Biochemistry Technology Diploma",
            "Paracel Laboratories Ltd.",
            "Good Laboratory Practices",
            "Paracel Laboratories",
            "Quality Control (Quality Control",
            "Eastern"
        ],
        "extracted_persons": [
            "Hamilton"
        ],
        "extracted_products": [
            "Excel"
        ],
        "extracted_money": [],
        "processed_text": "service environmental Indoor Air Quality laboratory . main laboratory facility locate support environmental lab microbiology asbestos laboratory . additional service depot locate . support broad spectrum project professional client . client base consist major environmental consultant level government industrial manufacturer locate . Junior Analyst join team St. Laurent lab . ideal role detail orient dexterous drive meet deadline fast pace environment . Junior analyst responsible perform analysis discrete Laboratory i.e. Organic Inorganic . involve sample preparation manipulation standard reagent preparation accord establish method Quality Control protocol assistance research project require direct supervision Senior Analyst . permanent position . key responsibility ensure test perform accord establish house protocol . responsible perform analysis preparation lab standard reagent routine research relate analysis . responsible perform . maintain cleaning workspace laboratory . assist collate tabulate datum . monitoring requisition supply require . comply company Quality Assurance Quality Control Health Safety policy procedure . qualification B.Sc . equivalent . superb attention detail accuracy . effectively follow interpret instruction method procedure . high degree manual dexterity . highly reliable deadline drive . strong communication skill . thrive fast pace environment . good understanding Quality Assurance . GLPs . independently team . proven computer skill include MS office Word . apply addition resume include cover letter application . applicant interest select interview contact . equal employer . require accommodation recruitment process effort provide appropriate accommodation place . power JazzHR bg5rxa2j3n"
    },
    "companyDescription": "",
    "description": "Who We Are: \n  Paracel Laboratories Ltd. is a full-service environmental and Indoor Air Quality laboratory. Our main laboratory facilities are located in Ottawa and are supported by an environmental lab in Hamilton and microbiology and asbestos laboratories in Mississauga and Calgary. Additional service depots are located in Kingston, London, Niagara, Windsor, and Richmond Hill. We support a broad spectrum of projects for professional clients from across Canada and around the world. Our client base primarily consists of major environmental consultants, all levels of government and industrial manufacturers located predominantly in Ottawa, Toronto, Niagara, Eastern and Southwestern Ontario.\n   The Opportunity: \n  Paracel Laboratories is looking for a Junior Analyst to join our team at our St. Laurent lab in Ottawa. The ideal candidate for this role is detail-oriented, dexterous and driven to meet deadlines in a fast-paced environment. \n  The Junior Analyst is responsible for performing analyses within a discrete section of the Laboratory (i.e. Organic, Inorganic). This involves sample preparations and manipulations, standards/reagent preparation according to established methods and QC protocols, and assistance on research projects as required under the direct supervision of the Senior Analyst. This is a full-time, permanent position.\n   Key Responsibilities: \n  \n   Ensuring that all tests are performed according to the established in-house protocols.\n    Responsible for performing analyses, and the preparation of lab standards and reagent, for both routine and research related analyses.\n    Responsible for performing analysis QC.\n    Maintaining and cleaning workspace in the laboratory.\n    Assists in collating and tabulating data.\n    Monitoring and requisitioning supplies as required.\n    Comply with company QA/QC and Health & Safety policies and procedures.\n  \n   Qualifications: \n  \n   B.Sc. or Chemical/Biology/Biochemistry Technology Diploma or equivalent with less than 1 year related experience.\n    Superb attention to detail and accuracy.\n    Ability to effectively follow/interpret work instructions, methods and procedures.\n    High degree of manual dexterity.\n    Highly reliable and deadline-driven.\n    Strong communication skills.\n    Thrives in a fast-paced environment.\n    Good understanding of Quality Assurance (QA) and Quality Control (QC).\n    Good Laboratory Practices (GLPs).\n    Ability to work independently and with a team.\n    Proven computer skills including MS office (Word and Excel).\n  \n   To Apply: \n  In addition to your resume, please include a cover letter in your application. We thank all applicants for their interest; however, only those selected for an interview will be contacted. \n  Paracel Laboratories is an equal-opportunity employer. If you require accommodation during the recruitment process, please let us know, and all efforts to provide the appropriate accommodation will be put into place.\n   Powered by JazzHR\n   bg5RXA2j3N"
}