{
    "id": "6a5c3530ebe1ee08",
    "company": "Intelerad",
    "positionName": "System Technology Specialist (Linux PACS - L2)",
    "jobType": [
        "Permanent"
    ],
    "location": "Ottawa, ON",
    "salary": null,
    "postingDateParsed": "2024-01-25T12:17:56.252Z",
    "url": "https://www.indeed.ca/rc/clk?jk=6a5c3530ebe1ee08&from=jasx&tk=1hl5djsk1h7hv800&bb=xjPBkK6OIlrxY1Te1w3p5XAlnIn42CP6jg06YnmoNgqVU24ozK8RXArzKrcREwMUkggHSjLhm50iTYdjvKTYUQ0XCyI_LJF67lNJ_woPaxVj0kidF2bh_Q%3D%3D&xkcb=SoAu67M3FlTATHzAAx0IbzkdCdPP&vjs=3",
    "externalApplyLink": "https://jobs.smartrecruiters.com/Intelerad/743999963122382-system-technology-specialist-linux-pacs-l2-",
    "job_info_group": {
        "extracted_phone_numbers": [],
        "extracted_links": [
            "HTTP/HTTPS Links",
            "General Links",
            "WWW Links",
            "TLDs"
        ],
        "extracted_emails": [],
        "extracted_location_data": [
            "NC",
            "Montreal",
            "Raleigh",
            "Non-US"
        ],
        "extracted_dates": [
            "5-7 years",
            "40 or older",
            "2021"
        ],
        "extracted_languages": [],
        "extracted_laws": [
            "The American Disabilities Act"
        ],
        "extracted_norps": [
            "the Americans"
        ],
        "extracted_orgs": [
            "Committed",
            "Enterprise Imaging Intelerad Partners",
            "Twitter",
            "LinkedIn",
            "Intelerad",
            "the System Technology Specialist",
            "The System Technology Specialist",
            "continual skills improvement Team",
            "Technical Support in Medical Software",
            "KLAS",
            "Best",
            "the US Meet Intelerad's Leadership Team",
            "More than 1,300 Radiologists Across",
            "Ambra Health",
            "RCA",
            "PACS Asia/Oceania",
            "(\"American Disabilities Act\")as",
            "Innovative Medical Image Management Solutions",
            "Optional Skills",
            "the Support Team",
            "Strategic Radiology"
        ],
        "extracted_persons": [
            "Python"
        ],
        "extracted_products": [],
        "extracted_money": [
            {
                "amount": "1",
                "noun_phrases": []
            }
        ],
        "processed_text": "company description improve healthcare innovative technology core Intelerad's . scalable medical imaging platform connect clinician powerful imaging ecosystem fast smart tap datum matter location . focus deliver good class medical image management solution improve provider efficiency decrease cost healthcare improve health population . Intelerad offer healthcare's comprehensive imaging analytic platform . headquarter employee locate office country . company empower healthcare organization speed scalability simplicity increase business performance importantly improve patient outcome . Intelerad's modern enterprise solution acknowledge KLAS recognition rank Best Global Software report . learn visit follow . description purpose System Technology Specialist report directly support Manager Manager closely support technician clinical application specialist engineering team client resolve tough technical issue . responsible solve problem share technical expertise product . involve mentor experienced team provide practical perspective product design discussion ensure product client architecture . high point escalation client service expect provide requirement product supportability maintenance . responsible development tool Support team . major accountability Accountabilities primary escalation point Level System Support team drive customer communication follow resolution respect set service level agreement . major incident manager system outage support Level perform root analysis major incident participate software requirement root review engineering design review mindset supportability software provide workaround issue find field stay current development product bug feature situation occur client site isp participate creation update Knowledge article reduce escalation L2 urgent escalation report support team occur regular schedule rotation availability participate project deem organization Employment Pre requisite pre requisite Degree computer science engineering equivalent client face role focus Field Linux OS administration expertise query structured Query Language asset networking troubleshooting expertise Cloud Infrastructure Development scripting language PHP Perl ... read code high level language qualification Desired Competencies competence highly motivated excel orient strong communication interpersonal skill creative thinker practical problem solver professional software development Product application support train customer service project management customer support environment Additional Information applicant meet minimum qualification require complete minute online assessment application . committed principle equal employment . committed comply federal state local law provide equal employment employment law regulation . applicant employee employee protect employment discrimination base race color religion sex include pregnancy sexual orientation gender identity national origin age genetic information include family medical history . Intelerad dedicate fulfillment policy regard aspect employment include limit recruiting hiring placement transfer training promotion rate pay compensation termination term condition privilege employment . committed ensure equal employment qualified individual . Intelerad Disabilities standard global recruiting hire purpose . prohibit discrimination qualified individual . define physical mental impairment limit major life activity individual record impairment regard impairment . Intelerad Combine form Global Industry Leader Cloud PACS bring LI Remote"
    },
    "companyDescription": "Intelerad is a leader enterprise workflow and medical image archiving solutions for all types of healthcare organizations. Renowned for their innovative features and functionality, Intelerad solutions, such as InteleViewer\u2122 and InteleOne\u00ae XE, increase productivity and streamline workflow by overcoming technical barriers in distributed and complex environments. Highly scalable, flexible and robust, Intelerad\u2019s solutions offer high performance and industry leading customer service and support. ",
    "description": "Company Description\n  Improving healthcare through innovative technology is at the core of Intelerad\u2019s work. Our scalable medical imaging platform connects clinicians to a powerful imaging ecosystem that is fast, smart, and tapped into the data they need, no matter their location. We\u2019re focused on delivering a best-in-class medical image management solution that improves provider efficiency, decreases the cost of healthcare, and improves the overall health of populations.\n  Intelerad offers one of healthcare\u2019s most comprehensive imaging and analytics platforms. Headquartered in Raleigh, NC and Montreal, Intelerad has nearly 700 employees located in offices across six countries. The company empowers nearly 2,000 healthcare organizations around the world with the speed, scalability, and simplicity needed to increase business performance while, most importantly, improving patient outcomes. Intelerad\u2019s modern enterprise solutions have been acknowledged by a Best in KLAS recognition, ranking #1 for PACS Asia/Oceania in the 2021 Best in KLAS: Global Software (Non-US) report. To learn more, visit intelerad.com and follow Intelerad on LinkedIn and Twitter.\n  Job Description\n  Purpose\n  The System Technology Specialist will report directly to the support Manager Manager and work closely with support technicians, clinical and application specialists, engineering teams, and our clients to resolve the toughest technical issues. The System Technology Specialist is responsible for solving problems, sharing technical expertise and product experience. This involves mentoring less experienced team members, as well as providing a practical perspective to product design discussions to ensure our products work well within the various client architectures. Since the System Technology Specialist will be the highest point of escalation within client services, he/she will also be expected to provide requirements for product supportability and maintenance. The System Technology Specialist is also responsible for the development of tools for the Support team.\n  Major accountabilities\n  Accountabilities\n  Act as the primary escalation point for Level 1 System Support team and drive customer communications and follow ups until resolution, by respecting set service level agreements.\n  Act a major incident manager during system outages to support Level 1 and perform root cause analysis (RCA\u2019s) for all Major Incidents\n  Participate in software requirements and root cause reviews with engineering as well as design reviews with a particular mindset into the supportability of the software and also provide fixes and/or workarounds to issues found in the field\n  Stay up to date with current development of the product (bug fixes and new features) and situations occurring at client site (ISP)\n  Participate in the creation/update of Knowledge articles used by the Support Team to reduce escalations to L2\n  Be available for urgent escalations reported by the support team that can occur after your regular work schedule: On Call Rotation Availability (24/7)\n  Participate in any project deemed necessary by the organization\n \n  Employment Pre-requisites\n  Pre-requisite\n  Degree in computer science, engineering, or equivalent\n  5-7 years of experience in client facing roles focused on Technical Support in Medical Software Field\n  Linux OS administration expertise\n  Experience running queries in SQL - an asset\n  Networking troubleshooting expertise (Cloud Infrastructure)\n  Development experience with scripting languages (PHP, Perl, Python, etc\u2026)\n  Ability to read code in other high level languages\n \n  Qualifications\n  Desired Competencies\n  Competences\n  Highly motivated to excel and Committed to continual skills improvement\n  Team oriented with strong communication and interpersonal skills\n  Creative thinker and practical problem solver\n \n  Optional Skills:\n \n   Professional software development\n   Product applications support and training\n   Customer service or project management in a customer support environment\n \n \n  Additional Information\n  All applicants meeting minimum qualifications will be required to complete a 30 minute online assessment as part of your application. \n Intelerad is committed to the principles of equal employment. We are committed to complying with all federal, state and local laws providing equal employment opportunities and all other employment laws and regulations. Applicants, employees and former employees are protected from employment discrimination based on race, color, religion, sex (including pregnancy, sexual orientation, or gender identity), national origin, age (40 or older), disability and genetic information (including family medical history). Intelerad is dedicated to the fulfillment of this policy regarding all aspects of employment, including but not limited to recruiting, hiring, placement, transfer, training, promotion, rates of pay, and other compensation, termination, and all other terms, conditions, and privileges of employment.\n \n  Intelerad is committed to ensuring equal employment opportunity for qualified individuals with disabilities. Intelerad uses the Americans with Disabilities Act (\u201cADA\u201d)as a standard for global recruiting and hiring purposes. This prohibits discrimination against qualified individuals with disabilities. The ADA defines \u201cdisability\u201d as a physical or mental impairment that substantially limits one or more of the major life activities of an individual, a record of such impairment, or being regarded as having such an impairment.\n \n  Intelerad and Ambra Health Combine to Form the Global Industry Leader in Cloud PACS and Enterprise Imaging \n Intelerad Partners with Strategic Radiology to Bring Innovative Medical Image Management Solutions to More than 1,300 Radiologists Across the US\n  Meet Intelerad\u2019s Leadership Team: https://www.intelerad.com/en/about/leadership-team/\n  #LI-Remote"
}