{
    "id": "b343c3ceeec09214",
    "company": "Kinaxis",
    "positionName": "UX Research Intern",
    "jobType": [],
    "location": "3199 Palladium Dr, Ottawa, ON",
    "salary": null,
    "postingDateParsed": "2023-09-15T06:49:48.563Z",
    "url": "https://www.indeed.ca/rc/clk?jk=b343c3ceeec09214&from=jasx&tk=1hbkvuh1oj32s803&vjs=3",
    "externalApplyLink": "https://boards.greenhouse.io/kinaxis/jobs/6933144002?source=Indeed",
    "job_info_group": {
        "extracted_phone_numbers": [],
        "extracted_links": [
            "HTTP/HTTPS Links",
            "General Links",
            "WWW Links",
            "TLDs"
        ],
        "extracted_emails": [
            "recruitmentprograms@kinaxis.com"
        ],
        "extracted_location_data": [
            "Canada",
            "Ottawa"
        ],
        "extracted_dates": [
            "January 2024",
            "12 months",
            "Every day"
        ],
        "extracted_languages": [],
        "extracted_laws": [],
        "extracted_norps": [],
        "extracted_orgs": [
            "http://blog.kinaxis.com/. Kinaxis",
            "RapidResponse",
            "Kinaxis"
        ],
        "extracted_persons": [
            "Alchemer",
            "Miro",
            "Condens"
        ],
        "extracted_products": [
            "Challenging Work"
        ],
        "extracted_money": [],
        "processed_text": "ground common belief people matter . play accomplish build culture global impact . empower help customer fast confident planning decision . create planet \u2013 customer generation . cloud base platform ensure product \u2013 medicine car item toothpaste \u2013 market hand minimal ecological footprint . . User Research Intern location office prefer Remote EST Zone Term length start Team User team transform user product RapidResponse . integrate User team treat permanent employee . closely developer product manager designer researcher exciting challenging research project . experiment learn skill gain valuable real . help broaden accelerate User research testing create execute usability test User designer identify test e.g. area risk uncertainty . write study protocol . schedule conduct moderated usability test prepare execute unmoderated test . analyze result . summarize finding . support research activity schedule conduct interview user . create survey . analyze result . summarize finding . create survey . analyze datum write report . collaborative story mapping brainstorming early concept generation . Figma collaborate fidelity visual design prototype . perform additional project assign . education user research psychology experimental social cognitive sociology anthropology human computer interaction human factor field . demonstrable research expertise strong communication skill team orientation responsive feedback . curiosity empathy attention detail strong desire create great product motivation learn improve . offer love solve highly complex problem . global leader industry innovate \u2014 . team role employee empower bring good idea forward jump solve problem passionate . great People seriously seriously dna celebrate laugh fun . strong open honest real . person play role share success . global Impact global team span continent boundary culture inspire impact colleague customer community large . diversity Equity Inclusion Diversity equity inclusion word . guide principle build culture celebrate other' difference continuously strive equality recognize inclusion strong individual company global citizen . information visit Kinaxis web site company's blog encourage diverse apply community . strive website application process accessible user . contact regard accessibility website assistance complete application process contact . contact information accessibility request inquire status application ."
    },
    "companyDescription": "",
    "description": "At Kinaxis, who we are is grounded in our common belief that people matter. Each one of us plays an important part in accomplishing our work, building our culture and making a global impact. \n   Every day, we\u2019re empowered to work together to help our customers make fast, confident planning decisions. This is how we create a better planet \u2013 for each other, for our customers and for generations to come. Our cloud-based platform RapidResponse ensures that the products we need \u2013 everything from medicine and cars, to day-to-day items like toothpaste \u2013 make it to market and into our hands when we need them with minimal ecological footprint. \n   We make the world better, and you can too.\n  \n UX Research Intern \n  Job location: our office in Ottawa, Canada (preferred) or Remote; Canada (EST Time Zone) \n  Term length: 12 months starting January 2024 \n  About the Team \n  The UX team at Kinaxis is transforming the user experience of our product, RapidResponse. You\u2019ll be integrated right into the UX team and treated like a permanent employee. You\u2019ll work closely with developers, product managers, designers and other researchers on exciting and challenging research projects. You\u2019ll have the opportunity to experiment, learn new skills and gain valuable real-world experience. \n  What you will do \n  Help broaden and accelerate UX research & testing at Kinaxis: \n  \n  Create and execute usability tests \n  \n   Work with UX designers to identify what to test (e.g. areas of risk or uncertainty). \n   Write study protocols. \n   Schedule and conduct moderated usability tests AND/OR prepare and execute unmoderated tests. \n   Analyze results. \n   Summarize and present findings. \n  \n  Support research activities \n  \n   Schedule and conduct interviews with users. \n   Create surveys. \n   Analyze results. \n   Summarize and present findings. \n  \n  Use Alchemer to create surveys. \n  Use Condens to analyze data and write reports. \n  Use Miro for collaborative story-mapping, brainstorming, and early concept generation. \n  Use Figma to collaborate on hi-fidelity visual designs and prototypes. \n  May perform additional projects as assigned. \n \n What we are looking for \n \n  An education in user experience research, psychology (experimental, social, cognitive), sociology, anthropology, human computer interaction, human factors, or a related field. \n  Demonstrable research expertise \n  Strong communication skills, team-orientation and are responsive to feedback. \n  Curiosity, empathy and attention to detail \n  A strong desire to create great products, and a motivation to keep learning and improving. \n \n \n  What we have to offer \n  \n   Challenging Work - We love solving highly complex problems. And as the global leaders in our industry, we never stop innovating\u2014our work is never \u201cdone. That\u2019s because across our teams and in all roles, every employee is empowered to bring their best ideas forward and to jump in and solve the problems they\u2019re passionate about. \n   Great People - We take our work seriously, but we don\u2019t take ourselves too seriously! It\u2019s in our DNA to celebrate, laugh, and have fun. We are stronger, together, when we are open, honest, and above all, real. Every person is valued here and plays an important role in our shared success. \n   Global Impact - As a global team spanning continents, boundaries, and cultures, every day we are inspired by the impact our work has on our colleagues, our customers, our communities, and the world at large. \n   Diversity, Equity and Inclusion - Diversity, equity and inclusion are more than words to us. They are the guiding principles for building a culture where we celebrate each others\u2019 differences, continuously strive for equality and recognize that inclusion makes us stronger as individuals, a company and a global citizen. \n   \n  For more information, visit the Kinaxis web site at www.kinaxis.com or the company\u2019s blog at http://blog.kinaxis.com/. \n   Kinaxis strongly encourages diverse candidates to apply to our welcoming community. We strive to make our website and application process accessible to any and all users. If you would like to contact us regarding the accessibility of our website or need assistance completing the application process, please contact us at recruitmentprograms@kinaxis.com. This contact information is for accessibility requests only and cannot be used to inquire about the status of applications."
}