{
    "id": "501be01609d0e036",
    "company": "Smile Innovations Group",
    "positionName": "Dental Technician - Orthodontic",
    "jobType": [],
    "location": "Gatineau, QC",
    "salary": null,
    "postingDateParsed": "2024-01-18T05:12:44.486Z",
    "url": "https://www.indeed.ca/rc/clk?jk=501be01609d0e036&from=jasx&tk=1hkikh137kp3h801&bb=MbdkWoTc0uPjBzci8Lm-JZwN10IscOckAXH8_5aEjYoHFkBq8yZU1Ud4xzmcWjHvWA9S3uPJ89n6O8nXbCoEC2G2BCY9F4C9pp8RiCJy5UtnQRloWIElfA%3D%3D&xkcb=SoB567M3FShL_WzU3h0CbzkdCdPP&vjs=3",
    "externalApplyLink": "https://smileinnovationsgroup.bamboohr.com/careers/61?source=indeed&src=indeed&postedDate=2024-01-16",
    "job_info_group": {
        "extracted_phone_numbers": [],
        "extracted_links": [
            "HTTP/HTTPS Links",
            "General Links",
            "WWW Links",
            "TLDs"
        ],
        "extracted_emails": [],
        "extracted_location_data": [
            "Licence CDT/RDT pr\u00e9f\u00e9r\u00e9e mais non requise"
        ],
        "extracted_dates": [
            "June 1995",
            "juin 1995",
            "2 years"
        ],
        "extracted_languages": [],
        "extracted_laws": [],
        "extracted_norps": [
            "appliances Polish"
        ],
        "extracted_orgs": [
            "Pr\u00e9parer des mod\u00e8les dentaires",
            "d'offrir ses",
            "an experienced, skilled Orthodontic Technician",
            "Gr\u00e2ce \u00e0 son programme interne de recherche et d\u00e9veloppement",
            "buff",
            "de proth\u00e8ses dentaires",
            "et amovibles Concevoir",
            "aux besoins sp\u00e9cifiques de sa",
            "Milident Inc.",
            "Milident Inc",
            "la fabrication d'appareils Appareils polonais",
            "cintrage de fils Connaissance des appareils orthodontiques et de leurs fonctionnalit\u00e9s \u00catre",
            "sp\u00e9cialise"
        ],
        "extracted_persons": [
            "r\u00e9parer des appareils orthodontiques Lisez et suivez",
            "Responsabilit\u00e9s g\u00e9n\u00e9rales",
            "continuellement de nouvelles avanc\u00e9es technologiques dans la fabrication de ses proth\u00e8ses dentaires de haute",
            "de couronnes et de ponts implantaires",
            "Milident Dental Laboratory est actuellement \u00e0 la recherche d'un technicien en orthodontie exp\u00e9riment\u00e9",
            "DE MILIDENT Ouvert"
        ],
        "extracted_products": [],
        "extracted_money": [],
        "processed_text": "Francais version suit MILIDENT open specialize creation complex case implant support crown bridge removable denture orthodontic appliance . forefront technology continue offer product service tailor specific clientele . internal research development program continually explore technological advance manufacture high precision dental prosthesis . description Milident Dental Laboratory currently seek dental lab . year' relevant dental lab \u2013 hear relocation package . General responsibility Custom bend wire framework removable orthodontic appliance Design fabricate repair orthodontic appliance Read follow detailed instruction dental professional prepare dental model fabrication appliance qualification CDT RDT license prefer require Minimum wire bend knowledge orthodontic appliance functionality multitask quick decision independent sufficient fast pace operation Good hand eye coordination excellent management skill attention detail unsupervised PROPOS se dans creation boitiers complex amovible ainsi d'appareils orthodontique . Toujours fine pointe technologie continue produits services adaptes clientele . explore precision . description qualifie pour travailler temps plein dans notre laboratoire dentaire . dans laboratoire dentaire nous voulon avoir vos nouvelles Cadre fil pliage personnalise pour diver appareil orthodontiques fabriquer les instructions detaillees du professionnel dentaire pour chamois Qualifications Minimum ans d'experience capable faire plusieurs tache fois prendre des decision rapide Etre independant autosuffisant Suivez rythme rapide l'operation Bonne coordination \u0153il main Excellentes competence gestion du temp Souci du detail Capacite travailler sans supervision"
    },
    "companyDescription": "",
    "description": "Fran\u00e7ais version suit\n \n  ABOUT MILIDENT \n  Opened in June 1995, Milident Inc specializes in the creation of complex cases, implant-supported crown and bridge, fixed and removable dentures as well as orthodontic appliances. Always at the forefront of technology, Milident Inc. continues to offer its products and services tailored to the specific needs of its clientele. Through its internal research and development program, Milident Inc. is continually exploring new technological advances in manufacturing its high-precision dental prosthesis.\n \n  Description: \n  Milident Dental Laboratory is currently seeking an experienced, skilled Orthodontic Technician to work full-time in our dental lab. If you have at least 2 years\u2019 relevant experience in a dental lab \u2013 we want to hear from you! A relocation package will be available.\n \n  General Responsibilities: \n  \n  Custom bend wire framework for various fixed and removable orthodontic appliances \n  Design, fabricate or repair orthodontic appliances \n  Read and follow detailed instructions from the dental professional \n  Prepare dental models for the fabrication of appliances \n  Polish and buff appliances\n \n  \n  \n  Qualifications: \n  \n  CDT/RDT license preferred but not required \n  Minimum 2 years wire bending experience \n  Knowledge of orthodontic appliances and their functionality \n  Be able to multitask and make quick decisions \n  Be independent and self sufficient \n  Keep up with the fast-paced operation \n  Good hand eye coordination \n  Excellent time management skills \n  Attention to detail \n  Ability to work unsupervised \n  \n - \n  \u00c0 PROPOS DE MILIDENT \n  Ouvert en juin 1995, Milident Inc se sp\u00e9cialise dans la cr\u00e9ation de bo\u00eetiers complexes, de couronnes et de ponts implantaires, de proth\u00e8ses dentaires fixes et amovibles ainsi que d\u2019appareils orthodontiques. Toujours \u00e0 la fine pointe de la technologie, Milident Inc. continue d\u2019offrir ses produits et services adapt\u00e9s aux besoins sp\u00e9cifiques de sa client\u00e8le. Gr\u00e2ce \u00e0 son programme interne de recherche et d\u00e9veloppement, Milident Inc. explore continuellement de nouvelles avanc\u00e9es technologiques dans la fabrication de ses proth\u00e8ses dentaires de haute pr\u00e9cision.\n \n  Description: \n  Milident Dental Laboratory est actuellement \u00e0 la recherche d\u2019un technicien en orthodontie exp\u00e9riment\u00e9 et qualifi\u00e9 pour travailler \u00e0 temps plein dans notre laboratoire dentaire. Si vous avez au moins 2 ans d\u2019exp\u00e9rience pertinente dans un laboratoire dentaire, nous voulons avoir de vos nouvelles!\n \n  Responsabilit\u00e9s g\u00e9n\u00e9rales : \n  \n  Cadre de fil de pliage personnalis\u00e9 pour divers appareils orthodontiques fixes et amovibles \n  Concevoir, fabriquer ou r\u00e9parer des appareils orthodontiques \n  Lisez et suivez les instructions d\u00e9taill\u00e9es du professionnel dentaire \n  Pr\u00e9parer des mod\u00e8les dentaires pour la fabrication d\u2019appareils \n  Appareils polonais et chamois\n \n  \n  \n  Qualifications: \n  \n  Licence CDT/RDT pr\u00e9f\u00e9r\u00e9e mais non requise \n  Minimum 2 ans d\u2019exp\u00e9rience en cintrage de fils \n  Connaissance des appareils orthodontiques et de leurs fonctionnalit\u00e9s \n  \u00catre capable de faire plusieurs t\u00e2ches \u00e0 la fois et de prendre des d\u00e9cisions rapides \n  \u00catre ind\u00e9pendant et autosuffisant \n  Suivez le rythme rapide de l\u2019op\u00e9ration \n  Bonne coordination \u0153il-main \n  Excellentes comp\u00e9tences en gestion du temps \n  Souci du d\u00e9tail \n  Capacit\u00e9 de travailler sans supervision"
}