{
    "id": "d7cb862c2b90e2ee",
    "company": "The Ottawa Hospital",
    "positionName": "Dialysis Technician",
    "jobType": [],
    "location": "Ottawa, ON",
    "salary": null,
    "postingDateParsed": "2024-01-17T05:13:13.488Z",
    "url": "https://www.indeed.ca/rc/clk?jk=d7cb862c2b90e2ee&from=jasx&tk=1hkikiru3ih1j804&bb=Jd9mLJftQykZfRy2WebzJxg6QagwCjP5sukHeX_Oy9defA3lmK5BuE5ZAKnfXebjT_GzK5ii2uKK13ei8KIBUnJBSq4OFt6Gxg8qZ6yozWaSpt_snsF_DA%3D%3D&xkcb=SoB-67M3FShEWlRyph0HbzkdCdPP&vjs=3",
    "externalApplyLink": "https://ohhcmdmzweb01.ottawahospital.on.ca/psc/HRPRD/?cmd=login&errorPg=ckreq&languageCd=ENG",
    "job_info_group": {
        "extracted_phone_numbers": [],
        "extracted_links": [
            "HTTP/HTTPS Links",
            "General Links",
            "WWW Links",
            "TLDs"
        ],
        "extracted_emails": [],
        "extracted_location_data": [
            "Canada"
        ],
        "extracted_dates": [
            "weekends",
            "today"
        ],
        "extracted_languages": [
            "English"
        ],
        "extracted_laws": [],
        "extracted_norps": [],
        "extracted_orgs": [
            "a recognized College of Applied Arts and Technology",
            "DBP",
            "Learning and Leadership Development",
            "the University of Ottawa",
            "The Ottawa Hospital",
            "The Ottawa Hospital Inspired",
            "WHMIS",
            "CPR / First Aid",
            "Position Information",
            "Driver's Licence",
            "Basic Requirements Diploma in Electronics",
            "CSA"
        ],
        "extracted_persons": [],
        "extracted_products": [
            "Valid G Class"
        ],
        "extracted_money": [],
        "processed_text": "research drive compassion TOH Canada's large learning research multi campus hospital . bed staff deliver specialized care Eastern region . compassion people relentless pursuit discovery seek solution complex health care challenge continually engage community support vision patient care . research institute partner hospital continually gain national international recognition high quality patient care teaching research strive meet culturally diverse community serve . Dialysis Technician perform corrective preventive medical equipment maintenance clinical staff training service equipment safety inspection calibration quality assurance equipment design testing determine clinical requirement equipment provide technological guidance ageing defective equipment replacement schedule renewal assist disposal surplus equipment . corporate position base . rotation shift include hour shift . information purpose Hospital reserve change . stand evening night weekend statutory holiday . program equivalent combination education maneuver dialysis machine associate water treatment equipement working knowledge general physics anatomy mechanical hydraulic system provide training staff patient word processing spreadsheet database application equivalent working knowledge understand interpret schematic diagram service calibrate electronic equipment good interpersonal skill sound judgement problem solve skill eligible . Preferred Qualifications OACETT cnepht sound knowledge operation dialysis equipment CANNT technical standard proficiency french oral expression advanced level comprehension advanced level . expect commit provide healthy safe inclusive environment . drive purpose provide patient class care exceptional service compassion love . offer attractive equitable compensation package include comprehensive benefit package Defined Benefit Pension plan insurance protection . offer discount choice provider variety product service . provide Health Wellness resource personal professional development house team help align goal career objective . interested apply passionate motivate improve health community excite lead edge medical technology commit excellence quality patient safety hear . submit application position interested . apply select consideration contact . equal employer . request accommodation recruitment process ."
    },
    "companyDescription": "",
    "description": "About The Ottawa Hospital\n   \n     \n    \n      \n     \n     \n      Inspired by research and driven by compassion!\n     \n     \n     \n       The Ottawa Hospital (TOH) is one of Canada\u2019s largest learning and research multi-campus hospitals. With more than 1,100 beds and approximately 12,000 staff members, we deliver specialized care to the Eastern Ontario region.\n     \n     \n       \n     \n     \n      From the compassion of our people to the relentless pursuit of new discoveries, The Ottawa Hospital never stops seeking solutions to the most complex health-care challenges while continually engaging with the community to support our vision for better patient care.\n     \n     \n      Working together with its research institute, the University of Ottawa, and other partners, the hospital is continually gaining national and international recognition for high-quality patient care, teaching and research, while striving to meet the needs of the culturally diverse community we serve. \n    \n   \n  \n \n \n  \n    Position Information \n    \n    \n    \n     \n      The Dialysis Technician performs corrective and preventive medical equipment maintenance, clinical staff training and in-service of equipment, safety inspections, calibrations, quality assurance, equipment design and testing, determine clinical needs and requirements for new equipment, provide technological guidance for ageing and defective equipment, suggest replacement schedules and renewal, assist in the disposal of surplus equipment.\n     \n      \n     \n     \n       This is a Corporate position, with the home base at the Riverside Campus.\n      \n    \n   \n  \n \n \n  \n   Rotation/Shifts \n    \n    \n    \n     \n      Days, including weekends, 8 and 12 hour shifts.\n       \n      \n       For information purposes only - The Hospital reserves the right to change.\n      \n     \n      \n     \n     \n       Must be available for stand by and call back on evenings, nights, weekends and statutory holidays.\n      \n    \n   \n  \n \n \n  \n   Basic Requirements \n    \n    \n    \n     \n      Diploma in Electronics (3 year program) from a recognized College of Applied Arts and Technology OR an equivalent combination of experience and education;\n       Ability to move and maneuver a dialysis machine and associated water treatment equipement;\n       Working knowledge of general physics, anatomy, mechanical and/or hydraulic systems;\n       Ability to provide training to staff and patients;\n       Experience working with word processing, spreadsheet and database applications;\n       Valid G Class (or equivalent) Driver's Licence;\n       Working knowledge of WHMIS;\n       Ability to understand and interpret schematic diagrams;\n       Ability to service and calibrate electronic equipment;\n       Good interpersonal skills;\n       Sound judgement and problem solving skills;\n       Eligible to work in Canada.\n      \n    \n   \n  \n \n \n  \n   Preferred Qualifications \n    \n    \n    \n     \n      OACETT/CNephT;\n       CPR / First Aid;\n       Sound knowledge of the operation of dialysis equipment and CSA and CANNT technical standards;\n       Proficiency in English and French - oral expression (advanced level) and comprehension (advanced level).\n      \n    \n   \n  \n \n \n  \n   What you can expect from us\n   \n     \n    \n      \n     \n     \n      The Ottawa Hospital is committed to providing a healthy, safe, and inclusive work environment for everyone. We are driven by our purpose to provide each patient with the world-class care, exceptional service and compassion we would want for our loved ones.\n     \n     \n     \n       We offer an attractive and equitable compensation package including a comprehensive benefits package, a Defined Benefit Pension (DBP) plan, and insurance protection. We also offer discounts from choice providers on a variety of products and services.\n     \n      The Ottawa Hospital provides various Health and Wellness resources as well as opportunities for personal and professional development opportunities from our in-house Learning and Leadership Development team to help align your goals with your career objectives. \n    \n   \n  \n \n \n  \n    Interested? Apply today! \n    \n    \n    \n     \n      If you are passionate about what you do, motivated by improving the health of the community, excited by leading-edge medical technology, and as committed to excellence, quality and patient safety as we are, we would like to hear from you. Please submit an on-line application for the position you are interested in. We thank all those who apply but only those selected for further consideration will be contacted.\n     \n     \n       The Ottawa Hospital is an equal opportunity employer. Upon request, accommodations due to a disability are available throughout the recruitment process."
}