{
    "id": "def95c5494bfad9e",
    "company": "BonLook Optique",
    "positionName": "Stylist",
    "jobType": [],
    "location": "Gatineau, QC",
    "salary": null,
    "postingDateParsed": "2023-10-07T02:03:50.322Z",
    "url": "https://www.indeed.ca/rc/clk?jk=def95c5494bfad9e&from=jasx&tk=1hc6gcllqltfi801&vjs=3",
    "externalApplyLink": "https://recruiting.ultipro.ca/FYI5000FYID/JobBoard/2f3e3a2c-3619-47a0-bb50-59b6f5e6300e/OpportunityDetail?opportunityId=cbcddb08-6020-43bd-8fc3-314ed5fe0440&postingId=ee5673bc-d5ce-4d57-940b-37d3370e0004",
    "job_info_group": {
        "extracted_phone_numbers": [],
        "extracted_links": [
            "HTTP/HTTPS Links",
            "General Links",
            "WWW Links",
            "TLDs"
        ],
        "extracted_emails": [],
        "extracted_location_data": [
            "Montr\u00e9al",
            "Canada",
            "Montreal",
            "d'all\u00e9ger ce texte"
        ],
        "extracted_dates": [
            "Today",
            "week-end",
            "1 years",
            "available days",
            "daily"
        ],
        "extracted_languages": [],
        "extracted_laws": [],
        "extracted_norps": [
            "votre famille et vos amis"
        ],
        "extracted_orgs": [
            "BonLook s'engage \u00e0 faire une diff\u00e9rence et favorise la diversit\u00e9 et l'inclusion",
            "Initialement lanc\u00e9e en ligne, l'entreprise compte",
            "une culture ax\u00e9e sur la diversit\u00e9 et l'inclusion dans",
            "un si\u00e8ge social situ\u00e9",
            "d'ici fond\u00e9e par des",
            "\u00c0 propos de BonLook BonLook offre une exp\u00e9rience de vente novatrice et des",
            "avec une",
            "avec chaque",
            "the Lachine Canal",
            "toutes les sph\u00e8res de l'entreprise",
            "cr\u00e9er des liens avec nos",
            "et RVER",
            "Atteindre les objectifs de vente Recevoir et transf\u00e9rer la marchandise au besoin Le profil recherch\u00e9 Candidat",
            "au rapport",
            "Aujourd'hui",
            "s'assurant que",
            "clients Avantages Poste",
            "l'approche avec l'\u00e9quipe et les",
            "Qualifications Candidate",
            "un",
            "\u00c9voluer dans une",
            "incluant l'assurance m\u00e9dicale et dentaire",
            "vision",
            "VRSP",
            "\u00e0 la",
            "Se d\u00e9velopper professionnellement en ayant notamment acc\u00e8s \u00e0 une formation sur l'optique",
            "appliqu\u00e9es au quotidien"
        ],
        "extracted_persons": [
            "un horaire",
            "lui expliquer le",
            "Depuis ses d\u00e9buts",
            "accueillante Amour de la mode",
            "Les principales",
            "Contribuer \u00e0",
            "pens\u00e9es et dessin\u00e9es",
            "interne et le coaching de nos opticiens formateurs",
            "Volont\u00e9 d'offrir un",
            "Acc\u00e9der \u00e0 une",
            "d\u00e9finit"
        ],
        "extracted_products": [
            "\u00catre en mesure de lire"
        ],
        "extracted_money": [],
        "processed_text": "produits ont du style qualite exceptionnelle . l'entreprise pour objectif rendre lunette prescription accessible afin d'en faire accessoire mode incontournable qualite prix sans egal . point vente au employes . BonLook se comme etant l'ultime destination pour une garde robe montures tendance . Pourquoi BonLook Participer au succes d'une entreprise entrepreneurs ont vu potentiel faire evoluer toute une industrie . compagnie les produit sont concus dessines dans . Travailler dans une entreprise les valeurs organisationnelle sont joie excellence innovation transparence . participer . notre plateforme . remuneration globale competitive rabais employe genereux pour vous . responsabilites apprendre connaitre client afin leur trouver les montures parfaites Accueillir chaque client concept BonLook marque les produits une prescription optique comprendre les besoins client Creer des profil client des commandes utiliser tous les outil fournis pour client maintenir boutique propre accueillante appreciee client Creer lien authentique memorable client disponible pour permanent temps plein temps partiel Disponibilites flexible jour soir fin semaine requis Esprit d'equipe capacite travailler dans milieu travail collaboratif Capacite aider client tout boutique est des gen service clientele authentique personnalise Minimum d'un d'experience dans domaine vente une similaire Pouvoir s'adapter facilement environnement changeant Etre creatif energique dans permanent temps plein temps partiel Doit etre disponible jour soir fin semaine Assurances collective disponible pour les employes temps plein Les employes du secteur vente au detail recoivent une paire lunettes gratuite beneficient d'un rabais corporatif pour des achat futurs ainsi pour leur famille amis Nous vous offron une formation complete pour faire les bons choix pour client . Nous croyon diversite au travail apporte aux employes possibilite d'atteindre leur plein potentiel . BonLook encourage les personnes tous genre culture postuler sur role . nous offron des chance egale dthemploi tous . masculin ete utilise afin _ _ _ _ _ _ _ _ _ _ _ _ _ _ _ _ _ _ _ _ _ _ _ _ _ _ _ _ _ _ _ _ _ _ _ _ _ _ _ _ _ _ _ _ _ _ _ _ _ _ _ _ _ _ _ _ _ _ BonLook BonLook offer innovative sale stylish product high quality . inception company's goal prescription eyewear accessible fashion accessory unparalleled . initially launch online company store employee . BonLook define ultimate destination wardrobe trendy frame design create . BonLook participate success canadian company entrepreneur potential develop entire industry . evolve company product conceive design head office locate heart Saint Henri district bank . company organizational apply joy excellence innovation transparency . participate culture diversity inclusion area company . develop professionally access training optic internal platform coaching optician trainer . access competitive total compensation package generous employee discount family friend . responsibility customer find perfect frame Greet customer explain BonLook concept brand vision product read optical prescription understand customer's create customer profile order tool provide create customer connection help maintain clean welcoming love store environment create genuine memorable connection customer transfer merchandise permanent schedule flexible availability require Team spirit collaborative workplace assist customer ensure store order fashion people Willingness offer sincere personalized customer service Minimum sale relative adapt easily change environment creative energetic approach team customer condition permanent permanent position evening weekend Group insurance include medical dental insurance employee retail employee receive complimentary pair glass corporate discount glass future purchase family friend . offer training help good choice customer inception BonLook commit difference promote diversity inclusion . diversity workplace empower employee reach potential . BonLook encourage people gender culture apply role . provide equal employment ."
    },
    "companyDescription": "",
    "description": "\u00c0 propos de BonLook \n  BonLook offre une exp\u00e9rience de vente novatrice et des produits qui ont du style, avec une qualit\u00e9 exceptionnelle. Depuis ses d\u00e9buts, l\u2019entreprise a pour objectif de rendre la lunette de prescription accessible afin d\u2019en faire un accessoire mode incontournable au rapport qualit\u00e9-prix sans \u00e9gal. Initialement lanc\u00e9e en ligne, l\u2019entreprise compte 35 points de vente au Canada et plus de 350 employ\u00e9s. Aujourd\u2019hui, BonLook se d\u00e9finit comme \u00e9tant l\u2019ultime destination pour une garde-robe de montures tendance, pens\u00e9es et dessin\u00e9es \u00e0 Montr\u00e9al.\n  \n  \n  Pourquoi BonLook? \n  \n  Participer au succ\u00e8s d'une entreprise d\u2019ici fond\u00e9e par des entrepreneurs qui ont vu le potentiel de faire \u00e9voluer toute une industrie.  \n  \u00c9voluer dans une compagnie dont les produits sont con\u00e7us et dessin\u00e9s \u00e0 Montr\u00e9al dans un si\u00e8ge social situ\u00e9 au c\u0153ur du quartier Saint-Henri aux abords du Canal Lachine.  \n  Travailler dans une entreprise dont les valeurs organisationnelles sont appliqu\u00e9es au quotidien: joie, excellence, innovation et transparence.  \n  Participer \u00e0 une culture ax\u00e9e sur la diversit\u00e9 et l\u2019inclusion dans toutes les sph\u00e8res de l'entreprise.  \n  Se d\u00e9velopper professionnellement en ayant notamment acc\u00e8s \u00e0 une formation sur l\u2019optique via notre plateforme interne et le coaching de nos opticiens formateurs.  \n  Acc\u00e9der \u00e0 une r\u00e9mun\u00e9ration globale comp\u00e9titive et un rabais employ\u00e9 g\u00e9n\u00e9reux pour vous, votre famille et vos amis.  \n \n Les principales responsabilit\u00e9s \n  \n  Apprendre \u00e0 conna\u00eetre nos clients afin de leur trouver les montures parfaites  \n  Accueillir chaque client et lui expliquer le concept BonLook, la marque, la vision et les produits  \n  \u00catre en mesure de lire une prescription optique et de comprendre les besoins de nos clients  \n  Cr\u00e9er des profils de clients et des commandes et utiliser tous les outils fournis pour cr\u00e9er des liens avec nos clients  \n  Contribuer \u00e0 maintenir la boutique propre et accueillante, appr\u00e9ci\u00e9e de nos clients  \n  Cr\u00e9er un lien authentique et m\u00e9morable avec chaque client  \n  Atteindre les objectifs de vente  \n  Recevoir et transf\u00e9rer la marchandise au besoin  \n \n Le profil recherch\u00e9 \n  \n  Candidat disponible pour un horaire permanent \u00e0 temps plein et \u00e0 temps partiel  \n  Disponibilit\u00e9s flexibles (jour, soir et fin de semaine requis)  \n  Esprit d'\u00e9quipe et capacit\u00e9 \u00e0 travailler dans un milieu de travail collaboratif  \n  Capacit\u00e9 \u00e0 aider nos clients tout en s'assurant que la boutique est accueillante  \n  Amour de la mode et des gens  \n  Volont\u00e9 d'offrir un service \u00e0 la client\u00e8le authentique et personnalis\u00e9  \n  Minimum d'un an d\u2019exp\u00e9rience dans le domaine de la vente ou une exp\u00e9rience similaire  \n  Pouvoir s'adapter facilement \u00e0 un environnement changeant  \n  \u00catre cr\u00e9atif et \u00e9nergique dans l'approche avec l'\u00e9quipe et les clients  \n \n Avantages \n  \n  Poste permanent \u00e0 temps plein et \u00e0 temps partiel  \n  Doit \u00eatre disponible le jour, le soir et la fin de semaine  \n  Assurances collectives, incluant l\u2019assurance m\u00e9dicale et dentaire, et RVER disponible pour les employ\u00e9s \u00e0 temps plein  \n  Les employ\u00e9s du secteur de la vente au d\u00e9tail re\u00e7oivent une paire de lunettes gratuite et b\u00e9n\u00e9ficient d'un rabais corporatif pour des achats futurs ainsi que pour leur famille et amis  \n  Nous vous offrons une formation compl\u00e8te pour faire les bons choix pour nos clients  \n \n Depuis ses d\u00e9buts, BonLook s\u2019engage \u00e0 faire une diff\u00e9rence et favorise la diversit\u00e9 et l\u2019inclusion. Nous croyons que la diversit\u00e9 au travail apporte aux employ\u00e9s la possibilit\u00e9 d\u2019atteindre leur plein potentiel. BonLook encourage les personnes de tous genres et cultures \u00e0 postuler sur nos r\u00f4les. Nous offrons des chances \u00e9gales d\u2019emploi \u00e0 tous.\n  \n  \n  Le masculin a \u00e9t\u00e9 utilis\u00e9 afin d\u2019all\u00e9ger ce texte \n  __________________________________________________________ \n  About BonLook \n  BonLook offers an innovative sales experience and stylish products with high quality. Since its inception, the company's goal has been to make prescription eyewear accessible and a must-have fashion accessory with unparalleled value. Initially launched online, the company has 35 stores in Canada and over 350 employees. Today, BonLook defines itself as the ultimate destination for a wardrobe of trendy frames, designed and created in Montreal.\n  \n  \n  Why BonLook ? \n  \n  Participate in the success of a canadian company founded by entrepreneurs who saw the potential to develop an entire industry.  \n  Evolve in a company whose products are conceived and designed in Montreal in a head office located in the heart of the Saint-Henri district on the banks of the Lachine Canal.  \n  Work in a company whose organizational values are applied daily: joy, excellence, innovation and transparency.  \n  Participate in a culture of diversity and inclusion in all areas of the company.  \n  Develop professionally by having access to training on optics via our internal platform and the coaching of our optician trainers.  \n  Access to a competitive total compensation package and a generous employee discount for you, your family and your friends.  \n \n Responsibilities \n  \n  Get to know our customers to find them the perfect frames  \n  Greet every customer and explain the BonLook concept, brand, vision and products  \n  Be able to read an optical prescription and understand our customer\u2019s needs  \n  Create customer profiles and orders, and use all tools provided to create customer connections  \n  Help maintain a clean and welcoming, well-loved store environment  \n  Create a genuine and memorable connection with each customer  \n  Meet sales goals  \n  Receive and transfer merchandise as needed  \n \n Qualifications \n  \n  Candidate available for a permanent full-time and part-time schedule  \n  Flexible availabilities (day, evening and week-end required)  \n  Team spirit and ability to work in a collaborative workplace  \n  Ability to assist customers while ensuring the store is in order  \n  Love for fashion and people  \n  Willingness to offer sincere and personalized customer service  \n  Minimum 1 years in sales or relative experience  \n  Can adapt easily to a changing environment  \n  Be creative and energetic in the approach with the team and customers  \n \n Work conditions \n  \n  Permanent full-time and permanent part-time position  \n  Must be available days, evenings and weekends  \n  Group insurance, including medical and dental insurance, and VRSP available to all full-time employees  \n  Retail employees receive one complimentary pair of glasses, and corporate discount on glasses for future purchase and for their family and friends.  \n  We offer a full training to help you make the best choices for our customers  \n \n Since its inception, BonLook has been committed to making a difference and promoting diversity and inclusion. We believe that diversity in the workplace empowers employees to reach their full potential. BonLook encourages people of all genders and cultures to apply for our roles. We provide equal employment opportunities for everyone."
}